"user","post","date"
"johnwayne11.bsky.social","This is a corrupt, politically motivated attack on the Federal Reserve. The strict independence of the Fed has been paramount to the stability of the global economy for over a century, which will collapse if Trump moves to seize control of it.","2026-01-12T03:55:26.663Z"
"johnwayne11.bsky.social","ICE officers slipping on ice while trying to terrorize communities is the most accurate metaphor imaginable. No balance. No footing. No moral ground. Just cruelty, incompetence, and gravity doing its thing.","2026-01-11T21:40:32.238Z"
"johnwayne11.bsky.social","And I’m gonna """"like"""" this post every day so nobody forgets exactly who Pedophile Trump is and why the Epstein files have suddenly disappeared. 🔥🔥🔥🔥🔥🔥 #Justice4theVictims_NOW","2026-01-11T20:50:43.594Z"
"johnwayne11.bsky.social","NOEM: “We can’t trust the government anymore.” BASH: “You are the government.” NOEM: “Yes, that’s what I’m saying.”🤔 The only honest thing @KristiNoem said today","2026-01-11T22:04:02.250Z"
"johnwayne11.bsky.social","♥️","2026-01-11T21:22:34.686Z"
"johnwayne11.bsky.social","This is f*cked up! There isn’t any law in this country that requires you to provide proof of citizenship on the interior, but unfortunately ICE is racially profiling. And they don’t care if you say you’re a US citizen. So where does this leave everyone? If you don’t look white, you’re in danger.","2026-01-11T23:01:01.123Z"
"johnwayne11.bsky.social","Frey: """"I think the initial impetus to come to MN was to arrest & deport a bunch of Somali people. They got here & realized the Somali people that would be deported are all citizens. Then they turned their ire toward our Latino community & others. These are communities that make Mpls a better place.""""","2026-01-10T16:58:58.102Z"
"johnwayne11.bsky.social","Frey: """"An individual from a car that was in the middle of a street was detained. ICE left the car in the middle of the street. The car wasn't even in park, so you got it just rolling down the street w/nobody in it. It could've hit anybody, including my own family. This is not about safety""""","2026-01-10T17:01:17.576Z"
"johnwayne11.bsky.social","FUTURE VOTERS #Midterms","2026-01-10T22:52:27.915Z"
"johnwayne11.bsky.social","Absolutely! Also, cancel the Mid Terms!","2026-01-10T23:34:13.867Z"
"johnwayne11.bsky.social","@deadder.bsky.social","2026-01-10T15:25:38.336Z"
"johnwayne11.bsky.social","FUTURE HIGH SCHOOL VOTERS GET ATTACKED BY ICE AND ARE SHARING ON SOCIAL MEDIA. #Midterms 🗳️","2026-01-10T22:59:35.232Z"
"johnwayne11.bsky.social","AMEN ‼️","2026-01-11T00:01:39.475Z"
"johnwayne11.bsky.social","More than 1,000 “ICE out” rallies planned across the U.S. today. NYC: chanting the name Renée Good. Signs reading “Abolish ICE.” A sign even calling for Trump to be put in jail. Anti-ICE marches are making it clear, people are done being scared, done being erased, done pretending this is normal.","2026-01-10T22:11:16.799Z"
"johnwayne11.bsky.social","At the very least we should impeach her hat. #PuppyKiller","2026-01-10T18:48:24.660Z"
"johnwayne11.bsky.social","A guy was escorted out of The New Beverly Cinema recently after taking out his cellphone during a """"Wild Strawberries / Straight Story"""" double bill.","2026-01-10T16:33:59.910Z"
"johnwayne11.bsky.social","What’s going on here","2026-01-11T01:59:52.441Z"
"johnwayne11.bsky.social","A member of the Crew-11 SpaceX mission suffered a medical event, prompting an early return to Earth for the four-person crew including NASA members.","2026-01-10T17:40:04Z"
"johnwayne11.bsky.social","The administration likes to joke about taking over sovereign countries.","2026-01-10T13:56:34.275Z"
"johnwayne11.bsky.social","I found this useful.","2026-01-11T00:41:22.696Z"
"johnwayne11.bsky.social","The Vice President of the United States is a fascist.","2026-01-11T02:49:14.954Z"
"johnwayne11.bsky.social","DAVE MATTHEWS: “I don’t want my taxes to pay for masked thugs to roam our streets & terrorize our communities... She was trying to get away. He shot her 3x in the head. Murdered in cold blood. They’re trying to tell us not to believe what we see. FUCK ICE.” (H/T @marcofoster.bsky.social )","2026-01-10T18:11:44.898Z"
"johnwayne11.bsky.social","And despite it all, this is Tehran 🇮🇷","2026-01-10T23:40:53.812Z"
"johnwayne11.bsky.social","MARYLAND — “Federal officials on Friday changed their account of the Christmas Eve shooting by immigration agents in Glen Burnie, reversing course after repeatedly doubling down on their story. A day after Anne Arundel County Police publicly disputed it.” www.thebanner.com/community/cr...","2026-01-11T04:12:55.140Z"
"johnwayne11.bsky.social","Let's tell every member of Congress—as many times as we can—that Kristi Noem is a JOKE and she needs to be removed immediately.","2026-01-11T01:16:42.235Z"
"johnwayne11.bsky.social","BREAKING: Massive Crowds of Anti-ICE protesters in Minneapolis, Minnesota as we speak. The tide is turning. America is Fed Up. Americans should be fighting back against what is happening in this country. Having masked, secret police shooting people, breaking into homes and cars, is NOT normal.","2026-01-10T20:23:38.761Z"
"johnwayne11.bsky.social","Well this article isn’t going to help me sleep any better. But it’s also not going to stop me from protesting ICE and defenestrating RFK Jr.’s policies.","2026-01-11T05:26:07.913Z"
"johnwayne11.bsky.social","“He’s got nothin’ to say! He’s got nothin’ to say!” Minnesota woman 👸 drags right-wing propaganda outlet reporter","2026-01-11T04:25:21.336Z"
"johnwayne11.bsky.social","Here’s a poem called ‘My Unbearable Politeness of Being’.","2026-01-10T09:16:06.928Z"
"johnwayne11.bsky.social","Is there a limit to how many times you can watch ICE falling on ICE?","2026-01-11T03:26:05.007Z"
"johnwayne11.bsky.social","the endless ground of your own deep pulse, Rainer Maria Rilke, tr. David Young","2026-01-10T19:53:08.520Z"
"johnwayne11.bsky.social","I can't believe I'm posting this video - but we actually have to have a conversation about the real world implications of America going to war over Greenland. Let me walk you through it. It doesn't turn out well for us.","2026-01-11T02:44:24.936Z"
"johnwayne11.bsky.social","This is stunning. Listen to this in Philadelphia. Thousands singing “Hey-Oh, we won’t be silent while our friends are gunned down.” Really listen to it.","2026-01-11T04:55:49.325Z"
"johnwayne11.bsky.social","Gifford: This ridiculous rhetoric by the president—it’s going to impact every single American because it makes them lose faith in us. That makes them less likely to travel here, buy American products, or invest here. This broken trust—the work of diplomacy—is very hard to build back.","2026-01-10T17:33:47.854Z"
"johnwayne11.bsky.social","UNARMED WOMAN: “Shame on you.” ICE GOON: “Have you not learned from the past few days?” UNARMED WOMAN: “Learned what? What’s our lesson?” ICE GOON: *VIOLENTLY SNATCHES HER PHONE* (H/T @Mollyploofkins)","2026-01-10T17:35:43.714Z"
"johnwayne11.bsky.social","Rep. Angie Craig: """"We were told because this facility is being funding by the 'Big Beautiful Bill,' not the congressional appropriations act, that we would not be allowed to enter the facility. That's complete nonsense ... I informed them they were violating the law. They said they didn't care.""""","2026-01-10T16:53:41.616Z"
"johnwayne11.bsky.social","Yes, it is beyond insanity. Luckily, the American people aren’t buying it.","2026-01-10T14:19:28.694Z"
"johnwayne11.bsky.social","A woman recording an ICE agent tells him """"Shame on you."""" The agent responds, """"Have you all not learned from the past couple of days?"""" """"Learned what?"""" she asks Then he knocks her phone out of her hand","2026-01-10T14:52:13.440Z"
"johnwayne11.bsky.social","I am hereby calling on Press Secretary Leavitt to stop blatantly lying to the American people. A mother of three who is now dead very clearly backed up and turned the wheel to get away from an ICE officer illegally trying to open her car. There must be an independent investigation.","2026-01-10T00:13:40.793Z"
"johnwayne11.bsky.social","Also true","2026-01-10T13:32:19.629Z"
"johnwayne11.bsky.social","THIS 👇 HERE","2026-01-10T10:45:45.281Z"
"johnwayne11.bsky.social","The United States is no longer a country worthy of respect, it's a shithole full of hatred human beings fueled by a demented madman as President. I'm so disgusted and angry right now.","2026-01-10T05:35:56.924Z"
"johnwayne11.bsky.social","Illinois stands with Minnesota.","2026-01-09T16:00:34.915Z"
"johnwayne11.bsky.social","Raise your hand if you agree with Billie Eilish. 🖐️🖐️ “ICE is a terrorist organization”","2026-01-10T12:40:59.572Z"
"johnwayne11.bsky.social","Menendez: At the same time, they try to banish the memory of January 6th from our collective memory, refusing to put up a plaque to honor law enforcement officers who defended them from actual domestic terrorists in this very building.","2026-01-09T16:31:19.851Z"
"johnwayne11.bsky.social","Oh look. Yesterday I wrote: """"They're trying to provoke enough violence so they can declare martial law and cancel the elections altogether"""" and now he's taking the next step:","2026-01-09T16:15:30.915Z"
"johnwayne11.bsky.social","WATCH THIS !! 👏👏⚖️","2026-01-10T01:08:27.600Z"
"johnwayne11.bsky.social","Mayor Frey: """"So our ask is really simple here. Our ask is to embrace the truth. Our ask is to include the Bureau of Criminal Apprehension in this process because we in Minneapolis want a fair investigation ... if you got nothing to hide from, then don't hide.""""","2026-01-09T15:13:26.888Z"
"johnwayne11.bsky.social","Obama deported 3 million illegal immigrants during his time in office and I don’t remember a single scene like this.","2026-01-10T09:39:55.249Z"
"johnwayne11.bsky.social","He was just making a joke about using military force to invade a sovereign ally. Cmon people. It was funny. Lol.","2026-01-09T16:40:39.044Z"
"johnwayne11.bsky.social","No words. 💔 #Justice4Renee","2026-01-09T19:53:46.716Z"
"johnwayne11.bsky.social","Amy Klobuchar: """"There are now more ICE agents in Minnesota than there are police officers combined in Minneapolis and St. Paul. So they are outnumbering our own local police officers out on the streets.""""","2026-01-10T02:17:24.638Z"
"johnwayne11.bsky.social","Thank you Senate 🇺🇸","2026-01-08T21:08:02.180Z"
"johnwayne11.bsky.social","Renee Nicole Good was 37 - A U.S. citizen - and a poet — her wife watched her be murdered and is now a single parent to a 6 year old This regime has been defined by the endless tragedies it’s caused — we owe it to the victims to fight for the accountability they 💯 percent deserve","2026-01-08T02:11:04.274Z"
"johnwayne11.bsky.social",".@PabloReports: What do you make of Republican attempts to increase ICE funding yet again? Ansari: There's absolutely no way that I will be voting for any funding for ICE. I don't think any member of Congress should vote to increase funding for a rogue agency….","2026-01-08T20:39:10.628Z"
"johnwayne11.bsky.social","BREAKING: The Hennepin County District Attorney's office says they have jurisdiction to charge the ICE agent involved in the fatal Minneapolis shooting.","2026-01-08T20:58:16.405Z"
"johnwayne11.bsky.social","BREAKING: ICE shooter identified as Jonathan Ross. www.startribune.com/ice-agent-wh...","2026-01-08T19:12:46.287Z"
"johnwayne11.bsky.social","Moskowitz on Noem: """"Is she hiding her face like her ICE agents now? By the way - is this what the $800b went to? Every day we see her after some new tragedy, she's wearing a different outfit with a different hat. She looks ridiculous. She deserves to be removed from her job, & if not impeached.""""","2026-01-08T17:36:37.081Z"
"johnwayne11.bsky.social","Walz: """"I couldn't help but think, and it scares me a bit -- 'The party told you to reject the evidence of your eyes and ears. It was their final, most important directive.' It certainly feels like that in this moment.""""","2026-01-08T17:57:50.214Z"
"johnwayne11.bsky.social","Swalwell: You better believe that accountability is coming. Immunity is going to be stripped. And to Kristi Noem, Tom “Cashbag” Homan, Greg Bovino—your asses are going to be in these witness chairs.","2026-01-08T17:56:38.448Z"
"johnwayne11.bsky.social",".@PabloReports: What do you make of Kristi Noem calling Renee Good a domestic terrorist? Magaziner: Kristi Noem is an idiot.","2026-01-08T21:20:23.096Z"
"johnwayne11.bsky.social","Great story! Now back to reality.","2026-01-05T09:46:29.937Z"
"johnwayne11.bsky.social","Today the Pentagon censured Senator Mark Kelly and moved to strip part of his earned military retirement benefits for stating the truth. This administration is trying to convince Americans that truth is whatever it says it is—even when the evidence is plainly in front of us.","2026-01-05T18:50:31.456Z"
"johnwayne11.bsky.social","Chris Murphy: """"At some level he's winning tonight because clearly part of his intent here was to distract the American people -- you and I -- from what's happening here at home. You have 20 million families who are getting massive increases in their healthcare premiums. People will die.""""","2026-01-06T01:57:53.526Z"
"johnwayne11.bsky.social","They’re making up the Venezuela strategy as they go. This sums it up… “We’re fundamentally dealing with an unserious, immature Commander-in-Chief, which means we are seeing unserious policy decisions which are incredibly hard to actually analyze and discern what their purpose is.” Michael Feinberg","2026-01-06T04:48:00.640Z"
"johnwayne11.bsky.social","TONIGHT: Coinciding with the winter solstice at 4:21PM, volunteers with SHARE/WHEEL will hold a vigil for the 245 homeless people who died in the Seattle area this year. Since 2022, the group has honored more than 1,100 people who passed away while unhoused or in public due to violence.","2025-12-21T20:51:23.096Z"
"johnwayne11.bsky.social","As expected, the first CBS News(max) night with Tony Dokoupil under Bari Weiss was a debacle","2026-01-06T05:23:12.257Z"
"johnwayne11.bsky.social","In 3 years Mark Kelly will be President and Kegbreath will be in prison.","2026-01-06T06:00:19.031Z"
"johnwayne11.bsky.social","The law is ..","2026-01-05T20:11:31.659Z"
"johnwayne11.bsky.social","Under a criminal administration quoting the law is against the law.","2026-01-05T18:49:23.804Z"
"johnwayne11.bsky.social","Tony Dokoupil's CBS Evening News debut got off to a tough start ...","2026-01-06T04:24:50.303Z"
"johnwayne11.bsky.social","This","2026-01-04T21:06:03.420Z"
"johnwayne11.bsky.social","This new war is not only illegal, reckless and deeply corrupt, it is the latest in a series of increasingly desperate distractions from the EPSTEIN Files. #ImpeachAndConvict47NOW","2026-01-04T20:35:37.381Z"
"johnwayne11.bsky.social","Rep. Sheri Biggs, who always seems mildly terrified to be on television, says """"I believe that the US is much safer now. What President Trump did is to put Americans first. He's been promising, he's been telling them what would happen if you hurt our American citizens.""""","2026-01-03T20:38:53.586Z"
"johnwayne11.bsky.social","I have a $100 bet that Senile Satan already has a costume made for when he’s pretending to be the president of Venezuela.","2026-01-03T18:53:02.705Z"
"johnwayne11.bsky.social","Trump really doesn’t want the world to know what is the truth behind the #Epstein #CoverUp #Venezuela","2026-01-03T12:00:43.152Z"
"johnwayne11.bsky.social","👇","2026-01-03T17:14:41.675Z"
"johnwayne11.bsky.social","Nothing to see here, folks","2026-01-03T21:41:08.528Z"
"johnwayne11.bsky.social","GOP Rep. Mariannette Miller-Meeks: """"We don't want to have troops on the ground. Iowans don't want that, Americans don't want that. We do not want nation building. This is not what's going to occur.""""","2026-01-03T18:31:31.350Z"
"johnwayne11.bsky.social","👇","2026-01-03T17:15:30.363Z"
"johnwayne11.bsky.social","Trump/GOP don’t care about their own voters much less the American people! All Trump/GOP care about is plundering oil, minerals etc.! You think Trump/GOP care about Venezuelans? Trump/GOP use collective punishment & label people as “gang members”, """"rapists”, """"savages"""", """"monsters”, """"narcoterrorists""""!","2026-01-03T21:32:33.698Z"
"johnwayne11.bsky.social","Reporter: How long do you expect the U.S. to run Venezuela Trump: I would like to do it quickly but it takes time. Their infrastructure is rotted. It is very dangerous. Oil is very dangerous. We will take a lot of money out so we can take care of the country.","2026-01-03T17:29:09.883Z"
"johnwayne11.bsky.social","The GOP appears to be preoccupied with personal financial gain, resulting in a lack of action on pressing issues.","2026-01-03T07:57:43.476Z"
"johnwayne11.bsky.social","That was fast www.wsj.com/livecoverage...","2026-01-03T20:43:30.705Z"
"johnwayne11.bsky.social","In the meantime WHERE ARE THE #EpsteinFiles ?? #FlashbackFriday WE KNOW THERE MUST BE MORE NOW. 👇👇","2026-01-02T22:00:43.630Z"
"johnwayne11.bsky.social","We are living in an era of rogue criminals masquerading as world leaders. 😳👇","2026-01-03T18:05:45.388Z"
"johnwayne11.bsky.social","Just a few hours ago Chinese Special Envoy was meeting Maduro for three hours in Caracas.","2026-01-03T09:06:58.081Z"
"johnwayne11.bsky.social","Dirty Harry (1971) 🎬🖤","2026-01-01T08:55:30.299Z"
"johnwayne11.bsky.social","Happy New Year, Minnesota!","2026-01-01T15:16:01.941Z"
"johnwayne11.bsky.social","I feel like I need to make an alt for my STO ships and their lore at some point, but for now, here’s another shot of the Oberon heading to DS9.","2025-12-30T19:51:13.340Z"
"johnwayne11.bsky.social","getting into a very commercial part of Stamp's career. One fun (or not?) thing about following one actor's filmography is you end up watching stuff you'd never watch and sometimes it's good! I've only seen Alien Nation of these, and I remember thinking it was going to be """"Alienation.""""","2025-12-31T19:19:57.266Z"
"johnwayne11.bsky.social","Smith: We had also interviewed Boris Epshteyn… He corroborated that they were, in fact, trying to call senators. He dissembled and tried to imply that the president hadn’t directed him to do it, even though there was a text message saying specifically that they had.","2025-12-31T21:51:40.135Z"
"johnwayne11.bsky.social","#ImpeachTrump #EpsteinFiles","2025-12-30T17:16:12.615Z"
"johnwayne11.bsky.social","uhhh yeah I can see why these childcare properties weren't eager to let in some rando dudes asking """"where are the kids?""""","2025-12-30T21:40:02.162Z"
"johnwayne11.bsky.social","A New Year is coming the fight for justice will keep going #EpsteinFiles","2025-12-30T00:36:22.424Z"
"johnwayne11.bsky.social","This is authoritarian rot in plain sight. A DOJ weaponized against “enemies” of a sitting president isn’t law enforcement — it’s vengeance. That’s how democracies die: not overnight, but when power decides dissent is a crime. www.democracydocket.com/news-alerts/...","2025-12-30T02:05:52.772Z"
"johnwayne11.bsky.social","This administration is the largest nervous breakdown the US has ever had in this century or the last. It’s a friggin midlife crisis.","2025-12-30T21:14:11.988Z"
"johnwayne11.bsky.social","“They’re losing in all courts, they’re losing before judges President Trump himself appointed, and people are pushing back. “ @skyeperryman.bsky.social on the growing backlash to President Trump’s immigration crackdown after the Supreme Court blocked his deployment of the National Guard to Chicago.","2025-12-27T14:48:20.594Z"
"johnwayne11.bsky.social","WATCH — @rokhanna.bsky.social : “Over 1200 survivors raped or abused, and you have rich and powerful men doing this - and this country did nothing.” (H/T @cwebbonline.com )","2025-12-27T14:31:06.152Z"
"johnwayne11.bsky.social","FOER: “This is one of those moments in Trump’s presidency when an event that would otherwise be recognized as a death knell for democracy somehow fails to elicit the outrage it deserves.” www.theatlantic.com/ideas/2025/1...","2025-12-22T15:46:17.186Z"
"johnwayne11.bsky.social","This 800-year-old church in Norway was built without a single iron nail. Borgund Stave Church in Lærdal, Norwegen.","2025-12-23T06:42:12.336Z"
"johnwayne11.bsky.social","I was devastated to hear about the loss of Rob Reiner and Michele Singer. Rob is a generational talent that used his voice to advocate for a better world. We live in a better country because of them. They will be missed.","2025-12-15T16:12:43.446Z"
"johnwayne11.bsky.social","Bill Clinton releasing a statement saying 'release the Epstein files, you cowards' was not on my bingo list.","2025-12-22T22:22:32.274Z"
"johnwayne11.bsky.social","#NowWatching Planes, Trains and Automobiles 🎬🎄❤️","2025-12-22T18:47:22.318Z"
"johnwayne11.bsky.social","The DOJ identified at least 10 co-conspirators who worked with Epstein and Maxwell. It’s obvious to anyone with two eyes that Epstein and Maxwell were engaged in organized crime, yet NO ONE ELSE involved in Epstein’s sex trafficking ring has faced criminal charges. Why?","2025-12-23T18:15:37.132Z"
"johnwayne11.bsky.social","Thanks GlobalTV Canada! 🇨🇦","2025-12-23T09:18:58.911Z"
"johnwayne11.bsky.social","Even if that is Ingrid and not Pam in the top pic, both women are getting way too close to a married man, and in Pam's case, the President of the United States. Melania should have been there in both pictures, but she isn't because she wants nothing to do with Jabba the Hut - unlike the other two.","2025-12-21T21:05:25.353Z"
"johnwayne11.bsky.social","Hey artists!! Post some art you made before Bluesky!! #lightwave3d #startrek phase II Enterprise set against space scenes by @grahamtg.bsky.social 2024","2025-12-22T21:37:09.665Z"
"johnwayne11.bsky.social","If this doesn't motivate you to vote in the Midterms, nothing will.","2025-12-22T20:36:22.247Z"
"johnwayne11.bsky.social","This is why Johnson sent the Congress home during the Shutdown for 54 days, nearly 8 weeks, so the FBI would have time to redact Trumps name from the Epstein files. What a joke !","2025-12-20T14:15:28.960Z"
"johnwayne11.bsky.social","WATCH - @rokhanna.bsky.social : “The DOJ’s document dump DOES NOT COMPLY. We are exploring all options.” #TrumpEpsteinCoverup","2025-12-19T23:32:22.979Z"
"johnwayne11.bsky.social","Schiff: """"I think we ought to bring Pam Bondi before the Senate Judiciary Committee demand answers as to why the DOJ has violated the law.""""","2025-12-19T21:40:42.977Z"
"johnwayne11.bsky.social","WATCH-- Former AG Eric Holder says Congress should consider impeachment for the DOJ officials responsible for holding back the Epstein files: “That's a nuclear option that Congress has.”","2025-12-20T01:43:17.010Z"
"johnwayne11.bsky.social","♥️ 😳🇺🇸","2025-12-20T03:47:23.487Z"
"johnwayne11.bsky.social","Maria Farmer worked for Epstein in 1996 and reported his """"child pornography"""" to the FBI back then. They ignored her.","2025-12-20T04:07:05.967Z"
"johnwayne11.bsky.social","💯","2025-12-20T02:10:36.132Z"
"johnwayne11.bsky.social","Khanna: Congress is talking about possible impeachment. They're talking about inherent contempt for the attorney general or deputy attorney general—any justice department official who has obstructed justice could face prosecution in this administration or a future administration.","2025-12-20T01:17:02.169Z"
"johnwayne11.bsky.social","""""Trump ISN'T the WORST president in American history. Trump is the WORST AMERICAN in American history,Trump Is aNational Disgrac","2025-12-19T17:47:29.503Z"
"johnwayne11.bsky.social","""""War is the tenseness, the eternal waiting, the warping or ennobling of character that constant strain produces. To me, the greatest war shot is of a taut G.I. in a foxhole, nervously puffing a cigarette. That's war."""" Director George Stevens, born 18 December 1904.","2025-12-18T20:24:11.198Z"
"johnwayne11.bsky.social","For a GOP president—after the Iraq War—to say outright that invading Venezuela is all about oil is wild. But it is. It’s also about corruption, power, graft, and land. And we should take him at his word. @msnowevents.bsky.social","2025-12-18T21:33:11.966Z"
"johnwayne11.bsky.social","We now have a bipartisan majority of members of Congress demanding a vote to extend ACA tax credits and keep health care affordable for all Americans. Speaker Johnson, bring this legislation to the House Floor immediately or step out of the way.","2025-12-18T22:21:43.069Z"
"johnwayne11.bsky.social","He has seen the Epstein Files in their entirety. Now he is fleeing before the shit hits the fan. #bonginobust","2025-12-18T10:45:41.002Z"
"johnwayne11.bsky.social","Orville Wright & Wilbur Wright Made the first controlled, sustained flight of an engine-powered, heavier-than-air December 17, 1903 at Kitty Hawk, North Carolina, en.wikipedia.org/wiki/Wright_...","2025-12-18T19:12:57.858Z"
"johnwayne11.bsky.social","🔥🔥🔥 DO NOT BE DISTRACTED & STAY LOUD!! 🔥🔥🔥 DONALD TRUMP IS GOING DOWN!! TRUMP & EPSTEIN ARE SEX TRAFFICKERS!!! I’m gonna post this every day so nobody forgets exactly who Pedophile Trump is and why the Epstein files have suddenly disappeared. 🔥🔥🔥🔥🔥🔥","2025-12-14T14:18:35.498Z"
"johnwayne11.bsky.social","🚨The courage, the honor, the truth and candor missing from the U.S. government in this moment has one unadulterated Congressperson who is standing up to the lies: Senator Mark Kelly. Spread this message, this truth, this courage.","2025-12-14T20:10:48.988Z"
