"user","post","date"
"johnwayne11.bsky.social","Who does this benefit?","2025-05-18T12:48:35.974Z"
"johnwayne11.bsky.social","#AmericaFalling #strongertogether #Resist #gr3tetag #BlueCrew #FDT #felon47 #POS47","2025-05-18T11:15:41.690Z"
"johnwayne11.bsky.social","Rep. Julie Johnson to Noem: """"Are you aware that ICE agent jackets are available on Etsy for $20? Anybody can throw a mask on and run around and terrorize people of color without any regard for the law because your agency does not have proper protocols to make sure your agents are clearly identified""""","2025-05-14T16:25:13.251Z"
"johnwayne11.bsky.social","Alsobrooks to RFK Jr: """"You are the wrong person for this job. And you had in this hearing today the unmitigated gall to say at the beginning of your testimony that China is ahead of the United States in healthcare because China does not have DEI.""""","2025-05-14T20:37:39.615Z"
"johnwayne11.bsky.social","Good Night if you’re sleeping 🌙 Good Day to you if you’re not.…","2025-05-15T06:27:14.409Z"
"johnwayne11.bsky.social","Marjorie, I know the truth confuses you and facts ain’t your strong suit—so let me break it down real slow: George Floyd didn’t die from drugs. He died because Derek Chauvin knelt on his neck for 9 minutes. That’s called murder.","2025-05-14T20:32:55.337Z"
"johnwayne11.bsky.social","Doing it out in the open doesn’t make it not corrupt or legal. @MarshaBlackburn @SenatorHagerty care to comment about any of this or nah? www.telegraph.co.uk/world-news/2...","2025-05-14T12:25:27.587Z"
"johnwayne11.bsky.social","I wouldn't be out there if I didn't believe that America can come through this moment, if each of us is prepared to play our role in demanding and delivering a better future.","2025-05-15T01:26:53.811Z"
"johnwayne11.bsky.social","Hope that shit is bugged","2025-05-11T15:39:47.697Z"
"johnwayne11.bsky.social","A happy thought for today…","2025-05-10T22:39:32.486Z"
"johnwayne11.bsky.social","⬇️ ⬇️😡","2025-05-10T23:40:13.829Z"
"johnwayne11.bsky.social","My love of reading is strongly link to this man…","2025-05-10T16:05:11.548Z"
"johnwayne11.bsky.social","Defendants are presumed innocent unless convicted. Every US Atty (or so I thought) knows you can’t weigh in on guilt like this.","2025-05-10T18:14:48.794Z"
"johnwayne11.bsky.social","www.facebook.com/share/r/1Bwa...","2025-05-10T05:55:03.971Z"
"johnwayne11.bsky.social","Massachusetts neighbors tried to stop ICE from ripping away a mother who was with two children, including a newborn baby. The agents had no warrant. Those who want “illegals” to uphold the law should start by upholding it themselves. This is vile, cruel, and unforgivable. Period. #OnYourSide","2025-05-10T05:26:56.699Z"
"johnwayne11.bsky.social","🎀🎀","2025-05-10T05:24:26.643Z"
"johnwayne11.bsky.social","Here’s a preview of the coming clash with SCOTUS which has already confirmed noncitizens are entitled to due process. “Sudden deportation” violates the Constitution.","2025-05-10T01:19:07.323Z"
"johnwayne11.bsky.social","Speak Truth to the Jellyfish......","2025-05-10T01:25:58.417Z"
"johnwayne11.bsky.social","She’s out!! They have released Ozturk from ICE custody!","2025-05-09T22:24:16.320Z"
"johnwayne11.bsky.social","When will this end? Teen girl violently arrested for trying to stop mother's ICE 'kidnapping': witnesses www.rawstory.com/teen-girl-vi...","2025-05-09T18:38:32.892Z"
"johnwayne11.bsky.social","Thank you @ericswalwell.bsky.social for keeping the faith and keeping us informed. Your town hall was inspirational.","2025-05-09T20:26:16.936Z"
"johnwayne11.bsky.social","MUST WATCH: REP. MELANIE STANSBURY ATE—no crumbs left. She straight-up torched Republicans for copy-pasting their bills from the extremist Project 2025 plan. These fascists are gutting our environment, selling out to oil execs, and calling it “freedom.” They know what they’re doing. And so do we.","2025-05-09T04:24:53.051Z"
"johnwayne11.bsky.social","The latest from the pro-birth party…","2025-05-07T15:53:27.276Z"
"johnwayne11.bsky.social","Good morning, Bluesky!!! Hope everyone has a day! Let's start it with Elmo and friends!! #SheShed #MomSky","2025-05-08T10:28:12.784Z"
"johnwayne11.bsky.social","Amen, God Bless, Praise the Lord, and Hallelujah… 🙏","2025-05-07T15:07:56.232Z"
"johnwayne11.bsky.social","Seattle port commissioner: """"We currently do not have any container ships at port right now.” So by Trump’s logic this means we’re making money?","2025-05-08T03:03:35.086Z"
"johnwayne11.bsky.social","Toni Storm had an opening and took it! She gets the win! #AEWDynamite","2025-05-08T00:38:22.668Z"
"johnwayne11.bsky.social","Horsey","2025-05-08T02:08:53.045Z"
"johnwayne11.bsky.social","Anti-vax imbeciles along with the worm brain running the HHS have successfully brought measles back.","2025-05-08T02:17:02.330Z"
"johnwayne11.bsky.social","Chicago is on to something.","2025-05-07T19:42:28.189Z"
"johnwayne11.bsky.social","If guilty people don't have Due Process rights, then innocent people don't have Due Process rights, because we don't know if they're innocent or guilty until we have a trial or hearing.","2025-05-07T18:35:23.312Z"
"johnwayne11.bsky.social","THIS is still how we make America safe again ☺️👇","2025-05-07T23:12:56.657Z"
"johnwayne11.bsky.social","Crockett: I cannot wait until voters have an opportunity to say: You took food out of my mouth. You took a roof from over my head. You are responsible for making sure that I do not have health care. I'm going to make sure you don't have a job.","2025-05-08T00:36:27.837Z"
"johnwayne11.bsky.social","Making sure our kids don’t go hungry isn’t just the right thing to do, it’s an investment in our future.","2025-05-08T01:05:21.251Z"
"johnwayne11.bsky.social","Why on earth would anyone want to have a child if this is what's expected of them?","2025-05-05T13:31:37.236Z"
"johnwayne11.bsky.social","Save the date! June 14th. Nationwide protests.","2025-05-06T11:13:18.351Z"
"johnwayne11.bsky.social","My New dream 👇😀","2025-05-05T14:16:27.535Z"
"johnwayne11.bsky.social","HA! HA! 😂😂","2025-05-01T21:31:45.006Z"
"johnwayne11.bsky.social","We have no kings in the United States of America.","2025-05-01T21:10:23.022Z"
"johnwayne11.bsky.social","@rjmatsoncartoons.bsky.social","2025-04-30T15:50:17.883Z"
"johnwayne11.bsky.social","We can't rest until government is restored as an instrument for the people, not our homegrown theocrats, kleptocrats and oligarchs.","2025-04-30T14:55:07.753Z"
"johnwayne11.bsky.social","It was all but certain that he would embarrass America at the Pope’s funeral.","2025-04-27T11:12:15.573Z"
"johnwayne11.bsky.social","At this moment of autocrats vilifying judges and the rule of law, lawyers can prove why they're lawyers. This is the time to stand up for the Constitution and the Bill of Rights and for people under attack.","2025-04-01T18:51:10.484Z"
"johnwayne11.bsky.social","Repost @gigialexander123.bsky.social @newmekboy.bsky.social @schultziepie.bsky.social @bluestormcomin1.bsky.social @gigialexander123.bsky.social @princesskim.bsky.social @dpfrazier22.bsky.social @kingresist.bsky.social @coko.bsky.social @lissespieces.bsky.social","2025-03-30T13:19:23.678Z"
"johnwayne11.bsky.social","Samuel McKinney of Kentucky bsky.app/profile/anti...","2025-03-31T00:51:02.774Z"
"johnwayne11.bsky.social","There were 13 church leaders & christian school employees who were arrested, pled guilty and/or were sentenced to prison for child sex crimes this week.","2025-03-31T00:49:38.408Z"
"johnwayne11.bsky.social","Everything old is new again. Not just racism and misogyny, but also voter suppression and dirty politics. open.substack.com/pub/joycevan...","2025-03-30T00:17:11.744Z"
"johnwayne11.bsky.social","Are you proudly one of them?👇 Let’s see all those beautiful hands raised, high! 🤚✨","2025-03-29T09:00:13.548Z"
"johnwayne11.bsky.social","•••••BREAKING••••• Arlington, VA — Multiple fights broke out at the Pentagon City shopping mall Saturday night forcing dozens of police officers to shut down the mall and call for a mass evacuation. Violence erupted on at least two other occasions earlier in the day. It remains unclear what…","2025-03-30T02:58:07.080Z"
"johnwayne11.bsky.social","@notoriousron.bsky.social @maestrobunny.bsky.social @johnwayne11.bsky.social @engagelongisland.bsky.social @macboxrocks.bsky.social @vtscrapper.bsky.social @steeler-girl58.bsky.social @kemccarthy.bsky.social @lanettaduke.bsky.social @cfrk.bsky.social @cyndiboo.bsky.social NO ADD ONS PLZ","2025-03-29T02:51:03.590Z"
"johnwayne11.bsky.social","when you've lost Maria Bartiromo ...","2025-03-27T16:06:05.294Z"
"johnwayne11.bsky.social","When Melanie mixes up your Garanimals and you end up wearing two different colors.","2025-03-27T22:27:13.498Z"
"johnwayne11.bsky.social","Carney: """"The old relationship we had with the United States based on deepening integration of our economies and tight security and military cooperation is over.""""","2025-03-27T19:57:55.615Z"
"johnwayne11.bsky.social","The only legitimate reason for not investigations because you don’t believe a crime was committed, not because “the mission was successful” www.nytimes.com/2025/03/27/u...","2025-03-27T16:24:15.022Z"
"johnwayne11.bsky.social","Keep the Congressional switchboard number handy these days: (202) 224-3121","2025-03-27T22:00:07.381Z"
"johnwayne11.bsky.social","Schiff: No, Mike Waltz, you’re the loser. And frankly, the country loses when we have an incompetent bozo like you as the national security advisor.","2025-03-26T19:43:14.095Z"
"johnwayne11.bsky.social","I'm Kat Abughazaleh and I'm running for Congress.","2025-03-24T13:30:34.999Z"
"johnwayne11.bsky.social","WOW!! Denver is Showing Out for Bernie and AOC!! 🤯🤩 #FightOligarchy Watch the entire rally earlier in Greeley,CO www.cpr.org/2025/03/21/b...","2025-03-21T23:52:50.875Z"
"johnwayne11.bsky.social","❤️BREAKING❤️ - Bernie Sanders before 20k People in Tucson: """"They have the wealth. They have all the money in the world. They have the power. They have the media. But you know what they don’t have? We’ve got 20,000 people here in Tucson and we got 100's of millions of people all across this country.""""","2025-03-22T20:40:51.281Z"
"johnwayne11.bsky.social","AOC: In every single stop that Bernie and I have had in the past couple of days… every single stop has completely blown out all attendance projections.","2025-03-22T20:13:01.789Z"
"johnwayne11.bsky.social","Pritzker: You know, I was asked the other day if I could say one thing to Donald Trump, what would it be? And I said, “What does Putin have on you?” Everybody rational understands that Putin is trying to rebuild the old Russian Empire. And Donald Trump is literally handing it to him.","2025-03-20T23:52:44.380Z"
"johnwayne11.bsky.social","Yep Wake up People Everyday he erodes The Foundation of the Constitution. Soon we will be asking. Why did we do nothing to Stop It!","2025-03-20T23:09:34.132Z"
"johnwayne11.bsky.social","www.politico.com/news/2025/03...","2025-03-20T23:20:15.077Z"
"johnwayne11.bsky.social","I did. To my Senator. Ended my voicemail with """"We did not vote for Elon, we cannot vote him out. The ball is in your court""""","2025-03-20T23:20:44.609Z"
"johnwayne11.bsky.social","Jackson TN. Let’s do this! More details to follow.","2025-03-19T13:52:15.605Z"
"johnwayne11.bsky.social","MAGA Mike Johnson. """"Hold my beer""""","2025-03-20T00:32:58.564Z"
"johnwayne11.bsky.social","@bsky.app what going on","2025-03-20T00:35:34.914Z"
"johnwayne11.bsky.social","An “empty chair” townhall for my missing Congressman. He hasn’t held a townhall since 2012.","2025-03-18T00:03:40.402Z"
"johnwayne11.bsky.social","400 killed. Mostly women and children. And this is the front page headline.","2025-03-18T21:16:59.062Z"
"johnwayne11.bsky.social","oh my goodness Schumer was getting death stares on The View today","2025-03-18T19:44:09.827Z"
"johnwayne11.bsky.social","I’m in… coming’ on my way","2025-03-18T21:37:55.865Z"
"johnwayne11.bsky.social","More of: I can do whatever I want because I’m President. He is daring someone to challenge him. How far off can, “and I’m sticking around for a third term”, be?","2025-03-17T22:13:18.105Z"
"johnwayne11.bsky.social","He couldn’t even run a charity without breaking the law—Now he believes he’s in charge of the Supreme Court, Congress, our rights, and the U.S. justice system. Who’s going to stop him?!","2025-03-18T03:49:06.191Z"
"johnwayne11.bsky.social","Bessent: """"Can you guarantee there's not gonna be a recession? I can't guarantee anything. I can't guarantee that the journalist who asked me the question that her news program is gonna be on in a year.""""","2025-03-18T14:40:50.048Z"
"johnwayne11.bsky.social","Several Teslas were set on fire at a Tesla service center in Las Vegas early this morning.","2025-03-18T16:46:42.943Z"
"johnwayne11.bsky.social","Which one of you did this? 🤣🤣","2025-03-14T20:17:44.811Z"
"johnwayne11.bsky.social","Madison Wisconsin capital Veterans, March","2025-03-14T17:20:26.920Z"
"johnwayne11.bsky.social","Everyone should be screaming like this! More of this, now please!","2025-03-12T20:52:42.905Z"
"johnwayne11.bsky.social","Kelly: When I was flying in combat over Iraq during the first Gulf War, I didn’t expect that there was a 10-year-old kid sitting in South Africa who would one day become the richest guy in the world and call me a traitor for doing my job. Now, he kind of acts like a 12-year-old kid","2025-03-12T23:09:10.523Z"
"johnwayne11.bsky.social","The FAA approved another launch before the last crash investigation was completed — and it ended in another disaster. Why is SpaceX getting a free pass from DOGE cuts? 🤔","2025-03-07T16:31:47.889Z"
"johnwayne11.bsky.social","Again: what happens here in Tennessee is coming your way next. Pay attention. They openly say they want this to end up at the Supreme Court. tennesseelookout.com/2025/03/06/t...","2025-03-06T15:37:25.264Z"
"johnwayne11.bsky.social","If you're a billionaire, $10 eggs might be just a """"little disturbance."""" For most Americans it's a real issue.","2025-03-05T20:12:33.399Z"
"johnwayne11.bsky.social","Amy Coney Barrett knows…","2025-03-06T00:19:16.965Z"
"johnwayne11.bsky.social","😡","2025-03-06T15:33:12.334Z"
"johnwayne11.bsky.social","Traitorous scumbags — every last one of them.","2025-03-06T14:15:53.480Z"
"johnwayne11.bsky.social","Leavitt: """"He feels strongly that it would be very beneficial for the Canadian people to be the 51st state of the United States.""""","2025-03-05T18:53:12.057Z"
"johnwayne11.bsky.social","JORDAN: You said 'Soros-funded organizers' are coming and disrupting down halls. Where has that happened? Can you give an example? REP. LISA MCCLAIN: Um, all you have to do is turn on the TV and it's all over the place","2025-03-05T19:20:19.468Z"
"johnwayne11.bsky.social","Walz: """"The idea of a president standing at that rostrum and throwing a slur at a US senator in the middle because you disagree on policy is absolutely ridiculous.""""","2025-03-05T21:09:22.780Z"
"johnwayne11.bsky.social","In Russian it is Comrade Krasnov","2025-03-04T17:54:28.563Z"
"johnwayne11.bsky.social","Literally 80% of their crops used to be sold outside of the US","2025-03-04T04:38:50.425Z"
"johnwayne11.bsky.social","Freeland: """"If these tariffs are put in place, it is going to hurt Americans ... your grocery prices are gonna go up, bc you know what you need to grow food in the US? You need fertilizer. 80% of it comes from Canada and you're gonna be a 25% tax on it? ... the WSJ is right. This is dumb.""""","2025-03-04T01:27:21.046Z"
"johnwayne11.bsky.social","In less than 30 minutes, the Dow has already dropped over 600 points. That’s the real State of the Union.","2025-03-04T15:10:32.676Z"
"johnwayne11.bsky.social","The Germans know how to throw a parade!","2025-03-04T14:58:41.743Z"
"johnwayne11.bsky.social","He refused to bend the knee to Putin's Puppet and Couchfucker McGee. SLAVA UKRAINI!🌻💪","2025-03-01T16:40:25.378Z"
"johnwayne11.bsky.social","“DO YOUR JOB!” TEXAS: @RepKeithSelf’s turn","2025-03-01T17:09:49.444Z"
"johnwayne11.bsky.social","NEW: Senator Marshall (R-KS) RUNS AWAY, fleeing his own town hall after being asked about DOGE firing Veterans. MAKE HIM GO VIRAL.","2025-03-01T18:21:50.958Z"
"johnwayne11.bsky.social","Zelenskyy: """"When they, for example say that Ukraine is almost destroyed, that our soldiers run away, that they are not heroes, that the president is a dictator, what is the reaction? It's not about me. The reaction is, where is the friendship between Ukraine and the US?""""","2025-02-28T23:25:15.509Z"
"johnwayne11.bsky.social","Donald Trump. The chosen face of the Republican Party. A legend only in his own mind. The whole world knows it. What a disgrace.","2025-03-01T00:03:06.419Z"
"johnwayne11.bsky.social","""""History will remember this day— when an American President and Vice President abandoned all we stand for.""""","2025-02-28T21:25:04.515Z"
"johnwayne11.bsky.social","How many opportunities are they going to give me to post this video. Bc I’m going to keep posting it—partly bc it makes me laugh, and partly bc they’re nazi’s.","2025-02-25T15:28:42.442Z"
"johnwayne11.bsky.social","When reality slaps you down…👇 Hard!","2025-02-24T20:38:37.147Z"
"johnwayne11.bsky.social","Maddow: I think it is a bad mistake to let Joy Reid walk out the door. It is also unnerving to see that on a network where we've got two nonwhite hosts in primetime, both of our nonwhite hosts in primetime are losing their shows, as is Katie Phang on the weekend. I do not defend it.","2025-02-25T05:29:14.869Z"
"johnwayne11.bsky.social","Katherine Clark: """"We just see cowardice. We just see them bowing to Trump, bowing to the fear Elon Musk will fund a primary opponent for them. Is there any red line that they won't cross? Is there anything that they won't give from their constituents to the billionaire class bc Trump told them so.""""","2025-02-24T16:03:36.823Z"
"johnwayne11.bsky.social","We are siding with the enemy.","2025-02-24T17:04:08.339Z"
"johnwayne11.bsky.social","“Fraud” is a crime. We’re still waiting for all the arrests. ⏰ www.publicnotice.co/p/despite-th...","2025-02-24T15:38:33.860Z"
"johnwayne11.bsky.social","The screens at the Department of Housing and Urban Development were playing this video this morning","2025-02-24T15:39:07.285Z"
"johnwayne11.bsky.social","I love this for him. More of this between now and the mid-terms!","2025-02-24T23:54:39.379Z"
"johnwayne11.bsky.social","The President of the United States expressing his views on the 1st Amendment","2025-02-24T20:33:37.983Z"
"johnwayne11.bsky.social","The Revolution will be AI-icized","2025-02-24T17:19:24.619Z"
"johnwayne11.bsky.social","FUCK. ALL. MAGAT. LOSERS. 😎✨","2025-02-24T08:00:25.773Z"
"johnwayne11.bsky.social","Video snippet courtesy of Belfast legend David Holmes on Instagram...","2025-02-22T20:04:38.526Z"
"johnwayne11.bsky.social","Sharing some positive thoughts. 🫖","2025-02-23T14:10:07.876Z"
"johnwayne11.bsky.social","Also if you feel strongly about Eric Adams, you should call your city councilmember to express that and ask for their position. You’d be surprised. Hochul’s stance is highly disappointing but it doesn’t come from nowhere. Press all your electeds. City elections are in 5 months. Ask candidates too.","2025-02-22T20:21:26.156Z"
"johnwayne11.bsky.social","Kristi Noem’s week: • Sent 400 ICE agents to Colorado and made ONE arrest. • Got the Acting Director fired. • Played dress-up cosplay. • Cheated with Corey Lewandowski. • Wacked more puppies and goats.","2025-02-23T02:14:57.903Z"
"johnwayne11.bsky.social","200 million dollars of waste.","2025-02-22T13:50:07.489Z"
"johnwayne11.bsky.social","This is beyond the pale kind of corruption, folks…👇 Absolutely disgusting. WHO AGREES?! 🤚 Fuck. Trump. And. His. Enabler. Musk. ✨","2025-02-23T07:47:13.753Z"
"johnwayne11.bsky.social","😕","2025-02-23T04:53:09.043Z"
"johnwayne11.bsky.social","Obama knew","2025-02-23T12:31:55.899Z"
"johnwayne11.bsky.social","He nails it.","2025-02-22T15:28:02.490Z"
"johnwayne11.bsky.social","👀 🔥","2025-02-22T14:14:26.172Z"
"johnwayne11.bsky.social","Brown had to go - he was serving his country while black.","2025-02-22T12:36:47.739Z"
"johnwayne11.bsky.social","Did you hear about the Italian chef? He pasta away. Get it? I'll be here all week. Don't forget to tip your waitress.","2025-02-21T14:35:10.335Z"
"johnwayne11.bsky.social","📉📉📉","2025-02-22T00:18:21.791Z"
"johnwayne11.bsky.social","Here's video of Steve Bannon doing a Sieg Heil today at CPAC. It is what it is and it's what Bannon intended. Don't let yourself be gaslit.","2025-02-21T03:54:24.669Z"
"johnwayne11.bsky.social","This is not how federal criminal investigations work. —me (former federal criminal investigator)","2025-02-20T21:25:38.715Z"
"johnwayne11.bsky.social","Yep.","2025-02-20T22:47:53.229Z"
"johnwayne11.bsky.social","CHATTANOOGA: “Chatt Prep didn't respond to why so many of their teachers didn't have active teaching licenses— they get taxpayer💰, who makes sure charter schools follow the law to keep kids safe?” (One faces 12+ sexual exploitation of a minor charges) newschannel9.com/news/local/a...","2025-02-21T00:11:27.087Z"
"johnwayne11.bsky.social","🎀💗🎀💗🎀💗🎀💗🎀💗🎀💗🎀💗🎀💗🎀💗🎀💗🎀💗","2025-02-20T22:52:36.288Z"
"johnwayne11.bsky.social","In future generations, when your children and grandchildren look back on this moment, they are not going to ask about the price of eggs. They are going to ask you what you did. Not what you felt. Not what you paid. But what you did. And I want to be able to say I did everything I possibly could.","2025-02-20T23:37:38.595Z"
"johnwayne11.bsky.social","Trump will never be King.","2025-02-20T02:39:43.888Z"
"johnwayne11.bsky.social","Jeffries: We’re dealing with a group of people where, for far too many of them, facts don’t matter. Hypocrisy is not a constraint on their behavior. And many of them have actually come to the conclusion that their shamelessness is a superpower. We have to hold them accountable…","2025-02-20T19:15:37.618Z"
"johnwayne11.bsky.social","news.gallup.com/poll/656891/...","2025-02-19T22:58:16.983Z"
"johnwayne11.bsky.social","Love this guy. He appeared on the Mueller, She Wrote podcast in 2018. Hell of an activist.","2025-02-20T19:37:31.192Z"
"johnwayne11.bsky.social","President Trump calls Zelensky a “dictator,” which we know can’t be true because Trump loves all the dictators. That’s why he appeases and coddles Putin and his filthy imperialist war on the people of Ukraine. History teaches us that we bow down to dictators and tyrants at our own peril.","2025-02-20T21:09:27.212Z"
"johnwayne11.bsky.social","Thursday’s front page of the British Daily Star. Putin’s Poodle","2025-02-20T04:57:14.196Z"
"johnwayne11.bsky.social","The entire democratic world wishes Zelenskyy was their leader, so I would say he is doing an admirable job. Carry on and Thank you for the example.","2025-02-19T22:36:53.332Z"
"johnwayne11.bsky.social","Baldwin: """"Last night, the president said 'I'm not touching Medicare, Medicaid, Social Security, VA, I'm not touching them.' By this morning, he endorsed the House budget resolution which paves the way for massive cuts to Medicaid.""""","2025-02-19T17:49:48.265Z"
"johnwayne11.bsky.social","50% of people in Mississippi don't have high school degrees and the poorest man in Alabama is the Tooth Fairy.","2025-02-20T00:26:22.552Z"
"johnwayne11.bsky.social","And listen up you dickless bags of hair, because this Gulf of America bullshit is so stupid it makes flat-earthers look like goddamn Nobel Prize winners. open.substack.com/pub/jojofrom...","2025-02-19T23:48:56.140Z"
"johnwayne11.bsky.social","Pulling out the same type of device on a traffic stop that was used to beat police officers on Jan 6 is probably not the best plan.","2025-02-20T17:21:32.879Z"
"johnwayne11.bsky.social","Duckworth: """"He essentially just surrendered to Putin.""""","2025-02-19T21:38:13.758Z"
"johnwayne11.bsky.social","Last night I attended the Save Our Services rally in New York City. Listen to Rep. Alexandria Ocasio-Cortez (D-NY) fighting for people & federal workers: “Every day our job is to wake up and say ‘what can I do today?’ — There is no act too small. Every action matters.” @aoc.bsky.social","2025-02-20T13:59:43.788Z"
"johnwayne11.bsky.social","It's the Gulf of Mexico, and it will always be the Gulf of Mexico, no matter how many deluded fucks try to rename it, and I truly hope all other news organizations stand in solidarity with Associated Press against the insane bullshit.","2025-02-16T05:48:39.144Z"
"johnwayne11.bsky.social","Count me in, ladies!! 💙💙","2025-02-16T01:31:08.093Z"
"johnwayne11.bsky.social","Thank you to everyone who has joined the resistance! Our ranks grow stronger every day.","2025-02-16T04:45:38.384Z"
"johnwayne11.bsky.social","🎀💗🎀💗🎀💗🎀💗🎀💗🎀💗🎀💗🎀💗🎀💗🎀💗🎀💗","2025-02-16T12:10:25.523Z"
"johnwayne11.bsky.social","I fear they’re coming for ALL school vaccine mandates next. Including measles, mumps and rubella.","2025-02-15T15:32:48.006Z"
"johnwayne11.bsky.social","I’m going to continue to work until my computer access is revoked,” Lennox said. “Then I’m going to volunteer. I’m going to keep working as best I can to support the veterans. That’s what I’m here for.” taskandpurpose.com/news/veteran...","2025-02-15T00:00:22.661Z"
"johnwayne11.bsky.social","Wow, just fucking WOW! 👇 Utah, sure is a fucked up state, isn’t it?! Gotta. Be. Proud. Huh?! ✨","2025-02-14T07:10:06.588Z"
