"user","post","date"
"johnwayne11.bsky.social","FIRE RFK Jr!! WE WANT THE CANCER VACCINE!!! “New mRNA Cancer Vaccine Delivers Stunning Results, Sparks Universal Treatment Hopes” Story below","2025-09-06T22:39:25.927Z"
"johnwayne11.bsky.social","Let’s get this done. We all agree!","2025-09-06T23:38:36.999Z"
"johnwayne11.bsky.social","Yup, they’re definitely predators.","2025-09-06T15:51:12.033Z"
"johnwayne11.bsky.social","""""Ask not what your country can do for you, ask what you can do to stop my simpleminded nephew from destroying your country.""""","2025-09-06T00:35:32.610Z"
"johnwayne11.bsky.social","Valhalla Overland brings MAXIMUM RESISTANCE during his speech at the DC Music Festival 🎶 🔥","2025-09-05T19:18:22.857Z"
"johnwayne11.bsky.social","I love the Kennedy Family with the exception of their depraved death machine cousin RFK jr! www.axios.com/2025/09/05/r...","2025-09-06T03:48:58.934Z"
"johnwayne11.bsky.social","WARREN: Did you tell the head of the CDC that if she refused to sign off on your changes to the childhood vaccine schedule, that she had to resign? RFK Jr: No. I told her she had to resign because I asked her 'are you a trustworthy person?"""" and she said no WARREN: This is not what she has said","2025-09-04T16:11:47.298Z"
"johnwayne11.bsky.social","www.facebook.com/share/p/1Ej1...","2025-09-05T16:15:58.661Z"
"johnwayne11.bsky.social","So much greatness.","2025-09-05T14:44:17.966Z"
"johnwayne11.bsky.social","Kuvin: He didn’t keep a list of these people. What he would do is get calls from powerful men — men who lived in Palm Beach, for example. They would talk to Ms. Maxwell, and she would send a girl out. If you really to know who was involved, you would look at his phone books","2025-09-04T19:23:07.408Z"
"johnwayne11.bsky.social","x.com/Acyn/status/...","2025-09-05T05:56:33.968Z"
"johnwayne11.bsky.social","x.com/GavinNewsom/...","2025-09-05T05:48:00.952Z"
"johnwayne11.bsky.social","FORCED BIRTH Wealth transfer to the rich Inequality Authoritarianism Voter Suppression CUT MEDICARE Terrorism Insurrection GUN VIOLENCE END SOCIAL SECURITY Dirty Air and Water Destroying Planet Pandemics RACISM Misogyny War Theocracy NO PLATFORM ..DEAD PARTY...GOPDead","2025-09-05T00:02:17.809Z"
"johnwayne11.bsky.social","Go kick life in the nuts.","2025-09-04T11:31:12.516Z"
"johnwayne11.bsky.social","👇","2025-09-04T04:33:02.612Z"
"johnwayne11.bsky.social","CNN put together a clip of RKF Jr denying today he linked antidepressants and mass shootings, followed by a clip of RFK Jr last week linking antidepressants and mass shootings","2025-09-05T01:14:35.130Z"
"johnwayne11.bsky.social","Sen. Warren Daniel (R–NC, District 46) was caught trading stocks right on the Senate floor. Didn’t even wait for a break. Playing the market on the taxpayers’ time…pure abuse of power.","2025-09-05T00:40:03.072Z"
"johnwayne11.bsky.social","Speaking on the steps with Rep. Ansari, discussing her recent visit to an ICE detention facility","2025-09-04T16:02:19.102Z"
"johnwayne11.bsky.social","RFK JR: You’re just making stuff up Hassan: Sometimes when you make an accusation, it’s kind of a confession","2025-09-04T15:25:10.416Z"
"johnwayne11.bsky.social","WARNER: Do you accept the fact that 1 million Americans died from covid? RFK Jr: I don't know how many died W: You're the secretary of health and human services. You don't have any idea how many Americans died from covid? RFK Jr: I don't think anybody knows that W: How can you be that ignorant?","2025-09-04T15:18:14.453Z"
"johnwayne11.bsky.social","Reid: Bondi is not a real AG. She just works for Trump. All these U.S. attorneys — what’s her name from Fox (who I hope is sober) — she’s not a real U.S. attorney. She works for Trump. They’ve gutted the DOJ. The DOJ doesn’t exist. The FBI doesn’t exist. It’s all just Trump’s employees.","2025-09-03T04:13:09.346Z"
"johnwayne11.bsky.social","Our public schools went back to school today with heavy hearts. We can’t resign ourselves to believe that our little ones can’t be safe from guns in what should be the safest possible environment.","2025-09-03T01:16:59.503Z"
"johnwayne11.bsky.social","𝑱𝒐𝒆𝒚 𝑷𝒆𝒏𝒏𝒚 """"Hold The Line - Toto did a mixture of the original solo, Steve Lukather’s Live solo version and my own improvisation… hope you guys like it""""","2025-09-03T00:20:31.511Z"
"johnwayne11.bsky.social","Conspiracy theorist RFKJr who is neither a doctor nor public health expert is destroying the CDC , one of the Crown Jewels of our government. Disgraceful.","2025-09-02T19:11:39.331Z"
"johnwayne11.bsky.social","when you’re upset at the cool kids for not inviting you to their lunch table","2025-09-03T01:21:10.763Z"
"johnwayne11.bsky.social","Things feel uncertain right now, Illinois. I want you all to know we’re doing everything we can to protect your rights. Make sure you know how to stand up for yourself and others at illinoisimmigrationinfo.org.","2025-09-02T17:25:58.441Z"
"johnwayne11.bsky.social","*DOG: “You're finally back! I missed you so much!!”","2025-09-03T00:29:05.260Z"
"johnwayne11.bsky.social","bsky.app/profile/iwil...","2025-09-03T01:42:26.863Z"
"johnwayne11.bsky.social","Khanna: It’s going to be a bombshell press conference tomorrow at 10:30 a.m. The American people will hear directly from survivors of the Epstein abuse. And they’re not just going to talk about Epstein’s and Maxwell’s abuse — they’re going to talk about rich and powerful men…","2025-09-03T01:51:49.879Z"
"johnwayne11.bsky.social","KASIE HUNT: Over the summer you said, “There’s no vaccine that’s safe and effective”. Do you still believe that? RFK JR: “I never said that.” KASIE HUNT: “Play the clip.” RFK JR (clip): “There’s no vaccine that is safe and effective.” (March 2024) ht: @cwebbonline.com","2025-09-02T19:40:13.311Z"
"johnwayne11.bsky.social","Armed Airmen are patrolling The National Mall.","2025-09-01T14:57:08.371Z"
"johnwayne11.bsky.social","As Trump attacks unions and occupies our city, we’re called to remember how we got here. Labor Day would not exist without the workers who fought and died at the Haymarket Massacre and the Pullman Strike in Chicago. It’s not a coincidence he’s targeting Chicago:","2025-09-01T22:48:55.567Z"
"johnwayne11.bsky.social","My wish for the day...","2025-09-01T20:24:15.007Z"
"johnwayne11.bsky.social","He put chalk on his shoes then walked on the Pulse Memorial crosswalk. Police arrested him. But the court said they had no cause and he was released. The man arrested is now considering suing the state of Florida citing first amendment right violations.","2025-08-31T17:11:04.085Z"
"johnwayne11.bsky.social","Remember this every single time they say it's an issue of mental health. They don't intend to do anything about mental health. They view it as something like the weather which you can't do anything about","2025-08-31T15:35:52.460Z"
"johnwayne11.bsky.social","No Words….","2025-08-31T16:57:59.555Z"
"johnwayne11.bsky.social","Cascade Ponds, Banff","2025-08-31T15:37:57.802Z"
"johnwayne11.bsky.social","Looks like a couple of pics are old ones #wherestrump","2025-08-31T13:21:37.047Z"
"johnwayne11.bsky.social","RADDATZ: You talk about what can be done. After shootings in Buffalo & Uvalde, Congress passed a bipartisan Safer Communities Act. It provided hundreds of millions for schools to expand mental health services. You didn't vote for it. Why? TOM EMMER: I don't remember the reasons I didn't vote for it","2025-08-31T15:22:02.454Z"
"johnwayne11.bsky.social","This is not a joke. This is where we are at with Trump. Force the media to make it the headline. Force them the way they forced it on Biden. @cnn.com @nytimes.com @politico.com @wired.com @nbcnews.com @reuters.com @democrats.senate.gov","2025-08-31T18:11:52.104Z"
"johnwayne11.bsky.social","RADDATZ: One of the things they are trying to do in DC with the National Guard is have them back up local law enforcement WES MOORE: They are picking up trash","2025-08-31T13:54:40.379Z"
"johnwayne11.bsky.social","He must know it’s coming ☠️","2025-08-30T21:38:55.726Z"
"johnwayne11.bsky.social","Jones: We have a presidential administration that has more outrage about the changing of the cracker barrel logo than they do about changing the policies that allow our children to be gunned down in school…","2025-08-30T20:42:14.747Z"
"johnwayne11.bsky.social","GOV. WHITMER on marriage equality 🏳️‍🌈 attacks: “Treating people equally is a Michigan value… LGBTQ+ Michiganders make our state stronger, better, and more vibrant.”","2025-08-30T00:19:20.738Z"
"johnwayne11.bsky.social","Welch: Am American president talks to other American citizens like that, and propagandists come on TV and normalize this behavior. And nothing about this is normal. Nothing","2025-08-30T02:30:31.338Z"
"johnwayne11.bsky.social","@nealkatyal.bsky.social: “You’ve got the president who's imposed the largest tax increase on American consumers since 1993 … and he did it without Congress saying one word. That is not our constitutional structure.”","2025-08-30T16:31:15.248Z"
"johnwayne11.bsky.social","#Melania Melania Barbie and her Epstein generated Einstein visa.","2025-08-30T15:55:43.055Z"
"johnwayne11.bsky.social","This needs a repost.","2025-08-29T20:30:14.677Z"
"johnwayne11.bsky.social","Well, I’m already stocked up on the good stuff. 🍾","2025-08-30T15:17:35.384Z"
"johnwayne11.bsky.social","“Do you guys feel bad about what you’re doing? Don’t you f*cking hate yourselves?”","2025-08-29T21:12:58.674Z"
"johnwayne11.bsky.social","Welch: He claims that he's the law and order president. But we all know that's a lie because he's a convicted felon. He pardons convicted felons, he surrounds himself with obsequious people that kiss his all day, every day","2025-08-29T02:10:02.129Z"
"johnwayne11.bsky.social","Don’t look away","2025-08-29T02:39:39.080Z"
"johnwayne11.bsky.social","Lynx coach Cheryl Reeve on the Minnesota shooting: """"The sad thing is we can't sit here and tell them that help is on the way. Because we're not going to do a damn thing about it.""""","2025-08-28T15:13:40.851Z"
"johnwayne11.bsky.social","Here's some good news: Catelin Drey won a special election this week to flip a seat blue in the Iowa Senate and break Republicans' supermajority.","2025-08-28T20:08:52.007Z"
"johnwayne11.bsky.social","Councilmember Tim McOsker Los Angeles City Councilmember for the 15th District","2025-08-28T10:42:26.414Z"
"johnwayne11.bsky.social","Vote 'em ALL out in 2026 !","2025-08-28T13:51:15.659Z"
"johnwayne11.bsky.social","RFK Jr on the mass shooting in Minnesota: """"We're launching studies on the potential contribution of some of the SSRI drugs and some of the other psychiatric drugs that might be contributing to violence.""""","2025-08-28T12:37:28.867Z"
"johnwayne11.bsky.social","This is how you stand up to bullies and aspiring tyrants.","2025-08-26T14:03:54.416Z"
"johnwayne11.bsky.social","THANK YOU FOR WATCHING THE LYING LIARS & NEWS STINKERS OF FOX """"NEWS"""" SO WE DON'T HAVE TO! IT IS VERY MUCH APPRECIATED BY THOSE OF US WHO VALUE HONESTY, INTEGRITY & DECENCY WHILE ALLOWING US TO CONSUME ACTUAL FACTS WITHOUT THEIR BRAINWASHING TECHNIQUES & ABILITY TO TRIGGER BOUTS OF VIOLENT NAUSEA. 🤮","2025-08-24T21:24:09.465Z"
"johnwayne11.bsky.social","Kristi Noem and her squad of geniuses are painting the American side of the wall black—apparently to keep us from escaping.","2025-08-24T18:34:15.973Z"
"johnwayne11.bsky.social","Welcome to the best state fair in the country.","2025-08-21T12:26:25.616Z"
"johnwayne11.bsky.social","White House official Lindsey Halligan: """"While slavery is obviously a horrible aspect of our nation's history, you can't really talk about slavery honestly unless you also talk about hope and progress ... we need to stop focusing so much on the lack of progress.""""","2025-08-21T13:33:53.533Z"
"johnwayne11.bsky.social","Powerful speech, don't learn from history, it has a habit of repeating itself","2025-08-20T07:14:31.863Z"
"johnwayne11.bsky.social","They’ve tried to erase us for centuries. Didn’t work then, won’t work now. Black history IS American history.","2025-08-20T03:29:07.538Z"
"johnwayne11.bsky.social","“My budget has become double for food shopping”","2025-08-19T20:18:58.781Z"
"johnwayne11.bsky.social","In a stunning moment, Elise Stefanik was booed off the stage twice at an event in her district.","2025-08-18T21:17:03.181Z"
"johnwayne11.bsky.social","This is some next level trolling 🙌👏👏👏 #electionriggingresponseact #gavinnewsom #governornewsom #pinks #resist","2025-08-19T07:40:58.169Z"
"johnwayne11.bsky.social","🎀🎀 youtube.com/shorts/Y2Cqb...","2025-08-19T12:22:08.560Z"
"johnwayne11.bsky.social","Art expresses what words cannot","2025-08-19T03:22:21.042Z"
"johnwayne11.bsky.social","www.samsung-news.com/articles/oEH...","2025-08-18T15:20:40.692Z"
"johnwayne11.bsky.social","Can’t believe Neil Young outlived him. I always assumed it would be… (puts on sunglasses) ..Neil before Zod.","2025-08-17T21:40:58.823Z"
"johnwayne11.bsky.social","@gavinnewsom.bsky.social: """"Wake the fuck up to what's going on in this country... We're going to put everything on the damn line... People haven't given up yet. We're going to do this. We can win this November. We can win next November, and then we can get this country back on track.""""","2025-08-17T16:56:36.029Z"
"johnwayne11.bsky.social","South Park’s ratings have been setting records. The season 27 premiere delivered 6 million cross-platform viewers and had the show's biggest share in 25 years.","2025-08-14T01:08:36.543Z"
"johnwayne11.bsky.social","Things are going just great in DC tonight.","2025-08-14T04:46:41.556Z"
"johnwayne11.bsky.social","Spotted in DC: a convoy of U.S. Park Police, ATF, and other federal law enforcement making random traffic stops near Howard University. Howard University is widely recognized as a historically Black university (HBCU)","2025-08-13T17:56:04.395Z"
"johnwayne11.bsky.social","Whip that mofo","2025-08-13T15:45:41.124Z"
"johnwayne11.bsky.social","""""Trying to silence me"""": Beto O'Rourke responds to Texas AG's threat to arrest him","2025-08-13T17:50:36.045Z"
"johnwayne11.bsky.social","Clearly this is not about making DC, or any of us, safer.","2025-08-11T22:13:27.480Z"
"johnwayne11.bsky.social","Ok this is my laugh for the night.","2025-08-12T01:29:25.743Z"
"johnwayne11.bsky.social","Florida Republicans wants to use legal loopholes to build concentration camps like Alligator Alcatraz then we can use legal loopholes to tear them down and keep them out!! Let’s go environmentalists!! You are saving the natural habitat of the Everglades and lives!! 💙","2025-08-12T04:43:48.810Z"
"johnwayne11.bsky.social","Raskin: In any event, if he really cared about public safety in DC… he would not have pardoned 1600 insurrectionists and violent cop beaters on his first day in office.","2025-08-11T20:49:54.281Z"
"johnwayne11.bsky.social","No, JD, belonging in America does not depend on how many generations of your family have lived here. The values of this country matter - deeply - to who we are and what it means to be American.","2025-08-12T01:31:41.038Z"
"johnwayne11.bsky.social","Koh: If he were serious about cutting crime he wouldn't be proposing cutting $400 million from the ATF or cutting $500 million from the FBI, 700 agents or the DEA with with drug enforcement or the office of violence against women, 100 million from there","2025-08-12T02:11:03.786Z"
"johnwayne11.bsky.social","“This is just the beginning” — US Attorney Pirro","2025-08-12T01:14:27.077Z"
"johnwayne11.bsky.social","Alligator Alcatraz closing? Detainees are disappearing and being moved and we need help","2025-08-11T21:00:30.675Z"
"johnwayne11.bsky.social","Ohio managed to get thousands of people to hold hands and link arms in a human chain that stretched 8 miles to stand against ICE. 8 miles of humans linked together.","2025-08-10T20:46:52.179Z"
"johnwayne11.bsky.social","Mark Kelly: """"I hope we got something out of this. Putin is a war criminal. This is not a show of strength to allow him to fly into the United States to land here to negotiate with our president.""""","2025-08-10T15:05:53.290Z"
"johnwayne11.bsky.social","It’s time to wake up - we are literally on the verge of losing our democracy if Donald Trump cheats his way to those seats in Texas.","2025-08-09T17:35:10.571Z"
"johnwayne11.bsky.social","The love that Sami Zayn gets from Montreal is UNMATCHED #SmackDown","2025-08-09T00:54:01.111Z"
"johnwayne11.bsky.social","He LOST. YOU win. (You knew he wanted YOU to pay his lawyers and his legal bills, right?)","2025-08-09T01:04:16.930Z"
"johnwayne11.bsky.social","Good morning","2025-08-08T15:09:24.829Z"
"johnwayne11.bsky.social","The CEO-to-worker pay ratio at S&P 500 companies last year was 285-to-1. The median employee would have had to start working in the year 1740 to earn what the average CEO received in 2024. Is it any wonder why so many think the system is rigged?","2025-08-07T23:01:07.212427Z"
"johnwayne11.bsky.social","Today we honor the wounded warriors who put their lives on the line for this country. But let’s be clear—#PurpleHeartDay can’t just be symbolic. If you’re not fighting for healthcare, housing, and justice for our veterans, you’re not really honoring them.","2025-08-08T02:15:05.366Z"
"johnwayne11.bsky.social","youtube.com/watch?v=M-bA... Brian Tyler Cohen","2025-08-08T09:27:17.087Z"
"johnwayne11.bsky.social","The right is trying to deploy its usual terror tactics against Texas Democrats and the state of Illinois. It won’t work. With millions of people’s voting rights on the line, the stakes couldn’t be higher. This is the type of bravery and fight we need from Democrats:","2025-08-07T15:49:49.579Z"
"johnwayne11.bsky.social","Laura Ingraham's lips are so filled that she sounds like she's on novocaine","2025-08-05T23:29:54.421Z"
"johnwayne11.bsky.social","Mornin 🙂","2025-08-06T09:27:59.799Z"
"johnwayne11.bsky.social","What in fresh hell is this? ICE agents jump from the back of a Penske truck with a Fox News crew at a Home Depot near McArthur Park in Los Angeles, CA. All to arrest day workers who are just trying to provide for their families. Shameful!! Are they learning these tactics from Patriot Front?","2025-08-06T16:23:06.258Z"
"johnwayne11.bsky.social","Women dressed in Handmaid regalia follow GOP Congressman Rep. Mike Flood NEBRASKA (R)","2025-08-06T00:55:19.459Z"
"johnwayne11.bsky.social","She said she made it 21 years but that’s long enough to know this is bullshit. In my 53 years I agree. They’re dehumanizing us.","2025-08-06T15:20:02.882Z"
"johnwayne11.bsky.social","REPORTER: When can we expect the first deportees to be sent to Rwanda? HOMAN: We're working on it","2025-08-06T16:18:22.569Z"
"johnwayne11.bsky.social","I am aware of reports that threats were made against Texas elected officials in our state. Threats of violence will be investigated and those responsible will be held accountable. I have instructed @ilstatepolice.bsky.social to ensure we maintain public safety.","2025-08-06T14:48:58.808Z"
"johnwayne11.bsky.social","My optimism about our ability to save our democracy comes from my experience. No matter how broken or bruised our democracy is today, I have seen it work and I know it can work again. I have seen the power of collective action. I know it can save us now.","2025-08-06T15:45:29.486Z"
"johnwayne11.bsky.social","“Borrowed” from another site….too good to not share. 🤷‍♂️","2025-08-04T11:10:02.328Z"
"johnwayne11.bsky.social","New York has entered the chat 💬","2025-08-04T16:06:37.502Z"
"johnwayne11.bsky.social","“This is like two teams coming out of the locker room at halftime and the team that’s ahead saying they want to change the rules in the second half to make sure they win. If they’re gonna cheat, we’re not gonna play.” — Texas State Rep. James Talarico @jamestalarico.bsky.social","2025-08-04T22:35:43.157Z"
"johnwayne11.bsky.social","She pretty well summed it all up 👇👇👇👇👇","2025-08-04T02:05:59.305Z"
"johnwayne11.bsky.social","Congratulations to Kellyanne Conway. She will be providing the new alternative job numbers.","2025-08-04T21:31:22.760Z"
"johnwayne11.bsky.social","I cannot imagine what this is doing to them. We are talking about the President of the United States of America involved and doing this. It's beyond RETRAUMATIZING. This is another crime against these victims, another rape","2025-08-04T23:27:23.988Z"
"johnwayne11.bsky.social","The transfer of Ghislaine Maxwell to a minimum security prison would have required Todd Blanche or his report to certify she is no longer a threat to public safety. The fix is in place.","2025-08-04T04:18:01.915Z"
"johnwayne11.bsky.social","Curiouser and Curiouser 🧐👇🏼","2025-08-04T01:58:21.201Z"
"johnwayne11.bsky.social","Q: Why did you cut snap and health care research? Rep. Flood: We do not have unlimited money in the United States. [Crowd booing]","2025-08-04T22:36:10.588Z"
"johnwayne11.bsky.social","Fact-","2025-08-03T01:11:52.743Z"
"johnwayne11.bsky.social","TX Dems have left the state to break quorum to fight the redistricting scam. Rep. Crockett has thoughts...","2025-08-04T02:56:20.418Z"
"johnwayne11.bsky.social","Talarico and Texas Dems break quorum to Halt Gerrymandering Vote.","2025-08-03T23:48:10.959Z"
"johnwayne11.bsky.social","We the American taxpayer are funding $50,000 bonuses for recruitment into the masked ICE Gestapo 👿👇🏼 When you're given $140 billion to turn our country into a police state I guess you've got money to burn right? 🤨👇🏼","2025-08-03T14:06:14.185Z"
"johnwayne11.bsky.social","Rage Against The Regime in Orlando ✊","2025-08-03T15:41:48.255Z"
"johnwayne11.bsky.social","The White House landscape now matches our national political one.","2025-08-02T19:45:27.507Z"
"johnwayne11.bsky.social","These people are going to turn me into a conspiracy theorist.","2025-08-01T15:12:10.006Z"
"johnwayne11.bsky.social","A beautiful Bison talking a stroll through Yellowstone national park… 😊 🦬","2025-08-01T10:25:26.856Z"
"johnwayne11.bsky.social","Epstein survivor Sarah Ransome on Ghislaine Maxwell: “It makes me sick that she is claiming to be a victim. This is the same woman that grabbed my arm and forced me into a room to be raped by Jeffrey. She had this evil smirk on her face. And she enjoyed it.” ht: @marcofoster.bsky.social","2025-08-01T17:14:00.416Z"
"johnwayne11.bsky.social","Good Morning Luvs! 🤗💗🎶☕️🌷☀️🐾🇨🇦🍁 Happy Friday! Happy August! I call Shenanigans! Start off the weekend with filling the day full of life,laughter,smiles,& sharing as much good as possible! Look out for each other & remember our animal friends! Be kind💗 Don’t be a donkey butt🤨","2025-08-01T13:21:59.527Z"
"johnwayne11.bsky.social","“She wasn’t stolen. She was preyed upon” She was 16 years old.","2025-08-01T02:31:22.142Z"
"johnwayne11.bsky.social","As governor, as a father, and as an advocate for mental health: this is an issue that’s both important and personal to me.","2025-07-31T22:49:21.192Z"
"johnwayne11.bsky.social","these are not serious people","2025-07-31T16:16:31.553Z"
"johnwayne11.bsky.social","Earthjustice President @abbiedillen.bsky.social on the Endangerment Finding repeal: “How is it possible that the EPA is telling us that we aren’t endangered now? To observe the pain that millions of Americans are suffering and officially shrug it off — well, it’s an epic level of gaslighting.”","2025-07-30T21:49:33.891Z"
"johnwayne11.bsky.social","Christian Nationalism is a pernicious threat.","2025-07-31T22:42:09.310Z"
"johnwayne11.bsky.social","RELEASE THE EPSTEIN FILES","2025-07-31T22:42:18.954Z"
"johnwayne11.bsky.social","Think about what the GOP is revealing with their attempt to suddenly change the Congressional maps: they know their agenda is so unpopular that they're going to lose unless something changes. Of course, what they should be changing is their policies, not the maps.","2025-07-31T01:27:15.321Z"
"johnwayne11.bsky.social","Dr. Phil’s TV network, Merit Street Media, is filing for bankruptcy just a year after its launch, accusing its Christian broadcasting partner of “sabotage.” www.independent.co.uk/news/world/a...","2025-07-28T01:59:56.520Z"
"johnwayne11.bsky.social","“I don’t do drawings” — immediately admits he does drawings","2025-07-28T14:13:24.780Z"
"johnwayne11.bsky.social","#CarryingWater #NoExcuse #FDT #HumanRights #EpsteinFiles","2025-07-27T18:30:42.294Z"
"johnwayne11.bsky.social","Amazing how Trump’s ball he hit into the deep rough just magically pops out of his caddie’s pocket and they all just play it off like Trump just hit it there. 29 time Club Champion! bsky.app/profile/patr...","2025-07-27T17:53:09.669Z"
"johnwayne11.bsky.social","CNN put together a supercut of Pam Bondi being for releasing Epstein files before she suddenly turned against it","2025-07-27T13:12:19.904Z"
"johnwayne11.bsky.social","Epstein survivor Sarah Ransome on Ghislaine Maxwell: “She had no remorse. Ghislaine has no soul. She’s a dangerous human being. She will reoffend, reoffend and reoffend. These people never stop. Ever.”","2025-07-27T19:18:25.187Z"
"johnwayne11.bsky.social","Fox News took Jeanine Pirro off air because """"she's crazy"""" and """"nuts."""" Their words, not mine. Now we're going to trust her with the lives and liberty of the people of DC? This is just absurd.","2025-07-27T19:48:42.053Z"
"johnwayne11.bsky.social","This is sad 🏴󠁧󠁢󠁳󠁣󠁴󠁿","2025-07-26T23:44:46.967Z"
