"user","post","date"
"johnwayne11.bsky.social","Phil Collins via TIKTOK Watch Phil Collins perform """"Against All Odds (Take A Look At Me Now) on The Two Ronnies, 1985 #PhilCollins #80sMusic #LoveSong","2026-02-16T04:28:02.621Z"
"johnwayne11.bsky.social","#OTD 10 years ago! 16 February 2016, liftoff of Sentinel-3A on a #Rockot launcher from Plesetsk, the third satellite in Europe's Copernicus environment monitoring programme 🧪🌍 www.esa.int/Our_Activiti... @euspa.bsky.social @esaearth.esa.int @esa.int @wmo-global.bsky.social","2026-02-16T09:03:31.516Z"
"johnwayne11.bsky.social","Hungary holds elections in 2 months. And the US Secretary of State is in Hungary campaigning for Viktor Orban. And as you can see, Russian state media loves it.","2026-02-16T11:25:50.424Z"
"johnwayne11.bsky.social","Atlantis Launch - From Jason Major (jpmajor.bsky.social) - https://flic.kr/p/a1MJCw","2026-02-15T22:00:13.922579+00:00"
"johnwayne11.bsky.social","To Fly Free in Space apod.nasa.gov/apod/ap26021... Bruce McCandless II was living the dream -- floating farther out than anyone had ever been before. Guided by a Manned Maneuvering Unit (MMU), astronaut McCandless, pictured, was floating free in space.","2026-02-15T18:49:11.319Z"
"johnwayne11.bsky.social","This would have been amazing! I remember the days we went to concerts to watch and listen to the bands play. Not to take our phones out and record the bands play. #GenX #GooGooDolls","2026-02-15T15:30:12.563Z"
"johnwayne11.bsky.social","Good Sunday morning, friends! Hopefully you're able to take the day to rest, relax, and reset. May you find joy in the smallest of things. Have a day y'all, stay warm! #SheShed #Sunday","2026-02-15T11:51:26.123Z"
"johnwayne11.bsky.social","Olympian Amber Glenn has spoken out about supporting the LGBTQ+ community under the Trump administration. Glenn, who identifies as pansexual, recently announced that she is taking a break from social media following backlash for speaking out against the Trump administration.","2026-02-15T13:40:45.147672591Z"
"johnwayne11.bsky.social","San Antonio, Texas: NBC Report Alleges ICE Staff Mocked Migrant Children with Fake Thanksgiving Feast and Served Spoiled Food","2026-02-15T11:43:12.498Z"
"johnwayne11.bsky.social","Dani Swan","2026-02-15T13:15:23.516Z"
"johnwayne11.bsky.social","Looks like after I left the MDC in Los Angeles night, the intimidation party swung back out and an SRT agent shoved a gun in a woman’s face","2026-02-14T16:04:20.315Z"
"johnwayne11.bsky.social","ICYMI: Trump posted on his platform that there will be Voter ID for the midterms. He also states “whether Congress approves it or not” - something he has no authority to do.","2026-02-14T09:58:12.510Z"
"johnwayne11.bsky.social","You are allowed to be tired, but you are not destined to quit. Rest if you must, cry if you need, but do not surrender your purpose. The same road that exhausts you today will empower you tomorrow.","2026-02-15T12:33:26.555Z"
"johnwayne11.bsky.social","I knew I saw this somewhere before. Funny that it’s almost exactly what’s actually happening now.","2026-02-14T14:33:20.084Z"
"johnwayne11.bsky.social","Moskowitz: By the president’s own metrics, what accomplishments does Noem have? • She’s holding up 200 miles of border wall. • She’s deported fewer people than Obama. • She’s not helping any of these red-state governors with their disasters. Why hasn’t he fired her?","2026-02-15T00:00:37.006Z"
"johnwayne11.bsky.social","For those unaware, a quick primer on perhaps the most dangerous of the oligarchs. Peter Thiel.","2026-02-15T00:05:10.332Z"
"johnwayne11.bsky.social","www.facebook.com/share/r/1Fm1...","2026-02-15T08:58:09.778Z"
"johnwayne11.bsky.social","Raskin: What makes somebody a good lawyer? You have to identify with the people who are the victims of injustice — not with their perpetrators. So I would say to Pam Bondi: If you’re going to stand with the victimizers and not the victims, then you’re not a real lawyer.","2026-02-14T23:25:50.767Z"
"johnwayne11.bsky.social","Other countries can do it, why can’t we? www.france24.com/en/live-news...","2026-02-15T03:41:39.492Z"
"johnwayne11.bsky.social","www.chicagotribune.com/2026/02/14/c...","2026-02-15T06:24:37.407Z"
"johnwayne11.bsky.social","Wow! This is some top-notch investigative journalism. The report claims the 3 million Epstein files released are only 2% of the total. The massive scale of what’s still missing is hard to comprehend.","2026-02-15T05:08:51.325Z"
"johnwayne11.bsky.social","Great sitting down with Brian Tyler Cohen to talk about everything from the courage we saw in Minnesota, to how Democrats can be true to our values and get stuff done, to how we’re building a community of changemakers at the Obama Foundation. youtube.com/watch?v=uI-hgSE5QIw","2026-02-14T20:42:13.380Z"
"johnwayne11.bsky.social","While I didn’t like the whole episode of this weeks #starfleetacademy it did not destroy #ds9 and Captain Siskos story. I loved @TrondyNewman character in this episode. Lot of great surprises. I loved DS9 and Avery Brooks Sisko character when I was young. . @StarTrek","2026-02-05T10:33:36.423Z"
"johnwayne11.bsky.social","I would feel much better about this if it wasn’t coming from an unhinged Karen, currently running for SC governor.","2026-02-13T23:18:04.835Z"
"johnwayne11.bsky.social","Nothing to see here…just more criminals buying their way out prison.","2026-02-14T03:40:55.250Z"
"johnwayne11.bsky.social","You might think that the inhumane conditions at America's concentration camps is because of this administration's usual lazy incompetence, but, no, it's because of this administration's usual vicious cruelty.","2026-02-13T19:42:45.055Z"
"johnwayne11.bsky.social","Why was Dr. Oz inviting Epstein to parties 8 years after Epstein was convicted of procuring a minor for prostitution?","2026-02-13T22:42:06.226Z"
"johnwayne11.bsky.social","I remember standing on Pad 39A in the Summer of 2024, months before Europa Clipper launched that October. It was a day much like shown below. A number of us from the APL & JPL mission assurance teams were down there prior rollout of SpaceX's Falcon Heavy vehicle. Artemis 2 will launch from 39B.","2026-02-13T03:19:01.859Z"
"johnwayne11.bsky.social","How sad!!!!! #Epstein #EpsteinFiles","2026-02-13T19:07:52.174Z"
"johnwayne11.bsky.social","“The second day they gave them tacos.” Candace Owens says the TP USA/Kid Rock halftime show (that drew far fewer eyeballs than Bad Bunny) was pre-taped with an audience paid to cheer — and, incredibly, they fed them… tacos.","2026-02-13T23:15:57.208Z"
"johnwayne11.bsky.social","It's clearly a cover up, and they think we’re all stupid and won't notice.","2026-02-13T21:30:13.754Z"
"johnwayne11.bsky.social","@deadder.bsky.social 🔥🔥🔥🔥🔥","2026-02-13T22:12:36.985Z"
"johnwayne11.bsky.social","DON LEMON: “I will not be intimidated. I will not back down. I will not be silenced.”","2026-02-13T20:55:24.745Z"
"johnwayne11.bsky.social","Of course, said anyone with even the slightest bit of common sense: A year in, it’s official: Americans, not foreigners, are paying for Trump’s tariffs….","2026-02-13T12:20:03.598Z"
"johnwayne11.bsky.social","They knew this policy was so unconstitutional that they kept the “legal memo” authorizing this practice hidden, wouldn't let physical copies of it circulate, and a whistleblower had to alert Congress about its very existence.","2026-02-14T00:00:10.002Z"
"johnwayne11.bsky.social","Sanders: The American people do not want this country to be an authoritarian society or an oligarchy. We have our differences, that’s what democracy is about—we argue it out. We don’t throw people who disagree in jail. We don’t intimidate the media. We don’t send ICE agents to shoot people.","2026-02-13T20:20:09.815Z"
"johnwayne11.bsky.social","Ffs….. …..how did she get a Visa","2026-02-14T00:36:09.196Z"
"johnwayne11.bsky.social","NEWS: LA Lakers Co-Owner’s Firm Linked to Proposed $80 Million ICE Warehouse Deal in Texas — a massive facility that could detain up to 9,500 people.","2026-02-14T00:04:39.935Z"
"johnwayne11.bsky.social","This week, I helped bring the D.C. Independent Film Festival to Capitol Hill to discuss how to strengthen film production in the U.S.","2026-02-13T20:24:45.174Z"
"johnwayne11.bsky.social","Two of them were convicted drug traffickers. But hey, they were former NFL players so they shouldn’t have to endure those kinds of things on their records. As usual, follow the money.","2026-02-13T10:46:21.369Z"
"johnwayne11.bsky.social","Noem has a hard time hearing questions over protesters but closes her ill-fated presser on an Orwellian note, claiming DHS will continue to work to """"bring peace and safety to the Twin Cities""""","2026-02-12T22:05:25.516Z"
"johnwayne11.bsky.social","Sarah Longwell: """"This is the Epstein administration because there are two types of people in it — there are people who are in the Epstein files and there are people who are covering up the Epstein file.""""","2026-02-12T22:19:53.953Z"
"johnwayne11.bsky.social","Amid the chaos of national politics, the power of the local is easy to overlook. But showing up in local organizations, processes, and politics can be a powerful way to change things for the better.","2026-02-13T00:08:41.627Z"
"johnwayne11.bsky.social","Walz: """"The federal government needs to pay for what they broke here. There's going to be accountability on things that happened, but one of them is the incredible and immense cost borne by the people of this state. The federal government needs to be responsible.""""","2026-02-12T16:04:00.539Z"
"johnwayne11.bsky.social","Washington state legislators‼️ Please publicly address why you think a bill (SB 6239) that forces survivors and their stories behind closed doors, is a good call? @noelframe.bsky.social @twinanobles.bsky.social @rebeccasaldana1.bsky.social @vandanaslatter.bsky.social","2026-02-12T23:47:13.892Z"
"johnwayne11.bsky.social","Oh, my goodness! I wonder what his wife and friends will think about THIS news! :-) newrepublic.com/post/206510/...","2026-02-12T23:43:47.724Z"
"johnwayne11.bsky.social","Frey: """"Obviously there's progress in that they are leaving right now, but as far as some deal was struck to get them out -- the answer is no. I think what you saw is a federal govt and administration that thought they were going to break the people of Minneapolis down.""""","2026-02-13T02:43:05.165Z"
"johnwayne11.bsky.social","Russia Ron says we’re not allowed to learn about our rights.","2026-02-13T06:53:00.155Z"
"johnwayne11.bsky.social","I made a friendly bet with Rep. Newhouse: If the Patriots won SBLX, he’d bring me some Washington cherries; if the Seahawks won, I’d bring him some Maine blueberries. Let’s just say it was a long walk to Dan's office. Congrats to the Seahawks! (We’ll always have the Malcolm Butler interception.)","2026-02-12T13:23:46.801Z"
"johnwayne11.bsky.social","Your American health chief, folks! 🙃🇺🇸","2026-02-12T20:17:42.632Z"
"johnwayne11.bsky.social","Dr. Oz appears to have invited Jeffrey Epstein to a Valentines Day party in 2016, long after Epstein pleaded guilty to soliciting sex with underage girls.","2026-02-13T03:04:34.554Z"
"johnwayne11.bsky.social","If we can’t stand for human rights here and abroad, we can’t credibly fight fascism anywhere. Palestinian freedom is tied to our fight against authoritarianism at home. You cannot defend democracy while aligning with anti-democratic interests like AIPAC.","2026-02-12T21:07:14.507Z"
"johnwayne11.bsky.social","x.com/i/status/202...","2026-02-13T06:57:05.429Z"
"johnwayne11.bsky.social","This weekend the world's leaders will gather together for the Munich Security Conference. I am calling on them to hold the Epstein Class accountable, including those in their own governments.","2026-02-12T19:26:46.375Z"
"johnwayne11.bsky.social","28 years ago, on February 13th, """"Sphere"""" premiered in US theatres. Directed by Barry Levinson and starring Dustin Hoffman, Sharon Stone, Samuel L. Jackson, Peter Coyote and Liev Schreiber. #Sphere #Horror #16mmInferno","2026-02-13T02:24:59.211Z"
"johnwayne11.bsky.social","youtu.be/MThLPaYLAjY?...","2026-02-13T04:38:32.832Z"
"johnwayne11.bsky.social","“.. Noem and Lewandowski frequently berate senior level staff, give polygraph tests to employees they don’t trust and have fired employees—in one incident, Lewandowski fired a U.S. Coast Guard pilot after Noem’s blanket was left behind on a plane ..” @wsj.com www.wsj.com/politics/pol...","2026-02-13T02:09:11.111Z"
"johnwayne11.bsky.social","This is so embarrassing. The cartel drones Pam Bondi was sounding the alarm about during the hearing turned out to be… party balloons. This administration is so incompetent.","2026-02-13T02:59:27.097Z"
"johnwayne11.bsky.social","Rep. Brian Steil: """"I flew home to my home state of Wisconsin, went to buy a 6 pack a beer, the clerk asked for my ID, confirmed it, and then I was allowed to buy the beer. I just think it's nuts that we protect our beer more than our ballots.""""","2026-02-12T13:33:28.846Z"
"johnwayne11.bsky.social","Every word of this is a lie","2026-02-12T14:29:39.927Z"
"johnwayne11.bsky.social","Been going through my poetry collection, trying to create order out of chaos, and came across this one again. Thought it was worth a repost. I still ponder this question daily, 'What is it to be Human', to live amongst other humans? #Poem #Poetry #Pondering #WhatIsItToBeHuman #EastCoastKin","2026-02-12T20:43:30.067Z"
"johnwayne11.bsky.social","The repeal of the """"endangerment finding"""" will make it harder for future administrations to regulate carbon dioxide and other greenhouse gases under the Clean Air Act without a new law or amendment passed by Congress—with serious public health and climate consequences","2026-02-12T19:49:18.953Z"
"johnwayne11.bsky.social","ICE was observed on a door-to-door raid in Virginia Beach, Virginia, on 2/11/26","2026-02-13T00:34:21.190Z"
"johnwayne11.bsky.social","Howard Lutnick misled the American people about his relationship with Jeffrey Epstein because he didn't want to admit he continued interacting with Epstein even AFTER Epstein was convicted of soliciting a minor. It's a disgrace. Lutnick needs to resign as Secretary of Commerce.","2026-02-12T20:00:53.713Z"
"johnwayne11.bsky.social","You get what you pay for.","2026-02-12T15:25:11.482Z"
"johnwayne11.bsky.social","cool, cool. so we are sort of like citizens, but not really?","2026-02-12T21:09:13.631Z"
"johnwayne11.bsky.social","a timelapsed video a very turbulent updraft base from a supercell thunderstorm on August 27th of 2022 near Cannon Falls, Minnesota","2026-02-12T21:12:41.315Z"
"johnwayne11.bsky.social","Dems are about to effectively shutdown the DHS. Now it’s time to impeach Kristi Noem!","2026-02-13T01:20:08.988Z"
"johnwayne11.bsky.social","A desperate and deranged individual posted this today. SAD!!!","2026-02-13T00:05:27.079Z"
"johnwayne11.bsky.social","REGULATIONS = PROTECTIONS FOR AMERICANS, HUMANS, EARTH DEREGULATIONS = ALLOWING CORPORATIONS TO HARM AMERICANS, HUMANS, EARTH","2026-02-12T23:32:42.801Z"
"johnwayne11.bsky.social","This is all performative bullshit. Believe it when you don't see ICE in Minneapolis/Saint Paul anymore.","2026-02-12T17:58:45.008Z"
"johnwayne11.bsky.social","I just voted to cancel Trump’s reckless tariffs on Canada. This is a major victory for the American people and for Congress reclaiming our constitutional authority over tariffs. And, it's a defeat for Trump and Speaker Johnson, who for months blocked the House from taking this vote.","2026-02-11T23:12:24.993Z"
"johnwayne11.bsky.social","Klein: People are afraid to come into clinics or hospitals because they’re afraid they’ll be snatched. So they’re staying home with acute conditions like appendicitis. They’re not going to their follow-up neonatal appointments. They’re allowing their jaundiced babies to go untreated.","2026-02-13T00:51:27.935Z"
"johnwayne11.bsky.social","I miss having someone in the office who was genuinely a good person. Not perfect, but good.","2026-02-11T20:04:24.859Z"
"johnwayne11.bsky.social","Get Ready","2026-02-12T15:58:24.616Z"
"johnwayne11.bsky.social","Inslee: The Republican Party was always a free-trade party, a Second Amendment party. Now they’re supporting a guy who is causing higher costs because of his tariff policies. He’s got people saying he’s going to disarm anybody who goes to D.C., and he’s trampling on states’ rights…","2026-02-13T00:38:48.882Z"
"johnwayne11.bsky.social","I can only assume removing his nappy formed part of foreplay.","2026-02-12T19:54:31.753Z"
"johnwayne11.bsky.social","I’ll believe it when I see it….","2026-02-12T17:06:33.849Z"
"johnwayne11.bsky.social","Since Pam Bondi is worse than useless, Epstein survivor @anniegrover.bsky.social has started a GoFundMe for Virginia Giuffre to help settle her estate and cover her legal fees. www.gofundme.com/f/help-virgi...","2026-02-12T18:19:02.399Z"
"johnwayne11.bsky.social","If Pam Bondi was a waitress.","2026-02-12T18:20:15.385Z"
"johnwayne11.bsky.social","Just like with Brazil arresting their insurrectionists rather than re-electing them, other countries are holding their Epstein-tied politicians accountable far better than we do. www.bbc.com/news/article...","2026-02-12T17:44:55.573Z"
"johnwayne11.bsky.social","WATCH - @heathergtv.bsky.social : “Do you know how many murders were in Culver City this past year, Pam Bondi? Zero.”","2026-02-12T13:19:10.207Z"
"johnwayne11.bsky.social","Attorney General Pam Bondi tells a member of a co-equal branch of government during a public hearing: “You don’t tell me anything, you washed-up loser lawyer.” The disdain for our own government is appalling. This administration is destroying our democracy.","2026-02-12T13:11:34.284Z"
"johnwayne11.bsky.social","🔴 Got chills ~ watching Rep Jasmine Crockett, grill this soulless • Heartless • MONSTER ‼️‼️‼️ 🤮 Pam Bondi Is A Monster 🤮","2026-02-12T11:41:49.755Z"
"johnwayne11.bsky.social","Don’t get too excited, Trump can veto this. www.cnn.com/2026/02/11/p... #cdnpoli","2026-02-12T00:25:13.786Z"
"johnwayne11.bsky.social","Thank you, Julie Johnson, for speaking out against the grotesquely misnamed SAVE act. We need you to keep fighting for us in the House.","2026-02-11T22:30:09.566Z"
"johnwayne11.bsky.social","The Terrorists are in the Trump Cabinet.","2026-02-11T18:07:03.856Z"
"johnwayne11.bsky.social","x.com/i/status/202...","2026-02-12T11:31:03.757Z"
"johnwayne11.bsky.social","x.com/i/status/202...","2026-02-12T11:25:50.596Z"
"johnwayne11.bsky.social","I can't wait until the chickens come home to roost. Where is the mainstream media? They have dropped the ball big time on this? 👇🤬","2026-02-11T21:45:45.809Z"
"johnwayne11.bsky.social","Team USA’s Jordan Stolz wins the Olympic gold medal in speedskating and sets a new Olympic record. Stolz, the world-record holder in the event, had been saving the exact blades he broke the record in to wear again in Milan.","2026-02-11T19:24:02.331Z"
"johnwayne11.bsky.social","""""Bondi lies to Congress, tells them Maxwell was not transferred to a 'lower-level facility'"""" ~ HuffPost Soo... Her statement should be taken as Maxwell's transfer to Prison Med was as MISTAKE, and Dem's should do everything in their power to correct it. i.e. SEND HER SKINNY ASS BACK UP FED RIVER!!!.","2026-02-12T04:08:53.151Z"
"johnwayne11.bsky.social","Please, please get a colonoscopy. The prep kind of sucks, but it's the best sleep you'll ever have. And it could save your life.","2026-02-11T20:23:26.584Z"
"johnwayne11.bsky.social","Many people are saying Howard Nutlicker was pimping out his nannies on Epstein Island.","2026-02-12T00:30:45.376Z"
"johnwayne11.bsky.social","“.. I think she has become a circus act.” - Marina Lacerda, Epstein survivor @newsnation.bsky.social","2026-02-11T23:53:14.538Z"
"johnwayne11.bsky.social","No lies detected","2026-02-11T17:06:12.202Z"
"johnwayne11.bsky.social","www.facebook.com/share/v/1APT...","2026-02-12T11:15:55.242Z"
"johnwayne11.bsky.social","x.com/i/status/202...","2026-02-12T11:12:15.521Z"
"johnwayne11.bsky.social","Governor of Michigan Gretchen Whitmer on the Gordie Howe bridge: """"Canadians have paid for the bridge. The bridge was built with organized labor, union labor on both sides of the bridge, including Michiganders."""" #cdnpoli","2026-02-12T08:15:21.204Z"
"johnwayne11.bsky.social","Let this sink in about Pam Bondi.","2026-02-12T00:52:48.779Z"
"johnwayne11.bsky.social","Hopefully history repeats itself..","2026-02-12T01:19:45.295Z"
"johnwayne11.bsky.social","I get why Matt posts this nonsense every day, outrage pays. None of this is on the current government. Open borders? Brexit. Soft-on-crime chaos? Tories. Highest taxes since the 1940s? Tories. Shafted pensioners? Tories. Farmers driven to despair? Brexit. Hotels for migrants? Brexit + Tory failure.","2026-02-12T08:26:27.183Z"
"johnwayne11.bsky.social","Where is the 21 Trillion Tariff dough we are raking in????","2026-02-12T11:00:35.863Z"
"johnwayne11.bsky.social","> @alivitali.bsky.social","2026-02-11T22:54:36.804Z"
"johnwayne11.bsky.social","Thank you, Rep. Ro Khanna.","2026-02-12T00:15:05.359Z"
"johnwayne11.bsky.social","The DOJ appears to have surveilled members of Congress who were looking through unredacted pages in the Epstein files and provided that information to Pam Bondi for her hearing before the House Judiciary Committee.","2026-02-12T02:33:35.677Z"
"johnwayne11.bsky.social","I wonder how a human being finds themselves in that chair in front of the watching world in a moment of such gravity, so completely bereft of empathy, so seemingly unencumbered by other people’s suffering, and so strident in the face of accountability... johnpavlovitz.substack.com/p/dear-pam-b...","2026-02-12T01:51:22.473Z"
"johnwayne11.bsky.social","Today is International Day of Women and Girls in Science. 🥳 This poem, originally written for #PoemsAbout is about me and my microscope. Thanks @alanparrywriter.co.uk for the prompt. #internationaldayofwomenandgirlsinscience #womeninSTEM #STEM #Volvox #poetry 🟢🟢🟢🔬➡️🦠🧫🐌➡️🌴🦟🛏️","2026-02-11T07:08:26.581Z"
"johnwayne11.bsky.social","LIFELESS, SOULLESS EYES","2026-02-12T10:44:38.898Z"
"johnwayne11.bsky.social","The hottest places in hell are reserved for those who remain neutral in times of moral crisis #FuckTrump #FuckICE","2026-02-12T10:44:43.231Z"
"johnwayne11.bsky.social","x.com/i/status/202...","2026-02-12T10:45:38.697Z"
"johnwayne11.bsky.social","Why is DOJ tracking what members of Congress are searching for in the Epstein files? bsky.app/profile/atru...","2026-02-11T22:55:06.749Z"
"johnwayne11.bsky.social","Reprocessing a pretty friend: M 42, the Orion Nebula. Also pictured are M 43, De Mairan’s Nebula, and NGC 1977, the Running Man Nebula. 2.5hrs, #Seestar S50 🔭 🧪 Siril, SyQon Starless, Veralux Hypermetric Stretch, Cosmic Clarity denoise and sharpening, GIMP","2026-02-12T02:37:41.476Z"
"johnwayne11.bsky.social","This is a huge rebuke of Trump by Republicans. A bigger deal than it might seem. 🚨 6 Republicans joined Democrats in backing the resolution to cancel Trump’s Canada tariffs sponsored by Rep Gregory Meeks.","2026-02-11T23:43:56.014Z"
"johnwayne11.bsky.social","I want to see this grinning, soulless ghoul in an orange jumpsuit.","2026-02-12T01:27:12.995Z"
"johnwayne11.bsky.social","WATCH: “In any remotely sane political climate she would be impeached, fired, or just have the good sense to resign in disgrace,” says Chris Hayes on Attorney General Pam Bondi.","2026-02-12T01:43:17.108Z"
"johnwayne11.bsky.social","While this is good news, It's hard for me to understand headlines about legal challenges. Are most people able to grasp this at first glance? """"Rejecting the not doing, they are blocking the ban and can undo the ban that stops the stopping."""" A form of dyslexia maybe? Are others baffled at first too?","2026-02-11T19:19:03.912Z"
"johnwayne11.bsky.social","If you missed the exchange between @raskin.house.gov and Pam Bondi today, watch this masterful statement from him on behalf of the Epstein victims: “You are siding with the perpetrators and you are ignoring the victims. That will be your legacy.” Repost if you agree she is the worst AG in history.","2026-02-12T02:51:02.172Z"
"johnwayne11.bsky.social","This is Pamela Jo Bondi contemptuously flipping her hair (which is SCREAMING for some purple shampoo) when asked to acknowledge the Epstein survivors seated directly behind her. She couldn't even be bothered to turn her head. What a rude and deeply unpleasant person.","2026-02-12T00:29:27.798Z"
"johnwayne11.bsky.social","Pam Bondi brought a document to the Judiciary Committee today that had my search history of the Epstein files on it. The DOJ is spying on members of Congress. It’s a disgrace and I won’t stand for it.","2026-02-12T01:14:57.174494904Z"
"johnwayne11.bsky.social","🚨BREAKING: The GOP’s sweeping new anti-voting bill cleared the U.S. House Wednesday, setting up a high-stakes battle in the Senate. www.democracydocket.com/news-alerts/...","2026-02-11T23:46:58.106Z"
"johnwayne11.bsky.social","Shut up, Mike.","2026-02-12T10:11:57.099Z"
"johnwayne11.bsky.social","Trump tried to weaponize our justice system to go after my colleagues' most fundamental right — free speech — all because he didn’t like what they said. The President is trying to silence Americans who speak up and speak out. I won't be intimidated, and neither should you.","2026-02-11T17:30:42.071Z"
"johnwayne11.bsky.social","We aren’t though, Karo-lyin.","2026-02-12T01:45:04.220Z"
"johnwayne11.bsky.social","x.com/i/status/202...","2026-02-12T10:05:32.942Z"
