"user","post","date"
"bigskybabs.bsky.social","There is an awful lot of email to read to/from Epstein at jmail.world","2026-02-10T22:38:29.383Z"
"bigskybabs.bsky.social","Does anyone know who is playing football at the Green Day / Bad Bunny concert?","2026-02-08T21:40:08.286Z"
"bigskybabs.bsky.social","Watching my friend's cat and snapped this pic. 🤣","2026-02-05T04:19:38.370Z"
"bigskybabs.bsky.social","@kqedforum.bsky.social I have thrown a consecutive monthly dinner party for the last 289 months and find that no matter what happens in life—divorce, pandemic, grief, or fascist takeovers—that filling my house with people I love and feeding them, makes the world right again, if only for a few hours.","2026-02-03T18:41:15.677Z"
"bigskybabs.bsky.social","friend of mine is an undocumented immigrant and has been hiding in Melania theaters bc he knows people assume no one is in there","2026-01-29T21:34:00.840Z"
"bigskybabs.bsky.social","...""""just men with guns who have to hide their faces to shoot a mom in the face and a nurse in the back.""""","2026-01-29T01:02:02.359Z"
"bigskybabs.bsky.social","Action is the antidote to despair. Instead of donating to our failing political parties, make a difference for Minnesotans directly affected by this nightmare. Make an online gift now www.wfmn.org/funds/immigr...","2026-01-28T22:34:18.255Z"
"bigskybabs.bsky.social","The pink coat lady speaks out. I hope Stella gets some trauma treatment. Know that if you witness a crime like this, you can tap a victim compensation fund to get help. My heart goes out to her. It stays with you forever when you watch someone die that way. 💔😭","2026-01-28T07:23:32.358Z"
"bigskybabs.bsky.social","I am not the least bit religious but when I hear a religious leader speak truth to power like Reverend Senator Warnock, it is a balm to my troubled soul.","2026-01-28T07:18:46.703Z"
"bigskybabs.bsky.social","How heartbreaking. Alex Pretti, just like George Floyd, Brionna Taylor, and Renee Good is all of us.","2026-01-28T07:14:50.411Z"
"bigskybabs.bsky.social","The number is 202.224.3121.","2026-01-27T16:27:00.386Z"
"bigskybabs.bsky.social","Walz' leadership is as stellar as we knew it would be.","2026-01-26T18:01:55.529Z"
"bigskybabs.bsky.social","Today is a great day to CALL your two senators and implore them to vote AGAINST the appropriations bill this week unless it strips ICE of funding. Tell them you would rather see a govt shutdown instead of more people being murdered. The number for all is 202.224.3121.PLEASE CALL","2026-01-26T18:00:40.626Z"
"bigskybabs.bsky.social","SF Bay Area peeps, a friend in disaster management said 100 ICE thugs are deploying in Alameda County. To try and blend in, they are wearing REI attire and driving Subarus. 🤣 As if. Keep an eye out and if you know which hotel is housing them, I would like to picket outside.","2026-01-25T18:57:16.754Z"
"bigskybabs.bsky.social","This is such powerful reporting.","2026-01-25T15:27:58.990Z"
"bigskybabs.bsky.social","www.instagram.com/reel/DT6H115... Sharing the vid from the lady in the pink jacket. I hope she is in hiding. TW.","2026-01-25T07:39:20.117Z"
"bigskybabs.bsky.social","Dear Democratic Party. Stop using these domestic terrorist attacks to ask me for money. I already pay you. Get louder. Stand stronger. Do what we elected you to DO, which is keep this regime in check. Seven of you cowards voted to fund this nightmare. You senators better not cave.","2026-01-25T04:54:44.919Z"
"bigskybabs.bsky.social","Be brave and relentless and call your 2 senators this week and implore them NOT TO FUND THIS EVIL GOVERNMENT until ICE is defunded. 202.224.3121 connects you to any and all. It's easier than hiding a family in your attic.","2026-01-25T03:38:21.700Z"
"bigskybabs.bsky.social","This is the energy I wanna see from Democratic leaders before they ask me for one more donation.","2026-01-15T15:54:56.977Z"
"bigskybabs.bsky.social","We could have had this guy as our VP. But NO...😥","2026-01-15T07:42:47.990Z"
"bigskybabs.bsky.social","I divested from Hulu and Spotify in the last couple of months. Always saw the evil of Amazon, so never supported them. Any other recommendations?","2026-01-15T04:05:43.860Z"
"bigskybabs.bsky.social","substack.com/@lvoldeng/no... Victims of Epstein and Trump are starting to speak out. Do you have the guts to listen? Part 2 is getting published soon.","2026-01-13T18:58:06.645Z"
"bigskybabs.bsky.social","Keep this bookmarked and handy and share widely:","2026-01-12T22:10:55.754Z"
"bigskybabs.bsky.social","This is what happens when power isn't held accountable for their actions. 🤬","2026-01-12T22:06:24.890Z"
"bigskybabs.bsky.social","Miss Yopps, a.k.a. Poppy Montgomery, enjoying very expensive heat coming out of the wall in front of her mini blue velvet sofa and pondering how to start a Cats Against ICE Militia. 😼","2026-01-12T06:20:14.073Z"
"bigskybabs.bsky.social","If you are against us going to war for oil, consider divesting from oil. EVs are amazing to drive, never need gas or oil. A charging station map will show you all the chargers that exist right near you. Yes, even you. #EVDriversKickGas","2026-01-03T23:30:15.212Z"
"bigskybabs.bsky.social","Okay, peeps. I just followed back everyone, finally. Thanks to everyone who threw me into their starter packs! It's been a slow start here on BlueSky but I am all caught up. Hope you are having a wonderful holiday season despite the looming threat of fascism.","2025-12-24T14:43:23.200Z"
"bigskybabs.bsky.social","Bari Weiss can go straight to hell and not collect 200 dollars. What a clown.","2025-12-24T03:56:07.967Z"
"bigskybabs.bsky.social","What Betty said. 😬😡","2025-12-23T21:56:24.411Z"
"bigskybabs.bsky.social","Keep this circulating. The monsters are not the deportees, but those paying other countries to torture them in prison.","2025-12-23T18:24:12.822Z"
"bigskybabs.bsky.social","Got a nice little pile going! Yeah, no tree. Lost everything last year including decades of my ornament collection chosen thoughtfully with my kids every year, and I just can't.","2025-12-22T14:53:05.123Z"
"bigskybabs.bsky.social","She doesn't have balls. She has integrity and courage. #sharynalfonsi","2025-12-22T13:38:28.394Z"
"bigskybabs.bsky.social","If you want to do a full boycott of #CBS : Showtime, Smithsonian, Paramount+, Simon & Schuster, MTV, Nickelodeon, Showtime, TMC, BET, VH1, TV Land, Comedy Central, Pop TV, and large stakes in CW. Next, the main advertisers who pay for what has become a state propaganda network:","2025-12-22T13:33:30.197Z"
"bigskybabs.bsky.social","Why?","2025-12-22T01:44:27.646Z"
"bigskybabs.bsky.social","AGREED! Also, last Friday's episode on The Daily by NYT was an insightful podcast on the matter.","2025-12-22T06:15:10.360Z"
"bigskybabs.bsky.social","So, @cbsnews.com and @60minutes.bsky.social are a cowardly group of so-called journalists. Did I get that right?","2025-12-22T06:02:21.903Z"
"bigskybabs.bsky.social","Santa Con San Francisco is always a highlight of my year. This year we donated 15-20 toys to SFFD for Toys for Tots and gave out 250 little gifts to random strangers.","2025-12-14T05:33:26.831Z"
"bigskybabs.bsky.social","I swear, Santa! I have been a veeeerrrry good girl. 😉","2025-12-13T05:27:20.621Z"
"bigskybabs.bsky.social","Today would be a great day to call 202.456.1111 and demand the release of the unredacted Epstein files. Saying it here really does nothing. CALL the Whitehouse and make your voice be heard. They tally calls by topic.","2025-12-12T15:27:35.983Z"
"bigskybabs.bsky.social","Remember kids, Santa is just another man getting credit for the unpaid labor of a woman behind the scenes.","2025-12-11T17:27:58.686Z"
"bigskybabs.bsky.social","Whomever requested the noods, here they are. #whatveganseat","2025-12-10T02:36:41.907Z"
"bigskybabs.bsky.social","Cranberry sauce is the chutney of America. Fight me.","2025-11-27T07:31:42.539Z"
"bigskybabs.bsky.social","Wanna shop for a better world? That starts with ditching Amazon, Target, and Walmart. I want you to write down these 2 websites that will help you break your Amazon addiction and actually make the world better. Are you IN?!","2025-11-25T20:14:22.276Z"
"bigskybabs.bsky.social","White people who have never had mac-n-cheese at Thanksgiving, you need to cultivate some black friends. 😉","2025-11-25T16:37:20.753Z"
"bigskybabs.bsky.social","Let's focus on the good people in these times.","2025-11-25T01:46:44.303Z"
"bigskybabs.bsky.social","Incredibly clever protest method. Take note.","2025-11-23T15:50:32.999Z"
"bigskybabs.bsky.social","😳","2025-11-23T08:13:31.534Z"
"bigskybabs.bsky.social","If you wanted to look at Epstein's birthday book click the jolded word """"here"""" and open PDF 1: oversight.house.gov/release/over...","2025-11-21T07:44:19.627Z"
"bigskybabs.bsky.social","Poppy says she'll cut a certain piggy if we need her to. 😼","2025-11-20T23:11:06.195Z"
"bigskybabs.bsky.social","Find a spine!","2025-11-20T20:56:15.172Z"
"bigskybabs.bsky.social","It's about the girls these women once were. Let's stand up for them as we should have back then. #releasetheEpsteinFiles","2025-11-17T18:04:23.644Z"
"bigskybabs.bsky.social","Let's not focus on the salacious news that Trump blew Clinton. What happens between grown men doesn't matter. What men do to girls, does. #ReleaseTheEpsteinFiles","2025-11-14T20:43:45.544Z"
"bigskybabs.bsky.social","Today would be a good day to call the Whitehouse and tell them to stop protecting pedophiles. They log calls by topic. Put the pressure on Repubs to TURN ON TRUMP. 202-456-1111","2025-11-14T19:10:45.372Z"
"bigskybabs.bsky.social","Here is a list of people I love, whom I would protect if their name was in the Epstein files:","2025-11-14T18:54:21.152Z"
"bigskybabs.bsky.social","So, did I hear this right? Bill Clinton is in the Epstein files because Trump gave him a BJ? I mean, we know Clinton loves those.","2025-11-14T08:32:16.838Z"
"bigskybabs.bsky.social","President (state your name) is the dumbest m-fer ever, and keeps getting dumber, which I didn't think was possible.","2025-11-11T20:56:28.627Z"
"bigskybabs.bsky.social","I would like to thank my two senators for not being weak-ass Dems: @schiff.senate.gov and Senator Alex Padilla. I see, and appreciate you standing strong against this fascist regime.","2025-11-11T06:15:05.615Z"
"bigskybabs.bsky.social","Just a friendly reminder that you can look up donations to any candidate, including weak-ass Dems, at fec.gov/data by name. For instance, if you want to see who the late Jeffrey Epstein donated to. 😉","2025-11-11T05:00:38.481Z"
"bigskybabs.bsky.social","Frank Sinatra Junior 😉 is such a stellar human being and thorough reporter I can hardly stand it. Please heed his warning:","2025-11-11T03:25:26.823Z"
"bigskybabs.bsky.social","White families ARE the face of Trump's Hunger Crisis, statistically speaking...","2025-11-11T02:53:15.510Z"
"bigskybabs.bsky.social","Imagine us, giving Dems what we gave them last Tuesday, and having them screw us by trusting Republicans. #WeakDemsMustGo","2025-11-11T02:42:47.805Z"
"bigskybabs.bsky.social","The only thing you really need to ask yourself, is how much did the pardonees pay to be pardoned by their fellow criminal? #trumppardonscriminals","2025-11-11T02:08:35.593Z"
"bigskybabs.bsky.social","Oh, my gosh. I am so glad the Dems got a pinky promise from the Republicans on health care. What could POSSIBLY go wrong? 🙄😡","2025-11-10T21:04:55.110Z"
"bigskybabs.bsky.social","Another way I go #plasticfree is to buy flowers at my local farmers market, where the grower wraps them in paper and appreciates my patronage. Shopping locally also fights corporate greed.","2025-11-09T21:16:50.655Z"
"bigskybabs.bsky.social","I designed and am making my signs for tomorrow. #NoKings","2025-10-17T19:06:13.953Z"
"bigskybabs.bsky.social","I don't know about you, but my sign is going to say I love America but hate fascism. #nokingsprotest","2025-10-17T16:55:35.086Z"
"bigskybabs.bsky.social","Today would be a great day to call your democratic senators (2) and rep in Congress (1) to encourage them to stand strong during the shutdown so we don't lose healthcare subsidies. 202.224.3121 connects you to any and all. You don't even need to know their names.","2025-10-17T16:53:54.022Z"
"bigskybabs.bsky.social","I never pegged him as a full Brazilian wax sorta guy. #TimeMagazinecover","2025-10-15T00:43:50.186Z"
"bigskybabs.bsky.social","Images from my corner of this liberal hell scape:","2025-10-12T03:00:49.585Z"
"bigskybabs.bsky.social","Oh, so now they are shooting priests at peaceful protests with pepper balls in Chicago. 😡 #ourstreets","2025-10-08T15:02:41.169Z"
"bigskybabs.bsky.social","Would you cut your carbon footprint in half if it was easy and delicious? Let #meatlessmonday inspire you to eat more plant based meals overall. In times when we feel helpless, action is the antidote to despair.","2025-10-06T20:18:00.322Z"
"bigskybabs.bsky.social","Calling in the Guard to assist with this?","2025-10-06T02:42:01.542Z"
"bigskybabs.bsky.social","@nike is supplying new masks to ICE agents. Anyone going to buy Nike now or are we going to keep claiming our power with our dollars until they understand who is actually in charge here? #fuckice","2025-10-06T13:54:42.987Z"
"bigskybabs.bsky.social","For anyone posting #RIPJaneGoodall, ask yourself what would Jane eat?, and do that.","2025-10-03T05:19:21.781Z"
"bigskybabs.bsky.social","Today would be a great day to call your reps in Congress (you have 2 senators and 1 rep) and tell them to stand strong, don't cave! 202.224.3121 is the congressional switchboard. You don't even need to know their name. Now, get on it!","2025-10-01T17:28:50.666Z"
"bigskybabs.bsky.social","Can anyone in Portland tell me what hotel chain is putting up the traitors invading that city? We need to boycott any and all hotel chains involved in housing ICE and Natl Guard.","2025-09-29T19:41:16.506Z"
"bigskybabs.bsky.social","Some nice posters on my morning walk. Going to head over to the Black Panther anti fascist trainings.","2025-09-29T17:41:59.516Z"
"bigskybabs.bsky.social","My name is Captain Dylan Blaha, and I’m an antifascist. I’ve served for nearly 13 years, including a tour in Afghanistan and three years in Germany. Yesterday, Trump designated """"Antifa"""" as a terrorist organization. Apparently it's now terrorism in America to be against fascism.","2025-09-19T05:25:54.113Z"
"bigskybabs.bsky.social","The contractor who hired undocumented immigrants to install a new roof and then called ICE so he didn't have to pay them is Todd Shuh of Mount Baker Construction in Washington State. Good luck finding workers in the future, Todd. The WA Dept of Labor is 800.647.0982","2025-09-29T13:56:52.539Z"
"bigskybabs.bsky.social","BREAKING NEWS: Tylenol researchers just discovered a disturbing link between Donald Trump and Jeffrey Epstein. #ReleaseTheEpsteinFiles","2025-09-29T05:41:05.840Z"
"bigskybabs.bsky.social","My genius vendor who cuts and bends metal for various sign projects always includes candy in my order. The dopamine surge of that on top of my always perfect order, is almost too much. This is my way of begging you to dump Amazon in favor of relationships with small biz.","2025-09-26T01:50:13.129Z"
"bigskybabs.bsky.social","Well, that explains it.","2025-09-23T21:31:22.560Z"
"bigskybabs.bsky.social","Here is a link to advertisers on Sinclair Broadcast stations who won't air #JimmyKimmel organized by state: reddit.com/r/television/comments/1no5592/list_of_abc_sinclair_owned_station_advertisers You know what to do! 😜","2025-09-23T17:31:03.251Z"
"bigskybabs.bsky.social","I set a record for the most ever spent to fill my EV up: 17.38 for a full tank. I was shocked, and then grateful I am spoiled to rarely spend over $10 a week. #EVDriversKickGas","2025-09-23T17:23:56.843Z"
"bigskybabs.bsky.social","Cancelled my Hulu subscription today and gladly told those cowards that they care more about money than free speech. I look forward to more local, in-person entertainment options with real people. #jimmykimmel #freespeech #fucktrump","2025-09-19T16:18:55.910Z"
"bigskybabs.bsky.social","Guns are still bad. #CharlieKirk","2025-09-10T22:01:47.423Z"
"bigskybabs.bsky.social","Ice is in my town tonight, terrorizing small businesses in Oakland.","2025-08-15T04:44:19.489Z"
"bigskybabs.bsky.social","So, Ghislaine Maxwell is allowed to leave the minimum security prison for work, and her """"work"""" was being a sex trafficker. Did I get that right?","2025-08-12T14:53:59.742Z"
"bigskybabs.bsky.social","He thinks deploying the National Guard will distract us from this:","2025-08-12T14:42:31.945Z"
"bigskybabs.bsky.social","Friends don't let friends shop prime days, today, tomorrow or any day. stop handing money to billionaires. #boycottAmazon #NoPrime","2025-07-10T07:12:30.975Z"
"bigskybabs.bsky.social","I hugged so many beautiful queer people at #sanfranciscopride today while wearing my late friend Hugh 's gayest of gay accessories and shrug.","2025-06-30T04:46:41.568Z"
"bigskybabs.bsky.social","#nomocuomo. That's it. That's the post.","2025-06-24T20:17:48.861Z"
"bigskybabs.bsky.social","So our wanna-be-king just kicked a hornets nest and the hornets are North Korea, China and other regimes supporting Iran, did I get that right? #impeach47 #noweaponsofmassdestruction #nowar","2025-06-23T04:45:36.674Z"
"bigskybabs.bsky.social","The most notable thing about the #NoKings protest in Oakland, is that there were no cops to be seen. Zero. Nada. And we didn't need them.","2025-06-15T05:49:11.962Z"
"bigskybabs.bsky.social","#nokings Show me your signs and I will show you mine:","2025-06-15T00:34:29.434Z"
"bigskybabs.bsky.social","I'm attending No Kings's event, “NO KINGS East Bay” - sign up now to join me! www.mobilize.us/nokings/even...","2025-06-12T00:40:07.585Z"
"bigskybabs.bsky.social","The real story here, isn't about the veiled threats between these two clowns, but the fact that these adult men are completely emotionally dis-regulated and unhinged. They have no qualifications to be leaders of a business or a country. #menaresoemotional","2025-06-06T14:30:19.482Z"
"bigskybabs.bsky.social","@kairyssdal.bsky.social just said the press secretary was LYING about the budget about to be passed not increasing this nation's debt. It in fact raises it by 3.3 trillion. I didn't realize how much I needed to hear the media call liars out for their lying. More of this, please!","2025-05-19T23:30:17.385Z"
"bigskybabs.bsky.social","I hate that we now have two highly qualified female presidential candidates going on the I Told You So tour.","2025-05-01T16:35:49.973Z"
"bigskybabs.bsky.social","Mike Waltz has left the chat.","2025-05-01T15:50:24.643Z"
"bigskybabs.bsky.social","Dear elected Dems. Unless you do something commensurate with the crap that is going on in this country, don't ask me for another dime! Due process is gone, a judge has been arrested, for crying out loud LEAD! #constitutionalcrisis","2025-04-25T21:44:49.935Z"
"bigskybabs.bsky.social","Did you know that 91% of rainforest destruction is to clear land to raise cows? We need oxygen. We don't need beef. Cut your personal carbon 👣 in 1/2 by eating plantbased. #ditchbeef #vegan","2025-04-23T07:15:44.820Z"
"bigskybabs.bsky.social","Call your reps every day and keep the pressure up to get rid of all the bad actors propping up Trump. 202.224.3121 connects you with any and all Congress members. 202.456.1111 gets you to the Whitehouse switchboard.","2025-04-21T17:24:54.494Z"
"bigskybabs.bsky.social","Just spoke with a wonderful client who owns a fabulous garden nursery and store. Overnight she is getting slapped with 15% increase for all garden furniture from a vendor she has been loyal to for years. This strong small biz is the 💚 of its community. #tarrifftax","2025-04-05T00:41:27.797Z"
"bigskybabs.bsky.social","Poppy says hi! She also says fuck Elon Musk.","2025-04-03T04:50:13.539Z"
"bigskybabs.bsky.social","Imagine if every Democrat spoke for a full day in succession, how the news cycle would be occupied with people talking about what Republicans are actually doing to this country.","2025-04-02T03:31:20.046Z"
"bigskybabs.bsky.social","Wisconsin understood the assignment. #ThankYouWisconsin","2025-04-02T03:29:49.620Z"
"bigskybabs.bsky.social","No one is more patient than a cat sitting below a window-mounted bird feeder waiting for her friends. 😼","2025-03-12T15:54:34.882Z"
"bigskybabs.bsky.social","Somehow I bought, and lost, a heavy sack of cat litter. Where would a bag of cat litter disappear?","2025-03-10T03:07:04.986Z"
"bigskybabs.bsky.social","Michael Fanone has zero fucks left to give and it is refreshing. #truthtopower","2025-01-27T20:31:53.854Z"
"bigskybabs.bsky.social","I am re-facing my dry erase board (you'll still be able to write on it as I have a film laminate that turns any surface into a dry erase surface) and am debating on the background art. Please weigh in on your favorite. A B C D E F G H I","2025-01-27T19:57:19.407Z"
"bigskybabs.bsky.social","America took a massive shit in 2020 and in 2024, decided to shove that poop right back inside it. 🤮","2025-01-20T22:21:08.609Z"
"bigskybabs.bsky.social","I heard that the people of Dubai don't like the Flintstones. 🙄 But, apparently, the people of Abudabi do! 😜","2025-01-18T06:34:13.738Z"
"bigskybabs.bsky.social","Another meal, another day of cutting my personal footprint in half by choosing plant-based meals over animal-based meals. I call it delicious activism. If you hate seeing the suffering caused by climate disasters, join me. It's easy and delectable. #dietforaburningplanet #eatveg","2025-01-18T04:34:12.094Z"
"bigskybabs.bsky.social","So Mr. Tough Guy is afraid of a little cold weather? I guess if it shrank from shrinkage, it would disappear. 🍄 #crowdsize","2025-01-17T21:20:46.227Z"
"bigskybabs.bsky.social","Wednesday I made this sweet potato chickpea curry, spiced rice, And other food for 25+ people for about $200 including spices. Eating plant based is NOT expensive, and saves money in healthcare and climate mitigation. Do something delicious for the planet today. 🌍 #dietforclimate #govegan","2025-01-17T21:02:58.937Z"
"bigskybabs.bsky.social","Just a reminder that when you see someone drowning, you don't ask """"what can I do to help?"""". You just help. Same goes for fire victims. Buoy their spirits with action or cash.","2025-01-11T19:26:27.623Z"
"bigskybabs.bsky.social","Some of you know I recently lost everything I own when my uhaul was stolen. Poppy and I have been working hard at rebuilding and she loves her new sofa. The little pillow was made my my daughter in sewing camp years ago and was something I found in the rubble of what was left in my truck. #caturday","2025-01-11T19:02:50.241Z"
"bigskybabs.bsky.social","Poppy in my new place on my amazing FB Marketplace chairs, originally 2k each bought for 300 from a stager. John Hutton design for Donghia. If she scratches these...","2025-01-10T17:01:03.597Z"
"bigskybabs.bsky.social","Every day you can easily and deliciously cut your carbon footprint in half by replacing animal based meals with plants based meals. Every day you can cut 20 lbs of carbon, save 1,100 gallons of water while enjoying your food just as much. Or we can keep watching the planet burn. It is up to us.","2025-01-10T16:59:18.158Z"
"bigskybabs.bsky.social","Politely asking corporate America to stop causing climate destruction is not working. The single most impactful action an individual can take to reduce carbon is to eat plants. The next is to drive an electric vehicle. If you are horrified by the extreme weather disasters, do something to change it.","2025-01-09T16:48:08.660Z"
"bigskybabs.bsky.social","My Wasband's childhood home in #pacficpalisades is surrounded by fire. It is the second house on the left side of Bellino. He had been fixing it up to rent to pay for his dad's dementia care. 😭 He remodeled it many years ago and I am sad for him if it doesn't survive.","2025-01-08T08:19:37.625Z"
"bigskybabs.bsky.social","My entire uhaul of belongings was stolen early this morning just hours before I closed my new home. Arizona license plate AE66717 stolen from Emeryville between 6:30 and 6:50 am. Bay area peeps please look for it. It is everything to me. Art, photos, everything. 😭😭😭","2024-12-13T21:48:52.726Z"
"bigskybabs.bsky.social","Too many murders happen every day, but when a CEO who made millions off denying care to patients in need gets shot, all available resources are dispensed. Piss all the way off. He doesn't matter any more than anyone else.","2024-12-09T18:00:40.454Z"
"bigskybabs.bsky.social","Hoteling it with my cat who, in the middle of the night realized we are in a wall to wall scratching post. Yeah, this innocent baby:","2024-12-09T16:50:17.971Z"
"bigskybabs.bsky.social","So, this week I cried on a call with my home insurance provider, my realtor, and my mortgage consultant. Will I ever close on this friggin house?","2024-12-06T23:32:41.775Z"
"bigskybabs.bsky.social","My calendar predicted my tsunami evacuation this month:","2024-12-05T22:44:09.485Z"
"bigskybabs.bsky.social","I am happy to report that after 9 days and 56 Facebook Marketplace DMs I found the perfect home for my free sofa. 🤣","2024-12-04T23:27:50.810Z"
"bigskybabs.bsky.social","So, I am moving and I ask my grown daughters, who are here for TG, if they wanna go through the stuffed animals to see if there are any they want. My youngest, 22, says YOu CANT THROW THEM AWAY! Didn't you see Toy Story? 🤣","2024-12-01T19:42:17.512Z"
"bigskybabs.bsky.social","I wrote Biden a card after he stepped out of the race. Today I got this letter on Whitehouse stationary with a sharpie signature. 🥰😭","2024-11-24T18:05:35.047Z"
