"user","post","date"
"bigskybabs.bsky.social","Please call 202-456-1111 and request Biden order FBI background checks of Trump's cabinet picks. The more of us calling, the better.","2024-11-23T16:50:20.146Z"
"bigskybabs.bsky.social","BEFORE you start holiday shopping, consider this: If you spend $1 on Amazon, less than 5¢ stays in your community. If you shop locally, 68¢ stays in your community. Stop buying billionaires more yachts. How you spend shapes the world.","2024-11-22T16:14:20.996Z"
"bigskybabs.bsky.social","Social media influencers are good story tellers. They just don't bother themselves too much with facts.","2024-11-22T02:42:04.221Z"
"bigskybabs.bsky.social","Apparently fucking your cousin leads to higher STIs. 😬","2024-11-22T02:29:00.523Z"
"bigskybabs.bsky.social","You DO know that all these outrageous appointments are merely distractions for the incoming president to make billionaires richer with even more power, RIIGHT? 🙂‍↔️","2024-11-21T23:09:28.138Z"
"bigskybabs.bsky.social","It is a slow start for me over here on blue sky, as I am moving into a new home I BOUGHT in California. Didn't think it could be done, but my ladies (realtor and mortgage broker) made it fucking happen. If I have not followed you back, I WILL. Just feels like moving 2 homes at the same time. 😉","2024-11-21T15:24:21.017Z"
"bigskybabs.bsky.social","I know I owe a LOT of follow backs and I WILL get to that. Still trying to get verified here as the code isn't showing up in my email.","2024-11-20T17:32:20.546Z"
"bigskybabs.bsky.social","My kids' cat won pet of the month in their apartment building. She is a star in all of the elevators and stairwells. 😻","2024-11-20T17:25:30.571Z"
"bigskybabs.bsky.social","OMG this follow all on the starter pack is genius. Hey, Everybody! Here is a view from the San Francisco Bay today. Not bad!","2024-11-12T17:46:08.681Z"
