"user","post","date"
"gatsby-girl.bsky.social","Virginia's off-year elections are coming up. This is the first chance for voters to weigh in on Trump's 2nd term. Democrats are fighting to maintain razor-thin legislative majorities. Donate to @VADems and Please Retweet","2025-11-01T23:04:37Z"
"gatsby-girl.bsky.social","Medicaid Cuts Kill 🔻900 billion cuts to Medicaid 🔻16 million lose their healthcare 🔻Hundreds of hospitals close 🔻Hundreds of nursing homes close Trump must be stopped! Show your support with a donation and Please Retweet!","2025-10-31T02:21:16Z"
"gatsby-girl.bsky.social","Trump's egregious abuse of power must be stopped! Democrats need your support to win the House and hold Trump and the Republicans accountable. Donate to support our cause and Please Retweet! https://secure.actbl... .","2025-10-30T15:48:34Z"
"gatsby-girl.bsky.social",".....","2025-10-29T19:09:34Z"
"gatsby-girl.bsky.social","@VADemocrats need your help to ensure everyone has access to the polls and every vote is counted. Volunteer Poll Observers flag potential issues at polling sites and work with the party to protect voters. Sign up here for online training:","2025-10-26T23:05:15Z"
"gatsby-girl.bsky.social","Virginia's off-year elections are coming up. This is the first chance for voters to weigh in on Trump's 2nd term. Democrats are fighting to maintain razor-thin legislative majorities. Donate to @VADems and Please Retweet","2025-10-25T23:05:16Z"
"gatsby-girl.bsky.social","Abigail Spanberger is poised to become the Virginia's first woman governor. A victory here will show the country the Democrats are fighting back against Trump's Project 2025 agenda. Please donate and share this link!","2025-10-24T15:48:35Z"
"gatsby-girl.bsky.social","Donald Trump is destroying the White House, the People's House! This egregious abuse of power must be stopped Democrats need your support to win the House and hold MAGA accountable. Donate to support our cause and Please Retweet!","2025-10-24T11:41:34Z"
"gatsby-girl.bsky.social","Medicaid Cuts Kill 🔻900 billion cuts to Medicaid 🔻16 million lose their healthcare 🔻Hundreds of hospitals close 🔻Hundreds of nursing homes close Trump must be stopped! Show your support with a donation and Please Retweet!","2025-10-24T02:21:16Z"
"gatsby-girl.bsky.social","Mom's 'Irresponsible' Act Revealed In New Reports On 5-Year-Old's Fall From Cruise","2025-10-23T23:04:09Z"
"gatsby-girl.bsky.social","White House Denies That It’s Considering Commuting Sean ‘Diddy’ Combs' Sentence","2025-10-23T19:09:33Z"
"gatsby-girl.bsky.social","Cracker Barrel CEO Reveals Big Reason Behind Failed Logo Redesign Julie Felss Masino dismissed talk of an """"ideological"""" reason for the reimagined logo that fueled right-wing backlash","2025-10-23T15:48:35Z"
"gatsby-girl.bsky.social","Trump's egregious abuse of power must be stopped! Democrats need your support to win the House and hold Trump and the Republicans accountable. Donate to support our cause and Please Retweet! https://secure.actbl... .","2025-10-23T11:41:34Z"
"gatsby-girl.bsky.social","...","2025-10-23T02:20:33Z"
"gatsby-girl.bsky.social",".........","2025-10-22T23:04:34Z"
"gatsby-girl.bsky.social","This is appalling. Graham Platner's racist commentary is disqualifying for a United States Senator. Donate to Janet Mills for Maine Senate here and Please Retweet! https://secure.actbl... .","2025-10-22T19:09:35Z"
"gatsby-girl.bsky.social",".....","2025-10-22T15:48:35Z"
"gatsby-girl.bsky.social","...........","2025-10-21T23:04:35Z"
"gatsby-girl.bsky.social","Roughly three million Americans canceled the streaming service in the month that it temporarily suspended Jimmy Kimmel’s show. About 4.1 million people canceled Hulu.","2025-10-21T19:09:34Z"
"gatsby-girl.bsky.social","How Many Votes Did The 'No Kings' Rallies Mobilize For Democrats?","2025-10-20T19:10:15Z"
"gatsby-girl.bsky.social","@VADemocrats need your help to ensure everyone has access to the polls and every vote is counted. Volunteer Poll Observers flag potential issues at polling sites and work with the party to protect voters. Sign up here for online training:","2025-10-19T23:04:34Z"
"gatsby-girl.bsky.social","Virginia's off-year elections are coming up. This is the first chance for voters to weigh in on Trump's 2nd term. Democrats are fighting to maintain razor-thin legislative majorities. Donate to @VADems and Please Retweet","2025-10-18T23:04:35Z"
"gatsby-girl.bsky.social","This is appalling. Graham Platner's dismissive attitude about sexual assault is disqualifying for a United States Senator. Donate to Janet Mills for Maine Senate here and Please Retweet!","2025-10-18T19:09:35Z"
"gatsby-girl.bsky.social","Hakeem Jeffries: “I'm not sure if Karoline Leavitt is demented, ignorant, a stone cold liar, or all of the above.” 🔥 🔥 🔥 🔥 Democrats MUST retake the House and make Hakeem Jeffries Speaker! Donate here and Please Retweet!","2025-10-18T15:49:14Z"
"gatsby-girl.bsky.social","University of Virginia declines to sign Trump administration’s higher-education proposal","2025-10-18T11:41:35Z"
"gatsby-girl.bsky.social","Medicaid Cuts Kill 🔻900 billion cuts to Medicaid 🔻16 million lose their healthcare 🔻Hundreds of hospitals close 🔻Hundreds of nursing homes close Trump must be stopped! Show your support with a donation and Please Retweet!","2025-10-16T02:20:36Z"
"gatsby-girl.bsky.social","An American flag altered to include an image of a swastika was found in Rep. Dave Taylor’s office. U.S. Capitol Police were called to investigate.","2025-10-15T23:05:08Z"
"gatsby-girl.bsky.social","Trump's egregious abuse of power must be stopped! Democrats need your support to win the House and hold Trump and the Republicans accountable. Donate to support our cause and Please Retweet! https://secure.actbl... .","2025-10-15T02:20:35Z"
"gatsby-girl.bsky.social",".....","2025-10-14T15:48:35Z"
"gatsby-girl.bsky.social","@VADemocrats need your help to ensure everyone has access to the polls and every vote is counted. Volunteer Poll Observers flag potential issues at polling sites and work with the party to protect voters. Sign up here for online training:","2025-10-12T19:09:35Z"
"gatsby-girl.bsky.social","Virginia's off-year elections are coming up. This is the first chance for voters to weigh in on Trump's 2nd term. Democrats are fighting to maintain razor-thin legislative majorities. Donate to @VADems and Please Retweet","2025-10-11T11:41:35Z"
"gatsby-girl.bsky.social","Medicaid Cuts Kill 🔻900 billion cuts to Medicaid 🔻16 million lose their healthcare 🔻Hundreds of hospitals close 🔻Hundreds of nursing homes close Trump must be stopped! Show your support with a donation and Please Retweet!","2025-10-11T02:20:34Z"
"gatsby-girl.bsky.social","Trump's egregious abuse of power must be stopped! Democrats need your support to win the House and hold Trump and the Republicans accountable. Donate to support our cause and Please Retweet!","2025-10-10T23:04:38Z"
"gatsby-girl.bsky.social","Republicans control all three branches of government. This is THEIR shit show! Democrats MUST retake the House. We will expose MAGA and make them answer for their crimes. Donate to support Democrats in the midterms. Please Retweet","2025-10-10T19:09:33Z"
"gatsby-girl.bsky.social","Virginia's off-year elections are coming. This is the first chance for voters to weigh in on Trump's 2nd term. Democrats are fighting to maintain razor-thin legislative majorities. Donate to @VADemocrats and Please Retweet","2025-10-10T11:42:17Z"
"gatsby-girl.bsky.social","........","2025-10-10T02:20:35Z"
"gatsby-girl.bsky.social","......","2025-10-09T23:05:15Z"
"gatsby-girl.bsky.social","Broadway shows are picking Baltimore to launch national tours. Here’s why.","2025-10-09T15:48:35Z"
"gatsby-girl.bsky.social","Supreme Court won’t hear Ghislaine Maxwell sex-trafficking conviction appeal","2025-10-09T11:42:24Z"
"gatsby-girl.bsky.social","Supreme Court turns away Missouri’s bid to revive gun law","2025-10-09T02:20:39Z"
"gatsby-girl.bsky.social","Medicaid Cuts Kill 🔻900 billion cuts to Medicaid 🔻16 million lose their healthcare 🔻Hundreds of hospitals close 🔻Hundreds of nursing homes close Trump must be stopped! Show your support with a donation and Please Retweet!","2025-10-08T23:05:19Z"
"gatsby-girl.bsky.social","Abigail Spanberger is poised to become the Virginia's first woman governor. A victory here will show the country the Democrats are fighting back against Trump's Project 2025 agenda. Please donate and share this link!","2025-10-08T19:09:36Z"
"gatsby-girl.bsky.social","The Nobel Prize in medicine goes to 3 scientists for work on the human immune system","2025-10-08T15:48:36Z"
"gatsby-girl.bsky.social","@VADemocrats need your help to ensure everyone has access to the polls and every vote is counted. Volunteer Poll Observers flag potential issues at polling sites and work with the party to protect voters. Sign up here for online training:","2025-10-08T11:41:37Z"
"gatsby-girl.bsky.social","Trump's egregious abuse of power must be stopped! Democrats need your support to win the House and hold Trump and the Republicans accountable. Donate to support our cause and Please Retweet! https://secure.actbl... .","2025-10-08T02:21:14Z"
"gatsby-girl.bsky.social","..","2025-10-07T23:04:35Z"
"gatsby-girl.bsky.social","White House memo says furloughed federal workers aren't entitled to back pay","2025-10-07T19:10:34Z"
"gatsby-girl.bsky.social","Medicaid Cuts Kill 🔻900 billion cuts to Medicaid 🔻16 million lose their healthcare 🔻Hundreds of hospitals close 🔻Hundreds of nursing homes close Trump must be stopped! Show your support with a donation and Please Retweet!","2025-10-07T16:32:17Z"
"gatsby-girl.bsky.social","The National Failure at the Heart of the Jeffrey Epstein Story","2025-10-07T15:48:33Z"
"gatsby-girl.bsky.social","Democrats need your support to win the House and hold Trump and the Republicans accountable. Donate to support our cause and Please Retweet! https://secure.actbl... .","2025-10-07T12:03:37Z"
"gatsby-girl.bsky.social",".....","2025-10-07T11:41:34Z"
"gatsby-girl.bsky.social","Join Blue Victory War Room for a discussion of what is next for democrats as we plan to fight back against Donald Trump by winning elections and rebuilding democracy.","2025-10-06T23:04:33Z"
"gatsby-girl.bsky.social","US federal shutdown enters sixth day as threat of layoffs looms","2025-10-06T19:09:35Z"
"gatsby-girl.bsky.social",".....","2025-10-06T19:06:09Z"
"gatsby-girl.bsky.social","Trump ordered troop into Memphis and authorized lethal force on U.S. citizens. This is the beginning of dictatorship in America. Donald Trump must be stopped! Donate to Free Memphis and Please Retweet!","2025-10-06T15:37:33Z"
"gatsby-girl.bsky.social","Virginia's off-year elections are coming up. This is the first chance for voters to weigh in on Trump's 2nd term. Democrats are fighting to maintain razor-thin legislative majorities. Donate to @VADems and Please Retweet https://secure.actbl... .","2025-10-06T11:41:16Z"
"gatsby-girl.bsky.social","Abigail Spanberger poised to become the Virginia's first woman governor. Cook Political Report calls this closely-watched race a toss-up. Early support for our candidate is so important. Please donate and share this link! https://secure.actbl... .","2025-10-06T02:20:34Z"
"gatsby-girl.bsky.social","...","2025-10-05T23:04:34Z"
"gatsby-girl.bsky.social","@VADemocrats need your help to ensure everyone has access to the polls and every vote is counted. Volunteer Poll Observers flag potential issues at polling sites and work with the party to protect voters. Sign up here for online training:","2025-10-05T19:10:13Z"
"gatsby-girl.bsky.social","David Hogg's PAC is a Massive Scam! Hogg launched Leaders We Deserve to support primaries against sitting Democrats, but most of the funds went to paying consultants. Donate here to save Democratic incumbents from bad actors like David Hogg!","2025-10-05T15:48:33Z"
"gatsby-girl.bsky.social","Keep up the fight! Donate to Free Portland and Please Retweet! https://secure.actbl... .","2025-10-05T11:42:06Z"
"gatsby-girl.bsky.social","Republican concedes long-unsettled North Carolina court election to Democratic incumbent https://apnews.com/a... m","2025-10-04T15:48:35Z"
"gatsby-girl.bsky.social","Virginia's off-year elections are a month away. This is the first chance for voters to weigh in on Trump's 2nd term. Democrats are fighting to maintain razor-thin legislative majorities. Donate to @VADems and Please Retweet","2025-10-03T19:09:34Z"
"gatsby-girl.bsky.social","Bill Gates announces end of Gates Foundation and decries Elon Musk for Doge cuts Microsoft co-founder accuses Trump ally of ‘killing the world’s poorest children’ by slashing funding to USAID","2025-10-03T15:48:35Z"
"gatsby-girl.bsky.social","Republicans Writing Trump’s ‘Big, Beautiful Bill’ Face Risks on Medicaid","2025-10-03T11:42:12Z"
"gatsby-girl.bsky.social","🧵","2025-10-02T06:36:35.715Z"
"gatsby-girl.bsky.social","Indivisible National is launching Neighbor2Neighbor, a relational canvassing program to support Yes on Prop 50 www.mobilize.us/indivisible/...","2025-10-03T00:55:52.793Z"
"gatsby-girl.bsky.social","Virginia's off-year elections are a month away. This is the first chance for voters to weigh in on Trump's 2nd term. Democrats are fighting to maintain razor-thin legislative majorities. Donate to @VADems and Please Retweet","2025-10-02T23:53:34Z"
"gatsby-girl.bsky.social","F.D.A. Approves a New Generic Abortion Pill (Gift Link)","2025-10-02T23:05:13Z"
"gatsby-girl.bsky.social","🧵","2025-10-02T06:36:35.715Z"
"gatsby-girl.bsky.social","🔥","2025-10-02T00:38:52.507Z"
"gatsby-girl.bsky.social","Trump just ordered the military into Portland and he’s authorized lethal force on U.S. citizens. This is the beginning of dictatorship in America. Donald Trump must be stopped! Donate to Free Portland and please share! https://secure.actbl... .","2025-10-01T20:03:36Z"
"gatsby-girl.bsky.social","Trump has ordered the military into Memphis and authorized lethal force on U.S. citizens. This is the beginning of dictatorship in America. Donald Trump must be stopped! Donate to Free Memphis and Please Retweet! secure.actblue.com/donate/freem... .","2025-10-02T00:32:44.682Z"
"gatsby-girl.bsky.social","Republicans control all three branches of government. This is THEIR shit show! Democrats MUST retake the House so we can expose MAGA and make them answer for their crimes. Donate to support Democrats in the midterms and Please Retweet secure.actblue.com/donate/retak... .","2025-10-02T00:26:56.826Z"
"gatsby-girl.bsky.social","🤬","2025-10-02T00:26:28.300Z"
"gatsby-girl.bsky.social","😢","2025-10-02T00:25:42.435Z"
"gatsby-girl.bsky.social","The First Amendment (And A Court) Punch Back open.substack.com/pub/joycevan...","2025-10-02T00:23:58.191Z"
"gatsby-girl.bsky.social","Lutnick on Epstein: Devine: So how come these other people could hang around him and not see it? Lutnick: They participated. That's what his M.O. was, """"Get a massage"""" And what happened in that massage room, I assume is on video. This guy was the greatest blackmailer ever. That's how he had money.","2025-10-01T23:23:41.000Z"
"gatsby-girl.bsky.social","Trump just ordered the military into Portland and he’s authorized lethal force on U.S. citizens. This is the beginning of dictatorship in America. Donald Trump must be stopped! Please donate to our cause and share this link! secure.actblue.com/donate/freep... .","2025-09-27T22:45:58.719Z"
"gatsby-girl.bsky.social","JESSE WATERS HAS TO FUCKING GO.","2025-09-26T01:55:02.927Z"
"gatsby-girl.bsky.social","House Votes to Rename Gulf of Mexico as Gulf of America, Taking a Symbolic Step Legislation all but certain to die in the Senate but the move puts GOP-led House on record supporting President Trump’s nomenclature","2025-05-08T15:48:34Z"
"gatsby-girl.bsky.social","David Hogg was entrusted to lead the party. Instead, he’s stabbing Democrats in the back! Let's show DNC Chair Ken Martin we won’t stand for Hogg's outrageous attacks on Democratic incumbents. Support our cause with a donation! Please share!","2025-05-04T11:41:34Z"
"gatsby-girl.bsky.social","Virginia's off-year elections are the first chance for voters to weigh in on Trump's 2nd term. Democrats are fighting to maintain razor-thin legislative majorities. Support Virginia Democrats with a donation and share this link! https://secure.actbl... .","2025-05-03T23:04:37Z"
"gatsby-girl.bsky.social","Abigail Spanberger poised to become the Virginia's first woman governor. Cook Political Report calls this closely-watched race a toss-up. Early support for our candidate is so important. Please donate and share this link! https://secure.actbl... .","2025-05-03T19:09:37Z"
"gatsby-girl.bsky.social","John Fetterman faces new spotlight on health, family drama, sparking online uproar Gisele Fetterman reportedly clashed with her husband over support for Israel","2025-05-03T15:49:06Z"
"gatsby-girl.bsky.social","Primary The Squad! We must #StopTheSquad or they will destroy our party! PROPac intends to fund midterm challenges to The Squad and other leftists. ProPAC gave over $200K to Democrats in 2024. Please support our cause and share this link!","2025-04-26T19:09:34Z"
"gatsby-girl.bsky.social","Colleague of Harvard scientist held by ICE warns that foreign scientists are scared","2025-04-26T15:49:13Z"
"gatsby-girl.bsky.social","Democratic lawmakers reacted with ferocity — and some Republicans with cheers — to the Friday arrest of Wisconsin judge Hannah Dugan for allegedly helping an undocumented defendant avoid arrest by ICE agents.","2025-04-25T23:05:03Z"
"gatsby-girl.bsky.social","Abigail Spanberger poised to become the Virginia's first woman governor. Cook Political Report calls this closely-watched race a toss-up. Early support for our candidate is so important. Please donate and share this link! https://secure.actbl... .","2025-04-24T15:49:13Z"
