"user","post","date"
"godless-prog916.bsky.social","Hey, anyone from the trump administration who is looking for people who are critical of this """"president"""" and administration... Right here, motherfuckers... You don't have to jump through hoops to find me. Here I am, assholes.","2026-02-15T20:56:28.743Z"
"godless-prog916.bsky.social","#EpsteinFiles","2026-02-15T21:46:26.904Z"
"godless-prog916.bsky.social","www.alternet.org/trump-seeks-...","2026-02-15T00:41:59.894Z"
"godless-prog916.bsky.social","another guy who never protested before radicalized to the point of tears by watching masked ICE agents terrify children in his neighborhood the Republicans are not ready or mentally capable of comprehending the backlash they have generated","2026-02-14T19:02:06.843Z"
"godless-prog916.bsky.social","A federal tool to check voter citizenship keeps making mistakes. It led to confusion in Texas. www.texastribune.org/2026/02/13/s... #USDemocracy #PoudBlue DHS SAVE program identifies less than 0.01% of voters as non citizens. SAVE disproves Trump’s claim of “massive voter fraud” pushing the SAVE Act","2026-02-14T19:03:44.114Z"
"godless-prog916.bsky.social","It’s mind boggling to me that Odd Job the troll mocks people all day long on Twitter.","2026-02-14T19:19:05.498Z"
"godless-prog916.bsky.social","OMG. are they ALL fucking pedos? www.msn.com/en-us/lifest...","2026-02-14T19:25:43.693Z"
"godless-prog916.bsky.social","I know his lies don't make the news anymore but we must keep trying to get the message out! He talks bollocks!","2026-02-14T08:55:26.997Z"
"godless-prog916.bsky.social","Happy Valentine's Day! We 💙💚💜 democracy, justice, and our community. Monday, we defend what we love. Join the People's Protest: We choose the people. We choose freedom. We choose to dissent. 12-1:30pm Falls Park 601 South Main Street Greenville. www.mobilize.us/mobilize/eve...","2026-02-14T14:22:03.909Z"
"godless-prog916.bsky.social","youtu.be/7VYq-ntaH1k?... THIS DEPLORABLE PIECE OF SHIT THEY BETTER NOT LET THIS FUCK REPRESENT MY BELIEFS TO THE WORLD;","2026-02-14T04:36:05.382Z"
"godless-prog916.bsky.social","Fuck yeah. www.nbcnews.com/politics/202...","2026-02-14T01:28:03.487Z"
"godless-prog916.bsky.social","But Garland and the Dow! What a cretin. theonion.com/pam-bondi-th...","2026-02-13T18:13:02.653Z"
"godless-prog916.bsky.social","The Republican SAVE Act is a sinister ploy to deny millions of Americans their right to vote. I’m a HELL NO.","2026-02-12T20:23:38.036Z"
"godless-prog916.bsky.social","Shit head looking out for his billionaire bud. www.alternet.org/trump-donor-...","2026-02-12T22:07:38.305Z"
"godless-prog916.bsky.social","MORE OF THIS! Resist! apnews.com/article/fede...","2026-02-11T23:05:59.714Z"
"godless-prog916.bsky.social","It’s official: the jobless boom of Trump’s first year back in office was even worse than we originally thought. 2025 was the worst year for job growth outside of a recession since 2003. trib.al/6zWH88F","2026-02-11T22:06:00.139Z"
"godless-prog916.bsky.social","To The MAGAs It May Concern,","2026-02-11T04:50:13.882Z"
"godless-prog916.bsky.social","www.notus.org/congress/hou...","2026-02-11T05:17:40.843Z"
"godless-prog916.bsky.social","we need to talk about that Ring Super Bowl ad","2026-02-10T20:18:04.071Z"
"godless-prog916.bsky.social","Well golly, isn't she a piece of shite? www.comicsands.com/loomer-super...","2026-02-10T20:53:55.300Z"
"godless-prog916.bsky.social","BREAKING: After we sued, DHS withdrew a subpoena seeking personal information about our client who criticized DHS' treatment of a man seeking asylum. This is a win not just for our client, but for everyone’s First Amendment right to speak out without fear of government retaliation.","2026-02-10T18:31:24.637Z"
"godless-prog916.bsky.social","I can see how not everyone speaking Spanish would make it so a lot of people couldn't enjoy Bad Bunny's half-time show. But maybe not everything has to be in English and not everything has to be all about white people and their comfort and their preferences and maybe that's partly the point.","2026-02-10T00:26:05.935Z"
"godless-prog916.bsky.social","Suckass bobbie....Olhttps://www.alternet.org/bad-bunny-kid-rock/?cx_testId=1&cx_testVariant=cx_1&cx_artPos=1&cx_experienceId=EXDEXBKK1F00&cx_experienceActionId=showRecommendations00Y25KV3W4VC16#cxrecs_s","2026-02-10T02:10:47.323Z"
"godless-prog916.bsky.social","Bless the staff who threw Greg Bovino out of their bar. I bet he flew a long ways.","2026-02-08T20:50:38.486Z"
"godless-prog916.bsky.social","I hope this clears up any confusion.","2026-02-08T12:52:22.335Z"
"godless-prog916.bsky.social","Imagine being the most powerful man in the world and being this much of a whiney victim BITCH. Good god what a child","2026-02-09T03:03:28.518Z"
"godless-prog916.bsky.social","Wondering if my mom is watching the halftime show. Those pearls haven't a chance.","2026-02-09T01:35:51.822Z"
"godless-prog916.bsky.social","Can we please get rid of such vulgar billionaires?Democracy Dies in Broad Daylight www.newyorker.com/newsletter/t...","2026-02-08T22:04:25.964Z"
"godless-prog916.bsky.social","Lotta fat old guys telling Olympic athletes that they should be sent home. No one is stopping you from getting off your couches and training to take their spots. Until then, enjoy watching them exercise their free speech rights. Go team USA.","2026-02-08T20:41:44.344Z"
"godless-prog916.bsky.social","I’m watching a lot of petty, mean-spirited haters dunking on Kid Rock on every platform and seriously you all rock.","2026-02-08T18:59:37.309Z"
"godless-prog916.bsky.social","It's always about the messenger and never about the message with them. It's why they hate Obamacare but love the ACA.","2026-02-01T18:30:08.795Z"
"godless-prog916.bsky.social","www.dailykos.com/stories/2026...","2026-02-07T14:58:36.374Z"
"godless-prog916.bsky.social","Gee, if ya want to be trusted, maybe be trustworthy? Cretins. www.msn.com/en-us/news/n...","2026-02-07T15:12:24.170Z"
"godless-prog916.bsky.social","Vive la France!","2026-02-05T10:45:56.014Z"
"godless-prog916.bsky.social","So am I supposed to file this year or what? I want to pay for my local subway and libraries and other public services but I don't want my money going to be embezzled by a child rapist","2026-02-05T17:45:05.534Z"
"godless-prog916.bsky.social","bsky.app/profile/more...","2026-02-07T02:07:48.114Z"
"godless-prog916.bsky.social","Bad Bunny has now joined Taylor Swift as an artist that doesn't make music I am interested in listening to, but has my full support anyway.","2026-02-05T16:57:53.313Z"
"godless-prog916.bsky.social","Where are all the idiots who have defended Trump against claims that he's a racist? He's a virulent racist...and if you support him, you are, too. I said what I said.","2026-02-06T16:35:23.470Z"
"godless-prog916.bsky.social","Virginia did NOT start this, but we are going to finish it. We must to TURN OUT AND VOTE YES for our Redistricting Amendment on Tuesday, April 21. #virginia #vote #redistricting","2026-02-05T19:17:41.942Z"
"godless-prog916.bsky.social","I'm attending Indivisible's event, “February Indivisible Flint & Genesee county” - sign up now to join me! www.mobilize.us/indivisible/...","2026-02-05T23:03:16.837Z"
"godless-prog916.bsky.social","As I was channel surfing this morning, I paused on MS Now (shouldn't have) and it was on long enough to see a commercial from ICE... WHAT THE ACTUAL FUCK?!","2026-02-05T22:49:00.276Z"
"godless-prog916.bsky.social","That Keith Porter and Parady La's names were included in this demonstration is a minor miracle, but this demographic being this vocal and disruptive of """"civility"""" is why you're seeing a bipartisan effort to sweep all this under cover of night.","2026-01-29T03:37:43.099Z"
"godless-prog916.bsky.social","😲","2026-02-05T20:23:26.574Z"
"godless-prog916.bsky.social","I've been voting every few of the last 45 years and have never seen an illegal alien trying to. Thus, I challenge any maga idiot to talk shit about it in my presence.","2026-02-05T20:23:21.688Z"
"godless-prog916.bsky.social","Save it for church, DICK. bsky.app/profile/stri...","2026-02-05T02:17:38.602Z"
"godless-prog916.bsky.social","Feeling a tad enraged at a pile of pragmatic weak tits. (They don't like routinely getting their ass kicked but seems they don't realize they're in a fight.) www.axios.com/2026/02/03/g...","2026-02-03T23:07:16.863Z"
"godless-prog916.bsky.social","FIRED? Who gives a fuck about “fired”?!? How about “send them to jail for life”? And I mean ALL of ‘em.","2026-02-03T02:31:06.148Z"
"godless-prog916.bsky.social","www.propublica.org/article/alex...","2026-02-02T03:29:00.310Z"
"godless-prog916.bsky.social","ILLEGITIMI NON CARBORUNDUM!","2026-01-31T01:25:44.572Z"
"godless-prog916.bsky.social","PAY ATTENTION. RESIST the Trump Nazification of America.","2026-01-31T00:33:06.253Z"
"godless-prog916.bsky.social","What a sad day- losing the wonderful Catherine O’Hara. Loved her since first seeing her on SCTV. May she rest in peace.","2026-01-30T23:28:07.793Z"
"godless-prog916.bsky.social","Taking the United Suckers of America for everything he can. www.cnbc.com/amp/2026/01/...","2026-01-30T03:07:41.790Z"
"godless-prog916.bsky.social","FUCK YEAH www.nbcnews.com/politics/imm...","2026-01-30T00:17:04.101Z"
"godless-prog916.bsky.social","Just watched (sub)Homan's news conference - not reassured or remotely impressed by that thuggish, crooked,slob's mumbling and grumbling macho posturing.","2026-01-29T14:11:15.157Z"
"godless-prog916.bsky.social","An evil, pathologically narcissistic one. www.dailykos.com/stories/2026...","2026-01-29T01:38:46.436Z"
"godless-prog916.bsky.social","🩸🩸🩸 I'm going to post this video every day so we never forget what the 34x POS convicted felon who incites political violence, adjudicated rapist & pedophile Trump did","2026-01-28T18:07:52.635Z"
"godless-prog916.bsky.social","theonion.com/kristi-noem-...","2026-01-28T14:11:43.063Z"
"godless-prog916.bsky.social","www.salon.com/2026/01/26/i...","2026-01-28T03:00:12.399Z"
"godless-prog916.bsky.social","I served my country as a combat veteran for 21-years. I was wounded on the battlefield in Iraq. I served at the Pentagon under presidents from both parties, putting our nation’s safety before politics. You can bet your ass I’m not backing down from the fight against chaos and corruption.","2026-01-27T23:10:15.043Z"
"godless-prog916.bsky.social","The Trump Administration always seems so unaware of what they say is so self-damning. Are you kidding me!? 🗽","2026-01-27T14:07:23.308Z"
"godless-prog916.bsky.social","1/27/2026 - Minneapolis ICE just attempted an illegal entry into the ECUADORIAN CONSULATE to abduct someone They did not have a warrant","2026-01-27T22:01:00.573Z"
"godless-prog916.bsky.social","Okay. Time to call your democratic senators and tell them that Bovino’s demotion and humiliation WILL NOT SUFFICE to fund DHS.","2026-01-27T02:53:47.149Z"
"godless-prog916.bsky.social","Yo, cnn and cBS, you know the deal.","2026-01-27T23:41:37.920Z"
"godless-prog916.bsky.social","I've never been much of a gun guy and I frankly think it was a mistake to be at an ICE operation with one BUT that gang of thugs that ganged up on and executed him must be brought to justice.","2026-01-27T23:38:51.382Z"
"godless-prog916.bsky.social","Don’t trust anything from this White House‼️","2026-01-27T03:30:16.258Z"
"godless-prog916.bsky.social","brass solidarity band performing “stand by me” in the streets of whittier next to alex pretti’s memorial. the crowd started chanting “the people united will never be defeated” so they incorporated it into the song. i love minneapolis","2026-01-27T00:22:41.533Z"
"godless-prog916.bsky.social","Bovino is just the patsy - a noxious and odious fall guy. Stephen Miller is the architect and prime mover of the whole thing. Everything they do is at his direction - often after his threats. As long as he runs policy in the WH, nothing will change no matter how many Bovinos come and go.","2026-01-27T00:17:05.480Z"
"godless-prog916.bsky.social","Small fry. While lotta these mother-lovers higher up the chain need to lose theirs ...for starters www.theatlantic.com/politics/202...","2026-01-27T01:47:17.209Z"
"godless-prog916.bsky.social","If you didn’t call your senators already to demand a no on tomorrow’s funding vote, what’s stopping you from doing it today?","2026-01-26T17:23:57.868Z"
"godless-prog916.bsky.social","Not quite understanding which botder in Minnesota they're sending subHoman to take the lead on this episode of the government terror campaign on citizens. Nor am I in the least reassured or optimistic.","2026-01-26T18:13:12.067Z"
"godless-prog916.bsky.social","Seen in Los Angeles (Credit: Zurita Carpio)","2026-01-25T19:35:51.953Z"
"godless-prog916.bsky.social","Shared with me by a goddess.","2026-01-25T21:04:42.121Z"
"godless-prog916.bsky.social","www.nonviolent-conflict.org/resource/gui...","2026-01-24T20:51:28.519Z"
"godless-prog916.bsky.social","This is a death sentence for America. www.nytimes.com/2026/01/23/h...","2026-01-23T21:08:34.496Z"
"godless-prog916.bsky.social","History repeats itself @surealworld.bsky.social This is Horrible...","2026-01-23T16:50:57.743Z"
"godless-prog916.bsky.social","in case you're curious about how angry Minnesota is about ICE, it was -20 today","2026-01-24T00:38:42.335Z"
"godless-prog916.bsky.social","Ben Damberg protest volunteer: “None of us want to be doing this — I don’t, but we simply cannot stand by as other Minnesotans are being hurt — we will march, we will protest, & we will do it all peacefully above all else”","2026-01-23T20:58:25.458Z"
"godless-prog916.bsky.social","Board of ‘Peace’ by Led Donkeys.","2026-01-23T21:57:13.793Z"
"godless-prog916.bsky.social","What a pity. bsky.app/profile/acyn...","2026-01-23T19:41:31.773Z"
"godless-prog916.bsky.social","Personally, it's been obvious to me every day of the last 10 years that this villain is an affront to our nation's well being and legacy. www.msn.com/en-us/news/n...","2026-01-21T21:19:36.716Z"
"godless-prog916.bsky.social","Can't wait to hear how the orange Chump reacts. www.cnn.com/2026/01/20/p...","2026-01-21T03:34:02.087Z"
"godless-prog916.bsky.social","www.theguardian.com/world/2026/j...","2026-01-20T04:11:09.379Z"
"godless-prog916.bsky.social","😳😳😳😳","2026-01-16T21:34:48.181Z"
"godless-prog916.bsky.social","Are we?","2026-01-15T16:38:06.835Z"
"godless-prog916.bsky.social","Ugh, are any of us surprised? www.npr.org/2026/01/14/n...","2026-01-14T17:33:06.160Z"
"godless-prog916.bsky.social","This definitely applies to too many peeps","2026-01-11T19:03:23.072Z"
"godless-prog916.bsky.social","A Black man was killed by ICE (off duty) in Los Angeles on New Year’s Eve. And like Renée Good, he was an American citizen. But most people have not heard about Keith Porter. I need y’all to realize this. Black people experience this lack of visibility all the time when it comes to being victims.","2026-01-10T15:24:52.997Z"
"godless-prog916.bsky.social","LETTERMAN: “.. CBS News is a wreck. It’s just gone. .. The integrity of CBS News .. has been trampled on, pissed on and eviscerated by these idiots that have taken it over.” @letterman.bsky.social $PSKY youtu.be/CHYksa07oQA?...","2026-01-10T20:26:06.141Z"
"godless-prog916.bsky.social","📫Feel Free to Repost📫 🎞Join For All Daily Clips🎞","2026-01-09T21:04:51.591Z"
"godless-prog916.bsky.social","White Bear Lake High School students walk out of school in protest ✊ Minnesota.","2026-01-09T21:34:03.527Z"
"godless-prog916.bsky.social","JONATHAN DAVID ROSS IS A MURDERER JONATHAN DAVID ROSS IS A MURDERER JONATHAN DAVID ROSS IS A MURDERER JONATHAN DAVID ROSS IS A MURDERER JONATHAN DAVID ROSS IS A MURDERER JONATHAN DAVID ROSS IS A MURDERER","2026-01-09T23:18:28.367Z"
"godless-prog916.bsky.social","ICE agents make approximately $43,665 per year on average. This is Jonathan Ross’s house. Its estimated worth is $663,200 on Zillow. It’s interesting how he can afford a home worth more than 15x his annual income. #Pinks #ProudBlue #JonathanRoss #JusticeForReneeGood","2026-01-09T23:13:00.538Z"
"godless-prog916.bsky.social","Obviously one man couldn’t do all that-we would have been fully rid of him in 2020 had his Republican Party held him to account, or in 2021 had both Republicans in the Senate & Biden’s DOJ held him to account. Plus the Roberts SCOTUS. It’s required hundreds of people for trump to do all this.","2025-12-27T02:58:39.725Z"
"godless-prog916.bsky.social","Wow","2026-01-08T02:51:37.301Z"
"godless-prog916.bsky.social","The most enlightening and disappointing thing to come out of this ICE shooting is that the right legitimately does not give a fuck about human life if it harms their political narrative. Watching people malign a 37 year old mother for being murdered by her country is insane.","2026-01-08T23:50:07.038Z"
"godless-prog916.bsky.social","My pride and affection for our nation has almost entirely evaporated in the last few years. www.theatlantic.com/ideas/2026/0...","2026-01-09T17:11:03.198Z"
"godless-prog916.bsky.social","Conway: This man is violating his oath in myriad ways each and every day. Impeachment is not an option. It is mandatory. It is required. It is morally, constitutionally, and legally obligated.","2026-01-09T00:50:13.773Z"
"godless-prog916.bsky.social","Saw this on Reddit -","2026-01-09T03:47:25.142Z"
"godless-prog916.bsky.social","СВР points gun directly at protester's head. Minneapolis, MN. 22/8/2026","2026-01-09T02:35:10.263Z"
"godless-prog916.bsky.social","Mark Kelly isn't backing down, that's refreshing these days! www.rollingstone.com/politics/pol...","2026-01-07T23:07:45.425Z"
"godless-prog916.bsky.social","100 Days post open heart surgery! Apparently rowing is my new thing.","2026-01-07T16:44:26.837Z"
"godless-prog916.bsky.social","I am so sick of organizations, media outlets, corporations, and politicians bending the knee to this POS. The cowardice is staggering.","2026-01-07T03:25:10.122Z"
"godless-prog916.bsky.social","Actual B.D.E vs crass, juvenile bravado. bsky.app/profile/muel...","2026-01-07T04:37:50.053Z"
"godless-prog916.bsky.social","Crockett: """"Everyone wants to talk about how Maduro was illegitimate. As we sit here on January 6, I do want to be clear: somebody else was trying to be a Maduro of the United States. Somebody else wanted to do the exact same thing. The difference is Maduro was successful.""""","2026-01-06T19:38:23.939Z"
"godless-prog916.bsky.social","Let's never forget what they did! Ever!!!!!!! #January6 #SheShed #DefendersOfDemocracy #VoteBlue","2026-01-06T17:45:48.650Z"
"godless-prog916.bsky.social","It'll work on red hatted deplorables. www.theatlantic.com/magazine/202...","2026-01-06T18:41:43.828Z"
"godless-prog916.bsky.social","MTG's kumbaya act is hilariously pathetic. You ever learn that you can't unsay shit, Margo?","2026-01-06T17:28:29.130Z"
"godless-prog916.bsky.social","Bet! Bitch, would you prefer 'bondistein files'? bsky.app/profile/slap...","2026-01-06T15:24:28.605Z"
"godless-prog916.bsky.social","The Trumpstein files, ooops!","2026-01-06T11:54:19.778Z"
"godless-prog916.bsky.social","Umm, what the fuck is going on in Grand Rapids, MI? Did this young woman just get arrested for speaking out about Venezuela? If this is legit we are now fast walking into fascism, we need to get a lot louder than we have been. It’s about to get ugly, y’all‼️","2026-01-06T00:04:12.016Z"
"godless-prog916.bsky.social","Wild- Trump’s guy Witkoff’s son using his brother’s death to praise Trump’s Venezuela invasion when in reality he died of OxyContin overdose from an American corporation (Purdue) and family (Sacklers) Gross stuff","2026-01-05T18:05:20.150Z"
"godless-prog916.bsky.social","I have no additional comment on Peter Hegseth's actions against Mark Kelly today.","2026-01-05T16:08:42.894Z"
"godless-prog916.bsky.social","Fun Fact: If Maduro was in the Epstein files he'd be safe at home in his bed right now.","2026-01-05T02:21:03.099Z"
"godless-prog916.bsky.social","We're the baddies now. The house the whole neighborhood hates.","2026-01-04T20:35:38.586Z"
"godless-prog916.bsky.social","He wants to be Emperor Palpatine – but on his best day, he's an orange Jabba the Hutt.","2026-01-04T18:16:59.371Z"
"godless-prog916.bsky.social","Come on guys. Give Trump a break. Invading countries and gaslighting the public is exhausting work.","2026-01-04T18:06:42.501Z"
"godless-prog916.bsky.social","CONTACT YOUR REPS!!! When Congress stays silent, it’s not being cautious. It’s abandoning its responsibility. They need to assert their authority now. We need briefings, hearings and accountability @mikethompson.house.gov @schiff.senate.gov @padilla.senate.gov","2026-01-03T18:26:31.188Z"
"godless-prog916.bsky.social","A malignant narcissist is incapable of withstanding ridicule, so please share this as widely as possible. Thanking you all in advance, Mar🐫 🙏 shorturl.at/mcfqd","2025-12-31T20:03:05.477Z"
"godless-prog916.bsky.social","C'mon kids, as much as I love the sentiment.... www.yahoo.com/news/article...","2025-12-30T23:21:59.689Z"
"godless-prog916.bsky.social","I'm just gonna admit that I occasionally miss casually using the R-word (satire notwithstanding). theonion.com/trump-issues...","2025-12-30T23:11:08.834Z"
"godless-prog916.bsky.social","14","2025-12-30T15:14:44.748Z"
"godless-prog916.bsky.social","Next time someone says they don’t have to apologize for being white anymore, ask them to tell about the most recent time they were forced to apologize for being white and who made them do it.","2025-12-29T02:18:13.206Z"
"godless-prog916.bsky.social","This is so fucking GROSS!","2025-12-25T20:41:40.654Z"
"godless-prog916.bsky.social","If you haven’t seen it yet, this site is pretty secure. 🙂","2025-12-24T04:44:43.842Z"
"godless-prog916.bsky.social","Not to seem obtuse but I may have been absent from school on a pertinent day cuz I don't remember ever being taught the definition of 'marco-terrorist'.","2025-12-24T00:53:25.473Z"
"godless-prog916.bsky.social","One positive that I had overlooked...","2025-12-23T13:56:13.176Z"
"godless-prog916.bsky.social","A reminder that whilst MAGA lunatic Nicki Minaj embraces racists and fascists, her husband is a convicted sex offender and her brother is serving 25 years to life in prison for raping an 11 year old. It only makes sense that she would worship the orange rapist.","2025-12-23T03:54:51.901Z"
"godless-prog916.bsky.social","Circulate this shit. bsky.app/profile/mrsb...","2025-12-23T03:32:31.889Z"
"godless-prog916.bsky.social","WATCH: Here's the segment CBS News pulled from """"60 Minutes"""" last night","2025-12-22T22:28:13.320Z"
"godless-prog916.bsky.social","The Onion has always been satire but it'd be plausible. theonion.com/trump-announ...","2025-12-21T23:15:04.367Z"
"godless-prog916.bsky.social","Venezuela is our spotlighted regime of the day; too bad dim donnie(TACO) doesn't have the stones to ever try to bring that same fervor to Russia. apnews.com/article/vene...","2025-12-21T18:57:50.349Z"
"godless-prog916.bsky.social","@mwcartoons.bsky.social","2025-12-18T14:11:56.901Z"
"godless-prog916.bsky.social","theonion.com/trump-assure...","2025-12-18T22:33:12.203Z"
"godless-prog916.bsky.social","Ronald Reagan, a cold man who ignored the AIDS crisis because he was a homophobe and craved the votes of other homophobes, is *not* a reminder of anything good or decent.","2025-12-17T02:28:34.445Z"
"godless-prog916.bsky.social","OK then, what was the action? What has the Trump admin done? What proposals have they made? They have only ever offered “thoughts and prayers” on social media. Nothing else.","2025-12-14T12:14:26.484Z"
"godless-prog916.bsky.social","This is Rose. She's paralyzed in both her back legs from being hit by a car as a stray. But when she sees her wheelchair harness come out, she knows it's time to walk and roll. 14/10 (IG: twopawrose)","2025-12-16T00:12:44.305Z"
"godless-prog916.bsky.social","👇👇👇👇","2025-12-12T15:53:49.305Z"
"godless-prog916.bsky.social","Start naming mass shootings after politicians who take money from the NRA.","2025-12-14T02:14:03.085Z"
"godless-prog916.bsky.social","Too soon?","2025-12-13T02:38:36.371Z"
"godless-prog916.bsky.social","The widow Kirk","2025-12-13T01:58:02.114Z"
"godless-prog916.bsky.social","Oh Indiana Republicans, you remind me of a better day when you were a party of mere assholes, not straight up ASSHOLES.","2025-12-13T02:21:43.209Z"
"godless-prog916.bsky.social","Not even a decent lie from the sumbitch and his administration - two dudes were trying to """"right"""" a 40 foot long boat? Ok, gramps, let's get you to you to bed after a quick tan spray apnews.com/article/trum...","2025-12-11T17:59:32.564Z"
"godless-prog916.bsky.social","Unless it's slid down into his neck, this villain has as much integrity as chin.","2025-12-11T15:22:51.734Z"
"godless-prog916.bsky.social","Aw, so bummer. Bitch, you apparently never heard what happens when you lie down with dogs.","2025-12-09T23:57:48.392Z"
"godless-prog916.bsky.social","one of the leaders of a pack of pathetic sycophants","2025-12-09T01:49:12.466Z"
"godless-prog916.bsky.social","Alina Habba is out as fake US Attorney.","2025-12-08T18:55:12.482Z"
"godless-prog916.bsky.social","“…Even if they are able to clean up his mess … elect a supremely sane president next, America will NEVER again be a trusted partner. Because there are enough Americans who would vote for him … (again). I couldn't even say anything. She was right. The damage this has done is endless…”","2025-12-07T16:15:11.284Z"
"godless-prog916.bsky.social","🔥🔥","2025-12-07T06:23:00.216Z"
