"user","post","date"
"godless-prog916.bsky.social","Sweet Donut- wiggly, goofy, loving boy abt 2die! East Coast- ME, NJ, NY, CT, ME, DC, PA, VA- step up! He’s a great boy! docs.google.com/forms/d/e/1F... 219320ID! HURRY! He’s as sweet as a DONUT and needs tons of reposts!","2025-05-09T15:52:38.128Z"
"godless-prog916.bsky.social","The Gestapo regime has arrested New Jersey Mayor Ras Baraka for trying to do oversight on an immigration facility! Thank You Major for standing up! www.politico.com/news/2025/05...","2025-05-09T23:55:03.832Z"
"godless-prog916.bsky.social","Is This the End of the Separation of Church and State? www.newyorker.com/news/the-led... THIS! Gotdamnded theocracy looming.","2025-05-09T03:47:53.724Z"
"godless-prog916.bsky.social","Loomer...Lunatic.","2025-05-09T02:24:48.981Z"
"godless-prog916.bsky.social","Crockett: Instead of the President cosplaying as the next pope, he may want to cosplay as an actual President of these United States. That means he may have to do a little bit of research and understand that he swore a an oath to defend and protect the constitution.","2025-05-06T00:06:31.310Z"
"godless-prog916.bsky.social","Thanks @mersyme.bsky.social @raykwong.bsky.social @bluebird4us.bsky.social @qm-b.bsky.social @coko.bsky.social @mlipsitt.bsky.social @suzyqfit4u.bsky.social @drios1111.bsky.social @juliindica.bsky.social @journeyled1.bsky.social @jfordemocracy.bsky.social @candybones.bsky.social @6j1.bsky.social","2025-05-05T20:29:54.120Z"
"godless-prog916.bsky.social","www.bbc.com/news/article... This POS!","2025-05-03T06:15:17.425Z"
"godless-prog916.bsky.social","We must fight to save PBS and NPR.","2025-05-02T22:27:51.061Z"
"godless-prog916.bsky.social","Wisconsin Gov. Says He's Not Afraid After Trump Official Suggests Possible Arrest www.huffpost.com/entry/wiscon... Thugs!","2025-05-02T23:30:04.866Z"
"godless-prog916.bsky.social","amp.cnn.com/cnn/2025/05/... Filthy, steaming, Bullshit here.","2025-05-01T19:15:49.080Z"
"godless-prog916.bsky.social","#MomSky Keep Reposting","2025-04-24T22:14:12.161Z"
"godless-prog916.bsky.social","Amen, Alex. They are so terrified of anon-white majority #resist #stopGOPfascism #impeach #saveourdemocracy #nomorebillionaires #nonazis","2025-04-29T12:55:39.707Z"
"godless-prog916.bsky.social","www.forbes.com/sites/antoni... AaaHaHa...pathetic.","2025-04-30T18:56:03.803Z"
"godless-prog916.bsky.social","www.npr.org/2025/04/30/n...","2025-04-30T17:22:02.235Z"
"godless-prog916.bsky.social","OMFG!!🤬","2025-04-29T23:31:43.781Z"
"godless-prog916.bsky.social","www.independent.co.uk/news/world/a... Poor donnie...does the dimwit not realize that we already know pretty much how much his beloved tariffs are raising prices?","2025-04-29T16:41:14.875Z"
"godless-prog916.bsky.social","www.theatlantic.com/politics/arc... Well, the scoundrel did start his rise cosplaying a """"successful """" tycoon.","2025-04-27T00:52:35.245Z"
"godless-prog916.bsky.social","www.msn.com/en-us/news/p... Been waiting fir these sorry assholes to pull this trigger.","2025-04-27T00:14:26.806Z"
"godless-prog916.bsky.social","Priorities.","2025-04-26T16:11:56.127Z"
"godless-prog916.bsky.social","The Guerrilla Marketing Campaign Against Elon Musk www.newyorker.com/news/the-led...","2025-04-26T00:38:00.352Z"
"godless-prog916.bsky.social","bsky.app/profile/just... Bye, Felicia.","2025-04-25T22:47:01.172Z"
"godless-prog916.bsky.social","🚨Georgetown University Law Center students are detailing which law firms have caved and which have stood up to the Trump regime. They have created this spreadsheet: docs.google.com/spreadsheets... Please share widely.","2025-04-03T04:41:32.981Z"
"godless-prog916.bsky.social","🚨🚨🚨BREAKING NEWS: Was just passed this from a fellow service academy grad. A Coast Guard Academy graduate posted this. They are reporting that ICE entered base housing and took a USCG spouse. I can’t confirm this but I’m calling for answers from the Coast Guard and Congress. This is unacceptable.","2025-04-25T00:09:33.009Z"
"godless-prog916.bsky.social","Thanks to the original poster who is somewhere around the internet.","2025-04-13T01:50:15.807Z"
"godless-prog916.bsky.social","According to CDC sources. RFK Jr. has reportedly instructed officials to stay silent on bird flu transmission and avoid testing farm workers with symptoms. This is a direct attempt to suppress vital information. Pandemics begin with secrecy and cover-ups. This administration is a direct threat","2025-04-22T13:39:18.357Z"
"godless-prog916.bsky.social","Good Folks 2 Follow @hourofignorance.bsky.social @sebright.bsky.social @annieandjoe.bsky.social @johngora.bsky.social @cynalbr.bsky.social @bornelderent.bsky.social @barrydc.bsky.social @time4sanity.bsky.social @notbob74.bsky.social @meextra.bsky.social @gdad1x7.bsky.social @justjen9899.bsky.social","2025-04-23T18:00:59.430Z"
"godless-prog916.bsky.social","theonion.com/trump-opens-... got ya!","2025-04-23T23:41:25.900Z"
"godless-prog916.bsky.social","www.theatlantic.com/ideas/archiv... Wow. This is a terrifying must read. please, please, do!","2025-04-23T03:42:37.478Z"
"godless-prog916.bsky.social","bsky.app/profile/lour...","2025-04-22T22:55:20.808Z"
"godless-prog916.bsky.social","HEY KID YOU WANT TO BE SECRETARY OF DEFENSE","2025-04-21T21:16:34.581Z"
"godless-prog916.bsky.social","www.nbcnews.com/news/us-news... Good.","2025-04-22T03:14:06.706Z"
"godless-prog916.bsky.social","Remember my fellow Americans! The Republicans in Congress can STOP all of this at any time. ❌ ☎️ CALL them every single day. Yes they’re spineless cowards but if they feel the tide turning, they may just try to save themselves. Link for phone # s: www.senate.gov/senators/sen... Please share!","2025-04-18T16:57:49.150Z"
"godless-prog916.bsky.social","I'd consider this a 'starter' list.","2025-04-22T02:57:16.580Z"
"godless-prog916.bsky.social","I promise to quit drinking if they give me the job.","2025-04-21T17:30:28.537Z"
"godless-prog916.bsky.social","""""Happy Easter! What a beautiful crowd!” she said. After reading Bunny with a Big Heart, she asked the kids what they learned.“Yes, we need to make friends and take care of them as well,” she told one child.“Kindness, yes,” she responded to another.“I hope to see you next year.” - The 'first lady'.","2025-04-22T01:51:29.711Z"
"godless-prog916.bsky.social","www.salon.com/2025/04/21/s... Wow, only """"the best and brightest """" in this administration. assholes, all.","2025-04-21T18:34:56.349Z"
"godless-prog916.bsky.social","So You Want to Be a Dissident? www.newyorker.com/news/the-wee...","2025-04-21T00:29:41.626Z"
"godless-prog916.bsky.social","www.nytimes.com/2025/04/20/u... This idiot is even dimmer than his boss.","2025-04-20T23:39:36.901Z"
"godless-prog916.bsky.social","www.theguardian.com/us-news/2025...","2025-04-20T22:26:05.858Z"
"godless-prog916.bsky.social","Well, I failed all 7 rules in the last segment, """"What if your . . . family supports the authoritarian regime?' Unless we can manage to impeach his 'dictator wannabe"""" a$$, we got 3 years, 9 months, 4 days, 22 hours, 39 minutes (as of this writing) until his day of reckoning! It is coming!!!!!🇺🇲","2025-04-15T18:25:07.380Z"
"godless-prog916.bsky.social","Everyone now and again I will see someone use the phrase """"woke mind virus"""" seriously and I will wonder what it is like to be them, and to have a head full of rancid pudding where a brain is meant to be","2025-04-20T01:07:46.059Z"
"godless-prog916.bsky.social","oh hell yeah! the security company lost its business license and the men are being charged with battery, false imprisonment, and other violations","2025-04-18T20:36:10.907Z"
"godless-prog916.bsky.social","www.msn.com/en-us/news/u...","2025-04-20T03:20:58.658Z"
"godless-prog916.bsky.social","James Carville Slams Bill Maher As 'Supremely Naive Man' Over Trump Meeting www.huffpost.com/entry/james-... Hey, Bill, ego much?","2025-04-19T21:07:04.656Z"
"godless-prog916.bsky.social","www.theatlantic.com/ideas/archiv...","2025-04-19T20:55:07.099Z"
"godless-prog916.bsky.social","Imagine that: a drunk Fox entertainment host can't run the largest agency in the world. It's a real shocker. www.mediaite.com/politics/the...","2025-04-19T16:58:52.365Z"
"godless-prog916.bsky.social","www.cnn.com/2025/04/18/p... Well, as much as this is a pathetic attempt at trying to re-argue old failures, hopefully it'll distract him a fraction from his war on America.","2025-04-18T22:47:52.987Z"
"godless-prog916.bsky.social","www.businessinsider.com/donald-trump... These fuckin thugs and their hubris. """"That's a nice business ya got there. It would be a shame if something happened to it.""""","2025-04-18T03:18:11.729Z"
"godless-prog916.bsky.social","www.theatlantic.com/politics/arc... I'm not much of an optimist considering the current court.","2025-04-18T02:55:11.415Z"
"godless-prog916.bsky.social","During these interesting (fucked up) times, after tucking the girls in, relaxing with my evening edible and some tunes from my youth is a tiny, much needed balm. Remember to take care of yourself, folks.","2025-04-17T03:17:10.177Z"
"godless-prog916.bsky.social","@realbillmaher.bsky.social Fuck you, dude. You ate officially a scared old White man with bent knees. Sell out.","2025-04-16T22:38:31.092Z"
"godless-prog916.bsky.social","Spray-Painted Penis Only Thing Holding Cybertruck Together","2025-03-24T18:00:09.000Z"
"godless-prog916.bsky.social","www.politico.com/news/2025/04... Are these fucking villains having a contest amongst themselves??","2025-04-16T00:53:33.895Z"
"godless-prog916.bsky.social","www.politico.com/news/2025/04... Theocracy warning.","2025-04-14T01:10:23.824Z"
"godless-prog916.bsky.social","Each week, The Contrarian selects """"Undaunted"""" individuals working to defend democracy This week's spotlight: The Associated Press AP refused to capitulate in the face of authoritarian bullying. Stalwart, unafraid and undaunted—we salute them","2025-04-11T12:33:36.611Z"
"godless-prog916.bsky.social","www.nytimes.com/2025/04/10/u...","2025-04-11T22:42:45.084Z"
"godless-prog916.bsky.social","Meet Lonesome Rhodes","2025-04-11T19:50:18.501Z"
"godless-prog916.bsky.social","www.alternet.org/trump-horror...","2025-04-11T11:44:24.434Z"
"godless-prog916.bsky.social","bsky.app/profile/meid... An evil idiot savant has his own episode of The Twilight Zone (this week, he upends the world's economy, takes a nation backwards 100+ years, and can address the very unfair showerhead crisis)","2025-04-11T03:10:48.144Z"
"godless-prog916.bsky.social","Proud of my fellow Michiganders who came out to support democracy.","2025-04-07T01:49:48.852Z"
"godless-prog916.bsky.social","I may be enjoying my evening edible - correct me if I'm wrong but these 53,000 criminals got away with a whopping $1,300 apiece. I guess even billionaires can still be as thick as a brick...or just full of shit.","2025-04-11T00:53:30.616Z"
"godless-prog916.bsky.social","www.forbes.com/sites/antoni... JFC. IF i were here illegally, I would probably reckon that when they find my ass, I'm in big trouble registered or not. I certainly wouldn't help them with that by putting myself on their list.","2025-04-11T00:38:45.538Z"
"godless-prog916.bsky.social","He just testified all morning about the reasons why the tariff policy was going to make America great. Then he checked his phone and realized everything he just said was canceled on Truth Social.","2025-04-09T18:56:31.538Z"
"godless-prog916.bsky.social","Has Trump’s Legal Strategy Backfired? www.newyorker.com/news/the-led...","2025-04-08T01:11:00.043Z"
"godless-prog916.bsky.social","For the #HandsOff , there were a group of seniors that couldn't make it to the Capitol. So they held their very own! 57 of them came out! Aged 67-104! They all walked down to the main street! So proud of them! They had s sign making day before the event! They sent this video to me to share.🥰","2025-04-08T00:35:37.995Z"
"godless-prog916.bsky.social","www.theatlantic.com/ideas/archiv...","2025-04-07T23:38:29.648Z"
"godless-prog916.bsky.social","Thank you 💙","2025-04-07T03:09:19.291Z"
"godless-prog916.bsky.social","www.thehandbasket.co/p/sackets-ha...","2025-04-07T02:08:29.501Z"
"godless-prog916.bsky.social","THIS IS TERRIFYING‼️ Dr. Peter Marks, former head of vaccines at the FDA, just had his last day—forced to resign or be fired because he wouldn’t lie about vaccines. He gives a chilling warning: the U.S. is unprepared for biowarfare—because the response team has been gutted.","2025-04-05T02:34:51.361Z"
"godless-prog916.bsky.social","www.msn.com/en-us/news/w... But, of course.","2025-04-05T04:52:45.387Z"
"godless-prog916.bsky.social","www.theatlantic.com/politics/arc... Good read.","2025-04-05T03:40:06.102Z"
"godless-prog916.bsky.social","www.msn.com/en-us/money/... I honestly Bennie Hill music playing, like, all the time.","2025-04-05T03:27:03.104Z"
"godless-prog916.bsky.social","Lithuanian president & people paid their respects to 4 American servicemen who died during training exercise. When the soldier’s remains arrived at Dover Air force Base, no US president was there to honor them on behalf of a grateful nation. Trump was golfing & will dine with rich Saudis","2025-04-04T21:54:08.663Z"
"godless-prog916.bsky.social","Gen Z and Millennials: In ten years when we’re still without a cure and you’re caring for your parents, remember what he did.","2025-04-04T21:00:15.775Z"
"godless-prog916.bsky.social","www.theatlantic.com/politics/arc...","2025-04-05T01:00:54.539Z"
"godless-prog916.bsky.social","The more you know!","2025-04-04T02:52:16.921Z"
"godless-prog916.bsky.social","He's devolved into a Neanderthal swing a club.","2025-04-03T01:41:47.936Z"
"godless-prog916.bsky.social","Bright lady. They'd demand it from our side abd they'll spotlight their gargantuan Hypocrisy Or,They'll declare they don't have a problem with doge getting into our shit while high.","2025-04-03T00:05:35.015Z"
"godless-prog916.bsky.social","#secularhumanism","2025-04-02T04:03:32.648Z"
"godless-prog916.bsky.social","G-d has officially joined The Reformers","2025-04-02T03:29:10.441Z"
"godless-prog916.bsky.social","bsky.app/profile/acyn... I've always fairly vaguely and less than completely knowledgly admired this fella... but wow.","2025-04-02T03:30:07.905Z"
"godless-prog916.bsky.social","www.npr.org/2025/04/01/n... Piss off, musk. Like his orange paramour, America, and it's people, are just a big antfarm to f#ck with","2025-04-02T03:24:07.521Z"
"godless-prog916.bsky.social","www.msn.com/en-us/news/n... Litnick. This MAGAsshole may be the next fall guy / discarded useful idiot. (Steffaniked) How many of these bootlickers is dim donnie going to burn through before the survivors begin to awake to their peril? Yay, Depends adult undies for the while team!","2025-04-01T23:58:40.227Z"
"godless-prog916.bsky.social","www.msn.com/en-us/news/n...","2025-04-01T22:14:58.256Z"
"godless-prog916.bsky.social","They are so cute together 💕","2025-02-24T18:40:40.340Z"
"godless-prog916.bsky.social","Fixed it","2025-03-31T23:29:19.034Z"
"godless-prog916.bsky.social","We have yet to receive adequate information from Homeland Security about the recent news of Minnesota students being detained by ICE. Snatching up students who come here legally to work hard and get an education does not make you tough on immigration. We need answers.","2025-03-31T22:58:07.831Z"
"godless-prog916.bsky.social","www.theatlantic.com/culture/arch...","2025-03-31T01:04:48.925Z"
"godless-prog916.bsky.social","ALSO NOT IN A FUCKING CULT!","2025-03-30T18:56:03.009Z"
"godless-prog916.bsky.social","Every year, the IRS loses over a 100 billion dollars because it doesn't tax businesses called """"churches."""" Look into that waste, Elon! youtu.be/37cZqx349xU","2025-03-03T17:20:51.461Z"
"godless-prog916.bsky.social","Corporate Sponsors for The White House Easter Egg Hunt??? 🐣 🐣 🐣 🐣 🐣 #DenOfThieves #WWJD","2025-03-30T11:21:41.745Z"
"godless-prog916.bsky.social","Attention all traditional American allies: Regardless of the current hostility by the current administration, the bulk of America considers you an ally and values your friendship.","2025-03-29T22:41:58.144Z"
"godless-prog916.bsky.social","The cherry blossom trees along the Tidal Basin in Washington, D.C., have officially reached peak bloom! Take a peek 👓 (not peak!) at the blooms pictured here, taken today (3/28) by the National Park Service. Visit nps.gov/cherry for more.","2025-03-28T17:40:47.899Z"
"godless-prog916.bsky.social","In 2024, there were 285 confirmed cases of measles reported in the US. In the first three months of 2025, there have been 483 confirmed cases of measles in the US.","2025-03-29T22:38:39.965Z"
"godless-prog916.bsky.social","I love this. www.newsweek.com/trained-rats...","2025-03-28T19:55:23.182Z"
"godless-prog916.bsky.social","www.msn.com/en-us/money/...","2025-03-29T20:05:46.026Z"
"godless-prog916.bsky.social","www.theatlantic.com/technology/a...","2025-03-29T18:49:50.261Z"
"godless-prog916.bsky.social","Miss piggy and elmo are spending too much of the government's money","2025-03-29T17:26:23.912Z"
"godless-prog916.bsky.social","Elon Musk takes $8 million a day from the federal government—your tax dollars—while doing zero philanthropic work. No giving back to society. FOCUS: gutting jobs in the most ruthless way possible. Hoarding wealth, boosting Nazis, and leaving folks terrified about their future.","2025-03-29T02:12:23.647Z"
"godless-prog916.bsky.social","You don’t have to confess to us that you were mistaken & that you got hoodwinked by billionaires & fascists but you better confess it to you.","2025-03-29T04:42:05.580Z"
"godless-prog916.bsky.social","BREAKING: On the Daily Beans podcast this week, our #GoodTrouble segment was to call Josh Kaul and ask him to DO SOMETHING about Elon buying votes in Wisconsin. Well, guess what #Leguminati ? www.wkow.com/news/state/w...","2025-03-28T19:51:49.623Z"
"godless-prog916.bsky.social","WTAF","2025-03-28T00:22:44.595Z"
"godless-prog916.bsky.social","The Biggest Scandal of the Second Trump Term Isn’t “Signalgate” www.yahoo.com/news/biggest... The worst of today's selection of horrors.","2025-03-29T02:23:29.780Z"
"godless-prog916.bsky.social","bsky.app/profile/catm... Given my knowledge the ranks of billionaires, this is one of the tiny fraction I like.","2025-03-29T00:05:07.002Z"
"godless-prog916.bsky.social","www.axios.com/2025/03/28/t... AW, Poor Stef! Another stooge of the Orange emperor learning the inevitable fate of all his vassals.","2025-03-28T23:58:41.945Z"
"godless-prog916.bsky.social","Golly! perhaps because she doesn't know shit.","2025-03-28T22:04:27.404Z"
"godless-prog916.bsky.social","So, if the Orange little man dies, this dude is next? Shudder.","2025-03-28T03:13:43.945Z"
"godless-prog916.bsky.social","Way to go, Greenland","2025-03-27T02:32:07.309Z"
"godless-prog916.bsky.social","www.msn.com/en-us/news/n... These deplorable cretins are just smart enough to fool the idiots who believe them. (half our nation 😳 ).","2025-03-28T02:13:47.140Z"
"godless-prog916.bsky.social","www.alternet.org/the-right-wi... I sense a forthcoming replay with trump, Vance starring in the role formerly presented by Reagan, Bush. V.P. Maybelline is gonna pardon trump after he replaces him.","2025-03-27T23:33:01.427Z"
"godless-prog916.bsky.social","ABC News: """"An unthinkable breach of national security."""" CBS News: """"An unthinkable breach of national security."""" MSNBC: """"An unthinkable breach of national security."""" CNN: """"An unthinkable breach of national security."""" Fox News: """"We've all texted the wrong person before.""""","2025-03-26T22:02:57.821Z"
"godless-prog916.bsky.social","@crawfordforwi.bsky.social is running for Supreme Court in Wisconsin and her opponent is backed by Elmo. This race will determine the balance of the our Supreme Court. Susan will protect women’s right to determine their own healthcare, she trusts women. If you are in WI get out and vote for Susan!!!","2025-03-27T01:20:32.748Z"
"godless-prog916.bsky.social","www.nytimes.com/2025/03/25/h... And Rod Serling is in the house.","2025-03-27T01:21:11.323Z"
"godless-prog916.bsky.social","What if democracy truly worked for everyone—not just the 1%? Imagine a world where: — Every voice matters. — Wealth didn’t equal power. — The people set the agenda, not the elite. Democracy isn’t broken. It’s being hoarded. Let’s take it back. For the 99%. #peoplepowerunited #democracymatters","2025-03-26T01:12:31.568Z"
"godless-prog916.bsky.social","Duckworth goes on Fox and Baier reads her statement calling Hegseth a “f**king liar”","2025-03-26T22:48:29.299Z"
"godless-prog916.bsky.social","I think that I (we) need to remember that this clowns courtyard's antics will invariably incite rage but we have to remember not to be shocked or surprised. (might be incrementally better for my hypertension). We all knew 2025 was going have one constant menu item - a big bag of dicks.","2025-03-26T23:25:51.600Z"
"godless-prog916.bsky.social","Much of mainstream media has caved to Trump. X is pretty much state-run. Big law firms have bent the knee. His entire cabinet lies for him without hesitation. Thank you @jeffreygoldberg.bsky.social for your courage and commitment to the truth, during a time when we need it the most.","2025-03-26T21:22:39.255Z"
"godless-prog916.bsky.social","I'm really really sick of the orange turd's clown show!","2025-03-26T18:35:20.021Z"
"godless-prog916.bsky.social","www.theatlantic.com/politics/arc...","2025-03-26T13:50:15.964Z"
"godless-prog916.bsky.social","Complete nonsense from Mike Waltz who knows better. He likely thought he was inviting someone else with same initials and fucked up. Every 13 year old can grok this idiotic move.","2025-03-26T00:11:14.902Z"
"godless-prog916.bsky.social","Me in the National Security team group chat","2025-03-25T02:44:41.000Z"
"godless-prog916.bsky.social","Looks like I've made an embarrassing public mistake. Time to do what alpha males like me do in these situations: whine and avoid accountability","2025-03-25T16:15:03.654Z"
"godless-prog916.bsky.social","www.theatlantic.com/politics/arc... It's like we have our very own fledgling fucking politburo With fox, et al, as their Pravda.","2025-03-26T02:29:35.251Z"
"godless-prog916.bsky.social","A friend mentioned these women...and while it's long...it's a pretty thorough take down of Fckrat Rupert Murdoch... youtu.be/DbjTlwpC0c0?...","2025-03-26T01:48:36.244Z"
"godless-prog916.bsky.social","Trump is claiming we are at war to justify using the Alien Enemies Act. This Act has only been used 3 times before when the US was at war. He has his blatantly politicized DOJ calling attacks on Tesla dealers terrorists. He is at war with the US. #ProudBlue#Voices4Victory apple.news/AscYFh9yNTmW...","2025-03-24T18:22:36.247Z"
"godless-prog916.bsky.social","www.msn.com/en-us/news/n... Tubby jerk. """"Whah! I don't like my fat picture!""""","2025-03-24T20:11:20.153Z"
"godless-prog916.bsky.social","Bill Maher Confirms He Will Meet With Trump At White House, Tells Critics 'F**k You' www.huffpost.com/entry/bill-m... It's like the emperor compels all of our weak sisters to bend their knee. Hee Hee, Bill, you're clichē. That red ball cap is definitely gonna clash with your usual wardrobe.","2025-03-22T23:44:19.074Z"
"godless-prog916.bsky.social","RFK Jr. Says Maybe We Should Just Let The Bird Flu Run Rampant www.yahoo.com/news/rfk-jr-... Oh Great. Trump/Epidemic 2.0 making good time off the blocks.","2025-03-22T22:27:45.851Z"
"godless-prog916.bsky.social","My maternal grandmother died in the 1918 flu pandemic. RFK Jr can go fuck himself.","2025-03-22T18:32:37.353Z"
"godless-prog916.bsky.social","""""The way I was taught is, if your family were immigrants to this country and came for a better life, the price you pay for that is you can never say that 'no one else is welcome.' That is what America was built on,"""" said the Dropkick Murphys frontman Ken Casey.","2025-03-21T10:50:14.876Z"
"godless-prog916.bsky.social","images.app.goo.gl/oSdPHgCPiAMz...","2025-03-21T00:42:03.328Z"
"godless-prog916.bsky.social","It’s like the Constitution is the paper confetti falling through the air at the Nazi parade","2025-03-20T20:43:30.392Z"
"godless-prog916.bsky.social","Every time you see someone powerful acting like a craven coward in the face of this authoritarian menace, let it stiffen your own spine. We are all we've got.","2025-03-20T22:57:26.583Z"
"godless-prog916.bsky.social","www.bridgemi.com/michigan-gov... So Donnie just wants to root out anything good and destroy it but I'm sometimes stunned stunned at how low he'll sink ( although I should know better).","2025-03-20T14:36:49.810Z"
"godless-prog916.bsky.social","I know this is a stupid question and doesn’t apply in these times, but is that even legal? On what basis can they arbitrarily, without due process or cause, search a personal phone?","2025-03-19T23:36:58.159Z"
"godless-prog916.bsky.social","No brainer.","2025-03-19T23:33:34.734Z"
"godless-prog916.bsky.social","finance.yahoo.com/news/elon-mu... I'm not sure who is the bigger whiner between hese two gigantic a$$holes.","2025-03-19T23:32:22.236Z"
"godless-prog916.bsky.social","www.theatlantic.com/ideas/archiv...","2025-03-19T13:53:02.129Z"
"godless-prog916.bsky.social","That’s some kind of “strong man” you put in power there, retrumplicans. You must be so proud. #Ftrump #KRASNOV #Fmaga","2025-03-18T15:53:59.468Z"
"godless-prog916.bsky.social","Civil Rights Icon Whom Trump Called A 'Hero' Erased From Arlington Cemetery Website www.huffpost.com/entry/medgar... That half of America voted for a dude Everyone knows lies when he breaths - mind boggling.","2025-03-19T01:47:31.127Z"
