"user","post","date"
"godless-prog916.bsky.social","⚡️JUST NOW: Rep. @brotherjones.bsky.social barred from a Secretary Noem event at NASHVILLE AIRPORT, in his own district🤔 He says he wanted to ask where hundreds grabbed by ICE in the Nashville raids are, has never been kept from an airport event. FULL Hill stream: www.youtube.com/watch?v=z0cw...","2025-07-17T22:53:19.266Z"
"godless-prog916.bsky.social","Soo...Did Epstein commit suicide or...? I don't care, personally, about anything that happened to that piece of shit. However, as is universally the case, a cover-up is a whole other big ball of wrong.","2025-07-17T17:21:46.485Z"
"godless-prog916.bsky.social","Tangerine Mussolini is great but “Clementine Caligula” is my favorite.","2025-07-17T02:13:24.996Z"
"godless-prog916.bsky.social","Underrated tweet.","2025-07-17T02:28:46.652Z"
"godless-prog916.bsky.social","Posted by The Other 98%","2025-07-15T23:50:23.523Z"
"godless-prog916.bsky.social","Sitting around, chastising myself for having a lazy """"recuperation"""" day and just now blocked J.D. Vance on here. That makes me feel a little more self-forgiving. (The fact that I had a Heart cath. yesterday is a technicality!)","2025-07-16T22:01:06.288Z"
"godless-prog916.bsky.social","This part can’t be repeated enough. Does anyone actually think this was a coincidence?","2025-07-16T20:55:25.425Z"
"godless-prog916.bsky.social","Thank you, patriots!","2025-07-16T21:04:20.541Z"
"godless-prog916.bsky.social","Hey Jake Tapper, fodder for your next book!👇","2025-07-16T20:10:00.407Z"
"godless-prog916.bsky.social","Never let people forget this fact:","2025-07-13T12:03:09.105Z"
"godless-prog916.bsky.social","www.theatlantic.com/ideas/archiv... """"Gabbard, Patel, and Secretary of Defense Pete Hegseth were always the unholy trinity of utterly unqualified nominees...""""","2025-07-13T00:07:57.005Z"
"godless-prog916.bsky.social","www.msn.com/en-us/news/n... And, once again, our shitty little drama queen keeps up his pugnacious antics.","2025-07-12T19:24:36.863Z"
"godless-prog916.bsky.social","Fascinating how MAGA is making Bondi the fall gal for the Epstein files debacle, as if she isn’t operating at the express instruction of the man she’s protecting.","2025-07-12T00:47:32.825Z"
"godless-prog916.bsky.social","Recently, my book THEY CALLED US ENEMY was banned – again – in Tennessee. Book bans are out of control. Huge parts of American history are being restricted. To join me in standing up for the freedom to read, go to pen.org/action. @penamerica.bsky.social @topshelfcomix.bsky.social @idwpublishing.com","2025-07-11T21:05:07.421Z"
"godless-prog916.bsky.social","Facts matter.","2025-07-11T15:14:07.970Z"
"godless-prog916.bsky.social","Where the hell are the marches? Nothing since July 4 we should be out the street daily. What is going on?‼️","2025-07-11T02:01:21.455Z"
"godless-prog916.bsky.social","www.msn.com/en-us/news/n... I'm struggling to break down the percentages. Stupidity = X Malevolent = Y I'd put them at 50/50 100% UNACCEPTABLE.","2025-07-11T00:11:00.251Z"
"godless-prog916.bsky.social","www.forbes.com/sites/zachar... KEEP it Going!","2025-07-10T00:59:10.397Z"
"godless-prog916.bsky.social","gotverdammt Einsatzgruppen!","2025-07-09T23:40:05.004Z"
"godless-prog916.bsky.social","theonion.com/ted-cruz-ass... Damnded rat.","2025-07-09T23:32:18.203Z"
"godless-prog916.bsky.social","Im sadly gobsmacked at how openly cruel our nation is. (always has been, but the bastards are loud and unselfconconsciously proud these days.)","2025-07-09T23:26:33.271Z"
"godless-prog916.bsky.social","Posted by the Other 98%","2025-07-08T02:28:34.486Z"
"godless-prog916.bsky.social","www.msn.com/en-us/news/u... Hideous asshole.","2025-07-08T03:07:17.872Z"
"godless-prog916.bsky.social","www.theatlantic.com/ideas/archiv...","2025-07-07T14:23:08.550Z"
"godless-prog916.bsky.social","Oh, America, with your racist bullshit legacy.","2025-07-07T02:23:41.129Z"
"godless-prog916.bsky.social","www.theatlantic.com/ideas/archiv... maybe because most christials aren't very """"christian""""?","2025-07-06T18:46:14.140Z"
"godless-prog916.bsky.social","www.theatlantic.com/culture/arch...","2025-07-05T21:41:26.253Z"
"godless-prog916.bsky.social","The thing about fireworks tonight if there's not much in this country worth celebrating at the moment and also I went to Disney this year and no fireworks can compare to those anyway 😂","2025-07-04T18:38:13.434Z"
"godless-prog916.bsky.social","Today I’m going to celebrate good people in America even though our institutions and “leaders” are severely corrupt and awful","2025-07-04T12:59:21.143Z"
"godless-prog916.bsky.social","Immediately.","2025-07-04T22:51:49.853Z"
"godless-prog916.bsky.social","Remember your oath, Marines. You fought in Belleau Wood, Iwo Jima, and against fascism in WW2. Trump is making a mockery of the USMC. He's deployed you against American civilians, and now he's turning you into prison guards for concentration camps. You do not have to follow unlawful orders.","2025-07-04T11:42:46.449Z"
"godless-prog916.bsky.social","The opposite of ‘woke’ is ‘ignorant’ so what are you? If you’re ignorant, you’re no use to anyone in society and that includes yourself #Woke #BeWoke #WokeAF","2025-06-27T12:10:40.269Z"
"godless-prog916.bsky.social","www.alternet.org/trump-hurts-... Very unchristian of me (not generally atypical of me) but I don't give a single, sympathetic, shadow of a f*ck for any trump voters that are going to get cut loose by ther Orange lord","2025-07-04T20:42:23.755Z"
"godless-prog916.bsky.social","'Hateful' Trump Trashed Over 'F**king Disgusting' Line About Half The Country For 4th Of July www.huffpost.com/entry/donald... k, he FINALLY told the truth once.","2025-07-04T14:41:29.052Z"
"godless-prog916.bsky.social","www.salon.com/2025/07/03/t... Madman or evil sociopah? Frankly, I don't care. I fear that even the best path forward for our nation leads to tragedy.","2025-07-04T00:48:10.009Z"
"godless-prog916.bsky.social","Vibe check:","2025-07-02T15:51:47.019Z"
"godless-prog916.bsky.social","www.theatlantic.com/politics/arc... didn't have to, should not have...but they still did so with great, villainous, ignorant, enthusiasm.","2025-07-02T21:40:58.095Z"
"godless-prog916.bsky.social","how'd that unholy bromance work out for ya, Herr Douche?","2025-07-02T02:59:45.226Z"
"godless-prog916.bsky.social","🦋 Big Ugly Bill tanks in polling - Americans are paying attention """"Folks elected Donald Trump to a second term because they wanted him & his policies to help their family but they think the big, beautiful bill does the exact opposite of that. They hate it, hate it, hate it."""" 🦋","2025-07-01T01:46:42.018Z"
"godless-prog916.bsky.social","“Alligator Alcatraz” will begin operations on Wednesday. This is your reminder that a prison without due process is a concentration camp.","2025-06-29T18:25:42.636Z"
"godless-prog916.bsky.social","🚨🚨The White House is pissed off about this ad so you know what to do, share it everywhere! ICE is disappearing people just because of the color of their skin! No Warrant! No Due Process! This is not who we are as Americans! #MAGAKidnappers want an all white America, fuck that‼️","2025-06-18T20:08:32.566Z"
"godless-prog916.bsky.social","music.youtube.com/watch?v=a3t6... The anthem for now.","2025-06-27T23:57:47.761Z"
"godless-prog916.bsky.social","bsky.app/profile/thet... Fucking fascists 'jUsT fOlLoWiNg OrDeRs'.","2025-06-27T22:10:39.953Z"
"godless-prog916.bsky.social","The bile, it burns!!","2025-06-27T04:14:01.376Z"
"godless-prog916.bsky.social","Wannabe dictator is just a tiny flaccid dick.","2025-06-27T02:17:23.347Z"
"godless-prog916.bsky.social","nuff said","2025-06-27T03:55:41.716Z"
"godless-prog916.bsky.social","Nuff said.","2025-06-26T19:08:48.027Z"
"godless-prog916.bsky.social","If you’re zip-tying grandmas protesting losing health care maybe you’re not the good guys in the story?","2025-06-25T21:51:05.078Z"
"godless-prog916.bsky.social","WHEN ICE HATES BEING FOLLOWED. 📫Feel Free to Repost📫 🎞Join For All Daily Clips🎞","2025-06-22T16:50:08.990Z"
"godless-prog916.bsky.social","We're not a theocracy YET!","2025-06-24T15:15:01.099Z"
"godless-prog916.bsky.social","theonion.com/think-tank-c...","2025-06-24T13:16:56.643Z"
"godless-prog916.bsky.social","More people need to get pissed.","2025-06-23T00:58:38.566Z"
"godless-prog916.bsky.social","NEW: The DHS has issued a heightened terror threat for Americans. Good thing we have that 22 year old former gardener in charge of counterterrorism and DHS is busy with mass deportation. www.dhs.gov/ntas/advisor...","2025-06-22T19:00:11.961Z"
"godless-prog916.bsky.social","We’ve got to do something. It’s unsustainable.","2025-06-21T20:07:14.689Z"
"godless-prog916.bsky.social","www.theatlantic.com/newsletters/... I always appreciate The Atlantic.","2025-06-21T23:48:38.987Z"
"godless-prog916.bsky.social","A Dem lawmaker and her husband were killed by a guy for their political views and it’s already out of the news.","2025-06-21T23:05:17.208Z"
"godless-prog916.bsky.social","apnews.com/article/mike... This fecal bastard....","2025-06-21T20:59:10.792Z"
"godless-prog916.bsky.social","INDEED.","2025-06-21T20:40:28.419Z"
"godless-prog916.bsky.social","#BlueCrew","2025-06-20T18:37:52.374Z"
"godless-prog916.bsky.social","bark bark! Yip yip!","2025-06-20T23:21:18.363Z"
"godless-prog916.bsky.social","BREAKING: In a unanimous decision, a federal court of appeals has ruled that Louisiana's law requiring the Ten Commandments to be displayed in all public school classrooms is unconstitutional. We’ll keep saying it: Public schools are not Sunday schools.","2025-06-20T19:50:02.894Z"
"godless-prog916.bsky.social","Live in such a way that you trigger white Christian nationalists.","2025-06-19T23:13:00.712Z"
"godless-prog916.bsky.social","“In about two weeks, l'll be releasing my big, beautiful healthcare plan, my taxes, the Epstein list — or we'll be bombing Iran."""" - Grandpa Grifter-Rico","2025-06-20T01:59:15.577Z"
"godless-prog916.bsky.social","New Orleanians. Our time has come.","2025-06-19T16:59:46.443Z"
"godless-prog916.bsky.social","Forgot how much I love this single.","2025-06-20T02:30:36.155Z"
"godless-prog916.bsky.social","Can you please make this contact thing a bot less counterintuitive. Please.","2025-06-20T01:22:26.083Z"
"godless-prog916.bsky.social","We sent a letter to President Trump late last night explicitly reminding him that only Congress has the power to authorize military force against Iran. Our leaders need to take that grave responsibility seriously.","2025-06-19T18:19:27.858Z"
"godless-prog916.bsky.social","Break it, un-break it, take credit for it. Every time.","2025-06-19T23:56:02.960Z"
"godless-prog916.bsky.social","Shouldn’t the NY Times headline note that this new policy breaks the law?","2025-06-19T23:53:03.455Z"
"godless-prog916.bsky.social","MAGA Personality Tells Girls To Go To College For A Really Retrograde Reason www.huffpost.com/entry/charli... What a horrid ittle jughead.","2025-06-20T00:27:32.157Z"
"godless-prog916.bsky.social","Brain-Dead Georgia Woman Is Taken Off Life Support After Delivering Baby www.huffpost.com/entry/adrian... Sorry, ladies in Georgia, apparently your worth is limited.","2025-06-19T13:24:54.404Z"
"godless-prog916.bsky.social","www.usatoday.com/story/news/n... To Some of you White, Christian, Americans: Wow, I never realized the pain you must've been feeling the last 30 years, being all persecuted and whatnot. I had no idea. Second thought - nvm, go eat a bag of dicks.","2025-06-19T01:37:15.560Z"
"godless-prog916.bsky.social","#NoKings #NoICE #NoMAGA #NoNazis #NoFascism #BestSigns 👏👏","2025-06-16T13:13:36.054Z"
"godless-prog916.bsky.social","Endorse this.","2025-06-18T03:29:33.636Z"
"godless-prog916.bsky.social","Once Trump left the G7 in Canada last night. President Zelenskyy joined the remainder of the session, which ended today. Look how real leaders assisted Ukraine!","2025-06-18T00:30:37.817Z"
"godless-prog916.bsky.social","Prayers for an “allergic reaction.” But mockery and hateful conspiracies for murder victims who aren’t in your tribe. With no apology or remorse. Fake Christian, small man.","2025-06-18T00:17:41.354Z"
"godless-prog916.bsky.social","Gov Gavin Newsom’s TikTok page is 🔥","2025-06-18T00:30:05.184Z"
"godless-prog916.bsky.social","ncnewsline.com/2025/06/17/n...","2025-06-18T01:52:25.294Z"
"godless-prog916.bsky.social","People!","2025-06-18T00:08:40.960Z"
"godless-prog916.bsky.social","apnews.com/article/kris... Dammit! Well, one can dream.","2025-06-18T00:05:09.051Z"
"godless-prog916.bsky.social","MAGA nightmare....","2025-06-17T23:38:53.034Z"
"godless-prog916.bsky.social","Hi, this is Meg Barnette, Brad's wife. While escorting a defendant out of immigration court at 26 Federal Plaza, Brad was taken by masked agents and detained by ICE. This is still developing, and our team is monitoring the situation closely.","2025-06-17T16:51:09.071Z"
"godless-prog916.bsky.social","and daddy bever loved you. Such a disappointed, damaged, little, man","2025-06-17T01:29:28.174Z"
"godless-prog916.bsky.social","www.comicsands.com/florida-maga... This good ol boy is sad. He no longer gets to tell himself that is low-wage slaves laborers are (almost) like family. wompwomp, ASSHOLE.","2025-06-17T01:19:32.586Z"
"godless-prog916.bsky.social","💯💯💯","2025-06-17T00:40:50.990Z"
"godless-prog916.bsky.social","BREAKING: A federal judge reversed National Institutes of Health's terminations of hundreds of critical research grants that were canceled because of their alleged connection to disfavored topics, including diversity, equity, inclusion, and gender identity. This is a major win for public health.","2025-06-16T21:46:11.445Z"
"godless-prog916.bsky.social","Come for the cat and crafting posts. Stay for the rage against public school privatizing.","2024-11-21T15:28:36.884Z"
"godless-prog916.bsky.social","www.theatlantic.com/newsletters/... poor slob.","2025-06-16T19:24:55.039Z"
"godless-prog916.bsky.social","No One Sure Why Kristi Noem Wearing Firefighter Helmet, Night-Vision Goggles, High Heels, Wet Suit theonion.com/no-one-...","2025-06-16T16:00:03.000Z"
"godless-prog916.bsky.social","www.theatlantic.com/photography/... Ready for more!","2025-06-16T13:01:15.169Z"
"godless-prog916.bsky.social","Timeline cleanser 🫶","2025-06-15T17:08:33.614Z"
"godless-prog916.bsky.social","Awesome parade in DC today!","2025-06-14T23:54:53.740Z"
"godless-prog916.bsky.social","Friggin' gun nuts.","2025-06-15T02:53:59.878Z"
"godless-prog916.bsky.social","Me either, however I cannot sit and watch it happen. Keyboard warrior","2025-06-15T02:33:09.504Z"
"godless-prog916.bsky.social","Fox News brings on Rebekah Koffler to talk about the military parade, but she seems to be heavily intoxicated so they cut away with quickness","2025-06-15T01:59:32.933Z"
"godless-prog916.bsky.social","All tyranny needs to gain a foothold is for people of good conscience to remain silent. If you got out today, gracias. If you couldn't, Please Do next opportunity. If you wouldn't, why the hell not?","2025-06-15T00:34:02.545Z"
"godless-prog916.bsky.social","This man is my hero because he’s a member of the United States Air Force and is standing by his #Oath to the #Constitution! I’m hoping that since he has taken the lead others will follow because this is what a true American Soldier looks like! Remember your Oath to the Constitution","2025-06-14T01:23:25.276Z"
"godless-prog916.bsky.social","Really anticipating today's attendance totals, Parade vs March.","2025-06-14T22:47:21.545Z"
"godless-prog916.bsky.social","www.forbes.com/sites/danale... Soon to be his next SuCsEsful venture. (the man destroys everything he touches)","2025-06-14T22:36:33.864Z"
"godless-prog916.bsky.social","news4sanantonio.com/news/local/t... I've ever been one one to ever consider conspiracy theories....","2025-06-14T21:50:41.708Z"
"godless-prog916.bsky.social","Enjoy your silly parade, donOld, I'll march.","2025-06-14T17:21:55.137Z"
"godless-prog916.bsky.social","My partner at today's protest.","2025-06-14T15:18:14.393Z"
"godless-prog916.bsky.social","😡😡😡😡","2025-06-14T03:45:51.945Z"
"godless-prog916.bsky.social","www.freep.com/story/news/l...","2025-06-14T04:22:50.675Z"
"godless-prog916.bsky.social","www.alternet.org/wayne-ivey-p... Another maga tough guy.","2025-06-13T12:09:17.719Z"
"godless-prog916.bsky.social","www.whatimreading.net/p/grammys-ad... Because of course. White people want country music only for them.","2025-06-13T04:17:17.064Z"
"godless-prog916.bsky.social","The Department of Defense has banned more than 500 books from its schools on military bases, allegedly including: ❌ To Kill a Mockingbird ❌ The Color Purple ❌ The Kite Runner ❌ Anne Frank’s Diary: The Graphic Adaptation We're taking the Trump administration to court to protect the freedom to read.","2025-06-12T18:58:27.522Z"
"godless-prog916.bsky.social","Considering my protest sign for Saturday...Thoughts?","2025-06-13T04:08:10.546Z"
"godless-prog916.bsky.social","Arrested for unauthorized jobs. Workers: 100 Managers who hired: 0 Owners who profited: 0 floridaphoenix.com/2025/05/29/i...","2025-05-30T03:08:56.786Z"
"godless-prog916.bsky.social","Dichotomy much? In 24 years as a road medic, I can say I've had a lot of law enforcement people that I've been, at least, friendly acquaintances if not actual friends . That said, I don't like cops. Kinda a person vs 'people' thing. The recent treatment of judges and congressmen appalls me.","2025-06-12T23:42:46.173Z"
"godless-prog916.bsky.social","🎀🎀","2025-06-12T10:56:00.231Z"
"godless-prog916.bsky.social","BREAKING: An ICE vehicle just RAMMED into a civilian car in Boyle Heights. Then they gassed it. Then they dragged out the driver. All three people in that car are U.S. citizens. This is militarized racial profiling on steroids.","2025-06-12T00:00:27.593Z"
"godless-prog916.bsky.social","Beware the wrath of a patient man. - J. Dryden","2025-06-12T13:53:02.397Z"
"godless-prog916.bsky.social","“Pretty much wherever you are, you’re probably less than 30 minutes away from your closest No Kings event.” - @leahgreenberg.bsky.social with @democracynow.org We hope to see you at your local #NoKings Day mobilization on Saturday: www.nokings.org?SQF_SOURCE=i...","2025-06-11T23:12:11.406Z"
"godless-prog916.bsky.social","DHS Chief: ‘We Are A Nation Of Immigrants Who Came Here Between 1776 And 1943’ — theonion.com/dhs-chief-we...","2025-06-12T13:40:47.515Z"
"godless-prog916.bsky.social","Im sad to write that my beloved mother has become a fully indoctrineted Faux (Völkischer Beobachter) viewer. I've lived with a couple alcoholics and someone with a legit borderline personality/narcissist, and, truth tell, I've never felt less optimistic about savaging that loss.","2025-06-12T03:57:14.921Z"
"godless-prog916.bsky.social","I'm attending No Kings's event, “NO KINGS FENTON MICHIGAN” - sign up now to join me! www.mobilize.us/nokings/even... Upgraded to a more secure email before signing up. (I'm adapting to the state of the """"Union)"""".) I recommend you do too.","2025-06-12T03:13:45.105Z"
"godless-prog916.bsky.social","W.E.B. Du Bois on Robert E. Lee: “Either he knew what slavery meant when he helped maim and murder thousands in its defense, or he did not. If he did not he was a fool. If he did, Robert Lee was a traitor and a rebel–not indeed to his country, but to humanity and humanity’s God.”","2025-06-11T12:42:59.724Z"
"godless-prog916.bsky.social","🥳+Trump's+Hill+fan+club www.axios.com/2025/06/11/t... JFC! where's Kafka?","2025-06-11T00:56:51.095Z"
"godless-prog916.bsky.social","apnews.com/article/chem... Ok folks, the USA is loudly, thoroughly, STUPID. (like it isn't already glaringly obvious)","2025-06-10T18:31:49.889Z"
"godless-prog916.bsky.social","stopice.net","2025-06-08T20:32:37.100Z"
"godless-prog916.bsky.social","Are there any kind hearts out there who can please RT so it reaches those willing bless our classroom or my self-care list?","2025-06-03T04:40:48.720Z"
"godless-prog916.bsky.social","🎯","2025-06-04T23:31:17.305Z"
"godless-prog916.bsky.social","It’s the Golden Age! For stupid people and con artists.","2025-06-05T12:57:15.992Z"
"godless-prog916.bsky.social","As if I'd ever actually walk into either...not!","2025-06-05T20:58:37.224Z"
"godless-prog916.bsky.social","apnews.com/article/trum... So sad when bestie bitches beef!","2025-06-05T17:34:38.261Z"
"godless-prog916.bsky.social","CHICAGOIANS STANDING UP TO ICE!! Don’t let them erase this. Share this everywhere!","2025-06-05T03:14:42.731Z"
"godless-prog916.bsky.social","www.propublica.org/article/trum... My capacy for incredulity is strained daily.","2025-06-05T02:00:07.877Z"
"godless-prog916.bsky.social","""""I didn't know he would do this."""" Yes, you did, or you voted while being completely uninformed which is just as bad. Prove you didn't know it by joining folks resisting the regime. Prove it by disavowing him. Prove it by fighting for what's right. Otherwise, just be quiet.","2025-06-03T02:33:34.321Z"
"godless-prog916.bsky.social","Who did this? 😂","2025-05-31T13:49:20.337Z"
"godless-prog916.bsky.social","Optimistic Researchers Say There Still Time To Head Off Climate Change Before It Starts Killing Rich People theonion.com/optimis...","2025-05-30T22:00:03.000Z"
"godless-prog916.bsky.social","oldgoats.substack.com/p/shari-reds... donold destroys more people than Typhoid Mary ever dreamed of. Including people would shoulda known better; let alone would have a sense of dignity or ethics.","2025-05-30T23:28:00.759Z"
"godless-prog916.bsky.social","All due (zilch) respect, donold. [TACO!]","2025-05-30T22:41:46.912Z"
"godless-prog916.bsky.social","TACO! (have a nice weekend)","2025-05-30T21:58:11.808Z"
"godless-prog916.bsky.social","www.theatlantic.com/ideas/archiv... Suck it Stevie!","2025-05-29T15:59:13.662Z"
"godless-prog916.bsky.social","Treating a new Covid strain like a crime and not a public health issue is deranged.","2025-05-28T23:39:58.972Z"
"godless-prog916.bsky.social","aviationa2z.com/index.php/20... All my life, I've loved astronomy, NASA, and all things space. It's a bit of a change for me when I avidly celebrate these failures. So be it, I sometimes have a pathological love of Schadenfreude","2025-05-29T01:41:31.718Z"
"godless-prog916.bsky.social","www.cbsnews.com/amp/news/tru... Taco, Taco, TACO...bitch.","2025-05-29T00:08:41.597Z"
"godless-prog916.bsky.social","www.forbes.com/sites/conorm... To be clear: If you proudly consider yourself an 'AlPhA mALe', please manually fuck right off. Us regular , real men, are rather embarrassed by you posturing nonsense.","2025-05-28T19:31:40.493Z"
"godless-prog916.bsky.social","oh there's a 'lost cause' alright; they're mad 'cause they lost, lol","2025-05-25T19:36:48.961Z"
"godless-prog916.bsky.social","No one likes you and you have no friends.","2025-05-23T22:14:44.523Z"
"godless-prog916.bsky.social","Only Two Republicans Were Brave Enough to Vote Against Medicaid Cuts newrepublic.com/post/195606/... via @newrepublic.com Republicans Assholes would rather spend our money arming against their """"enemies"""" than let our non-billionaire citizens have a fair deal.","2025-05-23T22:24:26.836Z"
"godless-prog916.bsky.social","SEE YOU JUNE 14th!!!! NO KINGS!","2025-05-20T15:50:41.361Z"
"godless-prog916.bsky.social","slate.com/news-and-pol... I, for one, was quite pessimistic that she would recuse in this case. Pleased to admit I was mistaken.","2025-05-23T16:26:30.206Z"
"godless-prog916.bsky.social","www.smithsonianmag.com/science-natu... Pathetic how little we've grown as a nation in a century .","2025-05-23T02:14:17.507Z"
"godless-prog916.bsky.social","FFS, White Supremacist much, donold?","2025-05-19T23:39:41.420Z"
"godless-prog916.bsky.social","Trump inauguration > birthday","2025-05-18T21:40:45.099Z"
"godless-prog916.bsky.social","www.reuters.com/world/us/tru... Wow, I'm so unsurprised.","2025-05-17T19:59:30.429Z"
"godless-prog916.bsky.social","www.theverge.com/amazon/66791... Another member of the gotdamnded billionaire boys club of evil.","2025-05-16T02:01:59.029Z"
"godless-prog916.bsky.social","""""I will not yield, because it was a terribly disrespectful comment – and I will not yield to disrespectful men."""" AOC","2025-05-15T00:09:32.539Z"
"godless-prog916.bsky.social","WE MUST UNIFY AND WALK THE BRIDGE TOGETHER ‼️🇺🇸","2025-05-11T15:31:59.090Z"
"godless-prog916.bsky.social","Please like, retweet and chip in if you can, and together, we will retire Lindsey Graham. secure.actblue.com/donate/lee4s...","2025-05-14T18:52:31.667Z"
"godless-prog916.bsky.social","GOP SILENCE implies CONSENT! #hypocrites #sheep","2025-05-13T13:27:58.134Z"
"godless-prog916.bsky.social","Tomorrow there will be more of us.","2025-05-12T02:23:50.073Z"
"godless-prog916.bsky.social","Amazing, and especially because of the two states implementing this act","2025-05-10T17:13:41.620Z"
"godless-prog916.bsky.social","How is it that ICE ‘ personnel’ don’t have to wear identifying information, can disguise their faces, and kidnapped people without due process? We are not a democracy if that can happen. We are no better than a fascist state. Tom Homan needs to be held accountable, like yesterday.","2025-05-11T16:58:43.122Z"
"godless-prog916.bsky.social","www.alternet.org/finally-some...","2025-05-11T22:15:27.180Z"
"godless-prog916.bsky.social","Somebody is miffed that she only got two chunks of Braunschweiger.","2025-05-10T18:07:32.746Z"
