"user","post","date"
"godless-prog916.bsky.social","Whom, exactly, is celebrating it? That's a far cry from not 'not mourning', jumping on the Kirk Lionizing train. Go doll up your eyes, chim-chim. www.cnn.comb2025/09/17/politi...","2025-09-19T12:13:10.283Z"
"godless-prog916.bsky.social","Truth 👇","2025-09-16T20:24:03.318Z"
"godless-prog916.bsky.social","Lions to be Superbowl Champions 2026!!","2025-09-17T14:08:00.173Z"
"godless-prog916.bsky.social","You see, kids, when someone dies who mostly did *good* things, people are *sad*.","2025-09-16T13:19:54.105Z"
"godless-prog916.bsky.social","Join me in condemning this kind of statement and this kind of hate.","2025-09-16T19:50:56.803Z"
"godless-prog916.bsky.social","I'd have to say Deadly serious.","2025-09-16T21:28:59.736Z"
"godless-prog916.bsky.social","Gov. Josh Shapiro criticizes 'selective condemnation' of political violence www.nbcnews.com/politics/pol...","2025-09-16T19:08:54.409Z"
"godless-prog916.bsky.social","Ms p. bondi, attorney general of the 'usa', I think you are an evil & stupid tw*t, youre an even bigger piece of shit than Charlie Kkk. This is me exercising my 1st Amendnebt right so go swallow a bag of dicks. I said good day, madame. abcnews.go.com/Politics/bon...","2025-09-16T17:11:42.819Z"
"godless-prog916.bsky.social","It is absolutely insane to me that we're having a debate over whether or not the rightwing deploys violent rhetoric within days of a Fox News personality calling for homeless people to be killed by lethal injection. There is no excuse for this obliviousness. It's unacceptable.","2025-09-16T02:06:20.386Z"
"godless-prog916.bsky.social","Is the national guard swarming Utah yet?","2025-09-14T23:33:55.515Z"
"godless-prog916.bsky.social","What the fucking fuck?!!","2025-09-14T19:33:25.397Z"
"godless-prog916.bsky.social","You’d think after their cult leader tried to hang his own VP for not helping him steal an election, they’d be familiar with the notion of right on right crime. Yet it befuddles them to this day.","2025-09-13T10:40:20.085Z"
"godless-prog916.bsky.social","there's a weird feedback loop where the media's reaction to kirk's death pushes you to speak more ill of the dead than you otherwise would because it's the only reasonable response to the simpering praise they're heaping on him","2025-09-13T02:19:49.461Z"
"godless-prog916.bsky.social","And here it is folks! Here’s the guy who killed Charlie Kirk","2025-09-12T19:11:22.146Z"
"godless-prog916.bsky.social","Everyone should be held to the same standards.","2025-09-12T19:31:10.992Z"
"godless-prog916.bsky.social","Nerd Alert. Happy Birthdate Neil Peart. (""""RIP"""")","2025-09-12T21:04:00.393Z"
"godless-prog916.bsky.social","@s-serling.bsky.social","2025-09-12T01:21:43.230Z"
"godless-prog916.bsky.social","Can't happen soon enough. www.mobilize.us/nokings/even...","2025-09-12T00:59:49.798Z"
"godless-prog916.bsky.social","The murder of Charlie Kirk was criminal, wrong, and should be condemned. And Charlie Kirk was a horrible, hateful man who spent his life radicalizing young people to embrace their worst demons by targeting women, people of color, immigrants, and the marginalized. I refuse to sanitize him.","2025-09-11T05:03:34.000Z"
"godless-prog916.bsky.social","Cue theories..and..go! www.washingtonpost.com/investigatio...","2025-09-11T22:55:23.408Z"
"godless-prog916.bsky.social","Ok, BRING IT, you hypocritical, bigoted WhitePride, intolerant pedo- protecting f*cks. www.democracydocket.com/news-alerts/...","2025-09-11T22:18:47.614Z"
"godless-prog916.bsky.social","Yes, please! (we just gotta make it to '26 & no election bullshit). www.npr.org/2025/09/11/n...","2025-09-11T19:42:51.616Z"
"godless-prog916.bsky.social","Decrying violence against political opponents rings a bit hollow when you pull Secret Service protection from your political opponents.","2025-09-11T17:16:47.467Z"
"godless-prog916.bsky.social","Holy Suck, I hate to confess that I just applied for Social Security (SSDI).","2025-09-11T18:30:25.983Z"
"godless-prog916.bsky.social","Oscar Wilde - """"Some men can make the world a better place by leaving it."""" Mark Twain - """"I do not wish to hasten the death of any man, but there many time I've read an obituary with considerable pleasure.""""","2025-09-11T02:13:54.908Z"
"godless-prog916.bsky.social","let me halt your doom scroll with a cute squirrel portrait","2025-09-10T21:40:36.932Z"
"godless-prog916.bsky.social","Elizabeth Warren on people who say Dems needs to tone down their rhetoric: """"Oh, please. Why don't you start with the president of the United States? And every ugly meme he's posted and every ugly word.""""","2025-09-11T00:28:36.211Z"
"godless-prog916.bsky.social","Here’s a story that’s becoming all too common: federal immigration agents using racial and ethnic profiling as a rationale for stopping, questioning and detaining U.S. citizens who they suspect are undocumented.","2025-09-11T00:12:14.770Z"
"godless-prog916.bsky.social","Charlie Kirk spent his life‘s work and all of his energy and time targeting out-groups while arguing for a world in which gun massacres would be easy to enact, plentiful, and inevitable, and he became famous and wealthy doing it, and we’re now not supposed to mention that because it’s not polite.","2025-09-10T23:41:58.239Z"
"godless-prog916.bsky.social","Thank you, Senator Warren.","2025-09-11T00:41:51.464Z"
"godless-prog916.bsky.social","We don’t yet know what motivated the person who shot and killed Charlie Kirk, but this kind of despicable violence has no place in our democracy. Michelle and I will be praying for Charlie’s family tonight, especially his wife Erika and their two young children.","2025-09-10T21:26:37.818Z"
"godless-prog916.bsky.social","I don't care about Charlie Kirk. I don't want him to die- I believe in ppl living w their mistakes [ala G Abbott] given a chance of redemption if they do things differently. It's not too soon for ME to remind you of GOP|Trump bs. 🛑Trump STOLE Blue state funds allotted to fight|prevent crime","2025-09-10T20:41:43.624Z"
"godless-prog916.bsky.social","trump and vance are encouraging us to pray for charlie kirk. As an atheist, I dont pray for anything or anyone and I'm not about to start for this asshole.","2025-09-10T19:23:03.335Z"
"godless-prog916.bsky.social","So the argument for blowing up boats suspected of smuggling drugs to the U.S. rests on the fact that lots of Americans who choose to take illegal drugs die from doing so. Lots of Americans also die from cardiovascular disease. Does that mean drone strikes on McDonald’s?","2025-09-10T01:05:06.149Z"
"godless-prog916.bsky.social","West Jordan, Utah. Felt like shit but glad I made it. 30 people, over 200 honks, the weekly protest is growing!","2025-09-07T01:30:23.799Z"
"godless-prog916.bsky.social","theonion.com/trump-claims...","2025-09-10T00:18:51.535Z"
"godless-prog916.bsky.social","Linda McCartney, Paul McCartney and Pink Floyd’s David Gilmour at a Lynyrd Skynyrd concert in the mid 1970's. #PaulMcCartney #DavidGilmour","2025-09-08T22:00:35.374Z"
"godless-prog916.bsky.social","Grear list! www.headphonesty.com/2025/09/albu...","2025-09-09T22:38:15.417Z"
"godless-prog916.bsky.social","It’s time to repost this. This right here 👇🏼 #nofascism","2025-08-10T00:53:18.434Z"
"godless-prog916.bsky.social","I may not give two shits about Epstein or how he died but I do care about the Orange POS slithering out of accountability as usual.a Everything potentially pertinent needs to be released. https ://www.theatlantic.com/politics/archive/2025/09/trump-epstein-letter-excuses/684138/","2025-09-09T13:34:31.770Z"
"godless-prog916.bsky.social","Holy shit…You can’t make this up: a plane is circling Soldier Field before the Bears home opener with a banner that reads— “HEY ICE, MASKS ARE FOR CUCKS.” Also the trolling is incredible for those that told us to stop wearing masks during the pandemic.","2025-09-09T00:18:06.211Z"
"godless-prog916.bsky.social","Anti-ICE/Gestapo protest - Chicago, IL Right now!","2025-09-06T23:10:52.899Z"
"godless-prog916.bsky.social","This isn’t Moscow or Beijing. It’s Chicago. Masked federal agents grabbed U.S. citizens protesting ICE and threw them into an unmarked van. “Who are you? Where are you taking them?” people shouted. “You are kidnapping them!” What has America become?","2025-09-07T21:18:23.046Z"
"godless-prog916.bsky.social","Even a Hack from his first term is mildly squeeking. www.msn.com/en-us/news/n...","2025-09-07T18:14:26.530Z"
"godless-prog916.bsky.social","Hey, Chicago peeps!","2025-09-07T01:41:34.298Z"
"godless-prog916.bsky.social","The worm-addled bastard means to kill us all. www.medscape.com/viewarticle/...","2025-09-07T01:39:05.406Z"
"godless-prog916.bsky.social","Marc Elias is OUR Champion 🏆 He is in Court Battling the Chump Regime almost Every Day. We Need More Like Mr. Elias on Our Side.......","2025-09-06T09:17:41.702Z"
"godless-prog916.bsky.social","25 days until open ❤️ surgery (Aortic valve replacement). Guess I'll just mow the backyard and oil a couple squeaky doors today","2025-09-06T19:16:44.955Z"
"godless-prog916.bsky.social","1,000%! www.theatlantic.com/ideas/archiv...","2025-09-06T03:30:50.271Z"
"godless-prog916.bsky.social","flvoicenews.com/florida-gene... Does Florida think kicking off the next childhood pandemic is 'owning the libs""""? FFS, What a villain.","2025-09-03T22:25:08.872Z"
"godless-prog916.bsky.social","Lori Chavez-DeRemer: """"I was elected as the Labor Secretary for all Americans"""" (She was not elected)","2025-09-02T14:51:10.027Z"
"godless-prog916.bsky.social","Aspirin, my ass. www.msn.com/en-us/news/p...","2025-09-03T02:12:09.289Z"
"godless-prog916.bsky.social","OMG 😳 😆","2025-08-30T00:10:44.905Z"
"godless-prog916.bsky.social","Pretty sure the word this moron was looking for is """"Inbreed"""".","2025-08-29T21:13:56.532Z"
"godless-prog916.bsky.social","These performative clowns! Like we didn't already KNOW they continue to have to intention of presenting anything other than an empty clown car. www.forbes.com/sites/alison...","2025-08-29T20:20:00.876Z"
"godless-prog916.bsky.social","No notes","2025-08-29T14:14:40.016Z"
"godless-prog916.bsky.social","In my opinion, Ashley Babbit was a stupid cunt. There, I said it. Although it lessons my as a woke (proudly, mostly) I said it.","2025-08-29T05:58:07.045Z"
"godless-prog916.bsky.social","I'm taking a break from hating that fucker, and worrying- tomorrow's a new day. Tonight, I've tucked my lovely loves in, my edible has bloomed, and I'm grooving to Cold Fire by Rush. Seems to be helping.","2025-08-29T03:57:27.398Z"
"godless-prog916.bsky.social","If someone tells you there's nothing we can do about gun violence beyond thoughts and prayers, remind them: —Gun laws in other countries have prevented mass shootings —More guns don't make us safer —A majority of Americans want gun reform We don't have to live like this.","2025-08-28T15:10:56.434100Z"
"godless-prog916.bsky.social","Hasset, you're a dim suckup. www.alternet.org/trump-jobs-r...","2025-08-28T00:15:41.120Z"
"godless-prog916.bsky.social","A reminder that Cracker Barrell settled 2 major discrimination lawsuits in 2004 that found Black customers were seated in areas segregated from white patrons, received inferior service, and were made to wait longer for tables. Oh, and served food from the trash. www.foxnews.com/story/cracke...","2025-08-27T16:18:21.130Z"
"godless-prog916.bsky.social","When he starts building a new WH with a high rise tower and then turns the Mall into a golf course with his name on it will Congress say anything? There are NO fences around his desires. He needs to be gone","2025-08-26T22:57:31.772Z"
"godless-prog916.bsky.social","A note to the party formerly known as the GOP: quit trying to embrace your mutated6 concept of racial equity when America has shit on black folks for hundreds of years. apnews.com/article/supr...","2025-08-27T23:30:57.355Z"
"godless-prog916.bsky.social","The televised multi-hour """"Dear Mr. President, are you a great president or the greatest president?"""" cabinet meetings are just such an embarrassment for everyone involved. All the bad politics aside, these people have no self-respect.","2025-08-27T11:54:01.076Z"
"godless-prog916.bsky.social","Twas a time, not very long ago, that I viewed John Bolton and, yes, #AdamKinzinger, as genuine political enemies. Yet, today, regarding the insane Orange emperor, I seem to tend a minuscule bit towards being generous.","2025-08-27T23:21:49.625Z"
"godless-prog916.bsky.social","To any republicans* who want to debate me that the gop* is the party of law and order: Bring It. I'll contest your invalid arguments to the brink of fisticuffs. *(Capitalization invalid.)","2025-08-27T23:13:33.514Z"
"godless-prog916.bsky.social","Evil incarnate…","2025-08-27T04:25:03.413Z"
"godless-prog916.bsky.social","The second amendment guarantees the right to a militia to guard against federal tyranny. But if a president can use that force against its own state, against the wishes of that state, then it is no militia at all and a clear violation of the second amendment.","2025-08-24T23:37:56.195Z"
"godless-prog916.bsky.social","👀","2025-08-24T02:58:07.058Z"
"godless-prog916.bsky.social","This is how it’s done.","2025-08-21T10:35:53.725Z"
"godless-prog916.bsky.social","apnews.com/article/cali... I've always 'Kinda ' liked this guy but today he's my boy.","2025-08-21T23:24:38.090Z"
"godless-prog916.bsky.social","Last week, Boston received a letter from AG Bondi threatening to prosecute officials and withhold funds unless we cooperate with carrying out mass deportations. The US Attorney General asked for a response by today, so here it is: stop attacking our cities to hide your administration’s failures.","2025-08-19T14:01:09.657Z"
"godless-prog916.bsky.social","Absolutely disgraceful and despicable. If you are a partner at Paul Weiss or Kirkland & Ellis you should be ashamed of yourself -- that is, if you had any shame left.","2025-08-21T00:36:21.935Z"
"godless-prog916.bsky.social","This is so disgusting and tacky. Everything about him is so disgusting and tacky. This is what people with zero class think class looks like.","2025-08-21T00:28:56.932Z"
"godless-prog916.bsky.social","www.jezebel.com/of-course-th... F*ck you, Pratt.","2025-08-21T02:59:23.219Z"
"godless-prog916.bsky.social","She's STILL missing.","2025-08-20T16:32:00.877Z"
"godless-prog916.bsky.social","Alright folks, who's hitting the street on Labor Day? Im looking for something in Lower Michigan.","2025-08-21T01:05:49.562Z"
"godless-prog916.bsky.social","terrymoran.substack.com/p/the-republ... I'll be honest, I am embarrassed to be an American, have been for almost a decade. Am I embarrassed by the Orange man-child? No. I detest him, si. What embarrasses me is half of this country chose him.","2025-08-20T23:50:35.585Z"
"godless-prog916.bsky.social","#FDT #felon47 #BlueHartedFamily #gr3tetag #trump4prison #putin @itsbek.bsky.social @petejrthedog.bsky.social @undine1975.bsky.social @agb2g.bsky.social @darren32359.bsky.social @dalewalls2.bsky.social @57kev.bsky.social @uh8.bsky.social @annettebeebe.bsky.social @ltwlauren.bsky.social ❌","2025-08-20T09:54:25.640Z"
"godless-prog916.bsky.social","Someone SAVE UNK! She is going to be euthanized! I have several posts abt her- over 100 reposts but we can and will do better! I NEED AN EAST COAST FOSTER FOR HER ASAP! REPOST PLS!! DM for application!","2025-08-20T21:31:55.776Z"
"godless-prog916.bsky.social","www.msn.com/en-us/news/n...","2025-08-20T01:38:34.887Z"
"godless-prog916.bsky.social","It's all too tempting to call the MAGA/GOP stupid, but, I'm really afraid today that those sumbitches learned an important lesson on J6: Have troops at the capital before the riot forms. Some shit is coming.","2025-08-19T03:00:23.380Z"
"godless-prog916.bsky.social","The party of small government is now the party of big brother.","2025-08-15T21:11:34.008Z"
"godless-prog916.bsky.social","Now is the time to square up, and defend democracy.","2025-08-14T21:09:04.696Z"
"godless-prog916.bsky.social","Ugly? Maybe. Nay, cowardly.","2025-08-15T03:43:48.857Z"
"godless-prog916.bsky.social","🎯","2025-08-14T03:55:32.752Z"
"godless-prog916.bsky.social","theonion.com/stephen-mill...","2025-08-14T21:21:03.475Z"
"godless-prog916.bsky.social","I can only think of 1 or 2 more punchables faces.","2025-08-14T03:23:19.281Z"
"godless-prog916.bsky.social","Newsome is just fucking with the Orange retardo.","2025-08-13T00:42:14.490Z"
"godless-prog916.bsky.social","www.nbcnews.com/news/us-news... Golly. so not shocking. Heaven forbid a state of morons keep guns away from a fella like this.","2025-08-12T21:00:53.471Z"
"godless-prog916.bsky.social","Desperate to get the Epstein scandal off the front page, he decided to invoke Martial Law in Washington, DC, citing crime as the reason, when they're quite literally at a 30-year low on crime. This is practice for when he has to stop cities from voting in 2026. www.theguardian.com/us-news/2025...","2025-08-12T00:25:06.868Z"
"godless-prog916.bsky.social","#ProudBlue #MomSky I’m game!","2025-04-11T16:53:13.893Z"
"godless-prog916.bsky.social","Would be cool to see this picture of Geddy Lee get reposted 2112 times","2023-08-01T02:29:38.334Z"
"godless-prog916.bsky.social","www.msn.com/en-us/news/n... El taco the bully cowardly blinks when he's facing a big boy. #craven","2025-08-12T00:46:30.339Z"
"godless-prog916.bsky.social","My local speedway's speakers iver the pumps play opera 24/7. (not flexing, they do it to deter panhanders)","2025-08-12T00:16:34.255Z"
"godless-prog916.bsky.social","Not only will we continue to demand the release of the unredacted (other than that of the victims), Epstein files, we demand the victims be heard! We don't care what a convicted sex trafficker has to say. The only voices that matter are those of the victims. 1/2","2025-08-10T22:38:57.116Z"
"godless-prog916.bsky.social","www.abc12.com/news/local/i... And now the masked villains are in my town","2025-08-10T19:41:12.544Z"
"godless-prog916.bsky.social","Can that fucker go any lower.....","2025-08-09T23:02:52.768Z"
"godless-prog916.bsky.social","""""It's a far cry from the word we thought we'd inherit. It's a far cry from the way we thought we'd share it. """" Far Cry, Rush This line from my current favorite classic rock tune really resonates with me.","2025-08-09T22:40:02.950Z"
"godless-prog916.bsky.social","apnews.com/article/texa... Is texas bucking to dethrone florida as the most despicable state in the 'United ' States?","2025-08-09T22:20:26.602Z"
"godless-prog916.bsky.social","www.msn.com/en-us/news/u... Don Draper just trolled hard.","2025-08-09T21:27:45.869Z"
"godless-prog916.bsky.social","""""Get it all on record now. Get the films. Get the witnesses. Because somewhere down the track of history some bastard will get up and say that this never happened."""" – Dwight D. Eisenhower, Germany, 1945","2025-08-09T18:07:06.240Z"
"godless-prog916.bsky.social","@govpritzker.illinois.gov: """"I led the effort to build the IL Holocaust Museum. What I know is that in 53 days, Nazis tore down the constitutional republic in Germany in the 1930s. It doesn't take much. We're seeing pieces of that sort of authoritarian activity happening right now in this country.""""","2025-08-07T17:43:46.605Z"
"godless-prog916.bsky.social","I believe those bastards engorging america's debt while they shred the constitution, economy, and safety nets equals class warfare, and willfully lighting the fuse on nation's self-destruction. And when that fate is fulfilled Bastille Day should no longer be solely a French concept.","2025-08-09T02:52:12.955Z"
"godless-prog916.bsky.social","I’ve recently gotten some hard hard news about my health. I’m having major surgery early Friday. I’m not ready to share more than that right now, but whatever positive thoughts you’ve got, I’ll take ‘em.","2025-08-08T02:32:20.584Z"
"godless-prog916.bsky.social","People in Los Angeles have been protesting 24 hours for 2 weeks straight and no news outlet is covering it! 8/8/25","2025-08-09T00:33:43.089Z"
"godless-prog916.bsky.social","More brazen attempts to install a Christofascist regime... www.propublica.org/article/irs-...","2025-08-09T02:26:49.646Z"
"godless-prog916.bsky.social","Unfortunately, this is where we are headed... shameful...🥺","2025-08-05T19:09:06.283Z"
"godless-prog916.bsky.social","Just tried to introduce my wife to Nobody's Hero by Rush and that uncultured swine rebuffed me! Good thing I love her even more than Rush.","2025-08-06T01:40:47.625Z"
"godless-prog916.bsky.social","www.teenvogue.com/story/anti-a... This sickens me to my core.","2025-08-05T23:49:01.035Z"
"godless-prog916.bsky.social","theonion.com/trump-still-... Just sometimes The Onion accidentally puts out not quite parody.","2025-08-05T00:47:06.512Z"
"godless-prog916.bsky.social","www.msn.com/en-us/news/p... In keeping with their desire to destroy anything good....","2025-08-04T21:37:25.745Z"
"godless-prog916.bsky.social","Oh no. dt says he won't pardon P.Diddy, b/c he wasn't very nice to him once. I don't think P deserves a pardon, but it does show what a small minded petty shallow liddle guy dt is. I bet if P keeps offering dt more 💲he can find the pardon he wants. dt is for sale to the highest bidder.","2025-08-03T19:07:42.770Z"
"godless-prog916.bsky.social","An important and evergreen reminder from Dr. Jane: """"Let us develop respect for all living things. Let us try to replace violence and intolerance with understanding and compassion. And love."""" 📸: Michael Neugebauer","2025-08-03T14:00:08.228386Z"
"godless-prog916.bsky.social","www.cbsnews.com/amp/news/cor... Shame on america.","2025-08-01T18:52:49.871Z"
"godless-prog916.bsky.social","We are very far over the cliff here folks","2025-08-01T02:02:32.466Z"
"godless-prog916.bsky.social","NYC: August 2nd, we’re taking to the streets across the city. Because it’s time to build community resistance—and that starts with you, in your neighborhood, on your block. Learn how to organize a hyperlocal protest near you: handsoffnyc.com/hyperlocal.","2025-07-31T01:55:21.234Z"
"godless-prog916.bsky.social","#UnitedWeStand","2025-07-31T03:37:21.255Z"
"godless-prog916.bsky.social","Taco Tuesday Parties 🌮🪇💃 @wizardofsmart.bsky.social @arlandolpho.bsky.social @442olds.bsky.social @misty10.bsky.social @unheardnomore.bsky.social @nmsage.bsky.social @pattyger.bsky.social @mysageadvice.bsky.social @teegeebo10.bsky.social @sassysister27.bsky.social @50501media.bsky.social","2025-07-30T01:44:50.834Z"
"godless-prog916.bsky.social","As pretty as he is smart.","2025-07-28T15:16:04.360Z"
"godless-prog916.bsky.social","Is it this administration's policy on pedophile crime to condone it?","2025-07-27T01:08:13.928Z"
"godless-prog916.bsky.social","Who has more on the the other? An understanding only goes so far.","2025-07-25T00:45:44.881Z"
"godless-prog916.bsky.social","slate.com/news-and-pol... Benn six whole months, folks.","2025-07-25T23:15:01.163Z"
"godless-prog916.bsky.social","time.com/7305512/step... Are they gonna go after those stamps, Parker & Stone, as well.? I'm NOT an angry old man. A contemptuous elder? Certainly.","2025-07-25T22:09:17.712Z"
"godless-prog916.bsky.social","SMITE!!!","2025-07-25T16:07:52.624Z"
"godless-prog916.bsky.social","Trey Parker and Matt Stone = muy gigantesco testiculos.","2025-07-25T01:03:43.676Z"
"godless-prog916.bsky.social","www.axios.com/2025/07/24/j... Personally, I'm rather loquacious about as many of his lies, weaknesses, and crimes as come to mind.","2025-07-24T23:58:41.347Z"
"godless-prog916.bsky.social","www.msn.com/en-us/news/n... And this jackass is, nominally, a doctor.","2025-07-24T23:07:51.404Z"
"godless-prog916.bsky.social","Today marks 16 years since the federal minimum wage was last raised. Guess how much the wage would be today if it kept up with worker productivity over the years?","2025-07-24T14:46:29.105Z"
"godless-prog916.bsky.social","Hulk H. has been dead to me since before the last gop national convention - no tears here.","2025-07-24T16:50:21.798Z"
"godless-prog916.bsky.social","www.thedailybeast.com/candace-owen... And the red hats wonder why people think they're assholes.","2025-07-24T03:28:49.016Z"
"godless-prog916.bsky.social","apnews.com/article/colu... Congratulations, Columbia. (resounding golf claps〕 You now have about as much credibility as trump university.","2025-07-24T00:19:52.440Z"
"godless-prog916.bsky.social","theonion.com/doj-removes-... """"JustUs""""","2025-07-23T02:37:59.592Z"
"godless-prog916.bsky.social","""""I'm a humanist because I refuse to be indifferent, wait, or rely on fairytales to fix this world."""" - Widelma Pagain Olivencia","2025-07-22T01:31:11.773Z"
"godless-prog916.bsky.social","Mayhap, an asshole.","2025-07-22T01:14:53.273Z"
"godless-prog916.bsky.social","I'm attending No Kings's event, “One Million Rising: Strategic Non-Cooperation to Fight Authoritarianism” - sign up now to join me! www.mobilize.us/nokings/even... I'm needin' a boost.","2025-07-22T01:10:41.498Z"
"godless-prog916.bsky.social","I’m looking forward to Stephen Colbert sharpening his knife over this year to show the capitulating Paramount what free speech is all about.","2025-07-19T02:36:41.811Z"
"godless-prog916.bsky.social","Secretary of Homeland Security on racial profiling by ICE: “That is not true… Don’t you dare ever say that again.” Who the f*ck does Kristi Noem think she is, addressing a legitimate question like that? It is true. Tom Homan admitted it. Noem is a liar.","2025-07-19T02:34:48.907Z"
"godless-prog916.bsky.social","How are YOU doing in our crazy, new reality?","2025-06-03T23:49:24.099Z"
