"user","post","date"
"homerandherstory.bsky.social","One of the most iconic cells. However, we ask need to keep the suits on. There is too much work to do!","2026-01-28T22:08:27.392Z"
"homerandherstory.bsky.social","Sage words. It's such a pity. The world needs more men like him.","2026-01-28T21:56:54.025Z"
"homerandherstory.bsky.social","A crucial test of NASA’s upcoming crewed flight to the moon is set to take place as soon as Saturday, the agency said","2026-01-27T17:01:03.520Z"
"homerandherstory.bsky.social","Sometimes I look around my classroom and wonder where I’m putting all of this when I’m done.","2026-01-28T21:45:31.135Z"
"homerandherstory.bsky.social","They won’t investigate the murders of Good or Pretti, but they’ll investigate fake 2020 election fraud. www.reuters.com/world/us/fbi...","2026-01-28T17:57:45.118Z"
"homerandherstory.bsky.social","I am currently on my way to another hearing regarding my federal charges for protesting ICE. When I say our leaders must be willing to put everything on the line, I mean it. And frankly, I see it as the bare minimum in this moment.","2026-01-28T16:09:56.545Z"
"homerandherstory.bsky.social","I wrote this song on Saturday, recorded it yesterday and released it to you today in response to the state terror being visited on the city of Minneapolis. It’s dedicated to the people of Minneapolis, our innocent immigrant neighbors and in memory of Alex Pretti and Renee Good. Stay free","2026-01-28T17:02:08.994Z"
"homerandherstory.bsky.social","NASA is preparing to send four astronauts on a flyby of the moon during its Artemis II mission. Thinking of traveling to the Kennedy Space Center in Florida for the event? Here’s what you need to know.","2026-01-28T18:10:03.436206Z"
"homerandherstory.bsky.social","I remember posting this headline before the US election and someone said to me: “what happened to you?! You used to be the weird medical historian and now you have TDS. We don’t want your political opinions.” As if a historian could stay quiet in this moment. Anyway, keep shouting everyone.","2026-01-27T12:57:49.100Z"
"homerandherstory.bsky.social","Hey everyone! I can’t get into my homersherstory account. So, if you see this, feel free to follow. Contact me on another platform if you are unsure. I just can’t get back in there. See you soon! ~Homer","2026-01-28T17:43:18.175Z"
"homerandherstory.bsky.social","Enrique Tarrio, the former leader of the Proud Boys, was sentenced to 22 years in prison for his role in organizing a gang of his pro-Trump followers to attack the Capitol on Jan. 6, 2021, and stop the peaceful transfer of presidential power. www.nytimes.com/2023/09/05/u...","2023-09-05T22:01:17.821Z"
"homerandherstory.bsky.social","This is my city is cooler than yours. The Oriental Theater is always one of my first loves.","2023-09-05T22:44:26.094Z"
"homerandherstory.bsky.social","Milwaukee, 57 years ago today Looking west over the Marquette interchange (then called the “central interchange”) under construction This section of highway replaced the recently bulldozed neighborhood of Tory Hill and Milwaukee’s original Red Arrow Park","2023-08-29T18:49:25.075Z"
"homerandherstory.bsky.social","On this date in 1971, the Milwaukee Brewers announced the hiring of Bob Uecker as a broadcaster. #cardsky","2023-09-04T18:29:12.864Z"
"homerandherstory.bsky.social","Milwaukee, 56 years ago today Emil Blatz Temple of Music at Washington Park","2023-09-05T16:49:37.601Z"
"homerandherstory.bsky.social","The lawsuit by Areej al-Sadhan alleges that Twitter has become a “participant tool” in a campaign of transnational repression by Saudi authorities as part of the company’s effort to monetise its relationship with the kingdom. Saudi Arabia is Twitter’s second-largest investor, after Elon Musk.","2023-05-20T19:29:05.381Z"
"homerandherstory.bsky.social","You may want to purchase an annual subscription to Disney+ before October because that is when their monthly price increases - just in time to ensnare Doctor Who fans who will start watching in November.","2023-08-29T12:36:01.277Z"
"homerandherstory.bsky.social","I am sitting here with my kiddo figuring out what direction I want today to go. Grading papers, binging Doctor Who or Good Omens…","2023-09-02T18:56:54.206Z"
"homerandherstory.bsky.social","I approve of federal judges ruthlessly bullying Ben Shapiro.","2023-09-02T17:06:39.305Z"
"homerandherstory.bsky.social","hey guys check this out","2023-09-02T17:21:39.642Z"
"homerandherstory.bsky.social","DON'T AWOO $350 PENALTY","2023-09-02T16:00:57.679Z"
"homerandherstory.bsky.social","Bluesky welcoming new arrivals from Twitter","2023-08-30T21:19:43.432Z"
