"user","post","date"
"kellyjo29.bsky.social","They've got enough money to throw us into another war, but not enough money to fund the suicide prevention hotline. Very """"pro-life."""" Very """"pro-family."""" So """"GREAT.""""","2025-06-19T01:54:40.495Z"
"kellyjo29.bsky.social","""""I'm happy to report I'm just fine. I lost a button. But I'm gonna sleep in my bed tonight, safe, with my family... At that elevator, I was separated from someone named Edgardo... Edgardo is in ICE detention and he's not going to sleep in his bed tonight.""""","2025-06-17T20:38:43.300Z"
"kellyjo29.bsky.social","this resonates with me a lot.","2025-06-16T19:00:44.944Z"
"kellyjo29.bsky.social","So devastating 💔","2025-06-17T16:21:06.871Z"
"kellyjo29.bsky.social","Always.","2025-06-17T20:30:04.172Z"
"kellyjo29.bsky.social","To recap—the only nation that’s ever used nuclear weapons on civilians, is backing a nation that has 200 nuclear weapons yet denies their existence, to threaten a nation that doesn’t have any nuclear weapons with annihilation if it doesn’t unconditionally surrender its sovereignty Are we great yet?","2025-06-17T22:15:28.612Z"
"kellyjo29.bsky.social","You do not under any circumstances have to give Rand Paul credit. He's not saying anything that thousands of us haven't already been saying. Find someone doing the work on the left and elevate their voice instead ffs.","2025-06-15T17:37:22.221Z"
"kellyjo29.bsky.social","Footage of the Minnesota assassin Vance Luther Boelter, a life long registered republican and """"Christian"""" nationalist incel that hated women. He's 100% MAGA.","2025-06-15T08:02:45.517Z"
"kellyjo29.bsky.social","Hate-filled, Republican, Evangelical Christian, Trump- supporter assassinates Minnesota House Speaker Melissa Hortman and shoots Democratic state legislator and his wife. GOP terrorist Vance Boelter had list of 70 targets. You never hear about a Democrat doing something like this.","2025-06-15T08:52:05.035Z"
"kellyjo29.bsky.social","Vance L. Boelter, killer of Minnesota Lawmaker Melissa Hortman, is a Fundamentalist LGBTQ+-Phobic Christian who voted for Trump (Not Surprised). Liberals, Pro-Choicers, and The LGBTQ+ Community are not threats to Democracy. The real threat is in MAGA's backyard. Your seat in Hell is ready, Vance!","2025-06-15T01:27:29.715Z"
"kellyjo29.bsky.social","Officials ask for help finding Vance Boelter","2025-06-14T20:12:46.364Z"
"kellyjo29.bsky.social","tinyurl.com/5cuuw4ka Coming to Amerikkka","2025-06-13T20:01:20.660Z"
"kellyjo29.bsky.social","We’ve uncovered fraud, waste, and abuse! ICE has now exceeded its congressionally approved budget. ICE is violating the Antideficiency Act by spending beyond Congressional authorization.","2025-06-13T13:09:15.989Z"
"kellyjo29.bsky.social","Who is he? He manhandled Padilla.","2025-06-13T09:41:02.498Z"
"kellyjo29.bsky.social","Predictably, after Gavin Newsom announces that a judge has ruled the National Guard deployment in LA illegal, we then learn that appeal judges have issued a hold on that order. The fact that Newsom had to seek a legal ruling against the president of his own country is surreal & appalling.","2025-06-13T08:44:19.065Z"
"kellyjo29.bsky.social","Truer Words were never spoken about Chump.....","2025-06-13T08:03:14.569Z"
"kellyjo29.bsky.social","And California has 40 million people! Fuckabee is as stupid, ugly, mean, and nasty as her father. Loser family and a LOSER state taking federal funds from California. Fuck those fat fascist idiots!","2025-06-11T21:48:21.878Z"
"kellyjo29.bsky.social","Double.","2025-06-11T17:18:45.761Z"
"kellyjo29.bsky.social","99.9% of L.A. is just fine. 99.9% of Fetterman is not fine.","2025-06-10T19:27:44.630Z"
"kellyjo29.bsky.social","@bluebird4us.bsky.social 💙💙 @pittsburghlady.bsky.social @bluestormcomin1.bsky.social @ellilanderson.bsky.social @sassysister27.bsky.social @filosia.bsky.social @normajeen.bsky.social @dcombes.bsky.social @free2beme.bsky.social @brittboosts.bsky.social @kobe1991.bsky.social @6j1.bsky.social FREE LA","2025-06-10T21:15:02.449Z"
"kellyjo29.bsky.social","#delusional #power... #christofascists #abolishtheocracy","2025-06-10T21:58:33.849Z"
"kellyjo29.bsky.social","chemical warfare","2025-06-10T19:54:17.911Z"
"kellyjo29.bsky.social","Silence is not golden! @moberzan.bsky.social @fireeyebooks.bsky.social @bitchinpost.bsky.social @roytastic.bsky.social @deanobeidallah.bsky.social @markymark757.bsky.social @melissjpeltier.bsky.social @pittsburghlady.bsky.social @chrisdash.bsky.social @pc93.bsky.social youtu.be/Q9jCwonE5sM?...","2025-06-03T18:38:57.092Z"
"kellyjo29.bsky.social","Never forget what Mussolini did! Smeared the press, demanded loyalty, threatened opponents, cried election fraud, and spread lies through state channels… oh wait, that was Taco Donold.","2025-05-31T18:02:23.780Z"
"kellyjo29.bsky.social","Rural Iowa #Iowa #USPS","2025-05-31T22:20:08.890Z"
"kellyjo29.bsky.social","Tell your MAGA relatives and friends this when they go to vote (ht @northjules.bsky.social ty)","2025-05-31T15:38:27.971Z"
"kellyjo29.bsky.social","So just like in America felon 47 is expecting expensive gifts for favorable treatment.","2025-05-31T11:36:50.695Z"
"kellyjo29.bsky.social","#UniteBlue @mrsdeborahlynn.bsky.social @bluestormcomin1.bsky.social @girlybojon.bsky.social @lionkuntz.bsky.social @rosesbloom24.bsky.social @mseesall.bsky.social @tford082.bsky.social @basswell.bsky.social @openforbusiness.bsky.social @orta69.bsky.social @johnbgilman.bsky.social @coko.bsky.social","2025-05-30T18:44:27.159Z"
"kellyjo29.bsky.social","Holy shit. 🤣😂 That's desperately low. No wonder he hates Harvard.","2025-05-30T22:41:15.380Z"
"kellyjo29.bsky.social","One passed laws for your kids. The other passed his hat for your cash.","2025-05-30T18:55:46.554Z"
"kellyjo29.bsky.social","evil personified Republican Sen. Joni Ernst defends proposed Medicaid cuts: 'We all are going to die' Her comment came in response to an attendee who yelled that proposed GOP cuts to Medicaid would cost lives. www.nbcnews.com/news/amp/rcn...","2025-05-30T22:11:24.239Z"
"kellyjo29.bsky.social","JONI ERNST: """"Well, we are all going to die."""" ME: """"You first, dear.""""","2025-05-30T19:20:34.913Z"
"kellyjo29.bsky.social","The new GOP slogan (thank you, Joni Ernst.)","2025-05-30T16:04:41.585Z"
"kellyjo29.bsky.social","Yes sir....A True President....","2025-05-29T11:16:37.929Z"
"kellyjo29.bsky.social","Representative Ashley Hinson voted for the big beautiful bill that Trump wants them to sign. Iowa, now is the time to primary or fire Ms. Hinson. It is obvious she is supporting the rich and not you. If she was supporting you, she would be supporting Medicaid, Medicare, etc.","2025-05-29T05:54:07.261Z"
"kellyjo29.bsky.social","horrific - my country is no longer free...","2025-05-27T14:44:18.237Z"
"kellyjo29.bsky.social","Dear Mike Johnson and friends,","2025-05-26T22:06:37.167Z"
"kellyjo29.bsky.social","The MAGA cult isn’t confused… they’re committed to the lie.","2025-05-26T23:10:49.591Z"
"kellyjo29.bsky.social","Maybe you should try covering the actual sundowning and dementia of the current sitting president...or are you waiting until he destroys the country and causes the fall of Democracy to write a book about it and cash in on the destruction of America by a senile rapist?","2025-05-24T17:48:38.829Z"
"kellyjo29.bsky.social","Thanks for showing us your just another scumbag tapper so I can block your stupid ass","2025-05-22T17:29:27.003Z"
"kellyjo29.bsky.social","Jake Tapper providing Fox and CNN with a month of content.","2025-05-24T00:59:46.314Z"
"kellyjo29.bsky.social","Chloe and Emma having a beautiful #Caturday on the Catio.","2025-05-25T00:02:59.920Z"
"kellyjo29.bsky.social","Never Forget ‼️","2025-05-24T23:22:58.612Z"
"kellyjo29.bsky.social","Little boys. 💕 Postcard from my collection, unsent, 1902.","2025-05-23T22:04:11.077Z"
"kellyjo29.bsky.social","My Congressman, Sam Graves, voted to gut Medicaid. This is a map of how many folks he couldn’t give two shits about…","2025-05-23T02:50:30.958Z"
"kellyjo29.bsky.social","Am I crazy or did we just have a convo about how we can't fund cancer research?","2025-05-23T02:23:23.611Z"
"kellyjo29.bsky.social","Imagine how we would view this if it was happening in another country","2025-05-23T01:38:07.277Z"
"kellyjo29.bsky.social","Remote control.","2025-05-16T13:29:48.175Z"
"kellyjo29.bsky.social","Wells Fargo Proposes USPS Privatization Plan; Faces Legislative and Public Pushback READ MORE HERE: dammedifyoudont.blogspot.com/2025/05/well... #USPSFuture #PostalPrivatization #WellsFargoPlan #ProtectThePostalService #MailForAll #PostalReform #CongressDebate #PostalRates #PostalJobs #RuralMail","2025-05-14T06:33:46.603Z"
"kellyjo29.bsky.social","Jake Tapper can take his book and shove it. The end.","2025-05-13T21:20:56.650Z"
"kellyjo29.bsky.social","Under court order, the government has released a nearly unredacted copy of the memorandum of understanding between the IRS and Homeland Security revealing how taxpayer data was shared for immigration enforcement.","2025-05-13T21:29:28.465Z"
"kellyjo29.bsky.social","Dearest DNC. I support David. I hope he goes full Hogg! Love and hisses, - xxx","2025-05-13T02:33:31.038Z"
"kellyjo29.bsky.social","Having now watched the footage and interview two of the members who were there, the amount of armed, masked federal agents surrounding three members of Congress and a mayor outside the ICE facility was totally unnecessary; the only possible reason for it was intentional escalation and intimidation.","2025-05-10T01:39:31.951Z"
"kellyjo29.bsky.social","Ras Baraka elevated in 1 day for standing up to fascism. Democrats, learn from this.","2025-05-10T00:48:43.420Z"
"kellyjo29.bsky.social","On my way to Newark, NJ to cover America's mayor, Ras Baraka ✌️ w/ @peoplesworld1924.bsky.social","2025-05-09T21:23:30.213Z"
"kellyjo29.bsky.social","He's emerged. He's free! The crowd is crazy. No one will let him leave, so he takes the podium. Massive cheers. I can't hear a word he's saying.","2025-05-09T23:55:21.687Z"
"kellyjo29.bsky.social","Ras Baraka is free.","2025-05-10T01:00:09.196Z"
"kellyjo29.bsky.social","The Mayor needs to sue FOX News for saying he broke into the facility. The lies must end!!","2025-05-10T00:31:31.714Z"
"kellyjo29.bsky.social","Newark Mayor Ras Baraka has been released after he was arrested for allegedly trespassing at an ICE facility in New Jersey pix11.com/news/local-n...","2025-05-10T00:24:05.344Z"
"kellyjo29.bsky.social","I want to see the Mayor of Newark. Seriously every other post can wait until tomorrow","2025-05-09T23:30:47.255Z"
"kellyjo29.bsky.social","HAPPENING NOW: Hundreds of protesters chant “Free our Mayor!” outside the DHS building in Newark, NJ where Mayor Ras Baraka is being held (Video: @spydermonkeywatch.bsky.social)","2025-05-09T23:20:45.740Z"
"kellyjo29.bsky.social","✊✊✊✊✊✊NJ Resisters! We ♥ U!","2025-05-09T23:48:59.657Z"
"kellyjo29.bsky.social","Mexico has sued Google for changing the Gulf of Mexico’s name to “Gulf of America” for Google Maps users in the United States, Mexican president Claudia Sheinbaum said on Friday.","2025-05-09T22:03:21.201Z"
"kellyjo29.bsky.social","She’s out!! They have released Ozturk from ICE custody!","2025-05-09T22:24:16.320Z"
"kellyjo29.bsky.social","This day keeps getting better.","2025-05-08T19:00:25.764Z"
"kellyjo29.bsky.social","@andertoon.bsky.social","2025-05-08T10:42:01.383Z"
"kellyjo29.bsky.social","The bronzer is looking rather Wonka lately.","2025-05-07T21:48:11.689Z"
"kellyjo29.bsky.social","5calls.org","2025-05-06T21:28:45.177Z"
"kellyjo29.bsky.social","Trump on Letitia James: """"She's a disaster for New York. She's a horrible, horrible human being. And I think she's a total crook. There's no question about it. But that's just my opinion. Pam is gonna have to do what she wants. She's a very bad person ... she's a sick person.""""","2025-05-06T21:22:21.616Z"
"kellyjo29.bsky.social","Just insanity","2025-05-06T21:22:44.436Z"
"kellyjo29.bsky.social","We should understand this for what it is: an effort to build public consent for the president to ignore the Supreme Court. abcnews.go.com/Politics/jus...","2025-05-06T12:28:32.621Z"
"kellyjo29.bsky.social","It’s not deportations. It’s human trafficking.","2025-05-06T13:29:24.226Z"
"kellyjo29.bsky.social","FIGHT BACK! Join Tony's Substack: https://thetonymichaels.substack.com/","2025-05-06T14:02:21.321372Z"
"kellyjo29.bsky.social","The United States was built on racism and hate. No matter how much fascist MAGA republicans try to erase this history, it’ll never be forgotten.","2025-05-06T04:39:53.476Z"
"kellyjo29.bsky.social","This Saturday May 10th At the Astoria Hidden Underground! #astoriaoregon #livemusic #musicsky #megatonleviathan","2025-05-06T00:58:21.266Z"
"kellyjo29.bsky.social","It fascinates me that giving to charity is considered ‘noble and praiseworthy’… But, creating an economic system that works for EVERYONE and doesn't require charity, is considered socialist and evil. Mind-boggling. 😎✨","2025-04-19T08:42:23.657Z"
"kellyjo29.bsky.social","Not the same indeed.","2025-04-18T15:58:40.688Z"
"kellyjo29.bsky.social","Not even close.","2025-04-18T22:38:59.154Z"
"kellyjo29.bsky.social","If as President you answer “I don’t know” when asked if you’ll follow the Constitution, you have violated your oath of office and should be removed.","2025-05-05T21:43:10.719Z"
"kellyjo29.bsky.social","Jasmine Crockett isn't being quiet about it—when it's time to elect the next House Oversight Committee ranking member, she wants the job. And she’s earned it. Let's back up @repjasmine.bsky.social . We need her voice in leadership—ASAP!","2025-05-05T13:15:01.474Z"
"kellyjo29.bsky.social","😂😂😂😂😂😂","2025-05-04T20:26:08.433Z"
"kellyjo29.bsky.social","No toys for thousands of kids this Christmas, but billionaires are out here buying yachts with yachts inside them. It’s like nesting dolls, but with tax shelters.","2025-05-04T20:38:01.087Z"
"kellyjo29.bsky.social","Jimmy Carter’s peanut farm seems rather quaint now.","2025-05-04T02:42:31.025Z"
"kellyjo29.bsky.social","I am an American, born and raised. I am humiliated to have this individual as our POTUS - and I am angered by the stupidity of those who voted for him without caring enough to educate themselves about Project 2025 and the nitty gritty details of his plans. #WeThePeople #DemVoice1 #ProudBlue","2025-05-04T14:21:09.015Z"
"kellyjo29.bsky.social","The Economy Only Works For One Group Of Individuals And Not The Rest Of Us….","2025-05-03T21:24:30.202Z"
"kellyjo29.bsky.social","Mitch McConnell is retiring after 40 years of working hard to make Kentucky one of the poorest, most under-educated, and unhealthy states in the US.","2025-05-03T18:50:10.376Z"
"kellyjo29.bsky.social","“Holy rusted metal, Batman!""""","2025-05-04T01:04:33.580Z"
"kellyjo29.bsky.social","Let us be the sunlight that destroys the mold upon our nation.","2025-05-04T01:49:47.569Z"
"kellyjo29.bsky.social","Sometimes I just stop, shake my head, and think how ridiculous it is watching my country be destroyed by a demented old man just because some white people are afraid of the future.","2025-05-04T01:53:16.034Z"
"kellyjo29.bsky.social","Your School House Rock moment...🤔","2025-05-02T18:56:11.581Z"
"kellyjo29.bsky.social","#SaturdayNightParties🎊 @kylegcrider.bsky.social @clareosel.bsky.social @rkdoctr.bsky.social @frankieflowetry.bsky.social @fugop.bsky.social @bullfrog142.bsky.social @oceangirl19.bsky.social @pattyger.bsky.social @judithbolyard.bsky.social @knighthawk899.bsky.social @dumptytrump.bsky.social","2025-05-04T01:29:00.179Z"
"kellyjo29.bsky.social","bsky.app/profile/bigg...","2025-05-04T00:53:02.166Z"
"kellyjo29.bsky.social","🤮","2025-05-03T21:56:33.501Z"
"kellyjo29.bsky.social","And there you have it.","2025-05-04T00:23:08.325Z"
"kellyjo29.bsky.social","And Here We Are All At Once….","2025-05-03T00:32:04.485Z"
"kellyjo29.bsky.social","Quite the compliment coming from one of my favorite accounts on this platform. Thanks for all you do, Rick! From your fan, Mar🐫","2025-05-02T21:03:30.262Z"
"kellyjo29.bsky.social","A Huge Thank You 🙏💙🙏 to Roy @roy040.bsky.social for adding me to their excellent first starter pack, I feel honoured to be included, do follow. #Resisters #StrongerTogether go.bsky.app/JGVi8Xs","2025-05-02T13:40:36.106Z"
"kellyjo29.bsky.social","💢 Kegsbreath orders the Army to ELIMINATE WASTE by cutting 1K jobs! The Army's Military Parade for tRuMp'S birthday will include: 🪖 6,600 Soldiers 🪖 159 Vehicles 🪖 50 Helicopters & Tanks 🪖 7 Bands 🪖 2000 Civilians 💢 At a cost of $92M #Voices4Victory #BlueSkyVets #ONEV1","2025-05-02T19:25:01.148Z"
"kellyjo29.bsky.social","Members of Congress should not be able to trade stocks. It's a huge conflict of interest because they vote on matters that affect stock prices. So sleazy.","2025-05-02T00:32:30.219Z"
"kellyjo29.bsky.social","“This is taxpayer-funded, state-sponsored religious indoctrination. You’ve just got to call it what it is.”","2025-05-01T21:10:50.436Z"
"kellyjo29.bsky.social","She should have been president","2025-05-02T01:43:07.611Z"
"kellyjo29.bsky.social","Socialism is what they called public power. Socialism is what they called social security. Socialism is what they called the growth of free and independent labor organizations. Socialism is their name for almost anything that helps all the people. —Harry Truman, 1952","2025-05-01T21:31:09.827079Z"
"kellyjo29.bsky.social","I’m proud to join the great Cyndi Lauper in the fight for women’s rights & healthcare. Go to www.bonfire.com/girlswantrights2025 to get a shirt and learn more about the #GirlsJustWantToHaveFundamentalRights Fund. @tidescommunity.bsky.social","2025-05-01T20:52:52.802Z"
"kellyjo29.bsky.social","Cal-Maine, the biggest egg producer, has been accused of using bird flu as cover to jack up prices and triple its profits from a year ago. It also received $22M in federal aid. While you're getting gouged at the grocery store, your tax dollars are subsidizing corporate greed.","2025-05-01T19:15:12.774627Z"
"kellyjo29.bsky.social","Son of immigrants, Marco Rubio, calls human beings """"despicable"""" and wants to dump them in other countries like trash. Since he loves authoritarian cruelty so much, he should deport himself to Cuba’s dictatorship and stop violating the rule of law. If despicable has a face in this story—It’s him.","2025-05-02T00:00:54.909Z"
"kellyjo29.bsky.social","If this doesn't sit well with you either...🦋🫂🦋 we should be friends","2025-05-01T11:27:08.098Z"
"kellyjo29.bsky.social","April 28, 2025: Migrants are making SOS signs out of their bodies so drones can see them at our country's concentration camps.","2025-04-30T19:08:14.367Z"
"kellyjo29.bsky.social","It’s National Adopt a Shelter Pet Day! As most of you know, I’m a passionate advocate for adoption. Not only to save the lives of superb shelter cats like Fergus & Francie, but to withhold money from the commercial breeding world which has done tremendous harm to the health of so many “purebreds”. 💔","2025-04-30T19:05:12.321Z"
"kellyjo29.bsky.social","Good morning! ☕️☀️😎🎶☮️🌺💙","2025-04-30T10:47:08.971Z"
"kellyjo29.bsky.social","Good morning 🌞 🙏🏼","2025-04-28T10:06:44.244Z"
"kellyjo29.bsky.social","Remember this guy? The South African nazi that stole all your most valuable data? Literally can't wait for his one-way ticket to mars...but any so called deportation to a random prison dungeon will do.","2025-04-28T00:17:59.919Z"
"kellyjo29.bsky.social","Thanks so much Monica for including me. I found a new friend to follow @zodzilla.bsky.social Hope you'll FB.","2025-04-28T01:01:14.791Z"
"kellyjo29.bsky.social","Hey Night Owl 🦉 Raise your hand if you are tired of America being an embarrassment on the world stage! 👋🏾 Repost 🔄 #FuckTrump #FuckMusk #BlueCrew","2025-04-28T00:59:45.619Z"
"kellyjo29.bsky.social","Good info","2025-04-28T00:51:09.768Z"
"kellyjo29.bsky.social","@bluestormcomin1.bsky.social @oceangirl19.bsky.social @pattyger.bsky.social @piratewenchart.bsky.social @jerasikehorn.bsky.social @happysnarkygal.bsky.social @allychicago.bsky.social @resist4harris.bsky.social @therickydavila.bsky.social @jamellebouie.net @cwebbonline.com @hcrichardson.bsky.social","2025-04-27T21:51:22.559Z"
"kellyjo29.bsky.social","TAX THE RICH would make a great sign! mobilize.us FiftyFifty.one","2025-04-27T21:01:51.199Z"
"kellyjo29.bsky.social","MAGA created a website called PublicSquare, “the anti-woke online marketplace,” to promote businesses that support Donald Trump. It's now being used by liberals to know which local and online companies to boycott. 🍿","2025-04-27T15:07:49.652Z"
"kellyjo29.bsky.social","Please find a protest near you for this Thursday, May 1. Protest is Democracy at work. Do not obey. actionnetwork.org/event_campai... #DemVoice1 #USDemocracy","2025-04-26T19:12:23.804Z"
"kellyjo29.bsky.social","Thinks about this: Trump is more unpopular now than he was at this point in '17, and yet more institutions have bowed to him now, all based on myth of him having more popular support and a claimed """"mandate."""" Time to wake the hell up. Columbia, the law firms, Newsom, etc., all miscalculated badly.","2025-04-27T17:25:41.149Z"
"kellyjo29.bsky.social","Detroit, MI ❤️‍🔥","2025-04-27T13:05:06.071Z"
"kellyjo29.bsky.social","It was all but certain that he would embarrass America at the Pope’s funeral.","2025-04-27T11:12:15.573Z"
"kellyjo29.bsky.social","Amen.","2025-04-26T22:21:38.349Z"
"kellyjo29.bsky.social","Destroying the USPS has been the fever dreams of the Republican party for decades as they didn't like the power of the Postal Union and the fact that the USPS was a gateway to the middle class for scores of people of color including immigrants. Back in 2006, the Repubs tried to bankrupt USPS.","2025-04-24T15:11:31.791Z"
"kellyjo29.bsky.social","IT IS SO GLORIOUS 🙌🏽","2025-04-26T22:52:48.534Z"
"kellyjo29.bsky.social","Followed all Thank you Fuck Trump #TheResistance","2025-04-26T01:24:17.690Z"
"kellyjo29.bsky.social","l.smartnews.com/p-kuatqg8/NI...","2025-04-24T02:12:15.019Z"
"kellyjo29.bsky.social","Since Trump want to do this, LFG!!! 💥","2025-04-24T20:00:30.481Z"
"kellyjo29.bsky.social","Trump’s organization is out here selling Trump 2028 hats like the Constitution is just a suggestion. Reminder: The 22nd Amendment exists. You can’t run for a third term.","2025-04-24T20:00:30.294Z"
"kellyjo29.bsky.social","Newsom: In 2023, Californians contributed $83.1 billion more to the federal government than we received back. And for your viewers: that other state—Texas—took $71.1 billion more than it contributed to the federal government. California: $83 billion, contributor. Texas: taker.","2025-04-24T20:04:14.883Z"
"kellyjo29.bsky.social","Trump and his administration have lost seven cases so far today.","2025-04-24T20:12:06.162Z"
"kellyjo29.bsky.social","When the moment came, Harvard didn’t hedge or flinch—it stood up. A reminder that integrity isn’t complicated, it’s just rare.","2025-04-24T20:51:47.099Z"
"kellyjo29.bsky.social","Pileated Woodpecker near Mississippi River Illinois #birds","2025-04-24T11:00:28.077Z"
"kellyjo29.bsky.social","Emma loves her naps!","2025-04-24T21:54:09.124Z"
"kellyjo29.bsky.social","Emma loves her naps!","2025-04-24T21:54:09.124Z"
"kellyjo29.bsky.social","Pileated Woodpecker near Mississippi River Illinois #birds","2025-04-24T11:00:28.077Z"
"kellyjo29.bsky.social","Push Shitler’s approval ratings into the 30s and keep them there. Keep highlighting the corruption, and keep up the ridicule.","2025-04-24T06:41:33.411Z"
"kellyjo29.bsky.social","Who else AGREES with David?! 🤚 One. Of. The. Good. Guys. 😎✨","2025-04-24T08:29:17.503Z"
"kellyjo29.bsky.social","Pete Hegseth installed a make-up station at the Pentagon. JD Vance loves a smoky dark eyeliner. Trump cakes on orange base till he resembles an Oompa Loompa. And these guys say LGBTQs are threatening gender norms?","2025-04-24T09:54:06.308Z"
"kellyjo29.bsky.social","THIS IS WILD‼️ Florida got $67M from a Medicaid fraud settlement. Instead of using it for actual health care, Casey DeSantis funneled $10M to a “charity” she controls. That “charity” passed it to anti-abortion and anti-marijuana groups—who then helped fund GOP campaigns. Both measures lost!","2025-04-23T19:52:47.832Z"
"kellyjo29.bsky.social","god this shit is blood boiling","2025-04-23T20:55:47.861Z"
"kellyjo29.bsky.social","Bluesky is collegial and interesting, the way Twitter used to be. Bonus: most people can spell.","2025-04-23T12:39:46.081Z"
"kellyjo29.bsky.social","Our campaign will be different - not just because I left the FBI to do it. Here’s some more insight into why I chose to step up right now. Give this article a read and follow along for more updates. fbisullivan.substack.com/p/two-weeks-...","2025-04-22T18:28:43.921Z"
"kellyjo29.bsky.social","Thank you! The outpouring of support today is unbelievable. If you haven’t already, there’s still time. Become a founding donor right now. secure.actblue.com/donate/fl-su...","2025-04-22T21:26:55.383Z"
"kellyjo29.bsky.social","MAJOR BREAKING: The FBI Section Chief who resigned and exposed Kash Patel and Donald Trump for weaponizing the FBI just announced he’s RUNNING FOR CONGRESS! John Sullivan is a former intelligence officer and is bringing receipts. Now he wants to FLIP a seat. Let’s go!!","2025-04-22T19:06:09.657Z"
"kellyjo29.bsky.social","By, MAGA","2025-04-22T23:10:23.213Z"
"kellyjo29.bsky.social","resistancekitty.com/why-rfk-jr-s...","2025-04-22T22:25:02.227Z"
"kellyjo29.bsky.social","👀","2025-04-22T20:56:31.343Z"
