"user","post","date"
"kellyjo29.bsky.social","Guess which ‘one’ hasn’t figured it out yet?! 👇 Just one guess. 🇺🇸","2024-12-18T10:27:00.185Z"
"kellyjo29.bsky.social","Chris Murphy: """"I read the headlines about the Liz Cheney criminal referral and almost every single one of them in mainstream media played this straight as if it was a normal function of legislative power, instead of telling the truth, which is that this is made up out of thin air.""""","2024-12-18T21:14:17.474Z"
"kellyjo29.bsky.social","Making a list and checking it twice…","2024-12-18T15:18:13.503Z"
"kellyjo29.bsky.social","How many independent media and podcast interviews did the leaders of the Democratic Party do today, since they are now starting to talk a big game about “building up progressive alternative media?” Don’t just talk about it, lead by example, and don’t just keep doing cable news.","2024-12-18T17:31:37.618Z"
"kellyjo29.bsky.social","What we're witnessing is nothing short of: Wealthy over working class, Sycophancy over skill, Trump-loyalty over ethics, Division over unity, Power over people. This is going to be more polarized, intolerant, divisive, hateful, tinpot autocratic MAGA.","2024-12-16T01:34:47.001Z"
"kellyjo29.bsky.social","💔","2024-12-17T08:07:30.989Z"
"kellyjo29.bsky.social","Another school shooting….more dead kids. This one in an area of Madison, WI that I know so well. This shit has got to stop & it starts with the @GOP putting our children’s lives before their goddamn A+ ratings with the NRA! End these needless deaths! #EndGunViolenceNow #DemsUnited #BlueCrew","2024-12-17T01:25:07.432Z"
"kellyjo29.bsky.social","I don’t want to hear about the “radical left” from people who pose their kids with guns for Christmas cards.","2024-12-17T11:16:36.268Z"
"kellyjo29.bsky.social","YOU'VE been warned @variety.bsky.social asked me to answer the question """"What Does MSNBC Do Now?"""" in 700 words or so so I wrote 4000 and trimmed it It posts tomorrow morning at 10 Eastern and is a) surprisingly optimistic and b) surprisingly pro-management🤷🏼‍♂️","2024-12-16T23:57:59.320Z"
"kellyjo29.bsky.social","Hey GOP crazies-Stay out of our Vaginas!","2024-12-16T23:13:50.904Z"
"kellyjo29.bsky.social","Horrible this happens. Here is how people can help! woundedpawproject.org/the-amish-co...","2024-12-17T05:18:45.800Z"
"kellyjo29.bsky.social","Interesting idea from @benwikler: He tells me that if he's chair, the Dem Party will actively empower/elevate a progressive media infrastructure, by getting Dem officials to feed it scoops and big interviews. This would go farther than what exists now. 4/ newrepublic.com/article/1891...","2024-12-09T16:53:36.551Z"
"kellyjo29.bsky.social","USPS privatization has been in the works for some time now. Trump-appointed Postmaster General Louis DeJoy has been doing his best to corrode one of the oldest, constitutionally ensured institutions in this country.","2024-12-17T00:43:34.163Z"
"kellyjo29.bsky.social","Here's a free idea for the USPS Board of Governors: Fire Louis DeJoy","2024-12-13T19:39:53.502Z"
"kellyjo29.bsky.social","SUPPORT our INDEPENDENT reporting on the for-profit healthcare industry for as low as $5 bucks a month: statuscoup.com/join/","2024-12-16T18:00:17.612Z"
"kellyjo29.bsky.social","EXCLUSIVE: Ex-United Healthcare employee Jenny reveals employees complained about a quota system they were ordered to meet for denying patient claims. FULL INTERVIEW below.","2024-12-16T18:00:17.610Z"
"kellyjo29.bsky.social","CNN Compares Brian Thompson to John Lennon & George Floyd, SLAMS """"Out of His Mind"""" Luigi Mangione PREMIERING NOW: youtu.be/kBCO40U7dMw?...","2024-12-16T18:46:15.324Z"
"kellyjo29.bsky.social","NY to Create Crisis Hotline for Worried CEOs? Luigi Mangione Pushed as DOMESTIC TERRORIST LIVE NOW: youtube.com/live/9AfBqju...","2024-12-16T22:05:24.218Z"
"kellyjo29.bsky.social","Facebook ain’t what it use to be anymore and it ain’t fun anymore. On the plus side, there is more competition and the social media market just got hotter. Due to more platforms competing to take users away from Facebook. Facebook’s days are numbered & they’ll wind up being the next MySpace.","2024-12-16T14:47:00.333Z"
"kellyjo29.bsky.social","JB Pritzker is a real patriot, a real fighter…","2024-12-16T06:10:33.278Z"
"kellyjo29.bsky.social","Now would be a good time to read up on the alt-right ideology that drove the megalomaniacal, Paypal psychopaths (Musk & Thiel) to spend $$$ to elect Trump and Vance and who are gearing up to do the same w Poilievre in Canada and Farage in UK Buckle up. english.elpais.com/usa/2024-11-...","2024-12-15T16:40:45.526Z"
"kellyjo29.bsky.social","#Resist #BlueCrew #Trump #GOP #MAGA","2024-12-16T02:17:03.340Z"
"kellyjo29.bsky.social","Truth","2024-12-16T02:04:05.429Z"
"kellyjo29.bsky.social","Ghandi once said he could never have beat Nazis the way he beat British because Nazis have no conscience and only care about the goal. MAGA is the same. So how do you survive when you cannot reason with people who hold great power over you?","2024-12-16T00:27:13.116Z"
"kellyjo29.bsky.social","Took this photo while delivering mail a few days ago. #USPS #NaturePics #Birds","2024-12-16T01:55:23.942Z"
"kellyjo29.bsky.social","🫠","2024-12-13T19:12:12.181Z"
"kellyjo29.bsky.social","Trump Supporter: “How come everyone who goes to college is a Biden supporter?” Follow for more!","2024-11-24T23:06:36.475Z"
"kellyjo29.bsky.social","Beautiful!","2024-12-15T19:44:58.947Z"
"kellyjo29.bsky.social","Trump posted this pic on X. You get it, right? It’s about the drone sightings in NJ Regardless of what you think of Christie, ask yourself should the President elect of the United States be using his platform to attack and make fun of any American? Here we go again! The madness has started.","2024-12-16T00:08:54.869Z"
"kellyjo29.bsky.social","Watching #TradingPlaces a great depiction of #CorruptCapitalism","2024-12-16T00:08:53.601Z"
"kellyjo29.bsky.social","If we taxed the wealthy, the churches, and big corporations our country would have enough money to fund healthcare and food security for everyone.","2024-12-15T21:48:13.925Z"
"kellyjo29.bsky.social","California, a state of nearly 40,000,000 people, has the same amount of representation in the United States Senate as Wyoming, a state of less than 600,000 people. This is the direct result of a deal struck between slave states and free states in the 1700s. It’s time for that to change.","2024-12-15T19:46:09.922Z"
"kellyjo29.bsky.social","Exactly! 💯","2024-12-14T22:02:21.368Z"
"kellyjo29.bsky.social","BREAKING: Biden has been asked to pick Jack Smith for the federal court so Trump can't fire him. Special Counsel Jack Smith can't be fired by Trump if he becomes a federal Judge. DO IT JOE!!","2024-11-23T03:37:48.420Z"
"kellyjo29.bsky.social","Oligarchs corrupt governance, weakening democracy by hoarding power and wealth. They suppress diversity, erode social equity, and expose institutions to corruption. A society rooted in inequality can never uphold the common good.","2024-12-15T20:50:03.470Z"
"kellyjo29.bsky.social","What do you think?","2024-12-11T17:08:47.308Z"
"kellyjo29.bsky.social","Concert ERUPTS When Luigi Mangione's Face Appears PREMIERING NOW: youtu.be/yvPW-AOR2jM?...","2024-12-14T18:00:38.452Z"
"kellyjo29.bsky.social","Pretty damn spot-on, don’t you think?","2024-12-14T21:10:09.445Z"
"kellyjo29.bsky.social","Look at this happy spoiled loaf. 🍞 Photo from my collection, no date/other info known.","2024-12-15T02:13:58.579Z"
"kellyjo29.bsky.social","Is it too late to post a #Caturday #CatPics post? My baby, Emma.","2024-12-15T03:10:06.027Z"
"kellyjo29.bsky.social","Actually, Leon, the 'propaganda words' we use for 'violent drug addicts with severe mental illness' are """"X Management Team""""","2024-12-10T17:20:34.232Z"
"kellyjo29.bsky.social","Downloaded a Santa with a green screened computer so I can make it look like he's judging bad takes","2024-12-13T21:47:26.835Z"
"kellyjo29.bsky.social","i am convinced that these people are death worshippers who want to spread as much disease and sickness as possible (i also think this is all tied up in eugenic beliefs about the “survival of the fittest” www.nytimes.com/2024/12/13/h...","2024-12-13T12:08:17.198Z"
"kellyjo29.bsky.social","A Version of the Atomic Whirl: Created by the American Atheists in 1963, this symbol represents the idea that scientific inquiry & the scientific method are the best ways to achieve human progress. Has a broken lower loop to represent that all is not known. @atheists.org","2024-12-13T02:32:30.122Z"
"kellyjo29.bsky.social","That will barely cover Don Jr’s cocaine!!","2024-12-13T00:06:42.509Z"
"kellyjo29.bsky.social","Friends, I create various handmade jewelry with soul✨️ Please help spread my shop, here you will find good ideas for gifts🎁🎄 made in Ukraine💙💛 Support my work with your purchase, sharing or donation❤️🫂 www.etsy.com/shop/NadiiaJ... Thank you🥰","2024-12-04T01:20:31.476Z"
"kellyjo29.bsky.social","I’m watching the 1938 version of a Christmas Carol. My personal favorite. Which one is your favorite? #Christmas #AChristmasCarol #ClassWarfare","2024-12-13T20:34:11.323Z"
"kellyjo29.bsky.social","Looks like it’s time to start dusting off this ol’ guy again.","2024-12-13T12:20:46.947Z"
"kellyjo29.bsky.social","Unrealistic hope is like a drug; it fogs the brain & can prevent you from seeing the reality you are living in. You want to “dream of a better future” when the present is falling part around you. Wake the fcuk up!","2024-12-12T17:34:27.445Z"
"kellyjo29.bsky.social","""""DeJoy"""" is French for """"Where is my f*cking mail?""""","2024-12-11T11:32:21.051Z"
"kellyjo29.bsky.social","Trump-appointed Postmaster General Louis DeJoy covers his ears with his hands today while Republican Rep. Rich McCormick yells at him for destroying the Post Office.","2024-12-10T18:32:12.664Z"
"kellyjo29.bsky.social","👍 #TruthWarriors","2024-12-12T01:14:10.496Z"
"kellyjo29.bsky.social","Season’s Greetings 🎄","2024-12-10T14:31:30.274Z"
"kellyjo29.bsky.social","Let's make it a trend. 《 524 》 to go ! #donatetoukraine #NAFO #boostUA","2024-12-10T10:59:11.523Z"
"kellyjo29.bsky.social","I want to repost this thread about Boosty by @UAartists on twitter, because information like this needs to be known and shared more. #Ukraine #StandWithUkraine 🧵⬇️","2024-12-06T14:22:07.150Z"
"kellyjo29.bsky.social","Freedom *from* religion. That works for me.","2024-12-09T21:27:17.416Z"
"kellyjo29.bsky.social","The mugshot of Luigi Mangione has been released.","2024-12-09T23:16:55.977Z"
"kellyjo29.bsky.social","“We The People” can do better than this shit Let us teach our children compassion, empathy, and kindness. Let it begin at home. #SheShed","2024-12-08T22:34:16.860Z"
"kellyjo29.bsky.social","Just like Mussolini did","2024-12-08T20:43:51.226Z"
"kellyjo29.bsky.social","FACT: The United States is the only developed country in the world without universal health coverage for all of its citizens - and that's absolutely shameful, especially for the most wealthy nation on the planet. #HealthCareForAll","2024-12-08T18:59:17.511Z"
"kellyjo29.bsky.social","This","2024-12-06T14:26:23.490Z"
"kellyjo29.bsky.social","That’s why I propose in the podcast setting up a large legal defense project …. Would require a lot of pro bono legal work and and funding. But I think it can be done. More lawyers need to get onto defending the rule of law.","2024-12-07T16:59:48.018Z"
"kellyjo29.bsky.social","Every resistance act matters.","2024-12-07T22:01:59.084Z"
"kellyjo29.bsky.social","Loveland police have arrested a former school custodian, 85 year-old Charles Littrell, after he allegedly exposed himself in a middle school bathroom. Yo, Nancy Mace, it's not a transgendered person.","2024-12-08T20:26:48.480Z"
"kellyjo29.bsky.social","Accurate.","2024-12-03T06:39:40.413Z"
"kellyjo29.bsky.social","$277 million? He spent $44B on Twitter and turned it into a weapon of propaganda for the right.","2024-12-08T18:29:24.267Z"
"kellyjo29.bsky.social","Sickening hypocrisy.","2024-12-08T10:02:26.761Z"
"kellyjo29.bsky.social","In the spirit of government efficiency, we could skip Tulsi Gabbard's nomination and DM our intelligence directly to Vladimir Putin.","2024-12-08T13:07:45.646Z"
"kellyjo29.bsky.social","😅😂🤣","2024-12-07T09:32:12.058Z"
"kellyjo29.bsky.social","Idk if this website is well known but I just found it and it puts wealth inequality into perspective so well. (But also made me super depressed knowing how many things could be fixed with just a fraction of these hyper rich people’s money, so beware lol) mkorostoff.github.io/1-pixel-weal...","2024-12-07T23:25:36.355Z"
"kellyjo29.bsky.social","Amid the backdrop that more than a dozen members of Trump's Cabinet are billionaires, a reminder that this is what happened to income inequality in this country once the tax rate for top earners was slashed after 1980. Trickle down does not work and top earners' priority is themselves.","2024-12-08T00:08:20.494Z"
"kellyjo29.bsky.social","Today's lesson discusses the American health care system for those in countries where their system provides care for free or reasonable fees. 👇","2024-12-07T10:36:39.625Z"
"kellyjo29.bsky.social","What happened to this country?","2024-12-07T23:26:08.344Z"
"kellyjo29.bsky.social","Pat Bagley","2024-12-08T01:56:54.134Z"
"kellyjo29.bsky.social","Leader Jeffries joined me on stage for a live discussion where no topic was off limits. We discussed Matt Gaetz's ethics report, Democrats' inability to learn that offering concessions to Republicans garners no goodwill, the growing power of independent media, and more. Give it a watch:","2024-12-08T01:52:55.078Z"
"kellyjo29.bsky.social","Exactly","2024-12-07T18:06:23.225Z"
"kellyjo29.bsky.social","Your Body My Prison","2024-12-07T05:55:20.192Z"
"kellyjo29.bsky.social","If you think Pete Hegseth is a crazy pick, unfit for Sec of Defense, wait until you hear who the President is going to be.","2024-12-07T00:22:21.238Z"
"kellyjo29.bsky.social","My Christmas Cat decorations #CatPics #Christmas","2024-12-08T01:24:09.415Z"
"kellyjo29.bsky.social","if we don't count them they didn't happen! www.youtube.com/watch?v=61Y7...","2024-12-07T20:26:18.552Z"
"kellyjo29.bsky.social","Of all the things I miss the most my sanity ranks at the top.","2024-12-07T16:18:54.923Z"
"kellyjo29.bsky.social","🙋‍♂️","2024-12-05T22:16:04.095Z"
"kellyjo29.bsky.social","The fact this guy hasn’t been identified yet has shattered the illusion of the bourgeoise being untouchable because of the surveillance state in my mind","2024-12-06T16:40:09.846Z"
"kellyjo29.bsky.social","here's today's post: 'Dark Brandon: “maybe I’ll become a pardon factory”' — firewalls against fuckery need to be constructed now. thanks for reading, and please sign up for my daily newsletter so you never miss a post —","2024-12-05T15:54:10.865Z"
"kellyjo29.bsky.social","Morning Joe - that elite & arrogant POS. Yelling at the audience is HARASSMENT. F them. Mika sitting there SMUG while her and him ABUSE their audiences. Disgusting, gaslighting BS. I dislike Joe Scarborough & always have. He reminds me of my abusive Ex. #MorningJoe","2024-12-07T10:57:17.816Z"
"kellyjo29.bsky.social","Yes sir","2024-12-06T19:26:49.227Z"
"kellyjo29.bsky.social","Ready for Yuletide?","2024-12-06T16:05:37.065Z"
"kellyjo29.bsky.social","Remember 8 years ago when it was a huge deal that Trump wouldn’t divest from his businesses? Seems quaint now","2024-12-07T03:41:53.894Z"
"kellyjo29.bsky.social","This should be making members of Congress really uncomfortable. Can Trump's followers invade the Capitol whenever they think there is insufficient loyalty to Trump? Do Senators & Reps really want to trade their personal safety for this? www.politico.com/news/2024/12...","2024-12-07T03:10:07.924Z"
"kellyjo29.bsky.social","Anyon saying we are bad people for celebrating a bad man (Mike Thompson) getting what he deserved can fuck right off. #FAFO #Resist","2024-12-07T11:01:28.190Z"
"kellyjo29.bsky.social","On paper the richest person on earth spent openly two years purchasing an election result & what are all the things he is trying to do with the powers of the office? Pay himself more money Especially the social security money everyone else in the country spent their whole lives working for","2024-12-07T00:20:31.236Z"
"kellyjo29.bsky.social","Oh it’s super clear now, Elon.","2024-12-06T19:48:05.732Z"
"kellyjo29.bsky.social","Everything I see about Morning Joe now is just embarrassing.","2024-12-05T15:42:40.538Z"
"kellyjo29.bsky.social","Like Joe always says. """"Everything Trump touches dies."""" Enjoy the slow death, Morning Joe.","2024-12-05T13:18:08.789Z"
"kellyjo29.bsky.social","Seeing the mug shot of Nick Fuentes made my day. 🍿","2024-12-06T21:45:43.782Z"
"kellyjo29.bsky.social","I'm going to post this video every day so we never forget","2024-12-06T12:31:15.659Z"
"kellyjo29.bsky.social","this only suggests to me that everyone needs to keep being meaner to those in power. the wealthy elite need to be scared","2024-12-05T19:38:28.747Z"
"kellyjo29.bsky.social","Today, #KashPatel sent a letter to my counsel @markzaidesq.bsky.social threatening to sue & demanding I retract my MSNBC comments on his unfitness to serve as FBI Director. This follows his threats against media & political opponents, showing how he might act if confirmed. I stand by my statements.","2024-12-04T18:53:03.106Z"
"kellyjo29.bsky.social","I'm glad Pete Hegseth has pledged not to drink if he is confirmed as Defense Secretary. So, I guess he can still sexually harass women, mismanage funds, discriminate against women service members, push for a Christian Nationalist agenda, and be a virulent Islamaphobe? Super duper.","2024-12-05T00:20:26.579Z"
"kellyjo29.bsky.social","Safe as Hell","2024-12-02T08:09:11.554Z"
"kellyjo29.bsky.social","Iconic","2024-12-05T00:14:55.833Z"
"kellyjo29.bsky.social","It's not our differences that matter. It's the things we all have in common with each other...like collectively laughing our asses off at cybertrucks and their owners.","2024-12-04T22:20:47.277Z"
"kellyjo29.bsky.social","This right here.","2024-12-03T23:35:33.531Z"
"kellyjo29.bsky.social","This cartoon is as cute as the dickens...","2024-12-03T23:54:58.351Z"
"kellyjo29.bsky.social","Do not obey!","2024-12-04T04:27:51.307Z"
"kellyjo29.bsky.social","I'm going to post this video every day so we never forget","2024-12-04T12:42:56.263Z"
"kellyjo29.bsky.social","And UPS & FedEx? Even more expensive and they both rely on Canada Post and USPS for a lot of last mile and virtually all non urban deliveries. The mail service is a service, not a business.","2024-12-04T00:05:36.546Z"
"kellyjo29.bsky.social","REMINDER: Get your 4 FREE At HOME COVID TEST KITS FROM USPS WHILE YOU CAN! PLEASE SHARE EVERYWHERE! special.usps.com/testkits","2024-12-02T17:27:13.242Z"
"kellyjo29.bsky.social","Republican voters are the epitome of selfish Americans. They'd love a big social safety net but just for them. And I don't mean collectively. Each individual thinks they alone should get everything while everyone else pounds it.","2024-12-04T11:09:46.396Z"
"kellyjo29.bsky.social","Good morning, Bsky friends! It’s sooo cold today here in Ontario; it has that sort of “soup day” feeling… Wishing everyone a warm and wonderful day!","2024-12-03T14:28:39.221Z"
"kellyjo29.bsky.social","100% accurate.","2024-12-03T22:07:57.938Z"
"kellyjo29.bsky.social","@patbyrnes.bsky.social","2024-12-04T00:45:39.998Z"
"kellyjo29.bsky.social","Sad, but true.","2024-12-03T03:44:50.275Z"
"kellyjo29.bsky.social","It shouldn’t be ignored that Kash Patel chose to plead the Fifth in response to a grand jury subpoena over the Mar-a-Lago classified documents. He only testified, involuntarily, after being granted immunity. Think about that. Trump’s FBI nominee pled the Fifth in response to a DOJ subpoena.","2024-12-03T15:16:37.445Z"
"kellyjo29.bsky.social","I am watching with grave concern over the actions of the South Korean president to declare martial law, all because the opposition has blocked his agenda and impeached his cabinet. Democracy is under assault across much of the world. We must be on highest guard here as well as Trump takes office.","2024-12-03T14:25:59.220Z"
"kellyjo29.bsky.social","I am not going to stop calling for an FBI background check of Tulsi Gabbard and neither should you.","2024-12-03T02:28:26.671Z"
"kellyjo29.bsky.social","teaching children it was the witches the should fear rather than the people who hung them and burned them is a perfect example of the insidious nature of christianity","2024-12-03T01:54:27.873Z"
"kellyjo29.bsky.social","Eric Trump on Fox News in May: “We’re a good family. Never done anything wrong.”","2024-12-01T15:26:31.004Z"
"kellyjo29.bsky.social","So true….","2024-12-01T20:21:19.622Z"
"kellyjo29.bsky.social","You know what these two rich men have in common besides being named to positions by Trump within a day of each other? They are the father-in-laws to his two daughters, Ivanka and Tiffany. Such brazen, mob boss nepotism.","2024-12-01T17:22:41.929Z"
"kellyjo29.bsky.social","Sir Richard Moore, head of MI6: """"In 37 years in the intelligence profession, I've never seen the world in a more dangerous state."""" """"We have recently uncovered a staggeringly reckless campaign of Russian sabotage in Europe."""" news.sky.com/story/flatpl...","2024-12-01T21:18:14.470Z"
"kellyjo29.bsky.social","1. The conventional explanation for food deserts—that these places are too poor or too rural to generate enough spending on groceries, or too Black to overcome racist corporate redlining — fail to grapple with a key fact: food deserts didn’t used to exist. My new piece in The Atlantic.","2024-12-01T14:06:49.727Z"
"kellyjo29.bsky.social","Me too...","2024-11-30T03:15:08.861Z"
"kellyjo29.bsky.social","Crazy how that works.","2024-12-01T01:44:15.408Z"
"kellyjo29.bsky.social","This is how history gets rewritten. One brazen act at a time.","2024-11-30T20:52:51.538Z"
"kellyjo29.bsky.social","Trump has named Charles Kushner, father of Jared Kushner, as ambassador to France. The elder Kushner once pleaded guilty to tax evasion and making illegal campaign contributions. Trump pardoned him in 2020. “L’état, c’est moi,” as the saying goes. Here you go, France. A nepo criminal!","2024-11-30T20:36:26.878Z"
"kellyjo29.bsky.social","I can hardly wait!","2024-11-30T19:09:37.568Z"
"kellyjo29.bsky.social","Elon Musk is danger to society.","2024-11-29T07:36:26.291Z"
"kellyjo29.bsky.social","My part-time Black job will be to remind them of their idiotic choice every fucking chance I get.","2024-11-29T10:27:49.991Z"
"kellyjo29.bsky.social","👇","2024-11-23T21:32:49.565Z"
"kellyjo29.bsky.social","You mean they don’t want to stay at Leon’s mojo dojo casa house","2024-11-28T20:16:16.417Z"
"kellyjo29.bsky.social","Let's work to strengthen our community of resisters on this platform. Like this post, comment #GrowTheResistance, and most importantly, hit the repost button. Next, follow one another back. An easy method is to follow those who repost. 💙🦋","2024-11-29T07:22:29.586Z"
"kellyjo29.bsky.social","It’s a hard no from me. And I’m gonna fight with our Blue allies for the next 4 years, because Australia and the US special a history And friends don’t let friends sit and watch while a sex offender date rapes their country","2024-11-29T11:24:40.143Z"
"kellyjo29.bsky.social","Seems that way…","2024-11-29T06:04:01.061Z"
"kellyjo29.bsky.social","I sure as hell am never gonna obey this monster. Not in advance. Not now. Not ever. No one should.","2024-11-28T05:03:54.550Z"
"kellyjo29.bsky.social","Tomorrow isn't just Thanksgiving, it's also happens to be Millie's 12th birthday & she would greatly appreciate being acknowledged in any of your holiday toasts. Thanking you in advance, Chelsea & Mar🐫","2024-11-27T22:36:20.289Z"
"kellyjo29.bsky.social","🗣️🤣😂 👁️👄👁️","2024-11-27T07:27:26.117Z"
"kellyjo29.bsky.social","A message from Ukraine!","2024-11-27T02:28:21.390Z"
"kellyjo29.bsky.social","Isn’t it funny how the U.S. media is suddenly posting stories about the improving inflation picture now that the election is over? 🧐","2024-11-26T14:01:49.641Z"
"kellyjo29.bsky.social","If you have the time, try to not only block a maga troll but the accounts they follow.","2024-11-25T15:26:20.905Z"
"kellyjo29.bsky.social","@bsky.app i love being here!! But please Do address the fake accounts problem- (example Liz Cheney). Perhaps a symbol for verified accounts of known persons- as the blue check once was on Twitter. Thank you","2024-11-25T16:15:12.581Z"
"kellyjo29.bsky.social","🔥 🗣️STURGILL SIMPSON: “This toxic patriarchal energy is an age coming to an end… that energy is clawing for its survival bc it knows it’s dying. We’re heading to something beautiful, we just have to go through some dark shit first. So love everybody.” (H/T @wutangforchildren.bsky.social )","2024-11-24T23:07:59.208Z"
"kellyjo29.bsky.social","I recommend this book if you have the stomach to read it…Surviving Autocracy.","2024-11-24T23:03:43.561Z"
"kellyjo29.bsky.social","People are asking what we can do. Follow and support independent accounts, networks and the like who are committed to honest and independent journalism, e.g. @meidastouch.bsky.social and all those connected, @muellershewrote.bsky.social, @atrupar.com and others. They can't work for free.","2024-11-24T21:44:41.715Z"
"kellyjo29.bsky.social","Who here is inclined to agree?","2024-11-24T00:28:47.317Z"
