"user","post","date"
"lavonda.bsky.social","Dimon on why JPMorgan Chase is not funding WH Ballroom: We have an issue, which is anything we do, since we do a lot of contracts with governments here and around the world, we have to be very careful how anything is perceived, and also how the next DOJ is going to deal with it.","2025-11-29T19:24:11.434Z"
"lavonda.bsky.social","“A Long Way From Home” 🏡 I’ve traveled farther than my fears, and wider than my doubts. Every step away from yesterday has taught me what I’m about. 👇🏾","2025-11-29T19:08:33.226Z"
"lavonda.bsky.social","My Post for Today is... TRUMP MUST BE TAKEN DOWN!","2025-11-29T14:37:08.198Z"
"lavonda.bsky.social","Good morning!☀️","2025-11-29T14:32:40.732Z"
"lavonda.bsky.social","I thank God everyday that I'm on the right side of History. Can you imagine waking up, kissing Trump's ring/ass and begging for favors? That's what GOP Reps and Senators do on a daily basis. It's disgusting. How can you live that way? So, I'm very thankful I'm a Democrat that votes for Sanity.","2025-11-29T05:36:26.151Z"
"lavonda.bsky.social","If Our Founding Fathers were transported to this timeline, they would be in total shock of it all. There is no question about it, they would side with the Democrats because Democrats represents Human Dignity, History with Traditions. Washington would be President again and hang the whole GOP lot!","2025-11-29T05:44:51.237Z"
"lavonda.bsky.social","Trump used Truth Social on Friday to announce that he will grant a “Full and Complete Pardon” to former Honduran president Juan Orlando Hernandez, a convicted drug trafficker sentenced last year to 45 years in U.S. federal prison for helping move massive quantities of cocaine into the United States.","2025-11-29T03:56:43.443Z"
"lavonda.bsky.social","Anytime Amy & thank you. Enjoy your evening 💙 🐊🐸🦋 @gentlem.bsky.social @val.sheshed.rocks @copperflash.bsky.social @williamebales.bsky.social @lavonda.bsky.social @neverstopthefight.bsky.social @maryosteen.bsky.social @flamekurve.bsky.social @fireeyebooks.bsky.social @warriorinblue.bsky.social","2025-11-28T23:10:00.048Z"
"lavonda.bsky.social","SEND THIS TO EUROPE AND THE UKRAINE ! VETO HIS BULLSHIT RUSSIA PLAN !","2025-11-28T22:49:32.794Z"
"lavonda.bsky.social","PLEASE REPOST","2025-11-28T23:09:15.278Z"
"lavonda.bsky.social","Oh my. When you've lost the Babylon Bee …","2025-11-28T16:26:24.696Z"
"lavonda.bsky.social","""""My poll numbers have never been better.""""","2025-11-28T15:53:48.984Z"
"lavonda.bsky.social","Dear Dems, Whatever you did on November 4th, Keep doing it! Don't back down. Don't eat your own. The Enemy is Trump & the Republicans if you haven't learned that already. You must plan ahead. You must be swift. You must be accurate and true. You must bring Justice back to the United States!","2025-11-28T17:13:14.412Z"
"lavonda.bsky.social","I don’t know . Can you make a suggestion ? 🤣🤣🤣","2025-11-28T04:03:35.523Z"
"lavonda.bsky.social","Good morning friends. ☀️🫶☕️","2025-11-28T12:06:59.062Z"
"lavonda.bsky.social","Cognetti: We don’t want Joe Rogan or OAN talking about this district because we have a congressman who has become one of the most prolific stock traders—someone who dumped six figures’ worth of Medicaid provider stock a week before he trashed a trillion dollars of Medicaid.","2025-11-27T21:21:58.803Z"
"lavonda.bsky.social","I found this in a storage unit auction! It this a good find? Let me know if know! Please share so I can get more people to see this! Thank you!","2025-11-27T21:41:52.266Z"
"lavonda.bsky.social","Happy Thanksgiving! Seven members of our coffee klatch gathered to connect together before we went our separate ways today, and they voted for this photo looking slightly north taken 8 minutes before sunrise. Tap for full size. I hope you have a great day!","2025-11-27T14:33:32.440Z"
"lavonda.bsky.social","Didn’t the FBi pull a lot of personnel from anti terrorism to put them on deportations? Actually the whole security establishment pivoted","2025-11-27T03:02:49.020Z"
"lavonda.bsky.social","I hope you have a safe and peaceful Thanksgiving.","2025-11-27T11:34:21.870Z"
"lavonda.bsky.social","@paulsgundlach.bsky.social","2025-11-27T11:33:01.549Z"
"lavonda.bsky.social","His abuse of our troops, who already had disastrous morale problems, is now criminal. Impeach. Convict. Remove.","2025-11-27T01:37:11.108Z"
"lavonda.bsky.social","Violence has no place in America. Michelle and I are praying for the servicemembers shot in Washington, DC today, and send our love to their families as they enter this holiday season under the most tragic of circumstances.","2025-11-27T01:15:03.589Z"
"lavonda.bsky.social","Absofuckinglutely 💯.......","2025-11-26T12:05:36.776Z"
"lavonda.bsky.social","Today's shooting of the National Guard in DC was a MAGAT/GOP operation. A deflection from the Epstein Files. That's my opinion and I'm sticking to it. #TrumpAssassinationAttempt #EpsteinFiles","2025-11-27T01:37:34.527Z"
"lavonda.bsky.social","www.nbcnews.com/world/pope-l...","2025-11-26T22:02:10.494Z"
"lavonda.bsky.social","The president of the United States is insane. Full stop.","2025-11-25T20:34:57.102Z"
"lavonda.bsky.social","If you’re wondering why there’s a lull in the Epstein files discussion, it’s because the law that just passed gave Pamela Jo 30 days to release the files. So we’re all waiting to see how she tries to sabotage it. The discussion will pick back up in earnest on December 20th.","2025-11-26T18:20:46.954Z"
"lavonda.bsky.social","If you think trump is smart for avoiding taxes and stiffing workers, try it. See what happens.","2025-11-26T19:25:58.076Z"
"lavonda.bsky.social","This is exactly what you do With presidents who coup","2025-11-25T21:01:14.077Z"
"lavonda.bsky.social","Good morning friends. ☀️🫶☕️","2025-11-26T11:45:15.218Z"
"lavonda.bsky.social","Pamela Jo has until December 20th to release the Epstein files. She must include explanations for everything she redacts or withholds.","2025-11-25T18:07:32.708Z"
"lavonda.bsky.social","If this is true, every halfway decent foreign intelligence service on the planet already has the receipts ….","2025-11-25T14:36:07.974Z"
"lavonda.bsky.social","#NeverForgetJanuary6th #FDT","2025-11-25T16:23:59.783Z"
"lavonda.bsky.social","They all had orders from Trump to converge on the capital and yes, Trump incited an insurrection. Put that together with all of the felonies that he has committed the sexual predator conviction the business fraud conviction, the classified documents case. He paid off Eileen Cannon. Trump the trader.","2025-11-25T12:04:33.693Z"
"lavonda.bsky.social","Waters: This is an important press conference that is being held to let you know what we're all doing: resisting this lowdown dirty no good filthy president","2025-11-25T05:09:35.972Z"
"lavonda.bsky.social","Good Tuesday morning, my friends. ☀️🫶☕️","2025-11-25T11:38:01.412Z"
"lavonda.bsky.social","Garcia: We know this is a nation of immigrants, and Donald Trump is attacking the very identity of our country. Right now, whether you are documented or not, whether you are seeking asylum at our border or have been here for decades, you could be targeted by this administration.","2025-11-25T04:24:16.332Z"
"lavonda.bsky.social","Watch the full video here: www.youtube.com/live/qcsjOoq...","2025-11-25T05:10:53.800Z"
"lavonda.bsky.social","As a survivor of the Tulsa Race Massacre, Viola Ford Fletcher bravely shared her story so that we’d never forget this painful part of our history. Michelle and I are grateful for her lifelong work to advance civil rights, and send our love to her family.","2025-11-25T00:45:23.371Z"
"lavonda.bsky.social","Full interview and more from MeidasTouch here: youtu.be/Z5_35sKuIq4","2025-11-24T03:27:44.107Z"
"lavonda.bsky.social","Twitter's new feature that reveals where accounts originate doesn't reveal many surprises.","2025-11-24T15:03:14.989Z"
"lavonda.bsky.social","Marjorie Taylor Greene's resigning in time to get a pension is a lesson to everyone. Most Americans don't get *any* pension anymore, but Congress gave itself a pension after only five years of work. Our """"representatives"""" aren't working for us, they are [barely] working for themselves.","2025-11-24T14:16:22.685Z"
"lavonda.bsky.social","Good morning good people. ☀️🫶☕️","2025-11-24T13:04:12.480Z"
"lavonda.bsky.social","""""Quiet, Piggy""""","2025-11-23T15:24:07.416Z"
"lavonda.bsky.social","Agree ⬇️ 💯.....","2025-11-24T11:41:31.583Z"
"lavonda.bsky.social","Keep in mind that this serial liar also promised a hundred times during the campaign that he would be able to end the war “in 24 hours” with “one phone call” to Putin because he has “a great relationship” with him, “knows just what to say to him,” & “it won’t even be that hard.”","2025-11-24T11:33:49.473Z"
"lavonda.bsky.social","This is my kind of good trouble.","2025-11-23T19:20:17.886Z"
"lavonda.bsky.social","GOD BLESS MARK KELLY AND ALL THOSE THAT MADE THAT STATEMENT!","2025-11-23T19:53:29.661Z"
"lavonda.bsky.social","Crockett on MTG resigning: """"Honestly, I was like, you got to be kidding. You're on the other side of the president for one week and you can't take the heat? Imagine what it is to sit in my shoes.""""","2025-11-23T14:17:24.861Z"
"lavonda.bsky.social","It’s crazy to think about the crimes we’re going to learn about after this regime ends. We’re already hearing about Watergate level crimes every week. Imagine what will come out after it’s over. We’re going to need a full accounting of all that’s been done in violation of the constitution.","2025-11-22T22:05:09.883Z"
"lavonda.bsky.social","Pam Bondage DOJ Is Investigating ITSELF.......","2025-11-23T12:20:34.950Z"
"lavonda.bsky.social","Mike Johnson is big mad that we forced through a petition and forced a vote on releasing the Epstein files. So let’s do it again. This time to restore the ACA credits he stole from us:","2025-11-23T00:50:01.363Z"
"lavonda.bsky.social","😡 On the eve of the negotiations, Russian terrorists dropped a FAB aerial bomb on residential high-rise buildings in Myrnohrad.","2025-11-23T16:12:07.554Z"
"lavonda.bsky.social","I hope MTG reads the Epstein list on the floor of Congress","2025-11-23T16:37:34.081Z"
"lavonda.bsky.social","JD Vance — begs folks to be patient with an economy he admits is bad. Trump — brags it’s the greatest ever. I’ve said it so many times, Republicans stay synced and on message even when the message is a lie, but this slip tells a story. There’s chaos behind the scenes and the wheels are coming off.","2025-11-22T23:11:20.423Z"
"lavonda.bsky.social","Atlantic: Do Childhood Vaccines Cause Tornadoes? / It hasn’t been ruled out. www.theatlantic.com/health/2025/...","2025-11-22T16:20:19.106Z"
"lavonda.bsky.social","This kid is brilliant. Voice of a generation.","2025-11-22T21:22:58.893Z"
"lavonda.bsky.social","“I’ve got the best poll numbers I’ve ever had! Red hot!!!”","2025-11-22T13:30:36.514Z"
"lavonda.bsky.social","Ever since the Govt Shutdown ended last week, Everybody started chatting about this & about that but resulting to NOTHINGNESS. The Fact is the US is still under seize by a hostile political party & We have to fight to get it BACK! Don't lose sight of that focus! We still have to save our Democracy!","2025-11-23T00:15:19.520Z"
"lavonda.bsky.social","TY @abbarsha.bsky.social @butwhoisthedreamer.bsky.social @dergrexxie.bsky.social @clarkpowers.bsky.social @kingresist.bsky.social @crankyoldcrackpot.bsky.social @normajeen.bsky.social @dcombes.bsky.social @docmurphydog.bsky.social @raykwong.bsky.social @packers1.bsky.social @merlinmm.bsky.social","2025-11-22T15:53:20.065Z"
"lavonda.bsky.social","Gosh they must have used so much tipex on the Epstein Files.","2025-11-19T20:34:00.656Z"
"lavonda.bsky.social","Racial profiling is all they do. Lawless.","2025-11-22T14:11:14.749Z"
"lavonda.bsky.social","💥💥💥💥","2025-11-22T14:39:12.356Z"
"lavonda.bsky.social","TY 💙 @bluestormcomin1.bsky.social 🐊🐸🦋 @schultziepie.bsky.social @msarielknox.bsky.social @jujubean123.bsky.social @greenellsworth.bsky.social @IanSeine.bsky.social @pirjapaa.bsky.social @gentlem.bsky.social @heatherjb.bsky.social @danalemaster.com @jrmck913.bsky.social","2025-11-22T13:28:58.351Z"
"lavonda.bsky.social","Good morning ☀️","2025-11-22T12:02:01.438Z"
"lavonda.bsky.social","I think it's possible I may love the commentary on this photograph more than life itself","2025-11-22T07:28:10.757Z"
"lavonda.bsky.social","What the AF is wrong with these people? Please read! @politicsgirl.bsky.social @katiephang.bsky.social Have you seen this? South Carolina Tried to Pass a Bill Jailing Women for Abortion. No Republican Voted Against It. - Slate apple.news/AxFglaJ-LTge...","2025-11-22T01:55:24.576Z"
"lavonda.bsky.social","Killin: And make no mistake, we must put a check on the lawlessness, the corruption, and the overreach of the Trump administration. And the only way we can do that is to flip the House in 2026. And this district — Colorado’s Fifth — is part of that path to taking the House back.","2025-11-22T01:03:43.655Z"
"lavonda.bsky.social","CNN: In the last couple of weeks or so, she's become kind of an ally on some issues. What do you make of this? Auchincloss: No, John, she hasn't.","2025-11-22T01:49:46.577Z"
"lavonda.bsky.social","Marjorie Taylor Greene Says She Plans to Resign in January www.nytimes.com/2025/11/21/u... She’s got something up her sleeve. Does she think she’s going to grab the MAGA vote now that Trump is losing it?","2025-11-22T01:46:39.964Z"
"lavonda.bsky.social","Here is my post for posterity: It goes like this: Trump will regret the day when he wished Members of Congress to their Death because of Insurrection. His own word will haunt him in his remaining day on Earth...","2025-11-21T22:12:51.132Z"
"lavonda.bsky.social","Watch the full video here: youtu.be/PGiUTYsr1Yw","2025-11-21T18:49:07.628Z"
"lavonda.bsky.social","Reporter: Are affirming that you think Trump is a fascist? Mamdani: We’ve spoken about— Trump: That’s ok, you can just say it.","2025-11-21T20:55:07.680Z"
"lavonda.bsky.social","How could so many people tried, but failed, to impeach, indict, sentence, imprison... Trump? I will say here and now... This Country tis of thee (US Govt) has failed the American People and our US Constitution in the biggest way... Now We, the Democrats, has to do DAMAGE CONTROL!!!!!!!!","2025-11-21T14:20:08.466Z"
"lavonda.bsky.social","Way off topic, but this picture has to be Charlie Kirk’s wife, no? Unless there is a specific look that MAGA women have to have? Am I the only one who thought this was Kirk’s wife?","2025-11-21T13:39:51.285Z"
"lavonda.bsky.social","I feel like disbarment should be the least of her worries. What if it hadn’t come to light that she violated his rights and it went to trial. She should be sitting in prison.","2025-11-21T15:07:40.610Z"
"lavonda.bsky.social","Pursuant to rule 3-11, a record manifesting a lack of honesty, trustworthiness, diligence, or reliability may constitute a basis for denial of admission. Any of the following may be considered by the board to be a basis for further inquiry before recommending admission: Unlawful conduct;","2025-11-21T14:46:15.943Z"
"lavonda.bsky.social","The Florida Bar Association should be ashamed of themselves that they gave Halligan and the AG blondie a law license and they will not revoke them even though over 1,000 Judges and lawyers have requested they dis-bar them!","2025-11-21T14:46:15.942Z"
"lavonda.bsky.social","If she gets disbarred she'll just get another law license from the same place she got her first one.","2025-11-21T11:50:10.283Z"
"lavonda.bsky.social","Incompetence from a trump appointee? What is the world coming to eh Habba? Eh Blanche, Bondi, Patel and Bongino?","2025-11-21T11:03:42.531Z"
"lavonda.bsky.social","DOES THIS SOUND LIKE A DECENT PROPOSITION?","2025-11-20T12:14:29.953Z"
"lavonda.bsky.social","JUST IN: A federal judge says one of the Venezuelan men — illegally deported to El Salvador in March before he was swapped back to Venezuela in a prisoner exchange — is now missing, possibly a victim of the violence he was seeking asylum from. storage.courtlistener.com/recap/gov.us...","2025-11-21T11:55:16.199Z"
"lavonda.bsky.social","Kelly: """"I never expected after serving 25 years in the Navy flying combat missions over Iraq and Kuwait, flying the Space Shuttle, that now I've got to worry about my personal safety and that of my wife, Gabby Giffords, who was already nearly assassinated, because of something the president said.""""","2025-11-21T02:07:59.234Z"
"lavonda.bsky.social","PROOF THAT TRUMP IS A FAILURE! DJIA Closed 45,752.26 -386.51 (-0.84%) NASDAQ Composite Closed 22,078.05 -486.18 (-2.15%) S&P 500 INDEX Closed 6,538.76 -103.40 (-1.56%) Russell 2000 Closed 2,305.11 -42.78 (-1.82%) Updated: 11:54 PM ET, 11/20/2025","2025-11-21T04:55:57.577Z"
"lavonda.bsky.social","Meet my friend @buzzgrambo.bsky.social. Radicalized by his oath to the constitution. Long time member of the @dailybeanspod.com community. Proud of you, shipmate.","2025-11-20T16:18:01.560Z"
"lavonda.bsky.social","Good Friday morning, lovely friends. ☀️🫶☕️","2025-11-21T11:59:07.775Z"
"lavonda.bsky.social","Is he calling for himself to be put to death for January 6th? I'm confused.","2025-11-20T16:12:59.184Z"
"lavonda.bsky.social","I DON'T feel like doing the following: 1) Listen to Trump's Hitler's mouth or Read his Hitler's Posts 2) Listen to VP's mouth 3) Read what MAGA has to say 4) Listen to Dems Doomsayers I DO feel like doing the following: 1) Being Hopeful that ALL Republicans will arrested 2) Hear Positive things","2025-11-20T23:47:44.575Z"
"lavonda.bsky.social","I want the truth and so does the American public and not a bunch a run around bullshit.","2025-11-20T19:25:26.851Z"
"lavonda.bsky.social","(📢) What Trump did today was not a SHOULD impeach, it was a MUST impeach. He said anyone who challenges his authority—an authority he doesn’t have—to give illegal orders to the military must be executed. That is a prima facie case for impeachment. Articles should be drawn up.","2025-11-20T21:15:52.554Z"
"lavonda.bsky.social","The federal government has collected nearly $195 billion in revenue from tariffs for fiscal year 2025 through Sept. 30, 2025. The collection of tariffs continues as the Supreme Court weighs its decision. www.cnbc.com/2025/11/11/t...","2025-11-11T20:01:36.341Z"
"lavonda.bsky.social","Ben Meiselas does his impression of WH Press Secretary Karoline Leavitt","2025-11-20T22:17:00.340Z"
"lavonda.bsky.social","I know I’m a libtard but I think it’s bad the U.S. president keeps calling for the killing of specific sitting elected officials who didn’t even commit crimes","2025-11-20T17:08:47.042Z"
"lavonda.bsky.social","Jeffries: I think Rick Scott has some history with medicaid fraud in the state of Florida. So he's no expert on health care. We ain't going to be lectured by Rick Scott about anything, but certainly not affordable health care.","2025-11-20T21:22:16.028Z"
"lavonda.bsky.social","That ends my support of them. In germany, displaying the swatstika is illegal and gets you jail time. Here, we wave it proudly Disgusting","2025-11-20T19:19:23.672Z"
"lavonda.bsky.social","Also:","2025-11-20T19:16:46.388Z"
"lavonda.bsky.social","""""I saw the South African president running his mouth a little bit """" Everyone knows why she speaks this way about the S. African president right? Can Americans stop pretending republicans aren't racists.","2025-11-20T19:13:07.957Z"
"lavonda.bsky.social","This is a stunning thing to even have to see Members of Congress say out loud. Absolutely chilling. And inspiring.","2025-11-19T20:18:05.007Z"
"lavonda.bsky.social","Jeffries: I guess he's saying he could beat George Washington and Abraham Lincoln. This guy couldn't beat Richard Nixon right now because he's been such a disaster.","2025-11-20T03:17:51.958Z"
"lavonda.bsky.social","Trump Boasts That His Funeral Will Have Much Bigger Turnout Than Cheney’s open.substack.com/pub/borowitz...","2025-11-20T16:28:25.883Z"
"lavonda.bsky.social","“THIS IS A SEWER… A SCAM… Congress has been enriching itself for too dadgum long.” We are highly critical of @RepTimBurchett but he & @repjayapal are right — Congress should be BANNED from trading stocks, as @unusualwhales calls out. Make your reps & senators back this.","2025-11-19T18:55:14.777Z"
"lavonda.bsky.social","It's #TacoTuesday! 🌮 @lindylou425.bsky.social @larrycolvin.bsky.social @isabellebeaudreau.bsky.social @tonyhq1985.bsky.social @joedecam.bsky.social @mcgigglepants.bsky.social @gilliflower.bsky.social @marriedsillynana.bsky.social @bluestormcomin1.bsky.social @raykwong.bsky.social When pigs fly.","2025-11-18T23:34:21.636Z"
"lavonda.bsky.social","🤷🤷🤷😱😱😱","2025-11-19T14:41:07.567Z"
"lavonda.bsky.social","Woohoo! It's #TacoTuesday! 🌮 @choudry1.bsky.social @jonthetherapist.bsky.social @ecohesfordragons.bsky.social @jamesmajesty.bsky.social @khw27fedup270.bsky.social @engageddemo.bsky.social @appledawg.bsky.social @grgi4404.bsky.social @bluestormcomin1.bsky.social @raykwong.bsky.social Quiet, piggy.","2025-11-18T23:33:55.023Z"
"lavonda.bsky.social","Woohoo! It's #TacoTuesday! 🌮 @mt-nestor.bsky.social @saynotobs.bsky.social @annmilernowski.bsky.social @ciaogirl9.bsky.social @arlie.bsky.social @oldmanhippy.com @primerisk.org @ladybug014.bsky.social @mdicey.bsky.social @bluestormcomin1.bsky.social @raykwong.bsky.social Quiet, piggy.","2025-11-18T23:33:35.225Z"
"lavonda.bsky.social","11/19 Boost A @natsattack.bsky.social @bluestormcomin1.bsky.social @marketman52.bsky.social @flintstone-56.bsky.social @lavonda.bsky.social @deeannventura.bsky.social @monica5519.bsky.social @jn7gw.bsky.social @monalisa33.bsky.social @equinox77.bsky.social @trickemhunter.bsky.social","2025-11-20T00:04:58.976Z"
"lavonda.bsky.social","As Trump ramps up his ICE raids in Charlotte, North Carolina, more than 30,000 students across the county reportedly did not attend school on Monday. This isn't about going after the “worst of the worst.” It was always about cruelty.","2025-11-19T21:45:06.723671Z"
"lavonda.bsky.social","Shapiro: Trump sits behind his desk in the Oval Office every day bullshitting the American people. But when the American people show up at the grocery store, it doesn’t matter how much they were listening to Trump — they see the prices, and they see those prices going up.","2025-11-19T19:41:15.755Z"
"lavonda.bsky.social","Full interview and more from MeidasTouch here: youtu.be/ySmFmXLtPdM","2025-11-19T19:41:15.756Z"
"lavonda.bsky.social","Swedish Deputy PM: Sweden needs to pick its friends wisely, and we are choosing Canada… So when we come to America, we come to Canada now.","2025-11-19T20:29:12.678Z"
"lavonda.bsky.social","Eisen: It’s exactly as legally effective as if you and I wrote an indictment of Trump right here on MeidasTouch. She’s an insurance lawyer. The indictment wasn’t even presented to the grand jury. None of us have ever heard of anything like this. This case is going to be flushed by the courts","2025-11-19T21:04:14.255Z"
"lavonda.bsky.social","Lindsey Halligan Reveals Her Dream is to Someday Go to Law School open.substack.com/pub/borowitz...","2025-11-19T22:46:57.601Z"
"lavonda.bsky.social","Khanna: """"The speaker looked frazzled last night. I think he's totally lost it. He's attacking the bill and he's not showing up to hear the survivors. The survivors wanted this bill. Then he's voting for a bill he criticized. And he's lost the confidence of half the people in his own caucus.""""","2025-11-19T15:13:18.283Z"
"lavonda.bsky.social","“Quiet, Piggy” would be fitting for his tombstone.","2025-11-19T01:10:41.992Z"
"lavonda.bsky.social","Today we won a big victory in Texas but the fight for democracy is not over. We all need to steel ourselves for the battles ahead. We won't win them all, but we can never lose sight of what we need to do to prepare fee and fair elections.","2025-11-19T02:27:24.579Z"
"lavonda.bsky.social","Happy Wednesday, friends. ☀️🫶☕️","2025-11-19T13:20:31.658Z"
"lavonda.bsky.social","Woohoo! It's #TacoTuesday! 🌮 @lindamalou.bsky.social @ssnbubblehead.bsky.social @jaxdeedee.bsky.social @seasthemoment.bsky.social @eileennjflns.bsky.social @lavonda.bsky.social @altonpi.bsky.social @sandybarbour.bsky.social @bluestormcomin1.bsky.social @raykwong.bsky.social Quiet, piggy.","2025-11-18T23:33:12.258Z"
"lavonda.bsky.social","AOC: Trump has been saying the economy is booming, but it’s really only seven tech companies. They’re driving this growth in just one sector: AI. So the entire economic growth can be tracked down to seven companies and their AI expansion…","2025-11-18T23:12:59.384Z"
"lavonda.bsky.social","POLICE ICE makes ALL the Police Law Enforcement look BAD! DISBAND ICE!!!!!","2025-11-18T23:56:16.999Z"
"lavonda.bsky.social","One and the Same","2025-11-18T21:19:28.332Z"
"lavonda.bsky.social","Swalwell: Kristi Noem and Tom Homan, you should familiarize yourselves with this room. Get to know that witness chair — you’re going to be parked in it for a long time. Accountability is coming.","2025-11-18T19:36:22.144Z"
"lavonda.bsky.social","Kudos to this ABC News journalist","2025-11-18T17:54:17.241Z"
"lavonda.bsky.social","Republicans have a bill to deport immigrants who attack dogs. Goldman moves to have it renamed to: The Kristi Noem Canine Relief Act","2025-11-18T16:00:22.011Z"
