"user","post","date"
"lavonda.bsky.social","7-12-25 BOOST E @tootiepeggy.bsky.social‬ @rogue-maverick.bsky.social‬ @thistlesister.bsky.social‬ @mikeree.bsky.social‬ @cherylkdwoods.bsky.social‬ @jedicus.bsky.social‬ @ycry2me.bsky.social‬ @briantylercohen.bsky.social‬ @marcelias.bsky.social‬ @trickemhunter.bsky.social‬ @angryeyes.bsky.social‬","2025-07-12T21:51:56.130Z"
"lavonda.bsky.social","7-12-25 BOOST B @716wings.bsky.social‬ @marvstanly.bsky.social‬ @positivelyfrank.bsky.social‬ @lynnvar.bsky.social‬ @grye01.bsky.social‬ @latina4jesusdshw.bsky.social‬ @supplysgt.bsky.social‬ @artemistheangry.bsky.social‬ @phecdaplato.bsky.social‬ @kimmer.bsky.social‬ @annfowleravery.bsky.social‬","2025-07-12T20:39:04.130Z"
"lavonda.bsky.social","Tell him #Rosie","2025-07-12T19:44:47.619Z"
"lavonda.bsky.social","Don, you’re 💯 right. That’s Donald Trump 👇👇…","2025-07-12T11:58:01.432Z"
"lavonda.bsky.social","7-12-25 BOOST A @gigibones.bsky.social‬ @lavonda.bsky.social‬ @trekrider4494.bsky.social‬ @markcsik.bsky.social‬ @outspokenobserver.bsky.social‬ @raykwong.bsky.social‬ @thatswiftiewitch.swifties.social‬ @mariablack.bsky.social‬ @markcsik.bsky.social‬ @scott766.bsky.social‬ @larrytansey.bsky.social‬","2025-07-12T13:15:11.991Z"
"lavonda.bsky.social","the mamdani thing is showing you how limited the range of acceptable opinions actually is in america. republicans can be a stone's throw away from endorsing genocide and thats fine but one guy goes slightly to the left of dem party orthodoxy and we're right in the middle of soviet russia","2025-06-26T18:00:24.553Z"
"lavonda.bsky.social","Looking back, historians may conclude that the worst thing about the bill about to pass the House is that it made the GOP so unpopular that they gave up on elections and launched their Fascist coup.","2025-07-03T17:44:22.903Z"
"lavonda.bsky.social","Supporting Ukraine incDefeating Russia (and dealing a blow to China) is much much cheaper than maintaining a defense posture to eventually fight Russia. We could then focus almost everything on China, after Russia falls","2025-07-12T12:57:31.624Z"
"lavonda.bsky.social","Cartoon by @deadder.bsky.social.","2025-07-12T12:13:51.873Z"
"lavonda.bsky.social","Most of The Immigrants that are on TV,illegal or otherwise, I would rather have as neighbors,than say,Stephen Miller ! Just sayin......","2025-07-12T09:18:39.108Z"
"lavonda.bsky.social","Rep. Debbie Wasserman Schultz after touring """"Alligator Alcatraz"""": """"These detainees are living in cages. The pictures you've seen don't do it just. They are essentially packed into cages. 34 detainees per cage...they get their drinking water & they brush their teeth where they poop, in the same unit""""","2025-07-12T18:14:40.630Z"
"lavonda.bsky.social","""""Jonathan Caravello...was reportedly “piled on by multiple agents all at once” as “he tried to help a man in a wheelchair” who was having difficulty moving after...[ICE] agents threw canisters of tear gas"""" our colleague is still missing as of the last info I got dailynous.com/2025/07/12/p...","2025-07-12T15:45:33.964Z"
"lavonda.bsky.social","Finally, the other piece of data raising eyebrows is the fact that Trump won all seven swing states—the first candidate to sweep the board in four decades— “It’s north of a 35 billion to 1 probability that you could win seven out of seven outside of recount range with less than 50% of the vote.”","2025-01-07T06:37:41.670Z"
"lavonda.bsky.social","Thank you, Beth! 💙 @annie1x.bsky.social @skepmi.bsky.social @lavonda.bsky.social‬ @veertjephilips.bsky.social‬ @spiritbeing.bsky.social‬ @smol-moff.bsky.social‬ @darbydoo.bsky.social @liberal100.bsky.social @rockwils1.bsky.social @bluestormcomin1.bsky.social @raykwong.bsky.social","2025-07-12T15:13:07.364Z"
"lavonda.bsky.social","It's time for Donald to pay his due. www.cnbc.com/2025/07/10/t...","2025-07-11T02:30:26.337Z"
"lavonda.bsky.social","Thank you, Ellsworth! 💙 @petramichaela.bsky.social @ramblinro.bsky.social @angsty61.bsky.social @metalreverie.bsky.social @diotema.bsky.social‬ @bennettmarcus.bsky.social @korphopparen.bsky.social @savedemocracy24.bsky.social @bluestormcomin1.bsky.social @raykwong.bsky.social","2025-07-12T13:21:30.833Z"
"lavonda.bsky.social","www.cnbc.com/2025/07/12/t...","2025-07-12T13:37:58.795Z"
"lavonda.bsky.social","It's time for Homan, Noems and Bondi to resign and resign NOW!!!!!!!!!!!!!!!!","2025-07-12T12:17:26.790Z"
"lavonda.bsky.social","Good Saturday morning friends. ☀️🫶☕️","2025-07-12T10:50:47.338Z"
"lavonda.bsky.social","Truth hurts, don't it?","2025-07-12T01:30:28.054Z"
"lavonda.bsky.social","@georgetakei.bsky.social","2025-07-11T18:05:50.014Z"
"lavonda.bsky.social","Recently, my book THEY CALLED US ENEMY was banned – again – in Tennessee. Book bans are out of control. Huge parts of American history are being restricted. To join me in standing up for the freedom to read, go to pen.org/action. @penamerica.bsky.social @topshelfcomix.bsky.social @idwpublishing.com","2025-07-11T21:05:07.421Z"
"lavonda.bsky.social","Homan must be stopped!","2025-07-11T21:51:33.004Z"
"lavonda.bsky.social","This has to end! End ICE!","2025-07-11T21:47:03.754Z"
"lavonda.bsky.social","Its only going to get worse I’m afraid The fascist will push and push until they can declare martial law","2025-07-11T17:53:10.760Z"
"lavonda.bsky.social","Hey @governor.ca.gov @gavinnewsom.bsky.social, is this legal? Please post clear guidance for your constituents ASAP. What are our rights when confronted with this situation? What do human beings that have been taken into custody need to know???","2025-07-11T23:48:02.226Z"
"lavonda.bsky.social","Your Prime Day reminder that half of Amazon warehouse workers struggle with food & housing costs. A third have had to rely on government assistance like SNAP — which is about to get cut. If Bezos can spend $50M on a wedding, Amazon can afford to treat its workers with dignity.","2025-07-08T16:41:33.742382Z"
"lavonda.bsky.social","youtube.com/post/UgkxmZY...","2025-07-11T22:06:55.365Z"
"lavonda.bsky.social","It has come to light that trump had the Epstein's files destroyed and MAGA are really pissed at Blondi, I mean, Bondi. Heads may roll. fyi","2025-07-11T22:13:15.927Z"
"lavonda.bsky.social","Absolutely! This administration is the most disgusting corrupt administration ever. They will write history books about the evil and lawlessness.","2025-07-11T22:16:06.792Z"
"lavonda.bsky.social","Hopefully, he dies from poor health sooner than later. The amount of hate of himself he carries must weigh heavily on his cardiac system. The NAZI costume fits him.","2025-07-11T22:16:42.284Z"
"lavonda.bsky.social","Texas your governor has failed you.","2025-07-11T22:13:24.301Z"
"lavonda.bsky.social","Hearing from UFW spokesperson just now that this man has died.","2025-07-11T19:57:10.687Z"
"lavonda.bsky.social","Guess What? Why don't you make it easier on those that want to follow you by typing '#resist' or 'Democrat' or something in your bios! You will get more followers that way. Just sayin'! 💙 *Edited for Grammar.","2025-07-11T18:27:20.073Z"
"lavonda.bsky.social","In June 2016, Britons received the Global Dunce Award when they voted for Brexit. In November 2016 Americans took that Award from the British by electing Trump. In November 2024 Americans earned the Triple-P* Dunce Award by reelecting Trump for the SECOND TIME! (*Permanent. Perpetual. Pinheaded.)","2025-07-11T18:37:05.225Z"
"lavonda.bsky.social","7/11 BOOST A @newmexicanextexan.bsky.social‬ @msfuturehope.bsky.social‬ @vickclicked.bsky.social‬ @igotpopcorn.bsky.social @tootiepeggy.bsky.social‬ @trickemhunter.bsky.social‬ @bluestormcomin1.bsky.social @dwilliams1210.com @deepeanuts.bsky.social @flintsone56.bsky.social @halostarmusic.bsky.social","2025-07-11T18:49:13.299Z"
"lavonda.bsky.social","It’s much worse than this. Undocumented immigrants are being barred from healthcare clinics where they go for medical help including for cancer treatment.","2025-07-11T14:41:21.513Z"
"lavonda.bsky.social","ICE vehicle getting towed at St John's hospital (Oxnard, CA) ✊🏽","2025-07-11T19:31:52.769Z"
"lavonda.bsky.social","INSANITY, MAKE THEM PICK THE CROPS!!!!!!","2025-07-11T19:39:31.985Z"
"lavonda.bsky.social","www.instagram.com/reel/DL8v044... FKICE","2025-07-11T19:37:22.103Z"
"lavonda.bsky.social","Thanks to mayor Adams.","2025-07-11T19:39:35.232Z"
"lavonda.bsky.social","I Love ❤️ AOC........","2025-07-11T07:55:58.512Z"
"lavonda.bsky.social","Indeed, she was. Fetterman shouldn’t pull the ladder up after his own family has climbed it.","2025-07-11T17:34:21.846Z"
"lavonda.bsky.social","So the Kerr County, Texas commissioners refused Federal ARPA funds for emergency warning systems because of “communism” and the result was they killed over 200 people… This is what hate and GOP rhetoric does to your brain. It’s deadly.","2025-07-11T18:32:29.923Z"
"lavonda.bsky.social","No way a tent prison called Alligator Alcatraz cost ten times, 10x more than it cost to operate the Florida State Prison at Raiford where Death Row is! You buying that?","2025-07-10T20:09:52.723Z"
"lavonda.bsky.social","Cancun Ted doesn’t care about the safety or well being of the people. cbwrong.blogspot.com/2025/07/we-a...","2025-07-11T17:37:37.087Z"
"lavonda.bsky.social","""""Cruz inserted language into the reconciliation bill that eliminates a $150m fund to 'accelerate advances & improvements in research, observation systems, modeling, forecasting, and dissemination of info to the public' around weather forecasting.""""","2025-07-11T17:22:33.360Z"
"lavonda.bsky.social","BREAKING: """"Metadata embedded in the [Epstein] video and analyzed by WIRED and independent video forensics experts shows that rather than being a direct export from the prison’s surveillance system, the footage was modified."""" www.wired.com/story/metada...","2025-07-11T16:49:50.921Z"
"lavonda.bsky.social","Bass: I just signed an executive directive that puts all city departments and leadership on notice to protect Angelenos—essentially from the federal government. We’re also filing a FOIA request because we want to know: Who are these masked men, and why are they masked in the first place?","2025-07-11T17:19:43.699Z"
"lavonda.bsky.social","What’s outrageous is pretending this cruelty is necessary. What’s inappropriate is defending it while our communities suffer. We don’t need more masked men in tactical gear, we need humanity.","2025-07-11T01:47:56.390Z"
"lavonda.bsky.social","Senator @johnfetterman.com — whose wife was an undocumented immigrant, and who said he was grateful that her family “broke the law” — now speaks up supportively of ICE as they terrorize others. What a tremendous hypocrite. WATCH:","2025-07-10T22:54:04.270Z"
"lavonda.bsky.social","Good morning my friends. ☀️🫶","2025-07-11T13:11:14.273Z"
"lavonda.bsky.social","Good Trouble Lives On Protests are set for July 17, to celebrate John Lewis. Drop a 💙for Rep. Lewis & the protesters that will honor him. (I borrowed this)","2025-07-10T23:58:21.390Z"
"lavonda.bsky.social","Phang: They never learn, do they? There’s a slew of federal district court and appellate court judges telling this administration that what they’re doing is illegal and unconstitutional—but they don’t care. In response, they just call them “rogue judges.”","2025-07-10T22:45:16.469Z"
"lavonda.bsky.social","Kim: I'm very concerned that if a hurricane hits, are we going to have to be begging Kristi Noem to be able to get off Instagram, to be able to actually go and do her job","2025-07-11T00:42:02.982Z"
"lavonda.bsky.social","Sen. John Fetterman should RESIGN right NOW!!!!!!!!!!!!!!!","2025-07-10T22:35:55.462Z"
"lavonda.bsky.social","ALERT: Attorney General Pam Bondi is apparently threatening some of those providing medical care to their minor transgender patients. If you receive one of these subpoenas, please reach out, have your lawyer do so, or send me a copy. My email is in bio, as is my Signal.","2025-07-09T22:32:44.484Z"
"lavonda.bsky.social","Federal judge issues new nationwide block against Trump’s order seeking to end birthright citizenship - CNN","2025-07-10T20:21:49.992Z"
"lavonda.bsky.social","Full video from Katie Phang’s YouTube channel here: youtu.be/vHGSnk6kro8","2025-07-10T18:48:18.012Z"
"lavonda.bsky.social","Phang: So, Scavino escaped having the value of his Trump Media stock drop by at least 11%—the answer is yes. In addition, Sergio Gor, director of the White House Presidential Personnel Office, also sold Trump Media securities… on March 27th, just days before Trump announced his tariffs.","2025-07-10T18:48:18.011Z"
"lavonda.bsky.social","Good Afternoon! Now for the Bad News for Amazon: www.cnbc.com/2025/07/10/a...","2025-07-10T19:09:22.961Z"
"lavonda.bsky.social","Make sure people know that they planned the cuts for after the midterms so people wouldn’t be hurt until after the election. That’s in case they lose so they can blame the cuts on the democrats. With lies, of course.","2025-07-09T23:03:22.606Z"
"lavonda.bsky.social","Crockett: If there is anyone I am concerned about their mental acuity—it’s the current president","2025-07-10T00:38:34.794Z"
"lavonda.bsky.social","Torres: If the bill is so popular, why are the cuts largely delayed until after the midterm election? And if the bill surgically targets fraud, waste and abuse, why is it necessary to set up a $50 billion stabilization fund for rural hospitals?","2025-07-10T02:40:59.628Z"
"lavonda.bsky.social","BREAKING: Senator Alex Padilla is calling for ICE agents to be unmasked. Who agrees?","2025-07-10T01:19:55.276Z"
"lavonda.bsky.social","The administration thinks that disabled people are going to do this? I would die on the first day.","2025-07-10T14:04:35.667Z"
"lavonda.bsky.social","Bondi Calls Epstein List as Non-existent as Trump’s Healthcare Plan open.substack.com/pub/borowitz...","2025-07-10T11:37:28.144Z"
"lavonda.bsky.social","Good morning friends. ☀️🫶☕️","2025-07-10T11:18:03.932Z"
"lavonda.bsky.social","Only ICE agents.","2025-07-09T14:08:29.385Z"
"lavonda.bsky.social","😂😂😂😂😂😂","2025-07-10T08:51:01.543Z"
"lavonda.bsky.social","Lock up these bitches! 🔒","2025-07-10T00:20:49.193Z"
"lavonda.bsky.social","A Story: Let us go to July 2026... trump: Of course I'm dying. Leave me be! vance: But you didn't drink your Coca Cola! trump: Be off with you! musk: I hear you are dying? trump: Go away! musk: I want my money back for your 2024 election! trump: Security! musk: Ha! I bought them off! trump: Nooo!","2025-07-10T00:31:30.741Z"
"lavonda.bsky.social","AFL–CIO President: We’re taking this bus across the country to highlight what’s happening with these cuts we just saw in the worst job-killing bill in history. This bus is going to show up everywhere. We’ll be outside VA hospitals and grocery stores, showing how these SNAP cuts will impact families.","2025-07-09T22:02:42.327Z"
"lavonda.bsky.social","How Many Disasters Must Happen in Texas Before Greg Abbott Stops Denying Climate Change? - Esquire","2025-07-09T15:51:46.751Z"
"lavonda.bsky.social","I'm afraid the floods in Texas will be handled just like Uvalde. Lots of investigations, lots of blah,blah, blah, and nothing changes.","2025-07-09T15:29:05.775Z"
"lavonda.bsky.social","Padilla: MacArthur Park—After they staged this show of force, there were zero people detained. I’m sure they got tons of footage for their next TikTok videos. On the flip side, what’s happening to the community? Before these agents went through the park, it was the site of a summer camp.","2025-07-09T18:34:44.407Z"
"lavonda.bsky.social","Thank you, 🍁GЯ3ƬΣ🇬🇧 @gr3te4rights.bsky.social @vic2121.bsky.social @erturan3.bsky.social @wordworkin.bsky.social @ed-in-nova.bsky.social @bkend44.bsky.social @gmoyer17.bsky.social @lavonda.bsky.social @houseofnadja.com @annmb48.bsky.social @humanity101.bsky.social — @krassotkin.bsky.social","2025-07-09T16:16:03.645Z"
"lavonda.bsky.social","A drunk and rapist with a brain like a slushie are in charge of the world's largest military. What could possible go wrong?","2025-07-09T15:27:38.066Z"
"lavonda.bsky.social","Let me see if I got this right? Pete Hegseth (Secy of Defense) gave the order to 'PAUSE' Weapons to Ukraine. trump later reversed. Now trump is saying He didn't know of Hegseth's order to 'PAUSE' so it wasn't his fault? It's shit like this that weakens our Country & our Credibility in the World.","2025-07-09T14:55:00.467Z"
"lavonda.bsky.social","Here’s the bottom line for what’s going on with Grok - if the owner of the website is putting his thumb on the scale hard enough for the chatbot to turn into Goebbels, you should be deeply concerned about what he’s doing to the algorithm that you can’t so easily see, and what it’s doing to you","2025-07-08T21:10:54.047Z"
"lavonda.bsky.social","Good morning folks. Have a good Wednesday. ☀️🫶☕️","2025-07-09T12:42:15.487Z"
"lavonda.bsky.social","Arrest this Criminal","2025-07-08T13:19:10.209Z"
"lavonda.bsky.social","Bass: We have to stop this mess. The idea of having troops go through the park and disrupt a children’s summer camp, or drive through the streets and just pick people off… So our city attorney is leading the way. We are filing a lawsuit and calling for an injunction to stop this.","2025-07-09T01:44:56.045Z"
"lavonda.bsky.social","Ossoff: There is no constituency for this. There is no voting bloc in Georgia that's crying out for more expensive health care…","2025-07-09T04:05:55.160Z"
"lavonda.bsky.social","He really should fire his makeup person.","2025-07-09T02:25:34.883Z"
"lavonda.bsky.social","He can't be serious.","2025-07-08T17:32:57.891Z"
"lavonda.bsky.social","Remember : Epstein’s victims have already told us the names of the men who had done a lot of these crimes, we know there’s a list, we know this is a cover up.","2025-07-09T00:36:42.282Z"
"lavonda.bsky.social","Jeffries: Republicans are complete phonies when it comes to be claiming to be the party of fiscal responsibility. All they have done is explode the debt and the deficit. Why? In order to provide massive tax cuts for the wealthy…","2025-07-08T22:36:39.458Z"
"lavonda.bsky.social","I called everyone in Jeffrey Epstein's little black book. Here's what I learned about rich people, conspiracy, “genius,” Ghislaine, stand-up comedy, and evil from the 2,000 phone calls.","2025-07-08T17:19:59.885Z"
"lavonda.bsky.social","If my retirement plan fails, I die. But the Republicans don’t care as long as their wealthy donors keep their money. We need to change our government to be for the people not the few! What has happened to us is a direct result of Donald Trump and his inability to govern. He let the rich run him.","2025-07-04T14:58:48.300Z"
"lavonda.bsky.social","GUARDIAN: “Before his Grecian holiday, Cruz ensured a reduction in funding to the NOAA efforts to improve future weather forecasting of events that cause the sort of extreme floods that are being worsened by the human-caused climate crisis.” www.theguardian.com/us-news/2025...","2025-07-08T13:25:29.401Z"
"lavonda.bsky.social","Ted Cruz: ‘Vacationing Is How I Grieve’","2025-07-08T20:25:00.000Z"
"lavonda.bsky.social","It's bigger than Al Capone. And as you know. He killed people.","2025-07-08T03:54:01.969Z"
"lavonda.bsky.social","That criminal motherfucker is gonna get away with everything: The child rape; selling national secrets to foreign entities; stealing two elections; appointing a Supreme Court that refuses to hold him accountable for his crimes.","2025-07-08T03:51:13.790Z"
"lavonda.bsky.social","Yes, 2/28/25 they were returned, after Bondi said on 2/21/25 that she had the Epstein files. Coincidence? www.nytimes.com/2025/02/28/u... www.foxnews.com/politics/bon...","2025-07-08T06:42:54.756Z"
"lavonda.bsky.social","Wallace: “Are you still talking about Jeffrey Epstein?” says the guy who’s still talking about his 2020 election loss.","2025-07-08T20:11:37.977Z"
"lavonda.bsky.social","Why so quiet, JD?","2025-07-08T18:52:57.947Z"
"lavonda.bsky.social","If anyone doubts that we are under authoritarian-military rule at this point, here is where they’re at. 🙈🙊🙉 #StrongerTogether","2025-07-08T19:14:29.613Z"
"lavonda.bsky.social","This is the """"G"""" part of the gop G-rifters O-ligarchs P-edos share.newsbreak.com/dybmk0bz","2025-07-08T19:14:40.286Z"
"lavonda.bsky.social","I want to take a moment to thank Drew for taking an interest in my work and putting together such an excellent profile. Most of what I do focuses on highlighting prominent figures and their statements, so being the subject of a profile is a new experience—and a meaningful one.","2025-04-19T22:29:47.613Z"
"lavonda.bsky.social","Good morning, Carmen! 💙 Have a great day! 💙 @dcombes.bsky.social‬ @brendao.bsky.social‬ @dailykotzn.bsky.social @sadlycatless.bsky.social @putawomanincharge.bsky.social @drmjl.bsky.social @annettabettis.bsky.social @milesdestin.bsky.social @bluestormcomin1.bsky.social @raykwong.bsky.social","2025-07-08T13:43:55.576Z"
"lavonda.bsky.social","Someone ask her what FEMA stands for. Quickly.","2025-07-08T17:59:17.986Z"
"lavonda.bsky.social","Good morning and happy Monday to everyone. Dickhead’s ’Kill Children and Poor People’ bill includes a bigger budget for ICE than the whole Russian army. And now he wants to put an 'Alligator Alcatraz' in every state. Fuck. That.","2025-07-07T11:07:09.719Z"
"lavonda.bsky.social","This is a cover-up. Five Florida lawmakers were blocked from entering Alligator Alcatraz—told it was “unsafe.” But Trump, DeSantis, and Noem toured it last week just fine. So why can’t lawmakers do their legal oversight? And if it’s too dangerous for them, what about the migrants trapped inside?","2025-07-08T01:39:18.073Z"
"lavonda.bsky.social","Donald Trump thinks people have houses in windmills and that wind is “ugly.” 25th this guy already.","2025-07-08T17:27:27.586Z"
"lavonda.bsky.social","Time for a Story: It all started when trump & musk cut off funding overseas. Millions ended up dying. Then trump cut off the staff in the Natl Weather Service (NWS and NOAA). More people died needlessly. Then no vaccines were available, Millions more died. trump couldn't sleep & died. The End.","2025-07-08T04:22:21.345Z"
"lavonda.bsky.social","When In Doubt Humiliate.","2025-07-08T11:16:34.443Z"
"lavonda.bsky.social","Good morning friends. ☀️🫶☕️","2025-07-08T10:24:47.464Z"
"lavonda.bsky.social","Thoughts and prayers don’t stop mass shootings, and they don’t stop climate disasters either. This is a tragedy Gov. Greg Abbott did nothing to prevent. He still denies that climate change is real. He won’t act, and he won’t regulate.","2025-07-05T23:14:45.049Z"
"lavonda.bsky.social","Kristi Noem posting on Instagram during disaster recovery","2025-07-07T06:04:19.423Z"
"lavonda.bsky.social","we've shifted from """"90 deals in 90 days"""" to """"tailor-made trade plans for each and every country on this planet"""" (in order words, no deals)","2025-07-07T17:37:29.295Z"
"lavonda.bsky.social","The Heritage Foundation's Project 2025 called for dismantling the NOAA, which provides warnings of natural disasters, such as the deadly floods in Texas. The irony is that Heritage wanted these cuts because it’s angry that NOAA helps prove the reality of climate change--the thing causing floods.","2025-07-07T16:56:27.875Z"
"lavonda.bsky.social","Thank you to Mexico 🇲🇽 for stepping up and helping in Texas!","2025-07-07T16:46:16.800Z"
"lavonda.bsky.social","Do you remember when Governor Abbott put razor wire along the banks of the Rio? Do you remember when he had razor wire wrapped around the buoys?","2025-07-06T22:24:36.701Z"
"lavonda.bsky.social","And... they misspelled """"AUSCHWITZ.""""","2025-07-06T22:03:47.924Z"
"lavonda.bsky.social","Thank you, Mexico. 🙏💙","2025-07-07T08:11:27.081Z"
"lavonda.bsky.social","When you take a vacation while your constituents are drowning that’s called a Ted Cruise.","2025-07-07T12:16:01.641Z"
"lavonda.bsky.social","Musk mocks Pam Bondi.","2025-07-07T10:10:14.948Z"
"lavonda.bsky.social","This is what happens when the head of HHS has no medical background.","2025-07-05T21:40:50.156Z"
"lavonda.bsky.social","#SaturdayNight 🎉 @redsun76.bsky.social @kelofchgo.bsky.social @ginly47.bsky.social @patawan1.substack.com @sassysister27.bsky.social @ltwlauren.bsky.social @raykwong.bsky.social @jfkfan.bsky.social @greenellsworth.bsky.social @bluestormcomin1.bsky.social @62walterp.bsky.social @srosnato.bsky.social","2025-07-05T21:36:46.898Z"
"lavonda.bsky.social","Don't let them fool you. A Page dropped a quarter on the floor, and they all pounced on it.","2025-07-05T02:10:07.588Z"
"lavonda.bsky.social","Good morning friends. I hope you enjoy your day. ☀️🫶☕️","2025-07-06T11:45:04.550Z"
"lavonda.bsky.social","Saturday Favs @atoth99.bsky.social @kodiak149.bsky.social @wisedan.bsky.social @aliadair22.bsky.social @roseh0911.bsky.social @gina-12.bsky.social @loveshine204.bsky.social @saneresponz.bsky.social @farmboi1.bsky.social @abbarsha.bsky.social @digitalwarrior.bsky.social","2025-07-05T09:03:54.476Z"
"lavonda.bsky.social","TY @atoth99.bsky.social 💙 @suzzisulli.bsky.social @raykwong.bsky.social @schultziepie.bsky.social @nyyankeechick.bsky.social @smith83k.bsky.social @abbarsha.bsky.social @dougieg633.bsky.social I enjoyed watching the fireworks last night when this appeared in the sky during the finale. 🤣","2025-07-05T14:34:46.275Z"
"lavonda.bsky.social","Mike Johnson is used to giving up on his personal preferences.","2025-07-05T12:43:57.249Z"
"lavonda.bsky.social","Good morning friends. ☀️🫶☕️","2025-07-05T12:02:14.795Z"
