"user","post","date"
"lavonda.bsky.social","If you missed James Talarico on Lawrence O'Donnell tonight, DVR the rerun or catch it online. If he wins the primary and then the Senate seat, I have no doubt he is on his way to the Presidency in the next 20 years. He was extraordinarily impressive. 💯💯💯","2026-02-18T03:37:12.819Z"
"lavonda.bsky.social","Randy Fine’s comment is blatantly racist, dehumanizing, and dangerous. Speaker Johnson must condemn this bigotry immediately. We will not normalize Islamophobia in Congress.","2026-02-17T19:57:56.066Z"
"lavonda.bsky.social","ICE killed that teacher, not the immigrant. DHS is no friend to peace or safety in USA under Kristi Noem’s leadership. She must resign and take that drunk f*ckboy mooching off the taxpayers dime with her. Insanity.","2026-02-18T00:59:06.566Z"
"lavonda.bsky.social","Gwen and I are joining Americans in mourning the loss of our friend, Reverend Jesse Jackson. I could always pick up the phone for his wisdom and historic perspective.","2026-02-17T15:25:17.773Z"
"lavonda.bsky.social","NEW — An obscure Navy contractor program is making Trump’s plans to quickly build out and supply immigrant concentration camps around the country a reality. Here I explain WEXMAC TITUS, an acronym you need to understand:","2026-02-18T00:05:17.132Z"
"lavonda.bsky.social","Ghislaine Maxwell, a convicted child sex trafficker, gets gardening time, sports, therapy dogs, and spa products in prison. Migrant children in custody are sleeping on concrete floors without enough food or clean water. Our priorities are so fucked.","2026-02-16T05:57:56.204Z"
"lavonda.bsky.social","2-17-26 Boost C @botanicalbaby.bsky.social @bluestormcomin1.bsky.social @lavonda.bsky.social @bsjcr.bsky.social @zec-e.bsky.social @jrobinestrella.bsky.social @annmb48.bsky.social @michaeljgolub.bsky.social @lauriejoyous.bsky.social @mylife13.bsky.social @mattmcneilshow.bsky.social","2026-02-18T00:59:03.077Z"
"lavonda.bsky.social","Please SHARE if you agree!","2026-01-17T13:26:51.172Z"
"lavonda.bsky.social","That is an ICE agent pepper spraying a restrained victim in the face at close quarters; it's an unquestionable and indefensibly abusive use of excessive force that should (but won't) be criminally prosecuted as assault","2026-01-21T22:15:37.452Z"
"lavonda.bsky.social","No one in the #EpsteinFiles is """"innocent"""". ALL were communicating, negotiating, requesting favors, networking, joking, bargaining, advocating WITH A *KNOWN* PEDOPHILE. Sweeping trafficking of women and children to the back of your mind because it's inconvenient to your needs is still complicity.","2026-02-11T17:09:53.612Z"
"lavonda.bsky.social","2-17-26 Boost D (Final) @trishalla2012.bsky.social @bluestormcomin1.bsky.social @joegee65.bsky.social @billmontei.bsky.social @allymae.bsky.social @merrylwiener.bsky.social @angryeyes.bsky.social @jacksters.bsky.social @jakeresist.bsky.social @zelderbell.bsky.social @larryseefried.bsky.social","2026-02-18T01:18:07.676Z"
"lavonda.bsky.social","Share...","2026-02-16T23:31:58.980Z"
"lavonda.bsky.social","Does anyone, including the media, recognize the ironical hypocrisy of those Screaming for voter ID...and in the same breath...railing AGAINST ICE Agents having Identifiable ID on their Uniforms, with their faces uncovered?","2026-02-17T01:18:10.002Z"
"lavonda.bsky.social","Thank you Jürgen! 💙 @dailykotzn.bsky.social ☮️💙🐊🐸🦋 @copperflash.bsky.social @williamebales.bsky.social @lavonda.bsky.social @neverstopthefight.bsky.social @warriorinblue.bsky.social @starbucksjunkee.bsky.social","2026-02-17T23:32:13.763Z"
"lavonda.bsky.social","2-17-26 Boost B @caligrl58.bsky.social @bluestormcomin1.bsky.social @lavonda.bsky.social @supercooljoshman.bsky.social @jasperthor.bsky.social @caligrl58.bsky.social @bming5.bsky.social @bihle.bsky.social @grameileen.bsky.social @naelairone.bsky.social @swdrp4life.bsky.social","2026-02-17T23:56:47.870Z"
"lavonda.bsky.social","Exactly.... repost if you agree 🔄 #America 🇺🇸 It's all about fucking money... nothing else folks....","2026-02-17T23:25:09.467Z"
"lavonda.bsky.social","Taco Tuesday starter pack in honor of Rev. Jesse Jackson! NOW is the time to start making a plan for voting. This administration is going to do everything they can to prevent us from voting. Please remember to be kind!!! #Resist #StrongerTogether #VoteBlue go.bsky.app/B88jo2U","2026-02-17T21:49:00.048Z"
"lavonda.bsky.social","@nagual4444.bsky.social","2026-02-17T23:55:18.567Z"
"lavonda.bsky.social","💥 A huge explosion hit a military command office near St. Petersburg—Putin’s favorite city. Fewer will join Russia’s army now, as conscription collapses with rising losses. The irony? The city is named after a Tsar, the region after Lenin. #RussiaIsCollapsing #MakeRussiaSmallAgain #StandWithUkraine","2026-02-17T20:14:43.705Z"
"lavonda.bsky.social","CBS pulling @jamestalarico.bsky.social’s interview from The Late Show with Stephen Colbert is alarming and nothing short of censorship. Full breakdown on my Substack page (link below). adamkinzinger.substack.com/p/emergency-...","2026-02-17T19:43:41.630Z"
"lavonda.bsky.social","Here is what Democracy Docket is tracking for you today: Active Voting Rights Cases: 166 Active Redistricting Cases: 49 Active Anti-Voting Cases: 89 Active Pro-Voting Cases: 73 Active DOJ Lawsuits: 24 Stay informed. Subscribe today. hubs.ly/Q03M8rql0","2026-02-17T15:52:32.305Z"
"lavonda.bsky.social","I would like to know please why Canada 🇨🇦 is not opening an investigation into the Epstein files? @seanfraser.bsky.social @rechievaldez.bsky.social","2026-02-17T20:36:52.533Z"
"lavonda.bsky.social","ASK JUDY!","2026-02-17T18:53:05.742Z"
"lavonda.bsky.social","How is it possible that Kristi Noem still has this job. Imagine if you’re a family member or a shipmate of this guardsman. www.nbcnews.com/politics/imm...","2026-02-17T15:17:01.472Z"
"lavonda.bsky.social","ICE BORDER PATROLS ARE THE MOST COWARDS HUMAN BEINGS ON THIS PLANET. They won't unmask, hiding behind a mask they wouldn't wear in 2020. They shoot people in cold blood because they can get away with it! Trump, Miller, Bondi, Noem & others are responsible.","2026-02-17T17:16:18.321Z"
"lavonda.bsky.social","We lost Jesse Jackson and Robert Duvall this week. We really need to have a chat with Mr. Reaper about his priorities.","2026-02-17T14:04:45.963Z"
"lavonda.bsky.social","All the more reason! Ffs!","2026-02-17T14:09:15.550Z"
"lavonda.bsky.social","At times, I misunderstood what Rev. Jesse Jackson was doing, but in retrospect, he was trying to make America safe for black people, and that job is not finished. Thank You and may you Rest in Peace","2026-02-17T14:07:55.484Z"
"lavonda.bsky.social","CBS again bent the knee to Trump and blocked Stephen Colbert from hosting Texas Democratic state Rep. James Talarico.","2026-02-17T16:19:40.650Z"
"lavonda.bsky.social","PLEASE REPOST!","2026-02-17T16:03:52.675Z"
"lavonda.bsky.social","RIP the Icon, honorable Rev. Jesse Jackson. You will be missed, thank you for the love and wisdom.","2026-02-17T14:21:46.067Z"
"lavonda.bsky.social","@genxer-71.bsky.social Happy Fat Tuesday!💜💛💚","2026-02-17T13:56:33.814Z"
"lavonda.bsky.social","WHERE'S THE ROPE? www.ms.now/opinion/step...","2026-02-17T04:20:20.154Z"
"lavonda.bsky.social","Good morning lovely friends. ☀️🫶☕️","2026-02-17T13:17:13.814Z"
"lavonda.bsky.social","I never thought I’d see the day. Americans being told by the rest of the world to fight for our own democracy. We should never have gotten here. Keep resisting. ✊🏽 #SheShed #Voices4Victory","2026-02-17T01:16:35.599Z"
"lavonda.bsky.social","What If? Dear Donald, I have an idea! Why don't you ride with me into Space? William Shatner did it. It will be fun! You will get a lot of publicity! Signed, Elon Dear Elon, Sounds great! Let's go! Later 5, 4, 3, 2, 1 - BLAST OFF! EM: Donald, You are in Space! djt: What's this lever?","2026-02-17T01:08:27.632Z"
"lavonda.bsky.social","www.facebook.com/share/p/1H8s...","2026-02-17T00:34:49.580Z"
"lavonda.bsky.social","… And For His Next Offense open.substack.com/pub/steady/p...","2026-02-16T23:30:47.305Z"
"lavonda.bsky.social","WHERE IS IT NOW?","2026-02-16T22:20:40.185Z"
"lavonda.bsky.social","Friendship Ball I send on to: @michellespenc.bsky.social @sheilaharris.bsky.social @kodiak149.bsky.social @mainebogboy.bsky.social @sibelian62.bsky.social","2026-02-16T13:38:36.631Z"
"lavonda.bsky.social","One of the most shocking and horrifying references to Trump and the Epstein material I've seen yet. And, it came from a sitting member of Congress. www.jackhopkinsnow.com","2026-02-16T22:49:46.183Z"
"lavonda.bsky.social","Again @brucespringsteen.net speaks for America. The anger and our resolve to Resist youtu.be/GDaPdpwA4Iw","2026-01-30T10:23:09.865Z"
"lavonda.bsky.social","oh, the brutality of ICE 🎯","2026-02-16T19:53:24.123Z"
"lavonda.bsky.social","It took one man... To realize that to steal a Nation full of gullibles... One just needs to have a platform that is unencumbered by the truth...","2026-02-16T21:13:34.950Z"
"lavonda.bsky.social","I was a parent of a troubled teen. I know how hard it is every day. But I never gave my teen access to a gun. There should be consequences, and maybe the next parent will make a better decision.","2026-02-16T17:11:06.290Z"
"lavonda.bsky.social","Looks like required neighborhood notification to me","2026-02-16T13:00:20.159Z"
"lavonda.bsky.social","TERMINATE Dilley. The Dilley Immigration Center is run by the for-profit contractor CoreCivic. Conditions are deplorable. Baby formula is mixed with putrid water, food has bugs in it, abuse is rampant. The measles outbreak is reaching a crisis level. www.medpagetoday.com/opinion/seco...","2026-02-15T23:07:36.117Z"
"lavonda.bsky.social","Never ever trust murica. They lie, cheat, bully, steal from other countries, bomb fishermen, they are a predator regime. If you have something the #NaziKing wants they will invade you and take it. It’s a locust regime. Never, ever trust murica. 🇨🇦 never will again. #Enemies #Traitors","2026-02-16T13:18:01.127Z"
"lavonda.bsky.social","How come a sitting president can sue an individual, but an individual cannot sue a sitting president?","2026-02-15T17:35:21.420Z"
"lavonda.bsky.social","www.joemygod.com/2026/02/news...","2026-02-16T13:15:59.568Z"
"lavonda.bsky.social","I guess our Founding Fathers forgot to put in the Prosecutor Clause on bad Presidents, didn't they? Or Today's Judicial and Legislature are so COWARDS that they won't Prosecutor ANYBODY???","2026-02-16T12:58:28.162Z"
"lavonda.bsky.social","And criminals are buying pardons and making tRump rich.","2026-02-16T12:02:25.076Z"
"lavonda.bsky.social","Lindsey Graham says who gives a shit about Greenland!!! Can a real investigative journalist find out what Trump has on Lindsey and share with everyone. His constituents deserve to know what and who they are voting for. The dirt has got to be really huge!!!!","2026-02-16T12:34:21.661Z"
"lavonda.bsky.social","IT'S TRUE!","2026-02-16T12:20:22.948Z"
"lavonda.bsky.social","Deciding it’s too dangerous to reveal just how unpopular the current president is seems like the worst poll result ever.","2026-02-11T19:45:28.026Z"
"lavonda.bsky.social","I concur. It must go.","2026-02-15T21:59:02.496Z"
"lavonda.bsky.social","Her murderers will be held for murder. We will make sure!","2026-02-15T22:55:11.482Z"
"lavonda.bsky.social","It's time to take back our country from the Republicans and start to rebuild... and make sure this madness never ever happen again!","2026-02-15T22:49:22.969Z"
"lavonda.bsky.social","Please Repost","2026-02-15T22:50:44.845Z"
"lavonda.bsky.social","A key topic at @munsecconf.bsky.social: Ukraine. I joined Yulia Navalnaya, Thordis Kolbrun Gylfadottir, and Benjamin Haddad for a conversation with Ali Aslan about where the conflict stands. I believe the attempt to force Ukraine to agree to a capitulation agreement with Putin is a disgrace.","2026-02-15T21:03:58.262Z"
"lavonda.bsky.social","What Trump touches turns to shit: 1) Executive Branch 2) Judicial Branch 3) Legislature Branch 4) State and Local Officials 5) Fox, CNN, NBC News, MS NOW 6) Americans 7) Rednecks 8) The World SO QUIT VOTING FOR THIS SHIT MAKER!!!!!!!!!!!!!!","2026-02-15T16:51:19.730Z"
"lavonda.bsky.social","""""In most countries they either imprison, or execute P*dophiles! Not Elect them…!!!","2026-02-15T08:15:57.810Z"
"lavonda.bsky.social","Tom Homan on ICE in Minneapolis: """"There were some issues here. I'm not going to sit here and say anybody did anything wrong."""" We'd be better off if Republicans put as much effort into combating gun violence as they've put into justifying murdering US citizens. #ProudBlue #Pinks #SheShed","2026-02-15T14:15:19.858Z"
"lavonda.bsky.social","@barackobama.bsky.social: """"Bad Bunny's halftime show... This is what a community is. People who did not speak Spanish and have never been to Puerto Rico saw that elderly woman serving a drink and the kids dancing with their grandmas... There's room for everybody here. That I think is where we win.""""","2026-02-14T18:54:29.215Z"
"lavonda.bsky.social","Say it again! Louder this time!","2026-02-15T14:23:37.235Z"
"lavonda.bsky.social","Good Sunday my friends.","2026-02-15T14:23:37.658Z"
"lavonda.bsky.social","👇👇👇👇","2026-02-14T00:59:48.186Z"
"lavonda.bsky.social","#Epstein #EpsteinFiles","2026-02-13T15:55:30.866Z"
"lavonda.bsky.social","Good morning friends and happy Valentines Day. 💕☀️🫶☕️","2026-02-14T13:35:05.776Z"
"lavonda.bsky.social","My 38th vetted pack- Spread the love! @schultziepie.bsky.social @victinibcn.bsky.social @dcombes.bsky.social @fireeyebooks.bsky.social @chaserbaybe.bsky.social @mlipsitt.bsky.social @markrf400.bsky.social @tammyjo408.bsky.social @claynobles.bsky.social go.bsky.app/G2VEQJn","2026-02-14T12:58:54.925Z"
"lavonda.bsky.social","2 Friday the 13th Pizza 🍕 Party @gaspatient.bsky.social @billthornbro.bsky.social @larrycolvin.bsky.social @demsocialistguy.bsky.social @pinkmouse.bsky.social @felicianmitzi.bsky.social @soldiergirl.bsky.social @kitchen5203.bsky.social @lavonda.bsky.social @blondiebombshell.bsky.social","2026-02-13T23:16:19.263Z"
"lavonda.bsky.social","Google gave ICE the sensitive personal data of a student journalist, including his bank account and credit card info, without even letting him know. The company is also helping bankroll Trump’s vanity ballroom project. Google is enabling fascism — all to protect its bottom line.","2026-02-12T21:15:09.164845Z"
"lavonda.bsky.social","Every time Trump praises Putin as wanting peace, Putin bombs the living shit out of Ukraine to make Trump look like the lying, compromised old fool that he is. Isn't it time for Trump to send real tough negotiators to Moscow instead of pansy boy Jared b/c Putin devours weakness.","2026-02-03T19:02:16.905Z"
"lavonda.bsky.social","Pamela Jo Bondi coldly ignoring the Epstein survivors as she memorizes her next irrelevant lie to protect one of the main perpetrators.","2026-02-11T17:18:15.029Z"
"lavonda.bsky.social","California, we have the power to stop election rigging, right now! Did you get your ballot in? I did and so did my entire family. Remind everyone you know. 👊🏽 #Prop50VoteYes","2025-10-30T19:23:18.138Z"
"lavonda.bsky.social","""""midterms_messaging: Trump Presidential Comparisons.""""","2026-02-13T21:08:22.188Z"
"lavonda.bsky.social","‪Not only is Trump murdering people... He is killing the United States... And NOW He is KILLING PLANET EARTH!!!!!!!!!! apnews.com/article/trum...","2026-02-13T04:18:35.347Z"
"lavonda.bsky.social","Sanders: The American people do not want this country to be an authoritarian society or an oligarchy. We have our differences, that’s what democracy is about—we argue it out. We don’t throw people who disagree in jail. We don’t intimidate the media. We don’t send ICE agents to shoot people.","2026-02-13T20:20:09.815Z"
"lavonda.bsky.social","Full interview and more from MeidasTouch here: youtu.be/IxmE2lb3MRo","2026-02-13T01:36:45.040Z"
"lavonda.bsky.social","Sanders: The other day, Trump said, “We are living in the best economy in the history of the world.” Well, he’s right — for him and his billionaire friends, he’s exactly right. But not for ordinary Americans.","2026-02-13T20:25:19.766Z"
"lavonda.bsky.social","Call them all and tell them to leave to exile!👹👹👹","2026-02-13T13:51:03.564Z"
"lavonda.bsky.social","It looks like there is at least some accountability everywhere in the world except the US where at least some of the crimes took place and at least some of the perpetrators were Americans. Looks like the perps in the rest of the world should be asking. """"where is my Pam Bondi?"""".","2026-02-12T18:02:32.029Z"
"lavonda.bsky.social","#Epstein #EpsteinFiles","2026-02-12T19:14:05.257Z"
"lavonda.bsky.social","Hey there Pam Bondi if you have nothing to hide why were you tracking what congressmen were searching on the Epstein files? Why uh…. Why…. Why so nervous?","2026-02-13T14:27:43.159Z"
"lavonda.bsky.social","Racist POS","2026-02-13T15:51:16.070Z"
"lavonda.bsky.social","@nagual4444.bsky.social @jen.sheshed.rocks hi, would you please help us by reposting?","2026-02-13T12:24:46.985Z"
"lavonda.bsky.social","This killing for kinks affair on taxpayer dime must end. Remove them both.👹👹","2026-02-13T14:29:11.742Z"
"lavonda.bsky.social","Imagine using their suffering as a political point just months ago & now ignoring them.","2026-02-13T14:13:54.073Z"
"lavonda.bsky.social","Good morning friends.","2026-02-13T13:48:30.492Z"
"lavonda.bsky.social","Just like with Brazil arresting their insurrectionists rather than re-electing them, other countries are holding their Epstein-tied politicians accountable far better than we do. www.bbc.com/news/article...","2026-02-12T17:44:55.573Z"
"lavonda.bsky.social","#Trump and the #Pedophiles are lying with impunity, and to our face, like we’re stupid! They’ve been protecting each other for decades! #Resist #Epstein #EpsteinFiles","2026-02-13T13:17:31.136Z"
"lavonda.bsky.social","Pam Bondi: """"There is no evidence that Donald Trump has committed a crime."""" Rep Lieu: """"You just lied under oath."""" Bondi: """"Don't you ever accuse me of a crime."""" Lieu: """"This is all on videotape... I’m showing you evidence."""" #OpDeathEaters #EpsteinCoverup #EpsteinFiles","2026-02-13T00:04:02.720Z"
"lavonda.bsky.social","Re: Nancy Guthrie. This probably won’t see the feed’s light of day but I feel compelled to post the horrific thought that just came to me. Is it possible this wonderful lady’s abduction was ordered by the Regime to take the spotlight off the Epstein files?😳😳","2026-02-12T01:47:42.366Z"
"lavonda.bsky.social","It’s amazing that MAGA people actually think this admin spends 5 minutes giving a fuck about any of them because they are fed a steady diet of culture war bullshit by Trump, Fox and paid influencers to keep them blissfully ignorant of what is really happening.","2026-02-13T00:46:41.567Z"
"lavonda.bsky.social","“We’re the only country in the world that has mail in ballots”. - Senile Satan","2026-02-12T23:28:37.201Z"
"lavonda.bsky.social","I was born and raised in rural Trump country. I'm telling you...I CONTINUE to see Republicans saying, """"F*ck Donald Trump!"""" The level of anger they are feeling...will not find them voting for Trump. Not. Gonna. Happen. I know these people. THIS...is different.","2026-02-12T23:29:01.762Z"
"lavonda.bsky.social","Epstein survivor Haley Robson: I’m so tired of having this administration just completely dismiss us. They’re supposed to be the party of, you know, family values and protecting children. And I just feel like if that’s the party you are, it seems like Thomas Massie is the only one showing up for it.","2026-02-12T22:24:18.044Z"
"lavonda.bsky.social","Full interview and more from MeidasTouch here: youtu.be/DJH7mnKN2EA","2026-02-13T00:38:48.883Z"
"lavonda.bsky.social","Klein: People are afraid to come into clinics or hospitals because they’re afraid they’ll be snatched. So they’re staying home with acute conditions like appendicitis. They’re not going to their follow-up neonatal appointments. They’re allowing their jaundiced babies to go untreated.","2026-02-13T00:51:27.935Z"
"lavonda.bsky.social","TELL THAT TO THE FAMILIES YOU MURDERED! apnews.com/article/minn...","2026-02-13T01:19:00.781Z"
"lavonda.bsky.social","You’re So Vain open.substack.com/pub/steady/p...","2026-02-12T23:42:43.687Z"
"lavonda.bsky.social","#Resist #Epstein #EpsteinFiles","2026-02-12T18:57:07.958Z"
"lavonda.bsky.social","In my mind, I see a small starving child, going from table to table in this horrific ballroom, begging for scraps of food....#Ballroom","2025-08-01T17:03:30.203Z"
"lavonda.bsky.social","We are in a fight of good versus evil. It was on display today in the form of Pam Bondi. Here is a woman who has seen the horrors in the Epstein files, yet she treated the survivors with absolute contempt and scorn while protecting the monsters who victimized them. She is beyond evil.","2026-02-12T03:47:54.558Z"
"lavonda.bsky.social","Likely-historic photo by NBC News of all the Epstein victims asked to raise their hands if they've not yet been asked to meet with the DOJ as Bondi testifies in foreground","2026-02-11T17:15:47.987Z"
"lavonda.bsky.social","Also, with apologies to Jodie Foster, “underage prostitutes” aren’t a thing. They’re child trafficking victims.","2026-02-12T14:54:57.067Z"
"lavonda.bsky.social","And…Epstein is NOT a disgraced financier he’s a CONVICTED CHILD SEX TRAFFICKER.","2026-02-12T11:05:58.740Z"
"lavonda.bsky.social","Dear Pam……","2026-02-12T07:24:01.586Z"
"lavonda.bsky.social","Good afternoon & TY TC @turquoise-cat.bsky.social 💙🕊️💙🕊️ @frankiemillie10.bsky.social @annmb48.bsky.social @genxer-71.bsky.social @markymark757.bsky.social @scorpionstardust4.bsky.social @rfscrewx.bsky.social @tomrom1.bsky.social @marlenerobertson.bsky.social @rubicon1313.bsky.social","2026-02-12T20:57:08.246Z"
"lavonda.bsky.social","Reminder: Pam Bondi made at least $3 million from the merger that formed the parent company of Trump's Truth Social platform. abcnews.com/US/trump-ag-...","2026-02-11T22:13:30.466Z"
"lavonda.bsky.social","We hate you for free!!!! #Resist #Epstein #EpsteinFiles","2026-02-12T18:56:28.181Z"
"lavonda.bsky.social","Guess What Folks??? I've been blocked from posting APNEWS!!!!!!! Something is up!!!!!!!!!!","2026-02-12T21:46:38.833Z"
"lavonda.bsky.social","📢SHUT EVERYTHING DOWN DON'T LEAVE YOUR HOME KEEP KIDS OUT OF SCHOOL, STOCK FOOD, DON'T SHOP, DON'T TRAVEL ANYWHERE UNLESS IT'S AN EMERGENCY HELP NEIGHBORS HAVE COMPASSION #StarveICE NOTHING MOVES WITHIN THE U.S. WITHOUT THE PEOPLE WHO LIVE HERE IF NO ONE IS IN THE STREETS THEY HAVE ZERO POWER 👇","2026-02-12T02:44:38.711Z"
"lavonda.bsky.social","bsky.app/profile/figh...","2026-02-12T19:54:49.350Z"
"lavonda.bsky.social","Pam Bondi reminds Epstein's victims why they should thank Trump www.rawstory.com/pam-bondi-re...","2026-02-12T19:19:02.844Z"
"lavonda.bsky.social","Look! """"News of a potential immigrant detention center in Kansas City sparked fierce public backlash over the past month. At rallies and protests, many people called on Platform Ventures to not sell the building to the federal government..."""" And now: www.kcur.org/news/2026-02...","2026-02-12T18:57:51.907Z"
"lavonda.bsky.social","Bondi telling Representative Ted Lieu: """"Don't you ever accuse me of a crime"""". Sounded like a threat from the US Attorney General even though she just committed perjury.","2026-02-12T14:24:13.975Z"
"lavonda.bsky.social","Todd Lyons claimed in Homeland Security hearing that ICE goons are only using their phones to collect evidence against so-called agitators. Except the guy who arrested Nekima Armstrong Levy clearly used it for propaganda purposes. storage.courtlistener.com/recap/gov.us...","2026-02-12T18:40:10.110Z"
"lavonda.bsky.social","McCormick: """"The things they're asking for are laughable. When you talk about having IDs, first & last name, & uncovering faces - that's way more than you wanted for voter ID. It's total hypocrisy. You know that's just for doxxing and to threaten people's families. They're already well identified.""""","2026-02-12T18:39:10.787Z"
"lavonda.bsky.social","Pamela Jo has just told Congress that Trump's shitty economy is more important than transparency with the Epstein Files.","2026-02-11T16:02:14.122Z"
"lavonda.bsky.social","👇👇","2026-02-12T19:47:59.907Z"
"lavonda.bsky.social","👇","2026-02-12T19:46:46.638Z"
"lavonda.bsky.social","Walz: """"The federal government needs to pay for what they broke here. There's going to be accountability on things that happened, but one of them is the incredible and immense cost borne by the people of this state. The federal government needs to be responsible.""""","2026-02-12T16:04:00.539Z"
"lavonda.bsky.social","I've looked for 10 mins and found 2 rapists The FBI had how long?","2026-02-12T16:31:01.734Z"
"lavonda.bsky.social","Bad guys with guns. And badges.","2026-02-12T16:30:41.734Z"
"lavonda.bsky.social","Pam Bondi’s testimony on the Epstein files revealed one key thing: The attorney general isn't interested in truth or justice.","2026-02-12T14:06:19.957Z"
"lavonda.bsky.social","Yikes — Epstein showing appreciation for @GovBillLee pal Betsy Devos making it harder to report sexual abuse on campuses","2026-02-12T14:33:36.300Z"
"lavonda.bsky.social","Mark Kelly Records Video Telling Bartenders They Are Allowed to Refuse Hegseth's Orders open.substack.com/pub/borowitz...","2026-02-12T14:01:49.288Z"
"lavonda.bsky.social","Good morning and good Thursday, my friends. ☀️🫶☕️","2026-02-12T13:18:37.790Z"
