"user","post","date"
"lavonda.bsky.social","I believe the Epstein/Trump victims. It's as easy as that.","2025-09-06T02:56:30.802Z"
"lavonda.bsky.social","So maybe the problem wasn’t with the head of the Bureau of Labor Statistics?","2025-09-05T15:24:41.092Z"
"lavonda.bsky.social","John Cleese Rocks!! 👊🏻💙😂😂","2025-09-03T21:36:09.790Z"
"lavonda.bsky.social","Priorities.","2025-09-05T19:47:00.199Z"
"lavonda.bsky.social","Good morning my friends. I hope your Friday is a day without worry. ☀️🫶☕️","2025-09-05T11:36:07.198Z"
"lavonda.bsky.social","Gavin Newsom mocking Karoline Leavitt as Effie Trinket from the Hunger Games 👏🏼🤣🏆","2025-09-02T14:51:07.667Z"
"lavonda.bsky.social","Scream this story from the rooftops. And again. And again.","2025-09-05T03:11:25.712Z"
"lavonda.bsky.social","Let’s stop calling them ‘medical miracles’, let’s instead call them, SCIENCE. Keep your miracles for your books of fantasy and fairy tales.","2025-08-26T15:37:32.620Z"
"lavonda.bsky.social","🤬 Russia attacks Ukraine with 150 drones, hit recorded in 9 locations","2025-09-02T06:20:19.401Z"
"lavonda.bsky.social","www.savehhs.org","2025-09-04T23:03:30.081Z"
"lavonda.bsky.social","Today's bulletin is a must read: www.meidasplus.com/p/today-in-p...","2025-09-04T22:22:20.890Z"
"lavonda.bsky.social","Ossoff: He never should have been confirmed by the senate and he needs to resign. It is one thing to be a skeptic or a reformer. It is quite another to be a fool…","2025-09-04T22:57:19.196Z"
"lavonda.bsky.social","Pritzker: Trump seems a little obsessed with me and with Chicago — maybe he’s got Pritzker derangement syndrome.","2025-09-04T19:43:28.221Z"
"lavonda.bsky.social","Full interview and more from MeidasTouch here: youtu.be/jtYEXHuc1AA","2025-09-04T19:57:27.189Z"
"lavonda.bsky.social","Pritzker: It appears they are amassing ICE officers… It’s been reported that about 300 officers are planning to come in and do what they did in LA — terrorize neighborhoods and cause mayhem. Their plan is to create enough chaos on the ground that troops will have to be called in","2025-09-04T19:57:27.188Z"
"lavonda.bsky.social","Agree Mr. Daniels,Chump's 💯 The Worst of Us......","2025-09-04T09:13:08.517Z"
"lavonda.bsky.social","Kuvin: He didn’t keep a list of these people. What he would do is get calls from powerful men — men who lived in Palm Beach, for example. They would talk to Ms. Maxwell, and she would send a girl out. If you really to know who was involved, you would look at his phone books","2025-09-04T19:23:07.408Z"
"lavonda.bsky.social","Wednesday Thanks @eggzbacn.bsky.social @sassy0210.bsky.social @raykwong.bsky.social @cheryl2877.bsky.social @jysexton.bsky.social @bluestormcomin1.bsky.social @phyllisjsilver.bsky.social @atti1711.bsky.social @trasgato.com @keithmuise.bsky.social @alphacentauri53.bsky.social","2025-09-04T17:49:57.430Z"
"lavonda.bsky.social","RFK Jr: It's gonna be the biggest infusion of federal dollar into rural healthcare in American history BERNIE SANDERS: Yeah. You know why? Because you're cutting $150b for rural hospitals, you're putting $50b back. That's not an infusion. That's a loss of $100b.","2025-09-04T16:16:01.654Z"
"lavonda.bsky.social","RFK JR: You’re just making stuff up Hassan: Sometimes when you make an accusation, it’s kind of a confession","2025-09-04T15:25:10.416Z"
"lavonda.bsky.social","Warnock: Clearly you have an agenda. It is a threat to the public health of the American people. It's clear that you are carrying out your extremist beliefs. RFK JR: We’re the sickest people on earth. How am I a threat? Warnock: I think that you ought to resign.","2025-09-04T16:48:34.683Z"
"lavonda.bsky.social","RFK JR: It's going to have a it's going to it's going to be the biggest infusion of federal dollars into rural health care in American history. SANDERS: You know why? Because you're cutting $150 billion for rural hospitals. You're putting $50 billion back. That's not an infusion.","2025-09-04T16:14:25.902Z"
"lavonda.bsky.social","For all the women everywhere. No matter the circumstances, no matter who you pray to. You are not alone and hope is eternal. If you can’t laugh out loud. Laugh with joy in your heart and feel the love grow within you. No one around can see. Your gift, your love, is you. Be safe.","2024-12-11T03:00:39.180Z"
"lavonda.bsky.social","RFK Jr is being barbecued in Congress right now. Rightfully so!","2025-09-04T15:23:12.305Z"
"lavonda.bsky.social","RFK JR: You're making things up to scare people. And it's a lie. Hassan: With respect, I do not think I'm the one making things up.","2025-09-04T15:26:30.319Z"
"lavonda.bsky.social","The Vice President decided he should get a new suit just in case an important event should arise. Here he is practicing. (All in my imagination.) #jdvance #vicepresident #presidentvance #inauguration #suit #politicalcartoons #newyorkercartoons #bayareacartoonists","2025-09-03T05:36:10.213Z"
"lavonda.bsky.social","Mike #Johnson says he’s worried about the #victims, he means the men who are named by some “untrustworthy lower-class female” (not his words) Do the women know the names of the men they were trafficked to? It sounds like they do.","2025-09-04T01:45:06.699Z"
"lavonda.bsky.social","Trump now calling #Epstein a #hoax is a dead giveaway that his name appears as attendee in at least two of those “parties” or testimonies.","2025-09-04T02:05:55.136Z"
"lavonda.bsky.social","Today, Donald Trump created the most grandiose, pathetic example of DARVO—Deny, Attack, Reverse Victim & Offender—ever seen. I wrote about the psychology behind Donald Trump sending fighter jets to harass Epstein survivors. Nevertheless, they persisted. www.mind-war.com/p/darvo-flyo...","2025-09-04T01:32:04.313Z"
"lavonda.bsky.social","Good Thursday, my friends. ☀️🫶☕️","2025-09-04T12:54:37.045Z"
"lavonda.bsky.social","open.substack.com/pub/mitchthe...","2025-09-04T12:50:19.675Z"
"lavonda.bsky.social","The president is using the military to dismantle cities that didn't vote for him The president is using the military to distract from women speaking out against his and Jeffrey Epstein's sexual abuses. We are not living in ordinary times. Extraordinary responses are called for.","2025-09-03T16:35:08.092Z"
"lavonda.bsky.social","RFK Jr. will face """"hard questions"""" over CDC shakeup, according to Thune. The Senate majority leader expressed frustration over the firings of recently confirmed officials.","2025-09-03T16:18:39.339Z"
"lavonda.bsky.social","Nigel Farage looks uncomfortable as Jamie Raskin uses his opening statement to absolutely demolish him","2025-09-03T16:39:55.827Z"
"lavonda.bsky.social","If releasing the Epstein files would end your presidency, then your presidency needs to end.","2025-09-03T20:47:53.759Z"
"lavonda.bsky.social","Donald Trump had 8 fighter jets flyover the Epstein rаpе survivor conference, interrupting them mid speech. This woman named Trump.","2025-09-03T21:19:19.237Z"
"lavonda.bsky.social","As a survivor, I can't think of a more fitting metaphor than a rapist creating loud noises with planes as a survivor tries to tell her story. I mean... just wow. Nevertheless, she persisted.","2025-09-03T18:45:11.478Z"
"lavonda.bsky.social","Do we believe these women who say they were raped by a monster or do we believe the monster?","2025-09-03T15:45:54.766Z"
"lavonda.bsky.social","AOC: Millionaires are very overrepresented in congress… If we want a congress that reflects the actual country we seek to represent and fight for, we need to have working class people who work here","2025-09-03T17:43:58.302Z"
"lavonda.bsky.social","Bonta: They tried to rely on this supposed exception to the Posse Comitatus Act. And Judge Breyer, during the trial, rightfully asked: “I haven’t seen that in the Constitution. Can you point it out?” Of course, it could not be pointed out by the witness, because it doesn’t exist.","2025-09-03T18:18:53.836Z"
"lavonda.bsky.social","Watch the full video here: youtu.be/j0IdOJHE-8Y","2025-09-03T18:18:53.837Z"
"lavonda.bsky.social","Shuler: We are living in a very cynical moment right now. So many people are cynical about our politics. They’ve lost faith in many institutions in our country. But there’s one institution they still believe in: unions.","2025-09-03T18:32:32.725Z"
"lavonda.bsky.social","Blue States need to pull together and save our people from wackos in the Republican Party.","2025-09-03T12:00:15.497Z"
"lavonda.bsky.social","Um, I was told that tariffs would bring the American manufacturing back","2025-09-03T11:26:52.215Z"
"lavonda.bsky.social","And he may have altered the Voter ballots last November ILLEGALLY!!!!!!!!","2025-09-03T14:34:24.955Z"
"lavonda.bsky.social","Elon Musk might be out of sight but by by Damned he is out of mind!!!!!!! We know what he did!!!!!!! He closed down Federal Agencies illegally while giving two perfect Hitler Salutes to the Public!!!!!! He stole from these Agencies and robbed them blind illegally!!!!!! He broke the LAW!!!!!!!!!","2025-09-03T14:32:06.043Z"
"lavonda.bsky.social","Speaking of Fraud and Immigrants, Illegal or otherwise, There's Chump's wife,Melanoma ?","2025-09-03T08:51:27.640Z"
"lavonda.bsky.social","I heard a rumor that Trump may resign. Thank God for Rumors! They keep us going and going strong. Can you imagine if that Rumor is true???","2025-09-03T02:22:31.087Z"
"lavonda.bsky.social","The state of America: Cyndi Lauper changes the lyrics to Girls Just Want to Have Fun to Girls Just Want Fundamental Rights.....","2025-09-02T23:38:13.853Z"
"lavonda.bsky.social","Reid: Bondi is not a real AG. She just works for Trump. All these U.S. attorneys — what’s her name from Fox (who I hope is sober) — she’s not a real U.S. attorney. She works for Trump. They’ve gutted the DOJ. The DOJ doesn’t exist. The FBI doesn’t exist. It’s all just Trump’s employees.","2025-09-03T04:13:09.346Z"
"lavonda.bsky.social","It’s chalk. The rain would have washed it away. But, DeSantis is so hateful n homophobic that he had to waste tax $$ to show hate towards the LGBTQ community! I say go draw the LGBTQ flag all over Florida to say 🖕🏼 DeSantis! #equality #lgbtq #florida","2025-09-01T05:29:23.363Z"
"lavonda.bsky.social","Thank you, Filosia! 💙 @baconskingirl.bsky.social‬ @emeraldilse65.bsky.social @bittiegirldonna.bsky.social‬ @marguerite00.bsky.social @politicshealth.bsky.social @lavonda.bsky.social‬ @rba11.bsky.social‬ @rebelb1ue.bsky.social @bluestormcomin1.bsky.social @raykwong.bsky.social","2025-09-03T11:19:33.016Z"
"lavonda.bsky.social","Good morning and happy Wednesday, my friends. ☀️🫶☕️","2025-09-03T11:38:59.459Z"
"lavonda.bsky.social","www.voanews.com/a/usa_impeac...","2025-09-02T21:51:10.088Z"
"lavonda.bsky.social","@liberalwarrior.bsky.social @filosia.bsky.social @cindyannpedersen.com @cindyandrewsmcgraw.bsky.social @nancyspantsbelt.bsky.social @adajah55.bsky.social @stevethdemocrat.bsky.social @greenellsworth.bsky.social @raykwong.bsky.social @spendsister.bsky.social @csnodd.bsky.social @malwolf.bsky.social","2025-09-02T21:57:32.603Z"
"lavonda.bsky.social","Ex-CIA Whistleblower: """"The NSA Audited The 2024 Election, Kamala Harris Won"""" open.substack.com/pub/thiswill... KAMALA HARRIS Beat Tramp who CHEATED","2025-07-31T15:13:30.520Z"
"lavonda.bsky.social","@lsatterfield.bsky.social @bella-belle.bsky.social @louwailou.bsky.social @jrw4vt.bsky.social @sherrinau.bsky.social ‪ @irongranny.bsky.social @countryboots44.bsky.social @lavonda.bsky.social @ksp2pdx.bsky.social @tunedhuman.bsky.social @mikiyo10.bsky.social @nbpt-john.bsky.social","2025-09-02T17:19:47.985Z"
"lavonda.bsky.social","Deport Musk and Thiel back to South Africa!","2025-09-02T05:10:27.818Z"
"lavonda.bsky.social","This is something I’ll never forget nor will I let anyone!","2025-09-02T19:21:36.532Z"
"lavonda.bsky.social","GOP Lawmaker Struggles to Explain Why He Voted Down Bill That Would Have Provided Mental Health Funding He Now Wants to Stop Mass Shootings www.mediaite.com/media/news/g...","2025-09-02T19:36:19.587Z"
"lavonda.bsky.social","以其人之道，还治其人之身！请君入瓮！","2025-08-31T16:03:24.096Z"
"lavonda.bsky.social","获得川贼授予的“自由勋章”不仅毫无意义，而且是一个终身无法洗刷的耻辱！","2025-09-02T13:34:44.516Z"
"lavonda.bsky.social","Ya know…","2025-08-15T00:25:41.258Z"
"lavonda.bsky.social","Pritzker: When did we become a country where it's okay for the president to insist on national television that a state should call him to beg for anything, especially something we don't want? Have we truly lost all sense of sanity in this nation that we treat this as normal?","2025-09-02T20:18:08.541Z"
"lavonda.bsky.social","Pritzker: Any rational person who has spent even the most minimal amount of time studying human history has to ask themselves one important question: Once they get the citizens of this nation comfortable with the current atrocities committed under the color of law, what comes next","2025-09-02T20:19:15.637Z"
"lavonda.bsky.social","And Don't Leave out Chump's Pedophilia !!!!!!","2025-09-02T08:51:34.288Z"
"lavonda.bsky.social","Good morning dear friends. ☀️🫶☕️","2025-09-02T11:08:44.579Z"
"lavonda.bsky.social","Platner: No one cares that you pretend to be remorseful as you sell out to lobbyists. Symbolic opposition does not reopen hospitals. Weak condemnations do not bring back Roe V Wade. Maine deserves better than Susan Collins.","2025-09-01T22:49:37.355Z"
"lavonda.bsky.social","Platner: I believe that input from working people is far more important than input from someone who simply has money. I believe that we shouldn’t be settling for crumbs while billionaires eat the cookie we baked.","2025-09-01T22:59:13.381Z"
"lavonda.bsky.social","If you're 60, 69.1% of all job growth since your birth occurred under Democratic administrations. If you're 45, that number is 74.7%. If you're under 28, the number is 100%. Happy Labor Day.","2025-09-01T14:57:40.092Z"
"lavonda.bsky.social","WWII ended 80 years ago today, as Japan surrendered on the USS Missouri in Tokyo Bay.","2025-09-02T10:22:18.003Z"
"lavonda.bsky.social","AMEN!!!!!!!!!!!!!","2025-09-01T21:34:31.766Z"
"lavonda.bsky.social","SSA Chief Data Officer resigns, indicating all SS data has been leaked. I would highly suggest everyone “lock” their credit accounts at the three major credit rating agencies to prevent identity theft. The Russian Mafia most likely already has those files. apple.news/AeeBlBCnhQNG...","2025-08-30T21:48:03.553Z"
"lavonda.bsky.social","Good morning and happy Labor Day. ☀️🫶☕️","2025-09-01T11:33:42.731Z"
"lavonda.bsky.social","💯%. I've come to accept how morally depraved Donald Trump is. But I'll never get over how blindingly imbecilic he is. www.huffpost.com/entry/trump-...","2025-08-31T23:43:15.430Z"
"lavonda.bsky.social","Feds accuse Virginia youth pastor of trading explicit pics with teen between calls with his wife www.independent.co.uk/news/world/a...","2025-08-31T20:25:45.613Z"
"lavonda.bsky.social","But did the black paint make it too hot? (Obviously not.) The US border wall is a sad joke. Paid for ($millions) by US taxpayers. Fleeced again.","2025-08-31T00:40:35.433Z"
"lavonda.bsky.social","Jill Stein and Cornel West both disgust me — such goddamn, self-serving hypocrites.","2025-08-31T13:18:20.164Z"
"lavonda.bsky.social","On day 2, the Supreme Court justices who ruled against the Constitution and the best intrests of the American people need to be cleared out and new ethics rules need to be developed for that entity.","2025-08-30T15:18:38.906Z"
"lavonda.bsky.social","I'll take that for now.","2025-08-31T17:41:06.543Z"
"lavonda.bsky.social","He won’t let the press anywhere near him. This is getting weirder and weirder.","2025-08-31T15:32:36.363Z"
"lavonda.bsky.social","Pritzker: """"No one in the administration -- the president or anybody under him -- has called anyone in my administration or me. It's clear that in secret they're are planning this invasion with US troops.""""","2025-08-31T14:51:41.603Z"
"lavonda.bsky.social","bsky.app/profile/ohth... Game over!","2025-08-30T17:22:00.323Z"
"lavonda.bsky.social","He wasn’t shot. He didn’t win. He raped children. He’s all over the Epstein files .","2025-08-30T20:21:11.145Z"
"lavonda.bsky.social","Chump Will Deceive You( LIE ! ) About Immigrants, but Why Hasn't ICE Arrested any Companies or Corporations that are Breaking The Laws.......The Grift continues !","2025-08-31T09:03:08.357Z"
"lavonda.bsky.social","Good Sunday morning, my friends. ☀️🫶☕️","2025-08-31T13:24:14.897Z"
"lavonda.bsky.social","Why do you appreciate unions? I’ll start: Weekends off Paid vacations Work breaks Sick leave Paid holidays No child labor Safer working conditions Health care and retirement benefits","2025-08-31T00:00:10.465194Z"
"lavonda.bsky.social","youtu.be/EdWCDTnKEfs?...","2025-08-30T23:46:21.952Z"
"lavonda.bsky.social","“ILLEGALS” MY ASS! Green card holder Rami Othmane speaks out after being snatched off the street by ICE while driving to the grocery store. He’s a documented immigrant and the husband of Dr Wafaa Alrashid, chief of staff at a local hospital. He was locked in detention for 13 days.","2025-08-30T20:50:58.374Z"
"lavonda.bsky.social","Something to think about when Democrats are forced to gerrymander on California and New York when the Republican force them to do it.","2025-08-07T18:26:25.669Z"
"lavonda.bsky.social","Two children were killed and seventeen people were injured in a shooting at Annunciation Catholic School. A Cracker Barrel logo change received far more scrutiny and attention than any fight against the epidemic of gun violence in this country. Our priorities remain idiotic.","2025-08-27T16:42:20.692Z"
"lavonda.bsky.social","US Health Secretary Kennedy Ignored & Sidelined CDC Experts, Officials Claim in Resignation Letters Multiple claims of CDC data manipulation, eugenics rhetoric, & misinformation. ✍️ @kerrycullinan.bsky.social @seckennedy.govpeeps.us @hhsgov.govmirrors.com @childrenshealthdefense.org.web.brid.gy","2025-08-29T11:45:40.770Z"
"lavonda.bsky.social","@nealkatyal.bsky.social: “You’ve got the president who's imposed the largest tax increase on American consumers since 1993 … and he did it without Congress saying one word. That is not our constitutional structure.”","2025-08-30T16:31:15.248Z"
"lavonda.bsky.social","DOGE wasn’t a cost-cutting venture. It was a data mining operation for private interests. Trump opened the gates to the castle from inside for invaders with bad and greedy intent to plunder and exploit.","2025-08-30T10:24:22.738Z"
"lavonda.bsky.social","Impeach RFK Jr. for dereliction of duty- this will fall under the category of high crimes and misdemeanors. The man is totally UNFIT to make health care policy for our nation and poses a grave danger.","2025-08-29T18:49:50.189Z"
"lavonda.bsky.social","youtu.be/3a0sXbxL16M?... I'm posting again to advertise our next protest day September 1st! It's also almost at 200 views!","2025-08-19T04:19:43.106Z"
"lavonda.bsky.social","What do your think! 🤔","2025-08-29T18:17:36.346Z"
"lavonda.bsky.social","Thanks to America’s ever shifting trade policies and Trump, LEGO has stopped shipping more than 2,500 pieces from its Pick a Brick program to both the United States and Canada. 🔗 www.404media.co/lego-stops-s...","2025-08-29T20:53:19.286Z"
"lavonda.bsky.social","Good morning friends. ☀️🫶☕️","2025-08-30T11:41:25.233Z"
"lavonda.bsky.social","The warfighters in DC got the trash picked up, now time to mulch.","2025-08-30T10:59:33.485Z"
"lavonda.bsky.social","The damage this man has done is incalculable.","2025-08-29T21:06:24.205Z"
"lavonda.bsky.social","there is no question in my mind that rfk jr is the most dangerous person in this administration and that his eugenicist ideology threatens the lives of millions of people www.advocate.com/politics/dem...","2025-08-29T20:53:28.166Z"
"lavonda.bsky.social","I wholeheartedly agree with this!","2025-08-29T11:53:25.214Z"
"lavonda.bsky.social","Evil Nazi fcks","2025-08-29T19:40:10.176Z"
"lavonda.bsky.social","Mike Johnson dismisses the unpopularity of the Big Beautiful Bill: """"The individual provisions of that giant piece of legislation are wildly popular."""" CNN host John Berman immediately debunks that claim.","2025-08-29T14:36:40.949Z"
"lavonda.bsky.social","I wonder why Bill Pulte didn’t send this case over to DOJ with a criminal referral along with his selective targeting of Adam Schiff and Lisa Cook? apnews.com/article/paxt...","2025-08-29T14:29:57.111Z"
"lavonda.bsky.social","Prose to my ears. Beautifully written. My sentiments as well 💙","2025-08-28T21:41:10.833Z"
"lavonda.bsky.social","No notes","2025-08-29T14:14:40.016Z"
"lavonda.bsky.social","Mike Johnson makes clear that when Congress returns next week he's going to work tirelessly to cover up the Epstein files","2025-08-29T14:38:34.615Z"
"lavonda.bsky.social","We believe this to be True of Mr. Sanders supporters.......","2025-08-29T08:53:22.082Z"
"lavonda.bsky.social","Welch: Everybody's missing the point here. The point is, he's doing this on purpose. He's priming the public to get accustomed to having the military in the streets","2025-08-29T02:22:41.914Z"
"lavonda.bsky.social","“I’ve had the privilege of meeting many foreign leaders,” Newsom said at Politico’s The California Agenda: Sacramento Summit on Wednesday. “They’re laughing behind his back. ... He’s being played everywhere. It’s an embarrassment.”","2025-08-29T00:31:18.373Z"
"lavonda.bsky.social","Good morning friends. ☀️🫶☕️","2025-08-29T12:26:26.530Z"
"lavonda.bsky.social","Newsom: Perhaps the president could deploy the National Guard in every corner of Mississippi. Murder rate is out of control there. And the governor may want to make that phone call.","2025-08-28T18:12:53.275Z"
"lavonda.bsky.social","Newsom: This cannot be normalized. And yes so I'm highlighting some just just blatant hypocrisy. Yes, we are putting a mirror up to the lunacy that is trump's tweets and his grift.","2025-08-28T18:14:24.110Z"
"lavonda.bsky.social","AMERICA: “It’s a mental health issue.” REST OF THE WORLD: “We have those. But don’t have mass shootings.” AMERICA: “It’s video games.” WORLD: “We have those too. But don’t have mass shootings.” AMERICA B: “It’s cause they took Jesus out of the classroom.” WORLD: “God, you’re stupid.”","2025-08-27T19:41:11.867Z"
"lavonda.bsky.social","Psaki: I felt a mixture of anger—a lot of anger—and emotional exhaustion about this today, as I’m sure many of you have, because we have been here so many times. And yet again, like clockwork, half the politicians in our country have little more to offer than thoughts and prayers.","2025-08-28T01:19:41.003Z"
"lavonda.bsky.social","A Story: The Whole World is watching the US while it is being plundered downhill by a madman. She is no longer great. Her greatness was with Biden and Obama and now... it will lie in ruins, worst than any third country. I am not betting man but I wouldn't bet on US if my life depended on it!","2025-08-27T23:31:31.894Z"
"lavonda.bsky.social","Frey: I think the impetus has to be on all of us to recognize that we've got more guns in this country than we have people, and it's on all of us to recognize the truth and the reality that we can't just say that this shouldn't happen again, and then allow it to happen again and again","2025-08-27T19:59:59.612Z"
"lavonda.bsky.social","I have never seen Nazism spread so fast but it has in America. DJT is responsible for this. Elon Musk gave two perfect Nazi Salutes back in Feb 2025 & now here we are on Aug 27th. Fascism or Nazism is running rampant in America & ya let it happen. You did nothing but complain but didn't stop it.","2025-08-27T13:49:06.523Z"
"lavonda.bsky.social","“A double-tap strike… Israel has killed more journalists in Gaza than all journalists killed in wars since World War 2 combined…” @chrislhayes @krystalmball @esaagar @aymanm cover the horrific Nasser hospital strikes, where rescue workers were targeted. Not a “mishap”.","2025-08-27T18:34:40.151Z"
"lavonda.bsky.social","Netanyahu is practicing genocide and USA sanctions it. Despicable.","2025-08-27T18:40:29.046Z"
"lavonda.bsky.social","Shuler: And when you ask the most vulnerable workers in this country—those workers still have faith in one single thing. Seventy-five percent of them say they believe in unions.","2025-08-27T15:45:59.628Z"
"lavonda.bsky.social","Frey: And don't just say, this is about thoughts and prayers right now. These kids were literally praying. It was the first week of school. They were in a church.","2025-08-27T15:59:49.836Z"
"lavonda.bsky.social","Good morning all. ☀️🫶☕️","2025-08-27T13:33:53.263Z"
"lavonda.bsky.social","💯 This‼️ 👇🏼","2025-08-25T18:55:54.250Z"
"lavonda.bsky.social","Did you know? that child rapist convicted felon #47 created more MAGA monsters since starting his so-called 2nd term??? He is spreading this Nazi Cancer all over the place! Whoever joins him, gave up their very soul to his royal shitty highness. Once you give up your soul, you go straight to hell.","2025-08-27T00:56:03.664Z"
"lavonda.bsky.social","National Guard is now tasked with picking up garbage in DC","2025-08-26T22:22:56.505Z"
"lavonda.bsky.social","Krasner: So, if what you have is a group of ICE agents, or even the military, coming into Philadelphia and committing crimes—assaults that are illegal, kidnapping, unlawful restraint, obstruction of the administration of justice—they can be prosecuted.","2025-08-26T23:43:28.140Z"
