"user","post","date"
"moskosh.bsky.social","THE LAME-BRAIN MEDIA.......","2026-02-14T10:52:17.057Z"
"moskosh.bsky.social","Walk for Peace 🕊 Those of you who are fortunate to have @kim.senate.gov SENATOR ANDY KIM, D-NJ....YOUR great Senator met the Buddhist Monks today near Capitol Hill & the Lincoln Memorial I will respect Senator Kim forever..You remember on January 6th, HE cleaned the floors after insurrection","2026-02-11T22:50:56.056Z"
"moskosh.bsky.social","Bad Bunny has a foundation called Good Bunny that distributes musical instruments, art supplies and sports equipment and funds programs to help children improve their lives. If you were looking for leadership you found it. God bless that dude.🙏","2026-02-10T14:11:04.011Z"
"moskosh.bsky.social","“The only thing more powerful than hate is love…. Together we are America!🇺🇸” —Bad Bunny","2026-02-09T02:17:59.847Z"
"moskosh.bsky.social","The funny thing about that show? Not a word of it was in English, but it was one of the more patriotic halftime shows I’ve seen. “The only thing more powerful than hate is love” “Together, we are America”","2026-02-09T02:18:02.396Z"
"moskosh.bsky.social","🎯🎯","2026-02-09T02:32:35.515Z"
"moskosh.bsky.social","These ladies were great sports! So enjoyed meeting them! #antiquesroadshow @roadshowpbs.bsky.social","2026-02-03T01:45:22.570Z"
"moskosh.bsky.social","John Quiñones 5 year old, Liam Conejo Ramos and his father, Adrian were released from DHS detention in Texas today. I flew with them on their way home to Minneapolis this morning. Watch my exclusive reports - and my interviews with them - today on all our @abcnews broadcasts and @abcnewslive","2026-02-01T19:17:54.538Z"
"moskosh.bsky.social","I won’t stop reporting the truth. The First Amendment is the bedrock of our democracy, and I’ll continue to fight to protect it 🤝🏾🇺🇸","2026-01-31T04:40:13.080Z"
"moskosh.bsky.social","Between seizing ballots in Georgia, trying to leverage Minnesota to turn over its sensitive voter data, and political prosecutions, the DOJ is laying the groundwork to subvert the 2026 elections. I created Democracy Docket for times like this. Help it grow by supporting it now. hubs.ly/Q03M8rql0","2026-01-31T02:19:11.175Z"
"moskosh.bsky.social","""""That's got to be his calling card."""" Wednesday in Houston, Steph Castle was asked to guard a pair of All-Stars half a foot taller when it mattered most. Castle's defense against KD and Sengun turned the game. His coach believes there is more to unlock: www.expressnews.com/sports/spurs...","2026-01-29T22:18:57.447Z"
"moskosh.bsky.social","i was already a Wemby fan and I'm even more of one now. People need to speak out about how fucked this is.","2026-01-27T20:21:55.359Z"
"moskosh.bsky.social","This is the BEST explanation I have seen so far.","2026-01-28T03:12:13.207Z"
"moskosh.bsky.social","The greatest danger to American freedom is a government that ignores the Constitution. - Thomas Jefferson","2026-01-27T16:09:45.701Z"
"moskosh.bsky.social","People seem to have forgotten that the establishment of Homeland Security was highly controversial as it was seen as a danger to democracy. It was feared that it would one day be used AGAINST the American people. And here we are. Tin soldiers and HOMELAND coming We’re finally on our own","2026-01-26T23:16:41.053Z"
"moskosh.bsky.social","Congratulations to Russia and China. You did it! 👏🏻 👏🏻 👏🏻 👏🏻 👏🏻 USA will never be looked at as a trusted partner and ally in the world ever again, by any sane or decent country. You spent years propping up the idiot occupying the Whitehouse, and it is working.","2026-01-23T14:44:25.726Z"
"moskosh.bsky.social","A Minneapolis FBI supervisor was pressured to not investigate Renee Good’s killing, now she’s resigned: F.B.I. Agent Who Tried to Investigate ICE Officer in Shooting Resigns www.nytimes.com/2026/01/23/u...","2026-01-24T01:19:45.189Z"
"moskosh.bsky.social","Tennessee 3 State Representative Justin Jones tells propagandist Sean Hannity live on his trashy Fox program that he keeps people fearful on purpose because he’s paid many millions of dollars a year to keep people fearful so they don’t pay attention. He’s absolutely right.","2026-01-21T04:46:03.083Z"
"moskosh.bsky.social","The rim at the Toyota Center is broken before the Spurs and Rockets starting taking threes, eh?","2026-01-21T01:13:54.151Z"
"moskosh.bsky.social","In a nail-biter, Victor Wembanyama is named an NBA All-Star starter. He is the first Spurs player to gain that distinction since Kawhi Leonard in 2017. www.expressnews.com/sports/spurs... via @expressnews www.expressnews.com/sports/spurs...","2026-01-19T19:21:36.082Z"
"moskosh.bsky.social","👇👇👇👇","2026-01-19T15:49:35.962Z"
"moskosh.bsky.social","The felon47 wants it to get things bloody by the ice starting it so he can instate the Marshall Law Act,so their won't be any voting.he doesn't care about people only his hide and money.","2026-01-19T14:11:23.622Z"
"moskosh.bsky.social","Isiah Thomas. Pau Gasol. Tony Parker. Dirk Nowitzki. Steve Nash. NBA LEGENDS IN LONDON 🙌","2026-01-18T18:14:14.011Z"
"moskosh.bsky.social","JONATHAN ROSS-JONATHAN ROSS-JONATHAN ROSS- JONATHAN ROSS-JONATHAN ROSS-JONATHAN ROSS- JONATHAN ROSS-JONATHAN ROSS-JONATHAN ROSS-JONATHAN ROSS-JONATHAN ROSS-JONATHAN ROSS-JONATHAN ROSS-JONATHAN ROSS-JONATHAN ROSS-JONATHAN ROSS-JONATHAN ROSS-JONATHAN ROSS. #Justice4ReneeNicoleGood ⚖️","2026-01-18T20:17:48.757Z"
"moskosh.bsky.social","I think it’s basically time to retire the peace prize because it really is meaningless at this point. Another 100+ year-old tradition cheapened, wrecked, and discredited by the gauche garish gangster.","2026-01-16T02:51:12.991Z"
"moskosh.bsky.social","The insurrection act was always the end goal - I’ve been talking about this for months. He’s been trying to find a city that would push back enough to give him a (flimsy) excuse to do it","2026-01-15T14:05:24.709Z"
"moskosh.bsky.social","A felon who married an immigrant is telling a lot of y’all that the problems in this country all stem from felons and immigrants. But keep buying that stupid red hat that’s made in China.","2026-01-12T14:17:54.192Z"
"moskosh.bsky.social","Very funny that the guy who turned the east wing of the White House into a pile of rubble one Friday is criminally investigating the federal reserve chairman about a building renovation","2026-01-12T02:45:15.439Z"
"moskosh.bsky.social","Powell, showing more guts than almost any GOP legislators: """"The threat of criminal charges is a consequence of the Fed setting interest rates based on our best assessment of what will serve the public, rather than following the preferences of the President."""" www.federalreserve.gov/newsevents/s...","2026-01-12T01:40:13.691Z"
"moskosh.bsky.social","This is precisely how you should respond to a bullshit investigation. “This new threat is not about my testimony last June, or the renovation of the Federal Reserve Buildings… this is a consequence of not following the preference of the President”","2026-01-12T01:28:01.406Z"
"moskosh.bsky.social","I think what he is really serious about is ginning up an excuse to tamper with the 2026 elections by putting NG or ICE in blue state polling atations. (Or worse)","2026-01-09T02:03:54.722Z"
"moskosh.bsky.social","ICE agents are masked...because they know they are committing crimes.","2026-01-09T00:17:54.291Z"
"moskosh.bsky.social","Wow","2026-01-08T02:51:37.301Z"
"moskosh.bsky.social","Yeesh I hate being repetitive, and yet... It's time once again to remind my fellow Americans that there is no mechanism whereby state run elections can be suspended or canceled by the federal government. None. So don't go along with any garbage you hear to that effect. Laugh, and get ready to vote.","2026-01-07T11:17:01.535Z"
"moskosh.bsky.social","This👇","2026-01-07T02:49:04.221Z"
"moskosh.bsky.social","💯","2026-01-06T03:08:09.546Z"
"moskosh.bsky.social","All Americans, and the entire world, must remember. Robert Reich: The most shameful day in American history open.substack.com/pub/robertre...","2026-01-05T17:01:07.838Z"
"moskosh.bsky.social","Beneath every gutter lies a sewer, which seems to be the ideal final destination for some.","2026-01-06T05:39:15.039Z"
"moskosh.bsky.social","Seems like every new Epstein files event results in the US bombing or invading someone.","2026-01-06T03:08:43.853Z"
"moskosh.bsky.social","Notable firings so far: Raheem Morris (Falcons) Jonathan Gannon (Cardinals) Kevin Stefanski (Browns) Pete Carroll (Raiders) Nicolas Maduro (Oilers)","2026-01-05T20:42:00.776Z"
"moskosh.bsky.social","""""Government by organized money is just as dangerous as Government by organized mob."""" —FDR, 1936","2026-01-05T23:00:08.867167Z"
"moskosh.bsky.social","here's today's post: """"here’s what it looks like when a mob boss takes over your country"""" — ‘fuck you, pay me.’ thanks for reading, and please sign up for my daily newsletter to keep getting the good stuff —","2026-01-05T15:40:02.856Z"
"moskosh.bsky.social","#Vote","2026-01-04T21:57:58.718Z"
"moskosh.bsky.social","""""America is an oil company with an army."""" —George Carlin","2026-01-04T19:21:23.153Z"
"moskosh.bsky.social","It's an old and obvious pattern. An unpopular president - failing on the economy and losing his grip on power at home - decides to launch a war for regime change abroad. The American people don’t want to “run” a foreign country while our leaders fail to improve life in this one.","2026-01-03T17:08:38.724Z"
"moskosh.bsky.social","Cartoon by @mluckovich.bsky.social.","2026-01-04T12:29:11.033Z"
"moskosh.bsky.social","Champagnie has made nine 3-pointers, which ties Chuck Person's franchise single-game record","2026-01-01T02:31:43.755Z"
"moskosh.bsky.social","In just one part of Greenland, there is an estimated 31.4 billion barrels of untapped oil, gas, and natural gas liquids. Venezuela has the one of the world’s largest oil reserves. Canada has 171 billion barrels of proven oil reserves. Get it now? #cdnpoli","2025-12-23T10:05:38.272Z"
"moskosh.bsky.social","Indiana failed to pass their map to help the GOP cheat, and another grand jury refused to indict Letitia James. Womp womp.","2025-12-11T21:47:07.527Z"
"moskosh.bsky.social","“…Even if they are able to clean up his mess … elect a supremely sane president next, America will NEVER again be a trusted partner. Because there are enough Americans who would vote for him … (again). I couldn't even say anything. She was right. The damage this has done is endless…”","2025-12-07T16:15:11.284Z"
"moskosh.bsky.social","Current US Policy: If you’re suspected of trafficking a small amount of drugs with no evidence, we will murder you, but if you’re convicted of trafficking an enormous amount of drugs with copious evidence, we will pardon you. Because we are currently a very stupid country.","2025-12-03T17:50:11.437Z"
"moskosh.bsky.social","“Whether you play basketball or work at a 9-to-5, there’s days where you get up and you’re like, ‘I don’t want to do this today.’ But it’s my job.” On Harrison Barnes, Julian Champagnie and a pair of Spurs iron man streaks that keep streaking: www.expressnews.com/sports/spurs... via @expressnews","2025-11-25T18:09:41.168Z"
"moskosh.bsky.social","""""You’ve got to be ready for any opportunity you get."""" Had the Spurs' backcourt been at full strength Thursday, David Jones Garcia would have been playing in a G League game in Cedar Park. Instead he was in San Antonio, helping the Spurs take down the Hawks. www.expressnews.com/sports/spurs...","2025-11-21T05:44:40.746Z"
"moskosh.bsky.social","""""Let me be clear: The president has both the funding and the authority to fund SNAP during a shutdown. In fact, every other president in every other shutdown has done so. People going hungry in this instance is a choice that this president has made.” Gov. Andy Beshear","2025-11-06T04:38:46.682Z"
"moskosh.bsky.social","Is there any large company standing with We, The People and our democracy? Yes. I give you, HEB of Texas. 👇 Bravo! #Voices4Victory #DemVoice1 #Pinks #wtpBLUE","2025-10-30T20:17:29.063Z"
"moskosh.bsky.social","How the Louvre heist went down...💎😹","2025-10-23T14:25:37.265Z"
"moskosh.bsky.social","Hey, you idiotic propagandists at the New York Post: God Bless America isn't the national anthem. It's a SHOW TUNE written by Irving Berlin.","2025-10-11T20:31:52.252Z"
"moskosh.bsky.social","I understand this. Please tell me you do, too.","2025-10-05T18:30:18.787Z"
"moskosh.bsky.social","Rest in Peace Jane Goodall.","2025-10-02T00:32:31.720Z"
"moskosh.bsky.social","😢😭 Thank you for sharing your compassion and kindness and knowledge. The world is better because of it.","2025-10-01T18:20:46.966Z"
"moskosh.bsky.social","This investigation is a disaster. We are about to have a briefing to tell us nothing of consequence but there is a real chance they spill information you don't want to release to the public. Example, they told everyone including the shooter they had his footprint so those shoes are now GONE.","2025-09-12T01:51:04.573Z"
"moskosh.bsky.social","@msnbc.com Unfollowed. I stand with Matthew Dowd","2025-09-12T02:15:07.631Z"
"moskosh.bsky.social","#MotherNatureSong #MusicChallenge Day 8 Eva Cassidy - Autumn Leaves youtu.be/xXBNlApwh0c?...","2025-09-08T18:37:43.287Z"
"moskosh.bsky.social","Well said.","2025-09-07T23:26:06.605Z"
"moskosh.bsky.social","We’ll wait…🤔","2025-08-28T02:52:54.860Z"
"moskosh.bsky.social","Neil deGrass Tyson: """"How sad it must be believing that scientists, historians, scholars, economists, journalists devoted their entire lives to deceiving you, but a reality-TV star proven in court to be a lying felon is your beacon of truth & honesty""""","2025-08-23T16:26:03.535Z"
"moskosh.bsky.social","The president of the United States is trying to steal congressional seats so I don’t give a fuck about the Cracker Barrel logo discussion. Good night and have a pleasant tomorrow.","2025-08-22T02:17:56.739Z"
"moskosh.bsky.social","Monday Friends #1 @raykwong.bsky.social @mersyme.bsky.social @smith83k.bsky.social @stephen5150.bsky.social @dcombes.bsky.social @jen-notjenny.bsky.social @goodplacejames.bsky.social @scottbluewave.bsky.social @tntnle.bsky.social @adoboblue.bsky.social @thecaffeinator.bsky.social","2025-08-04T14:54:19.468Z"
"moskosh.bsky.social","Thank goodness for the American Medical Association. Here is their YouTube page. Please share this far & wide. MISINFORMATION at CDC is spreading throughout our country & most people have no clue. Please stay updated & bookmark this page for your health & well-being.➡️ www.youtube.com/@americanmed...","2025-08-04T19:36:27.558Z"
"moskosh.bsky.social","We need to make it illegal for AI models to offer advertising. And, we need to really examine referral fees as well. The last thing we need is to have algorithms designed to maximize revenue driving LLM output and interactions. We need to have learned our lessons from algos in social media","2025-07-26T20:29:48.100Z"
"moskosh.bsky.social","We’re #1!!!","2025-06-21T13:20:00.437Z"
"moskosh.bsky.social","Mumble, mumble, gubment overreach, mumble, mumble...","2025-07-06T04:40:14.988Z"
"moskosh.bsky.social","Putin couldn’t have dreamed up a better outcome, alienate our allies, gut federal institutions, fire qualified generals, wreck national security with drunk incompetent fools at the top, tank the economy and $ with tariff wars… all in just 4 months. And here we are. Coincidence?","2025-05-25T22:15:18.533Z"
"moskosh.bsky.social","I think it’s actually worse when Jack did it because we weren’t privy to the meaning. Made it extra demonic and evil. We should suspend habeas corpus and send him to El Salvador without telling his family","2025-05-17T01:36:56.094Z"
"moskosh.bsky.social","Fam, it's happening: -Pope Leo XIV (aka Cardinal Robert Francis Prevost) has roots in the 7th ward in New Orleans! -His mom had Creole roots. -""""Now we know why her cooking was so good — both her mother and father were from New Orleans,"""" Honora said. www.nola.com/news/first-a...","2025-05-08T20:34:15.378Z"
"moskosh.bsky.social","Why are we saying Pope Leo XIV is first American pope? Is he not the first North American pope? Pope Francis was the first American pope inasmuch as he was from South America.","2025-05-08T20:57:15.226Z"
"moskosh.bsky.social","Big loss in court for Kari Lake Judge Royce Lamberth orders administration to restore millions of $$ in funds to Radio Free Europe Judge: """"When money has been appropriated by Congress.. Executive has no residual constitutional power to refuse to spend these appropriations""""","2025-04-29T21:54:16.661Z"
"moskosh.bsky.social","👏👏","2025-04-25T00:43:03.176Z"
"moskosh.bsky.social","This is the kind of shit I want to see from every single Democrat","2025-04-18T01:44:42.764Z"
"moskosh.bsky.social","He’s alive","2025-04-18T02:45:02.993Z"
"moskosh.bsky.social","@golden.house.gov The SAVE ACT will disenfranchise tens of millions of registered and eligible voters. To say otherwise is fraudulent.","2025-04-11T03:40:34.384Z"
"moskosh.bsky.social","He did it because those tux-wearing bastards never once said """"thank you.""""","2025-04-06T20:50:31.922Z"
"moskosh.bsky.social","I think there is going to be a Red Rural Recession and soon if all the cuts continue as is All the firings, cancelling of grants and contracts with companies , the closing of offices, disproportionately impact small towns, cities and states. Their finances will be turned upside","2025-03-28T03:14:02.462Z"
"moskosh.bsky.social","Gotta love the French! 😎❤️✨","2025-04-02T07:52:58.449Z"
"moskosh.bsky.social","Woohooo!! 🥳 #MomSky","2025-04-02T01:57:55.397Z"
"moskosh.bsky.social","ABC News: """"An unthinkable breach of national security."""" CBS News: """"An unthinkable breach of national security."""" MSNBC: """"An unthinkable breach of national security."""" CNN: """"An unthinkable breach of national security."""" Fox News: """"We've all texted the wrong person before.""""","2025-03-26T22:02:57.821Z"
"moskosh.bsky.social","99.4% of new drugs approved by the FDA are the product of NIH funded research. Remember this every time you see another headline on the NIH funding cuts. It will directly impact YOU. #ScienceNOTSilence","2025-03-23T22:36:39.145Z"
"moskosh.bsky.social","And remind them to vote out their republican representatives that won’t vote against this attack on benefits","2025-03-19T17:40:10.951Z"
"moskosh.bsky.social","How, just how?","2025-03-19T04:01:54.544Z"
"moskosh.bsky.social","He's past the point of trying. He's succeeding.","2025-03-13T21:20:44.666Z"
"moskosh.bsky.social","Most of us Canadians are fighting harder for democracy in the United States than some democrats in the Senate.","2025-03-15T00:48:13.759Z"
"moskosh.bsky.social","Yet another plane crash today in PA. I blame the orange felon firing FAA leadership, firing FAA employees including air traffic controllers and dismantling an air safety committee.","2025-03-10T04:24:37.280Z"
"moskosh.bsky.social","""""Only fools or kremlin tools"""" is a nice little rhyme that benefits from being the truth.","2025-03-10T11:03:26.876Z"
"moskosh.bsky.social","Translation: “I want a dynamic country that funnels your tax dollars to my rich friends.”","2025-03-10T15:04:09.055Z"
"moskosh.bsky.social","The coolest thing I’ve seen today is that a bunch of volunteer public health professionals and developers have restored the CDC website from before January 20th 2025. This differs from an archive in that they want to rebuild the links between pages and replicate the full website.","2025-03-09T13:11:22.723Z"
"moskosh.bsky.social","THIS IS HUGE! Researchers at Stanford University have developed a dual-antibody treatment that remains effective against ALL SARS-CoV-2 variants by targeting a less-mutable part of the virus. This breakthrough could lead to longer-lasting therapies that OUTPACE viral evolution. 🧪🧵⬇️","2025-03-09T16:00:18.427Z"
"moskosh.bsky.social","Keep in mind that RFK receives millions of dollars from a law firm that sues over vaccines.","2025-03-09T21:32:43.377Z"
"moskosh.bsky.social","Literally said one day one","2025-03-09T01:53:24.305Z"
"moskosh.bsky.social","Former 🇺🇸 ambassador to Russia 👇🏽","2025-03-04T12:40:10.616Z"
"moskosh.bsky.social","This administration seems to be deliberately creating chaos across multiple sectors, sparking nationwide unrest. The endgame? Civil disorder reaching a breaking point, justifying the imposition of martial law. This isn’t accidental—it’s strategic.","2025-03-07T21:47:26.165Z"
"moskosh.bsky.social","can't believe it's 2025 and i'm stressed about tariffs and measles, like am i a character in an american girl book","2025-03-03T21:09:03.946Z"
"moskosh.bsky.social","Slava Ukraini! #IStandWithUkraine✨️ Repost if you do too!! I should see 70k reposts!!","2025-03-02T19:30:01.504Z"
"moskosh.bsky.social","Seems like a pretty important detail","2025-03-01T20:09:34.798Z"
"moskosh.bsky.social","Yep, this is just another grudge.","2025-03-01T20:41:14.394Z"
"moskosh.bsky.social","#TrumpIsANationalDisgrace #TrumpIsATraitorAndACriminal","2025-02-28T22:59:52.878Z"
"moskosh.bsky.social","I’m trying to figure out why anyone would expect any more from Rubio. He’s handpicked to be another asshole.","2025-03-01T00:16:02.423Z"
"moskosh.bsky.social","America remember the shame of this day. Years from now when the memory of men like Krasnov, Musk, Vance and Rubio has been scrubbed and forgotten from history, Zelensky's legacy will burn bright and eternal for Ukraine, Europe, and the free world.","2025-02-28T22:35:53.934Z"
"moskosh.bsky.social","Let's be very clear. The Constitution says that presidents are limited to being elected twice. Anyone who says otherwise needs to read the 22nd Amendment.","2025-02-22T13:31:37.122Z"
"moskosh.bsky.social","The measles outbreak in rural West Texas has grown to 90 cases across seven counties, the state health department posted online Friday, and 16 people are hospitalized.","2025-02-21T18:39:13.042Z"
"moskosh.bsky.social","MAGA is making a mockery of the United States","2025-02-22T01:34:37.083Z"
"moskosh.bsky.social","It always bears repeating that private shipping companies like UPS, FedEx, and Amazon use the USPS to ship to remote rural areas because they don’t think it’s worth it to do it themselves so it is always a dumb idea to privatize public good.","2025-02-21T19:25:26.241Z"
"moskosh.bsky.social","Meanwhile in Texas 👇","2025-02-21T18:55:24.935Z"
"moskosh.bsky.social","Michael McFaul is an American academic & diplomat who served as the US ambassador to Russia from 2012 to 2014. We need his voice right now on BlueSky, but his account is barely off the ground. Can we all please do what we can to boost his followers so he spends time HERE?! @mcfaulmike.bsky.social","2025-02-19T21:50:20.931Z"
"moskosh.bsky.social","🚨 BREAKING: President Biden released the following statement on the release of American hostage Sagui Dekel-Chen:","2025-02-15T17:39:12.010Z"
"moskosh.bsky.social","This is so smart. @petebuttigieg.bsky.social , thoughts ? And if you see this. A reminder. This is not Twitter. You can engage here and have thoughtful discussions ! We all look forward to reading your thoughts","2025-02-14T18:15:04.254Z"
"moskosh.bsky.social","One year ago, we launched the Cost Plus Marketplace to help healthcare businesses access affordable medications. Today, we proudly supply thousands of hospitals, clinics, long-term care facilities, surgery centers, and retail pharmacies. ➡️ Sign up today: business.costplusdrugs.com","2025-02-11T20:16:41.033Z"
"moskosh.bsky.social","REPOST if you support our federal workforce and know how dedicated they are to their jobs. Show them you appreciate them!","2025-02-14T01:15:56.806Z"
"moskosh.bsky.social","“Dumbest Goddamn Student Ever” Ends Department of Education","2025-02-12T21:56:34.479Z"
"moskosh.bsky.social","I’m irrationally delighted by this.","2025-02-13T03:53:27.831Z"
"moskosh.bsky.social","Thank goodness for the American Medical Association. Here is their YouTube page. Please share far and wide. Right now bird flu is spreading throughout our country and most people have no clue. Please stay updated and bookmark this page for your health and well-being. www.youtube.com/@americanmed...","2025-02-12T20:45:18.897Z"
"moskosh.bsky.social","@snpkh.bsky.social","2025-02-11T23:55:32.218Z"
"moskosh.bsky.social","Is there anyone out there that is mapping any delayed or cancelled federal payments ? Would be really interesting to see which towns and cities are going to be hit","2025-02-10T23:52:02.953Z"
"moskosh.bsky.social","Hi Bluesky! Glad to be here.","2025-02-10T14:23:28.872Z"
"moskosh.bsky.social","Texas evangelical megachurch youth pastor, Charles Goff, has been indicted for possessing videos & images of minor girls being sexually abused. www.bigcountryhomepage.com/crime/abilen...","2025-02-09T20:20:56.852Z"
"moskosh.bsky.social","Pete Buttigieg: “Even the greatest country, if it loses the rule of law, will not have much left.” REPOST if you stand with Pete Buttigieg!","2025-02-09T21:49:15.561Z"
"moskosh.bsky.social","American Medical Association is providing regular updates on bird flu and other infectious diseases on YouTube. I highly recommend subscribing to their page, especially since CDC has been axed by FOTUS #Voices4Victory m.youtube.com/user/AmerMed...","2025-02-09T20:31:31.450Z"
