"user","post","date"
"moskosh.bsky.social","This is the most relevant article to NIH and research cuts I’ve seen. Imagine if this was today , how many people would be saying “Why are we studying Gila Monsters and their impact on diabetes ? That’s wasted money !” globalnews.ca/news/9793403...","2025-02-09T21:58:10.718Z"
"moskosh.bsky.social","Measles outbreak escalating among children in red state's least vaccinated counties #News&Politcs","2025-02-07T19:21:27.903Z"
"moskosh.bsky.social","Does Canada have a website comparable to our CDC (RIP) where we can get updates on medical issues.","2025-02-08T17:22:08.322Z"
"moskosh.bsky.social","TIME Magazine. Grandpa RICO won’t be happy.","2025-02-07T18:03:08.279Z"
"moskosh.bsky.social","The new cover of TIME.","2025-02-07T14:10:20.313Z"
"moskosh.bsky.social","This is also a valuable resource for sky users theblue.report","2025-02-06T02:47:36.390Z"
"moskosh.bsky.social","(h/t: @the.language.nerds)","2025-02-03T12:05:12.491Z"
"moskosh.bsky.social","@physiciandemocracy.medsky.social What?????? I was raised in Camp Hill, Alabama which is almost a non-existent town now. How did the virus get this name?","2025-02-01T19:36:49.887Z"
"moskosh.bsky.social","Can you say the same?! 🤚 Gobsmacked. To. My. Core. ✨","2025-01-31T07:46:30.680Z"
"moskosh.bsky.social","I live in New York City in the year 2025. The president is a convicted felon. The mayor of NYC is an indicted felon. The secretary of defense is a Fox News host. The secretary of transportation is a Fox News host. The very worst people in America are in charge of America.","2025-01-31T06:22:23.346Z"
"moskosh.bsky.social","Elon Musk pressured FAA Chief Michael Whitaker to resign bc Whitaker had proposed a $633k fine against SpaceX for failing to follow license regs for 2 launches in 2023. Musk, who is personally worth over $400B, got pissed for a fine, equalling just 0.00015825% of that wealth. Hope it was worth it...","2025-01-31T04:52:29.585Z"
"moskosh.bsky.social","The head of the FAA was fired because he held Elon Musk accountable for SpaceX safety omissions. Donald and Elon don't care about regular Americans dying in plane crashes, they only care about themselves getting richer.","2025-01-31T02:23:01.394Z"
"moskosh.bsky.social","“.. I leave you with this quote from former US Navy pilot Jack McCain, son of the late Senator John McCain:” (via @bloomberg.com)","2025-01-30T21:51:23.421Z"
"moskosh.bsky.social",".@maddow.msnbc.com Kash Patel was chief of staff for Chris Miller they DENIED the National Guard 14 times on January 6th. I logged all the 14 calls and out over where I was that day. Pelosi is NOT in the chain of command! www.youtube.com/watch?v=Fr3P...","2025-01-31T02:49:36.989Z"
"moskosh.bsky.social","Hey Jim- You were the best that @cnn.com had to offer & will be deeply missed! I look forward to the next chapter in your career & I'm not just saying that because of the killer Yoda impression you did when I was on your show.","2025-01-29T23:12:05.841Z"
"moskosh.bsky.social","Truth to power💥 Let's let him know and repost to fight this corrupt coup shitshow hellscape. #AmericanTerrorist","2025-01-28T18:07:48.659Z"
"moskosh.bsky.social","CNN's Jim Acosta signing off: """"I will not give in to the lies. I will not give into the fear. Post it on your social media so people can hear from you too."""" I will not give in to the lies. I will not give into the fear. Post it on your social media so people can hear from you too. Pass it on.","2025-01-28T16:23:13.559Z"
"moskosh.bsky.social","Some very helpful info here","2025-01-27T17:42:31.553Z"
"moskosh.bsky.social","here is a fact: undocumented immigrants paid more in federal taxes than Bezos and Musk combined.","2025-01-27T19:46:04.344Z"
"moskosh.bsky.social","Nuff Said!","2025-01-25T15:49:43.662Z"
"moskosh.bsky.social","You fire inspectors general if you don’t want them inspecting your abuses of power.","2025-01-25T16:25:19.757Z"
"moskosh.bsky.social","Happy Sunday, Sinners! Can y’all show me where in the Bible Jesus says to mass deport immigrants?","2025-01-26T13:51:46.872Z"
"moskosh.bsky.social","This is awesome. This is how to fight them, at every turn, with those who can stepping up. Thanks to The Skimm.","2025-01-25T03:33:52.073Z"
"moskosh.bsky.social","“Terrible things are happening outside. Poor helpless people are being dragged out of their homes. Families are torn apart. Men, women, and children are separated. Children come home from school to find that their parents have disappeared.” Diary of Anne Frank January 13, 1943","2025-01-24T20:08:13.825Z"
"moskosh.bsky.social","There’s no law and order in America anymore, it’s finished.","2025-01-24T15:28:34.758Z"
"moskosh.bsky.social","Never forget January 6th. Never forget January 6th. Never forget January 6th.","2025-01-23T12:59:09.444Z"
"moskosh.bsky.social","Never. Forget. January. 6th. ✨","2025-01-23T10:33:48.104Z"
"moskosh.bsky.social","As a christian and a human being I stand with Bishop Mariann Edgar Budde. She is speaking the vision and message of Jesus and the Gospels, and truth to power of showing mercy and love to all, and treating everyone with dignity. I hope all people of faith support her in this moment.","2025-01-22T14:23:58.813Z"
"moskosh.bsky.social","This guy won the popular vote. That’s why I say America deserves everything we get.","2025-01-22T14:23:13.783Z"
"moskosh.bsky.social","“Make good trouble.” ~ John Lewis","2025-01-22T19:37:11.756Z"
"moskosh.bsky.social","Yes, we can all speak up!","2025-01-22T12:32:30.164Z"
"moskosh.bsky.social","Thank you for speaking truth to power through love, Rev Mariann Edgar Budde. The kind, just people of this world see you and appreciate you.","2025-01-22T17:37:58.752Z"
"moskosh.bsky.social","I think yesterday's front page of The Morning Star is getting quite a response in the States!","2025-01-22T09:13:17.972Z"
"moskosh.bsky.social","@chrisbritt.bsky.social","2025-01-22T21:48:05.601Z"
"moskosh.bsky.social","from today's post — link is here: bit.ly/40HSX4w","2025-01-22T18:37:40.786Z"
"moskosh.bsky.social","And just like that, with a stroke of the pen, Caitlin Jenner is Bruce Jenner, again… Just call him BRUCE! 😂","2025-01-22T00:57:54.113Z"
"moskosh.bsky.social","Bishop Mariann Edgar Budde is the Christian that Franklin Graham failed to be.","2025-01-21T23:49:54.142Z"
"moskosh.bsky.social","And yet, he doesn’t have any problem selling them…👇 Does he?! Grifter. In. Chief.","2025-01-21T11:22:26.394Z"
"moskosh.bsky.social","Bishop Mariann Edgar Budde Hero.","2025-01-22T01:54:13.708Z"
"moskosh.bsky.social","Day 1. We made it. Only this many to go. 👇 www.tickcounter.com/countdown/16...","2025-01-21T07:43:31.423Z"
"moskosh.bsky.social","#SundayService 🙏🏼 @johnfugelsang.bsky.social","2025-01-19T16:42:21.804Z"
"moskosh.bsky.social","Senate confirmed Marco Rubio as Secretary of State 99-0. Just a reminder, he’s paying Rubio back for finding Aileen Cannon. Rubio served as Cannon's sponsor, asking her to apply for the judicial nomination in 2019 & created the faux “bipartisan” FL judicial advisory commission who vetted Cannon.","2025-01-21T03:33:01.901Z"
"moskosh.bsky.social","A convicted felon, adjudicated rapist, con man, traitor, thief, fraud, liar, and his porn """"model"""" mail-order fake wife who won't live with him, let alone sleep with him, befoul the White House tonight. Do NOT let the MAGA in your life off the hook for this. Do your part.","2025-01-20T23:31:23.815Z"
"moskosh.bsky.social","Anyone who says this was NOT a Nazi salute can — with all due respect — fuck off.","2025-01-20T23:10:09.281Z"
"moskosh.bsky.social","I’m not okay This is what happens when a treasonous terrorist gets away with an insurrection, stealing top secret documents, trying to overthrow an election, sexual assault, etc etc etc. Our justice system failed us. The motto ‘No one is above the law’ was total horse shit. We will all suffer!","2025-01-21T02:38:50.328Z"
"moskosh.bsky.social","In the space of half a day, the new administration has trashed the Constitution, subverted the independence of the DOJ, granted a broad amnesty to traitors, abandoned the global community on climate and public health, and launched a wide-ranging attack on minority rights.","2025-01-21T02:45:37.304Z"
"moskosh.bsky.social","CNN reports that the January 6 criminals have been told they are invited to attend inaugural balls tonight. They are going to be released from the D.C. jail momentarily. All are insurrectionists. We are not a democracy anymore, folks. We do not have rule of law.","2025-01-21T02:31:03.295Z"
"moskosh.bsky.social","﻿Under the Civil Service Reform Act of 1978, federal agency employers are prohibited from asking political party preference questions of federal employees and applicants","2025-01-13T18:42:58.596Z"
"moskosh.bsky.social","Maya Angelou.. when they tell you who they are; believe them. people tell us who they are through both their words and their actions, and we should pay attention to these revelations.","2025-01-20T22:27:26.131Z"
"moskosh.bsky.social","11AM: How bad could the new administration be? 4PM: And Elon did that how many times?","2025-01-20T22:01:03.054Z"
"moskosh.bsky.social","From midnight tonight until next Saturday morning, there's no TV, no Internet, no Social Media, no nothing for me. Symbolic protest is better than none at all. #5DayBLACKOUT","2025-01-19T22:57:19.033Z"
"moskosh.bsky.social","Fox’s level of incompetence is off the charts.","2025-01-20T19:24:03.334Z"
"moskosh.bsky.social","ELON DID A FUCKING NAZI SALUTE AND THAT IS NOT FUCKING OK","2025-01-20T20:41:39.881Z"
"moskosh.bsky.social","Over the past four years, in many cases and on many days, federal judges in Washington have warned that a lack of accountability and penalties for the US Capitol rioters will create a risk of future political violence in the US They warn it'd """"normalize"""" political violence","2025-01-20T20:54:43.499Z"
"moskosh.bsky.social","The Internet is forever. I can't believe my own eyes.","2025-01-20T21:13:32.846Z"
"moskosh.bsky.social","I’ll be posting this today","2025-01-20T15:05:38.980Z"
"moskosh.bsky.social","Hell is empty, And all the devils are here.","2025-01-20T14:38:48.462Z"
"moskosh.bsky.social","😡😡😡😡","2025-01-19T15:47:44.762Z"
"moskosh.bsky.social","No words….","2025-01-19T13:59:31.713Z"
"moskosh.bsky.social","Texan here. Have you paid attention to who is flying flag at half mast today and who is not?","2025-01-20T21:04:46.603Z"
"moskosh.bsky.social","Tomorrow will be a difficult day for many of us, but tonight, that's funny! 😅🤣😂","2025-01-20T03:17:00.162Z"
"moskosh.bsky.social","I’ve deleted all apps of mainstream media today and no TV in my home. At least I can take a nap with no notifications .","2025-01-20T20:08:40.756Z"
"moskosh.bsky.social","""""One of the most important things any of us can do right now is bring attention to the lived experiences of people in states that have banned or restricted abortion. & practically, we can make sure people are familiar w/all of their options for abortion care"""" joycevance.substack.com/p/honoring-s...","2025-01-20T15:39:40.266Z"
"moskosh.bsky.social","BREAKING NEWS: President Biden has just awarded PREEMPTIVE PARDONS to Liz Cheney, General Mark Milley, Anthony Fauci, and the entire January 6 Committee. Good!","2025-01-20T14:12:29.557Z"
"moskosh.bsky.social","Finally! We now know the backstory to this classic """"Planet of the Apes"""" ending.","2025-01-20T17:57:20.006Z"
"moskosh.bsky.social","Listen up.","2025-01-19T02:08:11.430Z"
"moskosh.bsky.social","So it was ok when Cheetolini broke yrs of tradition & didn't attend Biden's inauguration or participate in the peaceful transfer of power. But when Michelle Obama & Kamala say I'm done being fake nice & polite to ppl who disrespect me & my family, they're the 1's getting criticized. FOH 🙄","2025-01-19T16:24:36.754Z"
"moskosh.bsky.social","2009 Obama 28°F 1977 Carter 28°F 1961 Kennedy 22°F It’s not about the cold… it’s about the small crowd size.","2025-01-17T22:26:54.143Z"
"moskosh.bsky.social","Secretary of Defense Lloyd Austin gets a standing ovation at his farewell ceremony.","2025-01-17T15:42:56.992Z"
"moskosh.bsky.social","Well, well, well...🙄","2025-01-18T00:43:40.011Z"
"moskosh.bsky.social","My one wish for the inauguration is that there is a gift bag under the seats of Bezos, Zuck, Elon etc, with a single, embroidered , padded knee pad Need to protect themselves when they are on bended knee, kissing the ring 🤷😆","2025-01-17T17:33:39.295Z"
"moskosh.bsky.social","What would I ask? """"What was your analysis of the Houthi Bombing in October? What counsel would you give POTUS regarding next actions?"""" """"What should the US strategy be in Syria ?"""" """" How would you counter Chinese aggression on the south China Sea ?"""" """"How would you assure civilian oversight of DOD""""","2025-01-15T03:48:21.487Z"
"moskosh.bsky.social","@marypar.bsky.social @misstrueblue.bsky.social @corapunzel.bsky.social @briantylercohen.bsky.social 💯💙🦋🦋💙","2025-01-13T02:47:20.299Z"
"moskosh.bsky.social","The American justice system is a fucking joke. Anyone disagree? Anyone at all?","2025-01-11T14:12:08.379Z"
"moskosh.bsky.social","The New Yorker This should send some waves to MAR -A-LARDO """"Two' A Crowd""""","2025-01-11T18:02:43.795Z"
"moskosh.bsky.social","The motherfucker is forever guilty.","2025-01-10T16:10:31.806Z"
"moskosh.bsky.social","I'm going to post this video every day so we never forget","2025-01-10T12:21:39.143Z"
"moskosh.bsky.social","I’ve totally lost faith in the US judicial system.","2025-01-10T19:46:20.747Z"
"moskosh.bsky.social","This last year has been devastating for my sense of justice, for my faith in our judiciary. We always had faith that in the US no one is above the law - that faith has been absolutely shattered.","2025-01-10T15:16:18.177Z"
"moskosh.bsky.social","Hadn’t thought of it that way before…","2025-01-09T17:16:01.670Z"
"moskosh.bsky.social","I'm going to post this video every day so we never forget","2025-01-09T12:47:27.090Z"
"moskosh.bsky.social","The fact that Republicans are attempting to straight up steal a Supreme Court seat in North Carolina by invalidating over 60,000 legally-cast votes should be getting a lot more attention than it is.","2025-01-07T19:34:23.751Z"
"moskosh.bsky.social","Our shadow President, everyone.","2025-01-06T13:42:27.202Z"
"moskosh.bsky.social","“For my next attention seeking trick, I will have you concentrate on Greenland, the Gulf of Mexico, and the Panama Canal—instead of my absurdly unqualified cabinet picks or that I have no real plans to fix the border or bring down food prices. Look, America, a rabbit!”","2025-01-08T18:46:48.838Z"
"moskosh.bsky.social","Jeff Bezos never wanted this cartoon to become public. He killed it, and as a result, pulitzer prize editorial cartoonist Ann Telnaes quit. Make sure everyone sees this cartoon.","2025-01-04T16:08:10.280Z"
"moskosh.bsky.social","Shamsu-Din Jabbar was born in the United States. REPEAT: Jabbar was a U.S. citizen. He was born here and did not cross the border. Any post claiming otherwise is straight-up disinformation.","2025-01-02T17:36:00.600Z"
"moskosh.bsky.social","It’s wrong to allow someone like this to be in charge of our country, and decisions that impact all our lives! If people would have simply done their jobs to hold him accountable he wouldn’t be! It’s wrong, and now we are all going to pay the price!","2025-01-02T16:32:14.683Z"
"moskosh.bsky.social","Exactly","2025-01-03T01:20:27.905Z"
"moskosh.bsky.social","4 days from J6","2025-01-02T17:54:57.522Z"
"moskosh.bsky.social","2025. Day 1. God help us.","2025-01-01T22:29:43.349Z"
"moskosh.bsky.social","Because it needs to be said, despite propaganda being spread about the terrorist in New Orleans being an immigrant, he was in fact born and raised in Texas and was a US Veteran. Their hopes in using this brutal terror attack to demean immigrants has ended in total failure.","2025-01-01T23:32:46.224Z"
"moskosh.bsky.social","It's true...","2025-01-01T14:42:04.277Z"
"moskosh.bsky.social","I'm going to post this video every day so we never forget","2024-12-30T13:02:07.217Z"
"moskosh.bsky.social","Let’s get #ThankYouJimmyCarter trending on BlueSky 🦋💙","2024-12-29T22:18:10.862Z"
"moskosh.bsky.social","One last gift from President Carter: Flags will be half staff on inauguration day.","2024-12-30T00:19:31.035Z"
"moskosh.bsky.social","This is how fucking stupid Greg Abbott it- He sends his condolences to Roselyn Carter! Dumb ass!","2024-12-30T00:53:55.595Z"
"moskosh.bsky.social","Wow","2024-12-30T01:29:02.753Z"
"moskosh.bsky.social","Former President Jimmy Carter died today. America is in mourning. According to a proclamation signed by then-President Dwight D. Eisenhower in 1954, because Jimmy Carter is a former president, American flags will remain at half-staff at all U.S. federal buildings for 30 days from today — the…","2024-12-30T02:36:20.683Z"
"moskosh.bsky.social","Jimmy refused to put one toe in 2025. Can you blame him?","2024-12-29T22:39:11.670Z"
"moskosh.bsky.social","Rest in peace to Submariner LT James Earl Carter Jr, USN (Ret). Carter, the only U.S. President to graduate from the U.S. Naval Academy, leaves a legacy of service. The USS Jimmy Carter (SSN-23), a Seawolf-class fast-attack submarine, carries his name in honor of his dedication to our nation.","2024-12-29T21:33:49.426Z"
"moskosh.bsky.social","Immigrants are stealing American jobs!! Someone from South Africa just STOLE the US Presidency! This cannot stand.","2024-12-28T04:24:22.469Z"
"moskosh.bsky.social","THIS is the TRUTH!","2024-12-24T16:00:19.803Z"
"moskosh.bsky.social","Make sure everyone sees this.","2024-12-24T18:01:56.268Z"
"moskosh.bsky.social","I'm going to post this video every day so we never forget","2024-12-24T12:28:46.699Z"
"moskosh.bsky.social","I'm going to post this video every day so we never forget","2024-12-22T12:36:49.673Z"
"moskosh.bsky.social","The GOP Nativity scene: No unwed mothers, Middle Eastern people, refugees, and obviously no wise men.","2024-12-22T19:56:48.445Z"
"moskosh.bsky.social","Wondering if the Co-presidents will wear matching outfits for the inauguration 🤔","2024-12-22T01:27:47.264Z"
"moskosh.bsky.social","I'm going to post this video every day so we never forget","2024-12-21T13:20:32.408Z"
"moskosh.bsky.social","Mad men…","2024-12-20T19:46:11.497Z"
"moskosh.bsky.social","An unelected billionaire was crowned co-President by the Republican Party. They’ve given him the influence to make a damn post that throws a spending bill into limbo cause House Republicans are scared of him. No greater example of oligarchy. Where the ultra-wealthy run the show.","2024-12-18T19:43:13.217Z"
"moskosh.bsky.social","I'm going to post this video every day so we never forget","2024-12-13T12:26:33.816Z"
"moskosh.bsky.social","I'm going to post this video every day so we never forget","2024-12-14T12:57:55.953Z"
"moskosh.bsky.social","📌“If you can convince the lowest white man he's better than the best colored man, he won't notice you're picking his pocket. Hell, give him somebody to look down on, and he'll empty his pockets for you.” ― Lyndon B. Johnson *(One of the most prescient things ever said by anybody.)","2024-12-15T16:08:13.837Z"
"moskosh.bsky.social","I'm going to post this video every day so we never forget","2024-12-11T13:16:39.778Z"
"moskosh.bsky.social","Exactly.","2024-12-07T02:09:41.286Z"
"moskosh.bsky.social","Indeed.","2024-12-05T19:27:05.769Z"
"moskosh.bsky.social","I'm going to post this video every day so we never forget","2024-12-04T12:42:56.263Z"
"moskosh.bsky.social","President Biden has done so much to help the American people in his term and I am extremely proud. -Some of the lowest Unemployment numbers in History -Inflation Reduction Act -Infrastructure Bill Drop 💙 and Repost if you are proud what Biden has done","2024-12-03T12:40:47.241Z"
"moskosh.bsky.social","So very happy to find one of my favorite cartoonists here on BlueSky! Hi @mluckovich.bsky.social!","2024-12-03T13:08:39.624Z"
"moskosh.bsky.social","I'm going to post this video every day so we never forget","2024-12-03T12:36:02.469Z"
"moskosh.bsky.social","Could two followers please copy and re-post this message to show that someone is always there? Please reach out for the assistance you need if you need it. National Suicide Prevention Hotline UK: 0800 689 5652 US: 1-800-273-8255 Canada: 1.833.456.4566","2024-12-02T16:42:53.805Z"
"moskosh.bsky.social","I'm going to post this video every day so we never forget","2024-12-01T18:54:34.933Z"
"moskosh.bsky.social","We will never forget.","2024-11-27T04:18:35.251Z"
"moskosh.bsky.social","In a sane world, we wouldn’t need to be wasting our time arguing for what is painfully obvious. But we must.","2024-11-23T01:13:57.551Z"
"moskosh.bsky.social","I'm going to post this video every day so we never forget","2024-11-26T12:31:36.942Z"
"moskosh.bsky.social","I'm going to post this video every day so we never forget","2024-11-21T12:16:53.435Z"
"moskosh.bsky.social","Ladies and gentlemen, the 47th President of the United States. ( ° ͜ʖ͡°)","2024-11-23T16:49:39.482Z"
"moskosh.bsky.social","A handful of billionaires now have unprecedented control over banking, the food we eat, the health care we can access and, now, the information we receive. This is what oligarchy looks like.","2024-11-15T22:47:03.595Z"
"moskosh.bsky.social","I see you .","2024-11-09T17:22:00.583Z"
