"user","post","date"
"richardbowles.bsky.social","Columbia University students appear to be under some kind of slow-motion siege by our fascist government in retaliation for holding the wrong political opinions","2025-03-14T04:19:02.813Z"
"richardbowles.bsky.social","This mechanic is one way fascists try to have their cake and eat it too. Any white person with a characteristic they dislike doesn't fully """"count"""" as a white person, so then they say that *all* white people are *free* of those characteristics. It's circular reasoning but they don't care. 6/","2025-03-11T22:29:19.966Z"
"richardbowles.bsky.social","that the decision to single out, detain &persecute someone for their political speech was made by those at the highest levels is the purest distillation of fascism. so many dems are silent bc, by framing anti-genocide speech as antisemitic for over a year, they helped create the conditions for this","2025-03-10T17:39:45.215Z"
"richardbowles.bsky.social","Listen this IS in fact how it’s done. Georgetown Law Dean William Treanor responds to Acting U.S. Atty Ed Martin’s threat to refuse to hire Georgetown graduates who have taken “DEI” courses in their curriculum. Treanor is a brilliant lawyer & constitutional scholar. Embarrassing for Martin.","2025-03-06T20:24:14.917Z"
"richardbowles.bsky.social","America does not need a ‘resistance,’ or stale slogans, or people putting those slogans on little paddles. It needs an opposition party that boldly defends the nation’s virtues, the rule of law, and the rights of its people. www.theatlantic.com/ideas/archiv...","2025-03-05T16:33:07.122Z"
"richardbowles.bsky.social","Ontario Premier Doug Ford cancels Elon Musk’s Starlink contract and bans all US companies from government contracts: “It’s done, it’s gone... We won’t award contracts to people who enable and encourage economic attacks on our province and our country.” “They only have President Trump to blame.”","2025-03-04T22:05:33.272Z"
"richardbowles.bsky.social","Trudeau: I want to speak first directly to the American people… your government has chosen to do this to you. Your government has chosen to put American jobs at risk. They have chosen to raise costs for American consumers on everyday essential items…","2025-03-04T16:25:49.747Z"
"richardbowles.bsky.social","SCOOP: Now that Linda McMahon is confirmed/sworn in as secretary, Trump will be imminently issuing an executive order eliminating the Department of Education. I’ve obtained a draft of an email that McMahon will be sending to staff re: the EO and the department’s “final mission”. Here is a portion:","2025-03-04T00:04:47.313Z"
"richardbowles.bsky.social","Extraordinary quote from the German president about Trump/Vance's ambush of Zelensky: """"I would never have believed that we would ever have to defend Ukraine from the United States.” www.nytimes.com/2025/03/01/w...","2025-03-01T23:07:25.217Z"
"richardbowles.bsky.social","Assuming governor signs and the courts don’t stop it, this probably ends my attempt to get a proper birth certificate. My papers arrived at their offices last Friday, and they said there is a 4-6 week queue. I’m so very upset, and will be exploring options to take them to court over this.","2025-02-28T04:19:32.383Z"
"richardbowles.bsky.social","Pretty clear. The goal here was to do a kind of ritual humiliation of Zelensky and Ukraine. They pushed Zelensky past his limit. Trump now says, in essence, you're own your own with Russia. Up to the free states of Europe now.","2025-02-28T18:30:08.931Z"
"richardbowles.bsky.social","Being in the room with a man who is actually strong and brave — which MAGA only pretends to be — reveals Trump and Vance for the babies they are.","2025-02-28T18:07:01.543Z"
"richardbowles.bsky.social","It’s horrifying that it’s come to this, but as someone with a deep affinity for Europe I feel moved seeing that continent come together to try to save itself in the absence of any meaningful aid from the totalitarian regime that’s in the midst of taking over the United States through an illegal coup","2025-02-28T03:38:44.995Z"
"richardbowles.bsky.social","Fealty to Donald Trump will not spare you from his cruelty. It's strength — not weakness — that curbs his baser instincts. Now is the time for us to be strong.","2025-02-28T00:54:12.640Z"
"richardbowles.bsky.social","The GOP claims slashing $880 billion from Medicaid is about eliminating """"waste, fraud, & abuse.” That's a smokescreen. The “fraud” amounts to less than 1/10th of 1%, not even close to $880 billion. Their actual plan slashes coverage for millions & leaves families without care. We won’t be fooled.","2025-02-26T18:16:01.935Z"
"richardbowles.bsky.social","NEW: Fully leaked diplomatic cable directing the implementation of this policy at all US diplomatic and consular posts.","2025-02-25T20:24:18.312Z"
"richardbowles.bsky.social","Remarkable assessment by an incoming German chancellor. “for me it is an absolute priority to strengthen Europe as quickly as possible, so that we achieve independence from the US, step by step.” www.dw.com/en/german-el...","2025-02-23T21:18:37.510Z"
"richardbowles.bsky.social","You can download a template for Red Cards that you can make copies of here: www.ilrc.org/red-cards-ta...","2025-02-23T20:34:24.095Z"
"richardbowles.bsky.social","Yes, it is entirely correct to point out that ICE officers do not have any legal authority to break into somebody’s home unless they get a judicial warrant; which they generally cannot do, because judges only issue warrants for probable cause of crimes, not immigration law violations.","2025-02-21T23:22:32.073Z"
"richardbowles.bsky.social","Another Nazi salute. Not funny nor equivocal.","2025-02-21T06:59:24.110Z"
"richardbowles.bsky.social","And to think just four days ago, after lecturing the Europeans on free speech, JD Vance was in my Twitter replies lecturing me about free speech too. Oh the shamelessness! This is who they are:","2025-02-21T06:13:56.421Z"
"richardbowles.bsky.social","I feel so sick. Enough with the lies, enough with the games. They know exactly what they're doing. This is a neo-Nazi movement. Proudly so. The only reason they've kept it coded up until now was to take advantage of those who didn't want to believe it. No more looking away. Face up to what it is.","2025-02-21T02:28:40.607Z"
"richardbowles.bsky.social","Trump just declared himself King of America on the official White House Twitter account, and among the overwhelmingly negative responses, even some Trump voters are feeling a little uncomfortable x.com/WhiteHouse/s...","2025-02-19T22:12:50.993Z"
"richardbowles.bsky.social","1/ The need to tell the truth is a difficult thing in times like these. This is because so much has already been said to no avail. I read an article a few months ago about how climate scientists and activists have had to attend therapy...","2025-02-19T21:09:59.416Z"
"richardbowles.bsky.social","""""The good news, that you can see all around now, is that the spirit is moving among us. It is the spirit of Jesus. And Jesus is that great voice of otherwise, who saw the contradictions of the gospel to the Roman Empire and who acted out an alternative."""" (2018)","2025-02-19T20:00:04.997Z"
"richardbowles.bsky.social","Now it just says “person”","2025-02-18T12:21:06.075Z"
"richardbowles.bsky.social","So while the MAGA media machine is fully mobilizing in support of Trumpist imperialism, the non-MAGA mainstream is getting Douthat-style sophistry and Baker-style faux-neutrality journalism - and just like that, polite society is treating """"Annex Canada"""" as if it was worthy of serious consideration.","2025-02-18T14:44:11.251Z"
"richardbowles.bsky.social","trying to imagine how loud the calls for my firing would be if i didn’t know who FDR was","2025-02-18T16:41:43.519Z"
"richardbowles.bsky.social","A friend from the VA just sent this and asked me to share. PMDB is Prevention and Management of Disruptive Behavior in the workplace. THIS is the real war against women: being forced to say there are only 2 genders but not being allowed to mention 96% of violence is perpetrated by men.","2025-02-18T16:48:08.738Z"
"richardbowles.bsky.social","This is why it is so important that our scientific societies speak out against factual inaccuracies like in the sex EO.","2025-02-18T18:08:16.126Z"
"richardbowles.bsky.social","""""This is no mastermind. This is a run-of-the-mill internet Nazi. But the fact remains that he’s been granted access to the most sensitive information held by the IRS, all at the behest of another Nazi."""" www.thehandbasket.co/p/nazis-musk...","2025-02-18T00:23:58.621Z"
"richardbowles.bsky.social","Excellent thread on the roots of American fascism.","2025-02-16T22:08:09.793Z"
"richardbowles.bsky.social","I’m in Munich and people keep asking me to decode Vance’s speech. OK: In Vance English “free speech” means “Let Musk run your elections” and “democracy” means “let Russia run your elections.” Now move on. 2025 is about what Europeans do, not what Americans say.","2025-02-15T22:44:35.564Z"
"richardbowles.bsky.social","Yesterday — YESTERDAY — JD Vance visited Dachau and said it drove home “what unspeakable evil was committed and why we should be committed to ensuring it never happens again.” Today he met with AfD?? He made a mockery of his visit to Dachau. Disgusting. www.washingtonpost.com/politics/202...","2025-02-14T21:45:05.496Z"
"richardbowles.bsky.social","And let me put an even sharper point on this: Oppressed people have lived OFTEN with the TOTALITY of formal information coming directly from their oppressors. And they have STILL fought for liberation, again and again and again.","2025-02-15T01:05:51.440Z"
"richardbowles.bsky.social","""""Starbuck's workface""""— talk about incompetent. What ever happened to proofreading your pleadings.","2025-02-14T19:50:10.077Z"
"richardbowles.bsky.social","A German researcher captured the contents of """"DEI.gov"""" before it was put behind a password wall. It contained a list of things USAID was funding filtered through the worst possible light: www.404media.co/dei-waste-go...","2025-02-14T19:35:23.055Z"
"richardbowles.bsky.social","we are getting stories crazier than watergate every single day and no one bats an eye at them anymore. society has hypernormalized intense corruption that it feels like NOT being openly corrupt hinders you","2025-02-13T19:26:45.496Z"
"richardbowles.bsky.social","We only know this man is in Gitmo because Noem tweeted a propaganda photo that included him and his sister saw it. He has no criminal record. He entered the US in January and immediately made an appointment with CBP to claim asylum. They sent him to a concentration camp bc of his basketball tattoo.","2025-02-12T16:09:27.127Z"
"richardbowles.bsky.social","first twitter, next the gulf of mexico. let’s keep it going. as long as people who clearly have no respect for queer or trans folks and their preferred names and pronouns keep renaming stuff, i’ll keep actively deadnaming it all. i can do this all day.","2025-02-12T05:05:26.556Z"
"richardbowles.bsky.social","The most fascistic section of law enforcement begins its rather predictable evolution into the role of secret police","2025-02-11T23:18:20.139Z"
"richardbowles.bsky.social","""""Today we were informed by the White House that if AP did not align its editorial standards with President Donald Trump’s executive order renaming the Gulf of Mexico as the Gulf of America, AP would be barred from accessing an event in the Oval Office."""" www.ap.org/the-definiti...","2025-02-11T21:22:35.207Z"
"richardbowles.bsky.social","This is so nauseating and monstrous.","2025-02-11T18:44:27.268Z"
"richardbowles.bsky.social","1/ This was my Communion Meditation in honor of Nex Benedict for yesterday’s church service: One year ago yesterday, Oklahoma lost Nex Benedict. As I’m sure we all remember, Nex was a trans Owasso student...","2025-02-11T06:07:54.043Z"
"richardbowles.bsky.social","I wrote a piece on the Christian Nationalist reaction to Bishop Budde. It is time that we truly delineate between Christianity and Christian Nationalism.","2025-01-28T19:45:23.249Z"
"richardbowles.bsky.social","Hearing that DOGE went into the Dept of Education today and shut down almost the entirety of the department's in-house research arm, Institute of Educational Sciences, cancelling contracts totally about $900m.","2025-02-11T00:59:56.150Z"
"richardbowles.bsky.social","This might be the most nakedly corrupt document I’ve seen on DOJ letterhead — and I wrote a history of Watergate!","2025-02-11T00:56:01.764Z"
"richardbowles.bsky.social","Courts *ordered* the Trump admin to stop its spending freeze Yet ProPublica found place after place where $ is still frozen -hot meals for elderly and disabled -groceries for those in need -maternal & child health services -a clinic that serves the poor www.propublica.org/article/trum...","2025-02-10T21:33:44.284Z"
"richardbowles.bsky.social","""""They can do whatever they get away with"""" Back when I started as a social studies teacher my department chair was a gruff (and wonderful) veteran who did a lot to take me under his wing and help me learn those practical elements of the art of teaching that you don't get in teacher ed programs. 1/","2025-02-10T22:02:42.312Z"
"richardbowles.bsky.social","Sunday reading: A MAGA Feeding Frenzy Is Ravaging the Constitutional Order The assault is coming from different angles: Project 2025. The feudal tech barons. The America First nativists. Less a single master plan – and more comprehensive chaos. This week’s piece:","2025-02-09T14:06:05.632Z"
"richardbowles.bsky.social","People should use all legal and non-violent methods to prevent the DOGE terrorists from accessing the federal treasury. For informational purposes only, here are the routes from Washington, DC to the US Treasury Building at 200 3rd St, Parkersburg, WV 26106.","2025-02-09T04:48:08.942Z"
"richardbowles.bsky.social","SCOOP: We've learned at least three individuals closely associated with Palantir or its cofounder Peter Thiel were involved in an online recruiting effort for DOGE late last year. Step inside the recruitment effort that helped build Elon's DOGE army:","2025-02-09T01:02:23.015Z"
"richardbowles.bsky.social","LA STUDENT STRIKE DAY 5 - RIGHT NOW: Pasadena High School has just joined the dozens of other schools all over LA that have staged walkouts throughout this week. This is the 6th straight day of anti-ICE, immigrations rights protests in LA.","2025-02-07T21:23:27.675Z"
"richardbowles.bsky.social","UPDATE: My colleagues and I were locked out of the Dept. of Education and denied a meeting with Acting Secretary Carter.","2025-02-07T18:28:30.569Z"
"richardbowles.bsky.social","You anti-Kamala Palestine supporters really showed her.","2025-02-05T01:50:14.499Z"
"richardbowles.bsky.social","🚨 BREAKING: Trump signs executive order withdrawing the U.S. from the UN Human Rights Council (UNHRC) and cut all funding to UNRWA, the main agency supporting Palestinian refugees. This means millions of Palestinians lose access to food, healthcare, and education.","2025-02-04T20:49:39.558Z"
"richardbowles.bsky.social","404 has the details. But in a number of interviews w those who've interacted with the Musk gizmocrats, AI and integrating government systems with AI comes up repeatedly. This isn't surprising in itself. AI is big in all tech now. But fits with what is described here.","2025-02-04T19:41:19.123Z"
"richardbowles.bsky.social","We are at the point of the fascist autocoup where the interim US Attorney is replying to an anonymous pro-Nazi account who wants to see someone punished for simply sharing the names of Elon Musk's lackeys who have gotten access to extremely sensitive government data systems.","2025-02-04T02:30:06.627Z"
"richardbowles.bsky.social","*sigh*","2025-02-04T00:41:26.309Z"
"richardbowles.bsky.social","This is why Congressional Democrats should be breaking down the doors of whatever facility manages payments and seizing control of the federal treasury because people are going to die as a result of the budget they passed and the money they allocated not being distributed according to the law.","2025-02-03T04:21:21.094Z"
"richardbowles.bsky.social","An excellent piece by @timothysnyder.bsky.social and recommended strongly by @hcrichardson.bsky.social - Please read and spread the word!","2025-02-03T03:31:48.909Z"
"richardbowles.bsky.social","This language describes a coup. You have to be a government employee, subject to the rules & procedures that bind gov employees, to do this kind of work. This is a blatant abuse of the public trust by the Trump administration, a true 5-alarm fire. www.wired.com/story/elon-m...","2025-02-02T19:34:04.397Z"
"richardbowles.bsky.social","fuck yes","2025-02-02T21:53:33.318Z"
"richardbowles.bsky.social","Anti-Trump demonstrators in Los Angeles have taken over the 101 freeway to protest ICE deportation raids. 🎥 ktla","2025-02-02T20:36:59.538Z"
"richardbowles.bsky.social","Elon Musk and DOGE are now publicly targeting Lutheran groups for cuts. Among those listed: Global Refuge (formerly LIRS), one of 6 faith-based groups that have long helped the govt resettle refugees. Not clear why Musk contends this funding, which is longstanding and well known, is """"illegal.""""","2025-02-02T15:25:56.097Z"
"richardbowles.bsky.social","""""I want to speak directly to Americans,"""" says Canadian Prime Minister Justin Trudeau. """"This is a choice that will harm Canadians...but will have real consequences for you.""""","2025-02-02T02:13:46.323Z"
"richardbowles.bsky.social","A man who has shown himself to be deeply sympathetic to Nazism might now have all of our Social Security numbers. That is a statement that would have seemed like absurd liberal hyperbole a few years ago, but is now just a neutral statement of fact.","2025-02-02T00:40:31.225Z"
"richardbowles.bsky.social","Same exact thing.","2025-02-01T23:17:32.358Z"
"richardbowles.bsky.social","This is a 5 alarm fire. They're going to pull down all publicly available data, studies, guidance, etc that involves LGBTQ people so when the worst happens to us, no one will know. They're actively trying to erase us. gizmodo.com/cdc-ordered-...","2025-01-31T18:17:03.509Z"
"richardbowles.bsky.social","Context for the CDC eliminating data from its website today. This was in Project 2025.","2025-01-31T17:36:33.631Z"
"richardbowles.bsky.social","When did mercy become for Christians(!) a casualty of the culture wars?","2025-01-31T03:35:06.689Z"
"richardbowles.bsky.social","Private. Private business bathroom ban. That’s one stop away from entering people’s homes.","2025-01-31T04:15:13.393Z"
"richardbowles.bsky.social","This has been a very racist week","2025-01-30T23:32:32.752Z"
"richardbowles.bsky.social","This.","2025-01-30T22:10:52.610Z"
"richardbowles.bsky.social","republicans understand that you jump in front of a camera and set a narrative. democrats think you spend all day doing focus groups for the perfect message and asking cory booker how to schedule your tweets.","2025-01-30T17:00:03.436Z"
"richardbowles.bsky.social","Anti-DEI is pure r*cist trash. We see all of you.","2025-01-30T17:18:42.760Z"
"richardbowles.bsky.social","This whole """"It's just a distraction"""" line of thinking needs to die. They are genocidal bastards hellbent on eradicating the trans community. It's not a god damn distraction. This is what they stand for and you're running cover for it by minimizing it.","2025-01-30T14:37:36.326Z"
"richardbowles.bsky.social","Trump says he has the highest standards, after putting a MTV's Real World alumnus in charge of Transportation and a Fox & Friends host in control of the Pentagon, while his nominees to lead the FBI (internet troll), HHS (celebrity science crank) and DNI (Russian stooge) flail in live hearings.","2025-01-30T16:51:08.365Z"
"richardbowles.bsky.social","A classic Trump ploy to distract from the questions raised by the fact that the FAA ATC staff responsible for that airspace last night HAD BEEN ASKED TO RESIGN only 24 hours before the tragedy. Part of Musk's scheme to terrorize federal workers. Did the WH press ask that fucking question? No no no","2025-01-30T17:22:20.357Z"
"richardbowles.bsky.social","Blackhawk crashes into a plane over the Potomac? DEI. Wife left you? DEI. Your children hate you? DEI. Gambled away your savings on a Trump crypto coin? DEI.","2025-01-30T18:09:14.453Z"
"richardbowles.bsky.social","I've been joking that I'll have to home school my kids so they learn about science and history. Might not be joking anymore.","2025-01-29T23:20:17.209Z"
"richardbowles.bsky.social","Because they are evil, we must stand up to them. But because they are also stupid, we needn’t be afraid to.","2025-01-29T14:17:01.295Z"
"richardbowles.bsky.social","They will come for Green Card holders too... soon. Don't be or pretend to be shocked, Trump said he would do this at several times last year and he usually does (or at least try to do) the nativist things he says.","2025-01-29T18:41:00.056Z"
"richardbowles.bsky.social","so I think they're claiming (1) trump issued a bunch of EOs that would require big spending freezes, (2) the memo detailed those freezes, (3) they're 'rescinding' the memo to moot the court case, but (4) they still expect all the agencies to follow the memo since it was just operationalizing the EOs","2025-01-29T18:58:10.598Z"
"richardbowles.bsky.social","I just saw an ICE vehicle at the intersection of 33rd and Boulevard in Edmond, OK about 20 minutes ago.","2025-01-28T22:41:35.211Z"
"richardbowles.bsky.social","Trump just signed an executive order banning gender affirming care for trans youth nationwide (under 19). Specifically directs the DOJ to investigate providers under criminal and federal consumer protection laws. drive.google.com/file/d/1oTIm...","2025-01-28T22:22:18.137Z"
"richardbowles.bsky.social","I wrote a piece on the Christian Nationalist reaction to Bishop Budde. It is time that we truly delineate between Christianity and Christian Nationalism.","2025-01-28T19:45:23.249Z"
"richardbowles.bsky.social","So far, Oklahoma is proposing 20 anti-trans bills in the State Legislature. A lot of them focusing on the official erasure of trans people, prohibiting documents, the use of pronouns, preferred names, and another drag ban.","2025-01-22T22:23:34.948Z"
"richardbowles.bsky.social","this is an illegal order. the president does not have the legal authority to discriminate against entire categories of americans on the basis of sex. this order is no different than if he had issued one reinstituting segregation.","2025-01-28T04:26:23.660Z"
"richardbowles.bsky.social","1/2 Anyone who has embraced a worldview that condemns empathy has walked away from Christianity. You cannot denounce compassion and remain a follower of Jesus Christ. The Greatest Command is to love the Lord and to love your neighbor as yourself - to empathize.","2025-01-28T03:45:12.518Z"
"richardbowles.bsky.social","This is downright genocidal. Revoking access to HIV meds will cause new infections to skyrocket while current patients deteriorate as HIV goes untreated.","2025-01-27T19:20:37.022Z"
"richardbowles.bsky.social","looks like Tuskegee Airmen are going to be one of our Black History Month episodes on White Homework!","2025-01-25T19:22:05.403Z"
"richardbowles.bsky.social","Because people are correctly interpreting MAGA’s use of the terms “DEI” and “woke” to mean Black.","2025-01-26T18:29:12.734Z"
"richardbowles.bsky.social","If Trump were to seize Greenland, a NATO member, under the NATO charter, NATO would be compelled to defend. This would either pit America vs NATO or force NATO to back down and dissolve. This is a Trump-Putin joint effort to destroy NATO together.","2025-01-26T14:59:14.390Z"
"richardbowles.bsky.social","Via Christian activist Shane Claiborne: Inauguration week was a collision of two Christianities —> religionnews.com/2025/01/24/i...","2025-01-24T20:47:19.400Z"
"richardbowles.bsky.social","Can confirm. The Episcopal Church I like to visit sometimes is a ten minute walk from my apt, the assistant rector is a woman, and they did not bat an eye when I walked in on a Sunday morning with a shaved head lol","2025-01-24T04:07:26.235Z"
"richardbowles.bsky.social","you won't often see a judge come closer to calling a DOJ attorney a Nazi than Judge Coughenour does here: """"There are other times in world history where we look back and people of goodwill can say where were the judges, where were the lawyers?""""","2025-01-23T19:56:27.682Z"
"richardbowles.bsky.social","1/ Something that I’m not seeing a whole lot of discussion on is the fact that Bishop Budde has had a previous significant experience with standing up to Trump. She was Episcopal bishop of Washington DC during the George Floyd protests…","2025-01-22T21:04:35.916Z"
"richardbowles.bsky.social","The """"he's not gonna listen to her"""" reactions are missing many points. Lots of other people are also hearing it. Lots of people can see him hearing it, then weigh what she's said with what he'll do. Lots of people can see her refusal to surrender these ancient teachings to the latest face of empire","2025-01-21T21:03:21.937Z"
"richardbowles.bsky.social","This matters. Not because I think Trump is capable of mercy or empathy towards these vulnerable groups. But because it is a public act of defiance. Contrast that with all these other powerful people in this country signaling nothing but appeasement and obedience.","2025-01-22T01:24:25.866Z"
"richardbowles.bsky.social","more nerve that billionaire media owners... turns out being super rich makes you a greedy coward: www.npr.org/2025/01/21/n...","2025-01-22T01:45:34.892Z"
