"user","post","date"
"richardbowles.bsky.social","Last week, Grok called for the extermination of the Jewish people and called himself MechaHitler. This week, the Department of Defense announced it was using Grok as an AI partner. In response, not a single Democratic member of Congress or progressive organization has left X.","2025-07-14T17:58:39.314Z"
"richardbowles.bsky.social","Trump’s deportation machine is targeting an overwhelmingly Christian immigrant + refugee population through unconstitutional abductions, placing them in camps where bibles are forbidden, & expelling them to countries where some will be tortured for their religious beliefs.","2025-07-14T17:47:37.627Z"
"richardbowles.bsky.social","at this rate don’t be surprised if the narrative becomes “stonewall was where brave nypd officers protected the city from rioting queers” before the year is out","2025-07-10T18:07:08.072Z"
"richardbowles.bsky.social","Those of us preaching on The Good Samaritan parable this Sunday have our hands full.","2025-07-09T21:13:02.385Z"
"richardbowles.bsky.social","Alright one final thread of the night: an absolutely deafening noise demo is taking place out in Pasadena outside two hotels where ICE agents are purportedly staying. You can hear the din from blocks away, it’s absolutely magnificent","2025-07-08T05:09:03.653Z"
"richardbowles.bsky.social","INCREDIBLE. Kids (in """"a summer day camp"""") were outside playing as federal immigration agents invaded the MacArthur Park in Los Angeles. Just out of words really ...","2025-07-07T20:55:40.049Z"
"richardbowles.bsky.social","🇷🇺🇷🇺🇷🇺🇷🇺","2025-07-04T22:23:12.158Z"
"richardbowles.bsky.social","I am grieving the barbarism that is going to unfurl from all this. People are going to die. Livelihoods gone. All to feed a corrupt kleptocracy. I see every day up close how different it is from the first time around. There are no guardrails. A disaster. I’m sorry we have to live through this.","2025-07-03T20:00:09.682Z"
"richardbowles.bsky.social","they're gonna pass this bill deep in the dark of night, while most Americans are sleeping aside from some of the hardest working folks who do tough jobs for little appreciation, whose lives will be most impacted by the cuts Republicans are about to make to pay for billionaire tax cuts.","2025-07-03T06:16:47.856Z"
"richardbowles.bsky.social","Viktor Orban banned pride events in Hungary, the people took it as a challenge and just had the largest pride march in their country's history.","2025-06-28T17:30:37.748Z"
"richardbowles.bsky.social","""""I'm not aware of a single instance of return fire. There's no enemy, no weapons."""" Palestinians and Human rights groups have been screaming this for weeks: the Israeli military is intentionally shooting at Palestinians at the Gaza """"aid centers."""" No paywall link: archive.is/rHhMU","2025-06-27T16:17:37.618Z"
"richardbowles.bsky.social","Brownshirt ICE rolled up to my local Home Depot today and got the F-off treatment. Shoutout to this woman because this is exactly how it’s done. No badge, face covered = F*ck all the way off. 📌 It’s on us citizens to stand up for our vulnerable brothers and sisters.","2025-06-23T23:21:25.926Z"
"richardbowles.bsky.social","I know there are mayors out there, including my own (ostensibly), who are serious about protecting their constituents from ICE, and this is a repeatable strategy that they can organize.","2025-06-23T03:55:31.768Z"
"richardbowles.bsky.social","It is good to remind people of good things during times of struggle, so that they are given hope and are reminded of the reason why we struggle. But this must be done carefully, because the reminders of good things must not become soporific distractions from the imperative of action.","2025-06-13T19:42:41.267Z"
"richardbowles.bsky.social","“Defense Secretary Pete Hegseth refused to say whether he would follow the courts if they ruled against President Donald Trump’s deployment of active-duty Marines to Los Angeles.”","2025-06-12T16:41:27.685Z"
"richardbowles.bsky.social","ngl this map of scheduled protests for this weekend is *wild*","2025-06-10T22:26:00.984Z"
"richardbowles.bsky.social","THE RULES OF ENGAGEMENT IN LOS ANGELES. Surely that sentence should slam everything down. Y'all. Y'ALL.","2025-06-10T23:28:16.025Z"
"richardbowles.bsky.social","Trump says anybody who protests the military parade on Sunday will be met with “very heavy force”","2025-06-10T16:47:27.985Z"
"richardbowles.bsky.social","Jason Carroll of @cnn.com was detained by LAPD while live on air and told to leave, all of which violates CA Penal Code 409.7. Their security WAS arrested, even though they are also protected by law as """"duly authorized representatives"""" of the media. I've been in touch with LAPD and Mayor's office.","2025-06-10T06:03:31.609Z"
"richardbowles.bsky.social","Fantastic","2025-06-09T19:29:51.567Z"
"richardbowles.bsky.social","Please watch this….","2025-06-08T13:48:35.847Z"
"richardbowles.bsky.social","This Pentecost, the Spirit of the Lord has rested over the heads of those protesting the regime’s ICE raids. God’s Presence is filling those who hunger for justice for the marginalized with the strength to march against oppression. May the protesters be protected. 1/2","2025-06-08T05:01:40.963Z"
"richardbowles.bsky.social","To be clear: Trump is dispatching the troops in response to protests *the Los Angeles Police Department* has described as peaceful","2025-06-08T04:01:46.803Z"
"richardbowles.bsky.social","Rise up!","2025-06-07T01:34:37.087Z"
"richardbowles.bsky.social","the countdown begins godspeed to the madleen 🙏❤️","2025-06-07T05:36:52.991Z"
"richardbowles.bsky.social","Oh, no biggie, just the President of the United States having a chuckle over D Day, suggesting that it was not a good day for Germany. Merz corrected him— actually, no, D-Day marks the LIBERATION of Germany from Nazi dictatorship. A good day. Sir, for the love of goddesses, READ A HISTORY BOOK.","2025-06-06T02:17:18.208Z"
"richardbowles.bsky.social","San Diego neighborhood makes ICE agents retreat","2025-06-02T21:29:26.661Z"
"richardbowles.bsky.social","Is this why we’ve been seeing so many masked, unidentified ICE agents? As of May 29, 2025, ICE has 635 active agreements in 40 states—deputizing local cops to act as ICE. DEMS: Hold hearings. Sanctioned or not, we need answers. ☎️ Call your Senators and Reps now: (202) 224-3121","2025-06-01T18:59:53.024Z"
"richardbowles.bsky.social","For four long years I was told not to call what’s coming our way fascism but here we are:","2025-05-31T15:12:07.517Z"
"richardbowles.bsky.social","GOP Sen. Joni Ernst responds to voters saying that cutting Medicaid will kill them: “Well, we all are going to die.”","2025-05-30T14:27:21.762Z"
"richardbowles.bsky.social","They are zip-tying children. They are zip-tying children. They are zip-tying children. Keep saying it. Make them defend it.","2025-05-30T13:50:23.471Z"
"richardbowles.bsky.social","The notion that private institutions need to toe the party line is so fundamentally un-American it is almost unbelievable","2025-05-28T15:04:44.886Z"
"richardbowles.bsky.social","Today, I was denied access to seeing my constituent, Mr. Kilmar Abrego Garcia. If there is nothing to hide, cut the crap. Let his lawyer and I check on him.","2025-05-26T19:32:05.580Z"
"richardbowles.bsky.social","Critical move","2025-05-25T02:05:30.685Z"
"richardbowles.bsky.social","As a reminder, she didn’t even run a red light, something DHS harped on as her disobeying US laws. The cops eventually admitted they pulled over the wrong car.","2025-05-23T14:39:16.840Z"
"richardbowles.bsky.social","we have now swung around from police militarization (cops looking identical to soldiers) to police chuddification (cops looking like half-drunk proud boys in downtown Portland circa 2019)","2025-05-23T05:03:02.543Z"
"richardbowles.bsky.social","I’m sorry to take us back to oral argument in the birthright citizenship case, but this was one of the most chilling parts of the argument.The SG would not commit to respecting decisions by federal circuit courts WITHIN THE CIRCUIT.Justice Barrett was so taken aback she even invoked Cooper v Aaron.","2025-05-20T19:08:57.276Z"
"richardbowles.bsky.social","Hurricane season starts June 1 and if you live in a Gulf state, you need to watch this. It’s worse than you might think. The few employees still left at FEMA admit: they are not prepared. Not enough staff. Not enough supplies. Not enough leadership. Plan accordingly.","2025-05-19T02:35:57.153Z"
"richardbowles.bsky.social","This is absolutely categorically an ethnic cleansing and sending people to Libya of all places is unconscionable.","2025-05-16T22:19:05.605Z"
"richardbowles.bsky.social","In other news, I continue to be baffled that McCartney doesn’t like the horn section on “The Long and Winding Road.” It’s the center of the cinnamon roll, Paul!","2025-05-13T19:54:31.093Z"
"richardbowles.bsky.social","This is insane. Republicans have inserted language into the budget reconciliation bill that would ban states from regulating AI in any capacity for 10 years. from @404media.co www.404media.co/republicans-...","2025-05-12T20:47:00.158Z"
"richardbowles.bsky.social","No matter how many times we say Fox News isn’t real news, it doesn’t matter—because their viewers believe it is. Watch: It shows exactly how they’re screwing all of us—you & me—because we’re stuck dealing with people who fall for disinformation. And their own viewers, because they believe the lies.","2025-05-11T00:42:02.000Z"
"richardbowles.bsky.social","WTH? Did I miss something?","2025-05-10T22:43:49.523Z"
"richardbowles.bsky.social","They’re falling for the wallet inspectors","2025-05-10T17:38:43.342Z"
"richardbowles.bsky.social","Just straight up uncut racism.","2025-05-10T18:29:27.954Z"
"richardbowles.bsky.social","The Trump administration is exploring plans to suspend habeas corpus rights for immigrants, one of the most fundamental protections in the Constitution.","2025-05-10T00:37:10.794Z"
"richardbowles.bsky.social","Wasn’t the first Chicago Pope Kate Turabian?","2025-05-08T18:20:36.240Z"
"richardbowles.bsky.social","A pretty delightful #TeslaTakedown.","2025-05-07T17:51:51.373Z"
"richardbowles.bsky.social","92 years ago today, the Nazis raided the Magnus Hirschfeld Institute for Sexuality, where the first study of trans people was conducted, and burned all of its contents. Fitting that today is also the day SCOTUS greenlights the project of the eradication of trans people from society in the US.","2025-05-06T19:08:31.030Z"
"richardbowles.bsky.social","Trump/MAGA denouncing the police killing of Ashli Babbitt (on Jan. 6, as justified as police deadly force can get) while defending the police killing of George Floyd (so clearly unjustified a jury found him guilty) is not hypocrisy. It's friend-enemy fascism. Important point from @jvl.bsky.social.","2025-05-05T18:00:27.764Z"
"richardbowles.bsky.social","Is it self defense yet? Or is it exactly what they said it was all along? Search all you want, but you will never find a defense for this.","2025-05-05T19:58:21.189Z"
"richardbowles.bsky.social","Just bringing this back for no reason at all","2025-05-04T17:58:27.887Z"
"richardbowles.bsky.social","Israel and the U.S. are starving Gaza to death. Israel and the U.S. are starving Gaza to death. Israel and the U.S. are starving Gaza to death. Israel and the U.S. are starving Gaza to death. Israel and the U.S. are starving Gaza to death. Israel and the U.S. are starving Gaza to death.","2025-05-03T11:30:41.831Z"
"richardbowles.bsky.social","A visual analysis shows the U.S. likely bombed a migrant detention center in Yemen on April 28. At least three U.S.-made GBU-39 bombs at the site of the attack, which killed 68 African migrants, according to the Houthis, a militant group that controls northern Yemen.","2025-05-03T20:09:29.682Z"
"richardbowles.bsky.social","Yesterday, a top Trump Administration official made an apparent threat to arrest me. Here’s my message to Wisconsinites. I encourage you to take a few minutes to watch. ⬇️","2025-05-02T17:05:59.849Z"
"richardbowles.bsky.social","🧵A dictator’s pain, the hurt that they themselves experience, is their self-inflicted egocentric alienation from the rest of humanity. Of course, the egocentrism itself originates from deep childhood trauma that compels them to expand their influence and power so that they have something to possess…","2025-05-02T06:06:47.594Z"
"richardbowles.bsky.social","""""After Judge Hannah Dugan's illegal arrest, Gov Tony Evers ordered Wisconsin state employees to limit cooperation with ICE unless a judicial warrant is presented The political stunt and attempted intimidation tactic by the Trump administration is backfiring..."""" - @dewforpolitics.bsky.social","2025-04-29T03:58:02.754Z"
"richardbowles.bsky.social","Pritzker: The reckoning is here. And now that this culture of timidity is on display, these same do-nothing Democrats want to blame our losses on the defense of Black people, trans kids, and immigrants, instead of on their own lack of guts and gumption.","2025-04-28T20:53:56.010Z"
"richardbowles.bsky.social","BREAKING: Police just surrounded Rev. William Barber, prominent activist and pastor, as he and others prayed in the U.S. Capitol Rontunda. Police then expelled everyone (including press!) from the Rotunda to (presumably) arrest them. I've covered protests here a lot. Never seen anything like it.","2025-04-28T17:59:35.467Z"
"richardbowles.bsky.social","www.nytimes.com/2025/04/25/w...","2025-04-25T21:26:18.429Z"
"richardbowles.bsky.social","Trans icon Miss Major was just denied entry on to a plane in Arkansas because her ID had an X gender marker on it.","2025-04-24T19:15:31.896Z"
"richardbowles.bsky.social","First RFK Jr says that people on the autism spectrum are useless eaters. And then he announces that the government is going to make a list of them, a “registry.”","2025-04-24T18:33:57.671Z"
"richardbowles.bsky.social","Remember the (false) hysterical squealing that Biden was only giving NC hurricane victims $750 because it was a red state","2025-04-22T22:13:11.503Z"
"richardbowles.bsky.social","I'm in Frisco where a """"Protect White Americans"""" rally is occurring. It is in response to a recent stabbing at a track meet, where a Black student, Karmelo Anthony, stabbed a white student, Austin Metcalf, after an altercation, per witnesses. Metcalf is now dead. This group wants Anthony convicted.","2025-04-19T16:09:39.964Z"
"richardbowles.bsky.social","1/ Oklahoma just passed a law stating that “Christ is King.” To be clear: this law is 1) a violation of the separation of church and state and 2) not Christian. It was passed by members of an entirely separate religion known today as Christian Nationalism…","2025-04-19T06:29:11.643Z"
"richardbowles.bsky.social","If Kilmar Abrego Garcia had only beaten Capitol police officers half to death with a Trump flag on his way into pissing on the halls on Congress while looking to hang a Vice President—he’d be free right now.","2025-04-17T04:09:42.820Z"
"richardbowles.bsky.social","The idea that the fascists cannot be defeated is the core of all fascist propaganda if you are spreading it you are spreading fascist propaganda it's as simple as that Moreover, ICE must be destroyed","2025-04-17T03:02:45.435Z"
"richardbowles.bsky.social","I can't emphasize enough that the most important thing journalists can do right now is publish exactly this kind of article","2025-04-16T02:30:50.687Z"
"richardbowles.bsky.social","1/ I think that it was, perhaps, two weeks ago when I read articles and think pieces from scholars explaining that the moment of Constitutional Crisis will be if and when the regime refuses to accept the authority of the courts...","2025-04-15T01:07:07.863Z"
"richardbowles.bsky.social","Donald Trump wants corrupt foreign leaders to build concentration camps to hold US citizens in an attempt to circumvent the constitution and rule of law.","2025-04-14T17:39:10.835Z"
"richardbowles.bsky.social","Some horrifying details on the white supremacist book purge at the Naval Academy library: www.nytimes.com/2025/04/11/u...","2025-04-12T14:01:37.131Z"
"richardbowles.bsky.social","AOC: We must acknowledge the terrifying moment we are in right now. What we are hearing and seeing with our own eyes is, in fact, happening. We are watching our neighbors, students, and friends being fired, targeted, and disappeared. It is real.","2025-04-12T22:29:18.466Z"
"richardbowles.bsky.social","BREAKING: 36k people showed up in LA for Bernie and AOC’s rally. In the off year. Americans are pissed — and anyone ignoring that is making a big mistake.","2025-04-12T22:11:25.970Z"
"richardbowles.bsky.social","“We simply cannot sustain the work on our own at current levels or in current form,” Archbishop Timothy Broglio wrote, explaining that the conference would look for alternatives to support migrants already admitted to the U.S.","2025-04-08T13:00:36.789Z"
"richardbowles.bsky.social","I was honored to learn more about the rise and danger of Christian Nationalism from Rev. Fleck and to have her lead one of our Pub Theology discussions. May the Lord grant her strength and wisdom in her new role!","2025-04-07T18:15:44.466Z"
"richardbowles.bsky.social","Just a legal historian here reminding everyone that “high crimes and misdemeanors” do not need to be felonies. They can include political abuses and stupidity, like, hypothetically, destroying the economy and wiping out people’s savings in 3 days.","2025-04-07T04:54:23.503Z"
"richardbowles.bsky.social","it's lovely for people to get out and great for movements to be inclusive but dictators don't bow down to signs","2025-04-06T00:33:45.618Z"
"richardbowles.bsky.social","Murphy: """"The vast majority of Republicans, their number one priority is Trump seizing power, and the Trump family and the MAGA universe holding power forever ... with the exception of maybe 20 Republicans in the Senate, the GOP inside Congress is done with democracy.""""","2025-04-05T00:19:00.858Z"
"richardbowles.bsky.social","The United States is currently a country where you can be kidnapped by secret police and shipped off to a slave labour concentration camp without ever being charged with a crime or getting a chance to argue your case in front of a judge. If you think it can't happen to you, why do you think that?","2025-04-04T22:50:14.859Z"
"richardbowles.bsky.social","When calculating the cost, don't forget lost alliances and global leadership. D³","2025-04-03T18:18:13.904Z"
"richardbowles.bsky.social","This is the admin's goal: Taking """"gender identity"""" out of government language, so that the private sector feels pressure to take it out, too, and a future court will rule that actually it's not protected. www.semafor.com/article/02/2...","2025-04-03T16:54:41.617Z"
"richardbowles.bsky.social","Required reading. This will be on the test — because we’re living through the test right now.","2025-04-03T04:32:37.643Z"
"richardbowles.bsky.social","1/ I am accustomed to using the words “affirming” and “unaffirming” when referring to people who support same-sex relationships, and I think that the word “affirming” is fine for people who support us. But perhaps a more accurate word for the unaffirming stance is actually “to disregard.”","2025-04-03T03:46:20.470Z"
"richardbowles.bsky.social","Thurmond was the same age as Booker when he set the record Senator Cory Booker just broke. Thurmond was afforded a bathroom break and read from the encyclopedia. Booker held the floor the entire time and delivered a consistent, cogent speech for more than 24 hours. Incredible.","2025-04-01T23:43:39.950Z"
"richardbowles.bsky.social","Assigning Sen. Thurmond’s “longest filibuster” of the Civil Rights Act to the dustbin of history is a powerful part of the story. Because no matter what, that’s where they’re all going, no matter how hard they fight it. Men who fight the future are the most foolish of all men.","2025-04-01T22:03:55.325Z"
"richardbowles.bsky.social","What does the U.S. look like in five or ten years? I was asked to reflect on this question, alongside other scholars. In a stable democracy, the range of plausible outcomes should be narrow. But for America, it now includes complete democratic breakdown and full-blown authoritarian rule.","2025-03-31T13:41:13.459Z"
"richardbowles.bsky.social","there are those in this world with only evil in their soul","2025-03-31T06:27:31.898Z"
"richardbowles.bsky.social","The Trumpist regime is fighting for the restoration of white male domination at home and abroad - committed to the global struggle to entrench and a tiered system of participation defined by hierarchies of race, gender, and wealth - a declared enemy of pluralistic liberal democracy everywhere.","2025-03-29T16:00:11.968Z"
"richardbowles.bsky.social","Greenland says """"No thanks!""""","2025-03-29T03:25:34.907Z"
"richardbowles.bsky.social","Today I learned that a graduate student at the University of Minnesota was abducted by ICE yesterday. We need a rapid response from leaders at all levels on what we can do to protect everyone in our community. I will keep working on this issue and update as I learn more.","2025-03-28T22:59:23.528Z"
"richardbowles.bsky.social","This is a very important point. Breathlessly vague headlines and summaries of these executive orders created for the executive powers it does not have. This kind of press contributed to authoritarian regime change.","2025-03-27T17:54:06.348Z"
"richardbowles.bsky.social","In so far as it's a sign, it's a sign that elite academics enjoy mobility that 99% of their colleagues do not, given the absurdities of the academic labor market. If you wanted the """"direst sign of bad things to come,"""" that was probably when Mahmoud Khalil got detained.","2025-03-26T13:31:54.614Z"
"richardbowles.bsky.social","Unidentified men grabbing someone off the street and putting her in a car because she wrote an op-Ed. This as flatly authoritarian as anything we’ve seen in this country in a very long time.","2025-03-26T17:41:56.037Z"
"richardbowles.bsky.social","""""The report found that more civilians were killed in the first week of the Trump administration’s bombing campaign than were killed in the 12 months of US- UK strikes on Yemen that were conducted under the Biden administration from Jan 2024 to Jan 2025."""" The Signal chat was bad. This is worse:","2025-03-26T05:14:20.445Z"
"richardbowles.bsky.social","1/ I have been asked how, given the circumstances, I could have hope. We are witnessing the collapse of democracy, our nation has abandoned our allies in favor of alliances with dictatorships, the trans community is being erased from government recognition…","2025-03-24T20:32:18.520Z"
"richardbowles.bsky.social","This is it!! Listen to Billie! I struggled with this one because it's both true and not true at depending on who you are and how you are applying it. She explains it perfectly.","2025-03-23T17:25:12.920Z"
"richardbowles.bsky.social","Fair question.","2025-03-23T03:41:34.396Z"
"richardbowles.bsky.social","Everyone with a little bit of knowledge has long warned that the U.S. lacks the infrastructure for Trump’s forced mass deportations. Which leads to these cruel conditions, which is, of course, what the Trump admin and its supporters want to see as they think it deters “illegal” immigrants.","2025-03-22T16:57:45.873Z"
"richardbowles.bsky.social","We have arrived at the point where Iran’s supreme leader is critical of the Trump Admin’s record on civil liberties and human rights.","2025-03-22T00:59:52.389Z"
"richardbowles.bsky.social","""""Columbia agreed to ban masks, empower 36 campus police officers with new powers to arrest students and appoint a senior vice provost with broad authority to oversee the department of Middle East, South Asian and African Studies as well as the Center for Palestine Studies.""""","2025-03-21T21:11:09.497Z"
"richardbowles.bsky.social","This is insane","2025-03-21T01:18:20.059Z"
"richardbowles.bsky.social","Meta is an immoral, unethical company. Total trash.","2025-03-21T04:04:51.861Z"
"richardbowles.bsky.social","Ben Gvir is back as the second most powerful person in the Israeli government. Does Chuck Shumer want to tell me that it's """"vicious"""" to call him a genocidal maniac? That because Jews suffered genocide we should somehow pretend it's not what it is?","2025-03-20T09:57:55.195Z"
"richardbowles.bsky.social","The touchstone of most authoritarian regimes is not the kind of total control that most people feel in their day-to-day lives. It is that the regime is only selectively bound by law, producing constant low-grade anxiety as to whether, how, or against whom power will be exercised.","2025-03-18T15:43:16.660Z"
"richardbowles.bsky.social","1. Germany has issued a travel advisory for trans and GNC people who wish to travel to the United States. International Pride organization InterPride has done likewise. Travel may be dangerous with visa restrictions. The latest from S. Baum. Subscribe to support our journalism.","2025-03-16T20:43:41.834Z"
"richardbowles.bsky.social","Can't let Yosemite and Joshua Tree stand alone in their distress signals! Solidarity from the right coast.","2025-03-01T16:41:03.850Z"
"richardbowles.bsky.social","Hey look: fascism","2025-03-15T17:58:49.586Z"
"richardbowles.bsky.social","SETH MOULTON TELLING SCHUMER TO GET A SPINE. IMAGINE WHAT YOU HAVE TO DO TO MAKE THAT SENTENCE HAPPEN.","2025-03-14T04:16:37.629Z"
