"user","post","date"
"richardbowles.bsky.social","Don't panic. Take a deep breath and organize.","2025-01-21T18:43:13.305Z"
"richardbowles.bsky.social","The firehouse of executive orders is intentional. It is meant to overwhelm. It is meant to destabilize. But authoritarian control requires effort. It is brittle, and it breaks when stressed. Fuck the empire.","2025-01-21T16:46:41.644Z"
"richardbowles.bsky.social","You’re going to see a lot of familiar faces and banners and ideologies over the next four years, but this time they will have zero fear of social and legal consequences.","2025-01-20T17:42:31.688Z"
"richardbowles.bsky.social","“I’m different, I’m a rebel. I’m an outsider,” I say to the credulous journalist before repeating verbatim the beliefs and worldview of the president of the United States and every person with money and power in the world right now.","2025-01-18T20:22:35.176Z"
"richardbowles.bsky.social","Fellow white Christians, we must interrupt inhumane actions, peacefully yet forcefully. The danger is higher for others. Find those doing the work and do what they say. If they're going to punch down and harm the vulnerable among us. They gotta go through us. www.motherjones.com/politics/202...","2025-01-18T19:43:02.163Z"
"richardbowles.bsky.social","Honor his memory by doing something strange, unraveling a riddle within yourself, and working on your favorite projects.","2025-01-16T18:51:53.852Z"
"richardbowles.bsky.social","One of the most important exchanges in today’s hearing with Hegseth was when Senator Slotkin took over. If you watch any exchanges watch this one. He’s loyal to Trump and it’s so very clear here. youtu.be/iSVASHj_w2U?...","2025-01-14T21:49:45.851Z"
"richardbowles.bsky.social","There is a massive financial campaign behind Hegseth, targeting wavering Republicans. His team is also engaged in intimidating witnesses. One former employee decided not to testify after conservative newspapers identified her publicly.","2025-01-14T04:44:42.899Z"
"richardbowles.bsky.social","Hundreds of Mexican firefighters have arrived in Southern California to help combat the wildfires. Thank you, Mexico🇺🇸🇲🇽","2025-01-11T02:24:55.951Z"
"richardbowles.bsky.social","Article by Facebook's former head of elections integrity for political ads, Yaël Eisenstat, @yaeleisenstat.bsky.social :","2025-01-10T17:36:50.923Z"
"richardbowles.bsky.social","The New Testament authors did not imagine followers of Jesus having as much privilege as rich, white men have today. The rich can sow as much evil as they wont and force the marginalized to reap in their place.","2025-01-10T18:30:44.798Z"
"richardbowles.bsky.social","What the fuck?","2025-01-10T02:49:50.477Z"
"richardbowles.bsky.social","Teachers who have intentionally outed queer students should be intelligible for credential reciprocity with states which purport to actually protect queer students.","2025-01-09T03:22:06.138Z"
"richardbowles.bsky.social","1) Meta’s new content moderation policy is deeply dangerous and harmful. It not only permits the use of disinformation and bigotry against us but it openly attacks the LGBTQ+ community in its own wording.","2025-01-09T03:06:11.394Z"
"richardbowles.bsky.social","Occasional reminder that there’s no, “it’s too late, its over” for anthropogenic climate change. Every molecule of CO2 that doesn’t go into the atmosphere makes a difference. Preventing 0.1 degree of warming makes a difference. Every bit of climate resilience we build together makes a difference.","2025-01-09T01:18:00.797Z"
"richardbowles.bsky.social","If your pastor tells you to reject your queer kid, reject your pastor and find a new church.","2025-01-09T02:40:58.122Z"
"richardbowles.bsky.social","If you work at Meta and support LGBTQ+ people no you don't.","2025-01-08T02:38:39.056Z"
"richardbowles.bsky.social","US media casually discussing invading a sovereign nation by force to steal their rare earth minerals.","2025-01-07T18:17:24.113Z"
"richardbowles.bsky.social","Here are 10 Bible verses that emphasize the value of love over the law, the God-belovedness of all people, and the special affirmation of those who have been historically rejected as unclean or unholy. (2017)","2025-01-07T18:30:12.943Z"
"richardbowles.bsky.social","Trump ran on a platform as a peace candidate who would stop endless wars and would end the war in Ukraine in 24 hours; but in the last 24 hours conceded that was not going to happen, & he wants to invade Greenland & Panama, and wants to take over Canada through economic warfare.","2025-01-07T18:04:13.352Z"
"richardbowles.bsky.social","Meta is pure evil and deserves to be wiped off the face of the planet. They removed all restrictions on content targeting protected characteristics i.e. hate speech. Anyone working there is complicit. You are enabling this. You will have blood on your hands. www.wired.com/story/meta-i...","2025-01-07T19:10:13.059Z"
"richardbowles.bsky.social","the only phrase dems need for the next 4 years is “how does this lower egg prices” and i havent seen it once","2025-01-07T18:19:38.721Z"
"richardbowles.bsky.social","🚨🚨🚨🚨HOMEWORK🚨🚨🚨🚨 I think the Jack Smith draft report is finished. Write to Merrick Garland and ask him to release the Jack Smith report. You can do it here. Select “Messages to the Attorney General” from the drop down menu www.justice.gov/doj/webform/...","2025-01-07T02:50:25.190Z"
"richardbowles.bsky.social","They want us to memory hole tearing down the American flag to fly Trump’s.","2025-01-07T03:10:49.802Z"
"richardbowles.bsky.social","The spiritual discipline of allowing yourself to freak out at allies when they are blinded by privilege. Like, placing the demonstration of marginalized rage on a tier alongside centering prayer causing both parties to confront reality - the realities of queer anger and blind privilege.","2025-01-03T07:06:50.256Z"
"richardbowles.bsky.social","there's a particular type of progressive opportunism that's like """"yes, Mr Hitler1488 says that the Jews control the banks, but what his followers are really angry about is financial inequality and opaqueness! We can tap into that!"""" You can't. It's poisoned soil.","2024-12-31T15:34:14.057Z"
"richardbowles.bsky.social","1/2 Incredible speech by an Israeli MK and rabbi calling out other leaders in the Knesset for their genocidal mindsets about Palestinians. Honestly have not seen anything even close to this strong from an Israeli leader on either side of the aisle in a while.","2024-12-30T23:13:34.327Z"
"richardbowles.bsky.social","1) The Universe was on the threshold of a celestial shock. But it didn’t know it. How could it? That Emmanuel was about to break in, tear through the veil and make godself known in a pooping peeing puking baby. A homeless refugee fleeing from Herod the Great. God with us.","2024-12-25T03:51:03.800Z"
"richardbowles.bsky.social","THIS FLEW UNDER THE RADAR Members of the German neo-Nazi political group AfD plan to attend Trump’s inauguration. They’ve actively been engaging with U.S. conservatives & trying to capitalize on Trump’s momentum. Keep an eye on this, especially in light of Elon’s newly discovered support of AfD. 🧵","2024-12-23T22:27:27.273Z"
"richardbowles.bsky.social","We’re hearing a lot of this sort of thing lately and I don’t agree with it. Defending fundamental human rights is not a “distraction.” The big error is thinking that there a fixed quantity of political engagement, such that solidarity with one group means doing less on something else.","2024-12-23T18:53:21.137Z"
"richardbowles.bsky.social","“Every Herod will pass, every Caesar will fade, for Empires have an expiry date… and let us remember that it is the meek, not the powerful, who will inherit the earth.” --Rev. Munther Isaac Here’s the link to Munther’s Christmas sermon if you missed it: redletterchristians.org/2024/12/20/chr…","2024-12-22T20:29:12.151Z"
"richardbowles.bsky.social","1) The very first Scripture passage I ever memorized is 1 John 4:7-9: “Beloved, love one another for love is from God. He who loves is born of God and knows God. He who does not love does not know God, for God is love.” From an ethical standpoint, this makes sense.","2024-12-22T21:34:49.973Z"
"richardbowles.bsky.social","Choose 20 books that have stayed with you or influenced you. One book per day for 20 days, in no particular order. No explanations, no reviews, just covers. Day 12","2024-12-22T08:28:30.893Z"
"richardbowles.bsky.social","Choose 20 books that have stayed with you or influenced you. One book per day for 20 days, in no particular order. No explanations, no reviews, just covers. Day 11","2024-12-21T08:42:35.525Z"
"richardbowles.bsky.social","Wrote about Russell Vought, the “post-constitutional” Right, and the radical “counter-revolution” they seek to unleash","2024-12-20T18:23:20.774Z"
"richardbowles.bsky.social","Choose 20 books that have stayed with you or influenced you. One book per day for 20 days, in no particular order. No explanations, no reviews, just covers. Day 10","2024-12-20T08:49:43.148Z"
"richardbowles.bsky.social","Good God.","2024-12-20T04:45:00.950Z"
"richardbowles.bsky.social","Posted last year by @karenod.bsky.social and well worth another shout:","2024-12-16T18:42:08.976Z"
"richardbowles.bsky.social","Choose 20 books that have stayed with you or influenced you. One book per day for 20 days, in no particular order. No explanations, no reviews, just covers. Day 9","2024-12-16T08:59:49.235Z"
"richardbowles.bsky.social","Lots of good examples out there right now for how the “polarization” concept is useful if you want to sound serious by lamenting the state of American politics but don’t understand or deliberately want to obscure the fact that the major threat to democracy is a radicalizing Right.","2024-12-12T22:41:10.339Z"
"richardbowles.bsky.social","This is five years old but still poignant. We cannot pretend to be elevated above the fray, bereft of a “side.” We are long past “savvy.”","2024-12-12T19:22:43.621Z"
"richardbowles.bsky.social","Choose 20 books that have stayed with you or influenced you. One book per day for 20 days, in no particular order. No explanations, no reviews, just covers. Day 8","2024-12-12T09:26:21.751Z"
"richardbowles.bsky.social","This is huge. An entire faith-based movement, the Sanctuary Movement and, more recently, the New Sanctuary Movement, was built around this policy, where houses of worship allow undocumented immigrants at risk of deportation to live in their facilities until their deportation order is dropped.","2024-12-11T18:24:45.368Z"
"richardbowles.bsky.social","They are going to target Blue cities and blue states first for three reasons one to dominate blue states, two this is not as much about deportations as it is deploying a de facto police state and three they want to collapse blue states economies to try and change the election math for governors.","2024-12-10T05:07:18.990Z"
"richardbowles.bsky.social","1. I obtained the new middle school sex education curriculum that was just approved by the Florida Department of Education. It excludes almost all information about sex. Follow this thread for details.","2024-12-10T17:17:54.151Z"
"richardbowles.bsky.social","The party that elected a rapist has removed all mention of consent from its sex ed curriculum in Florida. I wonder why.","2024-12-10T19:28:45.091Z"
"richardbowles.bsky.social","Choose 20 books that have stayed with you or influenced you. One book per day for 20 days, in no particular order. No explanations, no reviews, just covers. Day 7","2024-12-10T07:52:20.194Z"
"richardbowles.bsky.social","Pope Francis and advocates add to pleas for Biden to commute the death sentences of the 40 prisoners on federal death row Pope encourages prayers for people with death sentences as pressure grows for Biden to act before Trump takes office www.theguardian.com/us-news/2024...","2024-12-10T06:54:44.205Z"
"richardbowles.bsky.social","Churches must prepare to help the vulnerable against this fascist tide","2024-12-10T00:29:57.622Z"
"richardbowles.bsky.social","From the very beginning, one of the more scandalous aspects of the Word of Christ is its universal implications. The Good News is offensive not for who it excludes, but for who it includes. There is hope, peace, joy, and love to be found in a Bigger God.","2024-12-09T14:45:18.890Z"
"richardbowles.bsky.social","""""God our Father and Mother, / when it feels you are / beyond the limits of our longing, / come, bring us home.""""","2024-12-10T00:00:02.176Z"
"richardbowles.bsky.social","Choose 20 books that have stayed with you or influenced you. One book per day for 20 days, in no particular order. No explanations, no reviews, just covers. Day 6","2024-12-08T07:49:23.036Z"
"richardbowles.bsky.social","1. Anyone who follows me knows that I am, shall we say, a big believer in hiring more religion reporters. But I wanted to take a minute to detail just one of the reasons I say that, like, all the time. More to the point: let’s pull back the curtain to explain what this kind of work looks like.","2024-12-07T23:48:54.163Z"
"richardbowles.bsky.social","Choose 20 books that have stayed with you or influenced you. One book per day for 20 days, in no particular order. No explanations, no reviews, just covers. Day 5","2024-12-07T20:47:11.490Z"
"richardbowles.bsky.social","Choose 20 books that have stayed with you or influenced you. One book per day for 20 days, in no particular order. No explanations, no reviews, just covers. Day 4","2024-12-06T08:29:39.536Z"
"richardbowles.bsky.social","RBC PAC’s $20 million last-minute spending spree boosting Trump on abortion was one of the most brazen stunt campaigns in recent memory, designed to evade basic transparency rules. Turns out it was 100% funded by Elon Musk. @rollingstone.com.web.brid.gy www.rollingstone.com/politics/pol...","2024-12-06T01:33:39.497Z"
"richardbowles.bsky.social","Our democracy was bought by a manbaby with a ketamine addiction.","2024-12-06T04:14:45.901Z"
"richardbowles.bsky.social","Just want to point out that, though he’s not on Bluesky, my cover photo is by a fabulous queer artist named Andrew Freshour and you should check him out. www.andrewfreshour.com","2024-12-05T00:29:27.119Z"
"richardbowles.bsky.social","The churches, that have remained Christian churches, face a responsibility: to become an alternative community to the authoritarian regime fast approaching. We must be completely separate from the nationalists, ministering to the world through our co-suffering love in the name of Jesus Christ.","2024-12-03T09:00:17.743Z"
"richardbowles.bsky.social","Choose 20 books that have stayed with you or influenced you. One book per day for 20 days, in no particular order. No explanations, no reviews, just covers. Day 3","2024-12-03T08:21:19.214Z"
"richardbowles.bsky.social","Choose 20 books that have stayed with you or influenced you. One book per day for 20 days, in no particular order. No explanations, no reviews, just covers. Day 2 💙📚 #booksky","2024-12-02T07:50:53.445Z"
"richardbowles.bsky.social","Now, President Biden needs to spend the next month using every bit of power he has to protect America and its people from the most corrupt and lawless cadre of ghouls on their way in.","2024-12-02T04:11:27.572Z"
"richardbowles.bsky.social","A cold quiet night. It feels like winter at last, though there is a sadness to the quiet. The insects are dead. Which is a perfectly normal cyclical thing to occur at this time. The rest of the summer creatures are sleeping.","2024-12-02T05:30:33.244Z"
"richardbowles.bsky.social","The churches, that have indeed remained Christian churches, face an enormous responsibility: to become an alternative community to the authoritarian regime we are fast approaching. We must be completely separate from the nationalists, ministering through co-suffering love and Good Trouble/News.","2024-12-02T04:50:52.196Z"
"richardbowles.bsky.social","Choose 20 books that have stayed with you or influenced you. One book per day for 20 days, in no particular order. No explanations, no reviews, just covers. Day 1 💙📚 #booksky","2024-12-01T06:33:34.331Z"
"richardbowles.bsky.social","I'm curious. During the campaign, fact-checkers routinely dinged the Harris campaign for calling Project 2025 Trump's playbook, saying """"Trump has denied this."""" Have any of them admitted how badly they got rolled in the most obvious of ways?","2024-11-30T05:51:00.980Z"
"richardbowles.bsky.social","Oh myyy","2024-11-30T00:23:43.604Z"
"richardbowles.bsky.social","Meet the Ideologue of the “Post-Constitutional” Right Russell Vought, one of the architects behind Project 2025, believes there is nothing left to conserve. He desires revolution – and to burn down the system. New piece:","2024-11-28T00:11:55.725Z"
"richardbowles.bsky.social","Luke and I got to meet Jaharia last week! An amazing drag artist, she competed on the latest season of Dragula, which is one of Luke and I’s favorite shows. Alt drag, particularly horror-themed drag, is one of my favorite expressions of queerness in that it queers that which is already queer.","2024-11-26T19:58:04.624Z"
"richardbowles.bsky.social","No, Rep. Crockett, that wasn't just a lesson. That was a PhD. God bless you for speaking h truth to them!","2024-11-25T05:04:50.696Z"
"richardbowles.bsky.social","Dear secretly affirming pastors, It’s way past time to stand up and speak out on behalf of your LGBTQ+ siblings. I know you have a lot to lose, I’ve been through it all, but it’s nothing compared to the queer lives being lost and further marginalized.","2024-11-19T02:09:44.899Z"
"richardbowles.bsky.social","We already knew this, but now we have proof: The Heritage Foundation, the architects of Project 2025, are key players in running Oklahoma public education. Our state is a testing ground for what MAGA intends for the whole nation. As a Christian pastor, it is my responsibility to resist this abuse.","2024-11-20T18:57:29.931Z"
"richardbowles.bsky.social","I just found out that Tony Campolo passed tonight. I never had a chance to meet him, but a whole lot of amazing theologians and activists who have had a tremendous influence on me knew him.","2024-11-20T06:28:07.467Z"
"richardbowles.bsky.social","So much of my trepidation is the knowledge of and bracing for the great tidal wave of responsibility thrust onto Christian shoulders to undermine the efforts of the Christian Nationalists. We must.","2024-11-19T05:48:35.367Z"
"richardbowles.bsky.social","When being frustrated trying to think of something to write to make some sense out of the world, Flitty is there to lift my spirit.","2024-11-16T05:55:26.013Z"
