"user","post","date"
"roseh0911.bsky.social","What it looks like when you're """"not conservative enough"""" for today's Republican Party","2025-02-25T15:08:07.533Z"
"roseh0911.bsky.social","NOW THATS A DEMOCRAT WIN!","2025-02-25T02:52:41.469Z"
"roseh0911.bsky.social","go.bsky.app/9bf7Eua @bluestormcomin1.bsky.social @sassysister27.bsky.social @fireeyebooks.bsky.social @connieblue25.bsky.social @sassy0210.bsky.social @savingdemocracy101.bsky.social @spoutiblegirl.bsky.social @jyc-jane.bsky.social @drowndworld-398.bsky.social @ktorz14.bsky.social","2025-02-25T03:04:10.518Z"
"roseh0911.bsky.social","The settlement here will not be for a trivial amount","2025-02-25T01:15:02.473Z"
"roseh0911.bsky.social","#Bluestormrising","2025-02-24T23:52:10.015Z"
"roseh0911.bsky.social","I support Dr. Borrenpohl. Resist. gofund.me/d4da0b0c","2025-02-24T20:09:52.215Z"
"roseh0911.bsky.social","It starts. This is absolutely disgusting, as are the ones sitting there silently. I hope she sues the shit out of the city for assault, and for violating her 1st Amendment rights. He called her a little girl?! She is Dr. Teresa Borrenpohl, and she is a damn hero! Freaking pigs. youtu.be/D76YwM9eg8E","2025-02-24T00:27:36.000Z"
"roseh0911.bsky.social","This is informative. Thanks","2025-02-23T23:40:38.232Z"
"roseh0911.bsky.social","Sounds like a threat to me! What a POS!","2025-02-24T16:16:51.374Z"
"roseh0911.bsky.social","🚨BREAKING: Federal Court issues TRO blocking the Department of Education and OPM from disclosing personal information to DOGE. Visit www.democracydocket.com for breaking democracy news.","2025-02-24T14:17:04.032Z"
"roseh0911.bsky.social","Tonight!!!! 👇👇👇","2025-02-24T12:20:46.466Z"
"roseh0911.bsky.social","Snowflake MAGA in their feels again.","2025-02-24T01:57:50.767Z"
"roseh0911.bsky.social","Good morning. The dance, whatever that means to you, is worth fighting for. “During the darkest days of the AIDS crisis, we buried our friends in the morning, protested in the afternoon and danced all night. The dance kept us in the fight because it was the dance we were fighting for.","2025-02-24T11:52:15.407Z"
"roseh0911.bsky.social","HOLY SHIT, the Philadelphia Eagles decided to REJECT the invitation to the White House, so I guess I'm an Eagles fan now. FLY, EAGLES FLY! 🦅💪","2025-02-24T07:49:48.913Z"
"roseh0911.bsky.social","go.bsky.app/HrPZq32 Thanks @pdc23.bsky.social","2025-02-23T21:20:02.965Z"
"roseh0911.bsky.social","go.bsky.app/Gec8Umxthank you @halostarmusic.bsky.social 💙🌀🐾","2025-02-22T20:29:43.709Z"
"roseh0911.bsky.social","✨STRONGER TOGETHER✨ @markhamillofficial.bsky.social appreciation list! 💙 > 👣 all > 🔄 @gatesz.bsky.social @cooltxchick.bsky.social @queenief.bsky.social @ppaattii.bsky.social @produkshun.bsky.social @pnwking.bsky.social @azkellyk.bsky.social @filosia.bsky.social @pete-1972.bsky.social 💙🫂","2025-02-22T13:04:50.392Z"
"roseh0911.bsky.social","Happy #Caturday friends 👋 If you want to meet more friends please drop a 💙 If you haven’t been boosted lately please comment boost if you are a follower of mine. Repost #BlueStormBoosts","2025-02-22T13:17:32.306Z"
"roseh0911.bsky.social","I will use every tool at my disposal to protect this country from Trump. I will litigate to defend voting rights until there are no cases left to bring. I will speak out against authoritarianism until my last breath. I will not back down. I will not bow or scrape. I will never obey.","2025-02-22T00:05:52.701Z"
"roseh0911.bsky.social","Governor Janet Mills wasn't having Trump's bullshit today at the White House. youtu.be/yEmXfX_4hgo?...","2025-02-21T20:23:59.687Z"
"roseh0911.bsky.social","Dear business owners that voted for Trump, You could have had $50K in capital and a robust SBA. Instead, DOGE is cancelling all your government contracts and putting you out of business so he can have the contracts for himself.","2025-02-20T17:38:02.810Z"
"roseh0911.bsky.social","I try to keep the language on here… PG… but in this case i can’t. You, Trump, are a traitorous piece of shit","2025-02-19T18:27:00.009Z"
"roseh0911.bsky.social","Russia launched an unprovoked full-scale invasion of Ukraine in February of 2022. Since then, thousands of Ukrainians have perished. Entire towns and cities reduced to rubble. It will take them decades to recover, if at all. For Trump to casually flip the narrative via tweet is beyond disgusting.","2025-02-20T11:50:04.166Z"
"roseh0911.bsky.social","Our Jasmine, fighting every day. She speaks for us all. www.youtube.com/watch?v=KA1V...","2025-02-19T20:17:48.597Z"
"roseh0911.bsky.social","Acosta: He is, essentially, a part-time president who has delegated the presidency to Elon Musk. And the question folks are going to have to start asking—and I think they already are—is: What the hell did we vote for here?","2025-02-19T21:41:47.469Z"
"roseh0911.bsky.social","Acosta: When Trump was out there on the campaign trail, he said, ‘On day one, I’m going to start lowering prices in this country.’ That hasn’t happened. And what is he doing? He’s going to the Super Bowl. He’s going to the Daytona 500. It’s like he’s on the StubHub Rapid Rewards program.","2025-02-19T21:39:14.025Z"
"roseh0911.bsky.social","Donald Trump is a clear and present danger to the entire free world.","2025-02-19T23:40:57.459Z"
"roseh0911.bsky.social","Ultimately you're going to do a lot better with compliance with court orders if there's a consequence","2025-02-19T21:23:54.034Z"
"roseh0911.bsky.social","It's because after Reagan shellacked the Democratic Party in 1980, they didn't just lose the election, they lost their spine and have been looking for it ever since. Want to see what spine looks like? 👇Start Here👇 #BeRelentless","2025-02-20T13:19:41.243Z"
"roseh0911.bsky.social","🗣️ @aoc.bsky.social out fighting for the people & federal workers: “Every day our job is to wake up and say ‘what can I do today?’ — There is no act too small. Every action matters.” 🇺🇸","2025-02-20T03:36:35.021Z"
"roseh0911.bsky.social","Crockett: He went from being the dork that was jumping around on stage to allegedly being this amazing genius that's gonna save a country he wasn't born in, and one that maybe he doesn't agree w/the idea of a democratic republic, considering the fact he may have been more on the side of apartheid.","2025-02-20T00:03:07.319Z"
"roseh0911.bsky.social","A Wednesday evening pack of my favorite blue friends with great posts and news sources! 🩵💙🦋🦋","2025-02-20T01:17:16.089Z"
"roseh0911.bsky.social","I don't and won't respect the office of the president. He tried to kill me and my coworkers. Ill never forgive or respect him 🖕🏽 you Donald.","2025-02-20T02:58:48.022Z"
"roseh0911.bsky.social","Fuck Putin. Fuck trump. I stand with Ukraine 🇺🇦🇺🇸.","2025-02-19T19:00:42.053Z"
"roseh0911.bsky.social","President Volodymyr Zelenskyy is not a dictator. He is a champion of democracy, freedom and truth.","2025-02-20T00:00:07.939Z"
"roseh0911.bsky.social","European Parliament member 👇🏽","2025-02-19T19:18:35.617Z"
"roseh0911.bsky.social","I'm rolling out my SECOND starter pack. I hope you'll join me to follow this group, along with following my first pack (linked in my next post.) go.bsky.app/TbJMrnk","2025-02-19T17:53:28.018Z"
"roseh0911.bsky.social","NEW: A letter from an anonymous federal worker. Please read and share: www.muellershewrote.com/p/letter-fro...","2025-02-19T02:00:47.145Z"
"roseh0911.bsky.social","✨ SUNDAY AFTERPARTY ✨ After another great super party yesterday, it's now time for a good AFTER-PARTY 💫 Wishing everyone a wonderful week. Keep supporting each other and keep resisting 👊🏼💪🏼 Please 💙 > 👣 all > 🔄 🙏🏼🌹 #StrongerTogether 🫂 #UnitedBlue 💙 #ResistanceReborn 💥 go.bsky.app/3gRjxfr","2025-02-17T13:21:31.276Z"
"roseh0911.bsky.social","Jim Acosta: I think the AP should consider whether or not to sue the administration… and the rest of the press corps should start seriously considering whether it’s worth sending everyone into the Oval Office, onto Air Force One, or into the briefing room.","2025-02-18T21:00:54.199Z"
"roseh0911.bsky.social","🚨BREAKING: @democracyforward.org files emergency lawsuit to halt DOGE from taking taxpayer data at the IRS. Visit Democracy Docket for full coverage. www.democracydocket.com","2025-02-18T14:43:14.023Z"
"roseh0911.bsky.social","Whatever else emerges in time about the Delta crash in Canada, one thing is certain: the importance & amazing professionalism of flight attendants who safely evacuated the plane in a matter of seconds.","2025-02-18T15:05:33.416Z"
"roseh0911.bsky.social","There was one Roman Emperor that really reminds me of this administration. Caligula. He was erratic and cruel. He declared himself a living god, He punished anyone who criticized him, He lived a debauched lifestyle, and he drained the Roman treasury.","2025-02-18T07:14:32.058Z"
"roseh0911.bsky.social","Defense Secretary Pete Hegseth’s overseas trip started with heckling from military families. That turned out to be one the best moments of his excursion.","2025-02-18T14:05:09.141Z"
"roseh0911.bsky.social","Here are the GOP members of the Senate Finance Committee--consider going to their LOCAL office this week and exhorting them to figure out why DOGE is in your financial records.","2025-02-18T15:02:00.742Z"
"roseh0911.bsky.social","theintercept.com/2025/02/17/e...","2025-02-18T03:07:20.414Z"
"roseh0911.bsky.social","Planes didn't crash when this guy ran things.","2025-02-18T04:11:51.959Z"
"roseh0911.bsky.social","It's really this simple, folks.","2025-02-18T12:34:38.162Z"
"roseh0911.bsky.social","Go ahead. Let the people see you for what you are.","2025-02-18T03:54:44.834Z"
"roseh0911.bsky.social","DC Good Trouble @dcglobal.bsky.social dropping a great new Starter Pack go.bsky.app/581PdhB","2025-02-17T23:42:55.039Z"
"roseh0911.bsky.social","This is much more believable than the bullshit story Dimwit Donnie is telling us.","2025-02-17T17:28:09.703Z"
"roseh0911.bsky.social","Speaking truth to power.","2025-02-17T22:12:31.698Z"
"roseh0911.bsky.social","Measles high infection rate is the reason we have not yet been able to eradicate it. That rate means you need a very high vaccination rate to prevent outbreaks. It is possible, but not with current levels of institutional distrust.","2025-02-17T14:49:07.452Z"
"roseh0911.bsky.social","My name is Peter Morley. I live on fixed income. I’ve Lupus/chronicillnesses/disabilities & SUBSIST on Social Security Disability for 18 years. I've survived cancer 2x & currently recovering from surgery. I DEPEND on MEDICARE/MEDICAID/SNAP. I’ll NEVER GIVE UP fighting for ALL until my last breath.🙏💜","2025-02-17T20:06:48.224Z"
"roseh0911.bsky.social","so far going anti-woke leads to less money and planes falling out of the sky","2025-02-17T21:08:13.918Z"
"roseh0911.bsky.social","Defense Secretary reframing not paying his taxes as a weaponization of government is a pretty good distillation of where things are","2025-02-17T20:09:48.857Z"
"roseh0911.bsky.social","President's Day march against Trump and Musk in NYC","2025-02-17T19:53:43.146Z"
"roseh0911.bsky.social","Annoy the hell out of them folks 😉 Daily....","2025-02-17T17:01:58.649Z"
"roseh0911.bsky.social","The resignations from New York City’s government are eviscerating the DOJ‘s rationale for dismissing the criminal case against Adams.","2025-02-17T18:12:05.332Z"
"roseh0911.bsky.social","Musk just posted a photo on X that supposedly showed migrants with axes and knives taking over a hospital, but the photo turned out to be a screen shot from the movie Dark Knight Rises.","2025-02-17T19:19:06.611Z"
"roseh0911.bsky.social","This cause is close to my heart - please sign: sign.moveon.org/petitions/bl...","2025-02-17T20:53:55.594Z"
"roseh0911.bsky.social","@juliusgoat.bsky.social","2025-02-17T20:02:57.063Z"
"roseh0911.bsky.social","I’m begging Democrats to stop talking about tax breaks for billionaires and the price of eggs! They are firing Air Traffic Controllers, stranding Americans in hostile countries, and getting ready to download our data from the IRS. No one is sitting around thinking “I’m worried about the deficit!”","2025-02-17T15:07:38.522Z"
"roseh0911.bsky.social","What's this you say about censorship, Elon? Just today, Twitter hit famed political cartoonist Mike Luckovich with an account violation and REMOVED this """"free speech"""" from your own platform.","2025-02-17T02:27:16.918Z"
"roseh0911.bsky.social","📍#Washington // Nationwide protests TODAY MONDAY, Feb. 17th, #NoKingsDay. We the people are pissed! Find a protest at > events.pol-rev.com 🇺🇸 Where will we see you? #50501movement #FiftyFiftyOne #BuildTheResistance #PoliticalRevolution #NoKings #VoicesOfFlorida #VoicesUnheard @polrev.bsky.social","2025-02-17T14:14:10.628Z"
"roseh0911.bsky.social","Happy Presidents' Day to the two best presidents of my lifetime. 💕","2025-02-17T13:59:48.916Z"
"roseh0911.bsky.social","The flying public needs answers. How many FAA personnel were just fired? What positions? And why?","2025-02-17T14:12:56.945Z"
"roseh0911.bsky.social","As @petebuttigieg.bsky.social wrote on another platform: “The flying public needs answers. How many FAA personnel were just fired? What positions? And why?”","2025-02-17T13:58:33.846Z"
"roseh0911.bsky.social","We remember Alexey Navalny on the one year anniversary of his “death“. This patriot has given us a peak into America’s possible future if we don’t take things into our own hands- Before it’s too late. #LetFreedomRing 🇺🇸","2025-02-17T01:21:17.226Z"
"roseh0911.bsky.social","Eww to WaPo, but certainly interesting. We need as much info as possible.","2025-02-17T14:05:50.783Z"
"roseh0911.bsky.social","""""The death of expertise is really about the rise of two social ills: narcissism and resentment."""" -- @radiofreetom.bsky.social","2025-02-17T12:46:47.903Z"
"roseh0911.bsky.social","Less than 1% of government spending went to foreign aid.","2025-02-17T00:05:48.527Z"
"roseh0911.bsky.social","I'm going to post this video every day so we never forget what Trump did","2025-02-17T12:32:53.226Z"
"roseh0911.bsky.social","Under Trump our ONLY “ally” will be Russia. NATO will find a new world leader, and would NOT come to our aid if we were attacked. Hegseth doesn’t know how to stop drinking, let alone stop an incoming nuclear warhead.","2025-02-17T13:05:15.642Z"
"roseh0911.bsky.social","I do it for me.","2025-02-17T11:47:13.541Z"
"roseh0911.bsky.social","Heather Cox Richardson: Vance claims that the equal rights central to democracy undermine nations by treating women and racial, religious, and gender minorities as equal to white Christian men. They want to see government to reinforce traditional religious and patriarchal values.🤬","2025-02-17T13:45:38.684Z"
"roseh0911.bsky.social","If you do not have the stomach for this fight, then get the Hell out of office and let someone younger have the damn job.","2025-02-17T01:03:31.775Z"
"roseh0911.bsky.social","The #1 reported reason people avoid doctor’s appointments is because they’re afraid of finding out they have a serious illness. If you have that fear, that’s normal and you’re not alone. Also remember, there is basically no serious illness that isn’t less serious if you catch it sooner.","2025-02-17T04:14:10.652Z"
"roseh0911.bsky.social","It will always be surreal to see Russian assets in our government.","2025-02-17T13:21:58.254Z"
"roseh0911.bsky.social","Oh my fucking God.","2025-02-17T00:14:17.564Z"
"roseh0911.bsky.social","Exactly 😡","2025-02-17T02:08:38.178Z"
"roseh0911.bsky.social","Last night @60minutes.bsky.social opened an otherwise superb segment on Germany’s approach to online hate speech by saying “in the U.S., most of what’s said on online [social media] platforms is protected by the First Amendment.” No.The First Amend protects us against GOVT infringements on speech.","2025-02-17T12:56:08.450Z"
"roseh0911.bsky.social","FFS! 𝙏𝙝𝙚𝙮 are firing National Park Service EMTs There will be no one to attend to you if you get attacked by wildlife, fall while climbing/hiking, have a skiing incident, are drowning, break a leg/arm/your neck, etc Alex Wilds is one such federal employee. Read what he's saying","2025-02-17T12:56:43.917Z"
"roseh0911.bsky.social","America is exposed. No one will share intelligence. It’s only a matter of time before disaster.","2025-02-17T12:52:23.507Z"
"roseh0911.bsky.social","let me strongly recommend the flu shot to whoever hasn't gotten one for this season. i just had a *terrible* bout with the flu that almost certainly would have been WAY worse had i not been vaccinated","2025-02-17T13:07:41.599Z"
"roseh0911.bsky.social","Have you heard about the SAVE Act? It's the newest effort at voter suppression by the House GOP & it's important for all of us. If you're a married woman or someone who doesn't have their birth certificate/passport handy, you're especially going to want to see this. open.substack.com/pub/joycevan...","2025-02-17T02:47:57.974Z"
"roseh0911.bsky.social","February 16, 2025","2025-02-17T05:11:23.047Z"
"roseh0911.bsky.social","It’s FUKKKING tiring already!","2025-02-16T21:29:44.989Z"
"roseh0911.bsky.social","The time to BEWARE, has passed…👇 Hasn’t it?! Unfortunately. For. Everyone.","2025-02-17T08:55:03.015Z"
"roseh0911.bsky.social","Build the wall! Around DOGE!","2025-02-17T01:37:17.153Z"
"roseh0911.bsky.social","The incompetent engineers at SpaceX who create aircraft that explode after takeoff are going to take control of the FAA to make aviation safer. Nothing to see. Everything is fine. GIRL, TAKE GREYHOUND!!!","2025-02-17T04:23:43.962Z"
"roseh0911.bsky.social","Musk & Trump fired 1000 VA staff including Veterans Crisis Line. Musk & Trump are firing Veterans across federal agencies That’s confirmed If you have been directly or indirectly impacted by these purges, please This link will send you to the VoteVets Tip Sheet act.votevets.org/signup/25021...","2025-02-17T11:04:35.048Z"
"roseh0911.bsky.social","open.substack.com/pub/thebrie1...","2025-02-17T11:04:40.074Z"
"roseh0911.bsky.social","NEW VIDEO: While the country is riveted by what Donald Trump and Elon Musk are doing in Washington, DC, the Republican Party continues to attack voting rights in the states and in the United States Supreme Court. Watch and share. www.youtube.com/watch?v=qLuW...","2025-02-16T12:38:52.604Z"
"roseh0911.bsky.social","We need Pete.","2025-02-16T01:00:50.812Z"
"roseh0911.bsky.social","✨SUPER SUNDAY PARTY✨ So happy to post today's SUPER SUNDAY starter pack! Have a quick look 👀 to see if you're in it, and if not, remember: there is, always another chance! Thanks for partying. Please check out the other hosts as well! Please 💙 > 👣 all > 🔄 #StrongerTogether 🫂 go.bsky.app/bDr2qr","2025-02-16T21:17:05.681Z"
"roseh0911.bsky.social","Fact check: nearly 70 percent of US money for Ukraine actually went to US defense industry to replenish the stocks of OLD stuff that went to Ukraine to use. Much of which we would have paid to destroy as their lifespan expired.","2025-02-16T16:55:24.890Z"
"roseh0911.bsky.social","Money talks","2025-02-16T18:21:05.525Z"
"roseh0911.bsky.social","Letters went out to federal workers this morning stating they were fired due to poor performance. However, all employees had been rated as “exceptional” performers by their supervisors. Please keep these records and pursue wrongful termination claims. Let the lawsuits begin.","2025-02-16T21:28:26.786Z"
"roseh0911.bsky.social","Listen up, you star-spangled dipshits… because while you were telling me to “cry harder” for the bazillionth time today cuz I have the nerve to care about kids with cancer… THEY “ACCIDENTALLY” FIRED THE PEOPLE WHO OVERSEE OUR NUCLEAR STOCKPILE. Wake the fuck up dumbfucks.","2025-02-16T20:47:00.797Z"
"roseh0911.bsky.social","Well said.","2025-02-16T18:24:49.403Z"
"roseh0911.bsky.social","Here’s a better peace plan for Ukraine. “Russia, you’ve already sustained twice as many casualties as the US did in ww2. Leave Ukraine or suffer four times more, and collapse as a country in the process” Done","2025-02-16T16:47:54.598Z"
"roseh0911.bsky.social","He’s right again.","2025-02-16T00:51:14.223Z"
"roseh0911.bsky.social","Wish I could travel back two decades in time to tell myself that the guy who was then head of the Republican National Committee is now doing more to fight back against a Republican president than most Democrats.","2025-02-15T22:06:02.024Z"
"roseh0911.bsky.social","Hearing that the DOGE chaos hurricane is hitting HUD soon, and the plan is to devastate federal housing funding. Let's be clear: this would cause a cascade of catastrophic impacts nationwide, shutting down housing and dumping families into the street.","2025-02-16T02:06:23.172Z"
"roseh0911.bsky.social","His team can't do math in Cobol It's an education and experience issue when you hire script kiddies to do financial analysis on systems coded in antiquated languages","2025-02-16T13:22:31.134Z"
"roseh0911.bsky.social","Another lie 🤥","2025-02-16T13:17:50.450Z"
"roseh0911.bsky.social","“My take on what we need to do right now is this: stay informed about what’s happening nationally, and get engaged locally.” joycevance.substack.com/p/the-courts...","2025-02-16T13:46:02.102Z"
"roseh0911.bsky.social","💫SUPER SUNDAY PARTY💫 Special SUPER booster party tonight, hosted by some fabulous booster-friends 👀🎁 Want to meet new friends too & gain MANY #resister followers? Drop a 💙/💬/🖼️ If I haven’t boosted you in a pack recently AND you follow me, comment """"pack"""" to be included 🫂 🔄 for broader reach 😉","2025-02-16T13:57:32.939Z"
"roseh0911.bsky.social","Friends, May we never forget that while negotiations,statements, addresses and the rest of the (undoubtedly important) diplomacy track are happening,exhausted #Ukrainian men &women in military uniform are holding back evil on the frontlines. Without them,there would be no diplomacy track at all.","2025-02-16T07:42:02.293Z"
"roseh0911.bsky.social","A reminder. Democracy Docket's entire website is free. Democracy Dockets daily and weekly newsletters are sent to subscribers for free. The only thing Democracy Docket charges for is its premium content. That is how it is able to provide all of the free content to over 350,000 people every day.","2025-02-16T02:34:45.544Z"
"roseh0911.bsky.social","They listen with their profits","2025-02-16T12:11:15.940Z"
"roseh0911.bsky.social","It's the Gulf of Mexico, and it will always be the Gulf of Mexico, no matter how many deluded fucks try to rename it, and I truly hope all other news organizations stand in solidarity with Associated Press against the insane bullshit.","2025-02-16T05:48:39.144Z"
"roseh0911.bsky.social","I absolutely agree 💯💯 🎯","2025-02-16T12:02:05.068Z"
"roseh0911.bsky.social","Nazism worked in a country of 80 million people. It won’t work in a country of 335 million. We were shocked in 2016. In 2025. We are pissed.","2025-02-16T11:18:49.928Z"
"roseh0911.bsky.social","Correct. This is a President of the United States declaring himself a dictator. And instead of Americans understanding that we’re now under imminent threat of martial law and tyranny, we’ll get a month of think pieces about what the President of the United States meant by his UNAMBIGUOUS statement.","2025-02-16T13:02:44.523Z"
"roseh0911.bsky.social","We are nearing a precipice.","2025-02-16T01:36:56.695Z"
"roseh0911.bsky.social","From an FDA probationary employee: the firings are coming from outside the agency without cause and with zero input from supervisors (as promised.) More firings expected between now and Tuesday. Do not open the termination email before you download your documents and performance evals.","2025-02-16T05:42:32.148Z"
"roseh0911.bsky.social","Hell of a time to kill the Epidemic Intelligence Service. This measles outbreak has already spread across the New Mexico border into Hobbs","2025-02-15T15:21:00.573Z"
"roseh0911.bsky.social","Thank you President Biden!","2025-02-16T13:42:04.600Z"
"roseh0911.bsky.social","Let’s be really clear here. This administration isn’t cutting funds to help Americans. It’s cutting funds to put into wealthy pockets. If you don’t see this yet. You are an utter moron. The kind of moron they like. Because you are their target audience.","2025-02-16T11:22:41.834Z"
"roseh0911.bsky.social","This is one of the best Starter Packs on Bluesky! Thank you for including me @theoriginaltomjoad.bsky.social! Great Resisters to follow! go.bsky.app/MbgyD5G","2025-02-16T00:34:19.980Z"
"roseh0911.bsky.social","My office is hearing reports that the Trump administration’s purges include firing veterans who have served our country for years. Our veterans deserve better. If you've been impacted, call congress: (202) 224-3121 And share your story: www.veterans.senate.gov/contact-rank...","2025-02-15T23:37:40.193Z"
"roseh0911.bsky.social","He's preparing to do something really bad.","2025-02-15T20:23:53.903Z"
"roseh0911.bsky.social","Gustofferson @gustofferson.bsky.social Saturday Starter Pack go.bsky.app/SVFZYUf","2025-02-15T20:42:22.439Z"
"roseh0911.bsky.social","Dear Leaders of the Free World, We're not with these maniacs. Sincerely, Decent Americans johnpavlovitz.substack.com/p/dear-world...","2025-02-15T22:08:16.478Z"
"roseh0911.bsky.social","@raianfitrebelscum.bsky.social great first edition Starter Pack!!! go.bsky.app/5mXM57G","2025-02-15T20:46:41.421Z"
"roseh0911.bsky.social","Mike Pence just reposted an old article he wrote about the limitations on the powers of a president. For some reason. Here is a part of it.","2025-02-15T22:50:22.712Z"
