"user","post","date"
"roseh0911.bsky.social","Protect PA Governor Josh Shapiro at all costs! He fought for free and fair elections, won in court 43 times against this regime…AND he helped strip Giuliani of his law license! If you live in PA MAKE SURE YOU ARE REGISTERED AND VOTE BLUE! Take a listen!👇🏼 #pagovjoshshapiro #pinks","2026-02-17T21:37:49.703Z"
"roseh0911.bsky.social","This is shocking. File this away in the """"in case Trump sends someone to kill me"""" file. It would be on brand with The Don, to pull a mob move. Another one. Others who ended up mysteriously dead: Jefrey Epstein Ivana Trump Thomas Crooks Oleg Erovinkin Jessica Aber I'm sure there are more. 🤷‍♂️","2026-02-14T15:12:43.240Z"
"roseh0911.bsky.social","Verify your registration Pay attention to any new changes!!! If we still have mail in ballots, take inside & get hand stamped cancellation! The post office has changed when the postmark the mai!","2026-02-17T12:49:07.658Z"
"roseh0911.bsky.social","Bipartisan governors just said NO to Trump's partisan stunt—NGA cancels White House meet after he tried inviting Republicans only. Even GOP chair Stitt called it out: We represent ALL 50 states, not just his club. This is leadership standing firm against division. Who's next? #sheshed","2026-02-17T05:20:36.864Z"
"roseh0911.bsky.social","CBS Censored This Interview With Talarico & Colbert. FCC Went After 'The View.' They Cancelled Jimmy Kimmel Till We Cancelled THEM Back. We Will Neuter tЯump's Madness When We ALL VOTE Together This Time.","2026-02-17T12:45:55.482Z"
"roseh0911.bsky.social","NEWS: CBS blocked Stephen Colbert from airing an interview with Texas State Rep. James Talarico and ordered him not to mention the cancellation over fear of FCC chair Brendan Carr. Colbert went on air and revealed it anyway. “He was supposed to be here, but… 1/","2026-02-17T09:39:00.355Z"
"roseh0911.bsky.social","Right-wing Heritage Foundation’s own data shows fewer than 100 noncitizens voted since 1982 (!!!) This is not a real problem. “The SAVE ACT is a Trojan horse to nationalize elections”: open.substack.com/pub/thiswill...","2026-02-16T15:23:58.555Z"
"roseh0911.bsky.social","Never","2026-02-16T22:17:21.955Z"
"roseh0911.bsky.social","WHY in the ACTUAL FUCK would the United States GOVERNMENT NEED A WAREHOUSE 7 FOOTBALL FIELDS BIG FOR ‘PEOPLE’ if The ‘PEOPLE’ are going BACK to their countries? WHY? BC its not for ‘Immigrants’! Its for ALL DISSENTERSand NATURALIZED CITIZENS!Anyone ‘Italian’’Irish’’Native’ Mexican-American! WAKE UP!","2026-01-31T04:26:46.599Z"
"roseh0911.bsky.social","$4 BILLION — So corrupt. There is no debating this. Anyone who says otherwise is telling on themselves.","2026-02-16T17:47:21.726Z"
"roseh0911.bsky.social","""""In Pennsylvania, the Shapiro administration is warning federal officials that it will not issue required state permits for two planned immigration detention centers..."""" www.spotlightpa.org/berks/2026/0...","2026-02-16T18:52:20.943Z"
"roseh0911.bsky.social","Don't ever forget the packed hospital ICUs and refrigerator trucks used for temporary morgues. www.facebook.com/share/r/1Brh...","2026-02-16T16:08:49.489Z"
"roseh0911.bsky.social","@politicussarah.bsky.social discusses DOJ's attacks on American citizens' right to privacy and 1st amendment rights, issuing """"administrative"""" subpoenas to tech companies to identify critics of ICE and Trump's regime. open.substack.com/pub/politicu...","2026-02-16T16:10:12.046Z"
"roseh0911.bsky.social","The MAGA GOP. That’s what the hell is wrong with this country.","2026-02-16T02:18:43.249Z"
"roseh0911.bsky.social","We need to remove and convict the Epstein Class. go.bsky.app/PFuqeu5","2026-02-16T15:49:59.583Z"
"roseh0911.bsky.social","🎯","2026-02-16T13:39:48.838Z"
"roseh0911.bsky.social","Just as he promised, he’s destroying NATO which has kept Europe & the US together for 80 years. This will open the doors for Russia to wage war or ultimatums on Europe for takeover & China to take Taiwan & eventually Japan along with other islands. To officially give presidents the dictator title.","2026-02-14T07:58:36.976Z"
"roseh0911.bsky.social","I Fully Endorse This Statement….","2026-02-14T15:10:48.900Z"
"roseh0911.bsky.social","He needs to go","2026-02-14T16:22:30.827Z"
"roseh0911.bsky.social","apnews.com/article/amaz...","2026-02-14T16:09:51.006Z"
"roseh0911.bsky.social","Trump has to go NOW. You can’t suffer 3 more years of him. He’s already done so much damage. He’s done nothing right, nothing!Not sure how you remove him. 25th? He’s unfit for office. Everyone knows it.","2026-02-14T10:01:48.619Z"
"roseh0911.bsky.social","Happy Valentine’s Day to my wonderful husband John! You've always been my best friend and the one who keeps me smiling. 💕","2026-02-14T16:09:53.991Z"
"roseh0911.bsky.social","I know his lies don't make the news anymore but we must keep trying to get the message out! He talks bollocks!","2026-02-14T08:55:26.997Z"
"roseh0911.bsky.social","It’s Now or Never cause we Can’t be what we can’t see Can’t speak when we can’t breath Can’t dance if we don’t move our feet It’s a blur tryin to keep pace Days are running like they’re in a race Can’t move if we’re in our own way. So what are we waiting for… go.bsky.app/A3xy1jY","2026-02-14T08:41:58.308Z"
"roseh0911.bsky.social","""""This is our America too and by God that flag will go back up - for every flag you take down - 10 more will go up!""""--New York State Assemblyman Tony Simone abc7ny.com/post/officia...","2026-02-13T11:12:01.077Z"
"roseh0911.bsky.social","The most corrupt pro-Putin president in US history endorses the most corrupt pro-Putin leader in Europe.","2026-02-13T15:49:16.659Z"
"roseh0911.bsky.social","BREAKING: Donald Trump is reportedly terrified that Europeans will subpoena all his bank records from the European banks he had to use after every US bank blacklisted him following decades of rampant fraud, and the Europeans will see all his suspicious transactions with Epstein...","2026-02-13T03:57:12.307Z"
"roseh0911.bsky.social","Hey there Pam Bondi if you have nothing to hide why were you tracking what congressmen were searching on the Epstein files? Why uh…. Why…. Why so nervous?","2026-02-13T14:27:43.159Z"
"roseh0911.bsky.social","Believe and protect the victims","2026-02-13T14:31:21.057Z"
"roseh0911.bsky.social","There are so many fucked up things with the current administration that it's hard to focus on one but this recent move is basically a death sentence for the planet. I've been involved with more boots on the ground actions over the years than I can count and this really bums me out.","2026-02-13T06:06:29.719Z"
"roseh0911.bsky.social","Walz: """"The federal government needs to pay for what they broke here. There's going to be accountability on things that happened, but one of them is the incredible and immense cost borne by the people of this state. The federal government needs to be responsible.""""","2026-02-12T16:04:00.539Z"
"roseh0911.bsky.social","Your American health chief, folks! 🙃🇺🇸","2026-02-12T20:17:42.632Z"
"roseh0911.bsky.social","1️⃣ Video clip timestamps: 8:15-8:54 of youtu.be/p-SLMw-yOkE?... 2️⃣ Transcript:","2026-02-11T22:20:51.107Z"
"roseh0911.bsky.social","Fuentes, Thiel/Vance, Musk, and pretty much ALL of the White Male Billionaires HATE women. Thiel (who owns Vance outright) says that the U.S. first went wrong when they gave women the right to vote.","2026-02-12T18:21:28.246Z"
"roseh0911.bsky.social","it really can't be said enough that this is a person who has dined with the president of the united states","2026-02-12T16:11:02.067Z"
"roseh0911.bsky.social","We know they’ve been spying on everyone, but to put it so out in the open is just 🤯.","2026-02-12T02:15:17.179Z"
"roseh0911.bsky.social","“If Trump’s malignant nationalism ends up helping cost Republicans the House, right in the heart of blue-collar Michigan, it would mark a fitting conclusion to this utter farce—and bring it to a close with a satisfying dose of poetic justice.”","2026-02-12T17:40:04.719Z"
"roseh0911.bsky.social","Pam Bondi did not even turn around to look at the women, then girls, who were victimized by Jeffrey Epstein, Ghislaine Maxwell, and many other perpetrators. She turned her back on them. The whole world saw it. This is who she is. Dwell on this.","2026-02-12T18:14:57.439Z"
"roseh0911.bsky.social","Ilia State University personnel and students hold a substantial spontaneous protest at the University, even closing the road on Chavchavadze Avenue (penalty risk: jail). 1/2 #TerrorinGeorgia #GeorgiaProtests 📷 @IliaMovement24","2026-02-12T17:05:50.680Z"
"roseh0911.bsky.social","go.bsky.app/EMkv2My","2026-02-12T18:08:03.248Z"
"roseh0911.bsky.social","She is convinced that there will be no more power transfer. If that doesn't shake you up, I don't know what will....","2026-02-12T15:25:35.811Z"
"roseh0911.bsky.social","The SAVE act is part of the MEGA Act.","2026-02-11T00:52:37.835Z"
"roseh0911.bsky.social","open.substack.com/pub/heatherd...","2026-02-12T14:37:15.719Z"
"roseh0911.bsky.social","Katie Johnson sued Donald Trump for rарing her when she was 13-year-old at Jeffrey Epstein’s NY home, but was forced to drop the case after receiving multiple death threats. Her sworn court testimony was public recorded. Trump didn't sue her for defamation. Watch: x.com/censoredhuma...","2026-02-08T09:59:35.224Z"
"roseh0911.bsky.social","Just do it already. Reveal the names","2026-02-09T21:53:21.925Z"
"roseh0911.bsky.social","———YEEEEEEESS———- FINALLY SOMEONE SAYS IT OUT LOUD!!! YOU GO CONGRESSWOMEN JASMINE CROCKETT!!!! NOW LETS HOPE SOME PEEPS HAVE THE B___L’s!!! TO BACK YOU UP FOR ONCE! #TruthWarriors #StrongerTogether #BlueCrew Just here to spread the good word! Oh and #ReleaseTheEpsteinFiles FFS","2026-02-09T21:50:50.463Z"
"roseh0911.bsky.social","Crockett: """"The US is falling apart, partially bc he's allowing for killings in the street, but also bc we have a 34 count convicted felon being shielded from any type of accountability as it relates to a child sex trafficking ring. I don't understand why we're pretending any of this is normal.""""","2026-02-09T15:55:51.295Z"
"roseh0911.bsky.social","Monday Connections! #5 @roseh0911.bsky.social @sswilliams.bsky.social @speechgal96.bsky.social @alaskagal.bsky.social @listifications.app @koolkaryn.bsky.social @docmurphydog.bsky.social @softtail65.bsky.social @stosh44.bsky.social @pauleric70.bsky.social @rebelb1ue.bsky.social 🚫Adds","2026-02-09T21:00:04.554Z"
"roseh0911.bsky.social","🚨 BREAKING After the Ghislaine Maxwell deposition, Rep. Melanie Stansbury warned: • 30+ Trump-linked names in the files • Active U.S. government cover-up • Donald Trump at the center Do not let this disappear.","2026-02-09T19:17:25.757Z"
"roseh0911.bsky.social","Clemency is for remorse, not leverage. Ghislaine Maxwell was convicted for enabling the systematic abuse of children. Prison is accountability, not a bargaining chip. Justice doesn’t negotiate with traffickers—it protects victims and draws a hard line.","2026-02-09T20:12:57.007Z"
"roseh0911.bsky.social","Thank you Annette! 💖 @mlipsitt.bsky.social @corrina.sheshed.rocks @bandroll.bsky.social @thewelshtaffy24.bsky.social @mrsdeborahlynn.bsky.social @catbutlersr.bsky.social @halostarmusic.bsky.social @tntnle.bsky.social @bostonbitch.bsky.social @alicekobres.bsky.social","2026-02-09T17:58:36.409Z"
"roseh0911.bsky.social","@fireeyebooks.bsky.social @athenagabriel.bsky.social @markfry.bsky.social @absentmindedprof3.bsky.social @catbutlersr.bsky.social @mrsdeborahlynn.bsky.social @allenbarkus1102.bsky.social @pattyger.bsky.social @alisonwhite3.bsky.social @lyndapole.bsky.social @chelseaman.bsky.social 💙🕊️","2026-02-09T17:35:27.816Z"
"roseh0911.bsky.social","REP. STEIL: Some Dems demands put at risk the safety of members of law enforcement CNBC: You mean like taking off their masks and having a badge that shows who they are? STEIL: Well, they're known to their supervisors CNBC: No other law enforcement officials in the US are allowed to wear masks","2026-02-09T13:32:42.812Z"
"roseh0911.bsky.social","I hope he deleted it to boycott Meta products. www.aol.com/articles/bad...","2026-02-09T16:23:01.395Z"
"roseh0911.bsky.social","Believe what they say","2026-02-09T16:22:37.719Z"
"roseh0911.bsky.social","🔴 When is America and the WORLD going to finally have the courage to say out loud, what is in plain sight?? THIS ONE is a Russian asset. A 'Manchurian Candidate'. 🤷🏻‍♂️ I mean ... There is no such President anywhere in the world, like this. 👇🏼","2026-02-08T18:29:42.062Z"
"roseh0911.bsky.social","Good Morning Everyone Thank you #BADBUNNY Bonito Antonio Martinez Ocasio This son of a truck driver and a school teacher stood on the world's biggest stage and said """"God Bless America"""" and then he named them all Then the FLAGS came THE ONLY THING MORE POWERFUL THAN HATE IS LOVE Thank you","2026-02-09T14:16:58.621Z"
"roseh0911.bsky.social","Monica's Place Superbowl Sunday Starter Pack! 🌊💙🌊 I've gathered a collection of great Resisters & Democracy Defenders to introduce you to tonight! #ResistersUnite 🤝 #StrongerTogether 💪 Check it out! 👀 Vet 🧐, Follow 👣 & Repost! 🔄 Ty! 🥰 go.bsky.app/E4AUPqi","2026-02-09T02:32:34.021Z"
"roseh0911.bsky.social","go.bsky.app/GFrogMv","2026-02-09T06:50:46.923Z"
"roseh0911.bsky.social","Call your Representatives and Senators and demand they vote AGAINST the SAVE Act, which would deny millions of U.S. citizens their right to vote, including ANYONE who changed their name in marriage so it no longer matches their birth certificate. Save Your Right to VOTE! go.bsky.app/6uoNa1h","2026-02-09T14:23:25.976Z"
"roseh0911.bsky.social","The Melting Pot go.bsky.app/J96bXjg","2026-02-09T15:41:48.283Z"
"roseh0911.bsky.social","He’s a criminal who can’t resist returning to the scene of the crime.","2026-02-07T13:57:15.709Z"
"roseh0911.bsky.social","""""The new law forbids counties and local law enforcement from contracting with ICE. It mandates that public bodies terminate any existing immigration detention agreements and prohibits the use of public property for federal civil immigration detention..."""" kfoxtv.com/news/local/n...","2026-02-07T21:05:45.883Z"
"roseh0911.bsky.social","go.bsky.app/FmEUJQe","2026-02-07T23:07:40.068Z"
"roseh0911.bsky.social","In California:","2026-02-07T15:30:45.685Z"
"roseh0911.bsky.social","Now that’s a President.","2026-02-07T16:10:45.050Z"
"roseh0911.bsky.social","Here are some incredibly kind and thoughtful people. Give them a follow. They are some of the best on Bluesky! 💙 @bluestormcomin1.bsky.social @markymark757.bsky.social @allie-froglegs.bsky.social @noofieninja.bsky.social @docmurphydog.bsky.social @atoth99.bsky.social @abbarsha.bsky.social","2026-02-07T15:37:01.270Z"
"roseh0911.bsky.social","Barack Obama went to Columbia and Harvard University. Michelle Obama went to Princeton and Harvard University. Donald Trump went to Epstein's Island.","2026-02-07T02:58:53.501Z"
"roseh0911.bsky.social","They’ve already written their plan to take away the voting machines to ensure ‘scrutiny’ and fairness. It will come as no surprise when Trump wins the midterms with a landslide! He’ll get 18 holes-in-one in Bedminster by the weekend too!","2026-02-07T08:28:06.919Z"
"roseh0911.bsky.social","Despite dismal reviews, audiences supposedly turned out for """"Melania."""" Except... the Military Religious Freedom Foundation says they have reports from bases around the world of military members being """"pressured"""" to see it. The group's president said people are scared. #USDemocracy #Voices4Victory","2026-02-07T14:49:26.304Z"
"roseh0911.bsky.social","Name them shame them","2026-02-05T14:30:19.969Z"
"roseh0911.bsky.social","Racist garbage continues to emanate from this President and his White House.","2026-02-06T23:48:54.196Z"
"roseh0911.bsky.social","Thousands sing to ICE agents in powerful protest: “It’s okay to change your mind” www.lgbtqnation.com/2026/02/quic...","2026-02-07T14:42:07.886Z"
"roseh0911.bsky.social","Peggy Noonan: """"(L)osing the one major newspaper left in the great nation’s capital—during a time of the easy abuse of standards and traditions...—is more than a Jeffersonian nightmare, it is a kind of sin. The kind history doesn’t easily forgive."""" www.wsj.com/opinion/a-la...","2026-02-07T14:42:09.331Z"
"roseh0911.bsky.social","690FB 💙👣 Vetted RESISTERS🦋🎗️🇺🇸 @rogerzenaf.bsky.social @rogue576.bsky.social @roseh0911.bsky.social @rosered23.bsky.social @rosesarentred.bsky.social @rozaneathome.bsky.social @rufusking76.bsky.social @ryantpozzi.bsky.social @sabirdxb.bsky.social @teeshasmom2.bsky.social 💙 🔁","2026-02-07T12:09:25.505Z"
"roseh0911.bsky.social","Gov. Josh Shapiro blasted U.S. Immigration and Customs Enforcement (ICE) Friday for buying a Berks County warehouse that may be used to detain people.","2026-02-06T20:03:12.881Z"
"roseh0911.bsky.social","Just like Trump saying I wish Maxwell well.","2026-02-05T13:48:46.061Z"
"roseh0911.bsky.social","@annettebeebe.bsky.social Ty @cathyhadenough.bsky.social @putawomanincharge.bsky.social @ebisback.bsky.social @timlee57.bsky.social @cotol17.bsky.social @merien.com @simsart.bsky.social @roseh0911.bsky.social @rnko.bsky.social @floatallboats.bsky.social @annettebeebe.bsky.social","2026-02-06T11:11:08.289Z"
"roseh0911.bsky.social","GETTEM FRANCE. FUCK HIM UP GOOD","2026-02-06T00:58:42.742Z"
"roseh0911.bsky.social","JD Vance was just ruthlessly booed at the Olympics during the Opening Ceremony when he was shown on the screen. But you would never know by watching the broadcast on NBC.","2026-02-06T21:59:25.443Z"
"roseh0911.bsky.social","He lied at the National Prayer Breakfast to take credit for a prisoner freed who was actually freed during Obama. You heard that right — Lying 🤥 at 🤥 a 🤥 prayer 🤥 breakfast 🤥 www.cnn.com/2026/02/06/p...","2026-02-06T21:43:51.225Z"
"roseh0911.bsky.social","Evil, Goebbel reincarnate","2026-02-04T20:16:45.732Z"
"roseh0911.bsky.social","Over 30 people, that we know of, from the Epstein files, are in the Trump administration! Where is the outrage?","2026-02-04T19:56:36.575Z"
"roseh0911.bsky.social","For those keeping score at home:","2026-02-04T15:48:13.835Z"
"roseh0911.bsky.social","He’s the stupid people’s President.","2026-02-04T19:53:56.883Z"
"roseh0911.bsky.social","Not acceptable, where are our representatives","2026-02-04T20:07:34.889Z"
"roseh0911.bsky.social","Heads are going to explode 💥 Cato Institute just nuked the lie. Immigrants have cut U.S. deficits by $14.5 TRILLION since 1994, slashing the national debt by a third. All that “immigrants are bleeding us dry” noise? Absolute bullshit. 1/3","2026-02-04T19:08:08.937Z"
"roseh0911.bsky.social","Judge rules members of Congress can inspect all ICE detention centers without appointment. """"...DHS Sec. Kristi Noem re-implemented a notice requirement…..[which] required 7-days’ warning for visits to [ICE] facilities... funded exclusively by the ‘Big Beautiful Bill’..."""" thehill.com/regulation/c...","2026-02-04T01:19:17.814Z"
"roseh0911.bsky.social","Jay Kuo - The Shadow Hearings On ICE Are A Compelling Must Watch open.substack.com/pub/statusku...","2026-02-04T20:05:23.549Z"
"roseh0911.bsky.social","Casar holds a 3 minute and 26 second moment of silence to represent the time in which DHS officers let Renee Good bleed out after she was shot","2026-02-03T22:37:25.954Z"
"roseh0911.bsky.social","This Homan presser is completely incoherent. He started by announcing a drawdown of 700 agents (good!) but then pivoted to whining about """"rhetoric"""" (bad) and suggested there will be more bloodshed if it doesn't stop (grim). Not clear to me that anything is actually changing on the ground here in MN.","2026-02-04T14:21:19.135Z"
"roseh0911.bsky.social","#Space #NASA #Artemis From #FloridaToday: """"NASA's last major test of the #Artemis2 moon rocket did not go as hoped ... As a result, the launch was pushed back to no earlier than March 6."""" www.floridatoday.com/story/tech/s...","2026-02-03T15:10:44.676Z"
"roseh0911.bsky.social","One of the things bothering me about how people are responding to the Epstein files is that there are tons of conspiracies being created and spread about what’s in them, rather than people just believing the victims like they could have been doing for years now","2026-02-03T15:10:25.613Z"
"roseh0911.bsky.social","😬","2026-02-03T15:46:59.600Z"
"roseh0911.bsky.social","the president is psychotic. in reality, his numbers are near all-time lows.","2026-02-03T03:03:44.380Z"
"roseh0911.bsky.social","Last night, GOP Senator Rand Paul went on national TV to flatly reject DHS's lies about the Pretti execution: """"My advice to [DHS], if they're watching: If you come into [our hearing] and try to justify that [Pretti] was assaulting a police officer, that cannot be acceptable.""""","2026-02-02T13:20:55.661Z"
"roseh0911.bsky.social","Swalwell: Nobody wants to perform there. Everyone who had been booked is now canceling since this guy put his name on it. I think he’s trying to save himself the humiliation of no one wanting to perform there or go there.","2026-02-02T23:37:49.177Z"
"roseh0911.bsky.social","Bad Bunny delivers his acceptance speech after winning Album of the Year at the #GRAMMYs.","2026-02-02T05:29:21.729Z"
"roseh0911.bsky.social","Sunday Connections! #1 @rexwilson.bsky.social @mike-lowe.bsky.social @listifications.app @megardener.bsky.social @kimstm.bsky.social @docmurphydog.bsky.social @arumar108.bsky.social @roseh0911.bsky.social @ebisback.bsky.social @nirvana1978.bsky.social @portlandken.bsky.social 🚫Adds","2026-02-01T18:49:01.532Z"
"roseh0911.bsky.social","“We are Humans and We are Americans “ go.bsky.app/TWum18S","2026-02-02T15:56:51.748Z"
"roseh0911.bsky.social","NEW: This isn't about """"training."""" The two agents who murdered Alex Pretti - Jesus Ochoa and Raymundo Gutierrez - have been with Border Patrol for 8 and 12 years respectively. You can't reform CBP. Abolish ICE/CBP. www.propublica.org/article/alex...","2026-02-01T21:26:19.512Z"
"roseh0911.bsky.social","GOP Rep. Thomas Massie: “How will we know if this bill has been successful? We will know when rich men are being perp walked in handcuffs to the jail. Until then, this is still a coverup.” #EpsteinFiles","2026-02-01T20:17:57.235Z"
"roseh0911.bsky.social","The DOJ just took down pages with detailed descriptions of Trump engaged in child rape and other pedophilia. We don't know if they have been corroborated, but we already know this DOJ will deny everything on behalf of their client.","2026-01-30T19:35:00.831Z"
"roseh0911.bsky.social","Make America MAGA Free 2026","2026-01-31T20:44:06.976Z"
"roseh0911.bsky.social","The Boss has spoken!","2026-01-31T09:42:15.924Z"
"roseh0911.bsky.social","Here is BRETT RATNER, the scumbag director for the film """"Melania """" ... All cozy with Epstein and an unidentified teenage child #EpsteinFiles SO MANY VILE SCUMBAGS and this one a friend of PEDO POTUS and his """"SweetPea"""" wife as Ghislaine Maxwell likes to call her We Stand With the Victims","2026-01-31T19:02:06.144Z"
"roseh0911.bsky.social","""""Mr. Bovino[*] complained that Mr. Rosen had been unreachable for portions of the weekend because of Shabbat."""" """"Mr. Bovino[*] …used the term 'chosen people' in a mocking way, according to the people with knowledge of the call. ...","2026-01-31T20:06:10.193Z"
"roseh0911.bsky.social","go.bsky.app/6tTXcTT","2026-01-31T03:44:14.216Z"
"roseh0911.bsky.social","Tell me he’s Putin’s puppet without telling me he’s Putin’s puppet.","2026-01-30T17:26:12.694Z"
"roseh0911.bsky.social","So this administration has charged an independent Black journalist reporting in Minnesota but not two white agents who murdered two citizens","2026-01-30T14:31:06.119Z"
"roseh0911.bsky.social","Tillis says he will continue to oppose any of Trump’s nominees to the Fed due to Trump’s sham criminal investigation into Fed Chair Jerome Powell","2026-01-30T13:56:27.586Z"
"roseh0911.bsky.social","Independent journalist Georgia Fort was also arrested by federal agents earlier for reporting on the church protest in Minneapolis. She was live streaming when agents arrived to take her into custody.","2026-01-30T14:10:25.351Z"
"roseh0911.bsky.social","We did not properly punish the confederates. We did not properly punish the insurrectionists on January 6th. We have to punish ICE. They can’t be allowed to slink back into their communities quietly. Expose them. Arrest them. Convict them. Imprison them.","2026-01-29T20:28:50.781Z"
"roseh0911.bsky.social","No arrests of the ICE thugs who murdered Alex Pretti, Renee Good, or Keith Porter. No arrests of anyone in the Epstein Files. But they arrested Don Lemon because of his journalism.","2026-01-30T13:44:54.578Z"
"roseh0911.bsky.social","Nothing says “save the children” like tear-gassing a preschool.","2026-01-30T12:59:03.435Z"
"roseh0911.bsky.social","ABOLISH ICE!","2026-01-29T23:27:43.243Z"
"roseh0911.bsky.social","#DefundICE #AbolishICE ICE OUT NOW!!!!","2026-01-29T23:24:44.414Z"
"roseh0911.bsky.social","From this moment forward (and before, but clearly now): -If you work for ICE. -If you vote for money for ICE. You are complicit. This is the gestapo. You're on the wrong side. You can't pretend not to know.","2026-01-24T17:07:01.389Z"
"roseh0911.bsky.social","Hoooooly shiitake…","2026-01-29T04:16:45.015Z"
"roseh0911.bsky.social","Thank you, Bruce. #Pinks #ProudBlue #MomSky youtu.be/GDaPdpwA4Iw","2026-01-29T23:22:20.123Z"
