"user","post","date"
"roseh0911.bsky.social","When President Clinton banned assault rifles in 1994, mass shootings dropped by 43%. After Republicans let the ban expire in 2004, they increased by 243% — please don’t tell me bans don’t work, because I don’t want to hear it.","2025-09-10T22:15:34.589Z"
"roseh0911.bsky.social","Gun violence is out of control. The victims of gun violence are Republicans, Democrats, independents, and kids, who have no political affiliation whatsoever. We need to tone down the incendiary political rhetoric, for sure, but we also need to do something about guns. The guns!","2025-09-10T21:15:43.137Z"
"roseh0911.bsky.social","It would be irresponsible not to assume that the amount of violence the president, intentionally or not, will be prone to urging his most unstable followers to embark on...in retaliation for the assassination of Charlie Kirk...is something every U.S. citizen should hold in their mind as high risk.","2025-09-10T21:32:02.061Z"
"roseh0911.bsky.social","People from across the political spectrum need to join together to condemn political violence, no matter who the target it is. It’s never acceptable.","2025-09-10T21:22:33.142Z"
"roseh0911.bsky.social","The problem with allowing guns everywhere is that no one is safe anywhere.","2025-09-10T20:24:56.425Z"
"roseh0911.bsky.social","This afternoon, in addition to Charlie Kirk, there was a school shooting. Bullets don't know and don't care if you are a Republican or Democrat. It is time for Republicans and Democrats to find a way to work together to reduce gun violence. www.wcpo.com/us-news/crim...","2025-09-10T20:28:22.783Z"
"roseh0911.bsky.social","Absolutely right!","2025-09-10T16:17:41.398Z"
"roseh0911.bsky.social","If Epstein Shocked You, The Names Behind His Money Will Floor You. I'm Telling You More About Them...Right Here👇 www.jackhopkinsnow.com/p/if-epstein...","2025-09-09T16:30:34.663Z"
"roseh0911.bsky.social","Thank you @markrf400.bsky.social 💙 @doglips13.bsky.social @ramblinro.bsky.social @lilygs.bsky.social @renee0064.bsky.social @nbpt-john.bsky.social @bulldogbenfla.bsky.social @freebroomrides.bsky.social @nemi2009.bsky.social @vonda.bsky.social @roseh0911.bsky.social @madison8.bsky.social","2025-09-09T14:46:28.667Z"
"roseh0911.bsky.social","The First Amendment protects our right to record ICE officers and law enforcement in public, whether Secretary Noem likes it or not.","2025-09-09T17:01:13.761Z"
"roseh0911.bsky.social","The Trump administration is going great... for Trump.","2025-09-09T16:05:17.207Z"
"roseh0911.bsky.social","A hearty FUCK YOU to all 6 Christo-Fascists at the SC: CJ Racist Roberts Samuel Asshole Alito Clarence “Gimme the $$$ Thomas Beery Brett Kavanaugh Neil “Hitler was a good guy” Gorsuch Amy Cunt Barrett 13 Federal districts = 13 Supreme Court Judges open.substack.com/pub/contrari... #ExpandSCOTUS","2025-09-08T18:21:10.065Z"
"roseh0911.bsky.social","There’s something to this the people that South Korea sent over here they were supposed to train American people how to do this job because everything in this plant was in Korean . So what did she accomplish destroying peoples jobs and does she think she’s gonna win no","2025-09-09T15:59:47.060Z"
"roseh0911.bsky.social","Arresting tech from S. Korea will hurt our economy. Proof this country is not safe this time. Who will want to invest in our economy?","2025-09-09T15:25:54.027Z"
"roseh0911.bsky.social","I admit, I copied this from a Facebook post, couldn’t help myself.","2025-09-08T20:54:46.042Z"
"roseh0911.bsky.social","Amazing turnout","2025-09-08T11:02:43.913Z"
"roseh0911.bsky.social","Rep. Ro Khanna said we all have to contact our Members of Congress and demand they pass this bill to release the Epstein files! Do your part via the link below! It only takes a minute to do! actionnetwork.org/letters/tell...","2025-09-08T01:04:28.491Z"
"roseh0911.bsky.social","Joe Biden was a great president! Just read his accomplishments listed here. Damn, I miss him. Kamala would've been great also. Just think of where we'd be right now if she were president!","2025-07-20T10:39:31.977Z"
"roseh0911.bsky.social","This is frankly one of the worst things Donald Trump has ever posted, which is really saying something","2025-09-06T16:50:03.153Z"
"roseh0911.bsky.social","""""You'll have to forgive me. I'm from the Divided States of America."""" heatherdelaneyreese.substack.com/p/youll-have...","2025-07-10T17:11:52.896Z"
"roseh0911.bsky.social","When is maga world and the republican party going to wake up and realize that they have been duped","2025-09-07T10:37:15.256Z"
"roseh0911.bsky.social","Ty: @raykwong.bsky.social @fireeyebooks.bsky.social @robwarrior.bsky.social @romanpiso.bsky.social @roseh0911.bsky.social @stupordave1.bsky.social @subdude.bsky.social @avalene.bsky.social @baileygeorge.bsky.social @cassadagabella.bsky.social 👑💙","2025-09-07T00:16:19.285Z"
"roseh0911.bsky.social","I guess all of us who served after 1945 served in a woke military, per Cadet Bone Spurs.","2025-09-06T00:53:04.822Z"
"roseh0911.bsky.social","Marc Elias is OUR Champion 🏆 He is in Court Battling the Chump Regime almost Every Day. We Need More Like Mr. Elias on Our Side.......","2025-09-06T09:17:41.702Z"
"roseh0911.bsky.social","We called him “Joey Jobs” because…🤭","2025-09-05T15:37:38.217Z"
"roseh0911.bsky.social","Thomas Massie claims $2.5M in attack ads are being run against him by GOP megadonors, including one listed in Epstein’s black book. #BlueCrew #Resist #ResistTrump #trumpLiesMatter #ReleaseTheEpsteinFiles","2025-09-04T06:03:08.540Z"
"roseh0911.bsky.social","These should be health care decisions made between you and your doctor- not Donald Trump or RFK. Thank you, Governor Shapiro, for your swift action to protect Pennsylvanians’ access to vaccines!","2025-09-04T20:07:04.963Z"
"roseh0911.bsky.social","The Epstein list contains the people who run the world. Perverted monsters. This is the blackmail that keeps so many in line, obedient. This is a house of cards. May it all fall down. May they all be held accountable. Prison. 🤬🤬🤬 #epstein #houseofcards #fuckedupshit #monsters","2025-09-04T00:23:11.554Z"
"roseh0911.bsky.social","Not surprising but incredibly disturbing","2025-09-04T20:07:33.366Z"
"roseh0911.bsky.social","""""There is NO such thing as 'CHILD PROSTITUTES'. That term implies agency, choice. Those CHILDREN were RAPED, VIOLATED, ABUSED. Do not let anyone get away with implying or pretending otherwise."""" niyad at DemocraticUnderground","2025-09-04T18:29:00.341Z"
"roseh0911.bsky.social","What does Putin have on him? Any guesses?","2025-09-04T20:05:32.622Z"
"roseh0911.bsky.social","Great news for everyone who wants to force the Justice Department to release the Epstein files!","2025-09-04T11:24:11.739Z"
"roseh0911.bsky.social","Hi Vincent @ewq9.bsky.social I am in the Right pack! I've been fightjng for gun control for decades. Honored to be included. Followed & sharing! #StrongerTogetherhttps://go.bsky.app/MYieRqt","2025-09-03T19:16:00.870Z"
"roseh0911.bsky.social","In a metaphor that was too on-the-nose, there was a military flyover in Washington, D.C. that drowned out Epstein survivors who were speaking out. I'm happy to report they persisted.","2025-09-03T18:39:36.501Z"
"roseh0911.bsky.social","So childish, so obvious","2025-09-03T18:40:29.158Z"
"roseh0911.bsky.social","""""I thought they were going to make me board the plane like they did with the other kids from the shelter, but they asked me for my name and told me I was not on the list."""" A terrifying declaration from an unaccompanied child nearly removed to Guatemala straight out of Schindler's List.","2025-09-03T16:36:19.767Z"
"roseh0911.bsky.social","The overall takeaway from the Epstein survivors’ press conference is that they are united and are no longer going to allow rich and powerful men to victimize, silence and intimidate them. Including the ones in Congress and the perp in the Oval Office.","2025-09-03T15:50:16.143Z"
"roseh0911.bsky.social","These women deserve the right to have all files and documents released, as they have requested. Why is the GOP preventing this from happening?","2025-09-03T16:23:26.582Z"
"roseh0911.bsky.social","Good Morning!😃It’s not Wednesday. It’s #EpsteinSurvivorsDay🥳🥳🥳 Let’s go! Set an alarm for 10:30 am EST. Tune in & support survivors. Their day has come","2025-09-03T11:47:54.003Z"
"roseh0911.bsky.social","Pritzker: """"When did we become a country where it's ok for the US president to insist on national television that a state should call him to beg for anything? Especially something we don't want. Have we truly lost all sense of sanity in this nation that we treat this as normal?""""","2025-09-02T20:11:19.897Z"
"roseh0911.bsky.social","As a physician, I know conversion therapy is dangerous and goes against everything we stand for in healthcare. It's abusive and not grounded in science.","2025-09-02T15:34:01.362Z"
"roseh0911.bsky.social","Epstein Survivors Press Conference Sept 3rd, 10:30 a.m. ET Tune in to support them.","2025-09-02T15:10:27.935Z"
"roseh0911.bsky.social","Netflix just gave Gavin Newsom 2 million for the redistricting fight and made a deal with Sesame Street. New episodes will air there and the backlog of old episodes will Be free to watch. Netflix picked a side. I will keep my subscription.","2025-09-01T13:05:25.694Z"
"roseh0911.bsky.social","Keep the pressure on... It's killing him","2025-09-01T21:42:10.351Z"
"roseh0911.bsky.social","Ron Johnson (Wisconsin) • DC Phone: (202) 224-5323 Thom Tillis (North Carolina) • DC Phone: (202) 224-6342 Marsha Blackburn (Tennessee) • DC Phone: (202) 224-3344 Roger Marshall (Kansas) • DC Phone: (202) 224-4774","2025-09-01T23:38:55.579Z"
"roseh0911.bsky.social","Something that has been missing from the Trump administration’s review of the Epstein case: considering the survivors. This week, they speak out, and we should all be listening. open.substack.com/pub/joycevan...","2025-09-01T22:48:23.842Z"
"roseh0911.bsky.social","For real: Are Republicans not embarrassed by stuff like this??","2025-08-31T03:30:55.879Z"
"roseh0911.bsky.social","When Laura Ingraham was a student at Dartmouth, she attended a meeting of the Gay Student Union and wrote down the names of the attendees, which she then published in the student newspaper. This was a time when it was very dangerous to be outed as gay. She is a dispicable, vile person.","2025-08-29T02:09:43.744Z"
"roseh0911.bsky.social","💔💔💔","2025-08-29T17:08:53.113Z"
"roseh0911.bsky.social","It's right in front of our faces.","2025-08-29T11:32:05.054Z"
"roseh0911.bsky.social","Overnight, the CDC unraveled. Its director fired, senior officials resigning, and public health left in chaos. As Jen Rubin explains, the White House chose politics over science, and Americans will pay the price.","2025-08-28T13:55:22.961Z"
"roseh0911.bsky.social","!!!!","2025-08-27T23:24:06.677Z"
"roseh0911.bsky.social","go.bsky.app/Jb4wLZ #DemValues","2024-11-17T07:59:03.684Z"
"roseh0911.bsky.social","I’m so damn sick and tired of this constant, horrible, sickening direction of this country.","2025-08-28T13:49:07.420Z"
"roseh0911.bsky.social","This is what fascism looks like. And it’s here. In America. And only we the people can stop it.👇","2025-08-27T21:10:02.518Z"
"roseh0911.bsky.social","And just so we don’t forget: Epstein, Epstein, Epstein","2025-08-27T22:13:07.821Z"
"roseh0911.bsky.social","Look I'm gonna say it: paying the biggest liberal-leaning influencers $96,000 a year to reach millions upon millions of people is pretty reasonable - honestly, a steal, even. In broad strokes it seems like the beginning of the sort of social media strategy Dems have been lacking.","2025-08-27T17:03:01.929Z"
"roseh0911.bsky.social","CDC MEDICAL OFFICER DEBRA HOURY SAYS SHE AND DEMETRE DASKALAKIS, HEAD OF CDC'S VACCINE UNIT, HAVE BOTH RESIGNED THE AGENCY","2025-08-27T21:47:43.922403+00:00"
"roseh0911.bsky.social","Don't get it twisted. Trump is having the National Guard pick up trash to debase them. He hates the military. He is incapable of understanding anyone who would make sacrifices for the greater good. He thinks they are suckers and losers, and he's treating them as such.","2025-08-27T18:19:58.086Z"
"roseh0911.bsky.social","Republicans would lose their minds.🤯","2025-08-27T15:48:01.429Z"
"roseh0911.bsky.social","Today was a tragedy and a national disgrace. Please, for the love of GOD, do not give the Republicans the gun control debate they desperately want to distract from Epstein, the failing economy, inflation, Trump's criminal blackmail and our utterly failed foreign policy. Please.","2025-08-27T17:43:21.596Z"
"roseh0911.bsky.social","So many adults have to fail a child before he ends up 10 years old telling CNN about the mass shooting he lived through this morning","2025-08-27T21:09:58.034Z"
"roseh0911.bsky.social","This song remains incredibly relevant in 2025. Harold Melvin and the Blue Notes ft Teddy Pendergrass performing """"wake up everybody""""","2025-08-27T12:24:01.859Z"
"roseh0911.bsky.social","Our children are being abused","2025-08-27T19:11:07.089Z"
"roseh0911.bsky.social","""""Rep. Mike Collins (R-GA) said he believes Trump is """"in there"""" during an Aug. 13 Muscogee County GOP meeting. Collins added that Trump is in the files because he “was the one that (sic) was telling the FBI about it,"""" #Pinks #EpsteinFiles www.rawstory.com/trump-267392...","2025-08-27T15:17:19.329Z"
"roseh0911.bsky.social","Hi, Maricella! @fireeyebooks.bsky.social Thank you my friend for including me in this Glorious #BlueTeam pack! Followed those that I had not met. #StrongerTogether! go.bsky.app/QHS2AvV","2025-08-26T20:56:07.049Z"
"roseh0911.bsky.social","If you support the NRA, work for the NRA, vote against common sense gun controls (and almost all limitations on the ownership of guns are common sense), then your finger is on the trigger every time one of these maniacs you have enabled commits another one of these nearly uniquely American crimes.","2025-08-27T16:09:07.814Z"
"roseh0911.bsky.social","THIS, is what the media should be saying as well. It's the god damned truth! #cdnpoli","2025-08-27T10:03:17.673Z"
"roseh0911.bsky.social","Vanity Fair staffers threaten to walk out over a proposed Melania cover: “We are not going to normalize this despot and his wife… if this happens, i’m gone, and so is half my team.” www.thedailybeast.com/i-will-walk-...","2025-08-27T18:23:53.652Z"
"roseh0911.bsky.social","The fact that all major news sources in the United States have daily lead stories like """"Experts weigh in on the most delicious ice cream"""" and not """"Democracy is dead"""" is one of the greatest derelictions in duty in the history of the country.","2025-08-27T12:22:56.506Z"
"roseh0911.bsky.social","We can't allow ourselves to become numb to mass shootings. What happened today in Minneapolis is heartbreaking, and Michelle and I are praying for the parents who have lost a child or will be sitting at their hospital bedside after yet another act of unspeakable, unnecessary violence.","2025-08-27T18:12:00.983Z"
"roseh0911.bsky.social","go.bsky.app/FaY2NfX Another great Starter Pack by Judith 💙😀 @judithbolyard.bsky.social","2025-08-27T07:39:59.391Z"
"roseh0911.bsky.social","Shuler: Thirteen billionaires in one picture—four of whom now run agencies of our federal government. If you’ve ever met someone who says the word “oligarchy” is too confusing or too complicated, well, you can explain it with that one photo.","2025-08-27T15:24:02.791Z"
"roseh0911.bsky.social","This was an amazing discussion about media, democracy, and community. Heather Cox Richardson Leigh McGowan (Politics Girl) Joanne Carducci (JoJoFromJerz) Dana Goldberg substack.com/@muellershew...","2025-08-27T04:24:13.222Z"
"roseh0911.bsky.social","💙💙👍","2025-08-27T08:42:57.849Z"
"roseh0911.bsky.social","Moore: """"The thing that gets me most about this is how deeply disrespectful this is to members of the National Guard who signed up for this job as I did when I deployed overseas & led paratroopers in combat where we signed up w/the expectation the commander in chief was actually taking it seriously""""","2025-08-27T01:13:04.112Z"
"roseh0911.bsky.social","FUCK YEAH SCIENCE arstechnica.com/science/2025...","2025-08-27T15:25:14.935Z"
"roseh0911.bsky.social","Hi Bek! @itsbek.bsky.social Thank you My Friend for including me in your wonderful pack! Followed All that I had not met. Sharing as we are #StrongerTogether 💙🥰 go.bsky.app/8gwAhsG","2025-08-24T23:59:12.098Z"
"roseh0911.bsky.social","Pritzker gets it.","2025-08-25T21:46:47.433Z"
"roseh0911.bsky.social","Hi @hopeful66.bsky.social Thank you for including me with so many friends in your Monday Roll Call 1! Always appreciated. Followed the 2 that I had not met. Sharing as we are #StrongerTogether! go.bsky.app/6TgZcwp","2025-08-25T21:50:57.279Z"
"roseh0911.bsky.social","👇🏻👇🏻","2025-08-24T22:07:25.223Z"
"roseh0911.bsky.social","They are deluded. Beyond repair. Nuremberg 2 is coming","2025-08-25T12:27:32.025Z"
"roseh0911.bsky.social","Pritzker: To the members of the press who are assembled here today and listening across the country, I am asking for your courage to tell it like it is. This is not a time to pretend here that there are two sides to this story.","2025-08-25T20:55:07.071Z"
"roseh0911.bsky.social","KILMAR IN BALTIMORE: “Never lose hope. Promise me you’ll continue fight for freedom — not just for me, for everybody.” He was just taken into ICE custody.","2025-08-25T12:30:42.668Z"
"roseh0911.bsky.social","The second amendment guarantees the right to a militia to guard against federal tyranny. But if a president can use that force against its own state, against the wishes of that state, then it is no militia at all and a clear violation of the second amendment.","2025-08-24T23:37:56.195Z"
"roseh0911.bsky.social","Governor Pritzker calling out Donald Trump for the tyrant he is","2025-08-24T04:29:18.041Z"
"roseh0911.bsky.social","They want us fighting so we never notice who is stealing from us all. Don’t get lost in the circus.","2025-08-24T10:24:18.500Z"
"roseh0911.bsky.social","If the US government had to pay for medical care of its citizens, it might care more about climate change impacts, air and water pollution, gun violence, traffic crashes, the food we eat, etc. It’s past time for single payer healthcare.","2025-08-24T06:32:02.762Z"
"roseh0911.bsky.social","Only a fcking idiot would believe the word of a convicted sex trafficker over 23 victims. Oh","2025-08-23T16:16:28.785Z"
"roseh0911.bsky.social","This brought to you by the same Trump GOP fascist regime that has put armed troops in your cities, released ICE goons and thugs to hunt down and kidnap slamming women and children to the pavement, defunded and attacked our colleges and made the US the world's most hated nation.","2025-08-23T13:05:55.432Z"
"roseh0911.bsky.social","👇👇","2025-08-23T12:30:39.886Z"
"roseh0911.bsky.social","Cartoon by DaveGranlund.com.","2025-08-23T12:33:47.109Z"
"roseh0911.bsky.social","D.C. has more residents than two U.S. states. They pay more per capita in federal taxes than any other state. But they don’t get a serious seat at the table to decide how they’re governed. D.C. statehood now.","2025-08-22T19:47:43.359Z"
"roseh0911.bsky.social","It may have been bat shit crazy, but the monster just informed all of us of the next steps he is taking It should not come as a surprise to anyone when it happens Impeachment and removal of these vile administration is the best solution to eradicating this cancer","2025-08-22T19:58:17.893Z"
"roseh0911.bsky.social","bsky.app/profile/did:...","2025-08-22T20:09:13.792Z"
"roseh0911.bsky.social","Thank you for the SP add💙","2025-08-22T08:47:42.134Z"
"roseh0911.bsky.social","I wasn't overreacting.","2025-08-21T18:39:13.333Z"
"roseh0911.bsky.social","Thank you Stephen💙😀","2025-08-21T09:18:33.545Z"
"roseh0911.bsky.social","Here, fixed it.","2025-08-21T18:14:19.120Z"
"roseh0911.bsky.social","NY on board!","2025-08-21T01:44:19.523Z"
"roseh0911.bsky.social","Get your children vaccinated","2025-08-21T18:16:50.588Z"
"roseh0911.bsky.social","Dems support fair, independent districting. Why don’t Republicans? For the same reason they want to ban mail-in ballots, and make it harder to regain your voting rights, and on and on. They have made voter suppression an art form. They want minority rule. 🇺🇸","2025-08-21T02:17:39.376Z"
"roseh0911.bsky.social","My grown son is a wonderful, brilliant, hard working gay man and he holds my heart. Recently because of the direction of this country I felt I needed to tell him that if he ever needs to leave this country to do it and not worry about me. The fact that this felt necessary absolutely enrages me.","2025-08-21T18:14:01.745Z"
"roseh0911.bsky.social","go.bsky.app/QVXdmj4 Thank you Judith for all your efforts on these Starter Packs. Much appreciated💙 @judithbolyard.bsky.social","2025-08-19T07:08:42.052Z"
"roseh0911.bsky.social","""""ICE"""" does not exist in any way that resembles what it was in its former life. This warrantless....non-identification bullshit...is the extension of the most evil, lawless...heartless son of a bitch in the United States of America.","2025-08-18T16:40:31.587Z"
"roseh0911.bsky.social","The war will be against """"the enemy from within,"""" and it will be waged with his 10,000 new ICE gestapo brownshirts. We have GOT to flip congress in 2026 and stop him.","2025-08-18T19:16:49.978Z"
"roseh0911.bsky.social","Hi, Patty! @packers1.bsky.social I love this! Thank you so much for including me! Followed Those that I had not yet met. Sharing because we are #StrongerTogether! go.bsky.app/3YEU3g4","2025-08-18T16:12:43.783Z"
"roseh0911.bsky.social","go.bsky.app/JdzgXEo Thanks Pete for the SP add 💙👍 @psychopete.bsky.social","2025-08-18T06:49:26.414Z"
"roseh0911.bsky.social","Mortified that the leadership of... Europe... has to come here b/c we couldn't bother to hire a competent woman for the job & instead re-hired a child rapist insurrectionist felon who happens to be Putin's little lap bitch. What Zelenskyy must sit through is now our eternal shame. #SlavaUkraini 🌻","2025-08-18T11:18:10.473Z"
"roseh0911.bsky.social","www.msnbc.com/rachel-maddo...","2025-08-18T00:17:32.652Z"
"roseh0911.bsky.social","Trump is a traitor. He’s a traitor to America, he’s a traitor to Ukraine, he’s a traitor to NATO and the free world. And Zelensky is meeting with him today. Zelensky should tell Trump to fuck off. But he won’t. If you’re the praying type, say a prayer today for Ukraine.","2025-08-18T10:52:34.228Z"
"roseh0911.bsky.social","America has fallen.","2025-08-16T22:55:05.642Z"
"roseh0911.bsky.social","Good evening, @gr3te.art and thank you my friend for including me in your glorious pack of 💙 💙 💙 hearted family! Followed All that I had not yet met. Sharing because we are #StrongerTogether! go.bsky.app/RhH4D5N","2025-08-13T23:48:10.711Z"
"roseh0911.bsky.social","I watch the world and the people who quietly fight to keep it steady. I write about them. I write for you, if you’ll let me. If you subscribe, it’s just this,me, bearing witness, and you, reading it. I won’t let you down. Join my newsletter here: tomjoad3.substack.com","2025-08-14T03:50:16.578Z"
"roseh0911.bsky.social","Hi, Dianne! @dpfrazier22.bsky.social and thank you for including me in your new 💙 💙 💙 pack! I’ve followed All that I had not met. Sharing because we are #StrongerTogether! go.bsky.app/NSJM8kG","2025-08-13T23:40:11.354Z"
"roseh0911.bsky.social","go.bsky.app/4zZm8ps","2025-08-12T23:10:48.758Z"
"roseh0911.bsky.social","Hear, hear.","2025-08-12T22:53:12.636Z"
"roseh0911.bsky.social","1/4🧵 The most important thing an American can do right now: 1. Be Calmly Pissed. Anger is a powerful force…but only if utilized from a calm clear headed state. This is accessed by being pissed/angry, and then feeling a sense of calm and focus ABOUT your anger.","2025-08-12T22:33:15.170Z"
"roseh0911.bsky.social","Jesse @journeyled1.bsky.social new Starter Pack go.bsky.app/BPuRiFq","2025-08-12T19:53:28.382Z"
"roseh0911.bsky.social","Trump’s new sport isn’t golf. It’s silencing the press. Colbert, Kimmel, Gayle King, ABC, CNN — all in his crosshairs. Fear is the point. The Constitution is the casualty. But honestly he’s just trying to make his little tiny scared self feel better. adamkinzinger.substack.com/p/the-censor...","2025-08-12T13:34:32.138Z"
"roseh0911.bsky.social","go.bsky.app/NZWVtf6 Thank you Barrie for the SP add 👍💙 @barrieholme.bsky.social","2025-08-12T13:42:08.924Z"
"roseh0911.bsky.social","When will enough be enough?","2025-08-12T13:54:20.910Z"
"roseh0911.bsky.social","It's Bek's 23rd starter pack. As always, please vet, follow, and share. #EpsteinFiles go.bsky.app/EtCHV8u","2025-08-12T02:51:25.933Z"
"roseh0911.bsky.social","go.bsky.app/8sCChpV @hopeful66.bsky.social Thanks so much!","2025-08-12T11:49:23.162Z"
"roseh0911.bsky.social","Hi, @mrsdeborahlynn.bsky.social I love it! Yes we are Done with the BS!!! Thank you always for including me. Followed All that I had not yet met! Sharing because we are #StrongerTogether! go.bsky.app/9VBi8P7","2025-08-12T00:20:34.819Z"
"roseh0911.bsky.social","Never forget","2025-08-11T23:23:36.541Z"
"roseh0911.bsky.social","Epstein, Epstein, Epstein, Epstein,Epstein, Epstein, Epstein, Epstein, Epstein, Epstein Epstein, Epstein, Epstein, Epstein, Epstein, Epstein. Epstein. Epstein, Epstein, Epstein, Epstein,Epstein, Epstein, Epstein, Epstein, Epstein, Epstein Epstein, Epstein, Epstein. Epstein, Epstein, Epstein.","2025-08-11T15:44:38.276Z"
