"user","post","date"
"roseh0911.bsky.social","@wisewonders.bsky.social @ltwlauren.bsky.social @elseeishere2.bsky.social @felicianmitzi.bsky.social @isabeladame.bsky.social @barbbengela.bsky.social @truebluebroad.bsky.social @thecatstotheleft.bsky.social @imnotfnselling.bsky.social @fintechernest.bsky.social @nancytt.bsky.social","2024-12-24T13:18:22.378Z"
"roseh0911.bsky.social","#ChristmasEve🎄 @sebright.bsky.social @partypolitical7.bsky.social @bluestormcomin1.bsky.social @pattievotesblue.bsky.social @epennysworth.bsky.social @beansbeth.bsky.social @roseh0911.bsky.social @justskeets.bsky.social @filosia.bsky.social @juliindica.bsky.social @coko.bsky.social @lstl.bsky.social","2024-12-24T13:18:22.377Z"
"roseh0911.bsky.social","Donald Trump's grandfather ran Canadian brothel during gold rush, author says Friedrich Trump amassed 'substantial nest-egg' from Yukon hotel before heading to New York","2024-12-23T21:41:49.553Z"
"roseh0911.bsky.social","Sharing a Great Starter Pack! go.bsky.app/5AKHS9k","2024-12-22T23:17:24.047Z"
"roseh0911.bsky.social","go.bsky.app/Ds1mz6S","2024-12-23T19:00:26.216Z"
"roseh0911.bsky.social","I want to give a big shout-out to my new friend @patawan1.bsky.social! She’s smart, creative, witty, and proudly Anti-Fascist/Anti-MAGA. Her content is a joy to follow! If you’re looking for meaningful connections, check her out and follow—you won’t be disappointed. Repost!","2024-12-23T20:07:51.123Z"
"roseh0911.bsky.social","Everybody go follow the super awesome @thetharp.bsky.social @itsjustjules123.bsky.social @timconrad.bsky.social @mollyantifa.bsky.social @gmf1369.bsky.social @dishfrombasinmike.bsky.social @wtafworld.bsky.social @aarondawson47.bsky.social @justinewales.teamlh.social @joannat.bsky.social","2024-12-23T14:34:23.376Z"
"roseh0911.bsky.social","The slimmest majority of the stupidest people in this country handed the Oval Office to an unrepentant sexual predator, adjudicated rapist, and he tried to put a sick fuck who had been paying teenagers for sex in charge of our Department of Justice.","2024-12-23T17:52:50.840Z"
"roseh0911.bsky.social","Get ready to be amazed—this is impressive AND it's spot-on accurate! 🖖","2024-12-23T21:19:37.101Z"
"roseh0911.bsky.social","If you're celebrating mass deportations… Thanks, @johnpavlovitz.bsky.social","2024-12-23T19:00:48.930Z"
"roseh0911.bsky.social","Gas prices Dec. 23, 2024 Sam's Club Longview, Tx. Thanks President Biden and VP Harris.","2024-12-23T20:55:46.254Z"
"roseh0911.bsky.social","The pasty-white driver so lively and quick, I knew in a moment it was that S. African prick; More deplorable than truth his robbers they came, And he snorted, shouted, and called them by name: """"Now, Bezos! now, Rupert! now McConnell and Lindsey! On, Zuckerberg, Johnson, Cruz and Dog-Killer Kristi!","2024-12-23T19:52:38.627Z"
"roseh0911.bsky.social","The secret to a happy life is to drink good wine and avoid talking to morons","2024-12-22T20:28:49.957Z"
"roseh0911.bsky.social","Happy holidays to all the menopausal republican women on gender-affirming hormone replacement therapy!","2024-12-23T17:48:20.662Z"
"roseh0911.bsky.social","Imagine if every member of Congress was this transparent & honest.","2024-12-23T06:10:44.820Z"
"roseh0911.bsky.social","youtu.be/XI6C7L66zq8?... 🎶🎤✨ @peacebird.bsky.social @tkaz99.bsky.social @shellieh.bsky.social @sandymw.bsky.social @justclaudia.bsky.social @kvconner.bsky.social @dbnranch.bsky.social @swonder.bsky.social @docgaby.bsky.social @paulette7.bsky.social @callmemare.bsky.social @veeham60.bsky.social","2024-12-23T17:27:23.577Z"
"roseh0911.bsky.social","Just stole this meme…","2024-12-23T20:29:50.177Z"
"roseh0911.bsky.social","LOVE to see this solidarity among union brothers and sisters! We must stand with Starbucks & Amazon workers! #SolidaritySeason","2024-12-23T18:40:15.231Z"
"roseh0911.bsky.social","People need to stop saying #mattgaetz had sex with a minor. No he committed statutory rape of a minor","2024-12-23T20:58:58.316Z"
"roseh0911.bsky.social","Team. Here’s our local MAGAt jerkoff crypto bro felon who likes to make sure he’s seen all over NYS. If he gives a dollar our local news covers it yet he terrorizes kids who work at his shit restaurants and flouts his lifestyle. Join me in a holiday block.","2024-12-23T14:18:30.281Z"
"roseh0911.bsky.social","Rapists of a feather.","2024-12-23T18:09:43.059Z"
"roseh0911.bsky.social","A dog on a chain can only watch and want as their life goes by.","2024-12-23T21:03:49.525Z"
"roseh0911.bsky.social","Happy Holidays! I hope your holidays are filled with fabulous food, friends, fun & lots of love. Please follow this starter pack filled with accounts that I love. Dedicated, fearless & full of fire—these brilliant content creators are here to make change happen & defend freedom. go.bsky.app/KSLztev","2024-12-23T20:00:35.527Z"
"roseh0911.bsky.social","See below for my statement in response to Chairman Loudermilk's """"Interim Report"""":","2024-12-17T19:36:36.794Z"
"roseh0911.bsky.social","🚨NEW: Donald Trump renews his attacks on Liz Cheney in an early-morning tirade, baselessly accusing her of “unthinkable acts of crimes.” Trump has previously threatened to jail her and hinted at political violence. REPOST if you stand with @lizcheney.bsky.social against Donald Trump!","2024-12-22T15:34:21.617Z"
"roseh0911.bsky.social","Early Christmas present from the Western District of Arkansas in favor of the first amendment and against the ARGOP’s book banning idiocy. arktimes.com/arkansas-blo...","2024-12-23T19:24:23.851Z"
"roseh0911.bsky.social","I remember Harris outlining policy to ban landlords from price fixing, creating tax burdens for corporate home buying, building 3M new housing units, and to give a $35K down payment for first time home buyers. The corporate media failed to amplify those messages.","2024-12-22T23:39:12.009Z"
"roseh0911.bsky.social","@vickiewybo.bsky.social hey, I just added you to my """"Badass Feminists"""" starter pack. If you want, please follow everyone and share this with your followers so that we can continue to grow! go.bsky.app/H9gFqmZ","2024-12-21T21:08:53.724Z"
"roseh0911.bsky.social","Hell yeah 🤭😂🤣 #SheShed","2024-12-23T16:57:21.149Z"
"roseh0911.bsky.social","I liked the movie up until she invited then man who battered her to her child's birth. Even though he agreed with her leaving him & that he wouldn't want his daughter to stay with an abusive man, there's no mention of keeping this violent man on a short leash around the baby.","2024-12-22T22:26:51.977Z"
"roseh0911.bsky.social","Why do all the movies like 'It Ends with Us' glamorize the decision of abused women who choose to keep their abusers' babies? Can we just please have a movie on a prominent media platform about an abused woman choosing abortion, getting out of the relationship & going on with her life?","2024-12-22T20:08:17.858Z"
"roseh0911.bsky.social","go.bsky.app/CagSQbD","2024-12-23T19:33:12.935Z"
"roseh0911.bsky.social","The big story today is the Matt Gaetz report. The bigger story should be the incoming President, despite knowing what Gaetz is, because everyone in Congress knew, still wanted to make him the Attorney General of the United States. Never normalize his madness, his corruption. Even for a single day.","2024-12-23T19:52:05.700Z"
"roseh0911.bsky.social","Anyone else wondering what the fuck ever happened to Nestor?","2024-12-23T18:55:21.677Z"
"roseh0911.bsky.social","Apparently, for Republicans… Sexual abuse is ok. Statutory rape is ok. Sex trafficking is ok. But don’t you dare try to forgive college loan debt. Now THAT’S a red line.","2024-12-23T18:45:10.063Z"
"roseh0911.bsky.social","I’m just trying to imagine Biden nominating an AG with the cojones to prosecute a congressman doing illegal drugs and paying underage girls for sex","2024-12-23T18:08:52.718Z"
"roseh0911.bsky.social","Last boost for a couple days.❄️🧵 @bohemianmelody.bsky.social @michaelkauter.bsky.social @carlissagilliam.bsky.social @harryprinceharry.bsky.social @mytrain666.bsky.social @lila8.bsky.social @rmz1961.bsky.social @airbasealmighty.bsky.social @pitfriend.bsky.social @paisleynclouds.bsky.social","2024-12-23T13:40:11.598Z"
"roseh0911.bsky.social","The only thing worse about the House Ethics committee report saying Matt Gaetz paid an underage girl for sex is the realization that so many other Republicans were ready to hide that shit. So. Fucking. Gross.","2024-12-23T15:44:42.875Z"
"roseh0911.bsky.social","Update: We’re up to over 100 members of Congress on Bluesky! We almost have an entire starter kit’s worth of members. Let me know if I’m missing any! go.bsky.app/F78vyQi","2024-12-22T21:20:18.774Z"
"roseh0911.bsky.social","Reminder: The House republicans against releasing the Gaetz ethics report because it violates his rights as a private citizen, are the same Republicans who made posters of Hunter Biden's schlong and forced everyone to watch for months on end.","2024-12-23T16:22:33.022Z"
"roseh0911.bsky.social","This aged like raw milk.","2024-12-23T17:07:36.815Z"
"roseh0911.bsky.social","Congrats Trump voters. You elected a serial sexual predator who brags about grabbing women by the pussy & surrounds himself with rapists, sex traffickers & pedophiles, but at least you’re “protecting” your daughter from the nonexistent trans boy on her middle school basketball team.","2024-12-23T17:53:18.383Z"
"roseh0911.bsky.social","🚨President Joe Biden commutes federal death row sentences of 37 inmates, except Mother Emanuel shooter white supremacist Dylann Roof, Boston Marathon Bomber Dzhokhar Tsarnaev and Pittsburgh synagogue shooter Robert Bowers.","2024-12-23T13:37:31.342Z"
"roseh0911.bsky.social","For the longest time, the easiest way to trigger Trump and MAGA was to question his self-reported crowd sizes. Now all you have to do is say ‘President Musk.’","2024-12-23T02:34:20.749Z"
"roseh0911.bsky.social","Check out this cockroach 🪳 #BlockAMaga","2024-12-23T00:12:34.448Z"
"roseh0911.bsky.social","Hey guys, here’s a nasty magat. #BlockAMaga","2024-12-22T22:15:33.767Z"
"roseh0911.bsky.social","🦋🦋🦋 Starter Pack 9 🦋🦋🦋 Full 150 Blue Accounts After you follow, please share! go.bsky.app/SwCaR2M","2024-12-23T00:38:34.003Z"
"roseh0911.bsky.social","#Resisters @bluewavesurfer.bsky.social @jkmiec.bsky.social @howgar.bsky.social @garyrsimonds.bsky.social @cyfy.bsky.social @evelynred845.bsky.social @lillyannie.bsky.social @tbirdhokie.bsky.social @sengov.com @jblvswesties.bsky.social @victoriashuts.bsky.social @jeremypearson.bsky.social","2024-12-23T02:07:45.914Z"
"roseh0911.bsky.social","go.bsky.app/Giy57kg","2024-12-22T20:27:30.517Z"
"roseh0911.bsky.social","Trump would know 🍳","2024-12-23T00:46:29.007Z"
"roseh0911.bsky.social","Biden maybe: “Let them fight amongst themselves.” Two things House Republicans are consistent about: they can’t govern, and they’ll fight each other. Everyone knew the same 30 Republicans always vote against continuing resolutions and this time would be no different.","2024-12-23T00:41:39.834Z"
"roseh0911.bsky.social","Some cool follows here:💙 @superday.bsky.social @lawrencehughes.bsky.social @neverstopthefight.bsky.social @mograybeard.bsky.social @5-2blue.bsky.social @justjules66.bsky.social @therichfromcali.bsky.social @incognita1.bsky.social @libky94.bsky.social @schultziepie.bsky.social go.bsky.app/MRurGYf","2024-12-22T23:29:06.826Z"
"roseh0911.bsky.social","In Scrooged when Bill Murray is in a slimy, dirty underground sewer that reeks of urine, he says: What is this? Trump Tower. Lol.","2024-12-22T22:55:33.652Z"
"roseh0911.bsky.social","Good morning, Bluesky Friends! 🗽💙 🌊","2024-12-22T12:59:32.144Z"
"roseh0911.bsky.social","Good trouble 👿: @progressivemum.bsky.social @phildorje108.bsky.social @imogenib.bsky.social @ndmom23.bsky.social @dcglobal.bsky.social @rexx95.bsky.social @johnsev.bsky.social @normajeen.bsky.social @buzzardsoul.bsky.social @fredbluevoter.bsky.social @coko.bsky.social @softtail65.bsky.social 💙💙","2024-12-22T16:35:14.264Z"
"roseh0911.bsky.social","Senator Adam Schiff is officially on Bluesky at: @adamschiff.com.","2024-12-22T20:24:51.598Z"
"roseh0911.bsky.social","The president of Panama, Jose Raul Mulino, isn’t having any of Donald Trump’s nonsense about taking back the Panama Canal: “Every square meter of the Panama Canal and the surrounding area belongs to Panama and will continue belonging so.” 🍿","2024-12-22T22:12:14.198Z"
"roseh0911.bsky.social","Everybody go follow the super fantastic @thetharp.bsky.social","2024-12-22T11:57:12.990Z"
"roseh0911.bsky.social","Thank you, @heisagrifter.bsky.social, for featuring my account in your thoughtfully curated “Building the Blue Opposition” Starter Pack. This collection has a diverse group of content creators, each offering unique perspectives and voices. It’s the perfect opportunity to connect with new and accts.","2024-12-22T23:19:22.522Z"
"roseh0911.bsky.social","Gotta love Samuel Jackson.","2024-12-22T14:36:51.122Z"
"roseh0911.bsky.social","This is a day that will never ever be forgotten! 💙","2024-12-22T18:47:11.392Z"
"roseh0911.bsky.social","Honestly the whole Panama flap, Trump is honest to god scared to death to actually use the military. So no worries Panama. He’s honest to god, scared to death. He’s such a small, weak, whiney, sissy","2024-12-22T22:40:00.684Z"
"roseh0911.bsky.social","Here is today's new starter pack!! If you want to be added to one of these, make sure to like, reply, and REPOST this post so I know who else wants to be on it. 🌊💙🦋🔄❤️🌊💙🦋🔄❤️ go.bsky.app/9mRdDk2","2024-12-22T21:36:59.278Z"
"roseh0911.bsky.social","THIS is to be shared","2024-12-22T22:21:16.971Z"
"roseh0911.bsky.social","I really do not have words to describe what it felt like to read this story - yet. How absolutely predictable, infuriating, and disgusting — every bit of it. ALL OF IT. SHAME on the women who not only participated in this, but enabled it for their own gain. www.nytimes.com/2024/12/21/b...","2024-12-21T17:44:26.633Z"
"roseh0911.bsky.social","Updated and now filled with 150! Starter Pack 8 go.bsky.app/6Tq8V6j","2024-12-22T00:10:11.338Z"
"roseh0911.bsky.social","💙 Times have changed.","2024-12-21T23:05:27.830Z"
"roseh0911.bsky.social","WTF … Muskie as #SpeakerOfTheHouse ??? No! No! No!","2024-12-21T23:54:30.933Z"
"roseh0911.bsky.social","Indeed, this is where we are.","2024-12-21T20:39:54.174Z"
"roseh0911.bsky.social","I’m really curious as to why no state prosecutors have pursued charges here.","2024-12-21T20:00:11.239Z"
"roseh0911.bsky.social","Thank you @crzycatt.bsky.social 🇺🇸🇺🇸🇺🇸 go.bsky.app/VbxXs9F","2024-12-21T20:09:10.108Z"
"roseh0911.bsky.social","Congresswoman Wexton scores one last legislative victory Senator Kaine was able to pass her bill funding pediatric cancer research in the Senate It was taken out of spending bill, but had already passed House Long story short, it passed and will be part of Wexton’s legacy","2024-12-21T01:56:31.186Z"
"roseh0911.bsky.social","The people of the nation of #georgia are absolute heroes. #georgiaprotests","2024-12-21T22:46:31.378Z"
"roseh0911.bsky.social","The richest man on the planet could probably solve child cancer himself using less money than he burned destroying Twitter. Instead, he used his influence to strip $190 million from the budget for pediatric cancer research. What a fucking asshole.","2024-12-21T18:17:50.373Z"
"roseh0911.bsky.social","Watch this inspirational call to action for us all 🔥 “What we need right now is for everyone to stand up and have courage. We need everyone to stand up and say, ‘I am not going to back down to this bully.’ We need people to be warriors for democracy.” @marcelias.bsky.social","2024-12-21T18:49:43.690Z"
"roseh0911.bsky.social","go.bsky.app/DDUGAjQ","2024-12-21T14:53:44.596Z"
"roseh0911.bsky.social","@nastyoldwoman.bsky.social @jerry-alberson.bsky.social @simplyskye.bsky.social @alchemist2000.bsky.social @filosia.bsky.social @madyrmyr.bsky.social @mary1kathy.bsky.social @catherineecullen.bsky.social @ladycolumbia.bsky.social @qm-b.bsky.social @artofmix24.bsky.social #TheResistanceReborn 💪🏼💙","2024-12-21T20:17:54.479Z"
"roseh0911.bsky.social","#StrongerTogether 🫂💙 @henry62.bsky.social @liberalwarrior.bsky.social @michaelb73.bsky.social @kqngins.bsky.social @coolsprings.bsky.social @drios1111.bsky.social @genirae.bsky.social @comminsense.bsky.social @petramichaela.bsky.social @jerrito8.bsky.social @filosia.bsky.social @pabush.bsky.social","2024-12-21T20:17:54.478Z"
"roseh0911.bsky.social","STRONGER TOGETHER #BlueCrewRise #boost Vet > 👣 > 🔄 > all @jackiegardens.bsky.social @getwisdomdude.bsky.social @mariaurea.bsky.social @aileenann.bsky.social @twisted257.bsky.social @huskerkia.bsky.social @t1gerblue.bsky.social @bluestormcomin1.bsky.social @filosia.bsky.social @coko.bsky.social 💙","2024-12-21T20:17:54.477Z"
"roseh0911.bsky.social","Starter pack is full at 150 #FBR. I'll be back later this morning and drop a Starter Pack #BlueCrew #NoDemUnder20K Drop me a 💙 here to be added. 🌊💙🌊💙🌊💙 I vet - Need a bio which indicates something you support. I look for follow backs 🚫Mega 🚫Crypto 🚫Paypal 🚫No Porn etc","2024-12-21T09:13:46.323Z"
"roseh0911.bsky.social","TRUTH!","2024-12-21T12:21:18.934Z"
"roseh0911.bsky.social","NEW: They’re already trying to cut social security. Dems in the senate saved it.","2024-12-21T04:51:10.787Z"
"roseh0911.bsky.social","Thank you Rep. Katie Porter for everything you have done to protect Medicare and for your incredible advocacy for mental health legislation in Congress. I can’t wait to see what you do next! 🙏💜","2024-12-21T13:53:41.979Z"
"roseh0911.bsky.social","Pretty wild that Elon’s debut as president elect was to strip funding for pediatric cancer research from the spending bill, only to watch the Senate have to pass it as a standalone bill. His first move was to fuck over kids with cancer.","2024-12-21T02:51:38.364Z"
"roseh0911.bsky.social","Rep. Balint: """"Who is it that we're negotiating with? It sure looks like we're negotiating with a boy billionaire who is playing at government. And why is he doing that? Because he's got $15 billion wrapped up in federal programs.""""","2024-12-21T02:23:40.018Z"
"roseh0911.bsky.social","We’re appropriately focused on all of the awful things we’re about to face during the next four years but we’re going to miss all of the little things we’ve come to expect from a normal president too.","2024-12-21T02:24:08.863Z"
"roseh0911.bsky.social","The Senate just passed the Gabriella Miller Kids First Research Act 2.0 by unanimous consent. Glad to see everyone do what’s right after President Musk tried his level best to eliminate funding for pediatric cancer research.","2024-12-21T02:44:42.895Z"
"roseh0911.bsky.social","go.bsky.app/CoyrxgA","2024-11-14T00:23:12.496Z"
"roseh0911.bsky.social","go.bsky.app/36eeW6n #FridayNightParty","2024-12-20T23:46:37.357Z"
"roseh0911.bsky.social","This sign should appear at the entrances to both chambers in Congress.","2024-12-21T01:28:02.139Z"
"roseh0911.bsky.social","WHOA 😳! Someone is getting pissed off! 😡 I love it 🥰","2024-12-21T01:29:03.793Z"
"roseh0911.bsky.social","Correct!!!","2024-12-21T01:02:48.636Z"
"roseh0911.bsky.social","Democrats just helped avert a government shutdown. President Musk and Trump failed to get what they demanded. Republicans threatened to stop paying millions of workers while Democrats once again showed that they’re the only adults in the room.","2024-12-21T00:49:59.677Z"
"roseh0911.bsky.social","It's a fucking shame that we have to breathe a sigh of relief or be excited when we hear that Congress did its fucking job and averted a government shutdown. Republicans are such a joke.","2024-12-20T23:54:50.278Z"
"roseh0911.bsky.social","#NoDemUnder1K Vet+Follow+Share @robdigital.bsky.social @mfoxfoley.bsky.social @01curlygirl.bsky.social @lisalynn.bsky.social @queenie53.bsky.social @amateurgatabout.bsky.social @stevencostanza.bsky.social @sophiagraceennis.bsky.social @rod-dagnan.bsky.social @therealmarchhare.bsky.social","2024-12-20T17:33:34.106Z"
"roseh0911.bsky.social","Michael Cohen nailed it. President-elect Musk doesn't know how the government works, or who would be impacted if the government shuts down, or how much a government shutdown would cost the taxpayers. It's laughable that this man has any control over our government. He's a dunce.","2024-12-20T19:39:21.369Z"
"roseh0911.bsky.social","#FridayDessertParty🧁 @grandpasnarky.bsky.social @cherylbluewave.bsky.social @genxrants.bsky.social @lauraboerman.bsky.social @antoniobruno.bsky.social @cona9705.bsky.social @ltwlauren.bsky.social @kingresist.bsky.social @bluestormcomin1.bsky.social @lucythebluecat.bsky.social @drios1111.bsky.social","2024-12-20T23:40:09.869Z"
"roseh0911.bsky.social","So we got a continuing resolution, but no debt ceiling increase that Trump wanted. Strategically this puts power in Hakeem Jeffries pocket and forces Republicans into deal making mode. I love that this is going to infuriate both Trump and the Free Dumb caucus.","2024-12-20T23:18:35.121Z"
"roseh0911.bsky.social","Anyone who wants real news about what’s going on in our nations capital doesn’t need to watch corporate media. All you have to do is watch C-SPAN.","2024-12-20T19:26:58.431Z"
"roseh0911.bsky.social","Fox News is speculating that Pete Buttigieg is planning a presidential run in 2028. I hope he is!","2024-12-20T19:07:50.278Z"
"roseh0911.bsky.social","💙💙🦋SURPRISE!! 🦋💙💙 I’m hosting a surprise #FBR party, and we’re celebrating all weekend long. Open up my mega starter pack and hit “follow all”! 🦋 Let’s get this party started! 🦋 go.bsky.app/9F5Rdze","2024-12-20T19:47:05.470Z"
"roseh0911.bsky.social","Biden says he wants to ratify the ERA and brings it up unprompted. Keep writing those letters and making those calls!","2024-12-20T19:11:16.500Z"
"roseh0911.bsky.social","To all the people who have followed me over the years, supported my advocacy, my health and well-being and to my new followers on this platform, I want to say: THANK YOU. Your kindness means the world to me & keeps me focused, motivated and I carry every one of your health stories in my heart. 🙏💜🙏💜","2024-12-20T21:02:01.494Z"
"roseh0911.bsky.social","Fuck no, @npr.org, the repeated government shutdown threats of the last few years aren’t because of “Washington gridlock.” It’s 100% Republican nihilism, now accelerated by a ketamine-addled oligarch.","2024-12-20T22:40:45.791Z"
"roseh0911.bsky.social","Elon Musk is SO GREAT at efficiency ideas!!! He created huge drama and delay in passing a bill that took months of work, insisted on last-minute changes, and effectively got nothing. Even GOP Senators calling it a shit show. SO EFFICIENT!!! Let's put him in charge of everything!! #DOGESHIT 🤡🤡🤡","2024-12-20T23:10:59.978Z"
"roseh0911.bsky.social","3 Friday Night Pizza 🍕 Party! @lakerpatrick.bsky.social @headdoc35.bsky.social @maurar.bsky.social @carolcook75.bsky.social @ladonna53.bsky.social @maralosers.bsky.social @louleoresist.bsky.social @tmfab.bsky.social @lois35.bsky.social @auberon.bsky.social","2024-12-20T23:10:22.917Z"
"roseh0911.bsky.social","#FridayDessertParty🍪 @bluestormcomin1.bsky.social @coko.bsky.social @ltwlauren.bsky.social @wisewonders.bsky.social @beansbeth.bsky.social @yodamonkey2.bsky.social @gdad1x7.bsky.social @teeshasmom2.bsky.social @anacostia71.bsky.social @gayveterans.us @simplyskye.bsky.social @mcb78.bsky.social","2024-12-20T23:18:40.485Z"
"roseh0911.bsky.social","The U.S. Senate is set to confirm President Joe Biden's 235th judicial nominee tonight, surpassing the number of federal judges confirmed during Donald Trump's first term in office. Senators will likely vote to confirm Serena Murillo to be a district judge for the Central District of California.","2024-12-20T23:11:06.459Z"
"roseh0911.bsky.social","Thank you House Dems for saving us all from a Trump shutdown. Again.","2024-12-20T23:14:14.953Z"
"roseh0911.bsky.social","President Musk and Vice President Trump just suffered a MAJOR DEFEAT with the overwhelming passage in the House of the government spending bill — WITHOUT the suspension of the debt limit.","2024-12-20T23:07:25.069Z"
"roseh0911.bsky.social","Objectively true.","2024-12-20T22:17:46.188Z"
"roseh0911.bsky.social","This Christmas, the incoming rapist, felon “president” is selling $60 buck Bibles while his billionaire nepo-baby buddy tries to keep paychecks out of the hands of our troops and the working class. But the price of eggs amirite.","2024-12-20T21:38:56.007Z"
"roseh0911.bsky.social","Did you know? Should a partial government shutdown occur, military personnel WILL NOT receive their salaries. Furthermore, furloughed workers and those deemed """"essential"""" in the government will also be left without compensation. President Musk couldn't care less.","2024-12-20T19:41:20.700Z"
"roseh0911.bsky.social","Weather like this and Minnesota was STILL ranked a top 5 state to retire 😎 By cutting social security taxes, allowing folks to age in their homes, and investing in safe communities, we’ve made life easier for our seniors. www.fool.com/research/bes...","2024-12-20T20:03:18.064Z"
"roseh0911.bsky.social","Luigi Mangione kills one CEO and gets charged with terrorism? January 6th rioters literally attacked the Capitol, and didn’t receive a single charge of terrorism. 👀👀👀 Apparently, it’s not terrorism unless it targets the wealthy.","2024-12-20T06:20:49.721Z"
