"user","post","date"
"rwilliams48239.bsky.social","🐸🐸🐸 🐸🐸🐸🐸 🐸🐸🐸🐸🐸 🐸🐸🐸🐸🐸🐸 🐸🐸🐸🐸🐸🐸🐸 🐸🐸🐸🐸🐸🐸🐸🐸 🐸🐸🐸🐸🐸🐸🐸🐸🐸 🐸🐸🐸🐸🐸🐸🐸🐸🐸🐸 🐸🐸🐸🐸🐸🐸🐸🐸🐸🐸🐸 FROGS TOGETHER STRONG Find a frog gathering near you www.NoKings.org | October 18","2025-10-12T14:38:29.767Z"
"rwilliams48239.bsky.social","Portland 🔥","2025-10-12T00:38:52.722Z"
"rwilliams48239.bsky.social","They """"unfired"""" the CDC employees when they figured out what a gigantic mistake that idiot Russell Vought had made. The Trump Administration is one idiot show after another. www.nytimes.com/2025/10/11/h...","2025-10-12T02:36:01.617Z"
"rwilliams48239.bsky.social","youtu.be/Q_oFL_b719g?...","2025-10-12T03:30:05.474Z"
"rwilliams48239.bsky.social","www.nytimes.com/2025/10/11/u...","2025-10-12T04:23:42.675Z"
"rwilliams48239.bsky.social","(🚨) BREAKING NEWS: Donald Trump No Longer Remembers That He Was President and Controlled the FBI on January 6, 2021, Confirming Americans' Worst Fears About His Advanced Dementia","2025-10-12T05:56:05.649Z"
"rwilliams48239.bsky.social","Good morning and Happy Sunday to everyone who correctly remembers that contrary to trump's post, Joe Biden was NOT the President on January 6, 2021 -- trump was. His delusional episodes are increasing, it's time for the 25th Amendment. HE IS UNFIT TO SERVE.","2025-10-12T08:46:51.879Z"
"rwilliams48239.bsky.social","🐸","2025-10-11T22:42:40.122Z"
"rwilliams48239.bsky.social","🚨AOC HUMILIATES MAGA with MOCKERY MASTERCLASS She didn’t yell. She laughed. And in minutes, she dismantled MAGA’s fake “tough guy” act. You HAVE to see this: youtu.be/-3Mx3WFXHBg","2025-10-08T23:56:22.272Z"
"rwilliams48239.bsky.social","Michigan Avenue right now.","2025-10-09T00:23:37.372Z"
"rwilliams48239.bsky.social","More messaging like this please","2025-10-05T21:14:36.717Z"
"rwilliams48239.bsky.social","Let's continue to build solidarity by peacefully opposing our tyrant-in-chief at No Kings Day 2.0 on October 18. There are currently over 2,000 events planned nationwide. More details here: https://www.nokings.org","2025-10-01T21:01:06.445492Z"
"rwilliams48239.bsky.social","CNBC: """"Very disappointing. It's a weak number. This is private sector jobs for September. The total comes in -32,000. And that was a surprise because economists were looking for an increase of 51,000. Also, the revision was not good. August now showing -3,000 compared to the initial read of 54,000""""","2025-10-01T14:10:25.192Z"
"rwilliams48239.bsky.social","If you hate the Pope because he is too “liberal”, I have some very bad news for you about Jesus.","2025-10-01T17:43:34.544Z"
"rwilliams48239.bsky.social","#TrumpShutdown","2025-10-01T06:25:58.470Z"
"rwilliams48239.bsky.social","I can’t believe I’m watching interviews of city mayors talking about how they are coordinating with other mayors to discuss how to protect their residents FROM THE PRESIDENT OF THE UNITED STATES I know we are “used to it” but it is absolutely insane","2025-10-01T00:13:47.224Z"
"rwilliams48239.bsky.social","This.","2025-10-01T00:17:16.560Z"
"rwilliams48239.bsky.social","Im not really loving how they changed the name to the Department of War, and then told senior military leadership that the enemy is “within.”","2025-10-01T01:20:03.441Z"
"rwilliams48239.bsky.social","Folks, this is the actual HUD.gov website. So tired of the lies and the bullying that result from the billionaire shitlers terrible policies 😞 or, should we be thankful he did not blame trans people? @muellershewrote.com","2025-09-30T19:30:45.901Z"
"rwilliams48239.bsky.social","Imagine a place where mental illness is on the rise and everyone has a gun. Where the guy in charge actively foments civil unrest, all to distract from his rampant corruption and pedophile benefactors. You don’t have to imagine such a place. You’re living in it.","2025-09-29T14:36:04.384Z"
"rwilliams48239.bsky.social","Because there are no left wing groups. There is no leftwing counterpoint to The Oathkeepers, 3 Percenters, Proud Boys, Patriot Front, The KKK, etc. etc. etc. Are you starting to finally see the problem?","2025-09-21T02:20:52.101Z"
"rwilliams48239.bsky.social","Ok, this one is too good and has to be shared! @jaybird54.bsky.social Goodnight & Sweet Dreams!","2025-09-21T02:30:38.201Z"
"rwilliams48239.bsky.social","I’m worried it can still get stupider","2025-09-21T02:39:05.771Z"
"rwilliams48239.bsky.social","www.404media.co/doj-deletes-...","2025-09-20T22:34:53.085Z"
"rwilliams48239.bsky.social","I stand with PBS. I stand with NPR. I stand with Stephen Colbert. I stand with Jimmy Kimmel. I stand with the First Amendment. PERIOD.* *Also #ReleaseTheEPSTEIN_Files","2025-09-18T18:39:59.230Z"
"rwilliams48239.bsky.social","The other interesting thing about this clip is how outraged Kirk is that anyone would blame Republicans generally for the act of a single deranged individual just because they routinely said terrible things about Pelosi. What a concept.","2025-09-17T17:20:10.805Z"
"rwilliams48239.bsky.social","They want to shut you up. To crush dissent. To end free speech. This is un-American.","2025-09-18T00:02:29.813Z"
"rwilliams48239.bsky.social","I stand with Jimmy Kimmel.","2025-09-18T00:06:57.510Z"
"rwilliams48239.bsky.social","From @nbcnews.com and @msnbc.com","2025-09-16T14:43:46.699Z"
"rwilliams48239.bsky.social","Gee, I wonder why. www.404media.co/doj-deletes-...","2025-09-16T21:22:08.117Z"
"rwilliams48239.bsky.social","FYI","2025-09-12T21:47:09.116Z"
"rwilliams48239.bsky.social","DEMOCRATS SHOULD DROP A CHARLIE KIRK GUN SAFETY ACT ON THE FLOOR JUST TO MAKE REPUBLICANS GO ON RECORD FOR VOTING AGAINST IT 🔄","2025-09-13T01:06:48.018Z"
"rwilliams48239.bsky.social","People are going to learn a lot about Groypers, Pepe the Frog, Furries, Helldivers 2, 4Chan and a bunch more this weekend. And they will be absolutely terrified.","2025-09-12T21:09:33.015Z"
"rwilliams48239.bsky.social","you’ll be shocked to learn Kirk was shot by a 22 yr old white radicalized Mormon from a UT gun-lovin GOP family. He once dressed as Trump at Halloween. Dad retired law. Confessed to dad — dad turned him in. Patel victory tour “solved it” in record time. 🤦‍♀️ #SarcasmIntended #NotTrans #NotRadicalLib","2025-09-12T19:06:15.738Z"
"rwilliams48239.bsky.social","Seems bad 😳","2025-09-08T03:51:09.207Z"
"rwilliams48239.bsky.social","LOL. Gift link for y'all. wapo.st/46erJUZ","2025-09-07T23:28:38.723Z"
"rwilliams48239.bsky.social","Jeffrey Epstein had doctors prescribe birth control and sedatives to his victims. They also screened his victims for STDs. He had dentists work on their teeth. I’d like to know who these people are and why they have been protected.","2025-09-07T18:44:40.454Z"
"rwilliams48239.bsky.social","blue = biden red = trump www.msnbc.com/rachel-maddo...","2025-09-07T20:19:40.263Z"
"rwilliams48239.bsky.social","“If Trump has created a ‘hot’ economy, why has American job growth slowed to a 16-year low?” www.msnbc.com/rachel-maddo...","2025-09-07T20:22:07.705Z"
"rwilliams48239.bsky.social","Killing American kids is the plan. Profiting from lawsuits is the plan. Hiring charlatans is the plan. Selling vitamins & horse paste is the plan. His family understands. Decades worth of damage done already. But, it doesn’t affect you, until it does, MAGA www.pbs.org/newshour/pol...","2025-09-07T22:18:39.589Z"
"rwilliams48239.bsky.social","#Pinks #ProudBlue #ResistanceUnited","2025-09-04T10:41:08.392Z"
"rwilliams48239.bsky.social","www.npr.org/sections/sho... RFKJR to face Senators today The Senate if they care for the American People and their children he must be investigated and removed . He must resign !! Turmoil at the CDC Schools are preparing for the worse as RFKJR tries reshape the vaccine landscape","2025-09-04T12:35:12.525Z"
"rwilliams48239.bsky.social","The height of hypocrisy is Republicans ranting about protecting girls from transgenders in the bathroom, but when given the chance to protect girls from the pedophile in the White House, they chose to cover it up. #ProudBlue #Pinks #TrumpIsUnfitForOffice Epstein Files","2025-09-04T12:31:27.564Z"
"rwilliams48239.bsky.social","I’m starting to doubt the religious brainwashing of my childhood… low-key let down. Doesn’t it seem at least half the world has been praying for cholesterol to do its job ridding ‘Merica of the Pathetic Peach Plague with the tiny pee-pee? Thank you for your attention to this important matter.","2025-09-04T02:52:26.013Z"
"rwilliams48239.bsky.social","👇","2025-09-03T18:08:32.079Z"
"rwilliams48239.bsky.social","Dogs are getting vaccinated less and rabies rates are rising, in part because 37% of Americans think vaccines will give their dogs... pawtism. www.nbcnews.com/health/healt...","2025-09-03T18:34:19.131Z"
"rwilliams48239.bsky.social","F*ck this guy","2025-09-03T19:09:35.794Z"
"rwilliams48239.bsky.social","Senate Democrats: DO NOT FUND the government when the current continuing resolution expires at the end of the month. SHUT IT DOWN unless DC is funded, the troops are withdrawn from our cities, elections are protected, the Epstein files are released in full... SHUT IT DOWN.","2025-09-02T20:30:17.001Z"
"rwilliams48239.bsky.social","The Pentagon authorizes military judges for immigration cases, the National Guard occupies DC, and Federal forces prepare to deploy to Chicago. They’re attacking democracy, terrorizing Black & Brown communities, and quelling dissent. We need to be prepared—learn how here: bit.ly/resistancetoolkit.","2025-09-02T20:55:44.446Z"
"rwilliams48239.bsky.social","Remember #MaineVoters - Susan Collins VOTED for ALL of this, while clutching her pearls… #SheCannotBeTrusted #CheckHerVotingRecord","2025-08-29T22:34:45.659Z"
"rwilliams48239.bsky.social","No one voted for this.","2025-08-29T15:18:56.597Z"
"rwilliams48239.bsky.social","Kim Jung-un, eat your heart out.","2025-08-29T16:42:06.125Z"
"rwilliams48239.bsky.social","This is good: With Trump/RFK destroying CDC, JB Pritzker's officials are exploring the possibility of buying Covid vaccines from manufacturers and distributing them in-state themselves, source tells me. Dem govs must step up and fill the void. New piece from me: newrepublic.com/article/1998...","2025-08-29T17:05:57.787Z"
"rwilliams48239.bsky.social","Not only is our new acting director of the CDC NOT a scientist, but he also has deep ties to Peter Thiel and Silicon Valley’s techno-utopia movement. One epidemiologist compared Jim O’Neill’s appointment to “making Elon Musk head of the FAA.”","2025-08-29T18:12:11.436Z"
"rwilliams48239.bsky.social","SARAH PALIN: """"There are going to be death panels!"""" RFK JR: """"Technically, it's just me.""""","2025-08-29T18:47:04.125Z"
"rwilliams48239.bsky.social","Just another reason to keep giving Netflix my money.","2025-08-29T19:10:07.291Z"
"rwilliams48239.bsky.social","What if we established a tax-exempt Church of Democracy and sued the government for infringing on our religious freedoms when it does authoritarian stuff?","2025-08-29T19:46:57.253Z"
"rwilliams48239.bsky.social","The fun would be watching Chump's reaction to it. 🤯 #ReleaseTheEPSTEIN_Files","2025-08-29T20:03:03.282Z"
"rwilliams48239.bsky.social","I hope people realize how absolutely fucked this situation is. This isn’t normal. People are resigning all over the place because the government is mishandling our data, ruining our public health services, and generally making Americans less safe.","2025-08-29T20:13:08.875Z"
"rwilliams48239.bsky.social","Trump played up a nick on his ear like it was serious combat wound for months but we’re all supposed to just ignore everything going on with his hands and ankles like there’s no issue.","2025-08-23T17:42:15.650Z"
"rwilliams48239.bsky.social","Kid Rock: I will no longer sell my music in California. Scott Baio: I will no longer act in California. Governor Newsom: My policies are working.","2025-08-24T14:53:09.845Z"
"rwilliams48239.bsky.social","Did you know there’s a special election THIS Tuesday in Iowa that could break the GOP super majority in the Iowa state senate? I had no idea. Just saw it on Tik Tok. Now…just out of curiosity, do you think the DNC should have rallied national Dems to support this election?","2025-08-24T15:19:16.013Z"
"rwilliams48239.bsky.social","Re-upping this for the Mandarin Mussolini supporters… how’s it looking?","2025-08-25T02:01:07.582Z"
"rwilliams48239.bsky.social","“I was r*ped sometimes 3 times a day on that island… and I was not the only girl on that island… Ghislaine must die in prison, because I’ve been in hell and back for the last 17 years.” Listen to the survivors.","2025-08-24T14:00:25.509Z"
"rwilliams48239.bsky.social","WOMEN TACKLED BY POLICE FOR SPEAKING HER MIND AT TOWN HALL IN INDIANA","2025-08-24T12:59:40.384Z"
"rwilliams48239.bsky.social","This is happening more than you think it is. Women are being snatched off the streets and raped. We're just not hearing about it. Outside the U.S. media is covering these stories though. 👇","2025-08-24T13:48:48.440Z"
"rwilliams48239.bsky.social","#Exactly","2025-08-22T15:04:20.130Z"
"rwilliams48239.bsky.social","Report this @cnn.com #YouHaveOneJob #AccurateReporting 🤦‍♀️","2025-08-20T18:25:26.903Z"
"rwilliams48239.bsky.social","In today's least-shocking news that we all knew before, Fox staff and producers all along the election wasn't stolen in 2020 and lied for ratings. www.mediaite.com/media/tv/fac...","2025-08-20T12:40:58.996Z"
"rwilliams48239.bsky.social","Sad, but true 🤷‍♀️","2025-08-16T14:29:12.228Z"
"rwilliams48239.bsky.social","Please read this excellent, point by point refutation of the claim that there was a """"Russia hoax"""" From @noupside.bsky.social www.lawfaremedia.org/article/from...","2025-08-07T07:10:31.555Z"
"rwilliams48239.bsky.social","I just realized that this video, """"Where Did Trump's Money Come From?"""" has over a million views. That is rather gratifying, as I did a lot of research for it. www.youtube.com/watch?v=RhIl...","2025-06-19T23:15:15.977Z"
"rwilliams48239.bsky.social","My bestie & I did umbrellas for Saturday’s protest.","2025-06-16T04:36:40.442Z"
"rwilliams48239.bsky.social","Clearly, no one wants to see tanks rolling in the streets of DC?! washingtondc.craigslist.org/doc/tlg/d/wa...","2025-06-12T04:30:10.141Z"
"rwilliams48239.bsky.social","That’s why you’re still here.","2025-05-16T23:52:38.161Z"
"rwilliams48239.bsky.social","The Attorney General sold between $1 million and $5 million worth of shares on April 2, disclosure forms show.","2025-05-15T11:04:33.241Z"
"rwilliams48239.bsky.social","You’re going to keep hearing stories like this—because Trump doesn’t GAF about these folks. WAKE UP! “We have a quarter million dollars in inventory stuck in China… we don’t have $400K to pay the tariffs… so we had to freeze all shipments… and let go of most of our people already this year.”","2025-04-23T02:00:48.085Z"
"rwilliams48239.bsky.social","It appears Whiskey Leaks (a.k.a. Secretary Too Many Manhattans Hegseth) cannot be trusted with sensitive information, a cell phone or social chat applications. >pretends to be shocked< 🤦‍♀️ #SignalGate #HegsethMustResign","2025-04-20T22:40:41.732Z"
"rwilliams48239.bsky.social","Constituents to Chuck Grassley: """"Are you bringing back that guy from El Salvador?"""" Senior Citizen: “If I get an order to pay a ticket to pay $1200 and I just say ‘no’, does that stand up? Because he just got an order from the Supreme Court and he just said ‘screw it’” “I’M PISSED!”","2025-04-15T20:46:34.626Z"
"rwilliams48239.bsky.social","All of my work shirts are Gildean (made in El Salvador). I can wear those I already have forever. See product/brand list in comments. We know our “selective shopping” works (google Target). #LetsDoThis 🙌","2025-04-15T00:39:15.552Z"
"rwilliams48239.bsky.social","No notes","2025-04-12T13:03:22.420Z"
"rwilliams48239.bsky.social","The VA is having mental health clinicians work in cubicle farms and tell veterans they can’t guarantee their privacy because of SecVA’s asinine return to work order. There isn’t room! Veterans will suffer. That’s the real goal. Force VA to fail. The price? Veterans. Enough is enough.","2025-04-12T01:15:53.928Z"
"rwilliams48239.bsky.social","From Reddit: Target stock declines 10 straight weeks in a row. Best comments on this thread: - Go fash, lose cash! - Go Trump, get dumped!","2025-04-12T06:38:34.466Z"
"rwilliams48239.bsky.social","#SignalGate - Pepperidge Farms remembers and so do I!","2025-04-12T02:26:26.043Z"
"rwilliams48239.bsky.social","Okay - who did this?! (My hero 💙) “CaroLIAR Lying LIARvitt”","2025-04-11T19:01:42.138Z"
"rwilliams48239.bsky.social","If you're a billionaire, then you'll barely notice a few thousand dollars a year in higher prices at the store from these Trump tariffs - plus you can count on him to get you another big tax break for the wealthy. But for everyone else, this is a big deal, and a bad one.","2025-04-11T00:08:34.409Z"
"rwilliams48239.bsky.social","Texas Attorney General Ken Paxton has officially announced that he is running for Senate. So here's everything you need to know about him—if you care about reality. Let's start with the fact that he had to take literal ethics classes after he was indicted for securities fraud. (1/5)","2025-04-09T00:00:44.217Z"
"rwilliams48239.bsky.social","The fight for democracy is the cause of our time. I created Democracy Docket to be fearlessly pro-democracy. No corporate overlords, no compromises, it will never obey. Sign-up now. newsletters.democracydocket.com/all-newsletters","2025-04-09T00:55:24.908Z"
"rwilliams48239.bsky.social","Billionaires should not have to worry though","2025-04-07T23:08:06.177Z"
"rwilliams48239.bsky.social","If you want to understand why MAGA’s are still “bought in” despite the repeated financial hits we all have taken, this may help: #MakeItMakeSense 🤦‍♀️🙄","2025-04-07T22:09:06.662Z"
"rwilliams48239.bsky.social","Republicans in Congress can repeal every tariff tomorrow and take Trump’s tariff authority away from him. But they choose not to. So every Republican in Congress owns EVERY SINGLE BIT of this. You can’t hide from the voters forever.","2025-04-07T00:48:36.719Z"
"rwilliams48239.bsky.social","The global stock markets have declared an unequivocal vote of no confidence in Donald Trump. It’s time for Congress to do the same.","2025-04-07T02:33:30.176Z"
"rwilliams48239.bsky.social","""""So Trump will impose these tariffs and sit back and wait for other world leaders to petition the king with their offerings that will ultimately expand his own power, all the while we are the collateral damage. We all get thrown under the bus; 350 million people suffer so that one man can benefit.""""","2025-04-06T21:29:22.240Z"
"rwilliams48239.bsky.social","does the stock market not know about trans kids playing sports with their friends or something","2025-04-06T23:33:06.886Z"
"rwilliams48239.bsky.social","No matter who or what Trump bombs this week, I refuse to get distracted.","2025-04-07T00:32:03.902Z"
"rwilliams48239.bsky.social","Based on futures, will be UGLY 😭 No worries, though the turd-reich business magnate (from his golf course) posts “it’s already working”. (Pretty sure he was referring to fleecing the middle-class of their life savings to fund his 1% tax cut)","2025-04-07T00:48:44.694Z"
"rwilliams48239.bsky.social","I’m no investment genius but straight down - is bad right? 🙄 *Note all red arrows depict various “brilliant business moves” of the orange shit-gibbon. Revised Retirement plans: I’ll die at my desk or spend my golden years as a Walmart greeter. Buckle up for black Monday 😭","2025-04-06T23:41:31.475Z"
"rwilliams48239.bsky.social","In the dead of night, the Senate advanced Trump’s budget. A great night for billionaires — a bad night for everyone else.","2025-04-05T06:50:47.168Z"
"rwilliams48239.bsky.social","The good old days…","2025-04-05T03:55:59.336Z"
"rwilliams48239.bsky.social","Some of you are so creative. I love memes. #PenguinGate","2025-04-04T21:33:44.944Z"
"rwilliams48239.bsky.social","Friends in Michigan - Many locations to join in peaceful protests this Saturday: #HandsOff #Indivisible","2025-04-03T11:33:22.769Z"
"rwilliams48239.bsky.social","It’s stunning to me that the New York Times did not put the story on the bloodbath at the NIH, CDC, and FDA on its front page this morning.","2025-04-02T13:49:24.100Z"
"rwilliams48239.bsky.social","#SignalGate - throw as much 💩 at the wall you want Mandarin Mussolini & minion clowns, THIS is NOT going away. I would add that Lying Tulsi needs to resign as well.","2025-04-02T20:46:33.876Z"
"rwilliams48239.bsky.social","#SignalGate #WhiskeyLeaks @housedemocrats.bsky.social @democrats.senate.gov Any thoughts on this? In my mind It most definitely is not. You need to stay on this.","2025-03-31T19:35:32.099Z"
"rwilliams48239.bsky.social","I have posted that since the 3 rd term story broke - this is to distract from Signal Gate - keep the pressure up - Do Not be so easily manipulated 🤦‍♀️ @nbcnews.com @abcnewsbot.bsky.social @nytimes.com @washingtonpost.com @theatlantic.com #SignalGate","2025-03-31T15:16:14.458Z"
"rwilliams48239.bsky.social","If Trumpty-Dumpty is working with the Russians to screw up America, he's doing a great job. Eggs, $11 a dozen. Health & Human Services down the dumper, ditto VA. If you call Social Security, they tell you to call back later. Guys 'n gals, this is more fucked up than Peter O'Toole on his birthday.","2025-03-30T15:01:19.616Z"
"rwilliams48239.bsky.social","Way to go!!! downtown Grand Rapids, MI. Stand up for #TransRights #LGBTQRights #Protest #Michigan","2025-03-30T18:34:25.050Z"
"rwilliams48239.bsky.social","Pam Blondie","2025-03-30T18:01:34.040Z"
"rwilliams48239.bsky.social","They love this “run the government like a business” canard coz it conjures images of efficiency and accountability. The reality is, it’s about increasing profits for the few over the wellbeing of the many. If the government operated the way a business does, the citizenry should rightfully revolt.","2025-03-30T16:09:23.993Z"
"rwilliams48239.bsky.social","FIRE HEGSETH, WALTZ & GABBARD","2025-03-30T16:36:09.487Z"
"rwilliams48239.bsky.social","Republicans & independents - we told ya 🤦‍♀️","2025-03-30T17:14:43.076Z"
"rwilliams48239.bsky.social","‘They’re trying to bankrupt me’: A dairy farmer in West Virginia is feeling Trump’s government spending cuts, which ended up killing a lifeline for his business — a butter contract he had with a food bank that lost its funding reut.rs/4cgLvSo","2025-03-29T18:20:03.294Z"
"rwilliams48239.bsky.social","Let it begin.","2025-03-26T18:26:50.363Z"
"rwilliams48239.bsky.social","If you’re upset about the chaos and corruption Trump is inflicting on your country—whether your focus is the nihilistic dismantling of government, the economy, our foreign relations, or his threats to the rule of law—please join the nationwide marches on April 5. Learn more here 👉 handsoff2025.com","2025-03-29T15:11:58.595Z"
"rwilliams48239.bsky.social","Worth noting folks","2025-03-29T15:15:39.204Z"
"rwilliams48239.bsky.social","68 days in ✔️Wars not ended ✔️Economy in toilet ✔️Unemployment rising ✔️Prices on goods rising ✔️National security breech ✔️ElonAHole has all our data & billions in new Govt Contract ✔️Trade wars & more coming ✔️Alienated allies ✔️Still telling Americans annexing Greenland Canada & Panama Canal is totes okay","2025-03-29T15:13:54.737Z"
"rwilliams48239.bsky.social","Trump’s ceasefire is a lot like his infrastructure plan - nonexistent despite lots of hype and false promises.","2025-03-28T15:33:31.428Z"
"rwilliams48239.bsky.social","Trevor Milton donated $920,000 to Trump’s PAC last year. He never made political donations before that. bsky.app/profile/atru...","2025-03-28T19:34:00.217Z"
"rwilliams48239.bsky.social","#Signalgate Secretary of DUI Hegseth & No Signal Allowed (NSA) Waltz should be fired or resign. These are not serious or competent people 🤡🚗 The liars in front of Congress (Gabbert & Radcliffe also should resign)","2025-03-28T21:07:57.704Z"
"rwilliams48239.bsky.social","Orange man = bad for economy. We told ya 🤷‍♀️ You get what you vote for! #Trumpnomics Suck","2025-03-28T20:59:14.477Z"
"rwilliams48239.bsky.social",". 🚨Michigan Anti-Voter Bill⬇️⬇️⬇️ ✅Sign & Send Petition⤵️ •State Rep Stephanie Young 🚫 Vote NO on (HJR B)🚫 •Michigan Already Has Secure & Accurate Systems In Place To Verify Eligibility! •Would Create New Bureaucratic Hurdles That Risk Purging Eligible Voters! act.commoncause.org/letters/tell...","2025-03-26T15:29:11.944Z"
"rwilliams48239.bsky.social","Elon was always an asshat, many Americans just did not see it, and the press? Just like with the Mandarin Mussolini, all the press cares about is what boosts engagement $$ 🤷‍♀️ www.propublica.org/article/elon...","2025-03-26T15:02:20.626Z"
"rwilliams48239.bsky.social","Such a short tenure, yet Hegseth has made so many mistakes www.nytimes.com/2025/03/25/u...","2025-03-26T08:40:12.129Z"
"rwilliams48239.bsky.social","I challenge someone, please screen record how you sneak onto a signal chat","2025-03-26T02:51:32.527Z"
"rwilliams48239.bsky.social","Dictator Donald and the RNC are escalating their war on democracy, now demanding voter records from 48 states under the lie of cleaning rolls. It’s a smokescreen to purge legal voters, intimidate officials, and lay groundwork to steal elections. This is fascism masquerading as oversight. 1/2","2025-03-25T23:41:47.000Z"
