"user","post","date"
"rwilliams48239.bsky.social","So lying “economist” Peter Navarro is just as stupid as Pamela Jo Bondi? The Dow Jones is not “the stock market.” And it is indexed—the 50,000 doesn’t stand for $50,000.","2026-02-15T20:48:48.826Z"
"rwilliams48239.bsky.social","It is a disgrace that big law firms sold out, when they should be trying to defend against the autocratic assault on our democracy and elections… #WhereYouAt #WhatWillYouTellYourGrandchildren #Shameful","2026-02-15T22:45:17.759Z"
"rwilliams48239.bsky.social","This is concerning, that a rep feels they must post this. A lot in our coalition has felt the same way and worried about it, but didn’t think we’d be here publicly.","2026-02-14T01:27:52.265Z"
"rwilliams48239.bsky.social","NEW: A page from Bondi's burn book. This is a list of the searches by Rep Jayapal of the unredacted Epstein files. That means the DOJ grabbed her search terms from the computers they set up for members of congress to view the Epstein files to use as ammunition. The photo is from Reuters.","2026-02-11T23:36:23.833Z"
"rwilliams48239.bsky.social","This is some genuinely psycho shit...","2026-02-11T20:02:51.944Z"
"rwilliams48239.bsky.social","The New “Alt-Reich”: Epstein and Silicon Valley’s High-Tech War on Democracy From Eugenics to “Patchwork” Sovereignty: Inside the Intellectual Web of the Modern Broligarchy That is Connected to Jeffrey Epstein and the Trump Administration open.substack.com/pub/thelefth...","2026-02-09T23:44:41.912Z"
"rwilliams48239.bsky.social","“If passed, the SAVE Act will disenfranchise 20 million voters.” Trump has pushed the Republicans to hold a vote in the House this week. Call your Rep and your Senators. 202-224-3121","2026-02-10T01:11:33.055Z"
"rwilliams48239.bsky.social","Now we learn from Reps of both parties who saw the unredacted Epstein files today that Trump, Bondi, & Blanche are covering up the absolute worst things in the Epstein files to protect the wealthy, powerful and politically connected. DOJ is being run by criminal co-conspirators.","2026-02-09T23:26:28.976Z"
"rwilliams48239.bsky.social","Ghislaine Maxwell got into jail for engaging in pedophilia and sex trafficking. Ghislaine Maxwell hopes to get out of jail by engaging in extortion. I'm beginning to get the impression that Ghislaine Maxwell enjoys criming.","2026-02-09T20:06:41.613Z"
"rwilliams48239.bsky.social","Tax cuts for giant corporations and the super rich. Paid for by cuts to the social safety net for everyone else. Trickle-up economics.","2026-02-07T19:02:01.789827Z"
"rwilliams48239.bsky.social","BREAKING: Epstein files show the FBI, under Kash Patel and Dan Bongino, internally discussed “clear and specific guidance” to redact images of former U.S. presidents, a secretary of state, and other celebrities. Support my Epstein Files research work, donate here: buymeacoffee.com/alexjungle","2026-02-07T18:35:07.902Z"
"rwilliams48239.bsky.social","more than anything","2026-02-06T22:54:19.912Z"
"rwilliams48239.bsky.social","Deputy Attorney General Todd Blanche needs to resign. He got the law wrong about patronizing sex parties with alleged child trafficking. He failed to redact names of victims & pictures of children. AND he moved Ghislaine Maxwell to a minimum-security prison & got her a puppy.","2026-02-03T20:45:00.822Z"
"rwilliams48239.bsky.social","Bulk sales of tickets to Melania are being promoted through emails from WH Faith Office advisor Paula White-Cain using her National Faith Advisory Board list. People are encouraged to purchase 30 tickets at a time to “support our First Lady.” meidasnews.com/news/exclusi...","2026-02-02T22:52:48.790Z"
"rwilliams48239.bsky.social","Precisely this. It’s too classified to send to *some* members of Congress. But there are absolutely folks who are (or could be) cleared to be read in. Even if it’s got to be a Gang of Eight only issue, send it to Congress.","2026-02-02T16:32:24.300Z"
"rwilliams48239.bsky.social","This is the way ⬇️ www.businessinsider.com/tech-ai-boyc...","2026-02-02T05:01:10.996Z"
"rwilliams48239.bsky.social","www.youtube.com/live/xiSmcNV...","2026-02-02T03:25:10.620Z"
"rwilliams48239.bsky.social","🤨","2026-02-02T04:15:24.134Z"
"rwilliams48239.bsky.social","Good to see that many Dem elected officials now want to be seen getting involved in the cases of immigrants who have been wrongly detained by ICE. Let's spare a word for @vanhollen.senate.gov, who did this for Kilmar Abrego Garcia back when wise pundits said this was politically dangerous.","2026-02-01T23:32:21.505Z"
"rwilliams48239.bsky.social","BREAKING: The two federal immigration agents who fired on Minneapolis protester Alex Pretti are identified in government records as Border Patrol agent Jesus Ochoa and Customs and Border Protection officer Raymundo Gutierrez.","2026-02-01T21:10:18.072Z"
"rwilliams48239.bsky.social","Seems like one of those issues that should greatly concern everyone regardless of their politics.","2026-01-29T23:43:25.343Z"
"rwilliams48239.bsky.social","“Not at all” For people out here believing Homan is some sort of savior, and acting like anything anyone in this regime says can be counted on","2026-01-30T04:12:07.234Z"
"rwilliams48239.bsky.social","The Fulton County search warrant & its implications for the 2026 & future elections is critically important news & not getting the coverage it merits. Read my most recent piece to get the download & understand why this is such a significant development. open.substack.com/pub/joycevan...","2026-01-30T06:14:59.616Z"
"rwilliams48239.bsky.social","ICE activity has not noticeably tapered off yet here and in fact this week they seem to be focused on terrorizing kids at bus stops and schools.","2026-01-28T23:59:09.389Z"
"rwilliams48239.bsky.social","This is why we can’t have nice things. Like health insurance, consumer protections, EPA, clean energy credits, snap-ed, energy assistance, nursing care standards, to name just a few…","2026-01-29T00:42:24.407Z"
"rwilliams48239.bsky.social","You see ICU Nurse Alex Pretti assisting veterans learning to walk again. Donald Trump sees a domestic terrorist and suckers and losers.","2026-01-28T22:31:03.174177425Z"
"rwilliams48239.bsky.social","I don't know how many times we will be told by the legacy media that Trump is moderating or backing off only to then see he is worse than ever. He is an authoritarian. He enjoys the cruelty. And the first thing he had Pam Bondi do after the shooting was to try to leverage it to get the voter files.","2026-01-28T03:30:04.818Z"
"rwilliams48239.bsky.social","BREAKING: Supreme Leader Trump has repealed the Second Amendment","2026-01-27T23:04:41.928Z"
"rwilliams48239.bsky.social","But, like everyone who causes negative poll numbers or bad press after following Trump’s orders she’s out. Being quietly moved to the southern border. (Not as much fun as being an Ambassador) Expect more cowgirl cosplay ads soon.","2026-01-28T03:45:30.515Z"
"rwilliams48239.bsky.social","Lest we forget! Keep them alive. Say their names! Silverio Villegas Gonzáles Alex Pretti Renee Good Keith Porter Luis Beltran Yanez-Cruz Heber Sanchez Domínguez Victor Manuel Diaz Parady La Geraldo Lunas Campos Luis Gustavo Núñez Cáceres STOP ICE ‼️","2026-01-27T18:37:22.054Z"
"rwilliams48239.bsky.social","In all seriousness, it's a good thing that these ICE goons are stupid enough to keep announcing their criminal intentions to people recording them.","2026-01-27T22:16:14.473Z"
"rwilliams48239.bsky.social","www.youtube.com/watch?v=5SaD...","2026-01-27T20:57:55.191Z"
"rwilliams48239.bsky.social","As usual, Trump has lied to everyone, including @governorwalz.mn.gov & all media to kill story “Personnel change” was to quell public outrage after border patrol agents execute Alex Pretti Saturday #StayAngry #DoNotLetUp #KeepRecordingEverything #KeepProtesting #HomanIsWorse #ImpeachMiller","2026-01-27T23:05:21.943Z"
"rwilliams48239.bsky.social","Exactly THIS ⬇️","2026-01-27T00:41:41.517Z"
"rwilliams48239.bsky.social","#ThumbBovino needs to be FIRED. As does puppy-killer Noem & Patel. ALL brought up on state charges, along with the 10yr & 8yr veterans of ICE who we watched commit murder. Impeach Vance for telling these “agents” they have full immunity. Nothing less than this is acceptable. Full stop. Pass it on.","2026-01-27T00:13:26.685Z"
"rwilliams48239.bsky.social","You know Alex Pretti & Renee Good—the 2 white people ICE killed. ICE has also killed Keith Porter, a Black man, Parady La, a Cambodian man, & 5 Latinos—Heber Sanchaz Domínguez, Victor Manuel Diaz, Luis Beltran Yanez-Cruz, Luis Gustavo Nunez Caceres, and Geraldo Lunas Campos. 9 TOTAL. ABOLISH ICE.","2026-01-26T02:32:37.673Z"
"rwilliams48239.bsky.social","This morning, I recorded a video on TikTok about why DHS’s arguments for the power to enter homes without judicial warrants in immigration cases are bunk. Nine hours later, TikTok still says my video is “under review,” and can’t be shared. Well, here’s a link: georgetown.box.com/v/Vladeck-IC...","2026-01-26T02:00:47.176Z"
"rwilliams48239.bsky.social","Chief Strategist for Rand Paul.","2026-01-24T21:14:21.654Z"
"rwilliams48239.bsky.social","LA doesn’t miss 🔥 Freeway overpass just now (405)","2026-01-25T00:03:30.803Z"
"rwilliams48239.bsky.social","Saw today’s #IceExecution of another American, listened to Rick Wilson’s latest. I too am fantasizing about #StevenMillerGoebbels & #ThumbBovino being first up for our version of Nuremberg Trials For them I shall fully support the death penalty.","2026-01-25T00:48:45.802Z"
"rwilliams48239.bsky.social","This is the go fund me sent to Alt National Parks for Alex Pretti”s loved ones (organized by @keithedwards.bsky.social) * Please share widely Well, baby Link: www.gofundme.com/f/alex-prett...","2026-01-25T00:25:08.592Z"
"rwilliams48239.bsky.social","JD “reverses” (aka admits he was lying) This dude lies so easily, even when it’s on video They think we are morons","2026-01-23T02:54:03.688Z"
"rwilliams48239.bsky.social","This is the solution to leaving a six year old on the street alone after taking her father over the weekend? The public outcry was just too great - Did Hoeman & Noem directed them to just take the kids too? Seems likely. #Barbaric #DefundIce","2026-01-22T01:33:31.426Z"
"rwilliams48239.bsky.social","Stop what you’re doing and read this whistleblower report. ICE has been training its agents that they don’t need a judicial warrant to break down your door - a blatant violation of the 4th Amendment. www.documentcloud.org/documents/26...","2026-01-21T22:58:13.417Z"
"rwilliams48239.bsky.social","Breaking WaPo: The recent death of a detainee at an immigrant detention camp in Texas has been officially deemed a homicide, according to an autopsy report released Wednesday by the El Paso County Office of the Medical Examiner.","2026-01-22T00:55:52.660Z"
"rwilliams48239.bsky.social","So pretty much “tariff this M’Fer!” ? Sadly this is likely the only thing the decrepit, smelly, demented, rotting, psychopathic narcissist may understand. Unfortunately it hurts everyone, which he clearly does not give a flip about. I could have been more descriptive above but you understand me","2026-01-19T23:58:26.908Z"
"rwilliams48239.bsky.social","Someday corporations and technology companies will pretend they were always against this","2026-01-19T22:51:40.022Z"
"rwilliams48239.bsky.social","Men who defend Jonathan Ross for murdering Renee Good are not safe to be around. End those relationships.","2026-01-19T15:10:16.370Z"
"rwilliams48239.bsky.social","Dr. Martin Luther King, Jr. dedicated his life fighting for equity and justice. He taught us that even in the face of intimidation and discrimination, we must never stop working towards a better future – a lesson that feels especially relevant today.","2026-01-19T14:01:58.391Z"
"rwilliams48239.bsky.social","Time to shutdown ice youtu.be/TP5TmVRJhCI","2026-01-19T02:56:38.735Z"
"rwilliams48239.bsky.social","👇👇","2026-01-18T16:03:40.381Z"
"rwilliams48239.bsky.social","My brother went deep...","2026-01-18T05:36:04.166Z"
"rwilliams48239.bsky.social","This dude rules","2026-01-15T03:32:04.076Z"
"rwilliams48239.bsky.social","This ⬇️","2026-01-17T21:42:03.318Z"
"rwilliams48239.bsky.social","Labor calls a general strike in Minnesota to protest the ICE invasion of the state.","2026-01-16T22:01:34.535Z"
"rwilliams48239.bsky.social","Better: """"The federal government's narrative is consistently horseshit and should be ignored.""""","2026-01-15T03:37:49.596Z"
"rwilliams48239.bsky.social","Senate Democrats absolutely have to shut the govt down to stop this ICE insanity in the Twin Cities. This is not sustainable & cannot be normalized. Any Democratic vote to provide money to the thugs who are brutalizing this community is a grave betrayal to the people here. Accountability can't wait.","2026-01-15T03:37:56.065Z"
"rwilliams48239.bsky.social","This is fascism, pure and simple.","2026-01-13T02:16:41.281Z"
"rwilliams48239.bsky.social","ICE is UNHINGED","2026-01-12T23:38:01.964Z"
"rwilliams48239.bsky.social","By now, almost everyone has watched the videos of Renee Nicole Good’s murder. It has created two camps: Those who believe in justice see the vehicle turn away from Jonathan Ross, the ICE Killer. Those who believe in fascism pretend the vehicle turned into Jonathan Ross, the ICE Killer.","2026-01-11T12:39:46.972Z"
"rwilliams48239.bsky.social","A woman recording an ICE agent tells him """"Shame on you."""" The agent responds, """"Have you all not learned from the past couple of days?"""" """"Learned what?"""" she asks Then he knocks her phone out of her hand","2026-01-10T14:52:13.440Z"
"rwilliams48239.bsky.social","100% THIS ⬇️ If you are anyone but a white MAGA Christian - you are less than human, you do not matter.","2026-01-09T23:37:01.665Z"
"rwilliams48239.bsky.social","This guy probably knows a lot about a lot of people.","2026-01-08T21:22:56.801Z"
"rwilliams48239.bsky.social","Serious Question. Who trusts Trump’s DOJ and Kash Patel’s FBI to investigate an ICE officer shooting of an American Citizen? Show of hands. 🙅‍♀️","2026-01-09T00:13:12.013Z"
"rwilliams48239.bsky.social","How does an entire administration not understand this basic reality? Venezuelan oil is not profitable. Heavy crude takes years to extract profitably. It requires massive upfront investment, specialized infrastructure, refineries configured for heavy oil, long timelines, and political stability. 1/2","2026-01-04T22:23:11.299Z"
"rwilliams48239.bsky.social","“We’re supposed to believe President Weekly Dementia Test is suddenly capable of managing an occupied country, hostile terrain, armed resistance, oil infrastructure, global backlash, and domestic fallout without immediately fucking it up.“","2026-01-04T22:24:48.947Z"
"rwilliams48239.bsky.social","And there it is:","2026-01-03T15:31:12.284Z"
"rwilliams48239.bsky.social","Not a bad idea… “whoopsie… did I do that?” 🤷‍♀️","2026-01-03T03:11:08.753Z"
"rwilliams48239.bsky.social","Community members made music and noise outside the Hampton Inn where ICE goons stayed in Eagan, Minnesota.","2026-01-03T01:46:44.474Z"
"rwilliams48239.bsky.social","“Then they came for me And there was no one left To speak out for me”","2025-12-31T18:13:35.555Z"
"rwilliams48239.bsky.social","Trump calling his boss to get his marching orders before his meeting with Zelensky. This is standard operating procedure for Trump. Fuck Putin. Fuck Trump. Say a few prayers for or have some positive thoughts for Zelensky. He’s gonna need them.","2025-12-28T17:49:25.224Z"
"rwilliams48239.bsky.social","“The decision to bring charges against President Trump was mine, but the basis for those charges rests entirely with President Trump and his actions ... I would do so regardless of whether the President was a Republican or Democrat."""" trib.al/2SjC4D5","2025-12-28T01:50:58.316503Z"
"rwilliams48239.bsky.social","Get ready for the “Trump was a young playboy” propaganda even though he was 50 and the girls were 14.","2025-12-21T02:03:30.617Z"
"rwilliams48239.bsky.social","Jake Paul and Andrew Tate both got their asses whooped this weekend. Maybe we should go ahead and let these trumpette puppet magas have their """"hunger games,"""" so everyone can see these fake ass fuckwits for what they really are, losers.","2025-12-21T04:20:25.319Z"
"rwilliams48239.bsky.social","Today, we're learning why DOJ didn't release the redacted files last March. Because the multitude of redactions exposes how much they're covering up.","2025-12-19T23:35:15.496Z"
"rwilliams48239.bsky.social","The White House has been caught. The administration inserted a photo of Bill Clinton, Michael Jackson, and Diana Ross into the Epstein files and falsely implied it showed them with victims. In reality, it’s a publicly available fundraiser photo featuring Jackson and Ross’s own children.","2025-12-20T12:33:16.088Z"
"rwilliams48239.bsky.social","The Epstein Files, everybody!","2025-12-19T21:13:36.537Z"
"rwilliams48239.bsky.social","Imagine being a 14, 15, or 16 year old trafficked to this nightmare list 🤢🤮 #EpsteinCoverUp","2025-12-19T23:29:20.926Z"
"rwilliams48239.bsky.social","Perfect. Nothing to see here, folks! 🤷🏼","2025-12-19T21:36:06.183Z"
"rwilliams48239.bsky.social","Hey! Remember when Barr (Bondi) withheld the Mueller (Epstein) documents for weeks so he (she) could mischaracterize what was in the Mueller (Epstein) Report and spin the findings for three weeks and then over-redact them? I sure do!","2025-12-19T19:45:25.268Z"
"rwilliams48239.bsky.social","Dan Bongino has been let go from the FBI to return to his podcast, just days before the ‘release of the Epstein files.’","2025-12-17T21:32:24.608Z"
"rwilliams48239.bsky.social","Massie: Previous presidents told us to go to war over WMDs that did not exist. Now it's the same playbook. Except we're told that drugs are the WMDs. If it were about drugs, we'd bomb Mexico or China or Colombia. This is about oil and regime change.","2025-12-17T19:24:32.499Z"
"rwilliams48239.bsky.social","It was never about drugs. It was always about oil.","2025-12-17T22:13:41.877Z"
"rwilliams48239.bsky.social","I don’t know, maybe it wasn’t the best idea to appoint a right-wing conspiracy theorist nut job podcaster as deputy director of the FBI.","2025-12-17T22:37:04.154Z"
"rwilliams48239.bsky.social","❄️ ❄️ ❄️ Bongino couldn’t handle the pressure. Now he runs back to yelling conspiracies he knows aren’t true into a microphone for cash to dumbed-down Neanderthals.","2025-12-17T22:20:20.120Z"
"rwilliams48239.bsky.social","💀☠️","2025-12-16T14:44:31.091Z"
"rwilliams48239.bsky.social","Susie Trump, what have you done? Did anyone start a pool for which Ambassadorship Susie gets? I’m taking “shithole Somalia” FTW.","2025-12-16T14:32:01.163Z"
"rwilliams48239.bsky.social","Are they actually trying to position Kelly to be strongest potential democratic presidential candidate for 2028? I thought Susie Trump was more savvy than that. Seems like a poor choice to persecute protected speech, especially when your target is Senator Mark Kelly, veteran, pilot, astronaut. 🤷‍♀️","2025-12-16T06:07:53.775Z"
"rwilliams48239.bsky.social","Opinion | I was a lifelong liberal Democrat. Then I read Donald Trump's triumphant Truth Social announcement that he had passed another cognitive exam.","2025-12-14T12:40:30.209Z"
"rwilliams48239.bsky.social","IN MEMORIAM: ROB REINER FILMMAKER & PATRIOT 1947-2025 Rob Reiner was a champion of democracy. Today 50501 honors his legacy We’re grateful to Reiner for his commitment to restoring our democracy","2025-12-15T23:42:52.729Z"
"rwilliams48239.bsky.social","Careless misinformation like this during a school shooting can get people killed. Schools will now have to update their procedures to tell students to ignore Trump’s posts during school shootings. Hopefully no one was harmed due to Trump’s sharing of false information.","2025-12-13T23:15:40.826Z"
"rwilliams48239.bsky.social","Just when I thought I couldn't admire the man more... 🎯 🎯 🎯 💯 💯 💯 👍 👍 👍","2025-12-13T18:58:29.390Z"
"rwilliams48239.bsky.social","Well, I think that Trump’s dismal approval ratings and the Republican Party having no answers on health care and needing a big distraction as the deadline looms means it’s time for Trump to invade Venezuela.","2025-12-13T03:06:50.063Z"
"rwilliams48239.bsky.social","Here's a meme for you. You're welcome.","2025-12-13T03:37:59.432Z"
"rwilliams48239.bsky.social","(🚨) MAJOR BREAKING NEWS: FBI Admits in Court Filing That It Is Aware of Epstein “Client Lists”—Months After the Personal Lawyer for Longtime Epstein Wingman Donald Trump, Pam Bondi, Told America No Such Lists Existed Take from this the obvious conclusion.","2025-12-13T00:01:23.158Z"
"rwilliams48239.bsky.social","""""By shouting things like 'our prices are coming down tremendously,' Trump is telling voters to 'reject the evidence of their eyes and ears.' But this is 2025, not 1984, and voters aren’t buying it.""""","2025-12-13T00:47:21.166Z"
"rwilliams48239.bsky.social","Socialism for me, not for thee. How very Republican. Farmers received socialism bailout in 2018, 2019 & 2020 Not required with Biden because he’s intelligent. Farmers sold crops to China 2024, farmers voted for socialism Trump tariffs killed crop sales again Taxpayers children in debt for bailouts","2025-12-12T21:00:57.095Z"
"rwilliams48239.bsky.social","Buttigieg on Indiana: """"The big part of how Trumpism works is to make you feel totally disempowered. To make him feel inevitable. And yet the clear takeaway from this is he is not unstoppable and you are not without power.""""","2025-12-12T01:22:57.101Z"
"rwilliams48239.bsky.social","The reports are accurate, he does get off on insulting women. Poor Susie, you bought that ticket yourself! 👀 Me thinks it would be better to be a female black reporter asking a question he cannot answer. JS 🤷‍♀️","2025-12-10T05:06:49.019Z"
"rwilliams48239.bsky.social","Turns out Trump was helping to bring about a golden age - the Golden Age of China.","2025-12-09T01:51:11.329Z"
"rwilliams48239.bsky.social","🇬🇧 🇺🇸 WATCH — @mrjamesob.bsky.social: “I’m going to say this slowly… The President of The United States of America has sided with Putin against the United Kingdom. He has put the whole of Europe in the crosshairs.”","2025-12-09T18:25:38.218Z"
"rwilliams48239.bsky.social","It’s important to remember that Laura Ingraham went to Dartmouth. She’s not as stupid as she sounds. She’s just a shameless liar.","2025-12-09T23:41:13.728Z"
"rwilliams48239.bsky.social","It is absolutely wild that the guy who won’t stop yelling about law and order is now personally stepping in to keep January 6 documents hidden from the police officers who were attacked that day. He knows exactly what’s in those files and he is terrified the country will see it.","2025-12-09T21:26:00.024Z"
"rwilliams48239.bsky.social","December 7, 2025","2025-12-08T07:33:17.965Z"
"rwilliams48239.bsky.social","Great financial crisis? You mean when the housing market collapsed, banks went under, our GDP sank, the working class lost trillions in net worth and unemployment soared? Seems like a repeat of the last time we tried to bully the world with isolationist tariffs. Not good.","2025-12-08T06:30:30.944Z"
"rwilliams48239.bsky.social","Ron called it correctly again So ashamed of this administration being Un-American in undermining of Ukraine, having zero response to attempt on Zelenski’s plane, Russian drones over France and Russia’s continued acts of aggression #WarCriminals #Traitors","2025-12-07T18:07:22.101Z"
"rwilliams48239.bsky.social","842,000 Americans died from overdoses in the last 25 years, 500,000 from opioids. If we’re hunting narco-terrorists we can probably stop blowing up fishing boats and start blowing up boardrooms.","2025-12-05T04:02:46.220Z"
"rwilliams48239.bsky.social","“OK, you can gerrymander to cheat in elections, but only if it hurts nonwhite voters.” - US Supreme Court","2025-12-05T14:43:05.094Z"
"rwilliams48239.bsky.social","The Golden Age.","2025-12-05T14:48:01.166Z"
"rwilliams48239.bsky.social","A """"FIFA Peace Prize"""" is tantamount to getting an """"AutoZone Best Actor in a Dramatic Play"""" award. And """"I want to really save lives"""" is rich coming from the homicidal slob who is murdering people on fishing boats in the Caribbean.","2025-12-05T19:36:06.355Z"
"rwilliams48239.bsky.social","The White House has launched a webpage to report """"media bias"""" tips. It would be a pity if it were flooded with tips about every show on Fox News. www.whitehouse.gov/articles/202...","2025-12-05T01:27:31.707Z"
"rwilliams48239.bsky.social","Reposting this everyday until Pete Hagueseth faces justice for his crimes against humanity.","2025-12-03T17:09:14.542Z"
"rwilliams48239.bsky.social","Actually, only one person has the power of the pardon. If you are an American listening to the string of lies out of his mouth & not connecting these dots🔻 you may be the stupid in our country. JS 🤷‍♀️ #DepartmentOfMurder","2025-12-04T00:10:42.068Z"
"rwilliams48239.bsky.social","#Fact","2025-12-04T00:03:23.658Z"
"rwilliams48239.bsky.social","I caught up on South Park and LAWDY. 👀 I am so HERE for the brutal depiction of current cabinet. If you have never watched it, I highly recommend this season. Rating: ⭐️⭐️⭐️⭐️⭐️ Also, if you are like me and prone to outbursts of laughter do not drink anything while watching. I nearly died.","2025-12-03T23:57:54.135Z"
