"user","post","date"
"rwilliams48239.bsky.social","Reposting this everyday until Pete Hagueseth faces justice for his crimes against humanity.","2025-12-02T20:36:30.364Z"
"rwilliams48239.bsky.social","A policy expert described Education Secretary Linda McMahon’s push in favor of private schools as a “great American heist,” funneling money from public schools: “It’s a strategic theft of the future of our country, our kids and our democracy.” (Published October 2025)","2025-12-03T01:00:11.849299307Z"
"rwilliams48239.bsky.social","People say they want to manufacture real things in America again BUT they complain that it’s “inappropriate” and “not productive” to talk about how we need lots of guillotines. Like make up your minds!","2025-12-01T01:38:25.445Z"
"rwilliams48239.bsky.social","If the Venezuelan sailors were enemy combatants, then the 2nd strike is a war crime. If the Venezuelan sailors weren’t enemy combatants, then both strikes are criminal murder. It’s that simple.","2025-11-30T20:42:20.707Z"
"rwilliams48239.bsky.social","Walmart and McDonald’s are among the top employers of workers who rely on food stamps. McDonald's CEO raked in $18.2M last year — over 1,000x the company's median employee pay. Walmart's CEO pocketed $27.4M — 930x the company's median employee pay. See the problem?","2025-11-30T17:30:10.017712Z"
"rwilliams48239.bsky.social","CEO-to-worker pay ratio in 1965: 20-1 CEO-to-worker pay ratio in 1990: 75-1 CEO-to-worker pay ratio today: 280-to-1 Trickle-down economics was always a sham. Nothing has ever trickled down.","2025-11-29T23:01:08.909061Z"
"rwilliams48239.bsky.social","calmly explaining why we shouldn't bomb random venezuelan boats to people who argued we should torture random iraqis and then won an election by saying they were against a war they advocated for","2025-11-29T04:35:42.387Z"
"rwilliams48239.bsky.social","More cracks in the dam","2025-11-29T04:50:35.613Z"
"rwilliams48239.bsky.social","What do these corporations have in common? Netflix Ford Tesla T-Mobile Duke Energy DISH Network Metlife Dominion Energy United States Steel In recent years, they all paid their execs more than they paid in taxes. This is what a corporate-rigged system looks like.","2025-11-28T20:00:21.963590Z"
"rwilliams48239.bsky.social","Okay racist Miller. I’ll take your premise at face value provided you & administration consider: Perhaps, manufacturing a “war on drugs” (fentanyl my ass!) in order to change Venezuelan regime (for oil) might just create a whole new generation of American-hating terrorists. Thoughts Asshat?","2025-11-29T03:22:20.823Z"
"rwilliams48239.bsky.social","A reminder: Trump 1.0 ordered the Afghanistan withdrawal, and Trump 2.0 granted the shooter asylum this past April. Trump 2.0 also dismantled the joint terrorism task force, and gutted our national security apparatus.","2025-11-27T18:59:00.975Z"
"rwilliams48239.bsky.social","Hubs dragged me out for an early morning icy walk. But there were otters!","2025-11-27T17:53:15.266Z"
"rwilliams48239.bsky.social","Republicans say Democratic lawmakers are causing discord and distrust by reminding service members to follow their oath. I think what's bringing discord and distrust is the America first movement online is a bunch of bot farms coming from Nigeria, Russia, and Iran.","2025-11-25T00:39:30.385Z"
"rwilliams48239.bsky.social","Dear lord.","2025-11-24T21:08:19.619Z"
"rwilliams48239.bsky.social","""""Court video showed ICE agents, who allegedly had a 12-pack of Modelo in their car... """"“This is great,” an officer said as they started following Martinez. “This is fun,” another replied. www.charlotteobserver.com/news/local/c...","2025-11-24T20:13:43.865Z"
"rwilliams48239.bsky.social","I’m seeing a comment from an OPM official that DOGE is disbanded reported in Reuters get picked up by other outlets, but the only thing that is real is the appropriation logs, don’t say it’s over until it stops being reported here: openomb.org/search?term=...","2025-11-24T16:09:26.350Z"
"rwilliams48239.bsky.social","There is no administrator of DOGE? There is no administrator of DOGE? There is no administrator of DOGE? There is no administrator of DOGE? There is no administrator of DOGE? There is no administrator of DOGE? There is no administrator of DOGE? THERE IS NO ADMINISTRATOR OF DOGE?????? #WITAOD","2025-11-24T15:59:44.036Z"
"rwilliams48239.bsky.social","As someone who is going to be needing *lots* of care from nurses in the very near future, maybe it wasn't the best idea to insult all of them. But Donald is smart like that.","2025-11-24T19:40:12.393Z"
"rwilliams48239.bsky.social","6 people have died from a nationwide listeria outbreak. 31 babies have been hospitalized with botulism from contaminated baby formula. Instead of firing crucial FDA employees & attacking the agency, Trump should be hiring more experts to crack down on these dangerous outbreaks.","2025-11-24T19:45:12.599891Z"
"rwilliams48239.bsky.social","🚨BREAKING: The Republican National Committee (RNC) has filed a sweeping new lawsuit in Michigan that seeks to eliminate a state law that protects voting access for U.S. citizens living abroad. www.democracydocket.com/news-alerts/...","2025-11-24T19:45:39.131Z"
"rwilliams48239.bsky.social","If Pete Kegsbreath follows through with his threat to court martial hero astronaut, former naval officer, and current U.S. Senator, he will further tarnish and diminish the Pentagon, and ensure a LANDSLIDE midterm victory for Democrats. I STAND WITH SENATOR MARK KELLY!!!!🙏💪","2025-11-24T19:51:40.721Z"
"rwilliams48239.bsky.social","This is who she was. Passionate in her beliefs. Fiercely loyal to her friends. Never afraid to let you know exactly where she stood. The best. Fun Fact: I remember arguing with her over which of us hated Piggy the most. I was sure I did. She disagreed. It remains unresolved...","2025-11-24T20:15:58.019Z"
"rwilliams48239.bsky.social","Pentagon Blames Venezuela For Flow Of Drugs Into Kash Patel","2025-11-23T17:00:20.779893811Z"
"rwilliams48239.bsky.social","Sign at the US Military Academy at West Point:","2025-11-23T06:41:57.419Z"
"rwilliams48239.bsky.social","Ghislaine Maxwell: as she is doing time already, Congress shd immunize her which would force her to have to testify (she is currently objecting based on the 5th A). She can be prosecuted if she lies or refuses to testify. And it would make it that much more outlandish for Trump to later pardon her.","2025-11-23T17:50:52.050Z"
"rwilliams48239.bsky.social","National Interest: A Russian general & troops have been deployed to Venezuela to serve as advisers to the Venezuelan Armed Forces in infantry, drone operations, special forces, military intelligence, armor, aircraft & artillery. This sounds fine.😳 #ProudBlue #Pinks #TrumpisaNationalDisgrace","2025-11-23T17:56:42.250Z"
"rwilliams48239.bsky.social","I take on average 10,000 stills and a half hour of video every week. Most I'll never think about again. This I'll hold onto until I grow old. 4 hours ago. Zero edits. No recoloring. No cropping. Nothing. Just straight up reality. 🦑","2025-11-23T05:21:13.557Z"
"rwilliams48239.bsky.social","Must add: “Many people are saying” = it’s me, I am many people. (as evidenced by my steady storm of untruth missives on my shitty social network every night)","2025-11-23T07:48:03.551Z"
"rwilliams48239.bsky.social","They must be so confused this week. First they hate Muslims, then they ♥️ them. First nooses & swastikas are okay, now they aren’t. First they don’t accept princes from nations that attacked our journalists, now we give them grand parties. First they hate democratic socialist mayors, now they don’t","2025-11-22T07:15:33.414Z"
"rwilliams48239.bsky.social","💀☠️","2025-11-22T21:32:15.763Z"
"rwilliams48239.bsky.social","If you’re given illegal orders, it’s your patriotic duty to disobey.","2025-11-22T17:59:26.445Z"
"rwilliams48239.bsky.social","Thank you @rolandsmartin.bsky.social! 7 weeks on the NYT best-seller list! www.simonandschuster.com/books/Separa...","2025-11-22T17:28:15.565Z"
"rwilliams48239.bsky.social","Who remembers those early Palantir trades","2025-11-22T15:08:06.229Z"
"rwilliams48239.bsky.social","Keep this story in the news. """"Man Detained by ICE Found Dead, Hanging With Hands and Feet Tied—Attorney"""" www.newsweek.com/ice-detainee...","2025-11-21T17:33:47.066Z"
"rwilliams48239.bsky.social","""""Quiet, piggy!"""" #DonaldTrump","2025-11-21T03:15:36.791Z"
"rwilliams48239.bsky.social","Fox asked voters about the economy and accidentally ran a negative ad against Trump.","2025-11-21T03:41:37.722Z"
"rwilliams48239.bsky.social","💀☠️","2025-11-21T05:38:28.014Z"
"rwilliams48239.bsky.social","This morning, the President of the United States publicly called for the execution of six Members of Congress. Donald Trump must be removed from office. Today. He is a clear & present danger to this country. Right now. Invoke the 25th Amendment, or impeach & convict him. Now.","2025-11-21T05:02:17.749Z"
"rwilliams48239.bsky.social","Where’s that Soros-funded think tank anyway? We have work to do!!!","2025-11-21T01:16:47.467Z"
"rwilliams48239.bsky.social","It looks like Lindsey Halligan misled a grand jury, prosecutorial conduct equivalent to committing perjury, in order to manufacture an indictment against James Comey for… wait for it… perjury.","2025-11-19T23:38:09.303Z"
"rwilliams48239.bsky.social","But of course Trumpstein intervene’s on behalf of yet another known sex trafficker… Birds of a feather and all. 🤷‍♀️","2025-11-18T12:50:54.878Z"
"rwilliams48239.bsky.social","Of course Trump will sign it. Friday he ordered DOJ to re-open the investigation Bondi just closed citing “nothing to see here” after firing Maureen Comey (prosecutor that tried Maxwell) Another investigation “open” means files cannot be released… it will stay open forever🤷‍♀️ #TrumpCoverUp #GOPHoax","2025-11-17T22:20:23.263Z"
"rwilliams48239.bsky.social","""""Hell no. We don't agree w/ each other about finance, we don't agree w/ each other about immigration, we don't agree w/ each other on foreign affairs – but by God, we can agree we don't want to be ruled by a hand full of rich men who think they're better than the rest of us."""" Heather Cox Richardson","2025-11-17T20:55:20.143Z"
"rwilliams48239.bsky.social","😂","2025-11-06T04:09:56.960Z"
"rwilliams48239.bsky.social","No notes","2025-11-11T00:57:30.709Z"
"rwilliams48239.bsky.social","There’s still time to call senators. Let me explain. Sorry not sorry about the cat. He’s also really upset about this deal.","2025-11-10T20:07:30.576Z"
"rwilliams48239.bsky.social","Totally shocked about this but happy for good news!!","2025-11-10T18:05:03.722Z"
"rwilliams48239.bsky.social","The President wouldn't last five minutes as an air traffic controller, and after everything they've been through - and the way this administration has treated them from Day One - he has no business shitting on them now.","2025-11-10T16:53:54.814Z"
"rwilliams48239.bsky.social","ALL of this! And if you cave now - YOU are to blame, not the GOP. FIGHT FOR THE AMERICAN PEOPLE!","2025-11-10T02:00:36.117Z"
"rwilliams48239.bsky.social","I just hope the former Capitol PD officer who was accused in the story of being the J6 pipe bomber sues The Blaze and this writer. He got his 13 million viral views. Now it looks like maybe he’s talked to a lawyer about it.","2025-11-09T20:03:35.786Z"
"rwilliams48239.bsky.social","@peters.senate.gov @slotkin.senate.gov @schumer.senate.gov DO NOT NEGOTIATE WITH GOP TERRORISTS. The citizens of the US would like to have healthcare & be able to eat. For fucks sake! You look weak, pathetic and do nothing for your constituents.","2025-11-09T22:56:42.222Z"
"rwilliams48239.bsky.social","Absolutely. They should donate it to food banks as they seem to be just fine causing a hunger crisis.","2025-11-09T19:13:06.142Z"
"rwilliams48239.bsky.social","We’re got one more election to win this year and it’s in Tennessee: @aftynbehn.bsky.social, a state representative and former Indivisible group leader, is running in a special election to flip #TN-07. Join us on Thursday to learn how you can help Aftyn win: www.mobilize.us/indivisible/...","2025-11-09T18:18:50.844Z"
"rwilliams48239.bsky.social","The dumbest president in history strikes again","2025-11-09T17:52:48.675Z"
"rwilliams48239.bsky.social","NEW: EXCLUSIVE: I spoke to sources at FBI and DOJ that reviewed the Epstein files. It’s worse than the photos. I’ll let you know what they said today at 3:30 PM PT / 6:30 PM ET on @meidastouch.com. Link to show: www.youtube.com/live/hEi77Ib...","2025-11-09T17:24:45.483Z"
"rwilliams48239.bsky.social","youtu.be/tC15GjhzAJY #TrumpCancelledThanksgiving","2025-11-09T19:06:36.691Z"
"rwilliams48239.bsky.social","No notes #TrumpCancelledThanksgiving","2025-11-09T03:16:30.422Z"
"rwilliams48239.bsky.social","Trump fired the BLS director for reporting data he didn’t like. Now we can’t trust any of the numbers coming out of the govt because they lie about everything.","2025-11-09T01:20:16.859Z"
"rwilliams48239.bsky.social","Trump’s plan is for people to pay his banker friends hundreds of thousands more in interest on mortgages while they own a piece of your home until you die.","2025-11-09T01:55:37.028Z"
"rwilliams48239.bsky.social","The past 24 hours really exposed the Republicans’ non-plan on health care. Since they were unable to repeal the ACA, they intend to make health insurance premiums skyrocket so people can’t afford health care, which will ultimately make emergency rooms their primary care doctors.","2025-11-09T02:04:57.285Z"
"rwilliams48239.bsky.social","Who did this? 💀","2025-11-07T21:08:05.452Z"
"rwilliams48239.bsky.social","This move by Democrats today (which I called for 2 weeks ago) really exposed the Republican position. It smoked them out in the open. They refuse to extend the ACA subsidies which will cause insurance premiums to go up for 22 million people. It’s not about anything else.","2025-11-07T23:18:41.410Z"
"rwilliams48239.bsky.social","Today, Mike Johnson will keep the House adjourned for the 95th day out of the last 107. 12 days of work in 107 days. With full pay and benefits. The senate has been working, so this is not about the shutdown. It is about avoiding a vote to release the Epstein files.","2025-11-07T12:37:59.942Z"
"rwilliams48239.bsky.social","Like you I am celebrating Tuesday's victories. However, my job is not to sugarcoat things and tell you it's all fixed. It is to warning about what to expect next and fight back. That is why I wrote this and why I hope you read and share. www.democracydocket.com/opinion/what...","2025-11-06T02:43:36.527Z"
"rwilliams48239.bsky.social","Hey look. Communism.","2025-11-04T18:12:39.670Z"
"rwilliams48239.bsky.social","Americans should not have to choose between food & healthcare. Please do NOT cave to the bully strongman administration that cannot be trusted #TrumpGOPShutdown #HoldTheLine Cc: @democrats.senate.gov @housedemocrats.bsky.social @peters.senate.gov @hakeem-jeffries.bsky.social @slotkin.senate.gov","2025-11-05T07:24:17.882Z"
"rwilliams48239.bsky.social","“Jobs are booming” is Treasury Secretary-speak for “most-announced-job-cuts-for-a-full-year-since-2020.” “Inflation is falling” is Treasury Secretary-speak for “inflation-is-at-an-eight-month-high.”","2025-11-04T23:05:21.269Z"
"rwilliams48239.bsky.social","I didn’t think this night could get any better.","2025-11-05T06:06:32.532Z"
"rwilliams48239.bsky.social","What we know, 12:10am [Now in 2 parts] —Prop 50 wins —VA Dems flip Gov, LG, AG —Dems flip ≈13 seats in VA House —Dems defend NJ-Gov + Assembly —Dems win NJ+VA trifectas —Mamdani wins —PA Dems win supreme court —ME vote-restricting measure loses —GA Dems flip 2 statewide offices —Krasner & Bragg win","2025-11-05T05:09:46.789Z"
"rwilliams48239.bsky.social","Today, Mike Johnson will keep the House adjourned for the 91st day out of the last 103. 12 days of work in 103 days. With full pay and benefits. The senate has been working, so this is not about the shutdown. It is about avoiding a vote to release the Epstein files.","2025-11-03T10:50:43.025Z"
"rwilliams48239.bsky.social","Keystone Kash needed a distraction from the story that he took another private govt jet to watch his girlfriend sing. apnews.com/article/detr...","2025-11-02T13:47:29.784Z"
"rwilliams48239.bsky.social","GOP cancelled Thanksgiving for millions of Americans… #TrumpCancelledThanksgiving","2025-11-02T22:49:26.111Z"
"rwilliams48239.bsky.social","No notes. youtu.be/YyAH6dntDqw","2025-11-02T22:41:34.272Z"
"rwilliams48239.bsky.social","Holy hot #CupOfJoe! Dr. Chheda has some things to say to healthcare workers who support this regime. Steamy!","2025-11-01T14:57:46.957Z"
"rwilliams48239.bsky.social","This is my Senator and she nails it.","2025-11-01T16:37:30.212Z"
"rwilliams48239.bsky.social","A horrific mass murder is unfolding in Sudan, where no one can see it. The RSF are murdering civilians in El Fasher, having finally defeated the Sudanese army forces holding out in the city. The BBC has managed to speak to some who escaped www.youtube.com/watch?v=i7fC...","2025-11-01T07:14:26.677Z"
"rwilliams48239.bsky.social","www.reddit.com/r/Detroit/s/... Trump attorneys loose in court. Judge orders Administration to release snap emergency fund & they APPEAL decision #GOPShutdown #TrumpIsStarvingChildren","2025-11-01T11:40:44.177Z"
"rwilliams48239.bsky.social","Hey folks, an update on the battle to bring down prices!","2025-10-31T19:03:01.399Z"
"rwilliams48239.bsky.social","Mike Don’t Know","2025-10-31T19:13:44.682Z"
"rwilliams48239.bsky.social","Trump destroyed growing economy he was handed to take US backwards to “golden age” for him & his 1% friends. Meanwhile he’s keeping govt shut down removing safety nets for millions, lying about who is responsible for this shitshow to the world. Increased inflation & mass layoffs! #TrumpnomicsSuck","2025-10-31T00:01:52.905Z"
"rwilliams48239.bsky.social","Don’t Republicans control the House, Senate, and White House? Asking for a friend.","2025-10-27T15:37:03.977Z"
"rwilliams48239.bsky.social","...","2025-10-27T04:38:57.006Z"
"rwilliams48239.bsky.social","Only 11 falsehoods?? That's it? A measly 11 lies, not even a dozen?? My goodness, Donald Trump really *is* losing it","2025-10-28T19:09:30.419Z"
"rwilliams48239.bsky.social","#TheMoreYouKnow","2025-10-28T20:35:59.463Z"
"rwilliams48239.bsky.social","Trump's economy is going so well, Amazon's laying off 30,000 workers. Tariffs are crippling our economy.","2025-10-28T04:15:59.627Z"
"rwilliams48239.bsky.social","Look at this guy! To look at him you'd think this was Fallajuh and he was worried about IEDs and coming under enemy fire, However this was suburbia and he was probably kidnapping someone from Home Depot. ICE is as comically ridiculous as it is morally and ethically obscene. #Fuckice","2025-10-22T22:37:55.145Z"
"rwilliams48239.bsky.social","Everyone’s dad, Tim Walz ALWAYS provides proper perspective. My heart still hurts, what could have been Such a contrast from perpetually on vacation, eyelined, lying liar that lies (about couches too) on Sunday fascist-promoting state run media shows Many people are saying that #EveryoneHatesVance","2025-10-27T16:32:43.970Z"
"rwilliams48239.bsky.social","This video from Portland is a metaphor for what is going on in America. ICE trying so hard to get Americans to cross a line and if they don't, dragging them across the line and violently attacking.","2025-10-26T19:17:03.685Z"
"rwilliams48239.bsky.social","Gee, I can’t imagine why…","2025-10-26T21:23:10.961Z"
"rwilliams48239.bsky.social","@mzigg.bsky.social @jaciscanadian13.bsky.social @schasse60.bsky.social @eliz37618.bsky.social @normajeen.bsky.social @lacerantplainer.bsky.social @eddiestime.bsky.social @mlipsitt.bsky.social @cluelesskid.bsky.social @oldfashionednuts.bsky.social @rwilliams48239.bsky.social","2025-10-26T22:59:52.455Z"
"rwilliams48239.bsky.social","Are we facing an ‘actual’ Nazi regime? I don’t know. But if it gets worse, this is the kind of stuff they’ll put in history books subtitled ‘How Americans came to ignore the obvious signs of rising fascism.’","2025-10-26T13:30:40.195Z"
"rwilliams48239.bsky.social","#OhTheAccuracy","2025-10-26T14:02:53.519Z"
"rwilliams48239.bsky.social","No notes. 🧙‍♀️","2025-10-26T13:54:13.165Z"
"rwilliams48239.bsky.social","ICE and CBP GOONS are patrolling Chicago in unmarked civilian cars, kidnapping and disappearing people for filming.","2025-10-26T01:23:22.344Z"
"rwilliams48239.bsky.social","🎯🎯","2025-10-25T23:04:28.251Z"
"rwilliams48239.bsky.social","Hunger in America makes Page One in Knoxville, Tenn, .. .. Indianapolis, Boston, Milwaukee .. #SNAP #Shutdown","2025-10-25T11:49:41.791Z"
"rwilliams48239.bsky.social","SCOTUS, He’s the Speaker, the Chief Law Enforcement Officer, DOJ, FBI, CIA, HHS, DOE, etc. Are you understanding the issue with your “Unitary Executive” theory yet? Or is blatant corruption, acts of war, murder, concentration camps & false indictments not quite enough cause for concern?! #TheSwamp","2025-10-25T15:25:00.157Z"
"rwilliams48239.bsky.social","Things like this keep happening.","2025-10-23T15:25:26.962Z"
"rwilliams48239.bsky.social","More accurately, his priority is his Mar a Lardo DC edition. Anyone know when they start setting up the golf course?","2025-10-23T20:21:15.038Z"
"rwilliams48239.bsky.social","Let’s not forget","2025-10-23T11:21:47.070Z"
"rwilliams48239.bsky.social","Oh.","2025-10-23T11:18:58.950Z"
"rwilliams48239.bsky.social","#WakeUp","2025-10-23T13:30:09.033Z"
"rwilliams48239.bsky.social","SNAP benefits are about to lapse for 42 million people, because nothing says “save the children” like starving them.","2025-10-23T11:03:19.439Z"
"rwilliams48239.bsky.social","NBC News finds that: -- ICE has shortened its training from 13 weeks to six. -- Nearly half of recruits couldn’t pass an open-book written exam. -- Recruits """"are supposed to attest"""" they can pass the physical-fitness test, which requires them to run ... 6 mph. www.nbcnews.com/news/amp/rcn...","2025-10-23T12:54:37.862Z"
"rwilliams48239.bsky.social","Today, Mike Johnson will keep the House adjourned for the 80th day out of the last 92. The senate has been working, so this is not about the shutdown. It is about avoiding a vote to release the Epstein files.","2025-10-23T12:49:54.211Z"
"rwilliams48239.bsky.social","Did he campaign on renovating the White House into the Mar a Lardo of DC? I am 58. Not once in my life have I heard an administration say “We need a grand ballroom on the White House grounds”. Were the furnishings and historical decor preserved? #BoycottTheDonors","2025-10-23T05:47:26.581Z"
"rwilliams48239.bsky.social","Much love to this cute granny","2025-10-20T03:48:36.497Z"
"rwilliams48239.bsky.social","I'm grateful to @60minutes.bsky.social featuring our study published @justsecurity.org. Link to the study (on the 'presumption of regularity'): www.justsecurity.org/120547/presu...","2025-10-20T00:09:28.146Z"
"rwilliams48239.bsky.social","www.freep.com/picture-gall... #Detroit #MI #FreedomLovingAmericansRise","2025-10-19T13:58:30.449Z"
"rwilliams48239.bsky.social","substack.com/@mallorymcmo... Proud of my city, and its people #Detroit #NoKings #MI #WeThePeopleRise","2025-10-19T12:41:36.525Z"
"rwilliams48239.bsky.social","🇺🇸 🔥 That. Was. Impressive. We are watching America reassert itself and its values from the grassroots up. The world saw you and we have huge hope invested in you.","2025-10-19T11:04:27.755Z"
"rwilliams48239.bsky.social","Big shout out to all those Americans who took part in or supported #NoKings today. Take your country back from Trump and his assorted tin-pot fascists and thugs.","2025-10-18T23:33:21.878Z"
"rwilliams48239.bsky.social","Dear MAGA That’s A LOT of ANTIFA checks!!!George Soros is no longer a millionaire. He be #BrokeAF like the rest of us, because of #TrumpTariffnomics #Detroit #Mi #NoKings2 #PeacefulProtests #FreedomLovingAmericansRise cc: @foxnewspolitics.bsky.social","2025-10-18T23:12:32.779Z"
"rwilliams48239.bsky.social","Thank you to the organizers of today's wildly successful (and peaceful) """"No Kings"""" rallies. You did an amazing job. And thanks to all the millions of people who showed up to give us faith. And a special shout out to the White House regime and the Speaker of the House for all the free publicity!","2025-10-18T19:42:36.644Z"
"rwilliams48239.bsky.social","OMG! Clearly, a message from radical anarchists who want violence because they hate America!!! (Republicans are shameless liars addicted to fictional talking points.)","2025-10-17T01:28:23.649Z"
"rwilliams48239.bsky.social","Mike Johnson has now had the House adjourned for 74 out of the last 86 days. They have worked 12 days in 3 months. Epstein Shutdown.","2025-10-17T11:06:32.376Z"
"rwilliams48239.bsky.social","Pop quiz: How much of an asshat are you if there are 2,500 protest locations against you in your own country, but also globally in UK Canada Mexico Panama Iceland Ireland Sweden Denmark Germany Austria Spain Switzerland France Italy Guam Mariana Islands #NoKings #PowerToThePeople www.nokings.org","2025-10-16T16:28:17.862Z"
"rwilliams48239.bsky.social","Portland, the lies vs. the reality. youtube.com/shorts/BSkDJ...","2025-10-12T13:52:58.648Z"
