"user","post","date"
"rwilliams48239.bsky.social","REPOST if you support our federal workforce and know how dedicated they are to their jobs. Show them you appreciate them!","2025-02-14T01:15:56.806Z"
"rwilliams48239.bsky.social","I think my favorite part of this Musk post where actor Jon Voight is fluffing him is when Voight calls him “a man of dignity and truth” while Musk was posting it from his new ‘Harry Bolz’ screen name.","2025-02-11T20:25:18.245Z"
"rwilliams48239.bsky.social","I know Elon has claimed he’s on the spectrum, and people have various theories on it, but what if he’s just a racist asshole who’s high on ketamine all the time?","2025-02-12T02:34:09.401Z"
"rwilliams48239.bsky.social","We’re done here. Right?","2025-02-11T22:05:07.638Z"
"rwilliams48239.bsky.social","Dear MSM I keep seeing articles about ElonAHole’s Dodgey Bros You are focused on Read/Write access Understand that “Big Balls” had ADMIN access = GOD i.e. can add users, lock users out or change user rights, edit code, COPY & DELETE data basically do ANY DAMN THING he wants too REPORT THAT PLZ","2025-02-12T05:03:17.872Z"
"rwilliams48239.bsky.social","THIS IS PERFECT.","2025-02-08T05:32:03.783Z"
"rwilliams48239.bsky.social","Imagine you're just some 30-something guy who converts to one of the world's major religions and in less than a decade its spiritual leader is rebuking you in front of the entire world That's how big a loser JD Vance is apnews.com/article/pope...","2025-02-11T16:21:51.200Z"
"rwilliams48239.bsky.social","Okay, okay. Who saw “Don’t look up” ? I was a huge fan of the Bronteroc, and I believe that would be a fine fate for these two…","2025-02-11T03:01:01.396Z"
"rwilliams48239.bsky.social","Do I have this right? Since orange shit gibbon forced head of FAA to resign (they were fining ElonAHole for rocket explosion & had grounded SpaceX) There have been 3 airplane crashes & 2 accidents at airports in 20 days of his administration? By comparison none on Biden/Secretary Pete’s watch? 🤷‍♀️","2025-02-11T02:47:45.538Z"
"rwilliams48239.bsky.social","A lesson about the Find Out phase of #FAFO courtesy of The Rick Wilson & @lincolnproject.us youtu.be/u49-8NDGdrc","2025-02-11T01:48:17.440Z"
"rwilliams48239.bsky.social","Hey NYTimes — *now* you’re lighting the beacons? NOW?!? After months of “Sauron: Avatar Of Evil… Or Extreme Uniter?” thumbsucker reporting you’re screaming what we’ve known since 2015? Fuck all the way off.","2025-02-09T22:28:00.919Z"
"rwilliams48239.bsky.social","Settled in with my doggos to watch Puppy Bowl 🐶 #BoycottSuperbowl Ref: All teams $upport for the spineless GOP, the dick-tater wannabe they helped elect as VP (to the racist South African that inherited emerald mine $$ bought other peoples good ideas & is now looting the US Government) #ElonAHole","2025-02-09T23:26:19.959Z"
"rwilliams48239.bsky.social","Received a letter from POTUS today purporting to remove me as Commissioner and Chair of the FEC. There's a legal way to replace FEC commissioners-this isn't it. I've been so fortunate to serve the American people and stir up some good trouble along the way. That's not changing anytime soon.","2025-02-06T23:41:05.134Z"
"rwilliams48239.bsky.social","Republicans are going to pass a budget with one of the biggest deficits in world history.","2025-02-07T13:01:11.424Z"
"rwilliams48239.bsky.social","We coulda had - universal healthcare - continuing child tax credits - help for small business startups - continued infrastructure & clean energy projects - A president who went about job of president QUIETLY & efficiently - a VP who is like everyone’s dad & doesn’t have eyeliner or couch fetish 😭","2025-02-07T19:25:03.761Z"
"rwilliams48239.bsky.social","Wait. Have @doge and Elon just been pulling numbers from usaspending.gov ? Then releasing it as if they discovered it ? Brilliant if true. Absolutely brilliant. Fooled me. Very Trump like too. Any usaspending.gov experts out there that can tell us ?","2025-02-07T04:32:51.085Z"
"rwilliams48239.bsky.social","Ohhh! I forgot to share with y'all due to all that BS with that insurrectionists heckling me, A VIDEO MESSAGE WITH MS.SICKNICK! Never will we forget or let them erase January 6th","2025-02-06T19:32:59.478Z"
"rwilliams48239.bsky.social","Precisely this ⬇️","2025-02-06T20:36:07.363Z"
"rwilliams48239.bsky.social","Rather than doomscrolling, spend a few minutes a day doing this (they have an app that makes it super easy as well). 5calls.org","2025-02-06T20:07:20.438Z"
"rwilliams48239.bsky.social","Enough doomscrolling!! Instead, I offer my super fabulous, adorable granddaughter laughing with her daddy (sound up) Enjoy! @dgcomedy.bsky.social ❤️","2025-02-06T00:29:28.144Z"
"rwilliams48239.bsky.social","Guy On Doomed Planet Mostly Concerned With Skin Color Of People In Movies theonion.com/guy-on-...","2025-02-05T21:00:00.000Z"
"rwilliams48239.bsky.social","What a guy! Those 500,000 athletes in the NCAA must be so relieved that (4) trans athletes cannot participate 🙄 GFY - to the mandarin bigoted asshole and his made up non-issues. C’mon cholesterol & karma! Like a widowmaker is too much to ask for? 🤷‍♀️","2025-02-05T23:53:46.526Z"
"rwilliams48239.bsky.social","What Hugo is saying here without actually saying it: Human assets in intelligence around the globe are going to disappear/be killed because of this. We saw this during the orange shitgibbon’s first term as well","2025-02-05T23:03:30.174Z"
"rwilliams48239.bsky.social","This ⬇️ May he and the Orange Shitgibbon rot in hell","2025-02-05T22:56:03.402Z"
"rwilliams48239.bsky.social","Out of 510,000 NCAA athletes, less than 10 are transgender. They are literally writing an executive order to target less than a hundred people nationwide. Republicans spent over $110 million in anti-trans ads on a made up problem.","2025-02-04T21:03:59.163Z"
"rwilliams48239.bsky.social","About that self-righteous protest vote","2025-02-05T03:52:56.923Z"
"rwilliams48239.bsky.social","He is distracting everyone from Elon’s gutting the government.","2025-02-05T02:19:24.797Z"
"rwilliams48239.bsky.social","Okay, okay, stay with me here… Can we have ElonAHole & his Dodgy 20-Something Bro’s head up the operations in Gaza? We as Americans can say “we offer the best, most innovative guy that surely can bring success to this project” (and in doing so get him the fuck out of American government servers?)","2025-02-05T03:38:09.936Z"
"rwilliams48239.bsky.social","Frost: """"Trump fired pretty much every inspectors general in the entire country. And then a little bit later we hear that Elon Musk now has access to the federal payment system with zero oversight. And the question is, what is to stop him from using that information to enrich himself?""""","2025-02-05T01:47:11.417Z"
"rwilliams48239.bsky.social","""""We knew Trump would be bad, but we just didn't believe that Kamala worked at McDonald's.""""","2025-02-05T02:03:47.173Z"
"rwilliams48239.bsky.social","Let's do a twofer helping the USPS -- send congratulatory postcards to VP Trump for the horrendous job he's doing in hijacking our government and alienating our allies. VIce President Trump The White House 1600 Pennsylvania Avenue NW Washington, DC 20500","2025-02-04T02:15:37.933Z"
"rwilliams48239.bsky.social","The most sensible post I have seen all day. I am still sad #AmericasDad isn’t our VP right now. Instead they stuck us with the couch-stalking eyeliner guy who lies better & more often than the orange shit gibbon. 😞","2025-02-04T03:39:09.548Z"
"rwilliams48239.bsky.social","The USA has had two major plane crashes in the last 4 days. The USA had previously not suffered a major plane crash for 16 years. ‘DEI’ programs have existed for decades. So what was it that changed in the last 14 days or so to suddenly cause so many crashes?","2025-02-01T17:21:38.801Z"
"rwilliams48239.bsky.social","Really love this cartoon from the great Michael De Adder. The outpouring of support coming in has been truly amazing! Thanks everybody!","2025-01-29T21:21:39.110Z"
"rwilliams48239.bsky.social","In May of 2024 Joe Biden signed a bill that provided funds to hire more air traffic controllers to remedy the shortage of such workers. In January of 2025 Trump fired the head of the FAA (because Musk had beef with him) and encouraged federal workers to resign. www.cnn.com/2024/05/16/p...","2025-01-31T00:27:30.139Z"
"rwilliams48239.bsky.social","Are they installing gas chambers too? Migrants are HUMAN BEINGS They are not the demonized description you hear from right wing media & orange shitgibbon “1200” (quota) deportations per day costing $800,000 per military plane (vs. $100,000 without photo op) are NOT criminals #GasLighting #WakeUp","2025-01-29T22:48:14.635Z"
"rwilliams48239.bsky.social","Hey guys! I’ve started something new. My new Substack… Go check it out! jimacosta.substack.com/p/hold-on-to...","2025-01-28T21:01:47.994Z"
"rwilliams48239.bsky.social","Elon Musk, WH Press Secretary, & Fox claimed that Trump had to freeze grants and govt funding because Biden supposedly sent $50 million in condoms to Gaza. Another lie in a firehose of daily lies. www.theguardian.com/us-news/live...","2025-01-29T01:53:11.836Z"
"rwilliams48239.bsky.social","do you enjoy knowing that when you deposit money in a US bank, you won't lose that money? nice, right? it's because bank deposits are insured by FDIC. i don't know what FDIC ever did to these people, but apparently it too is now on their blow-it-up list: www.washingtonpost.com/business/202...","2025-01-27T22:54:18.560Z"
"rwilliams48239.bsky.social","We need to pay attention to this now before it’s too late.","2025-01-28T00:43:34.660Z"
"rwilliams48239.bsky.social","“The Democrats didn’t do enough on Gaza, so I withheld my vote to make a statement.” “Well, Trump won and now he’s gonna destroy Gaza.” “Yep. We’re paying the price for the Democrats’ incompetence.” “‘We?’ The Gazans are paying the price, not us” Pause. “I needed to make a statement.”","2025-01-26T16:18:27.884Z"
"rwilliams48239.bsky.social","Firing independent watchdogs is straight out of the authoritarian playbook. Removes another obstacle to corruption and abuse of power www.reuters.com/world/us/tru...","2025-01-25T04:52:39.315Z"
"rwilliams48239.bsky.social","Trump ordered the National Institutes of Health to cancel their review panels on cancer research. If you or someone you know has cancer, heart disease, diabetes, or one of many countless illnesses that needs a cure — this could have devastating effects.","2025-01-23T17:59:39.391Z"
"rwilliams48239.bsky.social","Dear members of the press, Can one of you, PLEASE just ONE: When Trump says we deleted all the evidence, please for the love of God, push back. The evidence is all here: www.govinfo.gov/collection/j...","2025-01-23T00:05:42.425Z"
"rwilliams48239.bsky.social","We told you.","2025-01-21T14:45:45.727Z"
"rwilliams48239.bsky.social","** Qualifier: This screenshot is from my daughter I won’t be reinstalling TikTok, any meta apps or the dead bird May they all die a quick but ugly death. You’re stuck with me forever BlueSky!!! 💙 (Unless of course you start obeying in advance, then it’s only Substack)","2025-01-19T21:35:01.364Z"
"rwilliams48239.bsky.social","@ronfilipkowski.bsky.social You called it Cannot wait to see when you post who owns 50% now. 🤮🤢","2025-01-19T20:59:46.602Z"
"rwilliams48239.bsky.social","Sure, sure, those “entitlements” that help some of the most vulnerable in our society should definitely be cut in order to fund their tax cut for the wealthy & deportations that will increase inflation, bankrupt our farmers & make grocery prices go up - not down Who needs to eat anyway? 🤦‍♀️","2025-01-19T18:38:50.904Z"
"rwilliams48239.bsky.social","“What No refunds?” #FAFO 🤷‍♀️","2025-01-19T17:26:06.456Z"
"rwilliams48239.bsky.social","So small crowd is the real reason behind the “indoor event”? Sounds about dRumph.","2025-01-19T17:05:21.549Z"
"rwilliams48239.bsky.social","Ah, of course! Let’s see who is in on the ownership..","2025-01-19T17:02:31.124Z"
"rwilliams48239.bsky.social","I thought this kind of realization would take a bit longer. Again, very little, far too late 🤷‍♀️","2025-01-19T17:01:03.479Z"
"rwilliams48239.bsky.social","The BEST idea I have seen yet. America needs to remember who the 🍊 shitgibbon plans to pardon on Monday","2025-01-19T16:59:03.435Z"
"rwilliams48239.bsky.social","It is disabled, but the orange shitgibbon plans to “save the day” as you can see here. Yet another performative bullshit act like bodega, McDonalds, ChikFilA & so many others he orchestrated. Also indoor inauguration for “the people” doesn’t square as many passed out from heat at his rallies 🤦‍♀️","2025-01-19T16:53:16.528Z"
"rwilliams48239.bsky.social","Jan 20, 2025","2025-01-17T17:46:12.039Z"
"rwilliams48239.bsky.social","George Conway: “I think it’s a matter of respect to call him First Felon of The United States” #FFOTUS That is trend worthy 🙂","2025-01-18T04:08:48.139Z"
"rwilliams48239.bsky.social","This TikTok scam by Trump is really something. In a few days, we will be hearing from Trump about how he “saved Tik Tok” & “brought it back.” He literally created the problem by calling for a ban. Rs pass a law. It gets banned. It goes dark for a day or 2, then Trump “saves” it.","2025-01-17T23:18:37.880Z"
"rwilliams48239.bsky.social","This cracked me up way too much. Maybe because I am getting delirious. So I had to share","2025-01-17T02:49:37.101Z"
"rwilliams48239.bsky.social","I highly recommend: Allison & Andy do an amazing job reading this. I can’t wait for part four! Jack Smith put his all into his report. Forevermore, it is a matter of public record that 🍊shitgibbon was indicted & would have been convicted. Evidence is solid & superseding indictment negated immunity","2025-01-18T03:04:24.070Z"
"rwilliams48239.bsky.social","So noted: The plague worked only temporarily in 2020, so clearly, a higher power is trying a different sign for the masses: “Hell hath frozen over” 🤷‍♀️","2025-01-18T02:24:49.139Z"
"rwilliams48239.bsky.social","Dear lord, we live in the dumbest timeline ever 🤦‍♀️ Sigh.","2025-01-16T23:07:49.418Z"
"rwilliams48239.bsky.social","In 2020, I asked why so many Republicans had abandoned the values they had previously held. Still relevant. www.theatlantic.com/magazine/arc...","2025-01-15T05:29:28.806Z"
"rwilliams48239.bsky.social","He’s still a sexist. He’s still a predator. He’s still an angry drunk. He’s still a dangerous pick for Secretary of Defense. youtu.be/Q4Es-IDBDao?...","2025-01-15T02:03:03.589Z"
"rwilliams48239.bsky.social","💙🙏💙","2025-01-12T04:32:07.675Z"
"rwilliams48239.bsky.social","JUST IN: Another team of Mexican firefighters has landed in LA to help combat the wildfires. Thank you, Mexico 🇲🇽🇺🇸","2025-01-12T03:55:30.097Z"
"rwilliams48239.bsky.social","They are taking back campaign promises faster than they made them.","2025-01-09T12:50:12.116Z"
"rwilliams48239.bsky.social","And he didn’t get reelected because people said they were mad about the economy","2025-01-10T17:32:44.091Z"
"rwilliams48239.bsky.social","Latest photos of my beautiful granddaughter (whose mama got a new camera for Christmas). Mom is capturing some amazing shots ❤️","2025-01-05T16:23:01.409Z"
"rwilliams48239.bsky.social","Let's start the new year off with some cold, hard truths: - Donald trump is a convicted felon. - He did NOT win by a landslide. - It was the 5th smallest win EVER. - None of his decisions are his own: he is owned and controlled by President Musk and Putin. PASS IT ON.","2025-01-02T00:19:41.806Z"
"rwilliams48239.bsky.social","It’s day 1, people! Take it down a notch!","2025-01-01T22:52:11.275Z"
"rwilliams48239.bsky.social","He’s a habitual, shameless liar. As this shows. And thousands of clips before this showed. But everyone knew that already, so Shameless Habitual Liars is the American Brand now. Make America Full of Shit Again. bsky.app/profile/meid...","2025-01-01T03:18:37.547Z"
"rwilliams48239.bsky.social","This","2024-12-25T01:59:04.531Z"
"rwilliams48239.bsky.social","Merry Christmas 🎄 & Happy Holidays 🕎 From our 🐾 Dog House 🐾 to yours!","2024-12-25T13:40:29.801Z"
"rwilliams48239.bsky.social","Jeffries: In our nation's history, 25% of our nation's debt was accumulated during the four years of the former president, 25%. How dare you lecture America about fiscal responsibility ever.","2024-12-19T23:13:42.502Z"
"rwilliams48239.bsky.social","Billionaire Bezos dined w Trump & the richest man on Earth, President Elon Musk. This is a lay up for Democrats. You need to rinse, repeat, & hammer the message of how Republicans represent the 1% who are stealing the country from the rest of us. Don't use kleptocracy or oligarchy. Keep it simple.","2024-12-20T05:43:33.440Z"
"rwilliams48239.bsky.social","TERRIFYING: Two Democrats — Marie Gluesenkamp Perez and Kathy Castor — voted in favor of Trump and Musk’s plan to defund programs that help kids with cancer. Let’s put them on blast!","2024-12-20T01:31:05.611Z"
"rwilliams48239.bsky.social","You know, this reminds me that I’m old enough to remember when some people were saying that Joe Biden was so out of it somebody had to be running the government for him","2024-12-20T03:51:09.283Z"
"rwilliams48239.bsky.social","Good morning and Happy Wednesday to everyone who agrees that much more media attention needs to be directed to the fact that Republicans' main witness against Hunter Biden pleaded guilty for lying about him. If it was trump, they'd still be screeching about """"lawfare."""" DO YOUR JOBS!","2024-12-18T15:37:27.533Z"
"rwilliams48239.bsky.social","Updated Pack! y'all are in it! The more you share the more followers🦋 @doctormike.bsky.social @treeaffinity.bsky.social @musicrave.bsky.social @morpheus55.bsky.social @canadianmom3.bsky.social @gadget44027447.bsky.social @mwreeve.bsky.social go.bsky.app/L7eVXuB","2024-12-15T03:23:40.027Z"
"rwilliams48239.bsky.social","Greetings! @akeith1.bsky.social @bojiboji1.bsky.social @engineerlawrence.bsky.social @n1ghtmarica.bsky.social @esedwards.bsky.social @rwilliams48239.bsky.social @firefeather35.bsky.social @jrtwrangler.bsky.social @godbless-you.bsky.social‬ @peacecrone.bsky.social","2024-12-16T23:03:12.783Z"
"rwilliams48239.bsky.social","After the shooting, someone said a lot of the CEO’s are afraid to return to work. Read that and now think about how our school-aged kids feel!","2024-12-16T18:46:15.905Z"
"rwilliams48239.bsky.social","@randyrainbow.bsky.social knocks it our of the park, again! The only positive thing about the 🍊🤡 being elected — is 4 more years of fabulous content from Randy 💙❤️ #IThinkImGonnaHateItHere youtu.be/BmrNhbn8KI8","2024-12-16T19:12:01.320Z"
"rwilliams48239.bsky.social","""""Trump already has shifted the balance of power between the media and the presidency before even taking office. This is a significant and deeply troubling development..."""" Harry Litman writes on ABC's capitulation to Trump.","2024-12-16T17:55:18.748Z"
"rwilliams48239.bsky.social","I'm going to post this video every day so we never forget","2024-12-16T12:40:59.246Z"
"rwilliams48239.bsky.social","Dear @wapo Fuck right off It wasn’t a landslide, decisive, or even a resounding win Perhaps if you were less concerned about clicks & more concerned about the fate of our democratic republic, we wouldn’t be facing 4 yrs of chaos, looting by billionaires & democracy’s shaky foundation crumbling","2024-12-16T18:46:02.160Z"
"rwilliams48239.bsky.social","@democracydocket.com should be a lot higher than 81 on this list! Are you all following Marc Elias and his group? If not, I highly recommend you do. Accurate news and Marc makes sure we are aware of all the things MSM doesn’t bother reporting. Follow & sign up for his newsletter!","2024-12-15T21:04:07.856Z"
"rwilliams48239.bsky.social","In Michigan, it’s Pop.","2024-12-15T20:56:06.237Z"
"rwilliams48239.bsky.social","I’ve been paying into Social Security & Medicare since I was 14 years old, I am 58 Apparently, ElonAHole, RamaSwampy & the GOP feel SS & Medicare is an “entitlement” They now propose my retirement age should be 69. I probably won’t live long enough to collect a dime They can go fuck themselves","2024-12-14T03:13:04.445Z"
"rwilliams48239.bsky.social","Did You Guys Realize It Was Just News Till This Faie Mothafukka Showed Up?? Who Agrees✋️? @merlinmm.bsky.social @candybones.bsky.social @cas7217.bsky.social @thesocialmediadiva.bsky.social @mynameisnotrachel.bsky.social @ltwlauren.bsky.social @tressa1.bsky.social @munjoy.bsky.social @hv4.bsky.social","2024-12-10T00:15:15.339Z"
"rwilliams48239.bsky.social","“Donald Trump’s suggestion that members of Congress who investigated his illegal and unconstitutional actions should be jailed is a continuation of his assault on the rule of law and the foundations of our republic.” — Rep. Liz Cheney www.nytimes.com/2024/12/08/u...","2024-12-09T11:54:04.049Z"
"rwilliams48239.bsky.social","jesus christ he was hiding in plain sight","2024-12-09T19:44:32.688Z"
"rwilliams48239.bsky.social","Don’t mistake our kindness for weakness.","2024-12-09T17:40:01.246Z"
"rwilliams48239.bsky.social","Dear Dems We fight, or we watch democracy die So many missed opportunities MSM & elected officials let America down Cabinet/congress should have used 25th amendment on 1/7/21 Congress should have impeached DOJ should have filed charges on the day GOP senate let him off What a fucking tragedy","2024-12-09T20:12:30.736Z"
"rwilliams48239.bsky.social","𝙒𝙚𝙡𝙘𝙤𝙢𝙚 𝙉𝙚𝙬 #𝘽𝙡𝙪𝙚𝙍𝙚𝙨𝙞𝙨𝙩𝙚𝙧𝙨 🇺🇸 𝙋𝙡𝙚𝙖𝙨𝙚 𝙁𝙤𝙡𝙡𝙤𝙬 𝙩𝙝𝙞𝙨 𝘼𝙢𝙖𝙯𝙞𝙣𝙜 𝙎𝙪𝙥𝙥𝙤𝙧𝙩𝙚𝙧 𝙛𝙤𝙧 𝘿𝙚𝙢𝙤𝙘𝙧𝙖𝙘𝙮｡ #𝙎𝙩𝙧𝙤𝙣𝙜𝙚𝙧𝙏𝙤𝙜𝙚𝙩𝙝𝙚𝙧 𝙝𝙚𝙧𝙚! 🗽 ⤵️ @therebelbase.bsky.social Add this hashtag #BlueResisters to your own profile description, I'll follow back and we'll ALL connect together for Democracy. 💙🌊 #Reᴛᴡᴇᴇᴛ 🇺🇲","2024-12-09T15:26:13.267Z"
"rwilliams48239.bsky.social","If you think they won’t come after social security, Medicare, Medicaid, or veterans’ benefits, remember how confident you were that they wouldn’t come after Roe v. Wade.","2024-12-08T20:02:48.653Z"
"rwilliams48239.bsky.social","My sweet granddaughter Elise… 4 months already","2024-12-07T18:20:08.779Z"
"rwilliams48239.bsky.social","Everytime Beks posts I reiterate, child sex abusers are not partisan & are always in a position where they have unsupervised access to children. Most often, A trusted person of authority (church leaders, youth leaders, law enforcement, coaches, etc) With no intervention the abused may become abusers","2024-12-06T16:44:07.951Z"
"rwilliams48239.bsky.social","Bingo! MSM please take note. (Also see comment #1) We are tired of you normalizing this behavior! It is NOT okay or normal.","2024-12-06T16:36:17.383Z"
"rwilliams48239.bsky.social","Can we start with ElonAHole & RamaSwampy?","2024-12-05T21:28:23.981Z"
"rwilliams48239.bsky.social","Blockity, block, block & report!","2024-12-03T00:17:27.492Z"
"rwilliams48239.bsky.social","Y'all notice this?","2024-12-02T16:41:33.835Z"
"rwilliams48239.bsky.social","Odin, 100% good boy understands it is already midnight (at 6pm). Cookie appears to be salty about that (she’s evil-eyeing me) 😂 #DoggoDaylightSavingsIssues #MomsBeTired","2024-12-02T23:39:42.465Z"
"rwilliams48239.bsky.social","The Chips and Science act alone is going to generate 37 projects, 36,300 jobs and $272 billion. It makes us competitive with China and when considered along with the Inflation Reduction Act investments the total comes out to 218 projects worth $388 billion creating 135,800 jobs. Trump will kill both","2024-12-01T01:11:11.190Z"
"rwilliams48239.bsky.social","The only rules to the party are simple. Follow everyone and follow back all resisters. Repost so all other resisters can connect. If you can't do this??? You can't party with me!!✨️ And I don't list people who don't follow me. I don't care if you're Jesus.","2024-11-27T17:18:03.109Z"
"rwilliams48239.bsky.social","My daughter in law is so creative with holiday baby pictures. This is my newest granddaughter (3 months)","2024-12-01T19:07:32.691Z"
"rwilliams48239.bsky.social","Early reports that Russian and Syrian forces have fled Hama airbase. More consequences of Putin’s war in Ukraine - he’s overcommitting troops to try to make progress in Ukraine and leaving himself vulnerable elsewhere. Losing in two theaters at once is pretty impressive.","2024-11-30T17:17:35.362Z"
"rwilliams48239.bsky.social","Trump will be 78 when he's inaugurated as president, making him the first president whose age exceeds his IQ.","2024-11-30T21:20:54.684Z"
"rwilliams48239.bsky.social","This is a fact everyone needs to come to grips with. Perfectly said. There is zero benefit to even speaking to a Trump voter. They are completely lost. Focus instead on motivating Democrats and those who did not vote.","2024-11-30T01:07:25.492Z"
"rwilliams48239.bsky.social","Alright, who made this? 🤣","2024-11-22T20:50:01.923Z"
"rwilliams48239.bsky.social","If we're not calling the 4B movement """"Batten Down the Snatches"""", what are we even doing","2024-11-30T18:47:41.613Z"
