"user","post","date"
"themanicman.bsky.social","Maybe Jesus was just a 1st century internet troll.","2025-07-04T12:49:33.983Z"
"themanicman.bsky.social","Christianity is a Roman religion, not a Jewish one.","2025-07-04T12:22:35.289Z"
"themanicman.bsky.social","Who knew Christians would end up deciding politics were more important than the Passion?","2025-07-03T14:57:36.484Z"
"themanicman.bsky.social","I'm always hearing from Christians that """"God uses flawed individuals for His purpose."""" This is such bullshit. The fact is that Christians just support awful people to be their leaders.","2025-07-02T17:51:47.851Z"
"themanicman.bsky.social","Amen!","2025-07-02T15:15:53.159Z"
"themanicman.bsky.social","Monotheism is just tribal deism with an """"I'm better than everyone else"""" mentality.","2025-07-02T01:10:05.155Z"
"themanicman.bsky.social","ALL religions are just authoritarian personality cults that survive the death of the personality that started them.","2025-06-30T16:51:11.506Z"
"themanicman.bsky.social","We need to reclaim OUR MONEY from the billionaire class.","2025-06-30T15:40:27.016Z"
"themanicman.bsky.social","If you remove the toxic parts of Christianity you are just left with normal reality.","2025-06-30T15:38:36.392Z"
"themanicman.bsky.social","We need to stop thinking wealth indicates intelligence.","2025-06-30T15:37:21.892Z"
"themanicman.bsky.social","We need to STOP giving TAXPAYER money to billionaires!","2025-06-30T15:34:50.189Z"
"themanicman.bsky.social","CALL YOUR SENATORS. There's still a chance to sink the GOP's Big, Bad Bill in the Senate!","2025-06-27T16:30:09.828Z"
"themanicman.bsky.social","Trump cancels all trade talks with Canada. So far, the dealmaking is going great!","2025-06-27T19:48:38.081Z"
"themanicman.bsky.social","Is it possible the Apostle Paul didn't write any letters at all? The book of Acts doesn't mention them, even though Paul is a central character. Maybe those letters were just later """"fan fiction"""" like the letters supposedly from John, Jude, James and Peter?","2025-06-27T16:38:10.004Z"
"themanicman.bsky.social","CALL YOUR SENATORS. There's still a chance to sink the GOP's Big, Bad Bill in the Senate!","2025-06-27T16:30:09.828Z"
"themanicman.bsky.social","Every time Pete Hegseth gives a press conference and screams about total nonsense and I don't go tell my mom in vivid detail about the stupidity, I feel like I'm giving into the normalization that I see in everyone else.","2025-06-27T03:59:03.103Z"
"themanicman.bsky.social","In high school, in the '90s, my teacher told our AP US History class that Richard Nixon got a raw deal, and he was actually a pretty good president. At the time, I thought maybe he was right. But now I realize he was just a Republican.","2025-06-27T02:30:29.441Z"
"themanicman.bsky.social","With all due respect to Pete Buttigeg, who I love, I don't think a """"nice guy"""" is what the Democrats need in 2028.","2025-06-27T00:49:02.551Z"
"themanicman.bsky.social","BE READY!!!","2025-06-26T14:24:08.119Z"
"themanicman.bsky.social","Once you realize the early Christians were just as dishonest and/or gullible as Christians today, it all starts to make a lot more sense.","2025-06-26T14:05:27.499Z"
"themanicman.bsky.social","If Christianity is a harmful ideology, it makes sense to want to eradicate it from society.","2025-06-26T02:36:25.597Z"
"themanicman.bsky.social","All religious cults are basically the same. They just believe in different conspiracies.","2025-06-25T15:10:38.852Z"
"themanicman.bsky.social","Atheists don't want our religious dogma pushed on other people. We just don't want your religious dogma pushed on other people either.","2025-06-25T03:04:37.935Z"
"themanicman.bsky.social","All religion is just people pretending to speak for God.","2025-06-25T02:58:21.491Z"
"themanicman.bsky.social","It's time for us to admit that Christianity is a hateful ideology that we should jettison from society.","2025-06-24T18:26:08.162Z"
"themanicman.bsky.social","Why do my tax dollars have to go toward another war in the Middle East? Can't Republicans pay for it? They started it (again). We need a Hyde Amendment for Republican wars!","2025-06-23T21:17:21.304Z"
"themanicman.bsky.social","Think about what we might have done with 2 TRILLION dollars.","2025-06-23T12:32:17.916Z"
"themanicman.bsky.social","Does Trump think he can drive his poll numbers back up by just mentioning """"God"""" like a million times in a three-minute speech?","2025-06-23T02:50:04.462Z"
"themanicman.bsky.social","I'm waiting to see how Trump will monetize this war. Will he sell trading cards or maybe commemorative coins?","2025-06-23T02:39:24.761Z"
"themanicman.bsky.social","My prediction: Trump is going to use the threat of Iranian sleeper cells in the US to push his authoritarian agenda against the American people. The media narrative is already being spun.","2025-06-23T02:36:30.290Z"
"themanicman.bsky.social","I can't believe a Republican president just started another 20-year war. Right after a Democratic president finally ended the last one.","2025-06-23T02:28:44.829Z"
"themanicman.bsky.social","Just to be crystal clear: bombing Iran is completely illegal.","2025-06-22T02:47:24.303Z"
"themanicman.bsky.social","Iran did not have a nuclear weapon. Iran did not have a nuclear weapon. Iran did not have a nuclear weapon. Iran did not have a nuclear weapon. Iran did not have a nuclear weapon. Iran did not have a nuclear weapon. Iran did not have a nuclear weapon. Iran did not have a nuclear weapon.","2025-06-22T02:15:42.010Z"
"themanicman.bsky.social","This is why we can't have nice things, like healthcare or free college. Always have to start a new war. Should do wonders for the deficit that Republicans are so worried about.","2025-06-22T03:11:34.573Z"
"themanicman.bsky.social","Obama didn't need to bomb Iran to get a deal.","2025-06-22T01:01:41.661Z"
"themanicman.bsky.social","This is how we get endless wars.","2025-06-22T00:56:45.695Z"
"themanicman.bsky.social","which group is mooching off society?","2025-06-22T00:42:43.209Z"
"themanicman.bsky.social","Some people are okay with facism as long as they're being the facists.","2025-06-20T21:45:30.191Z"
"themanicman.bsky.social","seems plausible","2025-06-20T16:43:34.941Z"
"themanicman.bsky.social","Yeah, I’m sure what Mike has in mind is to build affordable housing at those scenic vistas on federal land he wants to open up for development. That’s how he’s selling it, but we all know that they have different plans.","2025-06-20T09:57:50.763Z"
"themanicman.bsky.social","This is so true! 👍","2025-06-19T21:12:00.054Z"
"themanicman.bsky.social","THIS WAR WITH IRAN NEVER WOULD HAVE HAPPENED IF OBAMA WAS PRESIDENT!!!","2025-06-17T15:50:25.918Z"
"themanicman.bsky.social","What if Trump's Middle East trip was all about getting buy-off for this attack on Iran? And his """"snub"""" of Israel wasn't a snub at all but just him keeping a strategic distance?","2025-06-17T01:49:32.693Z"
"themanicman.bsky.social","We never should have given Israel nukes. They'll be the ones to drop one, just you watch!","2025-06-17T01:34:05.570Z"
"themanicman.bsky.social","Israel is starting a war with Iran because they ran out of places to bomb in Gaza.","2025-06-17T01:25:23.421Z"
"themanicman.bsky.social","This war with Iran is just the """"Weapons of Mass Destruction"""" narrative all over again.","2025-06-17T01:24:36.720Z"
"themanicman.bsky.social","Trump's military parade was the lamest thing I've ever seen. All it did was make America look pathetic.","2025-06-15T18:08:34.694Z"
"themanicman.bsky.social","Why are we giving Israel weapons so they can start conflicts in the Middle East? How does that help us? Do we really want to get involved in another """"forever war""""?","2025-06-15T17:20:34.567Z"
"themanicman.bsky.social","I keep seeing articles about how Democrats need to win back men who voted for Trump. I don't know—do we really want to win back men who were attracted to Trump's fake version of masculinity? Let MAGA have them. Good riddance, I say!","2025-06-15T17:18:48.849Z"
"themanicman.bsky.social","LET ISRAEL FIGHT ITS OWN WARS!!!","2025-06-15T17:16:39.576Z"
"themanicman.bsky.social","All Trump does is start wars and spread hate.","2025-06-15T15:55:12.981Z"
"themanicman.bsky.social","Trump little military parade was a big ol' donut!","2025-06-15T12:55:58.500Z"
"themanicman.bsky.social","I can't wait till Donald Trump goes the way of Ron DeSantis.","2025-06-14T23:52:20.134Z"
"themanicman.bsky.social","NO KINGS!!!","2025-06-14T14:33:22.991Z"
"themanicman.bsky.social","Early Christians believed in THREE gods: The Father, The Son, and The Holy Spirit. But this embarrassed the later Christians so they came up with the idea of the Trinity.","2025-06-14T03:40:30.007Z"
"themanicman.bsky.social","Controversial opinion: The stories of Jesus are plagued with too much manufactured adoration.","2025-06-14T02:12:54.635Z"
"themanicman.bsky.social","Promises Made, Promises BROKEN","2025-06-14T02:03:28.887Z"
"themanicman.bsky.social","What is Israel going to do when the world finds out the United States won't go to war on their behalf?","2025-06-13T03:12:22.314Z"
"themanicman.bsky.social","Good on Sen. Alex Padilla. 👏 We need more of that. Let's expose this authoritarian regime!","2025-06-13T00:17:42.931Z"
"themanicman.bsky.social","TACO-Trump is more popular than nonTACO-Trump.","2025-06-12T23:47:41.029Z"
"themanicman.bsky.social","Are Democratic governors talking? I sure hope they are having some strategy sessions.","2025-06-12T01:58:58.459Z"
"themanicman.bsky.social","I think Jesus was probably just another cult leader a lot like Trump, and if I had been alive back then, I'd have found him just as unappealing.","2025-06-11T22:07:27.476Z"
"themanicman.bsky.social","The 2020 BLM protests were a preview of what we can expect now. Get ready!","2025-06-11T13:46:33.093Z"
"themanicman.bsky.social","Trump is going to get Gavin Newsom elected President.","2025-06-11T01:37:56.405Z"
"themanicman.bsky.social","MAGA is working hard to make all the conspiracies they believe in come true for everybody.","2025-06-10T02:03:20.123Z"
"themanicman.bsky.social","That's a good point.","2025-06-10T00:05:02.876Z"
"themanicman.bsky.social","Is the war between Elon and the Donald over already? This is so disappointing! 🫤","2025-06-09T21:14:02.981Z"
"themanicman.bsky.social","Being very religious is like being addicted to drugs. Breaking the addiction can be very painful and disruptive, but it's also very freeing and worth it to go through.","2025-06-09T18:41:41.688Z"
"themanicman.bsky.social","This is a pretty important point!","2025-06-09T18:10:54.153Z"
"themanicman.bsky.social","The Evangelical Christian community is narcissistic on a mass scale. You can't win an argument with a narcissistic. You can't reason with them. All you can do is avoid them.","2025-06-09T02:22:21.938Z"
"themanicman.bsky.social","Trump wouldn't be attacking California if the Epstein stuff wasn't true.","2025-06-08T12:04:42.959Z"
"themanicman.bsky.social","There are no true gods. They're all false gods.","2025-06-08T01:48:17.255Z"
"themanicman.bsky.social","Has Donald Trump ever won ANYTHING without cheating?","2025-06-06T17:47:11.005Z"
"themanicman.bsky.social","feels","2025-06-04T00:47:32.832Z"
"themanicman.bsky.social","We should stop protecting hate groups just because they call themselves a church.","2025-06-03T13:57:14.474Z"
"themanicman.bsky.social","Curtis Yarvin as Dark Helmet from Spaceballs.","2025-06-03T00:39:03.490Z"
"themanicman.bsky.social","Donald Trump is the worst liar since Jesus Christ.","2025-06-02T15:17:58.100Z"
"themanicman.bsky.social","""""New Atheism"""" isn't a thing. The only difference between """"new"""" atheists and old atheists is that the new atheists are dying of old age or cancer instead of being burned alive.","2025-05-31T20:20:11.164Z"
"themanicman.bsky.social","God is dead. And Evangelicals have killed Him.","2025-05-29T14:15:59.611Z"
"themanicman.bsky.social","TACO is such a great nickname for Trump. It works on so many levels.","2025-05-29T02:08:14.823Z"
"themanicman.bsky.social","Christianity in America is changing from a belief in God into a cultural marker of identity.","2025-05-28T03:30:02.650Z"
"themanicman.bsky.social","Trump is an economic and cultural warmonger.","2025-05-28T02:30:07.926Z"
"themanicman.bsky.social","Maybe Trump is destroying our education system because he thinks smart people can be replaced by AI?","2025-05-28T01:11:27.064Z"
"themanicman.bsky.social","The Apostle Paul never met Jesus. So when he claimed to see him in a vision, how would Paul even know it was Jesus? And how could anyone else know he was right?","2025-05-27T02:51:32.965Z"
"themanicman.bsky.social","We need to do to Evangelical Christianity what we did to Tesla.","2025-05-26T21:34:33.622Z"
"themanicman.bsky.social","The problem I have with people who claim to be """"Libertarians"""" is that when you question them you tend to find out they really only care about their own Liberty, and not anyone else's. In my opinion, that's not Libertarianism, it's Authoritarianism. Authoritarians only care about themselves.","2025-05-26T15:18:01.161Z"
"themanicman.bsky.social","1/ The “One Big Beautiful Bill” is more than just tax cuts and spending shifts. Buried inside are provisions that quietly centralize power, weaken accountability, and erode democratic safeguards. Let’s talk about the authoritarian red flags 🧵","2025-05-23T16:55:39.310Z"
"themanicman.bsky.social","Hypocrisy is the currency of the Congress.","2025-05-24T15:47:29.806Z"
"themanicman.bsky.social","When it comes to the history of Christianity, it's important to remember that the early Christians were just as honest as the modern Christians.","2025-05-24T02:24:52.834Z"
"themanicman.bsky.social","1/ The “One Big Beautiful Bill” is more than just tax cuts and spending shifts. Buried inside are provisions that quietly centralize power, weaken accountability, and erode democratic safeguards. Let’s talk about the authoritarian red flags 🧵","2025-05-23T16:55:39.310Z"
"themanicman.bsky.social","Own the Libs, Lose Your Meds","2025-05-23T13:35:32.868Z"
"themanicman.bsky.social","Elon Musk claimed DOGE was going to cut 2 Trillion from the federal budget. Instead, they added 4 Trillion to the national debt.","2025-05-22T17:29:16.689Z"
"themanicman.bsky.social","I am an atheist and I love the Bible. I just hate when people misuse it. And those people are almost always Evangelical Christians.","2025-05-22T03:43:27.464Z"
"themanicman.bsky.social","FACT: Black wealth has barely increased as a percentage of total U.S. wealth since the 1960s. How much has it actually increased since Civil Rights? In 1968, Black Americans held about 1.5% of U.S. wealth. In 2019, they held about 3%. Good job, America. You're really making a difference. 🥺","2025-05-22T03:28:47.007Z"
"themanicman.bsky.social","FACT: In 1970 America, the richest 1% owned about 10% of the nation’s wealth. Today, they own over 30%! Why are we giving them more tax breaks? Are we trying to increase that trend or reverse it? Why is it okay to increase it but not okay to reverse it?","2025-05-22T03:23:02.080Z"
"themanicman.bsky.social","FACT: In America, The top 1% captured 38% of all new wealth created from 1989 to 2019. Why are we giving these people tax cuts while adding more debt burden on our children?","2025-05-22T03:19:51.742Z"
"themanicman.bsky.social","FACT: Wealth inequality in the U.S. is now worse than in Ancient Rome. (And they fought several civil wars over this problem.)","2025-05-22T03:18:03.225Z"
"themanicman.bsky.social","FACT: In 1983, the median American family had $85,000 in wealth (adjusted for inflation). In 2022, it was $88,000. In contrast, in 1983, the top 1% held $5 trillion in wealth. By 2022, they held over $45 trillion.","2025-05-22T03:17:13.330Z"
"themanicman.bsky.social","FACT: The three richest Americans now own more wealth than the bottom 50% of the country.","2025-05-22T03:14:27.147Z"
"themanicman.bsky.social","FACT: In America, CEO pay has increased 1,460% since 1978, while worker pay has increased only 18%. Why are we giving these people more tax cuts?","2025-05-22T03:13:33.451Z"
"themanicman.bsky.social","FACT: In America, the top 0.1% now own more wealth than the bottom 90% combined.","2025-05-22T03:12:34.006Z"
"themanicman.bsky.social","If you support Russia bombing Ukraine, if you support Israel bombing Gaza, if you support Saudi Arabia bombing Yemen, if you support Trump's hatefulness and lies -- what the hell is wrong with you?","2025-05-22T03:08:45.138Z"
"themanicman.bsky.social","We need to get the religious extremism out of government.","2025-05-22T03:03:24.815Z"
"themanicman.bsky.social","I feel like Evangelical Christians have never read Luke 10:25-37.","2025-05-22T03:01:47.888Z"
"themanicman.bsky.social","The trad wife movement seems to have a lot of women speaking very loudly about how women should be quiet and submissive.","2025-05-22T02:54:27.116Z"
"themanicman.bsky.social","You could literally ELIMINATE all federal taxes on 80% of Americans and it would add LESS to the deficit than passing this Big Beautiful tax cut bill. That's kind of crazy.","2025-05-22T02:49:37.107Z"
"themanicman.bsky.social","Can someone explain to me why anyone making a million dollars a year needs an additional tax cut? We're adding 3 TRILLION dollars to the national debt for that?","2025-05-22T02:17:27.188Z"
"themanicman.bsky.social","Gee, I wonder who's going to benefit?","2025-05-21T21:20:54.016Z"
"themanicman.bsky.social","We need to de-MAGA-fy America!","2025-05-21T15:39:46.260Z"
"themanicman.bsky.social","The Trump mafia family is a criminal syndicate and will need to be torn out by the roots. The first time we beat this we made a big mistake: we showed TOO MUCH MERCY and Biden wasn't up for it. We can't make that mistake next time. Never forget. Remember in 2028.","2025-05-21T15:38:07.416Z"
"themanicman.bsky.social","Religion is an addiction, and needs to be cured like one. The first step is to admit you have a problem. The best option is to quit cold turkey. The withdrawals will be bad for a couple weeks, but then you'll forget you ever had it. It will be like it never existed, and you won't miss it. Trust me.","2025-05-21T03:15:32.558Z"
"themanicman.bsky.social","Christianity is a conspiracy cult obsessed with human sacrifice and blood rituals. Isn't it time we left all that in the past?","2025-05-20T16:18:23.056Z"
"themanicman.bsky.social","When you base your morality on ancient superstition, you end up electing people like Donald Trump.","2025-05-20T14:38:00.944Z"
"themanicman.bsky.social","It's time to do to Evangelical Christians what they have done to us, says the Lord.","2025-05-20T13:28:53.142Z"
"themanicman.bsky.social","It really does seem like a pattern at this point.","2025-05-19T21:47:19.331Z"
"themanicman.bsky.social","Now this is the kind of thing I've been talking about!","2025-05-19T19:11:54.390Z"
"themanicman.bsky.social","If Evangelical Christians don't like living in a secular democracy like America, they can move to a religious theocracy like Russia or Hungary.","2025-05-19T17:21:32.160Z"
"themanicman.bsky.social","Hitler gained power by convincing the Christians that he would defeat their age-old enemy, the Jews. Look how that turned out! It turned out so badly, Christians had to find some totally different groups to demonize instead.","2025-05-19T15:12:51.740Z"
"themanicman.bsky.social","Remember, if you start believing the patients in the asylum, you'll probably wind up there.","2025-05-19T15:00:13.272Z"
"themanicman.bsky.social","Trump is creating a new heretical sect of Christianity.","2025-05-19T13:24:53.719Z"
"themanicman.bsky.social","Whenever you think of Jesus, picture Donald Trump, and you will be close to historical reality.","2025-05-19T12:51:01.727Z"
"themanicman.bsky.social","Don't you think Jesus was just another conman like Donald Trump?","2025-05-19T12:37:03.385Z"
"themanicman.bsky.social","Nearly all the religious countries in the world are authoritarian autocracies. That's why Evangelicals are trying to use Trump to turn America into another autocracy, because it's the only way for Christianity to survive.","2025-05-18T23:22:46.399Z"
"themanicman.bsky.social","Now it's going to be American companies that are supposed to """"eat the tariffs""""? I thought it was other countries that have to pay for tariffs? Make it make sense!","2025-05-18T23:17:32.373Z"
"themanicman.bsky.social","The secret Christians don't tell you: Heaven is just like a Trump Cabinet meeting.","2025-05-17T22:27:43.645Z"
"themanicman.bsky.social","God is a reflection of us. He didn't create us in his image. We create him in ours.","2025-05-17T20:24:11.846Z"
"themanicman.bsky.social","i have noticed this too","2025-05-17T16:22:22.061Z"
"themanicman.bsky.social","The reason Evangelical Christians love Trump so much, is because they both have the same character flaws which neither of them will admit to.","2025-05-17T14:50:49.005Z"
"themanicman.bsky.social","You know how Christians rationalize all the hateful things Trump says? We shouldn't be surprised. They've been doing that with the Bible for centuries!","2025-05-16T19:54:39.771Z"
"themanicman.bsky.social","Great idea😆👏👏","2025-05-16T17:18:33.164Z"
"themanicman.bsky.social","We used to call it the ALT-Right, but now it's just the Right.","2025-05-16T17:40:44.997Z"
"themanicman.bsky.social","We should ruin Trump's birthday with a nationwide protest.","2025-05-16T17:17:50.568Z"
"themanicman.bsky.social","Trump is letting in white immigrants from South Africa because that's the only place to find immigrants that are fans of his racism.","2025-05-16T03:56:21.357Z"
"themanicman.bsky.social","I'm sure cozying up to authoritarian Islamic countries isn't going to come back to bite American Christians in the ass later on.","2025-05-16T03:54:52.754Z"
"themanicman.bsky.social","Ever notice how Christian missionaries always target the poorest, most desperate places? They say it’s about helping—but it’s really about finding people desperate enough to believe what they’re selling.","2025-05-16T03:20:30.180Z"
"themanicman.bsky.social","Religious people tend to confuse ethics and ideology. They aren't the same thing.","2025-05-16T02:46:14.338Z"
"themanicman.bsky.social","Why does """"morally arrogant"""" and """"morally vacuous"""" so often go together?","2025-05-16T02:34:10.002Z"
"themanicman.bsky.social","Religion and Politics are the two cancers on society. That's why we must keep them separate. Bring them together and the patient dies.","2025-05-15T15:40:30.741Z"
"themanicman.bsky.social","Our brains expand to fill the available space—so give yourself more sky, not more walls.","2025-05-14T13:35:01.087Z"
"themanicman.bsky.social","Some people spend their lives cultivating an intentional habit of willful ignorance.","2025-05-14T03:05:46.195Z"
"themanicman.bsky.social","My MAGA Christian family thinks the end of the world is coming soon, and they're actively trying to make it happen.","2025-05-14T03:00:58.782Z"
"themanicman.bsky.social","Jesus was the leader of a crazy apocalyptic cult. And he still is.","2025-05-14T02:56:11.723Z"
"themanicman.bsky.social","reason+empathy=morality","2025-05-14T01:14:04.444Z"
"themanicman.bsky.social","I don't understand. Has manufacturing been brought back to the United States already?","2025-05-13T02:12:16.962Z"
"themanicman.bsky.social","You can make yourself believe anything if you constantly flood your mind with positive affirmations about that belief. Religion succeeds by encouraging this type of self-indoctrination.","2025-05-12T02:52:07.517Z"
"themanicman.bsky.social","Everyone assumes that belief in God is the moral position. But what if it was actually the immoral position? That would explain a lot!","2025-05-12T02:42:14.537Z"
"themanicman.bsky.social","I knew it!","2025-05-11T21:43:53.086Z"
"themanicman.bsky.social","Question: Does having kids make stupid people think they are smart?","2025-05-11T17:03:13.547Z"
"themanicman.bsky.social","I've noticed a curious thing about Evangelical Christians: they're always the victim and they never take responsibility for anything.","2025-05-11T15:16:23.638Z"
"themanicman.bsky.social","Why is God so obsessed with sex?","2025-05-09T20:22:50.236Z"
"themanicman.bsky.social","Why are religious organizations tax exempt? Why are we forced to subsidize our own destruction? Religion is not making society better. We should not give them an advantage over secular institutions that are actually improving the world.","2025-05-09T02:43:14.643Z"
"themanicman.bsky.social","The government should be the servant of the people, not their master.","2025-05-08T23:07:19.270Z"
"themanicman.bsky.social","There's no reward for leaving Christianity except for intellectual honesty.","2025-05-08T16:09:02.947Z"
"themanicman.bsky.social","Why do so many Christians—especially evangelicals—idolize people with such poor character? Maybe it’s not a flaw. Maybe it’s the feature they’re drawn to.","2025-05-08T15:42:25.007Z"
"themanicman.bsky.social","Ever notice how people who leave Christianity tend to show more self-awareness, while those who stay often lack it? I don’t think that’s a coincidence.","2025-05-08T15:00:44.746Z"
"themanicman.bsky.social","If sin is about moral behavior, then supporting liars and the politics of hate is sinful too. Evangelicals treat sin like it’s only about sex—but cruelty and deceit are sins, too.","2025-05-08T02:41:46.778Z"
"themanicman.bsky.social","Maybe we can exile Trump to Alcatraz the way the French did with Napoleon?","2025-05-07T17:30:48.547Z"
