"user","post","date"
"themanicman.bsky.social","I don't think it's a coincidence that Pam Bondi was the attorney general for Florida when Alex Acosta gave Jeffrey Epstein his sweetheart deal in 2008 and she's also Trump's attorney general now.","2026-01-02T22:56:47.302Z"
"themanicman.bsky.social","Everyone should watch the testimony of Jack Smith that was recently released. It's wild.","2026-01-02T21:23:45.688Z"
"themanicman.bsky.social","The one thing about Trump is that he's 90% performative and only 10% effective. Most of his attempts at being a dictator fail. He pretty much just plays one on TV.","2026-01-02T20:34:50.109Z"
"themanicman.bsky.social","Everybody is talking about Trump and Epstein in regard to the sex abuse, but we should also be looking at them as co-conspirators in a money laundering scheme too.","2026-01-02T18:43:19.074Z"
"themanicman.bsky.social","If we implemented a meritocracy for ideas, religion wouldn't stand a chance!","2026-01-02T17:04:47.052Z"
"themanicman.bsky.social","It's time to use the """"God wants it"""" argument to actually help people.","2026-01-02T16:12:55.005Z"
"themanicman.bsky.social","Why did God make it so difficult to lose weight? Seems like a design flaw.","2026-01-02T16:08:50.699Z"
"themanicman.bsky.social","He kills you with irony.","2026-01-02T16:04:31.036Z"
"themanicman.bsky.social","""""Our great Country cannot be run by “STUPID” or INCOMPETENT PEOPLE!""""","2026-01-02T15:22:21.323Z"
"themanicman.bsky.social","The problem with the Christian Church in American is that it's filled with people who like to criticize other people but not be accountable to anything but the God in their heads, and He always agrees with them.","2026-01-01T22:48:37.183Z"
"themanicman.bsky.social","BREAKING NEWS: Racists don't think Trump sounds like a racist.","2026-01-01T22:02:58.158Z"
"themanicman.bsky.social","Merrick Garland really needs to answer some tough questions after Jack Smith's testimony.","2026-01-01T21:34:31.342Z"
"themanicman.bsky.social","Christians like to claim Jesus must have risen from the dead because the disciples """"wouldn't have died for something they knew was a lie"""". This is such a stupid argument. Which disciple died for something they knew was a lie? Think about it.","2026-01-01T20:58:52.130Z"
"themanicman.bsky.social","Only cult leaders get away with r*ping children!","2026-01-01T16:40:49.019Z"
"themanicman.bsky.social","The NAZIs were just Christian Nationalists that happen to live in Germany.","2026-01-01T15:28:11.490Z"
"themanicman.bsky.social","So many experiencing FAFO, but the time for understanding has expired.","2026-01-01T13:45:00.825Z"
"themanicman.bsky.social","It seems like a lot of Trump supporters are figuring out that if you're constantly hateful to other people, eventually they will start to avoid you.","2025-12-31T22:29:29.699Z"
"themanicman.bsky.social","The Epstein Files: THE WORST IS YET TO COME!","2025-12-23T17:07:32.279Z"
"themanicman.bsky.social","Let's not forget it's the White Evangelical Christians that are responsible for Trump's election win.","2025-12-31T18:31:29.648Z"
"themanicman.bsky.social","There's nothing in the Constitution that says we have to make religion tax exempt.","2025-12-29T01:24:06.587Z"
"themanicman.bsky.social","BOLD PREDICTION: By the end of his Presidency, Trump will have us involved in a war with Europe, allied with Russia and China.","2025-12-28T19:12:40.075Z"
"themanicman.bsky.social","🎯","2025-12-28T14:28:32.658Z"
"themanicman.bsky.social","America wasn't founded as a Christian nation. Christians want to inject their religion into everything, and America was founded specifically around avoiding that. If anything, American was founded as an anti-Christian nation.","2025-12-27T22:04:01.156Z"
"themanicman.bsky.social","The Great Dechurching of America continues to accelerate. Expect even more extreme behavior from the Religious Right as their numbers dwindle in the coming decades.","2025-12-27T16:28:27.562Z"
"themanicman.bsky.social","Trump skipped the War on Christmas and went right for starting multiple wars on Christmas.","2025-12-26T21:20:12.823Z"
"themanicman.bsky.social","Trump has no imagination. That's why he always accuses other people only of things that he himself is guilty of. He can't think of anything new. He has no imagination, only ego.","2025-12-26T01:19:33.645Z"
"themanicman.bsky.social","Trump has no imagination. That's why he always accuses other people only of things that he himself is guilty of. He can't think of anything new. He has no imagination, only ego.","2025-12-26T01:19:33.645Z"
"themanicman.bsky.social","Obama was able to own the conservatives without being extremely hateful to everyone.","2025-12-26T01:01:12.096Z"
"themanicman.bsky.social","Three more years of this...","2025-12-26T00:02:54.326Z"
"themanicman.bsky.social","I'm starting to think it's the anti-immigrant folks that can't assimilate.","2025-12-24T20:30:39.999Z"
"themanicman.bsky.social","Kash Patel should be prosecuted for lying to Congress.","2025-12-24T04:41:26.663Z"
"themanicman.bsky.social","I hope this is a rhetorical question.","2025-12-23T20:46:39.778Z"
"themanicman.bsky.social","The Epstein Files: THE WORST IS YET TO COME!","2025-12-23T17:07:32.279Z"
"themanicman.bsky.social","A Democratic president in 2029 should assign a Special Prosecutor to investigate everything to do with Trump and his terms in office on Day One.","2025-12-23T03:41:50.424Z"
"themanicman.bsky.social","I really like this idea.","2025-12-23T00:11:41.235Z"
"themanicman.bsky.social","Christianity is a religion based on hypocrisy.","2025-12-22T17:58:21.298Z"
"themanicman.bsky.social","👇","2025-12-21T00:55:50.963Z"
"themanicman.bsky.social","This is how it feels right now.","2025-12-21T15:19:03.446Z"
"themanicman.bsky.social","The whole Christian revival narrative is just more astroturfing. Like everything associated with Trump, it's all fake.","2025-12-21T18:01:39.858Z"
"themanicman.bsky.social","Game on!","2025-12-21T17:47:55.585Z"
"themanicman.bsky.social","People say the cover up is worse than the crime. But the case of Epstein, the crime is worse than the cover up. That's why Trump is choosing the obvious cover up instead, so you know the crime must be even worse.","2025-12-21T05:06:46.801Z"
"themanicman.bsky.social","This is why they're panicking. Keep the pressure up!","2025-02-26T01:33:31.450Z"
"themanicman.bsky.social","This is how it feels right now.","2025-12-21T15:19:03.446Z"
"themanicman.bsky.social","100 CC FATAL KKKARMA ENJOY THE CARNAGE OF MORON MAGAT CANNIBALS","2025-12-21T03:39:47.924Z"
"themanicman.bsky.social","Yes, the blatant cover up legitimates assuming the worst. Given Trump’s malignant narcissism, habitual cruelty, manifest misogyny, blatant racism, sexual predation, lust for lying, & substantiated friendship with Epstein at the peak of the “wonderful secret” pedophilia, Kate Johnson’s account fits🧩🧩","2025-12-21T06:42:51.193Z"
"themanicman.bsky.social","People say the cover up is worse than the crime. But the case of Epstein, the crime is worse than the cover up. That's why Trump is choosing the obvious cover up instead, so you know the crime must be even worse.","2025-12-21T05:06:46.801Z"
"themanicman.bsky.social","What a couple of loser creeps.","2025-12-21T03:39:43.449Z"
"themanicman.bsky.social","The Epstein files release was a complete disaster. Trump is going to start sacrificing henchmen (and women) to save himself. You hate to see it.","2025-12-21T03:38:52.179Z"
"themanicman.bsky.social","👇","2025-12-21T00:55:50.963Z"
"themanicman.bsky.social","Who could have predicted Elise Stefanik would flame out so quickly?","2025-12-20T02:58:34.660Z"
"themanicman.bsky.social","Trump didn't redact the Epstein files to protect the victims. He redacted them to protect himself and his friends who are hip deep in this mess!","2025-12-20T02:01:56.384Z"
"themanicman.bsky.social","Please remember that evangelical Christians like Donald Trump so much because he is a reflection of their values!","2025-12-19T21:14:37.127Z"
"themanicman.bsky.social","How do you tell a Christian their entire life is based on conspiracies and lies? I feel so bad they are wasting their lives on this stuff.","2025-12-19T17:40:25.429Z"
"themanicman.bsky.social","Why did Trump give his speech last night in ALL CAPS?","2025-12-18T20:11:19.981Z"
"themanicman.bsky.social","Ben Shapiro was all on board when the right wing wanted to discriminate against Muslims and trans people. But he draws the line at discriminating against Muslims, trans people AND Jews.","2025-12-18T17:48:55.855Z"
"themanicman.bsky.social","We need to see this """"proof""""!","2025-12-18T04:24:18.642Z"
"themanicman.bsky.social","Trump wants to give more money to the military and wants the rest of us to blame our problems on immigrants.","2025-12-18T02:30:17.153Z"
"themanicman.bsky.social","Trump says the economy is doing great, and then says, """"...and nobody can believe it."""" I don't believe it alright.","2025-12-18T02:17:13.788Z"
"themanicman.bsky.social","The problem with Christians is they only care about themselves, their kids and their cult.","2025-12-17T19:08:54.406Z"
"themanicman.bsky.social","Merry X-mas!","2025-12-17T16:53:33.604Z"
"themanicman.bsky.social","Christianity persecuted all its competitors out of existence. Hey, if it worked for Christianity... 🤷‍♂️","2025-12-16T18:43:54.142Z"
"themanicman.bsky.social","Christianity today is just political ideology layered on top of a ancient toxic superstition.","2025-12-16T18:41:19.625Z"
"themanicman.bsky.social","If all the Holy Scripture in the world vanished in an instant, would God inspire people to write the same texts today?","2025-12-16T18:36:48.191Z"
"themanicman.bsky.social","Christianity has become a malignant religious cult. It should be retired permanently.","2025-12-16T18:23:53.007Z"
"themanicman.bsky.social","Tonight I'm watching """"The Princess Bride"""" in honor of Rob Reiner. The best movie ever! What's your favorite Rob Reiner movie?","2025-12-15T20:46:34.034Z"
"themanicman.bsky.social","Count on Trump to make it all about himself.","2025-12-15T16:16:56.674Z"
"themanicman.bsky.social","Young adults are leaving religion. There may be hope after all.","2025-12-10T14:04:46.634Z"
"themanicman.bsky.social","Telling people they are going to be burned in hell for all eternity unless they belief the right thing is a toxic ideology, especially when told to children. And especially since the """"right belief"""" is always the belief of the person telling you this!","2025-12-10T22:38:17.838Z"
"themanicman.bsky.social","Relationships depend on some kind of shared reality. That's why this era has been such a train wreck for relationships.","2025-12-11T00:43:24.246Z"
"themanicman.bsky.social","So, this is what it looks like when evangelical Christians are in charge?","2025-12-12T01:53:02.073Z"
"themanicman.bsky.social","So, this is what it looks like when evangelical Christians are in charge?","2025-12-12T01:53:02.073Z"
"themanicman.bsky.social","Indiana Republicans defy Trump's threats to redistrict. This guy is weaker than dry spaghetti.","2025-12-11T23:01:32.883Z"
"themanicman.bsky.social","Christianity is the Big Tabacco of the 21st century!","2025-12-11T16:21:07.702Z"
"themanicman.bsky.social","Jesus is the modern Snake Oil. Don't fall for it. Don't trust his salesmen!","2025-12-11T15:42:17.481Z"
"themanicman.bsky.social","Relationships depend on some kind of shared reality. That's why this era has been such a train wreck for relationships.","2025-12-11T00:43:24.246Z"
"themanicman.bsky.social","Telling people they are going to be burned in hell for all eternity unless they belief the right thing is a toxic ideology, especially when told to children. And especially since the """"right belief"""" is always the belief of the person telling you this!","2025-12-10T22:38:17.838Z"
"themanicman.bsky.social","Atheists are just people that think God-claims are a bit silly and stupid.","2025-12-10T14:57:11.288Z"
"themanicman.bsky.social","Is anyone else really tired of having Christmas every year? Maybe we could skip it for a decade or two?","2025-12-10T14:37:11.432Z"
"themanicman.bsky.social","Young adults are leaving religion. There may be hope after all.","2025-12-10T14:04:46.634Z"
"themanicman.bsky.social","Most of Christian theology is built on after-the-fact rationalizations for why Jesus had to die.","2025-12-10T13:30:34.602Z"
"themanicman.bsky.social","Someone just called Jared Kushner a """"tailor's dummy"""" and now I can't unsee it. 😆","2025-12-08T17:19:21.828Z"
"themanicman.bsky.social","Most of the growth of Christianity occurred AFTER the Roman Empire made it their favored religion. Coincidence? I don't think so!","2025-12-08T15:09:12.446Z"
"themanicman.bsky.social","What a pathetic SOB.","2025-12-08T14:46:37.426Z"
"themanicman.bsky.social","OMG. What a complete doofus.","2025-12-08T01:46:46.919Z"
"themanicman.bsky.social","An apologist is someone who sows doubt about reality.","2025-12-07T19:24:48.299Z"
"themanicman.bsky.social","It's time to crank the pressure UP!","2025-12-04T17:45:58.458Z"
"themanicman.bsky.social","I really see this in my own evangelical family. Because their litmus test for whether someone is credible is if that person confirms their religious beliefs, they end of listening to some ridiculously crazy people. It's why they believe so many stupid conspiracies!","2025-12-04T17:41:56.870Z"
"themanicman.bsky.social","""""Tell one lie and you’ll have to tell another."""" This perfectly sums up religion.","2025-12-04T05:06:52.530Z"
"themanicman.bsky.social","I guess the military should have listened to that video Democrats put out advising them not to follow illegal orders!","2025-12-02T14:58:22.884Z"
"themanicman.bsky.social","Remember when Trump said he was going to arrest Obama? What a nutcase.","2025-11-29T22:24:52.321Z"
"themanicman.bsky.social","Trump is an inspirational president in that he inspires everyone to act as terrible as he does.","2025-11-29T21:51:58.047Z"
"themanicman.bsky.social","A lot of people say Trump is not a Christian. I disagree. I think there has never been a more Christian president than Trump. Christianity has always been toxic and hateful. Hopefully, people are starting to realize that finally. It's time to jettison this harmful ideology.","2025-11-29T18:17:46.934Z"
"themanicman.bsky.social","When Republicans say """"Tax Cuts"""", what they mean is tax breaks for the rich and cutting services for the poor.","2025-11-29T04:12:06.172Z"
"themanicman.bsky.social","When Republicans say """"Tax Cuts"""", what they mean is tax breaks for the rich and cutting services for the poor.","2025-11-29T04:12:06.172Z"
"themanicman.bsky.social","I hope Democrats are preparing for impeachment. They should not wait this time.","2025-11-29T04:11:15.638Z"
"themanicman.bsky.social","Still valid.","2025-11-27T14:13:56.263Z"
"themanicman.bsky.social","Was Jesus really so great, or was it just his culty followers who thought so? Think about it.","2025-11-27T03:05:34.946Z"
"themanicman.bsky.social","Good explainer video from Johnny. This is why our politics are so screwed up.","2025-11-26T22:12:43.006Z"
"themanicman.bsky.social","Just watching the original Pink Panther movie again and I'm struck by the similarities between the character of Inspector Jacques Clouseau and Donald Trump.","2025-11-26T04:04:49.542Z"
"themanicman.bsky.social","Trump is really doubling down on the sedition accusations. He must be planning something really BAD with the military. I've heard he might be planning a blanket pardon for all military personnel. We need to be prepared!","2025-11-23T16:37:58.789Z"
"themanicman.bsky.social","This is scary stuff.","2025-11-23T16:03:19.817Z"
"themanicman.bsky.social","About 37 percent of Americans think the Earth is less than 10,000 years old. Coincidentally, Trump's approval rating is about 37 percent. 🤔","2025-11-21T19:37:26.130Z"
"themanicman.bsky.social","Is MAGA falling apart less than one year into Trump's second term?","2025-11-22T16:17:26.502Z"
"themanicman.bsky.social","✋","2025-11-22T04:35:06.260Z"
"themanicman.bsky.social","The way Donald Trump stared at Zohran Mamdani! 😂","2025-11-21T23:49:44.417Z"
"themanicman.bsky.social","Mamdani wins over Trump. This guy really is amazing.","2025-11-21T21:39:48.097Z"
"themanicman.bsky.social","About 37 percent of Americans think the Earth is less than 10,000 years old. Coincidentally, Trump's approval rating is about 37 percent. 🤔","2025-11-21T19:37:26.130Z"
"themanicman.bsky.social","Important thread!","2025-11-19T20:27:37.373Z"
"themanicman.bsky.social","I wonder if Trump will have a televised signing ceremony for the Epstein Transparency Act? Somehow I doubt it.","2025-11-19T20:24:03.235Z"
"themanicman.bsky.social","We really need to look more deeply into who bribed Alex Acosta to give Jeffrey Epstein such a sweetheart deal in Florida in 2008.","2025-11-19T19:42:52.870Z"
"themanicman.bsky.social","The worse thing about the internet is that it turned assholes into billionaires.","2025-11-19T17:38:36.350Z"
"themanicman.bsky.social","MAGA is a party of childish and narrow minded bigots.","2025-11-19T16:07:31.893Z"
"themanicman.bsky.social","Christianity has a Roman origin, not a Jewish one, in the same way that Mormonism has an American origin, not a Christian one.","2025-11-19T04:48:05.372Z"
"themanicman.bsky.social","Where is Marco Rubio? Isn't he the Secretary of State? Why don't I ever see him? Why is Steve Witkoff traveling around the world instead? It seems a little weird.","2025-11-19T03:57:17.237Z"
"themanicman.bsky.social","In my opinion, MTG still has some amends to make before I forgive her, but at least she seems to be on a better path.","2025-11-18T21:44:49.323Z"
"themanicman.bsky.social","People should remember that it takes a lot longer to build bridges than to burn them!","2025-11-17T16:38:36.414Z"
"themanicman.bsky.social","Remember, Trump could release the files anytime he wants. He doesn't need a House vote!","2025-11-17T15:29:11.462Z"
"themanicman.bsky.social","He knows he doesn't have the votes. Next step: Obstruction!","2025-11-17T04:02:21.355Z"
"themanicman.bsky.social","🤣","2025-11-15T21:53:26.725Z"
"themanicman.bsky.social","Fantasizing? I think you mean, """"remembering"""". 😉","2025-11-16T14:35:08.216Z"
"themanicman.bsky.social","Richard Dawkins: """"...jealous and proud of it, a petty, unjust, unforgiving control-freak; a vindictive, bloodthirsty ethnic cleanser, a misogynistic, homophobic, racist, infanticidal, genocidal, filicidal, pestilential, megalomaniacal, sadomasochistic, capriciously malevolent bully.""""","2025-11-16T04:33:53.783Z"
"themanicman.bsky.social","Why does Trump remind me so much of the God of the Old Testament?","2025-11-16T04:32:20.273Z"
"themanicman.bsky.social","I thought they were """"good friends""""?","2025-11-15T02:08:35.922Z"
"themanicman.bsky.social","@themanicman.bsky.social REPOST REPOST REPOST","2025-11-14T20:01:05.420Z"
"themanicman.bsky.social","Didn't Biden inherit a bad economy from Trump? We're actually still recovering from the economy Trump crashed the first time!","2025-11-14T04:02:27.866Z"
"themanicman.bsky.social","Adam Kinzinger really hit it out of the park with this video. We should share it everywhere. Maybe shame isn't dead. youtu.be/RMs7ILQ_n2Q?...","2025-11-13T04:33:49.527Z"
"themanicman.bsky.social","One thing that seems to be missed with this whole Epstein saga is that if they had fully investigated it in the beginning, the link to Trump would have been found and he never would have been elected in 2016!","2025-11-12T20:50:52.950Z"
"themanicman.bsky.social","Trump has done more to cultivate a culture of corruption of any President in my lifetime. We're going to be dealing with this until we die. Thanks to you, Mr. President.","2025-11-11T04:24:50.106Z"
"themanicman.bsky.social","If lies were water, Trump would be a fish.","2025-11-11T02:20:03.255Z"
"themanicman.bsky.social","Why do Democrats always surrender when they're winning?","2025-11-10T21:56:36.422Z"
"themanicman.bsky.social","There are two kinds of people in the world: those who idealize their parents and those who don't.","2025-11-10T22:17:16.327Z"
"themanicman.bsky.social","Why do Democrats always surrender when they're winning?","2025-11-10T21:56:36.422Z"
"themanicman.bsky.social","Now that the shutdown is over, we can vote on the Epstein Files, right?","2025-11-10T16:41:55.574Z"
"themanicman.bsky.social","You can't argue with a hypocrite, so don't even try.","2025-11-10T16:39:55.616Z"
"themanicman.bsky.social","The problem with Evangelical Christians is that they've turned pushing their ideology onto vulnerable people into an act of charity. It's not. It's just a pure selfish attempt at self-validation.","2025-11-10T16:35:56.913Z"
"themanicman.bsky.social","We should do this. It would send a serious message. youtube.com/shorts/CnU4U...","2025-11-07T16:10:28.103Z"
"themanicman.bsky.social","Evangelical Christians use the narrative of the persecution of Christians to justify their own persecution of others. Don't fall for it!","2025-11-08T17:26:17.957Z"
"themanicman.bsky.social","We should do this. It would send a serious message. youtube.com/shorts/CnU4U...","2025-11-07T16:10:28.103Z"
"themanicman.bsky.social","Thought I'd never say this, but Democrats should listen to Donald Trump: Nuke the filibuster, expand the court, add two states (DC & Puerto Rico), implement voting integrity, pass Medicare-for-All, and SAVE THE COUNTRY!","2025-11-07T16:05:06.338Z"
"themanicman.bsky.social","Add two states, pass medicare-for-all, and pack the courts!","2025-11-07T15:57:07.459Z"
"themanicman.bsky.social","I hope Trump succeeds in convincing Democrats to Nuke the Filibuster!","2025-11-07T15:56:08.895Z"
"themanicman.bsky.social","Democrats need to start thinking about taking over State legislatures for the 2030 redistricting battle. We need to gerrymander the Republicans out of existence for a decade.","2025-11-06T17:57:20.395Z"
"themanicman.bsky.social","PLEASE DONT!!!!!","2025-11-06T17:31:29.214Z"
"themanicman.bsky.social","Your life is more expensive because of Donald Trump.","2025-11-06T16:05:25.186Z"
"themanicman.bsky.social","The polls overestimated Trump support in Tuesday's election. That's an important thing to keep in mind.","2025-11-06T13:35:06.864Z"
"themanicman.bsky.social","God is just an emotional vampire, and churches are his hunting grounds.","2025-11-06T03:56:48.364Z"
"themanicman.bsky.social","Democrats should take advantage of their leverage and make additional demands to end Trump's government shutdown.","2025-11-05T16:38:06.063Z"
"themanicman.bsky.social","I don't know. I really think this explains Christianity.","2025-10-31T15:47:41.036Z"
"themanicman.bsky.social","People really like to lionize their martyrs, but that doesn't mean we should believe those biographies. They most often aren't a very accurate depiction of reality. Consider what happened to Charlie Kirk. Could the same thing have happened with Jesus?","2025-10-31T00:52:46.622Z"
"themanicman.bsky.social","The Israel-Palestine Peace deal that Trump called """"the greatest in history"""" was all just theater. Nothing really changed. Trump has already moved on. If Trump put half the energy he puts into creating theater into doing something REAL, that would be impressive.","2025-10-30T03:33:16.841Z"
"themanicman.bsky.social","Who could have guessed that being shameless was an important indicator of success in this world? And is it weird that Christianity encourages guilt but inoculates someone to shame?","2025-10-28T03:07:56.997Z"
"themanicman.bsky.social","Trump wants to build a gold ballroom to host everyone who gave him millions of dollars and exclude everyone else. It's basically an investment in his grifting operation under the guise of the US government.","2025-10-26T03:32:23.970Z"
"themanicman.bsky.social","How did the Apostle Paul know it was Jesus that appeared to him? Paul had never met Jesus. He didn't know what Jesus looked or sounded like. Did Jesus show Paul his Voter ID?","2025-10-26T03:26:20.438Z"
"themanicman.bsky.social","Christianity has become a toxic dumpster fire in America.","2025-10-23T21:27:43.951Z"
"themanicman.bsky.social","I'm tired of putting up with hateful crap just because of someone else's religion. Religion shouldn't be a justification for being hateful.","2025-10-22T03:00:18.145Z"
"themanicman.bsky.social","CONTROVERSIAL OPINION: Religion is more harmful to kids than porn.","2025-10-22T02:50:58.750Z"
"themanicman.bsky.social","""""Heaven"""" and """"Hell"""" are just concepts made up by religious folks to condemn their enemies and reward themselves. It's a toxic idea that we should jettison from society.","2025-10-22T02:40:38.999Z"
"themanicman.bsky.social","When they go low, we go for the jugular. #NOKINGS","2025-10-21T02:33:22.619Z"
"themanicman.bsky.social","Should you believe in a God that can't forgive you without a blood sacrifice?","2025-10-20T15:25:42.229Z"
"themanicman.bsky.social","Religion is so often a justification for hating other people.","2025-10-20T03:32:59.229Z"
"themanicman.bsky.social","The Bible is just religious propaganda. It’s just pretending to be history. Read carefully.","2025-10-19T03:36:18.606Z"
"themanicman.bsky.social","Christianity is like a cancer. Once you let it spread, it kills the body politic.","2025-10-18T18:37:45.663Z"
"themanicman.bsky.social","Newson screwed up. He should have drawn an extra 20 seats instead of just five. We are going to need them.","2025-10-18T16:54:23.176Z"
"themanicman.bsky.social","Christianity is moral superiority combined with moral hypocrisy.","2025-10-18T16:06:46.247Z"
