"user","post","date"
"themanicman.bsky.social","Can you die from irony? I'm dyin here!","2025-03-14T21:57:44.882Z"
"themanicman.bsky.social","Trump is literally doing the very things Republicans have been warning about for years.","2025-03-14T21:51:44.401Z"
"themanicman.bsky.social","Gavin Newsom is becoming a caricature of his former self. So disappointing.","2025-03-14T19:19:50.985Z"
"themanicman.bsky.social","Chuck has got to go. It's time for new leadership. The old ways of the past are not going to work in this new political moment! (IMHO)","2025-03-14T19:07:41.848Z"
"themanicman.bsky.social","What happened to the free speech crowd?","2025-03-14T18:50:35.251Z"
"themanicman.bsky.social","To me, atheism isn’t a belief—it’s a lack of belief. It exists only as a reaction to theism, a pejorative term created by theists for those who didn't share their belief. Without theism, the word atheist wouldn’t even be necessary.","2025-03-14T17:43:56.961Z"
"themanicman.bsky.social","How its going/how it went last time","2025-03-14T16:43:17.050Z"
"themanicman.bsky.social","This doesn't look good.","2025-03-14T16:42:45.009Z"
"themanicman.bsky.social","Remember that Jesus did not have to BE God for his later religious cult to THINK he was God.","2025-03-14T16:32:55.657Z"
"themanicman.bsky.social","CUT TAXES for the RICH and SERVICES for the POOR.","2025-03-14T15:56:06.939Z"
"themanicman.bsky.social","Remember when Republicans were fear-mongering about the """"Great Reset""""? Remember that every admission is actually a confession!","2025-03-14T15:06:02.932Z"
"themanicman.bsky.social","I think we forget that most Democratic Reps are part of the wealthy class.","2025-03-14T14:48:46.674Z"
"themanicman.bsky.social","Conservatives don't mean what they say, so don't take them at their word!","2025-03-14T13:47:31.654Z"
"themanicman.bsky.social","Let's say the Trump cult lasted for another 2,000 years. Would you trust them to tell you what he was really like? #JesusCult","2025-03-14T03:41:11.512Z"
"themanicman.bsky.social","Unsurprising. That's the real problem with most religions honestly: God is always on your side (even if you are directly acting in contrast with what is prescribed).","2025-03-14T02:32:09.211Z"
"themanicman.bsky.social","Great. Now I have to subscribe to another Substack newsletter!","2025-03-14T02:07:32.055Z"
"themanicman.bsky.social","Christianity is a personality cult that took over the administration of the Roman empire. Kind of like what's happening now.","2025-03-14T02:04:10.338Z"
"themanicman.bsky.social","Christians are notoriously dishonest. Don't trust anything they write. Especially if someone tells you it's Scripture!","2025-03-14T00:49:58.013Z"
"themanicman.bsky.social","Wow. Betrayed by our own. That really hurts.","2025-03-14T00:23:58.079Z"
"themanicman.bsky.social","I am MAGA about religion. I want to burn it all down.","2025-03-13T23:02:29.526Z"
"themanicman.bsky.social","The concept of God is not about love. That is just what they tell you. In reality, it is always about control.","2025-03-13T22:55:52.368Z"
"themanicman.bsky.social","Imagine if a Trump sycophant wrote a book. That's basically the New Testament. Do you still trust it?","2025-03-13T21:09:04.618Z"
"themanicman.bsky.social","This guy really channels my anger. I like him. youtu.be/hAQVtmF8u7I?...","2025-03-13T20:21:08.497Z"
"themanicman.bsky.social","If Evangelical Christians want to make empathy a sin, let's be sure not to sin against them!","2025-03-13T20:12:25.056Z"
"themanicman.bsky.social","I mostly use BlueSky as a cathartic outlet so I don't scream at the people in my ordinary life.","2025-03-13T03:19:48.977Z"
"themanicman.bsky.social","How come when we praise Christianity, it's a divine revelation, but when we criticize it we are told it's just made up of imperfect people?","2025-03-13T03:17:11.077Z"
"themanicman.bsky.social","Yes, I know Christians were the ones against slavery. But Christians were also the ones FOR slavery, and that's the part of Christianity that keeps rearing its ugly head.","2025-03-13T03:15:27.475Z"
"themanicman.bsky.social","I don't know who this guy is, but I like him. youtu.be/4WmWZ0pZpyQ?...","2025-03-13T01:29:50.690Z"
"themanicman.bsky.social","This so perfectly encapsulates both movements. Follow this guy!","2025-03-12T15:21:41.308Z"
"themanicman.bsky.social","Being woke is just having a third-grade reading level.","2025-03-12T14:14:11.926Z"
"themanicman.bsky.social","Has Trump sealed even a single deal since he entered office? Best trade deal ever? Haven't seen it. Peace for Ukraine in 24 hours? Not yet after way more than 24 hrs. Bringing down grocery and gas prices? Gee, I'm still waiting on that too!","2025-03-12T03:22:03.728Z"
"themanicman.bsky.social","I like Bart Ehrman. He's a great Bible scholar. But he gives early Christians too much credit. They were liars, and all of Christian history needs to be examined through that lens.","2025-03-12T02:40:54.903Z"
"themanicman.bsky.social","Hey Good Christians! Why are there so many bad Christians? Can't you do something about that? What's the point of your stupid religion anyway? If it doesn't produce better people, what's it all for?","2025-03-12T02:36:51.799Z"
"themanicman.bsky.social","The only manufacturing Trump will succeed in bringing back to America is the Recession he's currently manufacturing with his stupid tariffs!","2025-03-12T02:31:49.515Z"
"themanicman.bsky.social","This is why evangelical Christians hated the pandemic so much. Church attendance never recovered. Turns out when people aren't being brainwashed and pressured to believe every week, many of them wake up and leave.","2025-03-12T02:15:14.883Z"
"themanicman.bsky.social","Christians worship the worst people!","2025-03-12T01:44:34.126Z"
"themanicman.bsky.social","Boycotting Tesla seems to really bother Elon. We should keep doing it.","2025-03-12T01:39:16.350Z"
"themanicman.bsky.social","The Bible is basically political propaganda given a divine veneer.","2025-03-11T20:19:03.899Z"
"themanicman.bsky.social","Not long ago, I thought my first EV might be Tesla. Now I'm so glad I didn't waste my money on a car from a company that might not be around in another year.","2025-03-11T19:49:04.330Z"
"themanicman.bsky.social","Is Trump a symptom or is he the disease?","2025-03-11T19:00:25.122Z"
"themanicman.bsky.social","There is a real lack of accountability culture in the evangelical Christian community. It needs to change.","2025-03-11T16:39:56.628Z"
"themanicman.bsky.social","Evangelical Christian culture is toxic and hateful and in denial about it.","2025-03-11T15:57:52.020Z"
"themanicman.bsky.social","Looks like we're having an effect.","2025-03-11T11:27:38.181Z"
"themanicman.bsky.social","Trump can't even make us rich here in America, but he's going to make everyone in Greenland rich? Why don't we spend those billions here in America, Donny?","2025-03-11T01:50:46.763Z"
"themanicman.bsky.social","Elon just wanted to mention a bunch of organizations you should support.","2025-03-11T01:48:03.156Z"
"themanicman.bsky.social","""""anti-American activity"""" Where have I heard that before?","2025-03-11T01:42:09.906Z"
"themanicman.bsky.social","Don't worry. Trump is here to make dumb people smart again.","2025-03-11T00:26:47.320Z"
"themanicman.bsky.social","It's so obvious when you think about it. Who said the Bible was the authority for everything in the first place?","2025-03-10T23:40:14.131Z"
"themanicman.bsky.social","My MAGA family think Trump is going to """"save Christianity"""". I think he'll destroy it, and I gotta admit, I'm ready to watch this awful religion burn right to the ground. 💪","2025-03-10T23:34:25.529Z"
"themanicman.bsky.social","We should criticize religion. To keep it reigned in. We have seen what happens in history to societies where criticizing religion was not allowed. Criticizing religion is my sacred duty as a good member of society!","2025-03-10T23:06:59.381Z"
"themanicman.bsky.social","Christianity isn't a religion. It's about a toxic relationship with Jesus.","2025-03-10T15:52:08.793Z"
"themanicman.bsky.social","The Evangelical Christian Church has confused unity for uniformity.","2025-03-10T15:45:16.563Z"
"themanicman.bsky.social","""""Evangelizing"""" your hateful religion is an immoral act!","2025-03-10T15:43:12.475Z"
"themanicman.bsky.social","It's kinda easy to predict something you're planning to cause.","2025-03-10T15:41:53.723Z"
"themanicman.bsky.social","Christianity is just a system for rationalizing hypocrisy.","2025-03-10T15:10:10.927Z"
"themanicman.bsky.social","Evangelical Christianity is totally obsessed with sex.","2025-03-10T14:29:53.505Z"
"themanicman.bsky.social","@kaysemelone.bsky.social 's new podcast episode on the gamification of Christianity I think is right on! youtu.be/8-MkAHcbhGk?...","2025-03-10T14:26:09.091Z"
"themanicman.bsky.social","Have you ever noticed how paranoid evangelical Christians are? Everyone is always out to get them.","2025-03-10T14:23:17.377Z"
"themanicman.bsky.social","Evangelical Christianity is a high-control religious cult.","2025-03-10T13:57:25.369Z"
"themanicman.bsky.social","Trump was right about one thing. America is in decline. He predicted it. He caused it.","2025-03-10T13:29:50.223Z"
"themanicman.bsky.social","This is definitely not true of ALL White Evangelical Christians. Just 81% of them.","2025-03-10T03:15:40.127Z"
"themanicman.bsky.social","Why won't Christians just give Satan one more chance?","2025-03-10T03:07:53.823Z"
"themanicman.bsky.social","Christians support Trump because they can't admit to being wrong about """"one more thing"""".","2025-03-10T02:35:13.078Z"
"themanicman.bsky.social","I don't think there are any """"real Christians."""" That's just what some people say about themselves and not about others.","2025-03-10T02:29:57.811Z"
"themanicman.bsky.social","Controversial opinion: When Jesus warned of having lust in your heart he was speaking from personal experience.","2025-03-10T01:05:43.929Z"
"themanicman.bsky.social","Trump demonstrates that Christians will idolize the utterly undeserving. How can we know this wasn't also the case with Jesus?","2025-03-10T00:58:51.031Z"
"themanicman.bsky.social","Have Christian apologetic arguments gotten worse, or am I just older and wiser?","2025-03-09T23:58:24.679Z"
"themanicman.bsky.social","You know how MAGAs can't see any flaws in Trump even though it seems obvious that all he has are flaws? That's how I feel when someone says the Bible is a perfect book. (The relevance is that the second belief leads to the first.)","2025-03-09T23:22:50.870Z"
"themanicman.bsky.social","Let's hope so!","2025-03-09T15:44:27.582Z"
"themanicman.bsky.social","We are way too dependent on Elon Musk. How did anyone think that was a good idea?","2025-03-09T19:06:53.382Z"
"themanicman.bsky.social","The number of people Christianity has hurt, is growing larger than the number its helped.","2025-03-09T17:30:11.069Z"
"themanicman.bsky.social","If Zelenskyy's a dictator, Trump is an orange.","2025-03-09T17:26:41.726Z"
"themanicman.bsky.social","The Scientific Method emerged in defiance of religious dogma, not because of it. We don't owe Science, Morality or anything else to Christianity.","2025-03-09T17:24:26.703Z"
"themanicman.bsky.social","If you never taught your mind to be flexible when you were young, you're not likely to learn it when you're old.","2025-03-09T17:15:23.176Z"
"themanicman.bsky.social","Every spring when Daylight Savings Time hits again, I'm glad I don't go to church anymore.","2025-03-09T14:18:37.965Z"
"themanicman.bsky.social","I really think this is happening! Divide and conquer!","2025-03-09T14:16:25.882Z"
"themanicman.bsky.social","The real problem with religion is that it's getting more and more difficult to excuse someone for being so ignorant that they believe it.","2025-03-09T03:58:33.314Z"
"themanicman.bsky.social","I don't want to only pick on Evangelical Christianity. Mormonism is also based on a pack of lies and indoctrination.","2025-03-09T03:54:30.495Z"
"themanicman.bsky.social","We need to de-MAGA America.","2025-03-09T02:42:19.767Z"
"themanicman.bsky.social","Republicans want to spend more on the military and less on the people.","2025-03-08T22:38:47.132Z"
"themanicman.bsky.social","Just because you can resolve a contradiction in the Bible doesn't make your resolution true.","2025-03-08T21:14:13.244Z"
"themanicman.bsky.social","Why is """"God-fearing"""" considered a compliment?","2025-03-08T19:59:48.933Z"
"themanicman.bsky.social","We should normalize not praying before eating.","2025-03-08T19:57:59.411Z"
"themanicman.bsky.social","I don't feel the need to be agnostic about God. Knowledge of my own limitations keeps me from being completely certain, but it's like I don't doubt my wife's love even though I might not be completely certain. Okay. Divorced so maybe not the best example, but I still think there are no gods.","2025-03-08T19:29:18.302Z"
"themanicman.bsky.social","Just because you're someone that has to worship SOMETHING, doesn't mean that I am.","2025-03-08T19:20:24.621Z"
"themanicman.bsky.social","There's this fear in Evangelical circles about being too open to exploring other people's perspectives overly much. Because, whoops, you might actually change your views about something other than the Evangelical orthodoxy. This is very limiting--and dangerous too, based on where we are currently.","2025-03-08T19:04:02.709Z"
"themanicman.bsky.social","If you think your religion is unique, you are just one of those people that would think that about whatever religion you first encountered.","2025-03-08T18:46:25.481Z"
"themanicman.bsky.social","Evangelicals of today didn't learn anything from their parents' mistakes. They just doubled-down on them.","2025-03-08T18:16:01.141Z"
"themanicman.bsky.social","Why can't Trump get Russia to stop bombing Ukraine?","2025-03-08T17:29:41.624Z"
"themanicman.bsky.social","Cosplaying is just my normal life.","2025-03-08T17:25:17.131Z"
"themanicman.bsky.social","it does seem strange when you put it like that","2025-03-08T16:37:47.793Z"
"themanicman.bsky.social","If you want to leave Evangelicalism, but you're not ready to leave Christianity yet, that's okay. One step at a time.","2025-03-08T16:35:12.855Z"
"themanicman.bsky.social","The downfall of Christianity in this country will be from all the lies.","2025-03-08T16:29:45.950Z"
"themanicman.bsky.social","People who have deconstructed have proven their honesty.","2025-03-08T16:26:37.485Z"
"themanicman.bsky.social","Russia has manipulated elections and installed Russian puppets in so many other countries. Why would we think they can't do that here?","2025-03-08T16:25:46.058Z"
"themanicman.bsky.social","What was the moment that you realized Christianity was bullshit?","2025-03-08T16:08:04.856Z"
"themanicman.bsky.social","Christianity is the greatest illustration of the """"sunk cost"""" fallacy. That's why they start them young. They know that's how it works.","2025-03-08T16:04:29.316Z"
"themanicman.bsky.social","If you consistently treat other people as enemies, eventually they will treat you the same, and then you can use that as justification for treating them as an enemy all along.","2025-03-08T16:02:37.584Z"
"themanicman.bsky.social","If you could heat Christianity in a test tube, the orange sludge you'd get in the bottom is basically Donald Trump.","2025-03-08T14:48:33.083Z"
"themanicman.bsky.social","Trump's fight against DEI is just about reinstating the racism of the past.","2025-03-08T14:36:55.677Z"
"themanicman.bsky.social","Trump sees Putin as an ideological ally, because he wants to become the Vladimir Putin of America.","2025-03-08T03:49:04.127Z"
"themanicman.bsky.social","The Evangelical persecution complex is a self-fulfilling prophecy. When you treat everyone like an enemy, pretty soon that's exactly what they become.","2025-03-08T03:43:59.586Z"
"themanicman.bsky.social","If you've turned your religion into a toxic hate-cult, I think I'm allowed to be critical.","2025-03-08T03:18:36.384Z"
"themanicman.bsky.social","I think all of this is in the Bible.","2025-03-08T01:56:54.447Z"
"themanicman.bsky.social","Poor Elon. His space toy blew up, his orange master slapped him down and his net worth decreased by 18B. If he still wasn't the richest man alive I might feel sorry for him.","2025-03-07T15:54:33.883Z"
"themanicman.bsky.social","Nobody is listening to Trump. He's like a child throwing a tantrum in another room.","2025-03-07T14:49:16.898Z"
"themanicman.bsky.social","All of Christianity is based on a single fragile assumption: that the books of the Bible are special and contain information we can be confident is true. If that one assumption is wrong, the entire religion unravels.","2025-03-07T03:53:54.848Z"
"themanicman.bsky.social","Maybe Jesus Christ was the Donald Trump of his generation.","2025-03-07T03:37:59.190Z"
"themanicman.bsky.social","What if the Apostle Paul was the Ben Shapiro of his generation?","2025-03-07T03:34:59.781Z"
"themanicman.bsky.social","Christianity is just a personality cult centered around the mythical figure of Jesus. Like the cult of Dionysius, or Orpheus, or Osiris. Those were all thought to be historical figures too. The difference is that it was the Jesus cult that was adopted by the empire of Rome at the height of its power","2025-03-07T02:58:08.042Z"
"themanicman.bsky.social","Let's say 100 years from now people are arguing whether Trump was just a human or an incarnation of God. Would that convince me that Trump is some kind of demigod? Hell no! I feel the same way about Jesus.","2025-03-06T22:15:00.290Z"
"themanicman.bsky.social","I'm just saying that if I have to explain what's so bad about Trump, that's kind of the problem.","2025-03-06T22:01:32.010Z"
"themanicman.bsky.social","Today, we are all Al Green.","2025-03-06T18:53:45.915Z"
"themanicman.bsky.social","How would Trump be acting differently IF he were a Russian asset? I'm wracking my brain and I can't think of anything.","2025-03-06T18:36:22.380Z"
"themanicman.bsky.social","Christianity is not some divine revelation from above. It's just an ideology like Nazism or Communism.","2025-03-05T19:45:20.244Z"
"themanicman.bsky.social","Trump's answer to inflation: recession..","2025-03-05T00:25:47.928Z"
"themanicman.bsky.social","Let's go back to the 1950s: Stocks are down, prices are up and people are dying from the measles. Yah. MAGA.","2025-03-04T18:05:57.994Z"
"themanicman.bsky.social","The only thing Trump creates is conflict.","2025-03-04T17:27:20.735Z"
"themanicman.bsky.social","Every time a Republican cancels a town hall, an angel gets its wings. Just kidding. There ain't no fucking angels.","2025-03-04T16:59:26.365Z"
"themanicman.bsky.social","There is something very Christian about this approach, just look at its history.","2025-03-04T16:41:18.516Z"
"themanicman.bsky.social","Trump is such a terrible dealmaker. The only way he knows how to deal with anyone is by bullying them, and if that doesn't work he has no Plan B.","2025-03-04T16:39:47.705Z"
"themanicman.bsky.social","There are two kinds of guys. Those who worshipped their fathers and those who didn't.","2025-03-04T16:26:39.791Z"
"themanicman.bsky.social","Bibi Netanyahu has been in power for 16 years. Israel is just becoming another autocratic Middle-Eastern country.","2025-03-04T16:20:01.938Z"
"themanicman.bsky.social","We should be on the side of Ukraine and Gaza.","2025-03-04T16:05:26.350Z"
"themanicman.bsky.social","Jesus probably suffered from delusions of grandeur, a characteristic of nearly all cult leaders.","2025-03-04T16:03:34.025Z"
"themanicman.bsky.social","I remember.","2025-03-04T16:01:24.524Z"
"themanicman.bsky.social","Free speech for me, but not for thee.","2025-03-04T15:31:59.780Z"
"themanicman.bsky.social","God is just a way for wannabe kings to buttress their authority over others. I'm sure you know a few people like this in your life.","2025-03-04T15:22:21.464Z"
"themanicman.bsky.social","Believing in God is too often just a rationale for treating other people badly. We should get rid of that rationale.","2025-03-04T15:02:43.911Z"
"themanicman.bsky.social","During the Zelenskyy meeting Marco Rubio was sinking so far into that couch JD Vance was starting to look jealous.","2025-03-04T14:49:22.269Z"
"themanicman.bsky.social","Trump isn't thinking about the next election. He's thinking about his retirement after achieving life extension technology and amassing a large enough cash reserve that it can last him at least several hundred years.","2025-03-04T03:39:45.174Z"
"themanicman.bsky.social","Prices set to go up again tomorrow.","2025-03-04T03:31:46.009Z"
"themanicman.bsky.social","Christianity is all about making people THINK it's a great solution to everything. It's all about PR and always has been. That's why it's such a great mesh with Trumpism.","2025-03-04T02:42:28.027Z"
"themanicman.bsky.social","Republicans call the Left """"postmodernists"""", like its a bad thing, so I look it up and it sounds like Republicans.","2025-03-04T02:07:45.013Z"
"themanicman.bsky.social","Trump is very successful at manipulating a certain kind of person. Trump supporters are super impressed at his ability to so easily manipulate them.","2025-03-04T01:52:32.052Z"
"themanicman.bsky.social","This is all starting to make a lot more sense now.","2025-03-03T22:38:15.711Z"
"themanicman.bsky.social","Elon Musk is currently trying to BUY the Wisconsin Supreme Court just like he bought the presidency. We can't let that happen!","2025-03-03T22:13:59.705Z"
"themanicman.bsky.social","Americans would pay 100 BILLION dollars LESS in TAXES if we started taxing CHURCHES! This seems like a no-brainer!","2025-03-03T22:07:19.848Z"
"themanicman.bsky.social","It's outrageous that American taxpayers are subsidizing these for-profit religious scams. youtu.be/37cZqx349xU?...","2025-03-03T22:03:42.522Z"
"themanicman.bsky.social","We should tax for-profit churches. Stop subsidizing other people's superstition!","2025-03-03T21:59:20.974Z"
"themanicman.bsky.social","There has been a dearth of criticism toward Christianity and that has allowed it to grow into this hateful death cult. We need to normalize Christian criticism if we ever want Christians to change their behavior and become better people.","2025-03-03T20:30:08.185Z"
"themanicman.bsky.social","Hitler was a reflection of the Christian community that voted for him, and so is Donald Trump.","2025-03-03T17:51:21.696Z"
"themanicman.bsky.social","Generative AI is like a """"Bob Dylan goes electric"""" kind of moment.","2025-03-03T15:35:26.990Z"
"themanicman.bsky.social","People forget that Hitler was elected in a country with a population that was 96% Christian. The Anti-Hitler Christians had to start a new church called """"the Confessing Church"""" because they were not the majority. Most of the Christian churches were Pro-Hitler!","2025-03-03T02:58:51.203Z"
"themanicman.bsky.social","Withdrawing from the rest of the world just results in more hostility to other people, whether it's evangelicals withdrawing into their little homeschooling enclaves or Trump withdrawing the United States from our traditional allies.","2025-03-02T22:49:27.318Z"
"themanicman.bsky.social","Controversial opinion: I don’t call myself an ‘agnostic’ atheist. I don’t need to hedge my doubts about other myths—so why make an exception for the Christian God?","2025-03-02T21:49:45.708Z"
"themanicman.bsky.social","It's all so hypocritical, and also so very typical.","2025-03-02T21:28:03.038Z"
"themanicman.bsky.social","it was the Christian cult that gave birth to the Trump cult.","2025-03-02T20:16:19.924Z"
"themanicman.bsky.social","when trump voters complain about how hateful our culture has gotten, i think, yeah, your guy won by doing that better than anyone else.","2025-03-02T20:07:44.026Z"
"themanicman.bsky.social","If you base your entire life around your religion, and then you support a fascist like Trump, I think it's fair to say that its a decision you made because of your religion too.","2025-03-02T19:56:16.794Z"
"themanicman.bsky.social","im not sure how I feel about the declining birthrate. Maybe it’s just Nature’s way of telling us we’re destroying the earth? Either way, economic changes are coming. Some think our only options are having more kids or ignoring it—but why not prepare for the inevitable and adapt smartly instead?","2025-03-02T19:09:52.835Z"
"themanicman.bsky.social","I'd like to make your experience a possibility for everyone!","2025-03-02T18:33:05.378Z"
"themanicman.bsky.social","I agree with this so much. Christianity distorts your mind and morals. It makes people think hate is love and love is hate and lies are truth. It's time to say enough is enough and get rid of this parasitic mind-virus!","2025-03-02T16:36:42.757Z"
"themanicman.bsky.social","Dear Family, Maybe if you didn't support hate targeting me, I wouldn't try to avoid you. Sincerely, MM","2025-03-02T15:11:48.700Z"
"themanicman.bsky.social","Religion is just your brain finding meaning in randomness.","2025-03-02T14:24:02.766Z"
"themanicman.bsky.social","Skiing in jeans is pretty bad, but being a fascist conspirator seems worse.","2025-03-02T04:11:48.974Z"
"themanicman.bsky.social","Smoking is comforting. Drinking is comforting. Christianity is comforting. But comfort often comes from satisfying addictions, and sometimes those addictions are harmful. We need to quit them for the health of society.","2025-03-02T04:02:14.323Z"
"themanicman.bsky.social","The victim narrative of the evangelical Christian community is born out of a lack of empathy for the people who are actually being persecuted.","2025-03-02T03:39:09.277Z"
"themanicman.bsky.social","When you realize Christianity is just a system of lies meant to manipulate you, I think it's reasonable to be angry about it.","2025-03-02T03:30:28.250Z"
