"user","post","date"
"grandy007.bsky.social","All the gun rights people who claimed they needed their guns in case it became “necessary to the security of a free State…” um this would be your moment.","2026-01-13T03:03:10.360Z"
"grandy007.bsky.social","Frey: """"You cannot drag pregnant women through the snow. You're not allowed to take teenagers out of their car and detain them when they are in fact American citizens. That is against the law in every state. That is against our US Constitution.""""","2026-01-12T21:51:44.623Z"
"grandy007.bsky.social","Breaking NYT: The Pentagon used a secret aircraft painted to look like a civilian plane in its first boat attack, according to officials briefed on the matter. The laws of armed conflict forbid combatants from feigning civilian status. That is a war crime called """"perfidy.""""","2026-01-13T00:05:41.362Z"
"grandy007.bsky.social","It's not wrong to call the president a Motherfucker, it IS wrong to call this Motherfucker a president","2026-01-11T20:12:45.779Z"
"grandy007.bsky.social","Incredible @statuscoupnews.bsky.social interview with Skye, who says she’s a Marine Corps vet and appears to have just been released from Whipple. She says she was trapped by ICE, yanked out of her car and stomped on. 1/2","2026-01-12T02:46:36.224Z"
"grandy007.bsky.social","Third times a charm #impeach","2026-01-12T05:12:54.109Z"
"grandy007.bsky.social","It's time for the US military to take control of the US government, Court Martial their fake Commander in Chief & the idiot Secretary of Defence & place them before a firing squad. That is if any US Generals still believe in their oath to the Constitution, else the US will dive into anarchy.","2026-01-11T23:40:59.050Z"
"grandy007.bsky.social","Someday, sociologists will study MAGA. So many books will be written.","2026-01-11T20:39:52.346Z"
"grandy007.bsky.social","If the military is not going to stand up and protect the people, the constitution or the rule of law then fuck them too. Every #GOP that voted to deport US Citizens to labor camps need to be removed by force as well as this administration.","2026-01-12T00:12:13.761Z"
"grandy007.bsky.social","I will never forget.","2026-01-12T04:48:33.930Z"
"grandy007.bsky.social","100% this!👇","2026-01-11T15:50:46.090Z"
"grandy007.bsky.social","Auchincloss: """"When you have a badge & gun and you are interacting with a citizen who has committed no crime, the onus of responsibility is on you to exercise good judgment. Nobody watching that video will buy the argument that he had no other resort other than to shoot her in the face 3 times.""""","2026-01-11T17:13:54.800Z"
"grandy007.bsky.social","I’m just trying to understand this. I thought America’s whole gun obsession was about preventing government tyranny. They now have masked ICE agents shooting them and disappearing people. Why aren’t they shooting back? I mean, thank goodness they aren’t. But why aren’t they?","2026-01-10T22:54:00.906Z"
"grandy007.bsky.social","🔥","2026-01-11T05:39:59.533Z"
"grandy007.bsky.social","This is why local police departments should not hire ex-military.","2026-01-11T04:00:21.431Z"
"grandy007.bsky.social","#MakeBadPeopleFeelUnsafe Especially [REDACTED]! #impeach","2026-01-10T20:26:35.944Z"
"grandy007.bsky.social","Maybe this is why [redacted] wants Greenland so bad. Gotta keep em young! #epstein #impeach #Greenland","2026-01-10T20:24:01.433Z"
"grandy007.bsky.social","If you aren’t seeing any Iran news in your feed, search Tehran Iran news to stay apprised of the situation. #Tehran","2026-01-10T05:24:50.212Z"
"grandy007.bsky.social","If the executive branch can unilaterally cut off federal funding to specific states the union has already been dissolved.","2026-01-10T01:34:32.362Z"
"grandy007.bsky.social","Just a reminder that the US Right have been (speciously) warning for decades that the people of the US might one day need to form a people's militia to oust a government that tries to impose a tyranny.","2026-01-08T13:40:45.843Z"
"grandy007.bsky.social","“Fight like hell”. Where have I heard that before? Oh yeah, the last time he tried to steal an election. #impeach","2026-01-09T19:14:26.373Z"
"grandy007.bsky.social","He’s fucking right","2026-01-09T18:54:03.377Z"
"grandy007.bsky.social","Yes. I’ve been saying this for a while. They may be actual criminal kidnappers. I believe the second amendment allows for self-defense. Shoot first.","2026-01-09T15:17:53.675Z"
"grandy007.bsky.social","Let’s talk about something. The fact that the ICE agent who murdered Renee Good was dragged by a moving vehicle in a prior incident is not a defense, it actually makes the situation much worse for him.","2026-01-08T20:45:18.111Z"
"grandy007.bsky.social","Anyone breaking a window to ‘get’ the person inside totally deserves what’s coming. How would Jonathan Ross respond if a masked assailant did it to him?","2026-01-09T03:39:35.773Z"
"grandy007.bsky.social","THIS is what 2A is for","2026-01-09T03:31:35.826Z"
"grandy007.bsky.social","I’m old and stubborn. I may have been wrong all my life about then second amendment. I think I finally understand what our founding fathers were afraid of. Nazis. Fucking Nazis SS Gestapo on our streets. #impeach","2026-01-09T03:20:21.466Z"
"grandy007.bsky.social","If a global south country was shooting its citizens in the face and kidnapping the leaders of neighbouring countries and threatening to invade a European country, the US would take military action against it. Looks like it's time for the US to take military action against itself.","2026-01-08T00:14:44.293Z"
"grandy007.bsky.social","I’m not a huge sports fan. As a manager, I avoided sports analogies. But one lesson that we should learn now is that it’s actually ok to fire the boss. For whatever reasons. This is not a Harbaugh post #impeach","2026-01-08T20:01:54.636Z"
"grandy007.bsky.social","Stephen Miller and Trump both have to be removed from office...","2026-01-08T02:59:10.176Z"
"grandy007.bsky.social","What ICE did today in Minnesota is simultaneously a horrific tragedy and 100% something that was thoroughly predictable from their preexisting brutality and unaccountability. The agency must be abolished and its agents prosecuted. There is no alternative.","2026-01-07T19:11:33.794Z"
"grandy007.bsky.social","ICE is murdering Americans in the street.","2026-01-07T18:15:46.406Z"
"grandy007.bsky.social","Trump doesn't understand how business works.","2026-01-07T18:49:45.516Z"
"grandy007.bsky.social","Yep. It is our responsibility to stop him. Either the easy way or the hard way.","2026-01-07T18:47:01.414Z"
"grandy007.bsky.social","Watching MTG on The View, and she still blames Antifa for J6. Who the fuck does she think Antifa is? It’s true that leopards don’t change their spots.","2026-01-07T18:45:51.831Z"
"grandy007.bsky.social","It is now confirmed from multiple sources that ICE shot a legal observer dead on Portland in Minneapolis between 34th and 33rd street. The victim is dead","2026-01-07T16:28:07.503Z"
"grandy007.bsky.social","Sounds simple, but I doubt that any politician will commit to this. Sad.","2026-01-07T17:55:48.228Z"
"grandy007.bsky.social","Any member of the military who is thinking of invading another country and murdering more civilians; it's a War Crime, punishable by death. He won't be in power forever. Pardons won't protect you. """"I was just following orders"""" is not a valid legal defense. #NurembergTrials","2026-01-07T00:36:46.198Z"
"grandy007.bsky.social","File impeachment TODAY File impeachment TOMORROW File it every day until it succeeds","2026-01-06T21:40:32.534Z"
"grandy007.bsky.social","Hilton Hotels doubles-down on their support for the American Gestapo. When looking for a hotel, there are *plenty* of other choices.","2026-01-06T20:32:10.267Z"
"grandy007.bsky.social","Seems like [REDACTED] nor his entire administration never actually finished a US or world history class. They really should have at least read the cliff notes to see how this ends them.","2026-01-06T22:19:07.703Z"
"grandy007.bsky.social","Suburbia implementing Trump foreign policy.","2026-01-05T06:58:34.219Z"
"grandy007.bsky.social","If kidnapping a foreign president isn’t enough to get him out of office, why would the Epstein files be a silver bullet?","2026-01-05T06:20:49.724Z"
"grandy007.bsky.social","So today's lesson is that we can break laws to remove a bad president...? Do I have that right?","2026-01-03T16:27:09.282Z"
"grandy007.bsky.social","US strikes Venezuela. Now What?","2026-01-04T00:42:22.290Z"
"grandy007.bsky.social","Not sure this quote is authentic or not, but George Carlin was right about so many things.","2026-01-04T00:40:00.615Z"
"grandy007.bsky.social","I’m sure that the oil company executives will do what’s best for Venezuela","2026-01-03T20:06:25.504Z"
"grandy007.bsky.social","A dictator just launched an illegal war without Congress — that’s what he is if we don’t impeach & remove him from office This is a dark day in American history","2026-01-03T10:40:22.273Z"
"grandy007.bsky.social","It’s all about his misconception that business people should be in charge of everything. Does anyone else really believe an oil company can run a country?","2026-01-03T18:02:53.405Z"
"grandy007.bsky.social","Need to start a betting pool on which Fox News host will be “running Venezuela”.","2026-01-03T17:27:22.411Z"
"grandy007.bsky.social","Congress: You must rein him in NOW. It will only get worse. Venezuela will be just the beginning.","2026-01-03T17:12:56.165Z"
"grandy007.bsky.social","And everyone in his orbit knows it and promotes it","2026-01-03T17:23:09.603Z"
"grandy007.bsky.social","So the the FIFA Peace Prize truly was meaningless after all?","2026-01-03T16:19:25.573Z"
"grandy007.bsky.social","Did you hear the felons press conference.? He rambled in confused quotes, mentioned the Monroe Doctrine from be the early 1800’s, then topped off with mentally defective nonsense.","2026-01-03T17:09:10.882Z"
"grandy007.bsky.social","“I miss the optimism I had back at the beginning of 2026.”","2026-01-02T17:40:45.320Z"
"grandy007.bsky.social","I’ll do this until April","2026-01-02T22:17:54.174Z"
"grandy007.bsky.social","A friend in baseball once told me: It's amazing how far away spring training feels on Dec. 31 ... And how close it feels on Jan. 1 Just to prove that ... The first spring training game of 2026 is 7 weeks from today! Feel warmer yet?","2026-01-02T15:19:37.133Z"
"grandy007.bsky.social","In the end, Mussolini was shot along with 15 others. The bodies of Mussolini, his mistress (he was a serial adulterer), and his key associates were hung upside down for public viewing where they were spat upon. Tyrants eventually fall. They need to be recognized and removed before they gain power.","2026-01-02T21:35:07.478Z"
"grandy007.bsky.social","Voters should have to pass a cognitive exam.","2026-01-02T21:38:01.542Z"
"grandy007.bsky.social","deafening silence from Mayor Mamdani on how he is going to lower the cost of living in San Francisco","2026-01-02T20:29:02.077Z"
"grandy007.bsky.social","As an Oregonian, I fully accept that we have roughly 100 words for rain. Mist. Drizzle. Sprinkle. Downpour. But today I learned something important: “Moist” is not one of them.","2026-01-02T20:33:40.470Z"
"grandy007.bsky.social","There’s A LOT you can do. Here’s a start.","2026-01-02T01:50:35.493Z"
"grandy007.bsky.social","Imagine being a successful recording artist, and the best gig you can get is MarALago on NYE. #pathetic","2026-01-02T02:47:19.603Z"
"grandy007.bsky.social","I had to do the math…","2026-01-02T01:33:44.871Z"
"grandy007.bsky.social","substack.com/@thedarkleft.... We the people have to make it happen!","2026-01-01T14:59:31.104Z"
"grandy007.bsky.social","And they are proud of their achievements! We must do better if we are to survive","2026-01-01T20:41:41.198Z"
"grandy007.bsky.social","the violence of the trump regime will insure his name's appearance on lists with hitler, stalin, pol pot, mao, putin. newrepublic.com/article/2042...","2026-01-01T20:35:47.564Z"
"grandy007.bsky.social","#GoDucks","2026-01-01T20:28:35.727Z"
"grandy007.bsky.social","Not enough seahorses on Bluesky! @orcoastaquarium.bsky.social","2026-01-01T18:01:29.509Z"
"grandy007.bsky.social","trump has expressed a desire to address the Ukrainian parliament. What could possibly go wrong, right?","2025-12-31T10:06:16.911Z"
"grandy007.bsky.social","Just making sure that 2025 is definitely over","2026-01-01T04:43:18.566Z"
"grandy007.bsky.social","Uneducated voters will always be a greater danger to this country than immigrants.","2026-01-01T00:46:24.892Z"
"grandy007.bsky.social","Melt #ICE. Anyone arrested by any masked officers, define the arrest as invalid, and set them free.","2025-12-31T15:23:18.220Z"
"grandy007.bsky.social","Finally!!","2025-12-31T22:12:15.654Z"
"grandy007.bsky.social","My wife and I are enjoying watching the Jack Smith testimony on NYE. We are not crazy folks..Trump is guilty as fuck! Happy New Year! 🎊","2025-12-31T21:58:17.371Z"
"grandy007.bsky.social","Trump is """"being played"""" by Putin in the same way a star QB is """"being played"""" by his coach. Thinking that Trump is a dupe, rather than a knowing, willing participant, is adorably naive. Yes, he's an idiot, but that doesn't mean he's not also actively complicit in this.","2025-12-30T23:44:36.650Z"
"grandy007.bsky.social","This is not hard. Artists are not responsible for ensuring the Kennedy Center remains relevant and successful. The center’s board is responsible for that, in a fiduciary way. All of this energy being directed at artists should be re-directed at the board.","2025-12-30T16:07:24.114Z"
"grandy007.bsky.social","#handsoff #nokings #ReleaseALLthefiles #EpsteinFiles #lovemyGov #itsthefuckingguns #midterms26 #getridofElectoralCollege #TheEpsteinBallroom Release ALL the files NOW 25th Ammendment NOW 👇👇👇","2025-12-30T08:57:51.090Z"
"grandy007.bsky.social","Make sure everyone knows this. Because it is all TRUE.","2025-12-29T17:26:22.366Z"
"grandy007.bsky.social","Please please please be true","2025-12-29T19:55:02.222Z"
"grandy007.bsky.social","I forgot if she was laughing or yawning","2025-12-29T19:53:01.527Z"
"grandy007.bsky.social","This should be in obnoxiously large / gold letters on The White House","2025-12-29T19:50:03.405Z"
"grandy007.bsky.social","I’m old enough to know that RLS was Restless Leg Syndrome Now I’m Radical Left Scum. Way better.","2025-12-29T05:06:51.869Z"
"grandy007.bsky.social","💤💤💤💤💤💤💤💤","2025-12-28T09:08:48.976Z"
"grandy007.bsky.social","Donald Trump has been repeatedly caught lying about aspects of the Epstein saga. Trump is in the Epstein files many thousands of times over. The DOJ allowing someone in the Epstein files to manipulate the rollout is a gross violation of long standing protocols and even the law itself. Shame.","2025-12-27T04:29:46.954Z"
"grandy007.bsky.social","""""In a year we will all be living in Mars."""" - Guy who has trouble making cars where the doors open """"AI will be running the world in the next 12 months."""" - Guy whose chatbot never gives the right answer Why does anyone listen to these guys?","2025-12-27T17:56:30.086Z"
"grandy007.bsky.social","What in the actual fuck? Documenting actual domestic terrorism is now domestic terrorism???","2025-12-27T20:12:13.283Z"
"grandy007.bsky.social","FRONT PAGE!FRONT PAGE!","2025-12-27T01:07:28.050Z"
"grandy007.bsky.social","A tiny, ideologically diverse Republican majority in the House and a Democratic caucus that is dedicated to opposing the GOP have combined to make it exceedingly difficult to pass meaningful bills through the House — Byhttps://apple.news/A42U0V6gzSnGium5hDkGHpg","2025-12-27T18:34:43.235Z"
"grandy007.bsky.social","I don't think most Americans have any idea how dangerous it is for a president to declare an entire ethnic group to be """"garbage."""" This is how the worst atrocities in human history have begun.","2025-12-27T16:50:57.114Z"
"grandy007.bsky.social","Trump Says DOJ Should Stop Releasing Epstein Documents, Demands Everyone Please Stop Noticing How Defensive He Sounds thehill.com/homenews/adm...","2025-12-27T06:25:44.542Z"
"grandy007.bsky.social","Dang. 4,990 followers. And I rarely having anything useful/funny/insightful to say! Thanks Grandy","2025-12-25T03:29:54.056Z"
"grandy007.bsky.social","Blind loyalty to a President is treason.","2025-12-24T17:06:17.092Z"
"grandy007.bsky.social","""""This should take him down."""" On TNL, @sarahlongwell25.bsky.social , @jvl.bsky.social and @timmiller.bsky.social talk just how bad the Epstein files are for Trump","2025-12-24T17:51:22.033Z"
"grandy007.bsky.social","Literally any other attorney general before Bondi would have fought tooth and nail and then resigned over this alone. Letting White House staff take over making public statements in the name of DOJ is in and of itself completely insane.","2025-12-24T06:56:56.643Z"
"grandy007.bsky.social","AMEN 🙏","2025-12-23T17:38:10.439Z"
"grandy007.bsky.social","Expect extra crazy fuckery tomorrow.","2025-12-24T07:51:22.156Z"
"grandy007.bsky.social","Time to take our country back from these corrupt politicians.","2025-12-23T02:24:37.394Z"
"grandy007.bsky.social","Everyone keeps talking about the midterms and how that’s going to upend Trump and his corruption after he’s impeached but let me go on the record who I believe should be FIRST to go. EVERY REPUBLICAN JUDGE IN SCOTUS THAT LIED IN THEIR CONFIRMATION HEARINGS! GET GONE!","2025-12-23T10:06:49.749Z"
"grandy007.bsky.social","This is awesome, and surprising, honestly.","2025-12-23T20:28:42.204Z"
"grandy007.bsky.social","his job approval rating is a dismal 36%. But 89% of republicans approve. Wild. They are still overwhelmingly supportive of a felonious rapist bully.","2025-12-23T18:26:31.941Z"
"grandy007.bsky.social","‘How the South Won the Civil War’ 💯🎯 @hcrichardson.bsky.social","2025-12-23T02:05:52.142Z"
"grandy007.bsky.social","Felon47 is the deranged one...","2025-12-22T15:23:23.709Z"
"grandy007.bsky.social","👇👇👇👇👇👇👇👇👇","2025-12-22T16:34:44.465Z"
"grandy007.bsky.social","The full spiked 60 Minutes CECOT package, clean & subtitled. 1/5","2025-12-23T01:28:12.219Z"
"grandy007.bsky.social","Has any elected official demanded that DOJ release the instructions they gave to people reviewing and redacting Epstein files?","2025-12-21T17:17:57.013Z"
"grandy007.bsky.social","It's laughable that Trump and his minions believe they can suppress the Epstein files forever. The truth will come out. Everyone involved in the coverup should be prosecuted. This is the biggest coverup in American political history.","2025-12-20T22:48:51.885Z"
"grandy007.bsky.social","We were doing it for 230 years before Con Man Trump showed up. If the poor guy can't run the country with The People's representatives and impartial judges checking up on him like the previous 45 presidents did, then he can't run the country.","2025-12-21T14:08:06.653Z"
"grandy007.bsky.social","Thanks for including me. I’m almost to 5000. Hopefully most are actually humans.","2025-12-21T22:37:44.372Z"
"grandy007.bsky.social","Can a press corps reporter just ask him “I need Rx medicine to stay alive. It costs $100. How much will it cost after the 600% price cut?","2025-12-21T08:08:18.452Z"
"grandy007.bsky.social","Sean Glendening is the man covering up the Trumpstein files.","2025-12-20T06:06:04.257Z"
"grandy007.bsky.social","What will the next generation of MAGA be called? NeoMAGA?","2025-12-20T17:06:54.772Z"
"grandy007.bsky.social","Trump obviously had the Epstein files redacted. They didn't even hide it. So im much more interested in hearing testimony from the victims. Bring them in to a grand jury - then release the testimony. This is national security. We can't let pervert Don alter reality to his liking.","2025-12-20T14:36:34.081Z"
"grandy007.bsky.social","ICE in Indio, CA chased a family, caused a car crash that injured everyone in the vehicle, kidnapped the father and left the hurt mother and children without providing medical attention (12/19/25)","2025-12-20T02:34:07.229Z"
"grandy007.bsky.social","Elise Stefanik finds that enabling Trump's corruption and amplifying his hatred isn't the ticket to the top she thought it was.","2025-12-19T22:14:12.631Z"
"grandy007.bsky.social","Of course they scrubbed them","2025-12-19T22:14:40.006Z"
"grandy007.bsky.social","I hope he doesn’t have a blood clot today. There is a lot going on, focus. #ClotsAndPrayers","2025-12-19T21:07:08.467Z"
"grandy007.bsky.social","Yeah it’s nice to see someone from The Bush Institute speaking up for Ukraine.. might’ve been even better if it was almost 4 years ago.. but I guess we take this","2025-12-19T15:53:29.491Z"
"grandy007.bsky.social","“Silence in the face of authoritarianism is complicity. Speaking out is a patriotic act. Democracy doesn’t defend itself. It requires participation, vigilance, and courage from ordinary people.” – Rob Reiner","2025-12-19T15:24:30.901Z"
"grandy007.bsky.social","This pattern is unmistakable: the administration is manufacturing a crisis to justify a conflict. Trump’s accusations that President Nicolás Maduro is a drug trafficker—charges Maduro denies—mirror the kind of pretext-building we have seen before in other misguided wars. resist.bot/petitions/PG...","2025-12-18T07:56:26.661Z"
"grandy007.bsky.social","Totally worth the time to read through this. She has done the homework on #TheBallroom.","2025-12-18T07:25:57.858Z"
"grandy007.bsky.social","Commerce Democrats are sounding the alarm: families are paying more for cable, streaming, and wireless while consolidation and hidden fees go unchecked. An FCC that ignores affordability is failing consumers. www.youtube.com/watch?v=VTR3...","2025-12-17T21:10:50.206Z"
"grandy007.bsky.social","SOLE FOOD DEPT: Yes, Denny’s made sneakers with actual maple syrup inside them","2025-12-17T18:14:17.582Z"
"grandy007.bsky.social","Imagine that. The Conservative Way.","2025-12-17T16:42:56.312Z"
"grandy007.bsky.social","ICE Accidentally Publishes A ‘Watch List’ Of Immigration Lawyers, Which Is Definitely A Normal Thing For The Government To Do This is... disturbing. Let’s not forget, this regime has not been subtle about its hostility toward lawyers in general and immigration lawyers in particular.","2025-12-16T11:51:02.204Z"
"grandy007.bsky.social","That’s an easy answer: FUCK YES.","2025-12-16T05:03:56.206Z"
"grandy007.bsky.social","Today, I reviewed some of the classified Epstein files. They were disturbing & hard to review—but even harder for survivors to have experienced. The DOJ must follow the law & release the files, with protections for survivors. Our march towards healing, transparency, & accountability continues.","2025-12-17T02:48:40.651Z"
"grandy007.bsky.social","When the demonic dictator is dead and gone, every vestige of Trumpism must be expunged, or if need be, blasted from the face of the earth.","2025-12-16T01:16:06.419Z"
"grandy007.bsky.social","Just really awesome how our financial elite just spent the last several decades admonishing people for pursing the humanities and creative fields, and are now suddenly pedaling the idea that """"there are no good ideas anymore"""" after spending the last 5 years laying off everybody with a brain","2025-12-16T19:10:39.116Z"
"grandy007.bsky.social","Our evil, mentally ill president, celebrates the murder of Rob Reiner He - and all who enable him - will eventually go to hell. I pity them all.","2025-12-15T16:15:29.059Z"
"grandy007.bsky.social","youtube.com/watch?v=vqd2... Kristie Noem and Trump FAFO with Judge Bosberg... 🤣","2025-12-15T04:18:24.919Z"
"grandy007.bsky.social","BREAKING NEWS!!! IT’S FINALLY HAPPENING!!! The orange turd regime is FINALLY going to be heard for contempt charges, after federal judges give numerous chances (6-7 months) to comply. Hearings are to be held this week. Pls watch & REPOST! #news #politics #breakingnews #currentevents","2025-12-15T04:19:14.525Z"
"grandy007.bsky.social","So you're telling me the Phillies now have a Bryce, a Bryson, and a Bryse. That's it, they're at the quota.","2025-12-14T13:36:14.767Z"
"grandy007.bsky.social","So true. A harsh reality check for those of us who were raised to believe in American freedoms as we were taught.","2025-12-15T00:38:07.032Z"
"grandy007.bsky.social","I want EVERYONE who joined Jeffrey Epstein in abusing women and children to go to jail for their heinous crimes, doesn’t matter their political affiliation. Fascist republicans want to protect all of their pedo rapists who joined him at all costs. That’s the difference.","2025-12-13T23:48:44.096Z"
"grandy007.bsky.social","Two victims of previous school shootings — Mia Tretta, who was shot in the stomach in 2019 at Saugus High School, and Zoe Weissman, who survived the 2018 shooting at Marjory Stoneman Douglas High School — are now at Brown. Gun violence is out of control in this country.","2025-12-14T06:38:52.724Z"
"grandy007.bsky.social","I’ve seen two kids post that the Brown University shooting is the second school shooting they’ve survived. This should enrage and radicalize everyone. Kids shouldn’t have to survive one shooting, let alone two. No more thoughts and prayers. It’s time to address the guns.","2025-12-14T04:43:02.433Z"
"grandy007.bsky.social","First time fan of Flavor Flav. Gotta say, I’m impressed","2025-12-14T06:30:37.808Z"
"grandy007.bsky.social","Enough is enough. You might offend them if you call the hotline, again.","2025-12-14T06:23:58.994Z"
"grandy007.bsky.social","Stop accepting the cynical notion that “nothing can be done” about guns, or anything else for that matter. Every time you give up hope, the emperor has already won.","2025-12-14T00:50:34.032Z"
