"user","post","date"
"grandy007.bsky.social","youtube.com/shorts/Jk5ck...","2025-12-14T04:14:54.998Z"
"grandy007.bsky.social","Oregon coast tonight","2025-12-14T03:46:28.180Z"
"grandy007.bsky.social","BREAKING: Another avoidable American mass shooting. Early reports indicate 20 people or more may have been shot at Brown University in Providence, Rhode Island. It’s never too early to politicize this for a safer America. No other country in the world does this happen so often.","2025-12-13T22:55:03.818Z"
"grandy007.bsky.social","Another university shooting go.citizen.com/Zou8Kh8I4Yb","2025-12-13T21:39:40.391Z"
"grandy007.bsky.social","How long before he bans *women*? What’s Alfalfa supposed to do now?—","2025-12-13T06:58:12.735Z"
"grandy007.bsky.social","🤘✊ Good morning! 🩷","2025-12-12T14:56:48.172Z"
"grandy007.bsky.social","A ‘Nativity art’ installation depicting ICE goons sparked a heated reaction when a man stormed onto the property of a Charlotte church while CNN was filming. The man tore down parts of the installation.","2025-12-12T21:50:59.730Z"
"grandy007.bsky.social","Happy 100th birthday Dick Van Dyke!","2025-12-13T05:09:43.904Z"
"grandy007.bsky.social","Abolish ice is now the conservative position Everyone in ice has to go to prison and the department must be destroyed","2025-12-12T01:14:50.516Z"
"grandy007.bsky.social","A simple question","2025-12-12T03:47:16.552Z"
"grandy007.bsky.social","Yup......","2025-12-13T03:09:50.366Z"
"grandy007.bsky.social","I kinda hope that Mike Pence had a little influence.","2025-12-13T02:07:59.811Z"
"grandy007.bsky.social","""""It feels like, the, the fact that this happened in Indiana is not an accident."""" @timmiller.bsky.social and Alyssa Farah Griffin discuss Indiana Republicans rebuking Trump by rejecting the redistricting map, and what Mike Pence may have had to do with it.","2025-12-12T23:16:24.674Z"
"grandy007.bsky.social","#AnotherImprachableOffense","2025-12-12T21:43:21.064Z"
"grandy007.bsky.social","Tom Waits is so funny to me. Why does he sound like that (positive). Top ten human voices of all time. He sounds exactly the way this album cover looks youtu.be/C7I4kSpS43o?...","2025-12-12T08:13:50.249Z"
"grandy007.bsky.social","👏👏","2025-12-12T19:44:56.589Z"
"grandy007.bsky.social","Only criminals attack the innocent. ICE agents abusing power should be arrested, and so should the man who gave them their orders.","2025-12-12T17:31:37.443Z"
"grandy007.bsky.social","This needs to be taken down by DHS.gov www.dhs.gov/news/2025/04...","2025-12-12T19:52:18.030Z"
"grandy007.bsky.social","#FuckTheHeritageFoundation","2025-12-12T06:23:06.387Z"
"grandy007.bsky.social","They will remain Christian until so called real Christians start actually kicking them out of church instead of treating them with utmost politeness","2025-12-12T03:48:24.137Z"
"grandy007.bsky.social","It wasn’t even close.","2025-12-11T22:51:06.289Z"
"grandy007.bsky.social","Of all the things that taste like chicken, it's odd that eggs aren't one of them.","2025-12-11T14:46:34.134Z"
"grandy007.bsky.social","We are living in the stupidest time in history.","2025-12-11T20:34:21.266Z"
"grandy007.bsky.social","#Impeach #Convict #Remove Thank you for your attention to this matter.","2025-12-11T21:07:41.352Z"
"grandy007.bsky.social","MAGAZINER: How many veterans have you deported? NOEM: We haven't deported veterans MAGAZINER: We are now joined on Zoom by a combat veteran you deported to Korea","2025-12-11T16:22:42.190Z"
"grandy007.bsky.social","Magaziner: How many US military veterans have you deported? Noem: We have not deported military veterans. Magaziner: We are joined on zoom by a gentleman who is an army combat veteran who was shot twice while serving our country. You deported him to Korea.","2025-12-11T17:18:21.834Z"
"grandy007.bsky.social","Well, it’s not wrong.","2025-12-11T20:39:03.817Z"
"grandy007.bsky.social","Dear male White House reporters, The next time Trump insults one of your female colleagues, if one of you doesn’t interject and say “Excuse me, sir, but fuck you.” God is going to lose his mind. Regards, God","2025-12-11T03:03:40.419Z"
"grandy007.bsky.social","I remember the Canadian Election of 1993 where the losing party was almost wiped out. That’s what I’m hoping will happen to the MAGA GOP A tsunami blue wipeout","2025-12-11T07:56:27.024Z"
"grandy007.bsky.social","Agreed!","2025-12-10T23:51:41.041Z"
"grandy007.bsky.social","Bass: We had an important victory today from the courts. The court determined what we knew all along: we do not need National Guard troops in our city. We didn’t need them in June, and we certainly don’t need them in December. I’m glad a decision was made saying the president is out of line","2025-12-10T21:58:58.701Z"
"grandy007.bsky.social","White House Begins Christmas Season With Ceremonial Lighting Of Cross","2025-12-10T22:00:15.574673218Z"
"grandy007.bsky.social","Is it just me, but isn’t our President a whopping piece of shit?","2025-12-10T19:56:29.230Z"
"grandy007.bsky.social","What the actual fuck!?! Stand your ground ICC 💪🏼","2025-12-10T20:24:36.295Z"
"grandy007.bsky.social","So what happens to the drugs that get blown up? Does it affect our oceans?","2025-12-10T20:31:10.254Z"
"grandy007.bsky.social","“Trump mocks affordability during first stop of Affordability Tour” Makes sense, he mocks world peace on World Peace Tour.","2025-12-10T20:20:49.239Z"
"grandy007.bsky.social","“This could never happen in America. We would never let that happen here”, or so I believed.","2025-12-10T18:47:01.259Z"
"grandy007.bsky.social","So it turns out an ice agent is much more likely to have an arrest record than an immigrant.","2025-12-10T01:00:53.285Z"
"grandy007.bsky.social","It is my hope that we don’t make the mistake again of not expanding SCOTUS.","2025-12-09T14:33:58.705Z"
"grandy007.bsky.social","2 wounded in shooting in Cleveland, Ohio.","2025-12-10T05:33:08.669Z"
"grandy007.bsky.social","How about adding closed captions to a sound bar instead of across the screen? And use modern speech/text software from the wired connection. This could help a lot of mixed-ability households.","2025-12-09T21:41:01.193Z"
"grandy007.bsky.social","Another university shooting go.citizen.com/hpnMAi64XYb","2025-12-09T21:34:13.323Z"
"grandy007.bsky.social","ICE GOONS at a Mexican restaurant.","2025-12-09T03:17:17.038Z"
"grandy007.bsky.social","President Zelenskyy has rejected the Trump peace plan, submitted to him in its original Russian.","2025-12-09T04:53:55.382Z"
"grandy007.bsky.social","Please. It’s all I want for Christmas.","2025-12-09T04:28:23.037Z"
"grandy007.bsky.social","I wonder how many times Mike Pence shouted, """"Oh, eat my ASS!"""" at the TV during MTG's 60 Minutes whine-fest about Trumpenstein being a big old poopy-head meaniebutt.","2025-12-09T02:10:10.177Z"
"grandy007.bsky.social","WATCH: An ICE agent pushes away a home security camera as she approaches a house. This is what a police state looks like.","2025-12-08T23:30:31.371Z"
"grandy007.bsky.social","Free Luigi","2025-12-09T00:21:03.667Z"
"grandy007.bsky.social","Here’s what he’s missing: We have a president calling immigrants “garbage” and affordability a hoax, a DOD secretary cosplaying war games with no accountability, a VP saying it’s “reasonable” to not want neighbors who speak another language, and a Speaker who believes women are inferior. The GOP.","2025-12-08T04:01:09.958Z"
"grandy007.bsky.social","What we need right now is a holistic, systematic rebuke of current Trumpian ideology & strategy : its betrayal of moral truth, humanity in general, & American ideals; its foundation in cowardly fear, racism, xenophobia & hate; its fraudulence, corruption; its foundation in lies.","2025-12-06T17:05:42.957Z"
"grandy007.bsky.social","This will be remembered as the most pathetic moment in American history. What a needy fool.","2025-12-07T01:09:01.051Z"
"grandy007.bsky.social","Great news for Oregon Coast communities apple.news/AJGfnG34fQam...","2025-12-05T22:00:52.395Z"
"grandy007.bsky.social","I haven’t been able to form a sentence in like 10 minutes","2025-12-05T17:42:53.322Z"
"grandy007.bsky.social","“Opinion commentator”. He admitted his entire career was based on telling a steady stream of lies, then got mocked for it all day. This is his response. ❄️❄️❄️❄️❄️❄️❄️❄️❄️❄️❄️❄️❄️❄️❄️❄️❄️❄️❄️❄️❄️❄️❄️❄️❄️❄️❄️❄️❄️❄️❄️❄️❄️❄️❄️❄️❄️❄️❄️❄️❄️❄️❄️❄️❄️","2025-12-05T20:06:38.045Z"
"grandy007.bsky.social","FLORIDA — Woman in scrubs: “I’m a U.S. citizen! Why are you doing this to me??”","2025-12-04T20:26:33.548Z"
"grandy007.bsky.social","Remember The Epstein Files","2025-12-04T12:32:45.195Z"
"grandy007.bsky.social","Jennifer Welch: “The Republican Party has done such a good job propagandizing that if you need anything from the government, you’re a lazy piece of shit and a moocher, when really the parasites in this country are the billionaires.”","2025-12-04T19:10:40.210Z"
"grandy007.bsky.social","Saw them open for Steve Martin that September in LA. Life changing.","2025-12-04T19:30:06.784Z"
"grandy007.bsky.social","I wish this was just British humor","2025-12-04T19:24:58.127Z"
"grandy007.bsky.social","#ETTD","2025-12-04T19:11:06.174Z"
"grandy007.bsky.social","Anyone else miss The Al Franken Decade?","2025-12-04T05:33:12.478Z"
"grandy007.bsky.social","🚨 The GOP is SHITTING themselves The GOP is losing young voters fast. Independents are gone too. 2026 could be a game changer for Dems! See the whole story: youtu.be/ugQ8zaV5gTg","2025-12-04T02:12:36.049Z"
"grandy007.bsky.social","This is funny","2025-12-04T04:36:54.486Z"
"grandy007.bsky.social","Wow. That’s disgusting.","2025-12-04T03:39:51.435Z"
"grandy007.bsky.social","Opposites in harmony. Nature's been woke since forever.","2025-12-04T04:18:29.650Z"
"grandy007.bsky.social","Finally. But who could step up and do it?","2025-12-03T22:36:22.784Z"
"grandy007.bsky.social","Does anyone know exactly what Palantir does? And how and why? How do they benefit humans?","2025-12-03T18:47:57.398Z"
"grandy007.bsky.social","Agents in Key Largo, Florida ripped this woman wearing medical scrubs out of her car as she screamed she is a US citizen. Agents cuffed her and put her in one of their cars. She was eventually let go, per David Goodhue of the Miami Herald, who also took this footage:","2025-12-03T17:20:43.229Z"
"grandy007.bsky.social","Pete Hegseth is a liar.","2025-12-03T10:39:22.885Z"
"grandy007.bsky.social","Math and geography is hard","2025-12-02T19:50:44.543Z"
"grandy007.bsky.social","youtube.com/shorts/IBd71...","2025-12-02T19:33:03.464Z"
"grandy007.bsky.social","Turns out that there are real consequences for feeling biscuits to bears. rv-times.com/2025/12/01/c...","2025-12-02T19:38:07.712Z"
"grandy007.bsky.social","The entire administration is batshit bonkers","2025-12-02T19:31:28.929Z"
"grandy007.bsky.social","Just wait until AI has the right to vote!","2025-12-01T19:27:32.217Z"
"grandy007.bsky.social","What fresh new hell is this? www.levernews.com/tech-giant-s...","2025-11-30T14:38:10.386Z"
"grandy007.bsky.social","Why didn’t Trump order flags to be flown at half staff for National Guard member Sarah Beckstrom like he did for Charlie Kirk? 🤔","2025-11-30T17:33:48.834Z"
"grandy007.bsky.social","Similar feelings here, but I admit I’m “defund the police curious”","2025-12-01T18:57:48.972Z"
"grandy007.bsky.social","What a despicable statement!","2025-12-01T13:54:53.848Z"
"grandy007.bsky.social","“ some things still fucking matter.” !!","2025-12-01T17:56:50.316Z"
"grandy007.bsky.social","Fixed it… (and fuck you Hegseth)","2025-12-01T03:28:20.625Z"
"grandy007.bsky.social","It’s wild how the press is ok with the president abusing the pardon power. That used to be one of the most scrutinized things about a presidency.","2025-11-30T07:00:24.765Z"
"grandy007.bsky.social","Agree or disagree?","2025-11-30T13:26:27.942Z"
"grandy007.bsky.social","American history!","2025-11-29T17:05:39.050Z"
"grandy007.bsky.social","I can't even BEGIN to imagine how long it's going to take to UNFUCK everything our behated president has accomplished during his rampant destruction. If it even CAN be unfucked.","2025-11-29T14:16:19.595Z"
"grandy007.bsky.social","I wish we had a Woodward and Bernstein today!","2025-11-29T17:06:50.136Z"
"grandy007.bsky.social","If this were a Rorschach Test, I see Trump humping Ukraine. What do you see. Curren peace plan-","2025-11-29T17:07:32.804Z"
"grandy007.bsky.social","Every day I think I can’t possibly loathe this walking, talking piece of 💩more! Every day I think my rage can’t get any worse. Every day he proves me wrong! My rage is NUCLEAR ☢️!","2025-11-29T11:00:17.511Z"
"grandy007.bsky.social","Trump wasn't shot in the ear without it leaving a mark. We're going to find out what happened in Butler the day he got a firefighter killed with his sympathy stunt. There's too many people that know the truth, now, to keep it quiet.","2025-11-29T16:59:39.752Z"
"grandy007.bsky.social","Is there anyone who can explain math to the president in a way he can understand?","2025-11-29T16:55:03.822Z"
"grandy007.bsky.social","Well said. Destroy and call it growth.","2025-11-29T16:49:36.563Z"
"grandy007.bsky.social","Just a reminder⤵️","2025-11-29T06:03:43.415Z"
"grandy007.bsky.social","Since he was born. And then, the two wretches that birthed him fucked him up worse. A waste of an entire life. He has never done a thing for anyone, including his miserable self.","2025-11-28T15:05:56.596Z"
"grandy007.bsky.social","Every single congressional Democrat needs to be out there, right now, insisting that Pete Hegseth resign right now and announcing that he will be held accountable for committing war crimes. If you do not demand accountability here and now, they will only become more emboldened.","2025-11-28T19:19:52.979Z"
"grandy007.bsky.social","Clueless Kash Patel Gives Presser Not Knowing Suspect Was In Custody","2025-11-28T18:56:46.000Z"
"grandy007.bsky.social","@genodellamorte.bsky.social best headline of the day!","2025-11-26T22:58:36.322Z"
"grandy007.bsky.social","Shooting at Farragut West White House on lockdown","2025-11-26T20:02:20.086Z"
"grandy007.bsky.social","""""A woman with a family connection to White House Press Secretary Karoline Leavitt has been arrested by Immigration and Customs Enforcement agents in Revere, Massachusetts."""" www.wcvb.com/article/karo...","2025-11-26T04:07:37.584Z"
"grandy007.bsky.social","CARTOON OF THE DAY 🇺🇸","2025-11-25T20:53:27.149Z"
"grandy007.bsky.social","Great news for the Oregon coastal community www.koin.com/local/oregon...","2025-11-25T07:59:06.865Z"
"grandy007.bsky.social","I was surprised that I was actually agreeing with Senator Katie Kitchen from Alabama.","2025-11-23T23:58:10.782Z"
"grandy007.bsky.social","It was a beautiful day","2025-11-23T07:04:43.511Z"
"grandy007.bsky.social","Cruel bastards. Who does this? Who in hell carried out these orders? Generational trauma was inflicted upon this family because of cruel and illegal practices. #endICE #impeachtrump #stayloud","2025-11-23T06:42:01.956Z"
"grandy007.bsky.social","Awesome. 👏🏽","2025-11-21T03:44:34.694Z"
"grandy007.bsky.social","It turns out the newly elected Mayor of New York City is a skilled moron whisperer and it is sending MAGA into a full blown panic attack.","2025-11-21T23:04:55.371Z"
"grandy007.bsky.social","Ayup. It's getting hot in here... 451°F, to be exact","2025-11-20T17:48:14.685Z"
"grandy007.bsky.social","Trump will FAIL. It is an OBLIGATION AND DUTY to NOT follow and ILLEGAL ORDER. It is codified into: *The Uniform Code of Military Justice (UCMJ) *The Law of Armed Conflict (LOAC) *The Nuremberg Principles *Command responsibility doctrine THIS...is the time that every one of us MUST stand strong.","2025-11-20T22:07:06.504Z"
"grandy007.bsky.social","threads.com/@indoorkidcartoons Tom Reese","2025-11-20T23:09:33.984Z"
"grandy007.bsky.social","Today should go down in history as the day a sitting President of the United States made death threats against sitting members of Congress. Are we great yet?","2025-11-20T22:03:16.448Z"
"grandy007.bsky.social","“If you’re quiet now, you would’ve been quiet in 1940.”","2025-11-20T04:44:26.234Z"
"grandy007.bsky.social","Trump is overdue for another impeachment","2025-11-20T20:01:17.753Z"
"grandy007.bsky.social","EPSTEIN BOMBSHELL: my staff is releasing a new report showing JPMorgan Chase executives – all the way to the top – enabled Epstein's sex trafficking operation. You're going to want to read this.","2025-11-20T15:26:30.767Z"
"grandy007.bsky.social","Just reposting this. No particular reason","2025-11-20T19:39:24.488Z"
"grandy007.bsky.social","Is she saying that if Trump issued the orders, then they must be lawful?","2025-11-20T19:33:19.459Z"
"grandy007.bsky.social","Slender Man. I can’t believe I’ve not seen that connection before. Marvelous.","2025-11-20T19:31:16.569Z"
"grandy007.bsky.social","Good. Thank goodness for videos. So… are they bringing charges against the Border Patrol agent?👇","2025-11-20T19:27:27.921Z"
"grandy007.bsky.social","Karoline Leavitt Bizarrely Defends Trump’s ‘Piggy’ Insult: You ‘Should Appreciate’ the President’s ‘Openness’ Mediaite","2025-11-20T19:14:17.000Z"
"grandy007.bsky.social","I know I’m a libtard but I think it’s bad the U.S. president keeps calling for the killing of specific sitting elected officials who didn’t even commit crimes","2025-11-20T17:08:47.042Z"
"grandy007.bsky.social","OMG","2025-11-20T19:23:06.318Z"
"grandy007.bsky.social","Bless @sophiegilbert.bsky.social @theatlantic.com: """"The past decade has been a gloomy lesson in how limited a proportion of men actually see women as equal human beings...The fish rots from the head. The pig is in the Oval Office."""" www.theatlantic.com/culture/2025...","2025-11-20T15:23:57.299Z"
"grandy007.bsky.social","🤔 www.rawstory.com/trump-doj-pu...","2025-11-20T19:14:45.251Z"
"grandy007.bsky.social","Judge orders Texas school districts to remove Ten Commandments displays from classrooms.","2025-11-19T00:51:51.754Z"
"grandy007.bsky.social","True leaders!","2025-11-19T16:31:46.255Z"
"grandy007.bsky.social","Why MAGA trust him?","2025-11-19T16:12:27.550Z"
"grandy007.bsky.social","youtube.com/watch?v=An-y...","2025-11-19T16:07:05.784Z"
"grandy007.bsky.social","See a Nazi, punch a Nazi.","2025-11-19T07:26:57.405Z"
"grandy007.bsky.social","How is Mary Bruce not a trending topic? She is 300 million Americans!! Thank you Mary @abcnews4.com and all abc news.","2025-11-19T02:11:48.972Z"
"grandy007.bsky.social","I didn’t expect that!","2025-11-18T22:58:34.030Z"
"grandy007.bsky.social","This. And Trump wants $230M for being investigated? How about split $230M among these folks?","2025-11-16T20:16:02.156Z"
"grandy007.bsky.social","Pastors arrested and shot with chemical weapons by secret police every single week. Take a good, long look. Let it sink in. This is Trump’s America.","2025-11-15T19:54:59.092Z"
"grandy007.bsky.social","This morning Pope met actors, actresses, and filmmakers from the world of cinema. Leo told them: “When cinema is authentic, it does not merely console, but challenges. It articulates the questions that dwell within us, and sometimes, even provokes tears that we did not know we needed to express.”","2025-11-15T13:48:22.604Z"
"grandy007.bsky.social","The Epstein coverup will go down as one of the greatest scandals and miscarriages of justice in U.S. history. Everyone involved with Epstein’s victims or with the coverup needs to be prosecuted and go down in shame. It does not matter if they are GOP or Dems! Repost if you agree. #BlueCrew","2025-11-15T01:13:32.228Z"
"grandy007.bsky.social","👀 The Nodfather, aka Trump, confuses the word """"adapt"""" with """"adopt"""" 3 times in a row. Where is Jake Tapper?","2025-11-15T01:57:52.541Z"
"grandy007.bsky.social","This needs to go viral: youtu.be/nsMQ8V4pNCI","2025-11-15T01:07:32.565Z"
"grandy007.bsky.social","*taps mic* If Dems are in “the files,” then they should be prosecuted too. I don’t give a damn how important they are, how much money they have, or what their politics are. If they are in there, PROSECUTE THEM!! It's not complicated. All we want is equal justice. NO ONE is above the law. ⚖️","2025-11-14T17:39:43.834Z"
"grandy007.bsky.social","They’re calling Megyn Kelly “Megyn R. Kelly"""" now.","2025-11-14T15:38:27.416Z"
"grandy007.bsky.social","America's most notorious child rapist, Jeffrey Epstein, said this man was the worst person he'd ever met. Let that sink in.","2025-11-14T00:36:45.951Z"
"grandy007.bsky.social","I’m sure it’ll be authentic","2025-11-14T04:06:10.687Z"
"grandy007.bsky.social","Between the Epstein birthday book and these emails it’d becoming increasingly difficult to accept that anyone hung out with Jeff because of his wit and conversational skills","2025-11-13T16:16:19.490Z"
"grandy007.bsky.social","It won’t take many, and once the lifeboats start to fill, there will be a mad rush to abandon this sinking ship.","2025-11-12T21:49:28.798Z"
"grandy007.bsky.social","This Isn’t Even The Worst Stuff.","2025-11-13T02:37:01.874Z"
"grandy007.bsky.social","BREAKING: CNN is reporting that Trump held a meeting in the Situation Room (Yes THE SITUATION ROOM!) with Pam Bondi, Todd Blanche, Kash Patel and Lauren Boebert over the House effort to force the release of the DOJ’s Epstein files! They are panicking big time!","2025-11-12T22:10:11.945Z"
"grandy007.bsky.social","For folks (and journalists) who want to search the Oversight Committee email texts, I made a database for searching the 20k text files: splendorous-chaja-f79791.netlify.app","2025-11-13T01:12:26.893Z"
"grandy007.bsky.social","If **Jeffrey Epstein** thinks you're a evil and demented sociopath, the odds are overwhelming that you are, in fact, an evil and demented sociopath.","2025-11-13T02:18:57.677Z"
"grandy007.bsky.social","This is NOT who we are as Americans Anyone in the GOV & its contractors who had anything to do with these abductions, renditions, & torture must be fully held to account when The Current Regime is overthrown Merrick Garland must not be allowed near the process www.newsweek.com/trump-deport...","2025-11-13T02:06:38.552Z"
"grandy007.bsky.social","This seems important","2025-11-13T01:49:17.357Z"
"grandy007.bsky.social","turns out the emails we should have been reading in 2016 were from the NYT","2025-11-12T22:34:09.695Z"
"grandy007.bsky.social","Mike """"Little"""" Johnson is facing a revolt of over 100 of his caucus switching to yes votes on the discharge petition. The dam broke. No reason to fight it. He is rumored to be bringing the Epstein files vote to the floor.","2025-11-13T01:08:48.507Z"
"grandy007.bsky.social","Which perp will be the first to just admit it and get it over with ?","2025-11-13T01:16:58.097Z"
"grandy007.bsky.social","Local media is calling it: Katie Wilson will be the next mayor of Seattle. Wilson ousts Mayor Bruce Harrell after running as a progressive challenger. Her win is a west coast companion to Mamdani’s as a statement victory for the left.","2025-11-13T00:12:23.631Z"
"grandy007.bsky.social","Bad timing. Too bad his bunker I mean #ballroom isn’t done yet.","2025-11-13T01:10:34.672Z"
"grandy007.bsky.social","I wish I had more faith in Americans. I’m afraid you may be right.","2025-11-13T00:09:25.542Z"
"grandy007.bsky.social","Sloppy Steve doing damage control with the cult today trying to talk them off the ledge.","2025-11-12T20:14:28.756Z"
"grandy007.bsky.social","I’m not even going to ask you to make it make sense. They literally moved the one person that could spill the beans on him to a prison country club and gave her a puppy.","2025-11-12T22:11:37.814Z"
"grandy007.bsky.social","This. Is. Awesome.","2025-11-12T22:35:52.190Z"
"grandy007.bsky.social","We can hold onto hope!!","2025-11-12T22:26:28.071Z"
"grandy007.bsky.social","Oh whoa!","2025-11-12T19:34:35.414Z"
"grandy007.bsky.social","They are all directly involved #epstein","2025-11-12T22:13:44.511Z"
"grandy007.bsky.social","She is going to be a rockstar!","2025-11-12T22:11:31.841Z"
"grandy007.bsky.social","A new catchphrase has been born!","2025-11-12T22:07:31.337Z"
"grandy007.bsky.social","Congratulations. Now let’s get to work holding him/them accountable","2025-11-12T22:05:31.067Z"
"grandy007.bsky.social","Adelita Grijalva is FINALLY sworn in and is now officially a member of Congress","2025-11-12T21:12:34.520Z"
"grandy007.bsky.social","Epstein assaulted Maria Farmer and her sister Annie. Kidnapped her. Threatened her life (via Ghislaine Maxwell). Maria reported this to the FBI, which did nothing, to Vanity Fair magazine, which didn’t print the information as a favor to Epstein. Now she has contacted writer Ellie Leonard:","2025-11-12T16:18:18.137Z"
"grandy007.bsky.social","Who else celebrates #explodingwhaleday? And who hopes that it coincides with #explodingpresidentday? www.oregonlive.com/living/2025/...","2025-11-12T20:40:28.972Z"
"grandy007.bsky.social","It's time for Schumer to step down from his post as minority leader and allow for new leadership to emerge—someone who is willing to consistently fight for the American people. sign.moveon.org/petitions/sc...","2025-11-11T17:09:56.021Z"
"grandy007.bsky.social","15 years on a car loan? The gap insurance will be crazy expensive- obliterating any monthly savings.","2025-11-11T17:01:51.978Z"
"grandy007.bsky.social","She’s not wrong. He has changed the course of America.","2025-11-11T16:56:10.156Z"
"grandy007.bsky.social","Seems so simple","2025-11-11T16:54:05.262Z"
"grandy007.bsky.social","Totally","2025-11-11T07:24:06.937Z"
