"user","post","date"
"grandy007.bsky.social","I don't think someone would resign over a hoax.","2026-02-17T18:11:27.831Z"
"grandy007.bsky.social","And what the fuck would these ruthless criminals know about """"sensitive nature""""? The left-over MAGAts prove themselves to be increasingly ignorant... such suckers and fools.","2026-02-17T00:59:17.764Z"
"grandy007.bsky.social","Keep pressuring to revel the #UnredactedTrumpEpsteinFiles #Epstein #EpsteinFiles","2026-02-16T17:39:39.478Z"
"grandy007.bsky.social","Right-wing Heritage Foundation’s own data shows fewer than 100 noncitizens voted since 1982 (!!!) This is not a real problem. “The SAVE ACT is a Trojan horse to nationalize elections”: open.substack.com/pub/thiswill...","2026-02-16T15:23:58.555Z"
"grandy007.bsky.social","The numbers they claim were “let in” and the numbers already removed do not add up to needing detention centers all of the US. The math ain’t mathing","2026-02-15T17:52:35.172Z"
"grandy007.bsky.social","Democrats should propose amendments to the SAVE act that require the government to furnish free IDs to all eligible voters before requiring them, automatically register all people to vote, expand mail-in voting, and create a national voting holiday. Then watch republicans block them.","2026-02-15T23:32:04.219Z"
"grandy007.bsky.social","On July 27, 1974, the House Judiciary Committee approved three articles of impeachment against Nixon which all were approved on bipartisan votes. 🎯Obstructing justice & mounting a cover-up 🎯Defying congressional subpoenas 🎯Interfering with and misusing the FBI/DOJ Trump is outdoing Nixon by far.","2026-02-16T00:12:33.005Z"
"grandy007.bsky.social","Why would you ever vote for a political party that doesn’t want the people to vote?","2026-02-15T16:14:18.891Z"
"grandy007.bsky.social","Republicans are fucking feckless. I doubt that even Susan Collins would be concerned.","2026-02-16T03:12:02.190Z"
"grandy007.bsky.social","So Lutnick not only took his kids to Epstein Island, he took other people’s kids too?","2026-02-15T03:07:40.855Z"
"grandy007.bsky.social","Remember when Pam Bondi sold between $1 million & $5 million in Trump Media (DJT) stock back on April 2, 2025— The same day Trump announced new tariffs during a “Liberation Day” press conference held after markets closed — & then (DJT) fell 13% in the following days","2026-02-12T17:56:29.933Z"
"grandy007.bsky.social","Howard Lutnick misled the American people about his relationship with Jeffrey Epstein because he didn't want to admit he continued interacting with Epstein even AFTER Epstein was convicted of soliciting a minor. It's a disgrace. Lutnick needs to resign as Secretary of Commerce.","2026-02-12T20:00:53.713Z"
"grandy007.bsky.social","We all do that. Right?","2026-02-12T19:34:03.402Z"
"grandy007.bsky.social","Time to boycott Ring. Blue Sky do your thing!! #boycottring youtube.com/shorts/-ITnL...","2026-02-10T23:17:28.383Z"
"grandy007.bsky.social","He looks like an ICE agent. Hard to tell the difference with masks on","2026-02-10T19:48:15.256Z"
"grandy007.bsky.social","Goldman: You said references to ICE as secret police encourages threats. The problem is you have it backwards sir. People are making valid observations about your tactics which are outright fascist. If you don’t want to be called a fascist regime, stop acting like one.","2026-02-10T17:29:26.504Z"
"grandy007.bsky.social","NEW and WOW!!! Jamie Raskin Reveals Trump’s Name Shows Up in Unredacted Epstein Files ‘More Than a Million Times’ www.mediaite.com/media/news/j...","2026-02-10T19:37:48.590Z"
"grandy007.bsky.social","DONALD J. TRUMP WAS MENTIONED IN THE EPSTEIN FILES OVER A MILLION TIMES.","2026-02-10T19:38:43.096Z"
"grandy007.bsky.social","Kamala Harris was right Hillary Clinton was right Michelle Obama was right Anita Hill was right E. Jean Carroll was right PLEASE START LISTENING TO WOMEN ᵛⁱᵃ ᵂᵒᵐᵉⁿ ᶠᵒʳʷᵃʳᵈ","2026-02-08T05:57:50.871Z"
"grandy007.bsky.social","Did they ever discover who killed JonBenet?","2026-02-08T04:54:03.964Z"
"grandy007.bsky.social","I will not vote for any candidate who runs with """"we need to move forward"""" and refuses to prosecute this administration for every single one of their crimes. Accountability is all.","2026-02-07T16:55:22.322Z"
"grandy007.bsky.social","I’m not sure we’ve properly addressed how profoundly disturbing it is that America can largely shrug at the stashing of human beings in giant warehouses.","2026-02-06T05:12:56.212Z"
"grandy007.bsky.social","🎀🎀","2026-02-05T19:31:35.482Z"
"grandy007.bsky.social","And that right there folks with all her flaws and all, I love me some Hillary R Clinton. She said bring it bitches, but bring in to the streets! Full-on gangsta mode.","2026-02-05T15:36:52.695Z"
"grandy007.bsky.social","the sensible people of this country want to get rid of ICE and Democratic politicians do not want to get rid of ICE we don’t have to do this goofy dance like it’s mysterious it’s a simple truth move past anyone who refuses to acknowledge","2026-02-04T13:51:16.996Z"
"grandy007.bsky.social","😕","2026-02-04T05:31:00.211Z"
"grandy007.bsky.social","JUST IN: SCOTUS declines to take up challenge to Gov. Newsom's redistricting effort in California.","2026-02-04T18:58:55.552Z"
"grandy007.bsky.social","please watch:","2026-02-04T17:17:54.149Z"
"grandy007.bsky.social","Rockin' in the Free World -Neil Young🇨🇦🎸🎶 tidal.com/browse/track...","2026-02-04T00:52:31.534Z"
"grandy007.bsky.social","Any detention center that routinely and systematically denies all detainees medical care is designed and operated as a slow extermination camp. All ICE detention centers are death camps. This isn't """"neglect""""; it's auto-genocide.","2026-02-03T21:27:57.902Z"
"grandy007.bsky.social","I wonder if we'll ever know what percentage of AI bandwidth is going to generating porn?","2026-02-03T01:05:16.347Z"
"grandy007.bsky.social","Virtually Everything he Does Is Illegal! He Must Be Removed From Office!","2026-02-03T01:13:14.890Z"
"grandy007.bsky.social","Today the groundhog came out and saw the shadow of the Epstein Files over everything, predicting six very bad weeks ahead for Donald Trump.","2026-02-02T18:11:25.242Z"
"grandy007.bsky.social","Look ma, we're in Variety. variety.com/2026/tv/news...","2026-02-02T18:11:33.413Z"
"grandy007.bsky.social","Not normal.","2026-02-02T05:57:03.696Z"
"grandy007.bsky.social","youtu.be/4yXsd87Zgb4?...","2026-01-31T23:06:28.278Z"
"grandy007.bsky.social","Trump's name appears in the Epstein files A LOT. He is very much implied. Now it's time to demand accountability. Trump was always there, he participated in the heinous acts and he's lied about it. MAGA, your leader is no Christian. He is the very evil you pray to be protected from.","2026-01-31T15:10:01.971Z"
"grandy007.bsky.social","I hope this is the sentiment of all remaining MAGA. I’ll believe it when I see it in action","2026-02-01T00:28:44.938Z"
"grandy007.bsky.social","There is no reaction big enough to what is happening in this country right now. We knew. ‘Grab them by the p*ssy.’‘I can shoot someone on Fifth Avenue.’￼ And it is so much more mind-bogglingly worse 10+ years later with no guard rails￼. But we knew.","2026-01-31T22:12:09.683Z"
"grandy007.bsky.social","Make sure you have the sound on!","2026-01-31T20:25:24.130Z"
"grandy007.bsky.social","Huh...","2026-01-31T20:22:16.837Z"
"grandy007.bsky.social","This is only 50% of the Epstein Files. This is the half they released.","2026-01-31T17:01:10.851Z"
"grandy007.bsky.social","America, throw the entire administration in prison.","2026-01-31T18:15:31.470Z"
"grandy007.bsky.social","The director of Melania movie","2026-01-31T18:59:16.190Z"
"grandy007.bsky.social","Bruce Springsteen in Minneapolis earlier today. Please share and let this ring out from sea to shining sea. ICE out now!","2026-01-31T02:02:15.374Z"
"grandy007.bsky.social","ICE pistol whips a 16 yr old with his hands up","2026-01-31T17:54:34.389Z"
"grandy007.bsky.social","Open letter to our Senators: Gentlemen, Ladies, we don't really care about ICE not getting even more funding. We don't care about more """"training"""" and more rules they won't follow. We want ICE de-funded. Dismantled. Gone. Driven out of our cities.","2026-01-31T09:01:42.556Z"
"grandy007.bsky.social","The real Melania movie She Stayed for the Stormy Daniels sh*t. Stayed for the child-separation horror. Stayed for the Epstein stench. Smiled for the checks. Turned self-regard into a business model. This isn’t mystery or grace—it’s self-fellation with a glam team.","2026-01-31T19:21:40.052Z"
"grandy007.bsky.social","Well, who killed #Epstein now seems obvious.","2026-01-31T15:54:02.284Z"
"grandy007.bsky.social","If the Grammy’s asked Springsteen to sing his new song ‘Streets of Minneapolis’ live on Sunday it would help USA. I personally worked on a Joe Strummer tribute w/Bruce at Grammy’s in ‘03 and a MusicCares tribute to Dylan with Bruce (same vibes, honor legacy) truth to power/🖕🏻ICE.","2026-01-30T21:38:52.489Z"
"grandy007.bsky.social","They destroyed the chain of evidence, the ballots can't be trusted for anything moving forward.","2026-01-31T03:51:24.283Z"
"grandy007.bsky.social","It doesn’t seem like Epstein is a hoax after all.","2026-01-31T01:53:27.738Z"
"grandy007.bsky.social","Major Epstein Update: Survivor Told FBI Maxwell """"Presented"""" Her to Trump and Made Clear She Was """"Available"""" open.substack.com/pub/aaronpar...","2026-01-30T23:52:49.220Z"
"grandy007.bsky.social","Trump’s Republicans are doing everything they told us the Democrats would do. Every accusation is a confession.","2026-01-30T15:42:24.221Z"
"grandy007.bsky.social","Open letter to our Senators: Gentlemen, Ladies, we don't really care about ICE not getting even more funding. We don't care about more """"training"""" and more rules they won't follow. We want ICE de-funded. Dismantled. Gone. Driven out of our cities.","2026-01-30T02:23:53.313Z"
"grandy007.bsky.social","So the FBI has time to raid an elections office in Georgia in order to prop up Trump’s conspiracy theories about losing the 2020 election… but not to release the Epstein Files? IMPEACH DONALD TRUMP!","2026-01-29T16:04:50.881Z"
"grandy007.bsky.social","I keep hearing the same argument from MAGA: """"What about all the citizens murdered by illegals"""". Then get a warrant and go arrest them! Don't patrol the streets terrorizing everyone, arresting children at schools and US citizens because you don't know who to arrest. See the difference?","2026-01-29T14:53:31.742Z"
"grandy007.bsky.social","This is funny!","2026-01-30T01:16:29.289Z"
"grandy007.bsky.social","Make this fkr pay at midterms. This is the same senator that spent the 4th of july in Russia.","2026-01-28T17:38:12.591Z"
"grandy007.bsky.social","DUCKWORTH: If it's true that we are not at war with Venezuela, will you advise the president to rescind his invocation of the wartime Alien Enemies Act? RUBIO: That was a mechanism to remove people from our country that present great danger D: It's a wartime act. Are we currently at war? R: No","2026-01-28T17:08:17.447Z"
"grandy007.bsky.social","2 wounded in shooting in Providence, Rhode Island","2026-01-29T01:21:41.649Z"
"grandy007.bsky.social","“I watched him die… then I watched them maneuver his body like a rag doll— only to discover it was because they wanted to count the bullet wounds and see how many they ‘got’, like he was a deer.”","2026-01-28T05:46:16.346Z"
"grandy007.bsky.social","I doubt this will get any airtime on many radio stations. Hopefully I’m dead wrong. In the meantime, share this and listen to it","2026-01-28T18:23:56.574Z"
"grandy007.bsky.social","Any and all Democratic Senators who vote to fund the Government is dead to me.","2026-01-28T14:45:03.623Z"
"grandy007.bsky.social","The attacker followed multiple right-wing accounts on X, like Charlie Kirk and Ben Shapiro. On Facebook, his profile picture was Trump multiple times and he regularly criticized Democratic politicians. All of this seems to indicate the attack was fueled by his political sentiments. trib.al/U4mbUX0","2026-01-28T15:31:43.880348Z"
"grandy007.bsky.social","Uh. So ICE just technically tried to invade Ecuador. Cool new international incident dropping.","2026-01-27T22:52:10.520Z"
"grandy007.bsky.social","If only the Border Patrol had a history of truthfulness. But I have a feeling there’s more to this story apple.news/AWm-b-qitSEi...","2026-01-27T21:09:25.827Z"
"grandy007.bsky.social","An apology isn’t good enough from this ghoul… only a charge of treason will suffice","2026-01-26T19:54:14.943Z"
"grandy007.bsky.social","Epstein files are still a thing, right?","2026-01-25T02:31:03.271Z"
"grandy007.bsky.social","i don’t think they understood how big this bear they poked is gonna be","2026-01-25T06:08:36.598Z"
"grandy007.bsky.social","Come Midterms Everyone is Going Down...","2026-01-25T04:07:00.971Z"
"grandy007.bsky.social","Mirror-imaging. They could never imagine putting themselves on the line for another person or their community (remember JD Vance's theory of love, that it extends only to your family and no one else?) and they know any """"resistance"""" on their end would be purely transactional - so they assume the same","2026-01-25T04:56:37.469Z"
"grandy007.bsky.social","The first Minnesota murder, they refused to let a medical professional help the woman they shot. The second Minnesota murder, they simply shot the medical professional.","2026-01-24T22:03:11.213Z"
"grandy007.bsky.social","Why the hell did ICE and BP show up to a planned protest? They were ordered to be there and cause trouble with law abiding citizens","2026-01-24T20:35:35.277Z"
"grandy007.bsky.social","ICE has now carried out two summary executions of innocent people in the streets of an American city. If you work for ICE, there's no denying that's the mission you're supporting now. You don't get to claim in one year or ten or twenty that you didn't know what ICE was doing. You're complicit.","2026-01-24T15:55:53.147Z"
"grandy007.bsky.social","I am watching what is happening in Minneapolis on Ali Velshi and one of the ICE officers (off camera) literally says, “It’s like Call of Duty. Pretty cool huh?” as they shoot whatever it is they are shooting. Agents walking around, guns unholstered for no reason. This is insanity","2026-01-24T16:45:33.134Z"
"grandy007.bsky.social","I just spoke with the White House after another horrific shooting by federal agents this morning. Minnesota has had it. This is sickening. The President must end this operation. Pull the thousands of violent, untrained officers out of Minnesota. Now.","2026-01-24T16:04:25.090Z"
"grandy007.bsky.social","Face it. ICE HAS ALIENATED AMERICANS by slamming their victims faces into the ground, killing people, wearing masks, not identifying themselves and using “Gestapo” tactics on immigrants & citizens. Americans are resisting, as they should. It is time to defund ICE! Repost if you agree #BlueCrew","2026-01-23T12:33:29.031Z"
"grandy007.bsky.social","Arresting clergy? Really? apple.news/AEb8f6AqMQcW...","2026-01-23T22:52:36.010Z"
"grandy007.bsky.social","There’s no reforming this","2026-01-22T18:17:16.819Z"
"grandy007.bsky.social","It's significant that Stephen Miller, who gives Trump the words to express his bigotry, is all but explicitly calling back to the very worst, the most discredited, racist writings in our history. They really think this. It. Is. Evil. [Screenshot of my own post so I get the repost in there.]","2026-01-21T17:07:36.821Z"
"grandy007.bsky.social","Terrorizing families (From @thejfreakinc.bsky.social )","2026-01-21T19:20:55.354Z"
"grandy007.bsky.social","Al Gore!","2026-01-21T19:14:05.559Z"
"grandy007.bsky.social","Maybe I should get this for my car","2026-01-20T20:54:46.937Z"
"grandy007.bsky.social","Tiananmen Square?","2026-01-20T20:56:44.689Z"
"grandy007.bsky.social","😬","2026-01-19T20:16:21.202Z"
"grandy007.bsky.social","The next US government should immediately introduce strict gun control. When the 2nd amendment mob start screaming that they need their guns to protect themselves from a rogue government. They can literally tell them to sit the fuck down as the events happening now prove they’re just pussies.","2026-01-19T20:46:34.329Z"
"grandy007.bsky.social","This must be bullshit. There’s no way a Christian pastor could also be an ICE agent. abcnews.go.com/US/wireStory...","2026-01-19T23:34:32.436Z"
"grandy007.bsky.social","""""US Archbishop of the Military Services Timothy Broglio: US military personnel could disobey ‘immoral’ orders against Greenland"""" www.thetablet.co.uk/news/broglio...","2026-01-19T17:14:02.063Z"
"grandy007.bsky.social","Can you say 25th Amendment? This is beyond crazy. But we know there are no serious players in this current cabinet.","2026-01-19T15:59:41.107Z"
"grandy007.bsky.social","The king has gone mad","2026-01-19T17:33:00.187Z"
"grandy007.bsky.social","Winter day on the Oregon coast Photos taken only a few hundred feet from each other","2026-01-18T23:15:54.975Z"
"grandy007.bsky.social","Canonical statements","2026-01-18T17:58:53.180Z"
"grandy007.bsky.social","Today I was Kidnapped By ICE - Dawokefarmer","2026-01-18T03:36:56.370Z"
"grandy007.bsky.social","Betrayed by [REDACTED]? Say it ain’t so apple.news/ABYYl2juCToO...","2026-01-18T05:15:57.108Z"
"grandy007.bsky.social","Bad idea. I don’t think [REDACTED] will appreciate it. (Btw the zip code is 20500)","2026-01-17T22:53:55.696Z"
"grandy007.bsky.social","“The United States will not let men steal trophies from women…” - says guy who happily took the Nobel Peace Prize awarded to a woman","2026-01-17T08:58:47.687Z"
"grandy007.bsky.social","When Fascism came to America, no one crawled on their bellies and kissed the boot more willingly than those who once defiantly shouted """"Don't Tread On Me!""""","2026-01-17T11:01:17.047Z"
"grandy007.bsky.social","🚨🚨 Attention: ICE 🚨🚨","2026-01-17T13:23:23.396Z"
"grandy007.bsky.social","I don't think there should be secret police who can shoot people in the street for no cause and with no consequence. This makes me a radical in the 2026 United States.","2026-01-16T23:00:00.774Z"
"grandy007.bsky.social","Please SHARE if you agree!","2026-01-17T13:26:51.172Z"
"grandy007.bsky.social","Sometimes guys sell Super Bowl rings. Doesn’t make whoever buys it a Super Bowl winner.","2026-01-16T03:50:15.053Z"
"grandy007.bsky.social","I always wondered who donates trophies to thrift stores And who buys them. Here we have both","2026-01-16T20:28:42.652Z"
"grandy007.bsky.social","Donald Trump is talking about invoking the Insurrection Act over peaceful protests in Minneapolis. That's so weird because liberals told us we had to be completely peaceful to avoid this, and we were. How much extra time is Trump getting by libs playing Wait & Vote?","2026-01-15T22:47:28.364Z"
"grandy007.bsky.social","I like thrifting. Not hard to find vintage bowling/T-ball/soccer trophies, but who wants a hand-me-down award? And more importantly, who will be impressed by it?","2026-01-16T19:17:05.144Z"
"grandy007.bsky.social","Nice","2026-01-16T19:09:26.704Z"
"grandy007.bsky.social","I couldn’t have said it better.","2026-01-15T22:12:40.288Z"
"grandy007.bsky.social","Why do ICE agents carry guns? Not one single report of them being shot at!! Not one single story about apprehending anyone with a gun!! Take the weapons away from the untrained, unrestrained, incompetent agents. Do it for public safety.","2026-01-15T18:01:15.250Z"
"grandy007.bsky.social","substack.com/@thedreydoss...","2026-01-16T08:41:04.157Z"
"grandy007.bsky.social","Wha is wrong with [REDACTED]? He has absolutely zero: Credibility Self awareness Integrity Scruples #impeach #impale #improve","2026-01-16T06:07:27.063Z"
"grandy007.bsky.social","ICE—the infamous masked gang of armed Gestapo are afraid. They are afraid that people don’t like them just because they go into people’s communities committing assaults, kidnappings and murders. They are endangering themselves. They have ONE possible way to save themselves. Resign and repent. TODAY","2026-01-15T12:51:57.498Z"
"grandy007.bsky.social","That old saying, “Cold as ice”, has a whole new meaning when you capitalize ICE. #ColdAsICE","2026-01-16T00:56:13.739Z"
"grandy007.bsky.social","This will make [REDACTED] so unhappy apple.news/AnHdNxxoBQyy...","2026-01-15T16:51:56.972Z"
"grandy007.bsky.social","Fixed it. All ICE","2026-01-15T16:17:45.990Z"
"grandy007.bsky.social","So is flipping off [REDACTED] and saying “fuck you” the way we should greet everyone now? Or just him? #goodforthegoose","2026-01-15T15:52:11.319Z"
"grandy007.bsky.social","Another ICE agent slips on the ice.","2026-01-15T06:01:07.556Z"
"grandy007.bsky.social","@mvij.org It’s important to maintain hope","2026-01-15T06:01:12.107Z"
"grandy007.bsky.social","Expert Opinion #Trump #Constitution #AntiquesRoadShow #Congress","2026-01-15T02:17:13.695Z"
"grandy007.bsky.social","Many of the January 6 insurrectionists want to cry “woe is me,” but they were literally convicted of crimes — and some are even considered white supremacists. I’m confused as to why we’re still debating conspiracy theories versus facts.","2026-01-15T02:52:04.188Z"
"grandy007.bsky.social","Does @Carhartt outfitting ICE in MN? I’ve never seen law enforcement nor military sporting branded hoodies. Maybe Carhartt should look into this and pick a side.","2026-01-15T04:38:57.075Z"
"grandy007.bsky.social","This must be AI. I was around in 1989. I was a grown ass man in 89 and I don’t remember most of these ‘future stars’. Maybe their time has yet to come.","2026-01-15T03:50:04.589Z"
"grandy007.bsky.social","Seeing Zohran instantly getting a bunch of shit done in like a week makes you realize that politicians could always do that on some level if they wanted it bad enough and very few of them actually do.","2026-01-15T01:23:54.704Z"
"grandy007.bsky.social","Well said.","2026-01-15T03:20:59.750Z"
"grandy007.bsky.social","www.nbcnews.com/news/us-news... City of #Minneapolis confirmed reports of a shooting involving federal agents tonight in North Minneapolis","2026-01-15T02:52:50.279Z"
"grandy007.bsky.social","No longer a Californian, but this is awesome news for all of us ! apple.news/Am0U7fQPUTxe...","2026-01-15T02:53:53.014Z"
"grandy007.bsky.social","Probably not a good idea. Same as putting an AirTag in one of their vehicles. Don’t do that either","2026-01-15T00:22:54.606Z"
"grandy007.bsky.social","It seems like you’re attacking me. I waver between both of those","2026-01-14T05:02:43.192Z"
"grandy007.bsky.social","“It’s like half of y’all ain’t never seen Star Wars or a Disney movie. How do you not know which side to root on?”","2026-01-14T04:04:25.146Z"
"grandy007.bsky.social","True. Gestapo is too easy. We need a new name. The federal slave catchers eventually became police. Today’s police rejects and wannabes are ICE. Such a confusing time.","2026-01-14T04:41:50.469Z"
"grandy007.bsky.social","Great question. But would they back down? Or escalate? Civil war, but not states vs states? Just anarchy?","2026-01-14T04:34:33.655Z"
"grandy007.bsky.social","Donald Trump Clarence Thomas Lindsey Graham Jim Jordan Andy Biggs should resign immediately and disappear. But they won’t. Regardless, I still would like proof, but Sascha Riley seems much more credible than any of these asshats.","2026-01-14T04:20:30.292Z"
"grandy007.bsky.social","This is appalling: Top DOJ officials are actively pushing for a criminal investigation into the widow of Renee Good, leading prosecutors to quit en masse, NYT is reporting. Who in the White House ordered DOJ to do this? That's the next thing to establish.","2026-01-13T18:44:00.545Z"
"grandy007.bsky.social","Revolt in Trump's DOJ is 'metastatic and spreading quickly': expert www.rawstory.com/doj-revolt-g...","2026-01-13T20:14:26.155Z"
"grandy007.bsky.social","This should save me a lot of time! Added [REDACTED] to my text replacement settings when I type his name!","2026-01-13T19:34:13.629Z"
"grandy007.bsky.social","I kinda thought it would take a stake through [REDACTED]’s heart to end him. I was not expecting a tent stake in the [REDACTED] to bring him down. #impaled","2026-01-13T06:49:01.438Z"
"grandy007.bsky.social","Can anybody explain this? Hmmm. #USDemocracy #Voices4Victory","2026-01-13T05:31:56.102Z"
"grandy007.bsky.social","Take a minute & a half & watch this, then pass it along so others watch.","2026-01-13T04:53:49.802Z"
"grandy007.bsky.social","How many more times do we have to explain that countries don’t pay the fucking tariffs? American consumers pay the fucking tariffs!","2026-01-13T04:54:53.030Z"
"grandy007.bsky.social","Stop what you’re doing and search: Sascha Riley This needs to be vetted and reported by msm if even partially true. #Impeach #Impale #[REDACTED]","2026-01-13T04:35:09.767Z"
"grandy007.bsky.social","""""ICE just broke Minnesota law detaining an American Citizen and kneeing on his neck, which was outlawed after the George Floyd murder.""""- @krassenstein.bsky.social","2026-01-13T01:02:48.526Z"
"grandy007.bsky.social","This has to stop.","2026-01-13T04:07:25.040Z"
"grandy007.bsky.social","🔥 @redstateupdate.bsky.social (MURFREESBORO): “Where are all the anti-tyranny people now?? The government is shooting people in their cars, and the people who wanted to rise up against the government, guess what they’re doing? Applying for jobs with ICE.”","2026-01-13T02:09:39.975Z"
"grandy007.bsky.social","#Impeach #Impale [REDACTED] Whatever it takes.","2026-01-13T03:47:39.383Z"
