"user","post","date"
"mattiebernie.bsky.social","There is no legitimate reason for DNI Tulsi Gabbard to have been at the seizure of all Fulton County 2020 ballots by the FBI. But she was. Gift article: wapo.st/4a3BqYf","2026-01-29T04:13:28.463Z"
"mattiebernie.bsky.social","Seems like a good video for his trial","2026-01-29T05:26:20.665Z"
"mattiebernie.bsky.social","Alabama Republican Barry Moore held a town hall and said migrants are not allowed due process. His constituents heckled him, chanting “shame, shame” as the coward made his hasty exit. #Resist #ProudBlue #FuckMAGA","2026-01-29T02:11:30.877Z"
"mattiebernie.bsky.social","Since Donald Trump """"took down the temperature,"""" nothing has changed except Greg Bovino is out of Minneapolis. Americans aren’t going to move past what happened to Renee Good and Alex Pretti no matter how much they try to change the conversation.","2026-01-29T02:12:59.323Z"
"mattiebernie.bsky.social","Masking is not about doxing. That is the excuse. They are wearing masks so people cannot identify agents who engage in abuses, civil rights violations, and crimes. You can’t report someone or hold them accountable in any way if you can’t identify them.","2026-01-29T02:17:57.380Z"
"mattiebernie.bsky.social","ICE murdered Good and Pretti it’s time we refuse to bankroll the system that executed them. Two U.S. citizens were shot and killed by federal immigration enforcement agents in Minneapolis this month first Renee Good, and then ICU nurse Alex Pretti.","2026-01-29T02:17:43.147Z"
"mattiebernie.bsky.social","These are my people. 🙌🙏🫶👇","2026-01-29T02:18:23.687Z"
"mattiebernie.bsky.social","The entire administration is basically just about posting and doxxing","2026-01-29T02:20:47.333Z"
"mattiebernie.bsky.social","Personally I think this is too much money for Donald trumps untrained heavily armed militia","2026-01-29T02:22:24.612Z"
"mattiebernie.bsky.social","Very, very proud of these people speaking truth to power.","2026-01-29T03:36:01.077Z"
"mattiebernie.bsky.social","A Democratic governor helping a Republican state, imagine that 🙏🏽","2026-01-29T02:30:03.723Z"
"mattiebernie.bsky.social","So my connect the dots here is that there will be some allegation that there was foreign interference in the voting — Hugo Chavez, Italian satellites, etc. — (hence why DNI is involved), making it a nat sec issue that they will use to justify doing something crazy/illegal in Nov","2026-01-29T02:31:54.276Z"
"mattiebernie.bsky.social","You would think Chuck Schumer would've learned by now that appeasement does not work with a dictator. Defund, Abolish, Remove. This is the only solution for ICE. People are literally getting murdered in the street and children are getting ripped from their families. Abolish ICE or step down","2026-01-29T02:35:12.929Z"
"mattiebernie.bsky.social","MFers!!","2026-01-29T03:31:13.720Z"
"mattiebernie.bsky.social","Someone got a new gig already? Bahahaha 🤭😅🤣","2026-01-29T02:41:57.288Z"
"mattiebernie.bsky.social","No one thought the Asshat was going to allow any more free & fair elections, did they? Seriously. Anyone?","2026-01-29T03:26:20.300Z"
"mattiebernie.bsky.social","Ossoff: """"They are building the libertarian, the conservatives' worst nightmare of a Leviathan federal government that is totally unaccountable that acts outside of the Constitution, and a society in which individual rights are not protected.""""","2026-01-29T02:54:51.743Z"
"mattiebernie.bsky.social","Kristi Noem, Stephen Miller, Greg Bovino. They must all resign and be held accountable.","2026-01-29T00:38:02.627Z"
"mattiebernie.bsky.social","Kristi Noem: """"Everything I've done, I've done at the direction of the president and Stephen""""","2026-01-28T13:21:11.043Z"
"mattiebernie.bsky.social","Thank you, Mr. President.","2026-01-28T12:05:07.335Z"
"mattiebernie.bsky.social","Reporter: 1.4 billion, really closer to 1.5. I studied Donald Trump's finances, and this amount the Trump family made last year is greater than the sum total of everything he ever made in his whole life. #NoWarrantNoICE #NoMoneyForMurderers","2026-01-28T22:48:16.831Z"
"mattiebernie.bsky.social","Wow, the White House is so shaken by the turn in the public mood that they thought Chuck Schumer might actually rise up and """"seize this moment"""" to get meaningful concessions. That's how panicked they are. They thought Chuck Schumer would do something.","2026-01-28T23:09:47.967Z"
"mattiebernie.bsky.social","you can’t fucking dox a public official!","2026-01-28T23:05:47.355Z"
"mattiebernie.bsky.social","Personally I think this is too much money to give to Donald trumps poorly trained but heavily armed Militia","2026-01-28T23:12:56.693Z"
"mattiebernie.bsky.social","HUGE news! This is about a Trump admin effort to arrest thousands of screened and vetted refugees in Minnesota and fly them to Texas to be jailed and then interrogated. After the interrogation is over, people are being dumped on the street and told to find their own way back.","2026-01-28T23:16:58.679Z"
"mattiebernie.bsky.social","On camera, immigration agents are shooting and killing people in broad daylight. Behind closed doors, ICE is also killing people with chokeholds, medical neglect, inadequate food, and other inhumane conditions. The needless deaths and suffering must end.","2026-01-28T23:19:15.185Z"
"mattiebernie.bsky.social","Important. There has not been a deescalation.","2026-01-28T23:33:25.985Z"
"mattiebernie.bsky.social","I know all eyes are on Minneapolis, but there's a fast-approaching nightmare in Springfield, Ohio. Trump is revoking protected status for tens of thousands of Haitians living there on Feb. 3. Reportedly, on Feb. 4, 1000 ICE agents are arriving to remove this population. Ethnic cleansing.","2026-01-28T23:38:44.053Z"
"mattiebernie.bsky.social","ICE activity has not noticeably tapered off yet here and in fact this week they seem to be focused on terrorizing kids at bus stops and schools.","2026-01-28T23:59:09.389Z"
"mattiebernie.bsky.social","We need to talk about the rise of """"smol bean fascism"""" where you have all the guns and the immunity but the really scary people are the ones with whistles and phone cameras and they're giving you generational trauma and ptsd by filming you killing people for no reason","2026-01-28T21:25:30.381Z"
"mattiebernie.bsky.social","Warren: """"I know there are Republicans right now who are seeing what we're seeing in MN, and they know it's wrong. It's time to speak out. Silence is complicity. Grow a spine, show some backbone. Being 'disturbed' doesn't change anything and the ICE agents who are waving around loaded guns know it.""""","2026-01-28T20:26:41.726Z"
"mattiebernie.bsky.social","Anyone who saw “The Producers” knows that you can wring cash out of intentional flop. Jeff Bezos pumped money into Melania not to sell tickets but to bribe and flatter Trump.","2026-01-28T20:31:55.225Z"
"mattiebernie.bsky.social","Scrolling through the photos of Pam Bondi's """"Minnesota rioters,"""" it's just hero after hero. Every photo includes a cowardly DHS agent with their back to the camera. Bondi thinks she's going to win the propaganda war with this shit, but it's never been more clear that they're losing.","2026-01-28T20:40:53.065Z"
"mattiebernie.bsky.social","An ICE agent attempted to enter the Ecuadorian Consulate in Minneapolis, threatening the staff member who prevented him from entering. Hello? ICE is so out of control that its agents think they can break international law. Congress needs to rein them in yesterday.","2026-01-28T20:45:17.780100Z"
"mattiebernie.bsky.social","Oof. Don't play FAFO with Scandinavians!","2026-01-28T21:30:01.951Z"
"mattiebernie.bsky.social","These words demand attention. “In a real sense this is holy ground, consecrated by blood spilled here. The cost is high, and so I had to be here to stand in the very place where this tragedy unfurled… I think we’re at a defining moment for our country…” ~ Rev Warnock Take a moment, so much more…","2026-01-28T03:16:53.622Z"
"mattiebernie.bsky.social","Senator Ruben Gallego says no to DHS money as long as Stephen Miller is in office: “Stephen Miller is the brains behind the most unhinged and depraved policies we’ve seen in generations…. No funding DHS with that creep calling the shots.”","2026-01-28T03:29:36.837Z"
"mattiebernie.bsky.social","WOW","2026-01-28T03:53:33.313Z"
"mattiebernie.bsky.social","Good thing that security guard was there. Omar was about to whoop that dude’s ass. 🤣","2026-01-28T04:00:06.935Z"
"mattiebernie.bsky.social","Just over the past 72 days, two non-white Democratic members of Congress have been attacked, one of them by a Trump supporter who threatened him with deportation. Does JD Vance have anything to say? After all, the GOP VP is always so keen to attack """"left-wing"""" political violence.","2026-01-28T04:00:48.362Z"
"mattiebernie.bsky.social","Sending @repilhan.bsky.social sincere admiration tonight.","2026-01-28T04:09:07.666Z"
"mattiebernie.bsky.social","Tim Cook is a degenerate puke.","2026-01-28T08:42:07.669Z"
"mattiebernie.bsky.social","In a heartening turn of events, the ICEwatch patrol training in Pasadena was absolutely packed to the gills this week, surprising even the organizers of the event. LA continues to get organized against ICE terror","2026-01-28T05:10:52.657Z"
"mattiebernie.bsky.social","“I watched him die… then I watched them maneuver his body like a rag doll— only to discover it was because they wanted to count the bullet wounds and see how many they ‘got’, like he was a deer.”","2026-01-28T05:46:16.346Z"
"mattiebernie.bsky.social","Just a reminder that both Ilhan Omar and Maxwell Frost have been attacked this week. No outrage by right-wing media or even corporate media. Now imagine if this were done to Republicans. The entire system is rigged in favor of conservatives, folks. The double standards are just wild.","2026-01-28T06:19:50.047Z"
"mattiebernie.bsky.social","If you’ve got a parent in a nursing home, read this twice. Executives funneled $4.8M to Trump’s super PAC, met him privately, and pushed to kill a rule meant to stop neglect. Your family’s safety was sold for access.(NYT)","2026-01-27T19:30:00.151Z"
"mattiebernie.bsky.social","Something important to understand about ICE thugs in the Twin Cities is that they're harassing innocent kids and parents at bus stops and schools every single day. Even after the Pretti shooting. It's terrorism.","2026-01-27T19:30:57.204Z"
"mattiebernie.bsky.social","Breaking per NBC News — CBP has shot and critically wounded another person, this time in Arizona. Very few details available at this time.","2026-01-27T19:36:56.608Z"
"mattiebernie.bsky.social","TRUMP ADMINSTRATION: """"You can't protest by getting loud, agitated, and in our faces!"""" PROTESTORS: """"OK, we'll just protest by silently kneeling during the national anthem."""" TRUMP ADMINISTRATION: """"YOU CAN'T DO THAT EITHER!!!!!""""","2026-01-27T19:39:10.794Z"
"mattiebernie.bsky.social","Effing evil goon.","2026-01-27T20:41:13.994Z"
"mattiebernie.bsky.social","Walz: I think Kristi Noem probably should go back to South Dakota, not have any dogs, and just kind of ride things out","2026-01-27T20:20:55.420Z"
"mattiebernie.bsky.social","i was already a Wemby fan and I'm even more of one now. People need to speak out about how fucked this is.","2026-01-27T20:21:55.359Z"
"mattiebernie.bsky.social","ICE is riddled with monsters!","2026-01-27T20:33:18.811Z"
"mattiebernie.bsky.social","GOP in 1992: """"Clinton will take your guns!"""" CLINTON: """"No, I won't."""" GOP in 2008: """"Obama will take your guns!"""" OBAMA: """"No, I won't."""" GOP in 2020: """"Biden will take your guns!"""" BIDEN: """"No, I won't."""" GOP in 2024: """"Harris will take away your guns!"""" DONALD TRUMP: """"You can't have guns.""""","2026-01-27T19:59:19.323Z"
"mattiebernie.bsky.social","This is complete bullshit, and it's a criminal administration's transparent effort to cover up a crime. www.ms.now/news/no-civi...","2026-01-27T20:00:30.738Z"
"mattiebernie.bsky.social","YES. Been waiting for this.","2026-01-27T20:01:18.557Z"
"mattiebernie.bsky.social","Just days after a group of Trump-aligned billionaires officially took over TikTok in the U.S., users reported their videos criticizing ICE and the shooting of Alex Pretti were suppressed or delayed. The oligarchy is tightening its grip over even more of our media. Beware.","2026-01-27T17:41:13.108846Z"
"mattiebernie.bsky.social","Minnesota shouldn’t have to negotiate its way out of federal brutality. 🚨 New statement from Gov. Walz’s office about his meeting with Tom Homan.","2026-01-27T17:11:30.722Z"
"mattiebernie.bsky.social","Tear jerking, and a hugely important message.","2026-01-27T17:28:21.786Z"
"mattiebernie.bsky.social","Damn. The corruption and insider trading with these grifters is off the charts!","2026-01-27T17:24:42.901Z"
"mattiebernie.bsky.social","In all seriousness, how can it be that the official now in charge in Minnesota was caught by the FBI on video taking $50,000 to steer government business, and walking out with the money, which we still haven't seen. How is he still working in Administration, not to mention not behind bars?","2026-01-27T16:42:47.154Z"
"mattiebernie.bsky.social","🎯🎯🎯🎯","2026-01-27T16:43:12.757Z"
"mattiebernie.bsky.social","Stephen Miller wasn't in the meeting, but the comms team was. This tells you this isn't a policy shift, it was just a meeting to figure out how to sell the bullshit better. https://www.nytimes.com/2026/01/26/us/noem-trump-meeting-minneapolis-ice.html","2026-01-27T16:45:10.817571289Z"
"mattiebernie.bsky.social","Trump lying about the substance of a call with a foreign leader, Chapter 1,378.","2026-01-27T16:47:24.716Z"
"mattiebernie.bsky.social","Such a stand up guy and a true patriot!","2026-01-27T17:20:16.914Z"
"mattiebernie.bsky.social","Start your clocks.","2026-01-27T16:10:29.966844778Z"
"mattiebernie.bsky.social","Google has agreed to pay $68M to settle a class-action lawsuit that alleged the technology giant's voice assistant had illegally recorded users (even if they didn’t activate it with “Hey Google”) and then shared their private conversations with advertisers.","2026-01-27T06:08:43.586Z"
"mattiebernie.bsky.social","Let's be real for a minute. That fascist fuck Bovino isn't being reassigned because of anything that happened in Minneapolis. He's being moved because he's a press nightmare. Do not think for one minute acting prez Miller & the WH squatter give one fuck about what happens to Americans.","2026-01-27T06:16:28.076Z"
"mattiebernie.bsky.social","Allies still support us despite Orange Caligula's best attempts to make them run screaming from us. Thank you, Scotland. It means a lot.","2026-01-27T08:38:35.374Z"
"mattiebernie.bsky.social","The strongest qualification Kristi Noem had to build the kind of terror squad Trump wanted, was that she shot her own dog rather than take the time to train it.","2026-01-27T07:23:50.924Z"
"mattiebernie.bsky.social","Okay. Time to call your democratic senators and tell them that Bovino’s demotion and humiliation WILL NOT SUFFICE to fund DHS.","2026-01-27T02:53:47.149Z"
"mattiebernie.bsky.social","@briantylercohen.bsky.social: Is ICE salvageable? @robertgarcia.bsky.social: No. We have to abolish ICE. No question.","2026-01-27T02:55:54.515Z"
"mattiebernie.bsky.social","@briantylercohen.bsky.social: Should ICE continue to exist in any form? @rokhanna.bsky.social: No. And that should be the answer across the Democratic Party. It is a rogue agency killing American citizens. Tear it down.","2026-01-27T02:57:19.863Z"
"mattiebernie.bsky.social","Amid these dark moments, something important is beginning to shift. It's clearly the result of healthy political pressure - which we must sustain, and build.","2026-01-27T03:05:52.076Z"
"mattiebernie.bsky.social","Kristi Noem is confused about what a “domestic terrorist” really is.","2026-01-27T03:06:10.059Z"
"mattiebernie.bsky.social","“Department of Homeland Security Secretary Kristi Noem, who was responsible for carrying out the policy that led to Alex’s needless killing, and Deputy WH Chief of Staff Stephen Miller, the architect of that policy, must resign immediately. If they refuse, Trump must dismiss them,"""" AFGE NP Kelley","2026-01-27T03:14:18.437Z"
"mattiebernie.bsky.social","I won’t be happy until Nazi scumbag Stephen Miller loses his job in the Trump White House.","2026-01-27T04:19:33.317Z"
"mattiebernie.bsky.social","Trump’s pal who bought TikTok clearly will impose censorship on users. He doesn't want to upset the financial benefits that accrue to him by making sure nothing gets posted that might hurt Trump’s fee fees.","2026-01-27T05:29:10.390Z"
"mattiebernie.bsky.social","The way I see it: the Trump Administration gave full license to ICE to act with impunity. And then covered up two ICE murders conducted as a result of such impunity.","2026-01-27T04:38:40.352Z"
"mattiebernie.bsky.social","Wow! Thanks to everyone who pitched in Alex Pretti’s GoFundMe it has surpassed $1.3 million. Huge thanks to Keith Edwards for organizing.","2026-01-27T00:35:20.586Z"
"mattiebernie.bsky.social","The 50501 Movement is mobilizing for the ICE Out of Everywhere National Day of Action on January 31st. We are also organizing the No Housing for ICE boycott, the #dontserveice movement, and the Primary Pro-ICE Dems campaign.","2026-01-27T00:46:12.729Z"
"mattiebernie.bsky.social","🚨""""What the f*ck is wrong with you!"""" -our @tinadesireeberg.com after she was attacked & gassed by Border Patrol agents while covering a protest at ICE hotel in Minneapolis. Immigration agents also fired rubber bullets at protesters from point blank range. It looks like a WAR ZONE ⬇️","2026-01-27T00:51:57.934Z"
"mattiebernie.bsky.social","Rep. Claudia Tenney has brainworms shooting out of her head on Fox Business: """"We see these tragic deaths that have occurred because the Democrats are using outside groups and a lot of money going in to gin up these people and they really don't know what they're fighting about.""""","2026-01-27T00:58:26.730Z"
"mattiebernie.bsky.social","Cartoon by Adam Zyglis","2026-01-27T01:01:14.637180Z"
"mattiebernie.bsky.social","Now do Stephen Miller","2026-01-27T01:07:18.915Z"
"mattiebernie.bsky.social","if bovino is out and conservatives are turning on noem then there is a real opportunity to demand that miller resign too.","2026-01-27T01:07:52.228Z"
"mattiebernie.bsky.social","Correct. The architect is Stephen Miller. The influence and style is white supremacist and neo-Nazi. The end goal is fascism.","2026-01-27T01:11:23.414Z"
"mattiebernie.bsky.social","Welcome home, Brooks Alexander! ❤️","2026-01-27T01:13:24.742Z"
"mattiebernie.bsky.social","Don't get distracted with this Homan bullshit. They're just replacing one evil with another. Meanwhile, Hegseth just approved the use of the military base Fort Snelling to expand ICE operations in Minnesota.","2026-01-27T01:28:40.591Z"
"mattiebernie.bsky.social","Until Miller’s gone these are just gestural purges to sanitize and consolidate his reign of terror.","2026-01-27T01:40:58.771Z"
"mattiebernie.bsky.social","The Catholic Church is calling for defunding ICE. The Episcopalian bishops are all out calling for people to put their bodies in the streets. Make of that what you will.","2026-01-27T01:41:31.463Z"
"mattiebernie.bsky.social","Unmask ICE. Guarantee most of these cowards would quit overnight.","2026-01-27T01:42:47.210Z"
"mattiebernie.bsky.social","Bye, Temu Himmler. Enjoy El Centro.","2026-01-27T01:45:26.234Z"
"mattiebernie.bsky.social","Good. I'm waiting for the news that he's been fired. This goon has no place in America. Wherever he goes, chaos will follow.","2026-01-27T02:17:53.172Z"
"mattiebernie.bsky.social","If Stephen Miller is still in the White House, that means the white nationalist gameplan is still all systems GO. What we're witnessing is just window dressing and distractions. Tom Homan is just as bad as Bovino, but less openly Nazi. Keep your eyes wide open.","2026-01-27T02:01:50.234Z"
"mattiebernie.bsky.social","Let’s have more straight talk. We are way past political differences. It’s us against the fascists.","2026-01-26T05:56:56.270Z"
"mattiebernie.bsky.social","We need to crush ICE’s budget.","2026-01-26T02:53:44.958Z"
"mattiebernie.bsky.social","oh commuters just found the motherlode of ice agents at a suburban hotel, including, potentially, bovino himself. a bunch of confirmed ICE and CBP cars from the bovino convoy there. spring hill suites in maple grove. people of the twin cities, do with this info what you will.","2026-01-26T03:44:19.357Z"
"mattiebernie.bsky.social","Minnesota National Guard on why they’re giving out coffee and donuts: “It’s a demonstration of safety and security. We’re here to help.” 🥹","2026-01-26T04:23:35.470Z"
"mattiebernie.bsky.social","I sobbed. Such a moment of respect & love!","2026-01-26T05:48:57.985Z"
"mattiebernie.bsky.social","This can’t be repeated enough. Not only won’t they investigate, they may never even tell us who did this. Think about the message that sends to the next ones. Nobody is safe.","2026-01-26T05:22:07.768Z"
"mattiebernie.bsky.social","There is no way in hell the United States under the Trump regime can host the World Cup in a few months. They are murdering citizens in broad daylight, threatening war against NATO, and lawlessly kidnapping children and foreign heads of state. The world has to organize a boycott. It’s not safe.","2026-01-26T02:56:31.589Z"
"mattiebernie.bsky.social","During the Soviet era, at times of govt instability, the state broadcaster would typically preempt scheduled broadcasts by airing performances of Swan Lake","2026-01-26T02:59:44.529Z"
"mattiebernie.bsky.social","A message from Greenland 🇬🇱","2026-01-26T03:03:20.846Z"
"mattiebernie.bsky.social","Welp!","2026-01-26T04:03:01.954Z"
"mattiebernie.bsky.social","“They are using the mechanism of armed officers with masks who are killing citizens to create disruption so they can use more force to eliminate the possibility they could be removed from office and suffer criminal sanctions for the crimes they are now committing”","2026-01-26T03:20:01.639Z"
"mattiebernie.bsky.social","All of these monsters are too chickenshit to speak up about what they all saw (like millions of us know to be true.) This was a craven, unforgivable shoot. A helper was shot in front of everyone's eyes. Mr. Rogers would be pissed!","2026-01-26T04:01:32.339Z"
"mattiebernie.bsky.social","Incredible. Right wing influencers spent a whole day trying to convince everyone this was a good shoot. Meanwhile, Trump won’t say he supports it, and ICE sources are telling Fox News that it’s a bad shoot and the admin’s (Miller, Noem, Vance) messaging isn’t helping.","2026-01-26T03:20:27.640Z"
"mattiebernie.bsky.social","This is like how the Catholic Church passed known pedophiles from parish to parish","2026-01-26T00:14:34.605Z"
"mattiebernie.bsky.social","NEW: Trump tells WSJ that federal agents in Minneapolis have done “a phenomenal job” www.wsj.com/politics/pol...","2026-01-26T00:21:39.121Z"
"mattiebernie.bsky.social","What a loser you are, Doug Collins!","2026-01-26T01:57:37.718Z"
"mattiebernie.bsky.social","Imagine insisting on kids first over politics.","2026-01-26T00:45:02.183Z"
"mattiebernie.bsky.social","You know it's going to especially infuriate Stephen Miller that Alex Pretti will become the beatified saint he tried turning Charlie Kirk into.","2026-01-26T01:04:24.125Z"
"mattiebernie.bsky.social","👇👇","2026-01-26T01:16:25.181Z"
"mattiebernie.bsky.social","Wolves have a moment of silence for Alex Pretti, after seven seconds of silence several fans yell """"FUCK ICE""""","2026-01-25T22:39:49.953Z"
"mattiebernie.bsky.social","Oh, he's being a baaaaaad bunny, I see. Make them MAGA heads explode!","2026-01-25T22:45:01.736Z"
"mattiebernie.bsky.social","👇👇👇👇","2026-01-25T22:47:49.601Z"
"mattiebernie.bsky.social","We’ve seen the videos. Quit gaslighting us. We aren’t stupid like your fucking base! #sheshed #FuckICE #IBelieveMyEyes #FuckTrump #ReleaseTheEpsteinFiles #TrumpIsaPedophile","2026-01-25T22:51:44.225Z"
"mattiebernie.bsky.social","Spotted in LA! 🗣️FUCK #ICE","2026-01-25T22:58:52.087Z"
"mattiebernie.bsky.social","That's just since New Year’s Eve. If you aren't mad yet, you aren't paying attention.","2026-01-25T23:05:44.962Z"
"mattiebernie.bsky.social","We’re airing a new campaign ad, starting tomorrow. Here it is:","2026-01-25T23:08:27.436Z"
"mattiebernie.bsky.social","“The shooting of Porter, who leaves behind daughters aged 10 and 20, was not caught on camera” How convenient for ICE","2026-01-25T23:19:59.592Z"
"mattiebernie.bsky.social","Massive anti-impunity protests broke out in more than 70 cities across the US over the weekend; hundreds of thousands of people are calling for the fall of the Trump regime, the arrest of regime officials, and the abolition of ICE. Chicago, protesting in under -20°. #3E #GoodvsEvil","2026-01-25T23:27:00.251Z"
"mattiebernie.bsky.social","Their lying and refusal to accept responsibility for their actions is DNA encoded in all members of the Rump regime.","2026-01-26T00:20:49.286Z"
"mattiebernie.bsky.social","Way to go, Chicago! Tons of people showed up, even in a snowstorm. ❄️👏","2026-01-25T23:41:59.715Z"
"mattiebernie.bsky.social","Senator Rosen calling for Noem’s impeachment. More of this, please.","2026-01-25T23:53:55.175Z"
"mattiebernie.bsky.social","Unrivaled co-founder and WNBA MVP Breanna Stewart held up an “Abolish ICE” sign during player intros ahead of Mist’s game this afternoon. Photo via @unrivaledwbb.bsky.social","2026-01-25T18:12:06.205Z"
