"user","post","date"
"mattiebernie.bsky.social","Governor Pritzker calls on Trump to be removed via the 25th Amendment: “There is something genuinely wrong with this man and the 25th Amendment ought to be invoked.”","2025-10-01T20:14:28.598Z"
"mattiebernie.bsky.social","Thanks, Sen. Warren. Exactly this. 👇🏾","2025-10-01T21:12:07.002Z"
"mattiebernie.bsky.social","If you hate the Pope because he is too “liberal”, I have some very bad news for you about Jesus.","2025-10-01T17:43:34.544Z"
"mattiebernie.bsky.social","A government run by billionaires is not “for the people”. It’s for billionaires. It’s why they’re getting billions in subsidies, tax breaks and government contracts. Meanwhile, working class Americans are losing their jobs and healthcare.","2025-10-01T18:40:14.321Z"
"mattiebernie.bsky.social","There’s always an old pic that’s worth 1000 words.","2025-10-01T17:30:44.877Z"
"mattiebernie.bsky.social","Seriously. Kegstand is a 100% clown. I suspect he has SDS (Small Dick Syndrome).","2025-09-30T22:06:28.490Z"
"mattiebernie.bsky.social","The ICE goons are out of control. 🤬","2025-09-30T22:03:55.537Z"
"mattiebernie.bsky.social","@moberzan.bsky.social @kvconner.bsky.social @sandybarbour.bsky.social @mlipsitt.bsky.social @itsbek.bsky.social @markymark757.bsky.social @phoenix509.bsky.social @scottgable.bsky.social @sissydonhadit.bsky.social @joehick58.bsky.social @starmom45.bsky.social @57kev.bsky.social","2025-09-30T02:34:55.319Z"
"mattiebernie.bsky.social","When a person says, """"This can be done the easy way or the hard way"""", with extremely high probability, they are a sadist. And sadism *never* exists in isolation, it's always accompanied by sociopathy-psychopathy (ASPD).","2025-09-29T20:50:34.597Z"
"mattiebernie.bsky.social","Fuck ICE! Fuck Trump and his lawless administration. They are hiring the worst of the worst who love hurting people. This brutalization makes me sick. Everything ICE is doing makes me sick. I miss my country.","2025-09-28T17:47:55.062Z"
"mattiebernie.bsky.social","💯","2025-09-27T21:49:45.046Z"
"mattiebernie.bsky.social","Too funny","2025-09-27T22:21:25.819Z"
"mattiebernie.bsky.social","Live from """"war ravaged"""" Portland!","2025-09-27T21:55:38.679Z"
"mattiebernie.bsky.social","Agreed, Rep. Crow. What IS the GOP planning for the mid-terms? Will they be cancelled? 🤬","2025-09-27T21:49:45.745Z"
"mattiebernie.bsky.social","Wapo once again sanewashing the act of a lawless president. """"That has little modern precedent."""" How about """"Is a clear violation of the law""""? Wapo -The president authorized the use of “Full Force, if necessary,” in a campaign to use the military against Americans that has little modern precedent.","2025-09-27T20:32:17.894Z"
"mattiebernie.bsky.social","Sigh... Another day, another drama.","2025-09-25T23:36:23.310Z"
"mattiebernie.bsky.social","This is perfect @maryltrump.bsky.social","2025-09-25T22:34:21.510Z"
"mattiebernie.bsky.social","ICE agents are fucking MONSTERS!","2025-09-25T19:00:42.322Z"
"mattiebernie.bsky.social","OMG, this afternoon's ANTIFA Board of Directors meeting went on and on. I thought Jesus would *never* stop talking!","2025-09-25T03:05:15.375Z"
"mattiebernie.bsky.social","Fuck ICE! Taking her dad away, and her mom is deceased! Dirty rat bastards!","2025-09-25T09:06:49.255Z"
"mattiebernie.bsky.social","Speaking of voices under attack…can we be just as loud about Black journalists and comedians who are silenced, even by our so-called liberal outlets. • Joy Reid • Don Lemon • Melissa Harris-Perry • Tiffany Cross • Jemele Hill • Marc Lamont Hill • Karen Attiah • Amber Ruffin","2025-09-25T04:40:16.923Z"
"mattiebernie.bsky.social","Gavin's comms team hits it out of the park again!","2025-09-25T07:48:03.841Z"
"mattiebernie.bsky.social","🫶👏👏👏","2025-09-25T04:20:42.079Z"
"mattiebernie.bsky.social","Jimmy Kimmel's Monologue now has 14.3 MILLION VIEWS on YouTube. It would be a shame for you to share it www.youtube.com/watch?v=c1tj...","2025-09-24T19:37:32.166Z"
"mattiebernie.bsky.social","Donald Trump’s climate denial is an abomination and a disgrace. History is watching, and future generations are counting on us to act.","2025-09-24T19:51:50.771Z"
"mattiebernie.bsky.social","And it's a HUGE problem.","2025-09-24T21:13:52.839Z"
"mattiebernie.bsky.social","This performative clown has zero insight into what the science says. Don't listen to her.","2025-09-24T21:12:20.993Z"
"mattiebernie.bsky.social","#ReleaseTheEpsteinFiles","2025-09-24T20:50:35.932Z"
"mattiebernie.bsky.social","Oh wow another ancient untraceable rifle. What a coincidence.","2025-09-24T17:25:51.799Z"
"mattiebernie.bsky.social","This is Trump’s America.","2025-09-24T17:47:35.743Z"
"mattiebernie.bsky.social","If the ICE shootings were committed by our side, the ammo would have looked like this..","2025-09-24T17:57:06.999Z"
"mattiebernie.bsky.social","Hard to express to those not in the weeds just how much the current state of the immigration detention system is just utter chaos.","2025-09-23T17:47:57.701Z"
"mattiebernie.bsky.social","Jon would like a second opinion","2025-09-23T18:02:42.876Z"
"mattiebernie.bsky.social","Mrs. Bowers gets it right again!","2025-09-23T19:04:13.170Z"
"mattiebernie.bsky.social","Bondi, Patel, Bongino are all inept. They can’t even cover-up Epstein for you, Donald.","2025-09-22T18:03:07.171Z"
"mattiebernie.bsky.social","genuinely crazy to me how unitary executive advocates read the vesting clause as granting a huge scope of essentially royal """"inherent"""" powers. one would think that if the framers intended to give the president royal authority, they would have just said so.","2025-09-22T18:26:47.892Z"
"mattiebernie.bsky.social","So cool they discovered the cause of autism on basically day they guessed they would. I’m also glad they are withholding this information for a few days to prep for a WrestleMania-style announcement. This is how science works.","2025-09-22T18:46:51.622Z"
"mattiebernie.bsky.social","I can make the following statement because this is what multiple studies have shown: If your child has is on the autism spectrum, it is NOT because you took Acetaminophen while you were pregnant. ACETAMINOPHEN. DOES. NOT. CAUSE. AUTISM. There’s no proven causal link. There is NOT.","2025-09-22T18:53:57.917Z"
"mattiebernie.bsky.social","LOL 🤣","2025-09-22T06:36:07.594Z"
"mattiebernie.bsky.social","Jesus Christ.","2025-09-22T06:34:14.419Z"
"mattiebernie.bsky.social","Murphy continues to be a really clear voice","2025-09-21T22:07:47.526Z"
"mattiebernie.bsky.social","Amen! 🤣","2025-09-22T00:30:06.704Z"
"mattiebernie.bsky.social","Did Trump’s DOJ shut down this bribery investigation? Was it Attorney General Bondi or FBI Director Patel? The act was caught on camera. The administration must turn over the tapes to Congress. Every decision made by Homan must be scrutinized for possible corruption.","2025-09-21T19:01:42.169Z"
"mattiebernie.bsky.social","These days traditional Republican values mean wanting bribes the old fashioned way in brown bags stuffed with cash, versus offshore accounts or crypto.","2025-09-21T19:21:58.690Z"
"mattiebernie.bsky.social","Ok, this one is too good and has to be shared! @jaybird54.bsky.social Goodnight & Sweet Dreams!","2025-09-21T02:30:38.201Z"
"mattiebernie.bsky.social","It’s not a crime to be in this country as an undocumented person. It’s a civil violation. But you know what is a crime? Taking a bribe from undercover agents in exchange for the promise of government contracts WHEN YOU’RE THE FCKING BORDER CZAR.","2025-09-21T02:14:59.928Z"
"mattiebernie.bsky.social","“The FBI recorded Tom Homan, White House border czar, accepting $50,000 in cash after indicating he could help agents posing as business executives win government contracts in a 2nd Trump administration… Trump’s DOJ shut down the investigation…” www.msnbc.com/msnbc/news/t...","2025-09-20T20:12:58.967Z"
"mattiebernie.bsky.social","🔥🔥🔥","2025-09-20T20:13:15.457Z"
"mattiebernie.bsky.social","“We’re grateful to RFK Jr.—otherwise we might put something unnatural into our bodies, like vaccines.”","2025-09-20T20:52:19.967Z"
"mattiebernie.bsky.social","Border Czar Tom Homan was caught by the FBI accepting bribes - on camera - to deliver government contracts in exchange for $50,000 in cash. Pam Bondi knew. Kash Patel knew. Emil Bove knew. And they made the investigation go away. A corrupt attempt to conceal brazen graft.","2025-09-20T21:08:45.136Z"
"mattiebernie.bsky.social","imagine if newsom walked around looking like this and expected us to take him seriously","2025-09-20T05:17:05.112Z"
"mattiebernie.bsky.social","Ì so wish our country was ready for a gay person becoming president. Our side of the asile is, but magats would lose their shit.","2025-09-19T08:48:01.087Z"
"mattiebernie.bsky.social","Can’t believe the CDC. Can’t believe the DoJ. Can’t believe the BLS. Can’t believe the FBI. But I believe in us.","2025-09-19T02:13:53.848Z"
"mattiebernie.bsky.social","🚨NEW: """"The Late Show with Stephen Colbert"""" just dropped its first response to ABC, FCC chair, and Disney firing Jimmy Kimmel. Trump ain't sleeping tonight. 🤣 This is a must-watch. 🔥","2025-09-19T03:02:51.237Z"
"mattiebernie.bsky.social","Great idea!","2025-09-19T05:30:36.468Z"
"mattiebernie.bsky.social","He’s baaack","2025-09-19T03:45:31.982Z"
"mattiebernie.bsky.social","JFC. 🤬","2025-09-19T05:26:16.958Z"
"mattiebernie.bsky.social","The union representing the musicians from Jimmy Kimmel’s band releases a statement calling the FCC’s pressure on Disney “state censorship.”","2025-09-18T01:59:32.815Z"
"mattiebernie.bsky.social","Psst, Donald Duck, I'm antifa, too! Cool cartoon!","2025-09-18T04:47:47.388Z"
"mattiebernie.bsky.social","This isn’t just! It’s unconstitutional! It’s hypocritical! It’s immoral! It’s illegal! It’s wrong! It’s unprecedented! They don’t care about any of those things. They laugh at handwringing. It’s about acquiring & wielding power. You can’t shame them, you have to defeat them.","2025-09-18T02:07:31.628Z"
"mattiebernie.bsky.social","great news! you're not actually seeing karl rove, john yoo, and david frum criticize the administration's lawlessness more stridently than dem leadership. you, reader, were infected with rabies by a brown bat 36 hours ago and this is all just the virus working its way through your nervous system","2025-09-18T02:11:06.798Z"
"mattiebernie.bsky.social","Repost and 💙 if you stand with Jimmy Kimmel!","2025-09-18T02:18:21.236Z"
"mattiebernie.bsky.social","This exchange is worth a watch","2025-09-18T02:29:20.536Z"
"mattiebernie.bsky.social","📌Brian Kilmeade advocated killing people last week, but sure, fire Jimmy Kimmel.","2025-09-18T02:40:38.799Z"
"mattiebernie.bsky.social","London Mortified as Trump Flaunts His Flaps.","2025-09-18T02:41:21.023Z"
"mattiebernie.bsky.social","And Stephen Colbert And Mathew Dowd And anyone else that this fascist regime is trying to silence for using their 1st Amendment Rights.✊️✊️✊️","2025-09-18T02:44:27.124Z"
"mattiebernie.bsky.social","THIS! 👇","2025-09-18T04:19:04.309Z"
"mattiebernie.bsky.social","If you have a problem with ABC's Jimmy Kimmel *correctly observing* that the guy who fired at Charlie Kirk was raised his whole life in a far-right—and eventually MAGA—family, but have no problem with Fox News' Brian Kilmeade saying that all homeless people should """"just be killed,"""" FUUUUUUUUUCK YOU.","2025-09-18T03:06:41.772Z"
"mattiebernie.bsky.social","Jimmy Kimmel has a LOT of powerful Hollywood friends and is very well liked in the industry. Here's a test for all of them. Will they stand up for Jimmy and finally speak out against Trump and MAGA's fascist march? Or will they both sides it? Lets see.","2025-09-17T23:29:38.938Z"
"mattiebernie.bsky.social","Every major talent that works for ABC and Disney should refuse to show up for work until Jimmy Kimmel is reinstated. Marvel movies need to shutdown. Ditto the sitcoms. Collective boycott. Corporations love money more than anything,& this will harm them and force them to do the right thing.","2025-09-17T23:52:51.062Z"
"mattiebernie.bsky.social","If someone’s not mourning the death of Robert Redford in a manner that’s consistent with your views, make sure you set up a database, call their employer, and get them fired.","2025-09-16T19:22:46.972Z"
"mattiebernie.bsky.social","Big Klan Rally at State Farm Stadium next Sunday.","2025-09-15T20:27:29.592Z"
"mattiebernie.bsky.social","Hahahahahahahaha! Sure, JD.","2025-09-15T21:18:00.143Z"
"mattiebernie.bsky.social","I know firing people for quoting Kirk maybe isn’t intentionally a dry run for the rewriting of history to come, but it sure feels like it is a dry run for the rewritten history coming at us.","2025-09-14T20:33:23.614Z"
"mattiebernie.bsky.social","Let’s get this straight, once and for all: Homophobia is not an opinion. Transphobia is not an opinion. Xenophobia is not an opinion. Misogyny is not an opinion. Racism is not an opinion. It’s hatred. — Are we all clear on this?","2025-09-14T20:45:41.771Z"
"mattiebernie.bsky.social","Democratic leadership in both chambers need to go!","2025-09-14T21:21:08.437Z"
"mattiebernie.bsky.social","NBC News has an article on this, too. The reporters mentioned the """"left-wing ideology"""", and I shut down the article immediately. This is BS, meant to demonize liberals. Pretty sure it's ignorance based on his romantic partner.","2025-09-14T21:18:47.259Z"
"mattiebernie.bsky.social","Presidents? SCOTUS grants them immunity. Corporations? SCOTUS makes it easier for them to pollute. Billionaires? SCOTUS says they can buy elections. But if you look Latino, speak Spanish, or work at a low wage job, SCOTUS says you can be abducted by masked agents. Hello?","2025-09-13T21:31:07.345499Z"
"mattiebernie.bsky.social","In a sane world, Fox host Brian Kilmeade would be fired and shunned for his depraved comments that homeless people should be euthanized. That’s sick (and deeply ignorant), but sicker still is that it’s tolerated.","2025-09-13T19:09:46.318Z"
"mattiebernie.bsky.social","I bonded with my kids playing football in the snow. Bonding with a gun should be considered child abuse.","2025-09-12T18:29:34.402Z"
"mattiebernie.bsky.social","Yes, you're 100% cotrect.","2025-09-12T18:53:31.615Z"
"mattiebernie.bsky.social","Maybe the people who baselessly blamed transgender people for Kirk's murder and spread disinformation and hate should apologize. Folks like Nancy Mace, Don Trump Jr and WSJ","2025-09-12T17:36:18.071Z"
"mattiebernie.bsky.social","Kash Patel is what you get when a right-wing conspiracy podcaster gets handed the keys to the FBI. Everyone knew he would be a train wreck, but they confirmed him anyway. PS: props to the foreign press for asking the questions our own reporters won’t.","2025-09-12T17:57:48.920Z"
"mattiebernie.bsky.social","Sorry, folks. Sounds like the civil war has been postponed due to white shooter","2025-09-12T16:22:20.438Z"
"mattiebernie.bsky.social","All of the war hero treatment for Kirk devalues the treatment for actual war heroes.","2025-09-12T17:29:13.474Z"
"mattiebernie.bsky.social","How about that.","2025-09-12T16:41:58.621Z"
"mattiebernie.bsky.social","hey the people that stormed the capitol and erected gallows to murder elected leaders want you to know that political violence is not ok","2025-09-12T02:28:00.655Z"
"mattiebernie.bsky.social","We don't yet know if this was politically motivated violence or a crazy love triangle gone wrong or some crazy stalker with a bad aim. Let's not call it """"political violence"""" or """"assassination"""" until we have an actual suspect and motive or evidence of intent. It's irresponsible and inflammatory.","2025-09-11T18:03:52.828Z"
"mattiebernie.bsky.social","the media rush to canonize charlie kirk is legitimately maybe one of the weirdest things of this nature i have ever seen in my life","2025-09-11T18:09:46.703Z"
"mattiebernie.bsky.social","i just sent this email to @ezraklein.bsky.social","2025-09-11T18:41:24.813Z"
"mattiebernie.bsky.social","State Department to ban immigrants speaking ill of Charlie Kirk. VP to fly his body to Arizona on Air Force 2. Trump to award him the Presidential Medal of Freedom. Journalists getting fired for asking the right questions. We are spiraling into a dystopia beyond our imagining.","2025-09-11T19:13:27.485Z"
"mattiebernie.bsky.social","This is how you do it. www.reuters.com/world/americ...","2025-09-11T19:15:38.859Z"
"mattiebernie.bsky.social","👇👇","2025-09-11T18:35:22.201Z"
"mattiebernie.bsky.social","This! 👇🏾 I was appalled when the right-wing started using this language yesterday.","2025-09-11T19:07:43.168Z"
"mattiebernie.bsky.social","I will not be distracted. Release the Epstein files.","2025-09-11T18:11:30.399Z"
"mattiebernie.bsky.social","Same.","2025-09-10T21:02:50.557Z"
"mattiebernie.bsky.social","Oops.","2025-09-10T07:06:50.984Z"
"mattiebernie.bsky.social","@maddow.msnbc.com thank you for this succinct indictment of the destroyer of democracy. You’re absolutely right.","2025-09-10T04:22:51.782Z"
"mattiebernie.bsky.social","I want to hug and kiss this little prince of a person! (With parental approval, of course.)","2025-09-10T06:59:37.214Z"
"mattiebernie.bsky.social","This is stomach turning.","2025-09-08T21:10:12.439Z"
"mattiebernie.bsky.social","Thank God the Supreme Court gave the president's secret police the right to profile and detain anyone based on any immutable characteristic today, knowing the president himself will never reveal himself to be writing Zodiackian poems and pervert kiddie sketches to a world-historic pedophile.","2025-09-08T19:51:29.108Z"
"mattiebernie.bsky.social","OMG. Miller officially slayed. 😁","2025-09-07T20:53:55.476Z"
"mattiebernie.bsky.social","It really is very stressful to be living through an era of escalating mass deceit and mass delusion.","2025-09-07T14:49:57.365Z"
"mattiebernie.bsky.social","This fraud of a doctor will have blood on his hands. Ladapo is dangerous and infuriating.","2025-09-07T20:16:07.846Z"
"mattiebernie.bsky.social","After this past shitshow of a week, the week we hoped he was dead seems like the good old days.","2025-09-07T20:06:26.264Z"
"mattiebernie.bsky.social","People: Monica, it's too early on this Sunday morning to be posting jokes. Me:","2025-09-07T16:08:25.854Z"
"mattiebernie.bsky.social","Florida's surgeon general is ending vaccine mandates in schools, and he isn't stopping there","2025-09-07T16:10:03.426Z"
"mattiebernie.bsky.social","So much funny stuff being posted today!","2025-09-07T19:31:26.800Z"
"mattiebernie.bsky.social","LOL!","2025-09-07T19:27:08.849Z"
"mattiebernie.bsky.social","RFK Jr can't say if Trump’s Operation Warp Speed is a triumph or a government catastrophe. We say he's a MAGA traitor. https://www.youtube.com/watch?v=pEHc-0JVXQ0","2025-09-07T17:00:14.516240546Z"
"mattiebernie.bsky.social","I cannot bear to look at this little hypocrite's face! For a person who claims his life is guided by the bible, he demonstrates he's never opened up the goddamned book! Fuck him straight to hell where he belongs.","2025-09-06T23:51:36.427Z"
"mattiebernie.bsky.social","Maybe he’ll do some more pull-ups for the cameras next.","2025-09-06T21:26:54.198Z"
"mattiebernie.bsky.social","You can't catch autism You can't become autistic You can't develop into an autistic person because of environmental or medical reasons It's not a disease Vaccines save lives, they do not create autistic people","2025-09-05T05:11:10.441Z"
"mattiebernie.bsky.social","i am watching clips from the kennedy hearing and one thing that comes across is his petulance at being challenged. he is like an overgrown baby (if that baby were a hot dog you grilled too long)","2025-09-05T02:02:37.629Z"
"mattiebernie.bsky.social","US military protesting the US backing of Israel’s genocide of Gaza and the Trump regime’s fascism: “Rise up America, it is time to take back this country from these corrupt politicians.” #3E","2025-09-04T21:57:49.722Z"
"mattiebernie.bsky.social","You speak the truth, Senator Ossoff!","2025-09-05T00:13:02.547Z"
"mattiebernie.bsky.social","Still A+","2025-09-04T23:03:22.617Z"
"mattiebernie.bsky.social","I'm so sick and tired of hearing about the Petey Hegseth. He should never have gotten confirmed.","2025-09-04T23:58:41.987Z"
"mattiebernie.bsky.social","I second that proposition.","2025-09-04T21:59:42.181Z"
"mattiebernie.bsky.social","If the White House considers releasing the full Epstein files a “hostile act,” there is only one conclusion: Guilt. Guilty. He's guilty as hell!","2025-09-04T00:19:48.722Z"
"mattiebernie.bsky.social","As a Californian, this makes me very happy.","2025-09-04T04:04:21.946Z"
"mattiebernie.bsky.social","👇👇","2025-09-04T01:45:49.667Z"
"mattiebernie.bsky.social","Trump, right now, thinking: “That’s the most beautiful head ferret I’ve ever seen.”","2025-09-04T01:01:49.571Z"
"mattiebernie.bsky.social","Well this much we know He didn't spend the last week at a psychiatrist's","2025-09-02T19:37:22.524Z"
"mattiebernie.bsky.social","One thing Trump has really done a great job of is exposing Jake Tapper as a gutless pussy and a partisan.","2025-09-02T19:47:38.274Z"
"mattiebernie.bsky.social","Today’s court ruling is what we’ve been warning about for months: Trump is unlawfully using the military to terrorize Americans, including kids and hardworking immigrants — many of whom have contributed to this country and are part of American families.","2025-09-02T20:04:07.735Z"
"mattiebernie.bsky.social","Pritzker: """"When did we become a country where it's ok for the US president to insist on national television that a state should call him to beg for anything? Especially something we don't want. Have we truly lost all sense of sanity in this nation that we treat this as normal?""""","2025-09-02T20:11:19.897Z"
"mattiebernie.bsky.social","What are they pumping into Donald Trump right now to give him energy to do this press conference that was scheduled for 2 pm but still hasn't started at 2:36 pm? Any guesses? This is what corporate media and MAGA did 24-7 with Biden. Perfectly fair to ask.","2025-09-02T18:37:20.746Z"
"mattiebernie.bsky.social","A clear attempt to drown out the voices of the victims.","2025-09-02T18:42:13.210Z"
"mattiebernie.bsky.social","The tolerance for lies is killing our country. Trump just called Chicago “the most dangerous city in the world, by far.” But its homicide rate isn’t even in the U.S. Top 20. Will major media call out the lie – and call it “a lie” – or will they talk about his “tenuous relationship with the truth”?","2025-09-02T17:32:50.328Z"
"mattiebernie.bsky.social","LOL.","2025-09-02T18:32:28.601Z"
"mattiebernie.bsky.social","A federal judge ruled what we all knew: Trump illegally deployed nearly 5,000 Marines and National Guard soldiers in Southern California turning our military into his personal police force. This brazen power grab violated federal law meant to keep troops out of domestic law enforcement.","2025-09-02T15:25:33.269Z"
"mattiebernie.bsky.social","Hm-m-m-m...","2025-09-02T07:08:27.081Z"
"mattiebernie.bsky.social","If AOC's star power helps propel Mamdani to mayor in NYC, and Bernie's star power helps Graham Platner unseat Susan Collins, while small moves, they would be nice steps toward a more progressive future. It does my little socialist heart good thinking about them boosting other progressives.","2025-09-02T04:28:26.966Z"
"mattiebernie.bsky.social","Well said, Jason. He’s absolutely right, you know!🎯","2025-09-02T04:43:01.004Z"
"mattiebernie.bsky.social","Amen.","2025-09-02T00:22:49.841Z"
"mattiebernie.bsky.social","Thank you on this labor day!!","2025-09-01T22:38:04.865Z"
"mattiebernie.bsky.social","Decided to scour news sites for coverage of DJT silence. Finally found mention of it in the Irish Star. Nothing in BBC News, the Guardian, MSNBC news, NBC news, local TV news. Thank you Irish Star, even though it was buried many grafs down in another story.","2025-09-01T19:08:04.633Z"
"mattiebernie.bsky.social","These posts will never get old. Brilliant GCN comms team!","2025-09-01T19:04:38.846Z"
"mattiebernie.bsky.social","Our media is so weak! It's not doing the work they purport to do. It's doing us no favors.","2025-09-01T18:41:24.373Z"
"mattiebernie.bsky.social","Excellent display of truthful knowledge.","2025-09-01T02:34:38.066Z"
"mattiebernie.bsky.social","NBC News reported he's in """"great spirits"""". No duh. He's assuredly been given a boatload of pain meds (most likely IV Dilaudid). Great spirits ensue! 🤪","2025-08-31T20:59:23.516Z"
"mattiebernie.bsky.social","What does Netanyahu not want American Senators to see? What could he possibly be hiding? 🤔 #DemVoice1 #ProudBlue #Pinks","2025-08-31T00:44:07.092Z"
"mattiebernie.bsky.social","Hot damn!","2025-08-30T09:17:27.661Z"
"mattiebernie.bsky.social","The media needs to stop calling this an “immigration crackdown.” That’s not what Trump’s doing. He’s using the military and ICE to invade cities and occupy them. Trump is itching for a fight, and he wants it with blue-city mayors and blue-state governors. The good news: they’re not backing down.","2025-08-30T02:22:04.584Z"
"mattiebernie.bsky.social","Garcia: This is a great ruling by the court. Of course, Donald Trump is already overreacting, saying this is going to somehow be the destruction of the United States. I'm not sure if he's aware he's trying to do that all on his own.","2025-08-29T22:54:06.203Z"
"mattiebernie.bsky.social","And yet, Trump has declared that the USA is respected again now that he's back. HA! Not even close, you waste of skin. You've made our nation an embarrassment on the world stage.","2025-08-30T01:40:47.774Z"
