"user","post","date"
"mattiebernie.bsky.social","the vice president is a klansman","2025-12-21T20:22:03.792Z"
"mattiebernie.bsky.social","💯","2025-12-21T18:18:17.591Z"
"mattiebernie.bsky.social","🧑‍🌾 SPOTTED in Jackson County, Wisconsin…","2025-12-21T18:44:34.534Z"
"mattiebernie.bsky.social","What a vile, disgraceful, soulless individual Vance is. 🤬","2025-12-21T20:35:20.276Z"
"mattiebernie.bsky.social","I'm 100% for Congress using inherent contempt. I'm pretty sure the Supreme Court will require legislation, which is reason 4839505 to take back both chambers of Congress in 2026. Back in 2021, @reptedlieu.bsky.social introduced a bill. Let's do it again. lieu.house.gov/media-center...","2025-12-21T19:39:17.441Z"
"mattiebernie.bsky.social","""""Donald Trump is not just a failure as a President. He is a failure as a human being."""" – Rob Reiner","2025-12-21T01:17:01.315Z"
"mattiebernie.bsky.social","If you Agree repost‼️","2025-12-21T01:18:15.724Z"
"mattiebernie.bsky.social","Cartoon by Dave Granlund | cagle.com/granlund","2025-12-21T05:00:47.791Z"
"mattiebernie.bsky.social","And his audience laughed with delight. 😱","2025-12-21T01:38:09.310Z"
"mattiebernie.bsky.social","i really think there is legit political space for running on """"we are going to dismantle ICE""""","2025-12-21T00:41:03.312Z"
"mattiebernie.bsky.social","First Christmas with the kitten and... #caturday","2025-12-20T17:27:07.695Z"
"mattiebernie.bsky.social","NEW: After months of the government telling the court under penalty of perjury that the US Attorney alone made the decision to charge Kilmar Abrego with a crime, there is now EVIDENCE tying Todd Blanche to the decision. More to come on Substack... storage.courtlistener.com/recap/gov.us...","2025-12-20T16:19:47.086Z"
"mattiebernie.bsky.social","I've said it before, I'll say it again: If you were hanging out with Jeffrey Epstein and hurting children, I don't care WHO you are, or what party you belong to. If you hurt kids, you don't belong to ANY party except the pedo party. And you belong in prison for life. PERIOD.","2025-12-20T18:48:21.501Z"
"mattiebernie.bsky.social","If there's one thing that's clear from the Epstein files released so far, it's that they've been cherry-picked to attack Dems and liberals. This is exactly what you'd expect from an administration led by a felon rapist bent on revenge.","2025-12-20T19:12:20.084Z"
"mattiebernie.bsky.social","And may every day be another wonderful secret.","2025-12-20T19:14:43.475Z"
"mattiebernie.bsky.social","Maybe old boy should look up the definition of the word """"fact"""".","2025-12-21T00:33:58.591Z"
"mattiebernie.bsky.social","It is obscene.","2025-12-20T19:47:01.728Z"
"mattiebernie.bsky.social","100% agree with him. Way past time for universal healthcare in the US.","2025-12-21T00:24:15.001Z"
"mattiebernie.bsky.social","So grateful all my grandkids have been fully vaccinated!","2025-12-21T00:20:29.742Z"
"mattiebernie.bsky.social","You can’t “trust” a scholar who actually does all of their own thinking and writing without the hallucinating bullshit machine? What?","2025-12-20T20:28:19.493Z"
"mattiebernie.bsky.social","My favorite t-shirt has a picture of him and the words """"Meet Jack Smith"""". Can't tell you how many strangers have told me they love it!","2025-12-21T00:08:48.164Z"
"mattiebernie.bsky.social","Well that escalated quick-ish. We're so screwed. All because they don't want to release the files. The nightmare continues. #SheShed #AmericanPiracy","2025-12-20T22:02:00.815Z"
"mattiebernie.bsky.social","Oh there’s Mike Johnson. Let’s ask him about The Epstein Files.","2025-12-20T20:12:35.780Z"
"mattiebernie.bsky.social","""""At least 16 files from Epstein release disappeared from the DOJ's webpage, including a photo of Trump, with no explanation."""" EXPLANATION: The DOJ is engaging in a sloppy, ham-fisted coverup to protect rich pedophiles. That's why the files went missing.","2025-12-20T21:50:46.391Z"
"mattiebernie.bsky.social","JFC. 🤬","2025-12-20T07:20:37.708Z"
"mattiebernie.bsky.social","♥️ 😳🇺🇸","2025-12-20T03:47:23.487Z"
"mattiebernie.bsky.social","Every word of this…","2025-12-20T04:00:13.314Z"
"mattiebernie.bsky.social","I've got to run over to CA's capitol bldg & buy his comms team a coffee. They are just too much. 🤣","2025-12-20T07:15:17.135Z"
"mattiebernie.bsky.social","If you've ever taken a MoCA test & passed, you know how easy it is. Effing deranged Grampa Idiot is a complete moron. This isn't the flex he thinks it is.","2025-12-20T07:10:21.295Z"
"mattiebernie.bsky.social","Gupta: Just the way he presents himself. Whether it’s the hand—is there something happening with that hand? Is there an IV there that they’re trying to cover up? His pressurized, rambling, incoherent speech. When you take it all together, reasonable people are asking reasonable questions","2025-12-19T19:18:55.340Z"
"mattiebernie.bsky.social","Everyone.","2025-12-19T20:16:38.786Z"
"mattiebernie.bsky.social","Wasn’t aware that Christmas meant to worship an evil criminal like a North Korean dictator. This is some sick shit.","2025-12-19T04:16:57.170Z"
"mattiebernie.bsky.social","Donors from around the world raised $2.5 million to support Ahmed Al-Ahmad, the hero who neutralized one of the terrorists in the Bondi Beach terrorist attack","2025-12-19T05:44:40.547Z"
"mattiebernie.bsky.social","What he said.👇","2025-12-19T01:37:42.622Z"
"mattiebernie.bsky.social","NYT columnist David Brooks wrote an op-ed a few weeks ago titled, """"The Epstein Story? Count Me Out,” lamenting people are too focused on the Epstein scandal + saying """"the QAnon mentality has taken over."""" Today he appeared in 4 photos from the Epstein dump. Welp! www.huffpost.com/entry/david-...","2025-12-18T22:03:27.230Z"
"mattiebernie.bsky.social","CARTOON OF THE DAY (from @BillBramhall)","2025-12-18T18:05:34.880Z"
"mattiebernie.bsky.social","A) This is racist as hell, Pinocchiogles B) it was never just about illegal immigration","2025-12-18T18:28:30.794Z"
"mattiebernie.bsky.social","REPORTER: More than 20 million Americans are now bracing for their premiums to skyrocket TRUMP: They will skyrocket because it was never any good","2025-12-18T19:09:36.847Z"
"mattiebernie.bsky.social","So did Leavitt hand over her phone to a Trump lackey to write this garbage? Apparently whoever wrote it doesn't know JFK is long dead. JFC!","2025-12-18T21:19:36.821Z"
"mattiebernie.bsky.social","Chris is right. The last paragraph is a gut punch.","2025-12-18T21:01:10.332Z"
"mattiebernie.bsky.social","If only Nutlick knew how math works. Even Fox tried to explain it, but Nutlick continued to display his math ignorance.","2025-12-18T20:49:26.748Z"
"mattiebernie.bsky.social","🎯🎯🎯🎯","2025-12-18T20:24:09.394Z"
"mattiebernie.bsky.social","This could have been an email.","2025-12-18T02:18:39.479Z"
"mattiebernie.bsky.social","Re: Trump’s lie-filled speech tonight","2025-12-18T02:24:36.148Z"
"mattiebernie.bsky.social","That was some weird shit","2025-12-18T02:28:57.003Z"
"mattiebernie.bsky.social","Trump tonight: Me Me Me Me Me Me Me Me Me Me Me Me Me Me Me Me Me Me Me Me Me Me Me Me Me Me Me Me Me Me Me Me Me Me Me Me Me Me Me Me Me Me Me Me Me Me Me Me Me Me Me Me Me Me Me Me Me Me Me Me Me Me Me Me Me Me Me Me Me Me Me Me Me Me Me Me Me Me Me Me Me Me Me Me Me Me Me Me Me Me Me Me Me Me Me","2025-12-18T02:29:05.810Z"
"mattiebernie.bsky.social","Beautiful.","2025-12-18T06:30:01.400Z"
"mattiebernie.bsky.social","Well said?","2025-12-18T03:44:34.761Z"
"mattiebernie.bsky.social","my latest is on the odd confluence of unitary executive theory with a president who is mostly AWOL from the business of governance (gift link)","2025-12-17T22:15:56.872Z"
"mattiebernie.bsky.social","watch a clip from Warnock's Meet the Press interview below and then consider that what he said prompted Trump to have this batshit crazy meltdown:","2025-12-17T20:54:58.959Z"
"mattiebernie.bsky.social","I keep choking up with every article I read about Rob Reiner's goodness & kindness.","2025-12-17T21:05:22.393Z"
"mattiebernie.bsky.social","This is Ranger. He has picked you as the chosen one for this dinner party. Or as he calls it, the weakest link. 13/10 an honor (TT: sunnycorina)","2025-12-17T19:02:29.563Z"
"mattiebernie.bsky.social","Ex-Trump lawyer John Dowd defends Jack Smith: """"Smith was once my adversary in a high-profile investigation of a Republican client. In that investigation, Smith proved himself to be fair, impartial and fearlessly committed to the facts … [R]ecent attacks on Smith are motivated by partisan politics.""""","2025-12-17T19:10:27.531Z"
"mattiebernie.bsky.social","Massie: Previous presidents told us to go to war over WMDs that did not exist. Now it's the same playbook. Except we're told that drugs are the WMDs. If it were about drugs, we'd bomb Mexico or China or Colombia. This is about oil and regime change.","2025-12-17T19:24:32.499Z"
"mattiebernie.bsky.social","LOL!","2025-12-17T20:53:11.657Z"
"mattiebernie.bsky.social","This is perfect. And I won't be watching his shitshow speech tonight.","2025-12-17T20:40:47.555Z"
"mattiebernie.bsky.social","It's a problem, not a hoax.","2025-12-17T20:11:34.702Z"
"mattiebernie.bsky.social","There is no question that Donald Trump is the worst person to have ever been elected president. But I think a case can be made that he is the worst person to ever have become famous.","2025-12-17T20:14:09.379Z"
"mattiebernie.bsky.social","there is really no difference between the current administration and having the country run by david duke","2025-12-17T03:17:51.451Z"
"mattiebernie.bsky.social","No blood for oil","2025-12-17T03:41:50.587Z"
"mattiebernie.bsky.social","Trump amplifies a post calling for the arrest of former FBI Director Chris Wray and former Attorney General Merrick Garland, adding, “And many others!!!”","2025-12-17T04:13:52.357Z"
"mattiebernie.bsky.social","Donald Trump is mentally unwell. Any reporter who covers him as if this should not be considered and addressed when writing about his acting as “President” is seriously failing at their job.","2025-12-17T04:02:02.277Z"
"mattiebernie.bsky.social","Correct! We cannot get into another war and have our young people die just to satisfy the oil companies and our oligarchs.","2025-12-17T06:25:50.010Z"
"mattiebernie.bsky.social","Oof. Tell us how you really feel, National Review!","2025-12-17T06:09:50.644Z"
"mattiebernie.bsky.social","Seems like Trump and his groupies think starting a regime change war of conquest out of nowhere is a political masterstroke that will get them back on the front foot, but I don’t think that’s how it will play out.","2025-12-17T00:38:57.191Z"
"mattiebernie.bsky.social","Not for nothing but federal law contains several statutory provisions that restrict, if not outright prohibit, this unilateral action by the senile dementia patient in the Oval. War Powers Act. War Crimes Act. Anti-Piracy Act. Neutrality Act. All still on the books.","2025-12-17T00:58:33.983Z"
"mattiebernie.bsky.social","LOL!","2025-12-16T21:57:34.256Z"
"mattiebernie.bsky.social","This is NOT a Joke. Kash Patel's FBI, who has failed to gain any major new evidence as to who the Brown University shooter was 3 days ago, just released a brand new image of the alleged shooter. It's almost as if they asked ChatGPT to blur the image. Patel and Bongino should resign.","2025-12-16T19:35:03.370Z"
"mattiebernie.bsky.social","Love me some AOC!","2025-12-16T21:01:50.487Z"
"mattiebernie.bsky.social","They basically want articles about the admin to read like a transcript of Dear Leader's Cabinet meetings.","2025-12-16T19:55:16.794Z"
"mattiebernie.bsky.social","Shapiro: I think it’s insulting to the people of Pennsylvania that this guy shows up and tries to convince them to unsee what they’ve seen with their own eyes—rising prices. I guess JD was afraid to upset his boss, and this is what you get.","2025-12-16T20:34:53.722Z"
"mattiebernie.bsky.social","It's bad.","2025-12-16T14:33:10.528Z"
"mattiebernie.bsky.social","#Unite @fireeyebooks.bsky.social @gmf1369.bsky.social @docmurphydog.bsky.social @mlipsitt.bsky.social @genxer-71.bsky.social @electroboyusa.bsky.social @djlane.bsky.social @kq5.bsky.social @heyudeuphus.bsky.social @cyndiw1.bsky.social @stevie547.bsky.social @eltopo71.com @coko.bsky.social 🚫NO ADDS🚫","2025-12-16T03:20:26.236Z"
"mattiebernie.bsky.social","These people are soulless pukes.","2025-12-16T08:30:39.444Z"
"mattiebernie.bsky.social","Trump's comment about Rob Reiner, a beloved American, really demonstrates the rottenness of his character.","2025-12-15T19:42:30.349Z"
"mattiebernie.bsky.social","European leaders commit to aid Ukraine militarily against future Russian attacks, if a peace deal is reached. Nothing Trump and Russia asked for will be part of deal, including their requests to occupy Ukrainian territory. The US was reduced to an observer role, France will lead the coalition.","2025-12-15T20:10:24.747Z"
"mattiebernie.bsky.social","Convicted Felon Donald Trump's Truth Social post about Rob and Michele Reiner is disgusting filth. It reflects the depravity of this soulless ghoul and how he is incapable of decency and good judgment.","2025-12-15T21:15:01.535Z"
"mattiebernie.bsky.social","every post is like i bet you didn’t know this absolutely wonderful thing about rob reiner and each one is different","2025-12-15T04:42:37.923Z"
"mattiebernie.bsky.social","FORBES: “The Gun Murder Rate In Australia—Where 15 Were Slain At Bondi Beach—Is 6,000% Lower Than In U.S…” www.forbes.com/sites/zachar...","2025-12-15T04:47:42.695Z"
"mattiebernie.bsky.social","Good Trouble ✊","2025-12-15T02:47:12.076Z"
"mattiebernie.bsky.social","Perfect.","2025-12-15T05:13:09.980Z"
"mattiebernie.bsky.social","Australia has the right idea about guns. We're so weak here.","2025-12-15T05:10:01.900Z"
"mattiebernie.bsky.social","Rob Reiner was a true patriot, a champion of democracy who understood the risks we face and strove to ensure that future generations of Americans would live in a free country. May his memory be a blessing.","2025-12-15T04:14:19.875Z"
"mattiebernie.bsky.social","MK and I cherish the time that we got to spend with Rob and Michele Reiner — we were devastated to learn of their passing. Titans of the industry in every sense, the Reiners' legacy is secured through works of art that impacted generations. May their memories be a blessing.","2025-12-15T04:44:29.866Z"
"mattiebernie.bsky.social","What a horrifying weekend of news. Too much.","2025-12-15T03:30:46.980Z"
"mattiebernie.bsky.social","Rob Reiner directed some of the most beloved movies of all time, including Stand By Me, This is Spinal Tap, and The Princess Bride. His production company also made movies like The Shawshank Redemption, Before Sunrise and Michael Clayton. The film industry has lost one of its titans.","2025-12-15T04:12:56.480Z"
"mattiebernie.bsky.social","An incredible list. Losing Rob Reiner is a tragedy on so many levels. #RIP","2025-12-15T04:01:43.233Z"
"mattiebernie.bsky.social","The posts from Gavin's comms team are LOL funny!","2025-12-15T02:01:56.394Z"
"mattiebernie.bsky.social","Donald, STFU, you obsessive, brain-addled old fool. There are many horrible things happening right now (shootings, a bad economy, murdering fishermen, kidnappings), and all you can think about is your sore-loser lies about winning an election five years ago. You're not well.","2025-12-14T22:29:57.736Z"
"mattiebernie.bsky.social","I've watched his heroic takedown of the shooter over and over again, while thinking """"look at this good guy with no gun!""""","2025-12-15T01:41:58.765Z"
"mattiebernie.bsky.social","Dear Politicians, PLEASE do not use """"thoughts and prayers"""" when commenting on the latest gun slaughter . It has lost its meaning and is code for we are powerless to help. We are sick to death of you not finding a way to ban assault weapons and strengthen gun laws. Sincerely, Majority of Americans","2025-12-14T23:01:18.130Z"
"mattiebernie.bsky.social","Measles didn’t make a comeback on its own. This is RFK Jr’s anti-vax movement and his disinformation campaign. And equally as disturbing, some people are perfectly fine with this outcome.","2025-12-15T00:49:27.496Z"
"mattiebernie.bsky.social","As it turns out, the only way to stop a bad guy with a gun *isn’t* a good guy with a gun—it can be a good guy *without* a gun. Just another NRA lie.","2025-12-14T23:19:48.580Z"
"mattiebernie.bsky.social","The Bondi Beach shooting is way outside the norm. 2 of my granddaughters live in Oz, and I've never been concerned they'd be shot down, which is a worry I carry about my USA grandkids.","2025-12-14T23:02:54.909Z"
"mattiebernie.bsky.social","Trump has escalated his attacks on Democratic Rep. Ilhan Omar to a disturbing new level. Yesterday, federal immigration agents pulled over her son and demanded proof of his citizenship.","2025-12-14T21:43:02.601Z"
"mattiebernie.bsky.social","Truer words have not been spoken.","2025-12-14T22:57:10.638Z"
"mattiebernie.bsky.social","There has never been, and there will never be, a ceasefire between Israel and Hamas. The reason for this is that—under Netanyahu—Israel is a genocidal rogue state whose signature on any document is meaningless. American media did Trump a solid by pretending that a wholly illusory ceasefire exists.","2025-12-14T04:11:36.826Z"
"mattiebernie.bsky.social","Zoe Weissman survived the Parkland shooting. Now she’s at Brown, and it happened again. “Honestly, I'm really angry that this is happening to me all over again, and I'm just in shock.” We’re failing our kids. A gun-sick nation. 🇺🇸 www.dailymail.co.uk/news/article...","2025-12-14T03:35:38.503Z"
"mattiebernie.bsky.social","As details continue to come in on the shooting at Brown University tonight, this much is clear: two innocent people were killed, and countless others will live with this trauma for life. We cannot accept this as normal, doing nothing is not an option.","2025-12-14T04:54:02.226Z"
"mattiebernie.bsky.social","Russia destroyed 100% of Odesa’s energy infrastructure. All substations were destroyed by missiles and drones. The city has been completely left without electricity, hot water, and heating for over one million people, including all critical infrastructure.","2025-12-14T05:52:10.394Z"
"mattiebernie.bsky.social","Two victims of previous school shootings — Mia Tretta, who was shot in the stomach in 2019 at Saugus High School, and Zoe Weissman, who survived the 2018 shooting at Marjory Stoneman Douglas High School — are now at Brown. Gun violence is out of control in this country.","2025-12-14T06:38:52.724Z"
"mattiebernie.bsky.social","Just saw a Parkland survivor post about being on lock down at Brown University. We've failed generations of kids with our gun fetish","2025-12-13T23:02:43.250Z"
"mattiebernie.bsky.social","As always, we don’t yet know the identity of the shooter or the motivation for the massacre but we *do* know it involved one of the millions of guns that are drowning this country.","2025-12-13T23:19:30.722Z"
"mattiebernie.bsky.social","Another shooting. The details will shift, the outrage will fade. That’s the danger. Repetition trains acceptance. A country doesn’t collapse at once…it gets conditioned to look away.","2025-12-14T00:52:42.110Z"
"mattiebernie.bsky.social","Tyson is shutting down its Lexington, Nebraska plant in January 2026. That’s 3,200 workers gone in one shot, the largest plant shutdown in company history. Blame Trump’s tariff chaos and the lowest cattle inventories in decades. Tariffs jack up costs. Supply shrinks. Plants close. Towns hollow out.","2025-12-13T19:30:31.324Z"
"mattiebernie.bsky.social","Can’t say I’m surprised to see neo-Nazi Steve Bannon in photos with serial pedophile rapist sex trafficker Jeffrey Epstein. No wonder he’s scared of going back to prison and why he fights to keep the orange felon in power to save him. MAGA is fucking disgusting.","2025-12-13T19:34:31.310Z"
"mattiebernie.bsky.social","This has potential for some good trouble for the OU students.","2025-12-13T19:44:31.447Z"
"mattiebernie.bsky.social","“.. Trump said that whoever the next Fed chairman is should consult with HIM — the President of the United States — about where interest rates should be set.” 🤡 #FOMC","2025-12-13T19:49:11.972Z"
"mattiebernie.bsky.social","🧵Bruna Ferriera was detained by ICE in MA while legally working to obtain her green card in this country she has lived in since being a little kid. Her son is 10, & he is WH Press Secretary Leavitt's nephew and godson. “I asked Karoline to be godmother [to Michael Jr] over my only sister.""""","2025-12-13T19:58:58.520Z"
"mattiebernie.bsky.social","Scottie Nell Hughes: """"We went through 4 years of this call for raising the minimum wage. Guess what? Those trickle down costs are now starting to be felt by these type of products that consumers are buying."""" BTC: """"Costs are not rising because minimum wage workers are getting paid minimum wage.""""","2025-12-13T20:17:47.747Z"
"mattiebernie.bsky.social","All Republicans in Congress are faced with a choice. They either stand with Trump, Vance and Putin, or they stand with Ukraine, Europe, most Americans, and the civilized world. Of course, there is also a 3rd option which most of them usually choose - cowardly silence.","2025-12-13T20:40:38.680Z"
"mattiebernie.bsky.social","Try not to cry.","2025-12-13T02:39:27.079Z"
"mattiebernie.bsky.social","No heroes here. Just one awful person embarrassing another awful person on camera.","2025-12-13T03:07:38.714Z"
"mattiebernie.bsky.social","California: this weekend, be the good Pete.","2025-12-13T05:14:40.563Z"
"mattiebernie.bsky.social","A president cannot defend a nation if he is not held accountable to its laws.","2025-12-13T00:53:27.765Z"
"mattiebernie.bsky.social","You know who ISN'T IN THE JEFFREY EPSTEIN FILES? Joe Biden.","2025-12-13T01:07:39.925Z"
"mattiebernie.bsky.social","A+ trolling from Zelenskyy","2025-12-13T02:33:34.068Z"
"mattiebernie.bsky.social","They hate on our Black queens because they can’t handle their greatness.","2025-12-13T02:34:02.316Z"
"mattiebernie.bsky.social","My kids have measles, there are no toys on the shelves, and I can't afford a steak. But at least there's no sign language interpreter at White House press briefings now.","2025-12-13T03:07:46.997Z"
"mattiebernie.bsky.social","He's an enormous POS.","2025-12-13T00:34:45.021Z"
"mattiebernie.bsky.social","Javier, our new CEO, wanted to thank everyone for a fun and motivating first week. You all have made his transition process enjoyable. He has much to do but insisted on relaying that his initial numbers indicate that the dogs are all very good and will likely continue to be ❤️","2025-12-12T22:36:04.938Z"
"mattiebernie.bsky.social","Cartoon by @bagleycartoons.bsky.social.","2025-12-12T22:41:41.115Z"
"mattiebernie.bsky.social","Q: At the end of this year, those extended Obamacare subsidies expire. What's your message to those 24m Americans who will see their premiums go up? TRUMP: Don't make it sound so bad. Obviously you're a sycophant for Democrats. You're obviously a provider of bad news for Republicans.","2025-12-12T23:07:09.494Z"
"mattiebernie.bsky.social","Reporter: There were new Epstein photos today showing you, Bill Clinton, Steve Bannon… Trump: He has photos with everybody. Hundreds and hundreds of people that have photos with him, that's no big deal, I know nothing about it.","2025-12-12T23:09:21.256Z"
"mattiebernie.bsky.social","Stormy Daniels says this a lie.","2025-12-12T23:15:03.418Z"
"mattiebernie.bsky.social","Time to admit they don't have a case. This is just embarrassing for the “Justice” Department under Pam Bondi.","2025-12-12T23:30:13.802Z"
"mattiebernie.bsky.social","Well done! 😂","2025-12-13T00:26:09.519Z"
"mattiebernie.bsky.social","Posted by the Tax Foundation — the world's leading nonpartisan tax policy nonprofit organization.","2025-12-12T19:32:33.471Z"
"mattiebernie.bsky.social","Saving this so Mary Trump can be my inspiration for next Halloween.","2025-12-12T05:45:02.714Z"
"mattiebernie.bsky.social","It’ll always be insane and despicable that the orange convicted felon was given full power of the US govt instead of being sent to prison forever where he belongs and is now using that power to try throwing his perceived enemies in prison for fake crimes.","2025-12-12T04:06:30.393Z"
"mattiebernie.bsky.social","this post 👇 ended up being timely today since Karoline Leavitt was finally asked what's going on with Trump's hand hours after it went up","2025-12-12T03:37:55.155Z"
"mattiebernie.bsky.social","WATCH: Gavin Newsom posts a video of Donald Trump, Pete Hegseth, and Stephen Miller HANDCUFFED going to PRISON.","2025-12-11T10:22:45.693Z"
"mattiebernie.bsky.social","There’s no money for $2K checks for Americans or to make healthcare more affordable, but there’s money for: $900B in defense spending $40B bailout for Argentina’s dictator $12B to farmers (creditors) $1B in updates for a Qatari jet $350M trashy ballroom $172M for private jets","2025-12-11T03:08:40.536Z"
"mattiebernie.bsky.social","""""Good night, everyone. Let's remember we're all in this together. Fighting for the equality of our neighbors isn't a political choice, it's about basic human kindness. ✌️ 🫶 ✊","2025-12-11T03:43:48.725Z"
"mattiebernie.bsky.social","MINNEAPOLIS: “All I did was step outside as a Somali American citizen, and I got chased by a masked person, assaulted, kidnapped. It was inhumane. If this is what’s happening to a 🇺🇸 citizen on camera, imagine what could happen to your loved ones.”","2025-12-11T04:00:41.990Z"
