"user","post","date"
"delilahpraete.bsky.social","You want Mom to die alone, laying in a puddle of her own piss and shit? Because this is how you get that: www.axios.com/2025/06/18/t...","2025-06-19T12:01:21.719Z"
"delilahpraete.bsky.social","go.bsky.app/CTF3iT9","2025-06-19T22:12:03.579Z"
"delilahpraete.bsky.social","go.bsky.app/9Q13g2D","2025-06-20T00:39:40.814Z"
"delilahpraete.bsky.social","Andry José Hernández Romero, I remember you, even if I do not know how to articulate my horror, rage, & sorrow at your treatment by my government. No one has heard from you in 97 days. As vigil, I’m posting a photo (or video) of you every day until you are returned from El Salvador.","2025-06-20T00:38:34.531Z"
"delilahpraete.bsky.social","Shouldn’t the NY Times headline note that this new policy breaks the law?","2025-06-19T23:53:03.455Z"
"delilahpraete.bsky.social","👀 Really- THIS GUY👇🏻👇🏻❓❓","2025-06-20T02:21:11.287Z"
"delilahpraete.bsky.social","Ok. But here’s the thing: Juneteenth is not about freedom being won, it’s about freedom being ENFORCED. The heroes of Juneteenth are the Union Soldiers who went from plantation to plantation looking slaveholders in the face & saying: fuck with us if you dare. Freedom is not won, it is SEIZED","2025-06-19T20:52:16.885Z"
"delilahpraete.bsky.social","“There is a myth we tell ourselves about #Juneteenth, as if #freedom arrived suddenly, like a thunderclap, on June 19, 1865, with General Granger reading General Order No. 3 to the enslaved people in Galveston, Texas.” @wordinblacknews.bsky.social @mustafasantiagoali.bsky.social","2025-06-19T14:44:31.250Z"
"delilahpraete.bsky.social","Conserving our environment is an American value. From hikers to hunters we want to keep our public lands public! Thats why the unprecedented sell-off of millions of acres of public lands needs to be removed from the Senate Budget Bill. Nature is non partisan! 🇺🇸 Pass it on!","2025-06-19T14:52:16.153Z"
"delilahpraete.bsky.social","LA DODGERS just now: “This morning, ICE agents came to Dodger Stadium and requested permission to access the parking lots. They were denied entry to the grounds by the organization. Tonight’s game will be played as scheduled.” Right on, Dodgers! More of this, please.","2025-06-19T19:35:07.534Z"
"delilahpraete.bsky.social","On Juneteenth, we celebrate freedom and recommit ourselves to the work that remains undone. We remember that even in the darkest hours, there is cause to hope for tomorrow’s light.","2025-06-19T13:46:22.544Z"
"delilahpraete.bsky.social","Happy Juneteenth!","2025-06-19T12:27:23.916Z"
"delilahpraete.bsky.social","This session, Texas lawmakers passed another set of bills making it easier for gun owners to access and keep firearms, and expanded the kinds of weapons they can access.","2025-06-18T14:21:38.814Z"
"delilahpraete.bsky.social","ICE denied U.S. Reps. Raja Krishnamoorthi (D-IL) and Jonathan Jackson (D-IL) entry into it’s facility in Chicago.","2025-06-18T22:36:12.967Z"
"delilahpraete.bsky.social","Police in Tifton, Georgia, arrested and charged a 24-year-old woman who lost her pregnancy in a case that has alarmed reproductive-health experts and other advocates.","2025-03-27T21:25:00.446Z"
"delilahpraete.bsky.social","This","2025-04-21T00:37:12.264Z"
"delilahpraete.bsky.social","gm","2025-06-18T22:11:26.307Z"
"delilahpraete.bsky.social","""""The bill directs what is likely the largest single sale of national public lands in modern history..."""" www.wilderness.org/articles/med...","2025-06-19T04:27:12.981Z"
"delilahpraete.bsky.social","Word.","2025-06-19T07:05:39.385Z"
"delilahpraete.bsky.social","So “pro-life.”","2025-06-18T22:10:12.181Z"
"delilahpraete.bsky.social","Governor Tim Walz, """"The way our nation moves forward is not through hate. It is not through violence. It is through humility, and grace, and compassion.","2025-06-17T17:55:42.102Z"
"delilahpraete.bsky.social","New in PN: Judge rules that anti-woke is just racism “'I’ve never seen a record where racial discrimination was so palpable,' Judge Young fumed. 'I’ve sat on this bench now for 40 years. I’ve never seen government racial discrimination like this.' *More of this, please*""""","2025-06-18T12:15:47.491Z"
"delilahpraete.bsky.social","Both belong in the Hague!","2025-06-18T12:50:36.389Z"
"delilahpraete.bsky.social","Ron won't tell you truth. He blames shitbag Netanyahu for American politicians who haven't had the balls to do what we should have done to eliminate the ability of Iran to enrich uranium in underground, concrete reenforced facilities a decade ago. Only America has the proper tools to do it","2025-06-18T11:24:54.723Z"
"delilahpraete.bsky.social","The pardons he sold took money from the victims — from their pockets (and ours) right into his.","2025-06-18T12:01:52.949Z"
"delilahpraete.bsky.social","historians is it good when the robe Nobles are able to buy the positions and honors typically reserved for the sword Nobles?","2025-06-18T12:45:45.388Z"
"delilahpraete.bsky.social","Remember when Brad Lander Caught Kristi Noem Stealing $80 Million? www.emptywheel.net/2025/06/18/r...","2025-06-18T12:48:49.469Z"
"delilahpraete.bsky.social","How people vote when they're personally doing very well tells you every single thing you need to know about them, and most especially if they only change their view when the shit hits the fan.","2025-06-18T13:16:18.131Z"
"delilahpraete.bsky.social","This seems like a big deal.👇 Jeffrey Clark, a key architect of the plot to help President Donald Trump subvert the 2020 election, addressed anti-voting activists from the White House complex Saturday. www.democracydocket.com/news-alerts/...","2025-06-17T17:40:08.180Z"
"delilahpraete.bsky.social","Federal agents arrested New York City comptroller and Democratic mayoral candidate Brad Lander outside an immigration court after he attempted to accompany a person out of a courtroom Tuesday. www.democracydocket.com/news-alerts/...","2025-06-17T18:24:16.271Z"
"delilahpraete.bsky.social","schumer and jefferies get you damn thumbs out of your asses!!!😡🤬","2025-06-17T23:01:38.810Z"
"delilahpraete.bsky.social","Our AOC, exposing just how crooked and stupid the entire Cabinet is.","2025-06-16T17:43:41.059Z"
"delilahpraete.bsky.social","I did a Sheroes portrait of #MelissaHortman today. May her memory be a blessing","2025-06-16T21:38:10.560Z"
"delilahpraete.bsky.social","I’m relieved to hear these two court officers are stable after this horrific attack in New York City this morning.","2025-06-16T17:49:29.921Z"
"delilahpraete.bsky.social","I guess the fact that Dems were shot and killed in Minnesota just doesn't matter to the Dems still alive and in office. Fuck you all to hell and back.","2025-06-17T16:21:55.702Z"
"delilahpraete.bsky.social","WHERE THE HELL ARE SCHUMER AND JEFFERIES AND THE REST OF THE DEM LEADERS (EXCLUDING CROCKETT AND AOC) ON ALL THE VIOLENCE AND DESCRIMINATION AND ABUSE THE LEFT IS GETTING FROM THE AMERIKKKAN WHITE WING??? ARE THE DEM VOTERS TALKING TO THE WALL OR ARE WE DOING ALL THE WORK? OR BOTH???","2025-06-17T00:59:06.209Z"
"delilahpraete.bsky.social","💯💯💯","2025-06-17T00:40:50.990Z"
"delilahpraete.bsky.social","This is an absolute betrayal of promises made by Congress to protect the people who protected American soldiers. A betrayal by people who think American greatness is based on half-assed military parades rather than being a credible ally to those that risked their lives for America.","2025-06-17T01:47:50.830Z"
"delilahpraete.bsky.social","Hey there Scott Walker. I noticed you deleted this after learning that in fact the shooter was from the right. I don’t think it matters either way, violence is violence, so I’m waiting for you to tweet the same thing with corrected facts? Cuz you’re uh, to use your words, “being silent.”","2025-06-16T14:30:34.458Z"
"delilahpraete.bsky.social","An Afghan man who worked as a translator for the U.S. military during the war was detained by ICE after showing up for a hearing inside of a federal courthouse in San Diego, his attorney says. He fears that if he returns to Afghanistan, he would be tortured or even killed, @nbcsandiego.com reports.","2025-06-17T01:01:14Z"
"delilahpraete.bsky.social","Birds of a feather always flock together","2025-06-16T04:40:06.400Z"
"delilahpraete.bsky.social","Please read and share this statement from Sophie and Colin Hortman, children of Rep. Melissa Hortman and her husband Mark. (via WCCO reporter Caroline Cummings on X)","2025-06-17T01:16:38.811Z"
"delilahpraete.bsky.social","#booksky","2025-06-17T00:09:15.463Z"
"delilahpraete.bsky.social","A lawmaker and her husband were murdered. A senator and his wife nearly killed. The suspect had a hit list. And what did we do? We blamed each other. We justified. We spun. Political violence isn’t coming—it’s here. And we’re normalizing it. adamkinzinger.substack.com/p/political-...","2025-06-16T19:47:32.452Z"
"delilahpraete.bsky.social","Okay. The world can see this. Why it so hard for 30% of Americans to continue holding out hope a leopard will change it's spots?","2025-06-17T00:03:22.885Z"
"delilahpraete.bsky.social","They were offering people $1000 dollars to attend the parade at the last minute. That had to cost them at least 27 thousand dollars. 😀","2025-06-16T00:35:35.934Z"
"delilahpraete.bsky.social","We absolutely must not forget what this administration did to Senator Padilla, because it tells us what they are willing to do to us.","2025-06-17T01:00:41.627Z"
"delilahpraete.bsky.social","My paper, """"The Supreme Court: How Did We Get Here? And What Comes Next?"""", co-authored with Chuck Cameron, is now available in The ANNALS of the American Academy of Political and Social Science. journals.sagepub.com/doi/epub/10....","2025-06-16T14:13:09.010Z"
"delilahpraete.bsky.social","WHERE THE HELL ARE SCHUMER AND JEFFERIES AND THE REST OF THE DEM LEADERS (EXCLUDING CROCKETT AND AOC) ON ALL THE VIOLENCE AND DESCRIMINATION AND ABUSE THE LEFT IS GETTING FROM THE AMERIKKKAN WHITE WING??? ARE THE DEM VOTERS TALKING TO THE WALL OR ARE WE DOING ALL THE WORK? OR BOTH???","2025-06-17T00:59:06.209Z"
"delilahpraete.bsky.social","If Noem doesn’t know who the California senator is, what else doesn’t she know?","2025-06-15T16:02:43.822Z"
"delilahpraete.bsky.social","www.nytimes.com/2025/06/13/u... """"Asked in the film for a life lesson she could impart to viewers, Ms. Cohn replied, 'Be engaged, and don’t accept any order that your conscience could not approve.'""""","2025-06-15T13:33:06.329Z"
"delilahpraete.bsky.social","political press is doing a real disservice by basically not reporting the nuances of public opinion on deportations, and creating the appearance that most americans support the stephen miller-style gestapo tactics","2025-06-15T20:58:54.048Z"
"delilahpraete.bsky.social","What we learned yesterday. The Times They Are a-Changin'","2025-06-15T16:42:28.693Z"
"delilahpraete.bsky.social","EPIC response.","2025-06-15T16:22:33.462Z"
"delilahpraete.bsky.social","There is no such thing as an overreaction with what has now happened. This is the line in the sand. Every red hat who supports killing Americans is a traitor.","2025-06-14T15:01:32.521Z"
"delilahpraete.bsky.social","You also get a dog smile today","2025-06-14T13:49:32.666Z"
"delilahpraete.bsky.social","Yes, just imagine.","2025-06-13T12:20:29.121Z"
"delilahpraete.bsky.social","I know not with what weapons World War III will be fought, but World War IV will be fought with sticks and stones. - Albert Einstein","2025-06-13T15:57:00.811Z"
"delilahpraete.bsky.social","💥 Walmart heiress took out a full-page advertisement in The New York Times on Sunday calling on readers to “mobilize” on Saturday, June 14. NYT ad: NO KINGS JUNE 14 MOBILIZE","2025-06-12T19:19:20.687Z"
"delilahpraete.bsky.social","CARTOON OF THE DAY (From @dccartoonist.bsky.social )","2025-06-12T16:56:49.472Z"
"delilahpraete.bsky.social","BREAKING: California Sen. Alex Padilla was detained and handcuffed during an altercation at Homeland Security Secretary Kristi Noem’s press conference.","2025-06-12T18:57:23.935Z"
"delilahpraete.bsky.social","This is not hard. Every Republican member of Congress should join Democrats in condemning this administration’s vicious arrest of Sen Padilla. “A Republic if you can keep it” is now.","2025-06-12T19:19:13.682Z"
"delilahpraete.bsky.social","Megabill would cost poorest households $1,600 a year, boost richest by $12K, according to Congress’ nonpartisan scorekeeper.","2025-06-12T15:59:19.466Z"
"delilahpraete.bsky.social","🚨 Secretary Noem basically said that her agency is now dedicated to forcible regime change…in American cities and states. There 👏🏽 is 👏🏽 a 👏🏽 name 👏🏽 for 👏🏽 this","2025-06-12T18:52:42.926Z"
"delilahpraete.bsky.social","From a friend in Torrence, California","2025-06-11T21:11:23.607Z"
"delilahpraete.bsky.social","The most inspiring chapters in our nation's history came when Americans faced down some of our country's darkest demons. Those moments, like our own, were difficult to live through but also brought the chance to bring out the best in us, with enduring consequences.","2025-06-12T14:40:30.403Z"
"delilahpraete.bsky.social","www.cnn.com/2025/06/11/T...","2025-06-12T17:53:16.310Z"
"delilahpraete.bsky.social","WATCH: “Holy f*ck — They literally just shot her point blank… I live here…” @lapdhq shoot a woman trying to get to her apartment at point blank range with a rubber bullet. Alexandria’s page (the woman who helps her): www.tiktok.com/@labyrinthlo...","2025-06-11T03:08:41.465Z"
"delilahpraete.bsky.social","Michelle Weathrstone, """"Weird how he didn't call in the National Guard on Jan 6.""""","2025-06-10T01:02:38.361Z"
"delilahpraete.bsky.social","I am so proud of those who protested in CA. That’s what showing up for decency and American values looks like. Fuck ICE!","2025-06-09T12:11:44.031Z"
"delilahpraete.bsky.social","NEWSOM: The Secretary of Defense is now threatening to deploy active-duty Marines on American soil against its own citizens. This is deranged behavior.","2025-06-08T14:44:32.722Z"
"delilahpraete.bsky.social","Why’d Musk scrub his X feed?","2025-06-08T15:04:26.764Z"
"delilahpraete.bsky.social","Donald Trump’s traitorous presidency, his undeserved occupation of the Oval Office, and his very repugnant presence in the highest seat of power in America are all a massive middle finger to those who died so that we could endure. #LosAngeles #California johnpavlovitz.substack.com/p/donald-tru...","2025-06-08T15:21:00.723Z"
"delilahpraete.bsky.social","""""MASKS WILL NOT BE ALLOWED to be worn at protests."""" Except these.","2025-06-08T14:39:09.717Z"
"delilahpraete.bsky.social","THIS IS AN EMERGENCY. The Trump Administration is fully weaponizing I.C.E., the National Guard, and the FBI against innocent civilians in Los Angeles after the I.C.E. agents (all masked) began indiscriminately abducting people without warrants, cause, or due process.","2025-06-08T14:47:27.504Z"
"delilahpraete.bsky.social","Fact check: True.","2025-06-08T17:01:14.972Z"
"delilahpraete.bsky.social","go.bsky.app/7JR3si4","2025-06-08T21:31:54.243Z"
"delilahpraete.bsky.social","go.bsky.app/L1WsaDd","2025-06-08T20:21:28.519Z"
"delilahpraete.bsky.social","go.bsky.app/6cdNFKT","2025-06-08T23:27:56.468Z"
"delilahpraete.bsky.social","go.bsky.app/4K8wCpP","2025-06-08T22:31:54.912Z"
"delilahpraete.bsky.social","go.bsky.app/U8iQdha","2025-06-09T01:39:21.630Z"
"delilahpraete.bsky.social","We need to stand up for @terrymoranabc.bsky.social","2025-06-08T17:26:07.369Z"
"delilahpraete.bsky.social","Imagine that. www.npr.org/2025/06/02/n...","2025-06-07T18:33:43.599Z"
"delilahpraete.bsky.social","VETERAN: “This is why they can’t wear masks. Because people like this exist… if you want to snatch people off the streets, do it in uniform, and show your damn face.” (@MarshaBlackburn’s Secret Police bill criminalizes transparency and threatens 5 years for naming an ICE agent)","2025-06-07T17:47:43.266Z"
"delilahpraete.bsky.social","White House aide calls Los Angeles anti-ICE protests an 'insurrection' reut.rs/4jCstHW","2025-06-07T19:15:05Z"
"delilahpraete.bsky.social","Elon Musk has never been weaker. He's a very dangerous man who needs to be kicked as hard as possible now that he's down. It's time to reignite the spirit and passion behind #teslatakedown. Show up today and protest!","2025-06-07T16:41:27.637Z"
"delilahpraete.bsky.social","Thinking of a hero I knew and admired.","2025-06-07T01:40:39.513Z"
"delilahpraete.bsky.social","here's today's post: """"good fucking riddance to Elon Fucking Musk"""" — a look back at the Space Nazi's reign of error. thanks for reading, and please sign up for my daily newsletter to keep getting the good stuff —","2025-06-01T14:42:54.601Z"
"delilahpraete.bsky.social","here's today's post: """"how old is Joe Biden? Comer Fudd vows to step on ALL the rakes in an all-new effort to find out"""" — here we go again thanks for reading, and please sign up for my daily newsletter to keep getting the good stuff —","2025-06-05T15:14:19.900Z"
"delilahpraete.bsky.social","You'd think that UN concluding that member of its own permanent security council committing crimes against humanity would be bigger news.","2025-06-05T10:01:08.505Z"
"delilahpraete.bsky.social","Trade War & US Inbound Shipping: We published a data viz this morning that used a 13-week moving average to capture inbound shipping. By request here is that same data viz using a 14-day moving average. We expect the shortages on the shelves to show up during the first two weeks of July. #EconSky","2025-06-04T13:13:05.534Z"
"delilahpraete.bsky.social","Happy Philly Pride! 🏳️‍🌈🏳️‍⚧️✨ From the 600-foot pride flag we carried, to the inclusive community, and the Batala Philly drummers #batalaphilly this was one of my favorite Pride March experiences!","2025-06-04T14:34:31.480Z"
"delilahpraete.bsky.social","Her stats line up with CDC data…","2025-05-27T17:40:58.954Z"
"delilahpraete.bsky.social","Please share and repost","2025-05-31T15:41:40.279Z"
"delilahpraete.bsky.social","Thou shalt not tie up children in zip ties and then deport them, for that maketh thou a MONSTER. A MONSTER! THE PEOPLE DOING ZIPTYING CHILDREN ARE MONSTERS!","2025-05-31T19:13:31.664Z"
"delilahpraete.bsky.social","We’re watching transparency erode as law enforcement begins to resemble secret police more than public servants. This piece unpacks how we got here, and why it should alarm us all.","2025-05-31T19:01:52.370Z"
"delilahpraete.bsky.social","At a time when people are understandably focused on the daily chaos in Washington, these articles describe the rapidly accelerating impact that AI is going to have on jobs, the economy, and how we live.","2025-05-30T21:46:14.431Z"
"delilahpraete.bsky.social","Apparently states’ rights stop the moment women board a plane with autonomy in their carry-on.","2025-05-30T21:36:03.893Z"
"delilahpraete.bsky.social","#BlueCrew #antitrump #antimaga #TrumpIsUnfitForOffice #trumpLiesMatter #TACOTrump #ImpeachTrumpNOW #Canada","2025-05-29T17:21:18.588Z"
"delilahpraete.bsky.social","Here’s the thing, if they are picking up folks working in the country illegally, I’m going to need to see some white guys also being arrested for employing people working illegally in the country. Otherwise, it’s just racism.","2025-05-29T15:55:27.681Z"
"delilahpraete.bsky.social","👇👇","2025-05-29T14:06:13.567Z"
"delilahpraete.bsky.social","""""Let cash registers ring!""""","2025-05-29T15:18:48.687Z"
"delilahpraete.bsky.social","Phang: If you have to resort to deceit to get something done, that tells me what you’re doing is wrong. What’s happening is a dup-and-scoop: people are being duped into going to court, their cases get dismissed, and then they’re scooped up by ICE and deported under expedited removal.","2025-05-29T04:17:59.102Z"
"delilahpraete.bsky.social","Congresswoman Yassamin Ansari @repyassansari.bsky.social """"Everyone has a Constitutional right to due process. If you need assistance with immigration related casework reach out to my office or visit ansari.house.gov to learn about your constitutional rights when it comes to dealing with ICE.""""","2025-05-29T09:30:26.704Z"
"delilahpraete.bsky.social","Unfuckingbelievable","2025-05-29T00:23:25.520Z"
"delilahpraete.bsky.social","""""Why attack universities? Why attack journalism? Because ignorance works for power ... With that done, power can rewrite history with grotesque, false narratives. They can make criminals heroes and heroes criminals."""" trib.al/oyBvPkF","2025-05-28T17:12:41.515Z"
"delilahpraete.bsky.social","It’s An Over Used False Argument… I hope someday the public will realize that the 'billionaires will leave if we raise taxes' argument comes from the corporate media who are owned by billionaires. Seems sus.","2025-05-29T00:23:33.557Z"
"delilahpraete.bsky.social","Meltdown on Truth Social in 3, 2, 1...","2025-05-29T00:07:29.812Z"
"delilahpraete.bsky.social","Breaking news: Trump tariffs ruled illegal by federal judicial panel.","2025-05-29T00:24:13.816Z"
"delilahpraete.bsky.social","Gov. Whitmer kissed the ring and now TRASHY trump is looking to pardon those convicted in the plot to kidnap her.","2025-05-28T20:17:02.844Z"
"delilahpraete.bsky.social","Medicare for All means Medicare for ALL — not some, or a few, or most. Health care is a human right. Every other major country recognizes that. It's long past time the United States does as well.","2025-05-28T19:40:20.518Z"
"delilahpraete.bsky.social","Told you so.","2025-05-26T23:36:38.729Z"
"delilahpraete.bsky.social","We’ve got a D- student killing our democracy!!! Why won’t cholesterol snatch his ass up!!!","2025-05-23T02:16:56.442Z"
"delilahpraete.bsky.social","This is from The Atlantic. This is exactly how Democrats should message Trump‘s bill. 👇🏻","2025-05-22T13:54:29.273Z"
"delilahpraete.bsky.social","The arrest of Rep Mciver conveniently deflects from the DHS illegally violating court orders in sending immigrants to Sudan for detainment.","2025-05-21T15:12:56.723Z"
"delilahpraete.bsky.social","The goal, ultimately, is to lower the price of one thing: American labor. If people are desperate enough, they will work for less, and work more than one job. We have greatly increased productivity since 1960, and we are exhausted. The oligarchs believe they haven't extracted enough from us.","2025-05-22T13:18:39.684Z"
"delilahpraete.bsky.social","LISTEN as GOP Sen. Johnson admits the GOP tax scam will increase the deficit by $4 trillion with the Big Beautiful Bill, and that Medicaid will be cut: """"Now what are you going to cut? Medicaid, absolutely"""" #StopTheBillionaireBailout","2025-05-21T19:51:36.837Z"
"delilahpraete.bsky.social","GOP grifters…","2025-05-22T12:04:01.034Z"
"delilahpraete.bsky.social","Somewhere, something incredible is waiting to be known.","2025-05-21T18:15:51.597276+00:00"
"delilahpraete.bsky.social","No one experiencing the tragedy of a miscarriage should be arrested, much less abandoned in jail for 5 months with a $100k bond. But that’s exactly what happened to Mallori Patrice Strait in Texas. Women, particularly women of color, in this country are no longer allowed dignity even in extreme loss","2025-05-21T15:19:24.712Z"
"delilahpraete.bsky.social","When you have to say it….","2025-05-19T12:35:13.120Z"
"delilahpraete.bsky.social","This administration has no rock bottom. They are the most reprehensible, disgusting, slimy people to have ever stolen the privilege of running this country. www.npr.org/2018/07/09/6....","2025-05-19T04:31:23.978Z"
"delilahpraete.bsky.social","‼️‼️","2025-05-19T00:05:28.393Z"
"delilahpraete.bsky.social","FRAUD Runs in the Family Tramp was Convicted of 34 Felony Fraud Counts FRAUD Runs in the Family","2025-05-19T13:42:53.284Z"
"delilahpraete.bsky.social","4 new words added to the script. I want my lawyer. Every day is shut the fuck up Friday","2025-05-17T01:12:21.849Z"
"delilahpraete.bsky.social","Philly! Election day is on May 20th—make sure you get out and vote!","2025-05-17T23:03:14.730Z"
"delilahpraete.bsky.social","“Politics is about improving peoples lives….Get off the pot, grow a damn spine & start punching.” - Ken Martin DNC chair in Detroit today speaking at the Michigan Democratic Women’s Caucus Luncheon. This is the energy we need—no more tiptoeing around injustice.","2025-05-17T17:52:00.133Z"
"delilahpraete.bsky.social","Those on the high court often exercise caution in their choice of words. That is why it was striking when she used an audience of lawyers to deliver a stern message to the legal profession: stand up for democracy, take on the hard fights and do whatever you can to win.","2025-05-17T13:32:48.900Z"
"delilahpraete.bsky.social","Trump & Elon Musk cut the National Weather Service office responsible for monitoring weather hazards across eastern Kentucky by 31%, making it unable to cover an overnight shift. Then a violent tornado swept across Kentucky & Missouri Fri night killing 21 people. Trump is responsible!","2025-05-17T20:39:36.821Z"
"delilahpraete.bsky.social","youtu.be/jLNya8fevqI?...","2025-05-17T20:17:06.089Z"
"delilahpraete.bsky.social","Russell Vought, former Trump staffer and Project 2025 author, says the quiet part out loud. They want a """"Shadow Government"""" so Trump will be able to perform illegal (and violent) actions as President - like shooting protesters. If you thought Musk was dangerous, hold onto your panties.","2025-05-17T20:12:44.267Z"
"delilahpraete.bsky.social","Gee, what could this possibly mean?https://www.cbsnews.com/news/gop-congressman-don-bacon-hegseth-ordered-pause-cyber-operations-against-russia/","2025-05-17T17:32:20.839Z"
