"user","post","date"
"delilahpraete.bsky.social","It only took two months.","2025-03-20T19:11:37.776Z"
"delilahpraete.bsky.social","Remember: Almost all of us are the descendants of immigrants who fled persecution, or were brought to America under duress, or sought better lives for themselves and their descendants. Politicians who stoke fear and hatred over immigration want you to forget this. Do not.","2025-03-20T18:45:06.973088Z"
"delilahpraete.bsky.social","UK Subs detained","2025-03-20T10:10:35.231Z"
"delilahpraete.bsky.social","Roses are red Violets are blue","2025-03-20T17:43:51.539Z"
"delilahpraete.bsky.social","Canadian MP Charlie Angus: I am here today to urge Canadians to avoid travel to the United States if at all possible and to call on our government to stand up for our citizens who are being denied their rights through arbitrary detention in the United States.","2025-03-20T18:37:07.475Z"
"delilahpraete.bsky.social","😡🤬","2025-03-20T19:36:29.561Z"
"delilahpraete.bsky.social","LOL.","2025-03-20T18:02:30.658Z"
"delilahpraete.bsky.social","This is the story that Karoline Leavitt said probably wasn’t accurate when it was first reported by Reuters because she said they aren’t reliable.","2025-03-20T15:19:12.725Z"
"delilahpraete.bsky.social","Fixed this for Stephen Miller","2025-03-20T14:32:04.025Z"
"delilahpraete.bsky.social","Cutting Medicaid, Medicare, and Social Security will result in people dying. Cutting medical research and funding will result in people dying. Cutting foreign aid, FEMA and NOAA will result in people dying. A few cars on fire is considered violence, but somehow the rest isn’t.","2025-03-19T19:34:15.485Z"
"delilahpraete.bsky.social","I want you to understand this is happening in our name and we know most of these men committed no crimes. One is a professional soccer player who was tortured in Venezuela and was working through asylum in the U.S. ICE shipped him for his Real Madrid tattoo and a picture throwing rock & roll horns.","2025-03-20T14:16:37.892Z"
"delilahpraete.bsky.social","John Roberts’s Rebuke of Trump Isn’t What It Seems newrepublic.com/article/1929... via @newrepublic.com","2025-03-20T15:19:08.688Z"
"delilahpraete.bsky.social","Sorry but this whole thing is a farce! This woman plainly does not run the organization, THE GUY WHO CAME UP WITH THE NAME AND WHO THE PRESIDENT SAYS RUNS IT RUNS IT","2025-03-20T03:06:58.634Z"
"delilahpraete.bsky.social","It looks like Tesla needs DOGE's services to find fraud and waste Tesla (TSLA) accounting raises red flags as report shows $1.4 billion missing electrek.co/2025/03/19/t...","2025-03-19T21:55:15.321Z"
"delilahpraete.bsky.social","Remember this all the time!","2025-03-19T21:18:06.899Z"
"delilahpraete.bsky.social","This is a serious story and I posted about it earlier but I’m worried the wig is going to distract people.","2025-03-20T00:54:40.919Z"
"delilahpraete.bsky.social","Boycotts work… people have the power to align their values with their dollars… don’t ever think you can’t make a difference Boycott Tesla","2025-03-20T00:20:42.135Z"
"delilahpraete.bsky.social","The prison guards in El Salvador must have a reason for hiding their identities: They are up to no good. And the United States is complicit in their abuse.","2025-03-20T00:26:56.343Z"
"delilahpraete.bsky.social","💔😭","2025-03-20T01:00:19.541Z"
"delilahpraete.bsky.social","I'm going to post this video every day so we never forget what Trump did.","2025-03-19T11:49:16.961Z"
"delilahpraete.bsky.social","The new issue of the UK’s Private Eye.","2025-03-19T18:03:30.057Z"
"delilahpraete.bsky.social","🤷‍♀️","2025-03-19T18:53:20.173Z"
"delilahpraete.bsky.social","Explore this gift article from The New York Times. You can read it for free without a subscription. www.nytimes.com/2025/03/19/u...","2025-03-19T19:28:30.835Z"
"delilahpraete.bsky.social","Dear Media- RIGHT NOW. investigate who these men are! Be relentless questioning trump & ICE DAILY. Don't let this story die!! We aren't North Korea! They're breaking the law! Hold Trump to account! It's time this administration learned whatLAW means. #Investigate #Journalism #Trump #Deportations","2025-03-19T16:22:37.034Z"
"delilahpraete.bsky.social","👇☮️💙🌊🐕‍🦺","2025-03-19T16:18:31.890Z"
"delilahpraete.bsky.social","Slight revisions.","2025-03-19T13:24:28.818Z"
"delilahpraete.bsky.social","ATTN Wisonsonites!!!","2025-03-19T15:36:53.264Z"
"delilahpraete.bsky.social","Is that a joke?","2025-03-19T11:27:53.977Z"
"delilahpraete.bsky.social","Worth reposting.","2025-03-19T15:34:32.495Z"
"delilahpraete.bsky.social","The #WITAOD mystery deepens. @annabower.bsky.social whomst?","2025-03-18T22:22:24.046Z"
"delilahpraete.bsky.social","These are not extreme tatoos to the peeps in power. These are declarations of loyalty to the grand orange wizard and his S. African NaziKKKer friend.","2025-03-19T15:32:26.391Z"
"delilahpraete.bsky.social","Some one blocked me becasue I said straight up that we have slavers in the house. Prove me TF wrong. Additionally, private prison companies must be chewing their guts out because people were disappeared to Venezuela when they could have exploited them here.","2025-03-19T15:30:38.263Z"
"delilahpraete.bsky.social","Bernie, """"Break it and then privatize it.""""","2025-03-19T15:27:47.647Z"
"delilahpraete.bsky.social","A story in three parts.","2025-03-19T14:07:01.137Z"
"delilahpraete.bsky.social","And MAGA will say this is fake news.","2025-03-19T15:25:24.135Z"
"delilahpraete.bsky.social","OMFG. He is lower than excrement.","2025-03-19T15:23:12.799Z"
"delilahpraete.bsky.social","Very day. 🤮🪖🇵🇷","2025-03-19T15:11:51.922Z"
"delilahpraete.bsky.social","Yes, and when it's backed up by people in power it's still devastating. People who are cruel don't care if they are seen as cruel.","2025-03-19T15:17:15.871Z"
"delilahpraete.bsky.social","Nothing is gonna happen with this. Those poor people who have been kidnapped will not be have a record of their names. That's what the orange admin does. It's just loses people and gets away with the trauma and devastation of its crimes agains humanity.","2025-03-19T15:16:14.303Z"
"delilahpraete.bsky.social","youtube.com/watch?v=QrN2... The judge is incredulous/demands sworn affidavit of time-line of defiance of court order","2025-03-19T15:11:58.067Z"
"delilahpraete.bsky.social","Yes, good but pls understand, they have dismantled, disorganised and disturbed these agencies and people are already suffering. And I won't hold my breath until DOGE GTFOH.","2025-03-19T15:14:30.303Z"
"delilahpraete.bsky.social","1. Ban books. 2. Ban words. 3. Ban people Straight up fascism!!!! Explore this gift article from The New York Times. You can read it for free without a subscription. www.nytimes.com/interactive/...","2025-03-19T15:12:57.055Z"
"delilahpraete.bsky.social","👉🏽DEI-friendly Businesses As of 3/18/25 • Nordstrom • Apple • Old Navy • Ben & Jerry's • Patagonia • Costco • REI • Chili's • Cinnabon • Sally Beauty • Hilton • Sprouts • Delta Air • Honda • JCPenny • Dollar Tree • Trader Joe's • Dr. Bronner's • Macy's • Ulta • United Air • e.I.f • Michael's","2025-03-18T14:00:39.440Z"
"delilahpraete.bsky.social","🚨TRUMP PUBLICLY CALLS FOR THE IMPEACHMENT OF JUDGE BOASBERG! Judge Boasberg halted the administration from using an 18th-century law to deport migrants. This Is A Constitutional Crisis. 03/18/2025 11:36 AM CST","2025-03-18T16:55:33.859Z"
"delilahpraete.bsky.social","WIRED: “It’s a heist — real federal auditors are horrified by DOGE… DOGE has posted some of its ‘findings’ on its website, many of which have been revealed to be errors.” www.wired.com/story/federa...","2025-03-18T21:28:15.171Z"
"delilahpraete.bsky.social","Bravo. These kids are showing more spine and character than a lot of the people they work for.","2025-03-18T21:23:39.270Z"
"delilahpraete.bsky.social","#DarkAges","2025-03-19T10:05:22.025Z"
"delilahpraete.bsky.social","Apparently Roberts can't read the room either. Maybe he and Schumer should start a support group.","2025-03-19T13:58:52.404Z"
"delilahpraete.bsky.social","“The regs slated for repeal, affecting…sources of pollution, had been set to deliver at least $254bn in economic benefits annually via lowered healthcare costs and fewer sick days [etc]. By contrast, the cost of complying with the regulations is around $40bn a year.” apple.news/AwtejKUztQSm...","2025-03-19T12:14:03.265Z"
"delilahpraete.bsky.social","substack.com/@newyorklove...","2025-03-19T13:40:32.443Z"
"delilahpraete.bsky.social","Can't be to much longer till they file bankruptcy. What a glorious day that will be!!! Good job people. Keep it up.","2025-03-19T11:35:55.745Z"
"delilahpraete.bsky.social","Kill Tesla, Save The Country open.substack.com/pub/therickw...","2025-03-19T11:08:39.099Z"
"delilahpraete.bsky.social","And should you find yourself dealing with black lung disease , RFK jr recommends drinking cod liver oil.","2025-03-18T21:32:49.810Z"
"delilahpraete.bsky.social","If they cared enough to read the constitution or/and consult legals they would have known this! But they didn't care. They just felt entitled to go in and break everything, and wreak havoc. They didn't and don't care about all the pain they inflict or damage they do. They are just feces throwers.","2025-03-18T20:55:13.401Z"
"delilahpraete.bsky.social","When Donald Trump lawlessly went after ordinary Americans, Chief Justice John Roberts didn't care. But now that Trump is taking aim at Roberts' fellow judges, Roberts suddenly cares. It's always the same with conservatives, they don't care until something affects them.","2025-03-18T18:59:26.033Z"
"delilahpraete.bsky.social","I am honored to have been welcomed to a local clinic for Medicaid Day of Action. Medicaid is vital for millions of families, children, seniors, & underserved communities. We should prioritize preventative care and get vaccinated for a healthier future. #MedicaidDayofAction","2025-03-18T20:23:16.439Z"
"delilahpraete.bsky.social","Because Krasnov.","2025-03-18T20:19:05.727Z"
"delilahpraete.bsky.social","LOL, seriously? Of course not.","2025-03-18T20:14:01.760Z"
"delilahpraete.bsky.social","ALSO, if you have a library card, you can read paywall articles for free with the Libby app.","2025-03-18T18:29:26.154Z"
"delilahpraete.bsky.social","Psychopaths on the rampage.","2025-03-18T20:07:30.904Z"
"delilahpraete.bsky.social","Undue Process www.muellershewrote.com/p/undue-proc...","2025-03-18T16:15:15.141Z"
"delilahpraete.bsky.social","❗️Lithuania, Poland, Latvia and Estonia have announced their withdrawal from the Ottawa Convention on Anti-Personnel Mines.","2025-03-18T10:19:10.682Z"
"delilahpraete.bsky.social","Anonymous will be exposing the fraud they found regarding the election with Trump and Elon‘s involvement","2025-03-18T15:58:45.763Z"
"delilahpraete.bsky.social","We have overcome near-death experiences before. We shall overcome this one too. Not by denying we are in a constitutional crisis. We are. But we can and will prevail if we face the truth unflinchingly and never abandon the long twilight struggle against evil. open.substack.com/pub/roberthu...","2025-03-18T14:00:28.156Z"
"delilahpraete.bsky.social","Over 100,000 seats are up for grabs in 2025 — governors, mayors, city councils, state representatives, judges, school boards, and more. Taking back our power starts now.","2025-03-18T14:02:06.112017Z"
"delilahpraete.bsky.social","Some facts:","2025-03-17T14:36:21.071Z"
"delilahpraete.bsky.social","When you want some facts!","2025-03-18T00:59:58.220Z"
"delilahpraete.bsky.social","Yeah these supposedly Christians are really just a bunch of scum bags pretending to be religious!","2025-03-18T01:16:53.613Z"
"delilahpraete.bsky.social","For educational purposes!","2025-03-18T01:30:34.582Z"
"delilahpraete.bsky.social","Our country under Trump is becoming a dictatorship folks","2025-03-17T20:55:45.224Z"
"delilahpraete.bsky.social","FACT!!!","2025-03-17T21:02:48.593Z"
"delilahpraete.bsky.social","Rather than bunker down, Sanders is in the arena, communicating that he is a fighter, that he’s not cowed, and that he’s willing to take on Trump and his kleptocratic regime.","2025-03-17T00:51:00.907Z"
"delilahpraete.bsky.social","And the SCOTUS will do nothing about this.","2025-03-17T13:02:11.981Z"
"delilahpraete.bsky.social","“The US spent 8 decades building an international system of rules, norms and values that has produced the longest period of great power peace and global prosperity in human history.” Fareed Zakaria on how upending the world order will only weaken America: www.washingtonpost.com/opinions/202...","2025-03-17T11:53:19.237Z"
"delilahpraete.bsky.social","You're right about our democracy. It's done. Over. Finished. But this wasn't written by #47. This is Stephen Miller's wet dream coming to llife.","2025-03-17T13:01:06.181Z"
"delilahpraete.bsky.social","Ways to show up for our libraries: -Get a library card -Regularly visit your library -Use library services -Donate books -Attend library events -Become a library “friend” -Purchase their merch or from their book sales -Volunteer","2025-03-15T21:14:26.435Z"
"delilahpraete.bsky.social","Valid visa and now gone. BTW, she was here to SAVE LIVES. Doctor and Professor Is Deported to Lebanon Despite a Judge’s Order www.nytimes.com/2025/03/16/u...","2025-03-16T20:29:29.498Z"
"delilahpraete.bsky.social","And the intellectual delete, even the ones with Ivy League credentials love him.","2025-03-16T22:29:12.732Z"
"delilahpraete.bsky.social","“They were each other’s closest friend for a very long time.”","2025-03-16T21:46:44.513Z"
"delilahpraete.bsky.social","How is this prediction going so far?","2025-03-16T21:01:06.564Z"
"delilahpraete.bsky.social","As @amoneyresists.bsky.social pointed out, Elon Musk is a mass murderer.","2025-03-16T14:41:39.417Z"
"delilahpraete.bsky.social","www.change.org/p/boycott-co...","2025-03-16T19:18:03.176Z"
"delilahpraete.bsky.social","NYT: “The White House did not comment on why the group had altered the contracts data or why it’s now harder for the public to scrutinize it.” The *savings* have been changed and altered — and are nowhere near what @MarshaBlackburn claims they are. www.nytimes.com/2025/03/13/u...","2025-03-15T12:10:11.453Z"
"delilahpraete.bsky.social","🎯","2025-03-16T15:15:30.958Z"
"delilahpraete.bsky.social","If you attack the Capitol to overturn election results and to overthrow democracy on behalf of a criminal, you’re a hero. If you attack a Tesla dealership, we’ll throw away the key.","2025-03-15T23:20:04.414Z"
"delilahpraete.bsky.social","I talk to people at the local level on social media everyday and NO!!!! They are NOT waking up now!!!!!! Especially the MAGA crowd.","2025-03-16T16:28:48.606Z"
"delilahpraete.bsky.social","Murphy: """"The president is continuing to act unconstitutionally. He shut down some of our most important programs that protect us abroad, like Radio Free Europe, that were funded & authorized in that spending bill. So it doesn't seem like we have restrained any of the president's lawlessness.""""","2025-03-16T14:32:55.482Z"
"delilahpraete.bsky.social","90% of people diagnosed with pancreatic cancer die from the disease. That's why the medical community is excited about the results of a small trial in which nearly half of the pancreatic cancer patients who received an mRNA vaccine for the disease remained relapse-free three years later.","2025-03-16T14:09:02.706Z"
"delilahpraete.bsky.social","Mary Prince escaped in 1828, sharing her story and those of enslaved women. In 1831, The History of Mary Prince became the first account of a Black enslaved woman’s life published in the UK, inspiring the anti-slavery movement. 158 days to Slavery Remembrance Day. #CountDowntoSRD","2025-03-16T01:47:05.266Z"
"delilahpraete.bsky.social","How to replace Chuck Schumer as leader.","2025-03-15T02:14:53.910Z"
"delilahpraete.bsky.social","If you want to know how much Leon hates his kids, look at the manny he left the little tyke with.","2025-03-15T17:42:14.380Z"
"delilahpraete.bsky.social","Worhsipping at the alter of the oligarchy. I'd love to know what Ptuie has on Leon. What does he have on the entier GOP?","2025-03-15T17:40:28.007Z"
"delilahpraete.bsky.social","Hundreds of people gathered at Patriots Park right now in Tarrytown for a Stop the Cuts Rally — holding Rep. Mike Lawler (R-NY) accountable for his vote to decimate Medicaid.","2025-03-15T17:20:46.658Z"
"delilahpraete.bsky.social","Straight up FASCISM. www.livemint.com/news/us-news...","2025-03-15T17:35:54.220Z"
"delilahpraete.bsky.social","This isn’t a left vs others thing. It’s about fighting vs rolling over. The middle is just as outraged as the edges","2025-03-15T14:35:05.450Z"
"delilahpraete.bsky.social","Remember when they tell you that you are over-reacting, it's because they are idiots or are on board with this shit.","2025-03-15T17:29:05.796Z"
"delilahpraete.bsky.social","Yes, they are coming for LGBTQIA too. I'm waiting for them to come for me because I am a #loudmouthedobnoxiousciswhtiewoman and the daughter of 2 holocaust survivors. I know where this is all going.","2025-03-15T17:25:08.388Z"
"delilahpraete.bsky.social","Yes, please.","2025-03-15T17:15:50.612Z"
"delilahpraete.bsky.social","Swiped this pic from my friend, Jackie @sentenne.bsky.social, because it slammed my heart so hard, and I can’t stop thinking about it. No one should be without shelter. We must hold tightly to our humanity and expand our own capacity. It’s up to the 99% of us to #EndClassWar #SheShed","2025-03-15T15:47:47.783Z"
"delilahpraete.bsky.social","DON'T KNOW WHY I'M GETTING BLOCKED FOR BEING """"UNVERIFIED"""", UNLESS OF COURSE IT'S THE NAZIKKK MEMBERS OF THIS OUTLET. Guess some people can't tolerate the truth about what's going on even here on BlueSky or real bot accounts are unhappy that I block them. You know, AI and all that.","2025-03-15T17:09:58.107Z"
"delilahpraete.bsky.social","It went further back then Bush.","2025-03-15T02:02:43.848Z"
"delilahpraete.bsky.social","News: Journalists at Voice of America were just informed that they’ve been put on administrative leave. Two people there told me this went to all fulltime employees. “From what we can tell, VOA is effectively shut down from this moment.”","2025-03-15T14:33:18.848Z"
"delilahpraete.bsky.social","If you have not at least called the first number to voice concern for his support of Project 2025, you are not resisting the rise of fascism at all points of access.","2025-03-15T15:20:33.694Z"
"delilahpraete.bsky.social","@brontyman.bsky.social","2025-03-14T23:38:42.700Z"
"delilahpraete.bsky.social","youtube.com/shorts/PgpP1...","2025-03-15T11:53:00.563Z"
"delilahpraete.bsky.social","What a relief. That's why Elon fired so many workers at the IRS. It all makes sense now.","2025-03-15T01:51:25.539Z"
"delilahpraete.bsky.social","🤬🤬🤬🤬🤬","2025-03-15T01:07:52.385Z"
"delilahpraete.bsky.social","NEW: Here are the 10 “democratic” senators that voted to sell out veterans, the American people, and their colleagues in the House. Cortez Masto Durbin Fetterman Gillibrand Hassan King Peters Schatz Schumer Shaheen","2025-03-14T21:25:01.117Z"
"delilahpraete.bsky.social","There are no words in the English language sufficient to describe how heartburstingly angry I am at the 8 traitors who just sold us all down the river. It is our job as Americans to make sure they can NEVER appear in public life EVER again. Die wretched and alone, unloved by your country.","2025-03-14T21:11:12.952Z"
"delilahpraete.bsky.social","Can you help me get 500 reposts on this post? I am going live on youtube on Friday. I am super pissed off what is happening in our party and want ro discuss Chuck Schumer and more with you. If you are not subscribed to my channel please consider doing so here: m.youtube.com/@adamparkhom...","2025-03-14T05:45:29.209Z"
"delilahpraete.bsky.social","The provision of the 14th amendment that the Supreme Court unanimously wrote out of the constitution existed for a reason. Its drafters knew what would happen if you allowed insurrectionists back into power.","2025-03-14T20:57:13.037Z"
"delilahpraete.bsky.social","These are the senators who collaborated with the GOP. Schumer Fetterman Cortez Masto Durbin King Shaheen Gillibrand Schatz Hassan Peters Don’t let them forget it. No peace for them.","2025-03-14T20:57:46.577Z"
"delilahpraete.bsky.social","When you're too rich to realise that you're this stupid and offensive.","2025-03-14T21:03:09.901Z"
"delilahpraete.bsky.social","Those people aren't attacking Telsa dealerships... They are simply tourists showing love… I learned that on January 6th 2021… Any Questions?!","2025-03-14T16:08:38.136Z"
"delilahpraete.bsky.social","Resign now you useless POS.","2025-03-14T20:41:31.405Z"
"delilahpraete.bsky.social","'Cause she's the one blonde they don't have to pay to lie.","2025-03-14T20:36:30.525Z"
"delilahpraete.bsky.social","substack.com/@mattlabash/...","2025-03-14T20:32:16.710Z"
"delilahpraete.bsky.social","Hear that Leon?","2025-03-14T20:28:38.389Z"
"delilahpraete.bsky.social","I'd love to hear what my survivor of 3 concentration camps father thinks about this after voting for Shitler TWICE. Won't know because I'd rather walk on glass than ever talk with him again. PS He's a dead beat dad that disappeared when I was 3 so the bar was very low...I was 51 when I found him.","2025-03-14T20:25:10.022Z"
"delilahpraete.bsky.social","This is going to be important: www.nbcnews.com/politics/tru...","2025-03-14T17:05:05.307Z"
"delilahpraete.bsky.social","Our country's Veterans have nothing to lose now, @schumer.senate.gov -- you've gutted their healthcare and risked their lives. What's to say they won't come after you? FUCK CHUCK!","2025-03-14T15:52:31.210Z"
"delilahpraete.bsky.social","I'm going to post this video every day so we never forget what Trump did on J6!!!","2025-03-14T11:35:19.917Z"
"delilahpraete.bsky.social","Nancy Pelosi urges Democratic senators to go against Schumer and vote NO on the Continuing Resolution.","2025-03-14T17:01:33.730Z"
"delilahpraete.bsky.social","“‘In the past several weeks, [Trump] has really launched a full-frontal assault on the Constitution, the rule of law, our system of justice and the entire legal profession.’”","2025-03-14T11:51:53.608Z"
"delilahpraete.bsky.social","Fact : Most people are 2 paychecks away from being evicted , with their jobs being uncertain sure doesn't help !!! #FascistPig 🐖","2025-03-13T05:07:11.241Z"
"delilahpraete.bsky.social","Always 💖 Don't make me tap the sign","2024-11-06T05:42:34.580Z"
"delilahpraete.bsky.social","www.axios.com/2025/03/14/t...","2025-03-14T14:00:33.657Z"
"delilahpraete.bsky.social","It started out as a joke Yesterday, the US President told his military to make plans to invade, by force, Panama. He announced his plans to annex Greenland - in front of the NATO head. He said the only way out for Canada was to become part of the U.S. This is not a joke. War is coming.","2025-03-14T10:09:51.592Z"
"delilahpraete.bsky.social","Justice for Breonna Taylor Justice for Sonya Massey Justice for Sandra Bland Justice for Tamir Rice Justice for Kalief Browder Justice for Eric Garner Justice for George Floyd Justice for Daunte Wright Justice for Alexia Christian Justice for Rayshard Brooks Say Their Names!!!","2025-03-13T16:37:45.249Z"
"delilahpraete.bsky.social","guys they're going to stop feeding TSA's bomb-sniffing dogs, per Fox News nat security correspondent:","2025-03-14T13:05:18.021Z"
"delilahpraete.bsky.social","oh got it www.tarapalmeri.com/p/fear-and-l...","2025-03-14T13:39:57.216Z"
"delilahpraete.bsky.social","Cracking the Magafacists code","2025-03-13T18:30:22.032Z"
"delilahpraete.bsky.social","Right.","2025-03-14T07:09:03.438Z"
"delilahpraete.bsky.social","I'm gonna need all democrats to call chuck's office and raise hell! I don't care if you're not from New York. You can call anywhere from around the country, if you're a democrat and tell him to grow a fucking backbone!! 202-224-6542","2025-03-14T09:21:55.467Z"
"delilahpraete.bsky.social","Chuck needs to resign now!!!!!!!!!!!!!!!!!!!!!!!!","2025-03-14T14:13:17.899Z"
"delilahpraete.bsky.social","[School gives a child a book with a black character in it without asking the parents first.] PARENTS: """"This is OUTRAGEOUS! A TOTAL violation of my parental rights!"""" [School inspects a child's genitals without asking the parents first.] PARENTS: """"This is fine."""" www.lgbtqnation.com/2025/03/gop-...","2025-03-13T21:40:59.208Z"
"delilahpraete.bsky.social","Despite Rubio’s grandfather’s “insistence that he was fleeing oppression, immigration officials raised suspicions that he might harbor communist sympathies…That charge, had they pursued it, could have led to a conclusion that he was a national security threat.” Oh. The. Irony.","2025-03-13T11:47:31.618Z"
"delilahpraete.bsky.social","Same bullshit. Different bullshitter.","2025-03-13T18:06:53.980Z"
"delilahpraete.bsky.social","YESSSSSSSSSSSSSSSSSSSSSS!!!!!!!!!!!!!!!!!!!!!!!!!!!!!!","2025-03-13T01:25:19.466Z"
"delilahpraete.bsky.social","@heyheygoodbye.bsky.social @rorywn.bsky.social @tigercat794.bsky.social @erosen1.bsky.social @docmurphydog.bsky.social @judithbolyard.bsky.social @jandee924.bsky.social @merlinmm.bsky.social @ltwlauren.bsky.social @stu559w.bsky.social @henry62.bsky.social @tcrg2012.bsky.social","2025-03-13T01:20:24.418Z"
"delilahpraete.bsky.social","THANK YOU BLUESKY FRIENDS!!! Coming here, seeing intelligent, creative, funny, courageous, and determined pro-democracy people here everyday is what is keeping me sane.","2025-03-12T16:48:48.006Z"
