"user","post","date"
"delilahpraete.bsky.social","This is so important. We cannot treat authoritarian or unconstitutional acts like they are inevitable.","2025-01-20T21:52:07.219Z"
"delilahpraete.bsky.social","This is just a reminder that the Nazi 🤡 has been an asset of Soviet/Russian Federation intel since at least 1982. Within the first 9 months following his unceremonious departure in January of 2021, with 100’s of classified documents, the U.S. lost over 2 dozen humint sources in Iran, China & Russia.","2024-11-18T16:47:31.235Z"
"delilahpraete.bsky.social","All Project 2025 just like we said. Will be tied up in knots for years","2025-01-21T01:57:11.939Z"
"delilahpraete.bsky.social","You are here:","2025-01-21T10:42:59.244Z"
"delilahpraete.bsky.social","Praising god for the fact that they can now wear red hats instead of the pointy white hoods.","2025-01-21T13:36:14.187Z"
"delilahpraete.bsky.social","💙🐈🐈‍⬛💙 Good Morning. All that’s left now is to watch all the craziness that 77 million people unleashed……All because eggs were expensive.😳😞","2025-01-21T13:26:52.579Z"
"delilahpraete.bsky.social","NAZIKKK party in the house.","2025-01-21T13:31:09.387Z"
"delilahpraete.bsky.social","It's really worse. Because the attackers on 09/11 were not American. Today is more like when one parent physically assaults and sexually molests a child and the other parent celebrates this.","2025-01-21T00:39:07.262Z"
"delilahpraete.bsky.social","youtu.be/zvgZtdmyKlI?...","2025-01-20T23:57:29.955Z"
"delilahpraete.bsky.social","Via RollingStone:","2025-01-20T20:23:09.267Z"
"delilahpraete.bsky.social","It's really worse. Because the attackers on 09/11 were not American. Today is more like when one parent physically assaults and sexually molests a child and the other parent celebrates this.","2025-01-21T00:36:40.030Z"
"delilahpraete.bsky.social","We should’ve deported that Nazi fucker (Musk) when we had the chance.","2025-01-20T22:16:30.561Z"
"delilahpraete.bsky.social","Yes...Hope my POS father who survived Auschwitz, Bergen Belsen and Dachau and voted for the orange bucket of vomit TWICE is eating his guts out right now. Best thing he did for me was disappear when I was three. I regret finding him when I was 51. The next best thing will be for him to die.","2025-01-21T00:19:58.278Z"
"delilahpraete.bsky.social","Hope my POS father who survived Auschwitz, Bergen Belsen and Dachau and voted for the orange bucket of vomit TWICE is eating his guts out right now. Best thing he did for me was disappear when I was three. I regret finding him when I was 51. The next best thing will be for him to die.","2025-01-21T00:12:05.653Z"
"delilahpraete.bsky.social","Everyone who signs on with Shitler always gets exactly what they deserve.","2025-01-21T00:08:51.837Z"
"delilahpraete.bsky.social","Hope my POS father who survived Auschwitz, Bergen Belsen and Dachau and voted for the orange bucket of vomit TWICE is eating his guts out right now. Best thing he did for me was disappear when I was three. I regret finding him when I was 51. The next best thing will be for him to die.","2025-01-21T00:03:13.453Z"
"delilahpraete.bsky.social","South African white colonialism ideology mix with fascism.","2025-01-20T22:56:06.108Z"
"delilahpraete.bsky.social","Hope my POS father who survived Auschwitz, Bergen Belsen and Dachau and voted for the orange bucket of vomit TWICE is eating his guts out right now. Best thing he did for me was disappear when I was three. I regret finding him when I was 51. The next best thing will be for him to die.","2025-01-20T21:42:25.043Z"
"delilahpraete.bsky.social","Hope my POS father who survived Auschwitz, Bergen Belsen and Dachau and voted for the orange bucket of vomit TWICE is eating his guts out right now. Best thing he did for me was disappear when I was three. I regret finding him when I was 51. The next best thing will be for him to die. ‪","2025-01-20T21:37:15.321Z"
"delilahpraete.bsky.social","Permanent mood.","2025-01-20T21:00:28.928Z"
"delilahpraete.bsky.social","Flip the script on democracy's destroyers. It's Day One of the new phase of the fight for our democracy.","2025-01-20T18:42:12.904Z"
"delilahpraete.bsky.social","Hope my POS father who survived Auschwitz, Bergen Belsen and Dachau and voted for the orange bucket of vomit TWICE is eating his guts out right now. Best thing he did for me was disappear when I was three. I regret finding him when I was 51. The next best thing will be for him to die. ‪","2025-01-20T21:32:17.193Z"
"delilahpraete.bsky.social","Hope my POS father who survived Auschwitz, Bergen Belsen and Dachau and voted for the orange bucket of vomit TWICE is eating his guts out right now. Best thing he did for me was disappear when I was three. I regret finding him when I was 51. The next best thing will be for him to die. ‪","2025-01-20T21:31:24.624Z"
"delilahpraete.bsky.social","Hope my POS father who survived Auschwitz, Bergen Belsen and Dachau and voted for the orange bucket of vomit TWICE is eating his guts out right now. Best thing he did for me was disappear when I was three. I regret finding him when I was 51. The next best thing will be for him to die.","2025-01-20T21:30:27.248Z"
"delilahpraete.bsky.social","Happy MLK Day.","2025-01-20T21:09:39.817Z"
"delilahpraete.bsky.social","Hope my POS father who survived Auschwitz, Bergen Belsen and Dachau and voted for the orange bucket of vomit TWICE is eating his guts out right now. Best thing he did for me was disappear when I was three. I regret finding him when I was 51. The next best thing will be for him to die.","2025-01-20T21:25:29.705Z"
"delilahpraete.bsky.social","We are about to enter an era of extreme and dangerous culture war in the United States. How do we protect our communities and work toward a cultural ceasefire? In this piece I wrote a couple months ago, I offer one possible path. wapo.st/40q1BDn","2025-01-20T20:03:14.037Z"
"delilahpraete.bsky.social","Ketamine is a hell of a drug.","2025-01-20T18:06:59.166Z"
"delilahpraete.bsky.social","Hope my POS father who survived Auschwitz, Bergen Belsen and Dachau and voted for the orange bucket of vomit TWICE is eating his guts out right now. Best thing he did for me was disappear when I was three. I regret finding him when I was 51. The next best thing will be for him to die.","2025-01-20T21:25:29.705Z"
"delilahpraete.bsky.social","Never. Forget.","2025-01-20T16:36:32.709Z"
"delilahpraete.bsky.social","NAZIKKKers out and proud now.","2025-01-20T21:11:22.344Z"
"delilahpraete.bsky.social","NAZIKKKers out and proud now!!!!!","2025-01-20T21:09:35.124Z"
"delilahpraete.bsky.social","RFK Jr.'s anti-science agenda and vaccine lies are a dangerous threat to public health. Healthcare costs would increase & harm businesses that rely on a healthy workforce. Urge your senators to reject Trump's HHS nomination of RFK Jr. http://dlvr.it/THTFKr","2025-01-20T20:56:34Z"
"delilahpraete.bsky.social","""""I knew that I could never again raise my voice against the violence of the oppressed in the ghettos without having first spoken clearly to the greatest purveyor of violence in the world today -- my own government... I cannot be silent."""" - Dr King Happy MLK Day!","2025-01-20T18:42:30.372Z"
"delilahpraete.bsky.social","NAZIKKKers out and proud now.🤬","2025-01-20T21:06:25.471Z"
"delilahpraete.bsky.social","What would Martin Luther King Jr. urge us to do as we celebrate his life and legacy? Press On.","2025-01-20T19:05:25.321Z"
"delilahpraete.bsky.social","In Wisconsin, we built a permanent campaign—where neighbors organize neighbors, year-round—all over the state. The model has proven its success, from flipping our state Supreme Court to reelecting Senator Baldwin in 2024. If I'm DNC Chair, we will use this model nationally.","2025-01-19T22:26:29.381Z"
"delilahpraete.bsky.social","March 7, 1965 it was a crisp 41 degrees as John Lewis marched peacefully, with head high and shoulders back, across the Edmund Pettus Bridge in Selma, AL. Knowing what was waiting on the other side John Lewis did what was right. I hope, if tested, I have this kind of bravery.","2025-01-19T22:44:18.762Z"
"delilahpraete.bsky.social","So sad… just another example of #ETTD. 😢","2025-01-20T16:12:47.547Z"
"delilahpraete.bsky.social","MAGA, BUY THIS!!! LOOK UNDER THE CUSHIONS ON YOUR SOFAS TO SCRAPE MONEY TOGETHER IF YOU NEED TO TO BUY THIS FROM THE ORANGE BUCKET OF VOMIT.","2025-01-20T16:15:49.378Z"
"delilahpraete.bsky.social","Trump literally broke TikTok so he could take credit for fixing it. It's disgusting. It's gaslighting. It's scamming & cheating. He's like a drug dealer who steals your stash and then helps you look for it. FUCK DJT!","2025-01-19T20:02:41.083Z"
"delilahpraete.bsky.social","As the Reverend Dr. Martin Luther King Jr. wisely said, """"Our lives begin to end the day we become silent about things that matter."""" Today and every day, I pledge to never silence my voice in the fight for what is right, and I will continue to march in the path he forged toward justice.","2025-01-20T14:49:21.743Z"
"delilahpraete.bsky.social","to recap: — Trump was *for* the TikTok ban — which the GOP Congress passed — and the GOP Supreme Court upheld — and even though Biden said he wouldn't enforce the ban, TikTok shut down anyway — so that Trump could """"save"""" it — and the media fell for it we really do live in the dumbest fucking country","2025-01-19T18:33:34.337Z"
"delilahpraete.bsky.social","RESIST. Don't quit. Don't stop fighting. Don't obey in advance. Don't stop calling them out. Keep raising your voices as loudly as you can. Keep organizing your friends, family, everyone. Keep supporting orgs that are leading the fight. RESIST.","2025-01-20T04:50:17.219Z"
"delilahpraete.bsky.social","""""The ultimate measure of a man is not where he stands in moments of comfort and convenience, but where he stands at times of challenge and controversy.”","2025-01-20T12:22:02.492Z"
"delilahpraete.bsky.social","😡😡😡😡","2025-01-19T15:47:44.762Z"
"delilahpraete.bsky.social","MERRICK GARLAND FUCKING DID THIS!!!!","2025-01-20T14:15:01.913Z"
"delilahpraete.bsky.social","#SundayService 🙏🏼 @johnfugelsang.bsky.social","2025-01-19T16:42:21.804Z"
"delilahpraete.bsky.social","Today, honor a King, not a Felon. #mlkday2025","2025-01-20T12:30:32.249Z"
"delilahpraete.bsky.social","We remember and honor Dr. Martin Luther King, Jr. on his birthday. Listen to his words, shared by his daughter, Bernice King. www.instagram.com/p/DE2mxKgxKEP/","2025-01-16T01:54:02.941Z"
"delilahpraete.bsky.social","This MLK Day, 1/20/25, Turner Classic Movies honors Dr. King's offscreen and onscreen legacy with a series of films depicting both the horrors of racism and the hope for racial justice. Jacqueline Stewart hosts the all-day showcase joined by Dr. King’s youngest child, Bernice King, during primetime.","2025-01-19T05:14:54.896Z"
"delilahpraete.bsky.social","Therefore, its time to resist there every move at every opportunity. Bernice King has it right about 47. I’m following this outline see if it helps you.","2025-01-16T04:59:24.667Z"
"delilahpraete.bsky.social","ATTENTION SHOPPERS!!!","2025-01-20T14:07:18.432Z"
"delilahpraete.bsky.social","If you can find a more polar opposite in energy and intention than MLK and DJT, you're a better person than I. But the poster is right, as is Bernice King. Avoidance is not an option.","2025-01-19T17:36:39.607Z"
"delilahpraete.bsky.social","Bernice King on MLK Day coinciding with Trump inauguration: ‘It reminds us of King’s spirit’ www.msn.com/en-us/news/p...","2025-01-19T21:40:22.986Z"
"delilahpraete.bsky.social","#MLKDay2025","2025-01-18T07:18:22.550Z"
"delilahpraete.bsky.social","MLK Jr message 1.20.25 Bernice King, saw the inauguration on MLK day as an opportunity to reaffirm MLK’s principles: “We cannot retreat or recoil... We have to commit ourselves to continuing the mission of protecting freedom, justice and democracy in the spirit of my father."""" We shall overcome!","2025-01-20T06:40:35.119Z"
"delilahpraete.bsky.social","Faith leaders including the Rev. Al Sharpton, the Rev. Bernice King and the Rev. William J. Barber II are slated to take part in gatherings marking Martin Luther King Jr. Day on Monday, which is also Inauguration Day.","2025-01-18T17:00:26.853Z"
"delilahpraete.bsky.social","Good morning beautiful people. Sharing this message from Bernice King ,she posted this morning . Saying it again I’m in this with you till the dirt . I’m not going quietly!","2025-01-18T14:15:39.580Z"
"delilahpraete.bsky.social","Ebenezer Baptist Church, Atlanta, GA. Martin Luther King preached here. Then his son, Martin Luther King, Jr. preached here. Then his daughter, Dr. Bernice King preached here. Then GA Senator Reverend Raphael Warnock preached here. Beside it is the King Center. Up a few houses is Dr. MLK, Jr.'s home","2025-01-20T09:29:03.345Z"
"delilahpraete.bsky.social","""""Dear politicians/ political influencers: When you evoke my father [today], remember that he was resolute about eradicating racism, poverty, and militarism. And about corrective justice work. Don't just quote him. Encourage and enact policies that reflect his teachings."""" Bernice King","2025-01-20T11:43:05.699Z"
"delilahpraete.bsky.social","“No matter what, my father said I am determined to create a just society” Dr. Bernice King stresses the importance of perseverance and remembering her father’s legacy in dark times.","2025-01-18T17:33:29.381Z"
"delilahpraete.bsky.social","MUCH WORSE!!! It's really worse. Because the attackers on 09/11 were not American. Today is more like when one parent physically assaults and sexually molests a child and the other parent celebrates this.","2025-01-20T13:51:52.896Z"
"delilahpraete.bsky.social","I'm going to post this video every day so we never forget INSURRECTIONIST TRUMP!","2025-01-19T12:43:04.739Z"
"delilahpraete.bsky.social","drvincentgreenwood-89455.medium.com/the-science-...","2025-01-19T18:04:57.417Z"
"delilahpraete.bsky.social","#Resisters @bluewavesurfer.bsky.social @bluegranny5.bsky.social @ajflick.bsky.social @pinksequinally.bsky.social @orangepapers.bsky.social @paul-mercury.bsky.social @dcran.bsky.social @overtonview.bsky.social @missmaggies.bsky.social @aresister.bsky.social @lainydapain.bsky.social","2025-01-18T21:12:33.023Z"
"delilahpraete.bsky.social","www.jefftiedrich.com/p/elderly-fl...","2025-01-19T16:53:36.385Z"
"delilahpraete.bsky.social","@donkoclock.bsky.social @bocksam.bsky.social @mmpadellan.bsky.social @bluestormcomin1.bsky.social @gigialexander123.bsky.social @syoozana.bsky.social @jjones57.bsky.social @kmamabear03.bsky.social @reneecablue.bsky.social @kcgg.bsky.social @firestorms802.bsky.social @drmav1.bsky.social","2025-01-19T03:47:04.284Z"
"delilahpraete.bsky.social","Sounds like a plan... *Yes, music posts will be the same as normal. We will need the distraction. 🎶🤘🎶","2025-01-19T02:44:32.510Z"
"delilahpraete.bsky.social","This must e what the SCOTUS meant by absolute immunity, right?","2025-01-19T03:51:47.193Z"
"delilahpraete.bsky.social","💯","2025-01-19T01:30:42.258Z"
"delilahpraete.bsky.social","The Laken Riley Act allows for the indefinite detention of any immigrant even SUSPECTED of theft. It also enables cops to detain citizens who look like immigrants until they can prove their citizenship. Senate Dems need to say No and vote against this bill.","2025-01-18T16:03:05.958Z"
"delilahpraete.bsky.social","The People's March turnout was greater than many expected. Keep fighting back! GREAT TURNOUT!","2025-01-19T01:29:29.469Z"
"delilahpraete.bsky.social","That is of course, if in the future, history will be at all factual.","2025-01-19T03:42:59.321Z"
"delilahpraete.bsky.social","WaPo is just another white wing fascist supporting rag now.","2025-01-19T03:37:05.904Z"
"delilahpraete.bsky.social","Turns out there are a lot of this people in positions of power. drvincentgreenwood-89455.medium.com/the-science-...","2025-01-19T03:07:05.983Z"
"delilahpraete.bsky.social","The internet","2025-01-19T01:14:51.626Z"
"delilahpraete.bsky.social","At the home of Scott Jennings, Trump violating the Constitution by ignoring its provisions is merely """"pushing the boundaries."""" Sad.","2025-01-19T02:34:44.976Z"
"delilahpraete.bsky.social","Make no mistake, the white wing would rather take a scorched earth approach to our country/democracy and our planet than have more non-white people to have more power.","2025-01-19T02:47:48.903Z"
"delilahpraete.bsky.social","Criminal........","2025-01-17T19:02:57.285Z"
"delilahpraete.bsky.social","Are you in? See you Monday on YouTube. YouTube.com/@MeidasTouch","2025-01-18T23:17:27.710Z"
"delilahpraete.bsky.social","Because POS Bezos doesn't have enough money. 😡🤬","2025-01-19T00:29:44.379Z"
"delilahpraete.bsky.social","FUCK PUTIN!! SLAVA UKRAINI!!!","2025-01-18T21:39:07.268Z"
"delilahpraete.bsky.social","England and Europe fought Nazis for 8 months before Pearl Harbor, and US involvement. Trumps administration and the Republican Party, are full of the kind of appeasers that objected to US involvement. America Firsters are not Patriots. Quite the opposite.","2025-01-18T21:34:59.453Z"
"delilahpraete.bsky.social","While the white wing is always touting American excellence. What they really mean is AmeriKKKan excellence.","2025-01-18T21:27:57.492Z"
"delilahpraete.bsky.social","As white woman, I don't have a vote on this but it's hard not to agree with his POV.","2025-01-18T21:25:54.788Z"
"delilahpraete.bsky.social","YES!!!!!!!!!!!!!!!!!!!!!!!!!!","2025-01-18T21:19:06.764Z"
"delilahpraete.bsky.social","We could have him instead of the guy that made up a story about people eating cats and dogs.","2025-01-18T21:18:31.164Z"
"delilahpraete.bsky.social","And the orange regime hasn't ended the bans on every single poisonous persticide under the sun!!!","2025-01-18T21:16:50.612Z"
"delilahpraete.bsky.social","Food for thought.","2025-01-18T19:06:53.525Z"
"delilahpraete.bsky.social","EXACTLY!!!!!!!!!!!!!!!!!!!!!!!!!!!!!!!!!!!!!!!!!!!!!!!!!!!!!!!!!!!!!!!","2025-01-18T18:23:20.486Z"
"delilahpraete.bsky.social","#transsky","2025-01-18T18:20:41.974Z"
"delilahpraete.bsky.social","🏳️‍⚧️TRANS FOLX! 🏳️‍⚧️ Today is the last day to update your IDs under the Biden administration. if you want to update your paperwork in the next 4 years, now is a great time to do it! here is a state-by-state guide on name change laws, driver’s license & birth certificate gender change:","2025-01-17T18:07:25.336Z"
"delilahpraete.bsky.social","This poster is asking far too many AmeriKKKans to think harder and watch/listen to white wing propoganda less. Too big an ask apparently.","2025-01-18T18:17:56.926Z"
"delilahpraete.bsky.social","Privatization ≡ Installing a wealthy person to syphon off value from production of a good or service people need. Incentive of the rich person: to provide as little as possible to get the most money possible. Do you really think this will make anything better?","2024-12-25T00:27:05.021Z"
"delilahpraete.bsky.social","Privatization ≡ Taking control over the production of an essential good or service from an organization which is accountable to the people and giving it to a private business that is not. The private business often gets a statutory monopoly with no incentives to influence prices or quality.","2024-12-25T00:35:57.692Z"
"delilahpraete.bsky.social","😀😂","2025-01-18T18:13:29.573Z"
"delilahpraete.bsky.social","What we've had the last four years vs what we are going to have for the next.","2024-12-29T03:14:21.030Z"
"delilahpraete.bsky.social","Most rich people are leaches. We have a system where, just because someone has money we allow them to take the lion's share value from other people's work and other people's ideas. This needs to change. People deserve a to have the lion's share of the value from their own work.","2025-01-04T19:05:25.270Z"
"delilahpraete.bsky.social","You cannot have a meritocracy without high quality universally available education. If education is expensive then only those who can afford it can gain """"merit"""". If merit can be purchased it is not actually merit. Only when everyone has the same opportunity can you call it meritocracy.","2025-01-04T19:18:04.267Z"
"delilahpraete.bsky.social","Some conservatives will say that """"facts don't care about your feelings"""". But its seems much more obvious to the rest of us that their feelings don't care about facts. In fact they will believe anything no matter how impossible if it feeds into their feelings.","2025-01-05T01:36:09.253Z"
"delilahpraete.bsky.social","Also, in Russia you can be imprisoned and tortured for calling their war a war. Telling the truth is illegal in Russia and the punishment is severe.","2025-01-12T18:13:22.726Z"
"delilahpraete.bsky.social","Mark Zuckerberg predicts AI will code like mid-level engineers by 2025, transforming software development. Meta plans to integrate AI into coding teams, potentially automating entire projects.","2025-01-18T15:48:17.639Z"
"delilahpraete.bsky.social","We could have had Tim.","2025-01-18T17:40:06.803Z"
"delilahpraete.bsky.social","Seriously!!!!","2025-01-18T18:06:41.277Z"
"delilahpraete.bsky.social","Madison agreed, and the painting of a man voluntarily giving up power rather than becoming a dictator hangs today in the Rotunda of the U.S. Capitol.","2024-12-23T13:41:38.126Z"
"delilahpraete.bsky.social","Twinning with tRump.","2025-01-18T18:00:36.325Z"
"delilahpraete.bsky.social","The arbiters of Absolute Immunity.","2025-01-18T17:57:38.733Z"
"delilahpraete.bsky.social","FUCK MERRICK GARLAND.","2025-01-18T17:50:32.845Z"
"delilahpraete.bsky.social","This is why they want to get rid of the Dept of Ed.","2025-01-18T17:49:11.781Z"
"delilahpraete.bsky.social","BOOM!!!","2025-01-18T17:47:32.365Z"
"delilahpraete.bsky.social","#clockit","2025-01-14T23:09:03.784Z"
"delilahpraete.bsky.social","Take any good new I can get.","2025-01-18T17:45:04.997Z"
"delilahpraete.bsky.social","What white wing men do when women say no. Especially Black women. #blacksky","2025-01-18T17:40:38.884Z"
"delilahpraete.bsky.social","#BlackSky","2025-01-17T04:44:01.199Z"
"delilahpraete.bsky.social","Don’t leave out the National Museum of African American History. I would also like to recommend Ben’s Chili Bowl. And across the state line into Maryland we have Casinos and Outlets. While you are here, we appreciate you helping to stimulate our economy. Peace✌🏾and deuces 🎲🎲","2025-01-18T17:31:02.243Z"
"delilahpraete.bsky.social","GOP sold him out to two rapists and one drunk. (No disrespect intended towards anyone struggling with alcoholism.)","2025-01-18T17:30:57.077Z"
"delilahpraete.bsky.social","Bluesky please stop the porn bots.","2025-01-18T17:19:34.407Z"
"delilahpraete.bsky.social","Gayle’s Gals 🦋 Pack 16 #GaylesGals I know it’s Woman’s March today. Tomorrow is maggot rally. 🤮 🦋please look out for each other and be safe wherever you travel 🦋 🦋Love from Bluesky 💙 🦋 go.bsky.app/UArT3U8","2025-01-18T17:19:39.243Z"
"delilahpraete.bsky.social","Leon is beyond weird.","2025-01-18T17:22:28.764Z"
"delilahpraete.bsky.social","#ProudBlue Monday is MLK’s birthday celebration, I will be remembering him, not the Felon. Such a woozy boy, too cold for him outside. I was hoping for a William Henry Harrison moment.","2025-01-18T00:26:46.010Z"
"delilahpraete.bsky.social","LOL!! Just the first of infinite disappointments for you assholes.","2025-01-18T02:53:23.510Z"
"delilahpraete.bsky.social","I'm going to post this video every day so we never forget INSURRECTIONIST TRUMP!","2025-01-17T12:45:34.480Z"
"delilahpraete.bsky.social","Typical Democratic BS. It's """"LAW"""" but it's not certified!!! So what the hell does that mean??? www.reuters.com/world/us/bid...","2025-01-17T20:22:44.198Z"
"delilahpraete.bsky.social","#Voices4Victory #ProudBlue BAD ASS WOMEN OF HISTORY Edith Green, elected to Congress in 1954 and served 9 terms, worked on women’s rights, education, and equal pay was born today in 1910. www.oregonencyclopedia.org/articles/gre...","2025-01-17T17:32:02.453Z"
"delilahpraete.bsky.social","Can someone explain why TikTok is a bigger national security concern than a social media platform run by a South African technofeudal oligarch actively interfering in our elections and sabotaging our national interests here and abroad?","2025-01-16T19:53:26.605Z"
"delilahpraete.bsky.social","I think this is one of my favourite colourful climate chart type things, because it depicts two things at once: - Things are going to get worse, no matter what - The degree to which they get worse depends on decisions made today theconversation.com/my-new-dark-... by @edhawkins.org","2025-01-17T08:40:09.981Z"
"delilahpraete.bsky.social","What a bunch of thugs. This is going to be a shit show.","2025-01-16T16:53:24.136Z"
"delilahpraete.bsky.social","Is there any billionaire rich enough that Republicans won’t support a tax cut for? Scott Bessent- Trump’s billionaire Treasury nominee - says no.","2025-01-17T14:31:22.532Z"
"delilahpraete.bsky.social","A new memo from ICE has been circulating in Senate offices that spells out the staggering cost of carrying out the bill if it were signed into law: $86 billion over three years, far exceeding House Republicans’ estimate last week of $3 billion per year.","2025-01-17T14:31:24.995Z"
"delilahpraete.bsky.social","Who agrees?","2025-01-17T13:30:48.923Z"
"delilahpraete.bsky.social","Tech billionaire Elon Musk’s friendliness with the far right “endangers” democracy in Europe, German Chancellor Olaf Scholz said today www.politico.eu/article/olaf...","2025-01-17T13:31:09.650Z"
