"user","post","date"
"yimabean.bsky.social","In fairness, it would have been pointless as Bill Barr wore gloves.","2025-10-11T18:44:55.360Z"
"yimabean.bsky.social","Sweet as it is, this ear of corn has a bitter message: Tariffs hurt farmers! Signs of the Times, #TeslaTakedown, Golden Valley, MN. Thread, 1 of 10. @indivistwincities.bsky.social @50501movement.bsky.social @teslatakedown.com @smith.senate.gov @governorwalz.mn.gov @maddow.msnbc.com #ProtestSign","2025-10-11T18:43:43.260Z"
"yimabean.bsky.social","Swear-in Rep. Adelita Grijalva! Release the Epstein files!","2025-10-11T19:07:37.127Z"
"yimabean.bsky.social","Donald Trump is engaged in the biggest cover-up in American history – and he's threatening members of congress to be complicit in his crimes. Release the Epstein files.","2025-10-11T19:09:52.792Z"
"yimabean.bsky.social","""""Donald Trump and Mike Johnson are engaging in a cover-up to shield people who were involved in raping children."""" Rep. Melanie Stansbury","2025-10-12T00:43:41.366Z"
"yimabean.bsky.social","If human beings had a thousand souls, JD Vance would happily sell all of his. Then, sneering through his beard, he would tell you you're a loser for not doing the same.","2025-10-12T18:06:17.176Z"
"yimabean.bsky.social","He's had 3 names. I've represented career criminals with fewer aliases.","2025-10-12T18:17:46.432Z"
"yimabean.bsky.social","What's the biggest inside indicator of Trump's poor health? JD Vance's behavior. Vance knows that Trump's prognosis is poor. He believes this is going to give him the presidency before 2028. No American VP has ever behaved this way. His level of arrogance is off the charts.","2025-10-12T18:57:07.881Z"
"yimabean.bsky.social","I’m with you.🧐","2025-10-12T21:27:27.728Z"
"yimabean.bsky.social","Trump was president on January 6th, 2020. So, is he now in late-stage dementia – or does he think his followers are exactly this stupid?","2025-10-12T21:25:16.200Z"
"yimabean.bsky.social","Sheesh to the billionth.","2025-10-12T21:26:49.319Z"
"yimabean.bsky.social","Giving up? LOL. We're just getting started. October 18th, Everywhere #nokings","2025-10-12T17:49:06.193Z"
"yimabean.bsky.social","We are Amphifa.","2025-10-12T17:30:17.155Z"
"yimabean.bsky.social","Finally realized what the freakout over Mamdani becoming mayor reminded me of, and it's the freakout over the first black mayors in southern cities. New post at CAMPAIGN TRAILS:","2025-10-12T18:45:41.767Z"
"yimabean.bsky.social","DO NOT LOOK AWAY!!!! TRUMP & EPSTEIN ARE SEX TRAFFICKERS!!! I’m gonna post this every day so nobody forgets exactly who Pedophile Trump is and why the Epstein files have suddenly disappeared.","2025-10-12T11:39:38.657Z"
"yimabean.bsky.social","“The surest way to screw up the world’s best technical school is to let feds tell them how to run it,” Kentucky Congressman Thomas Massie wrote on X. “Congrats to my alma mater for turning down a bribe to let the executive branch dictate what happens on its campus.”","2025-10-11T21:55:09.757Z"
"yimabean.bsky.social","Stand up, yours could be next","2025-10-12T21:01:33.456Z"
"yimabean.bsky.social","Candyman Jackson said Trump’s visit today to Walter Reed was a follow up for his vascular issues and also to get updated travel vaccinations.","2025-10-10T23:02:59.768Z"
"yimabean.bsky.social","What he not saying is that his friends and cronies invested a fortune in Argentina since their guy Milei won, they stand to lose a big chunk of those fortunes the way things are going, and Argentina’s elections are in two weeks and we are tampering in them to bail Milei out.","2025-10-10T23:58:56.678Z"
"yimabean.bsky.social","Trump got a Covid vaccine today.","2025-10-11T01:08:22.884Z"
"yimabean.bsky.social","The cost of homeowners and auto insurance in FL is insane, but Republicans are always laser focused on the important distractions from all that stuff.","2025-10-11T01:26:09.902Z"
"yimabean.bsky.social","Today Mike Johnson and Steve Scalise called these No Kings rallies antifa terrorism. open.substack.com/pub/meidasto...","2025-10-11T01:45:30.810Z"
"yimabean.bsky.social","Children that were kidnapped by invading Russian barbarians, not displaced.","2025-10-11T12:21:17.836Z"
"yimabean.bsky.social","Epstein files giving House Republicans over two months paid vacation and counting.","2025-10-12T12:34:08.047Z"
"yimabean.bsky.social","This isn’t a conspiracy theory, it’s a time travel science-fiction pitch.","2025-10-12T11:02:28.778Z"
"yimabean.bsky.social","Absolutely","2025-10-12T12:27:13.219Z"
"yimabean.bsky.social","GOP just can't stop fucking it up.","2025-10-12T12:26:43.241Z"
"yimabean.bsky.social","- #GopHatesTheConstitution Congressional oversight ensures: accountability of the executive branch to the public, transparency, agencies are following the law, taxpayer funds used responsibly, efficiency, economy, and effectiveness of governmental operations. 🌊💙 ☮️ #PamelaLovesTheConstitution -","2025-10-11T19:17:22.233Z"
"yimabean.bsky.social","A general strike is a good idea. People MUST come out October 18!","2025-10-11T17:53:22.096Z"
"yimabean.bsky.social","“A woman is like a tea bag – you never know how strong she is until she gets in hot water."""" –Eleanor Roosevelt ☕️","2025-10-11T19:07:52.525Z"
"yimabean.bsky.social","Trump is going to continue to do everything in his power to try to incite violence somewhere. If Portland and Chicago don’t work, he’ll probably go to New York. He’s looking for a reason to invoke the Insurrection Act.","2025-10-11T03:05:14.006Z"
"yimabean.bsky.social","What is the line trump has to cross to get Congressional republicans to wake the fuck up?","2025-10-11T02:43:34.411Z"
"yimabean.bsky.social","We already found the line - he briefly wanted to raise taxes on millionaires and they told him absolutely fucking not. Everything else appears to be fair game.","2025-10-11T02:49:39.842Z"
"yimabean.bsky.social","To be completely fair to him, he’s drunk - hard to be a good leader when you’re sloshed. It’s even harder to be a good leader when you have absolutely no leadership qualities to speak of… so he’s double fucked. And yes, nobody should sign that.","2025-10-11T02:48:34.971Z"
"yimabean.bsky.social","What do these Trump Administration dudes all have in common? 🤏 #SDM","2025-10-11T02:14:36.740Z"
"yimabean.bsky.social","It all boils down to: Trump wants to harm as many Americans as possible, while plundering as much cash as possible, because that’s what his Kremlin whoremasters want.","2025-10-11T10:02:59.615Z"
"yimabean.bsky.social","""""'People don’t like the idea of doing these things to kids. Over and over again this administration thinks there is support for the idea that we as a country can do this to children and they’re 80/20 issues.'""""","2025-10-11T00:15:40.401Z"
"yimabean.bsky.social","A Very Cynical Plan: 1. Lie about Antifa being real & powerful. 2. Lie about nonexistent """"riots"""" in peaceful Democrat cities. 3. Lie that Jan 6 goons playing dress-up as ICE are sent to stop riots when they are going to start them. 4. Lie about who is funding Antifa so you can shut them down.","2025-10-10T21:04:49.607Z"
"yimabean.bsky.social","I'm feeling better about turning down that Nobel Prize (I've simply run out of shelf space) since they didn't turn around and give it to you-know-who. What a relief.","2025-10-10T21:22:30.985Z"
"yimabean.bsky.social","I love that the folks in Norway didn't want to just deprive Donald Trump of the Nobel Peace Prize he was so shamelessly hungry for, they awarded it instead to someone he would hate, a decent Latina woman working against undemocratic authoritarianism. Nice touch. 👨‍🍳👄","2025-10-10T21:48:32.703Z"
"yimabean.bsky.social","2017 TRUMP: “Qatar has been a funder of terrorism at a very high level.” 2025 TRUMP: “Thank you, Qatar, for my free $400,000,000 personal jet!” TRUMP, a few months later: “I'm letting Qatar be the first foreign nation to build a military base on US soil.” www.c-span.org/clip/white-h...","2025-10-10T21:56:56.431Z"
"yimabean.bsky.social","Odd, how Laura Loomer has to speculate about what Hell must be like, whereas anyone who has ever had to spend time with her does not.","2025-10-10T23:41:59.718Z"
"yimabean.bsky.social","""""The University of Zurich said the married couple, who currently work at MIT, would join its economics faculty …. [They] will be moving … at a time when experts are warning that Trump's cuts to research funding and attacks on … freedoms could lead to a brain drain …."""" www.lemonde.fr/en/economy/a...","2025-10-10T22:25:33.492Z"
"yimabean.bsky.social","You should not control a nuclear arsenal if you cannot tell the difference between fiction and reality. The story needs to be told through the lens of mental illness","2025-10-10T22:49:20.575Z"
"yimabean.bsky.social","“The Founders would never believe that it would ever come to pass that one state militia could be sent to another state for the purposes of political retribution” THAT PART! Thank you, Judge Perry.","2025-10-10T00:32:46.766Z"
"yimabean.bsky.social","Thank you!💙","2025-10-11T00:00:27.235Z"
"yimabean.bsky.social","At least these guys weren't handed 150 million bucks.","2025-10-10T14:21:35.364Z"
"yimabean.bsky.social","Big Balls going through the 60 Minutes staff for dead weight soon.","2025-10-10T14:15:48.527Z"
"yimabean.bsky.social","Pretending every huge peaceful protest is worse than January 6th while also pretending January 6th never happened.","2025-10-10T14:31:21.258Z"
"yimabean.bsky.social","Well done 💙","2025-10-10T14:47:26.449Z"
"yimabean.bsky.social","Not only did Trump lose, he lost to a (very deserving) Spanish-speaking WOMAN. Gifted article about his shameless campaign: www.wsj.com/world/trump-...","2025-10-10T11:11:34.998Z"
"yimabean.bsky.social","""""The Presidential Checkup is now complete! The President, at 6'6"""" in height, weighing in at 205 lb. had a blood-oxygen saturation of 104%. His cholesterol levels are better than perfect, and he was able to perform 150 pushups with Commander Hegseth standing on his back.""""","2025-10-09T11:46:16.263Z"
"yimabean.bsky.social","Nothing to see here, just Trump going for his second “yearly” checkup this year. Anyone ready to admit that something is wrong with POTUS yet?","2025-10-09T11:41:33.156Z"
"yimabean.bsky.social","#FuckThemKids #FTK","2025-10-07T14:38:03.276Z"
"yimabean.bsky.social","Please share. Spread the word. If you're in Florida - Sarasota, or nearby - show up & support our friend, @jim-stewartson.bsky.social Defend Free Speech Now Link: www.defendspeechnow.org","2025-10-07T17:36:51.499Z"
"yimabean.bsky.social","Our corpulent overlord doesn’t want for food, certainly, but that doesn’t mean his subjects won’t starve. This is a direct consequence of Stephen Miller’s racism.","2025-10-08T09:56:15.459Z"
"yimabean.bsky.social","Stephen Miller said """"plenary authority,"""" which is a fancy way of saying """"absolute power of the kind Hitler enjoyed,"""" and then goes silent, probably because he jizzed his pants.","2025-10-08T10:54:59.245Z"
"yimabean.bsky.social","Best as I can tell, """"plenary authority"""" also describes the relationship Elon Musk has over Miller's wife. Remember, a matador is a guy in sequins who moves out of the way after riling up the bull...and she DID say he was a """"sexual matador."""" 🙃 [I'm joking, BTW. At least, I think I'm joking.]","2025-10-08T11:01:39.124Z"
"yimabean.bsky.social","Serious question: How is it legal for the governor of Texas to send his state's national guard into Illinois, when Illinois doesn't want them there? In response, can the governor of Illinois call up HIS state's national guard to defend Illinoisans against the portly Lone Star occupying force?","2025-10-08T11:09:05.706Z"
"yimabean.bsky.social","👀👀👀👀","2025-10-08T13:18:08.011Z"
"yimabean.bsky.social","Thugs","2025-10-07T12:46:10.319Z"
"yimabean.bsky.social","All these headlines saying “Bondi Goes on the Attack.” Really? She wasn’t in the octagon, she’s a public servant who was at an oversight hearing. Her job was to answer questions. She refused to do her job. Stop glamorizing and whitewashing this moronic, performative bullshit.","2025-10-08T02:33:25.084Z"
"yimabean.bsky.social","Dolly Parton’s sister, Freida Parton, is asking for people to pray for her sister’s health.","2025-10-07T22:22:49.947Z"
"yimabean.bsky.social","He is SUCH A CREEP.","2025-10-08T21:43:31.089Z"
"yimabean.bsky.social","Of course.","2025-10-08T21:42:49.687Z"
"yimabean.bsky.social","Fat Satan and his little henchman want one-hit wonder Lee Greenwood to perform at the Super Bowl instead of Bad Bunny. They’re writing their own jokes at this point.","2025-10-08T19:54:21.155Z"
"yimabean.bsky.social","He finally got the election-denying MAGA A.G. he always dreamed of. Bondi was openly partisan, scornful & highly combative, her non-answers dripping with disdain. Very telling when she was asked if she'd seen the photos of her boss """"with half-naked young women."""" PATHETIC #ProtectingHerPedophilePrez","2025-10-08T19:02:24.738Z"
"yimabean.bsky.social","🧐😄","2025-10-08T01:35:01.281Z"
"yimabean.bsky.social","Did Air Traffic Controllers just start the general strike?!?? 🤝 “…Transportation Secretary Sean Duffy claimed that many air traffic control workers were calling out sick.” Read more: www.dailymail.co.uk/sciencetech/... #GeneralStrike #ShutItDown #AirTrafficControllers #50501movement","2025-10-08T01:07:12.026Z"
"yimabean.bsky.social","#ProudBlue #Voices4Victory Oh, come on PA we deserve better than this guy. I don’t know if he’s just clueless or he thinks we’re stupid. I guess he thinks American revolutionaries had 3-D printers. This kind of mentality is exactly why we’re the only state without a budget passed. 🤦‍♀️","2025-10-07T23:53:21.850Z"
"yimabean.bsky.social","It will be if everyone shares it over and over. Share this over and over, everyone.","2025-10-08T00:42:52.810Z"
"yimabean.bsky.social","I think the better question would have been: """"Pamela Jo, as a fellow taker of bribes, in your case from Donald Trump to shut down your Florida AG investigation of Trump University's consumer fraud, did you approve the shutting down of the bribery investigation into Homan?""""","2025-10-08T00:21:14.625Z"
"yimabean.bsky.social","I'm not a conservative commentator. No Billionaire is offering me $150 million. No TV network will make me its editor in chief. I am just a lawyer who fights hard for democracy. I built Democracy Docket to keep you informed. For $10 a month, you can help it do its vital work. hubs.ly/Q03CbHTt0","2025-10-08T01:01:51.009Z"
"yimabean.bsky.social","If this was a no, it would be really easy to say no. Bondi’s ad hominem attack on Whitehouse is WAY more of an answer than she realizes.","2025-10-07T15:36:55.804Z"
"yimabean.bsky.social","Fuck this. This is nothing but red meat for Trump’s base. A federal law that *Trump* signed into law guarantees backpay to furloughed workers. There’s no disputing this.","2025-10-07T16:48:28.484Z"
"yimabean.bsky.social","Pam Bondi admits she spoke to Apple to """"get the ICEBlock app taken down."""" Sounds an awful lot like coercion to suppress disfavored speech to me. A clear violation of the 1st Amendment.","2025-10-07T18:56:30.162Z"
"yimabean.bsky.social","IN HONOR OF FRIENDSHIP MONTH: djt: """"We have certain things in common, Jeffrey."""" Epstein: """"Yes we do, come to think of it."""" djt: """"A pal is a wonderful thing. Happy Birthday- and may every day be another wonderful secret."""" And by """"wonderful secret"""", he means raping children. #PedoPrez","2025-10-07T18:48:33.812Z"
"yimabean.bsky.social","They are beyond unreal","2025-10-08T01:02:07.107Z"
"yimabean.bsky.social","Damn straight.","2025-10-06T20:31:38.416Z"
"yimabean.bsky.social","We should stop calling it the second term and just call it what it is, The Grift","2025-10-04T17:18:42.357Z"
"yimabean.bsky.social","The people who are calling on us to choose """"sides"""" are not as patriotic as they think they are.","2025-10-05T17:23:20.919Z"
"yimabean.bsky.social","Cadet Bonespurs needs to show respect for Guardsman and stop ripping them away from their jobs and their families just for political stunts.","2025-10-06T20:20:34.521Z"
"yimabean.bsky.social","Newly elected Dem claims Mike Johnson shutting her out of Congress over Epstein","2025-10-06T20:03:12.000Z"
"yimabean.bsky.social","Comer withdraws Comey subpoena in Epstein case","2025-10-06T19:30:03.000Z"
"yimabean.bsky.social","“No one man can terrorize a whole nation, unless we are all his accomplices.” -Edward R. Murrow","2025-10-06T17:01:09.596038Z"
"yimabean.bsky.social","He's totally going to pardon Ghislaine Maxwell by the way.","2025-10-06T17:44:33.367Z"
"yimabean.bsky.social","COLLINS: Which local officials in Portland have said that the National Guard is needed there? LEAVITT: The judge's opinion is untethered in reality and the law","2025-10-06T17:35:12.975Z"
"yimabean.bsky.social","￼👇🏼😡😡😡","2025-10-05T21:06:52.681Z"
"yimabean.bsky.social","True that.","2025-10-06T19:08:46.572Z"
"yimabean.bsky.social","🤔🥴😂","2025-10-05T21:04:39.126Z"
"yimabean.bsky.social","Their comfort in their racism grows daily. They proudly show it off now. The level of disgust these fascists cause real, normal, human beings is beyond anything seen in well over a century in this country. We must continue to unite, become involved, and resist!","2025-10-05T21:10:21.173Z"
"yimabean.bsky.social","No need to remind us.","2025-10-05T22:48:34.255Z"
"yimabean.bsky.social","Reminder: The Trump administration is giving Argentina a $20 BILLION bailout as Americans struggle to afford groceries.","2025-10-05T20:34:00.914262062Z"
"yimabean.bsky.social","We know. Can’t fool all of us.","2025-10-05T22:47:26.661Z"
"yimabean.bsky.social","👏👏👏👏","2025-10-05T22:43:31.028Z"
"yimabean.bsky.social","💥 Russia: Kstovo Oil Refinery struck by Ukraine in Nizhny Novgorod region. Daily refining capacity of 340,000 barrels - 6% of Russia's total refining capacity.","2025-10-05T05:37:16.918Z"
"yimabean.bsky.social","Obviously purloined from some sap.","2025-10-05T22:42:08.476Z"
"yimabean.bsky.social","we lost a queen 👑","2025-10-05T17:12:05.595Z"
"yimabean.bsky.social","This obviously raises more questions about Joe Biden's mental competence","2025-10-05T22:35:39.650Z"
"yimabean.bsky.social","I second my post from earlier… bsky.app/profile/irma...","2025-10-05T22:23:01.589Z"
"yimabean.bsky.social","He needs a gong or lambs hook asap.","2025-10-05T22:34:29.954Z"
"yimabean.bsky.social","Using massive Medicaid and Medicare fraud.","2025-10-05T17:17:43.566Z"
"yimabean.bsky.social","Well known fraudster. The best!!","2025-10-05T22:32:55.988Z"
"yimabean.bsky.social","American taxpayers are paying people to post Bible verses on a US government account.","2025-10-05T17:23:42.827Z"
"yimabean.bsky.social","Trump admits what we knew all along - the shutdown is happening because they want to repeal Obamacare by choking off funding for it. Project 2025.","2025-10-05T17:29:21.562Z"
"yimabean.bsky.social","Yet they will STILL BOW and very LOW.","2025-10-05T22:32:08.550Z"
"yimabean.bsky.social","I say that ALL the time. HE IS SOLELY responsible for this travesty.","2025-10-05T20:41:07.531Z"
"yimabean.bsky.social","This video of Chicagoans intervening to save a man from being abducted off the streets by ICE is making the rounds on Instagram. Community action works. Source: www.instagram.com/reel/DPZL2AL...","2025-10-05T17:24:53.662Z"
"yimabean.bsky.social","My O positive is on fire 🔥","2025-10-05T20:37:59.376Z"
"yimabean.bsky.social","Put your devices on do not disturb, and read this masterful article featuring 2 brilliant writers. So haunting, and I’m now going outside to look at the sky and to feel the sun on my face.","2025-10-05T15:38:20.956Z"
"yimabean.bsky.social","When """"The Sound of Music"""" is shown, I suspect that as each Trump year passes, fewer Americans are cheering during this scene.","2025-10-04T20:45:09.982Z"
"yimabean.bsky.social","JD VANCE: """"My mother got the drugs that almost killed her from Mexicans."""" REALITY: JD's mother got the drugs that almost killed her from her hospital patients, whom she stole from.","2025-10-05T00:05:00.246Z"
"yimabean.bsky.social","Donald is *not* going to be happy about Bad Bunny hosting SNL. The only thing that would make this better is if Bad Bunny wins an Emmy, something Donald used [?] to want with the pathetic public desperation he now shows in wanting a Nobel Peace Prize.","2025-10-05T00:11:00.356Z"
"yimabean.bsky.social","Christian nationalist fascism: when they lower masked Gestapo goons from helicopters in the night to smash apartment windows, terrorize residents, and zip-tie and kidnap children for not being white looking enough— and then violate the 1st Amendment by reciting scripture from a government account.","2025-10-05T18:09:27.296Z"
"yimabean.bsky.social","January 6 was basically a training session for upcoming ICE agents.","2025-10-05T18:21:35.097Z"
"yimabean.bsky.social","Soon, the majority of government shutdown days *in all of US history* will have happened on Donald Trump's watch.","2025-10-05T18:28:34.100Z"
"yimabean.bsky.social","The Opportunistic Lies vs. The Pleasant Reality","2025-10-05T19:15:16.948Z"
"yimabean.bsky.social","Just like the movie """"Weekend at Bernies"""". This mentally and cognitively dead president is being propped up by Stephen Miller/right wing radicals and Wall Street opportunists for their benefit. They are the puppeteers, and dead Trump is the puppet. They control the destiny of all of us! CHILLING!","2025-10-05T19:09:35.027Z"
"yimabean.bsky.social","““They dragged little Greta [Thunberg] by her hair before our eyes, beat her, and forced her to kiss the Israeli flag. They did everything imaginable to her, as a warning to others,” the Turkish activist ErsinÇelik, a participant in the Sumud flotilla, told Anadolu news agency.”+","2025-10-04T18:21:46.883Z"
"yimabean.bsky.social","👏👏","2025-10-05T12:24:41.514Z"
"yimabean.bsky.social","It was clear from the beginning that ICE staffing up was going to be a full employment program for racists, barroom bullies and wife beaters","2025-10-05T01:10:49.555Z"
"yimabean.bsky.social","Even if you support massive deportation operations, under no circumstances should ANYONE be ok with US citizens being forcibly removed from their homes and detained without explanation. This is a clear violation of their constitutional rights and should universally condemned.","2025-10-04T21:04:41.356Z"
"yimabean.bsky.social","Free Greta Thunberg and the rest of the illegally detained flotilla activists.","2025-10-04T22:12:27.896Z"
"yimabean.bsky.social","Maybe we should try Ctrl+Alt+Del on the United States right now 🥴🥴","2025-10-04T02:33:12.508Z"
"yimabean.bsky.social","Excellent plan, my man!","2025-10-04T21:27:05.552Z"
"yimabean.bsky.social","Yeah. They were always in the background and at the ready but I won’t say my theories. This 50/50 attitude must stop.","2025-10-04T21:25:40.298Z"
"yimabean.bsky.social","In order for the United States to become a party to the International Criminal Court and have our officials be subject to trial at The Hague, the US Senate would need to ratify the Rome statute by a two-thirds vote. Let’s start running on that.","2025-10-04T03:03:03.419Z"
"yimabean.bsky.social","GOP Leaders LOSES CONTROL in PUBLIC as SHUTDOWN RUINS THEM","2025-10-04T18:48:32.000Z"
"yimabean.bsky.social","Joy Reid slams 'mean girl' Megyn Kelly as 'the blonde Laura Loomer' in scathing takedown","2025-10-04T18:48:31.000Z"
"yimabean.bsky.social","You GO Lady! Can’t think of anyone more deserving.","2025-10-04T21:20:35.898Z"
"yimabean.bsky.social","Well of course they are. No stops on anything.","2025-10-04T20:59:11.867Z"
"yimabean.bsky.social","He is SO PATHETIC.","2025-10-04T20:58:31.659Z"
"yimabean.bsky.social","Whenever Trump is missing for a few days Saturday comes and they roll away the stone for golf.","2025-10-04T12:53:37.827Z"
"yimabean.bsky.social","Of course.","2025-10-04T20:55:09.416Z"
"yimabean.bsky.social","Miller will need a full and unconditional pardon when Trump goes, and If you need a full and unconditional pardon, maybe, just maybe, you weren’t serving the people","2025-10-04T18:38:47.329Z"
"yimabean.bsky.social","The inept Trump administration is too stupid to stop creating evidence that can be used to show the court that the indictment of James Comey was not because he was guilty of any crime, but so the vengeful Donald Trump could humiliate him and make him suffer.","2025-10-04T00:44:59.752Z"
"yimabean.bsky.social","Agreed.","2025-10-04T20:48:57.628Z"
"yimabean.bsky.social","JD Vance talks to women like a controlling guy who's always hiding his wife's car keys.","2025-10-04T19:35:00.027Z"
"yimabean.bsky.social","omg. I can’t even. Much love and respect to Joy. Loved your show and your laugh.","2025-10-04T20:48:31.142Z"
"yimabean.bsky.social","The Nobel Prize winners will be announced next week. We should flood the Oval Office with calls so that every time Donald hears the phone ring, he gets his giddy little hopes up. www.pbs.org/newshour/wor...","2025-10-04T19:39:37.573Z"
"yimabean.bsky.social","The obscene face of Christian Nationalism: outlandish untaxed wealth in defiance of Jesus. Oh, and this time, slave laborers, too! Glory! Just remember, for any money you give to Heaven, there is always a 100% handling fee here on Earth.","2025-10-04T19:48:06.214Z"
