"user","post","date"
"yimabean.bsky.social","He was regular beaten with a plastic pipe and survived on a paltry diet of ground-up fish heads: The horrors of Ukraine's """"civilian hostages"""" seized and held in Russia's modern gulag. www.nytimes.com/2025/11/29/w...","2025-12-01T14:44:15.667Z"
"yimabean.bsky.social","""""American stocks are up. But guess what? They're up more everywhere else.""""","2025-11-30T22:56:38.364Z"
"yimabean.bsky.social","We're #20! (Of 23.)","2025-12-01T12:52:02.348Z"
"yimabean.bsky.social","Teflon Don strikes again.","2025-12-01T14:57:58.864Z"
"yimabean.bsky.social","Thank you to all the volunteers! Rep. Aftyn Behn reported that more than 600 volunteers turned out and knocked on 13,000 doors. Let’s flip TN’s 7th District! And if you’ve got time, they still need help!","2025-12-01T01:02:42.269Z"
"yimabean.bsky.social","Hard to accept indeed.","2025-12-01T14:54:53.161Z"
"yimabean.bsky.social","Let’s Go!","2025-12-01T12:30:42.380Z"
"yimabean.bsky.social","Glad to join ya!","2025-12-01T12:31:24.362Z"
"yimabean.bsky.social","It’s clear that Republicans are very worried about the upcoming special election in a Tennessee district that Trump won by double digits. Help us GOTV for @aftynbehn.bsky.social (a state representative and former Indivisible organizer) before Election Day on Tuesday: www.mobilize.us/indivisible/...","2025-12-01T01:11:52.211Z"
"yimabean.bsky.social","Actually, he should get a prize for the biggest liar of all time.","2025-12-01T14:51:14.916Z"
"yimabean.bsky.social","Tom Stoppard. One of the great writers. An epic wordsmith whose craft was such that one only compares themselves to him aspirationally. ROSENCRANTZ AND GUILDENSTERN ARE DEAD. SHAKESPEARE IN LOVE. BRAZIL. EMPIRE OF THE SUN. BILLY BATHGATE. ANNA KARENINA. Stage, screen, print. A genius. Rest in peace.","2025-11-29T18:02:32.948Z"
"yimabean.bsky.social","""""True individual freedom cannot exist without economic security and independence. People who are hungry and out of a job are the stuff of which dictatorships are made.” —FDR, 1944","2025-11-30T20:08:27.775Z"
"yimabean.bsky.social","Department of Defense Law of War Manual, Sec. 18.3.2.1 states the """"requirement"""" to refuse illegal orders. What’s its key example? Wait for it . . . It’s """"orders to fire upon the shipwrecked.""""","2025-12-01T13:48:59.972Z"
"yimabean.bsky.social","“Pete Hegseth does not have the power to murder. The United States of America is a nation of laws, and the fascists in power have made a bet they can’t cover.” steveschmidt.substack.com/p/war-crimin...","2025-12-01T14:41:43.561Z"
"yimabean.bsky.social","The D.C. police are now having to guard National Guard members.","2025-11-29T22:38:34.197Z"
"yimabean.bsky.social","A U.S. soldier was executed on the streets of the U.S. capital, yet the flags remain at full-staff. But when a hate-peddling podcaster was killed, the flags were lowered to half-staff within hours—and stayed that way for days. WTH? Tonight...","2025-11-30T02:40:13.613Z"
"yimabean.bsky.social","That would be a NO. A hard NO.","2025-12-01T14:43:37.677Z"
"yimabean.bsky.social","When your foundation shade is “nuclear sunset.”","2025-11-30T19:37:00.528Z"
"yimabean.bsky.social","You think that the years of ridicule would alter the shade in someway, but I guess falling on deaf ears, and dumb brain.","2025-12-01T14:41:13.387Z"
"yimabean.bsky.social","They’re simultaneously arguing that soldiers have to follow all orders from the president, legal or not, but they get to ignore orders from a federal judge if they feel they’re not legal.","2025-11-30T17:43:44.887Z"
"yimabean.bsky.social","#SuperSundayParties🎉 @57kev.bsky.social @oneveteransoath.bsky.social @candycemv1.bsky.social @ferallioness77.bsky.social @judithbolyard.bsky.social @suzzisulli.bsky.social @paulamurphypounds5.bsky.social @miamac88.bsky.social @firehawkjw.bsky.social @stephen5150.bsky.social @ltwlauren.bsky.social","2025-12-01T00:10:11.434Z"
"yimabean.bsky.social","@lagunabeachdems.bsky.social @neverstopthefight.bsky.social @waysideleslie.bsky.social @lsto4.bsky.social @wisewonders.bsky.social @gnarchynow.bsky.social @pattyger.bsky.social @lilmudda.bsky.social @blueskyvets.bsky.social @vallahha.bsky.social @bluestormcomin1.bsky.social @ltwlauren.bsky.social","2025-12-01T00:18:29.967Z"
"yimabean.bsky.social","Alina Habba’s parents emigrated to the US from Iraq citing persecution.","2025-11-30T16:06:45.401Z"
"yimabean.bsky.social","He doesn’t know what part of the body they did an MRI on. Sounds plausible. bsky.app/profile/acyn...","2025-12-01T00:15:11.295Z"
"yimabean.bsky.social","Such a complete and total ass. 🫏","2025-12-01T00:19:55.592Z"
"yimabean.bsky.social","This!","2025-11-30T23:36:07.308Z"
"yimabean.bsky.social","BREAKING: This is huge news, the EU's equivalent of the 🇺🇸Supreme Court's 2015 Obergefell v. Hodges ruling. 🇪🇺Court of Justice just ruled all 🇪🇺countries must recognise same-sex marriages granted in other member states. This effectively legalises gay marriage across 🇪🇺","2025-11-25T10:10:41.204Z"
"yimabean.bsky.social","They made fun of me on Fox for saying this (oh, the layers of irony) www.politico.com/news/magazin...","2025-11-25T19:54:52.259Z"
"yimabean.bsky.social","Trump loves a paralipsis.","2025-11-25T18:56:56.342Z"
"yimabean.bsky.social","If you read this before, it’s okay to read this again. If you haven’t read this, you can read it now. And repost it to share w/ other readers.","2025-11-27T04:07:51.627Z"
"yimabean.bsky.social","""""We followed everything we were supposed to do"""" Legitimate green card applicants with US spouses are being arrested by armed, masked men at scheduled immigration interviews, taken away from their children, sent to prison www.nytimes.com/2025/11/26/u...","2025-11-27T11:55:36.963Z"
"yimabean.bsky.social","Part of why Trump won in 2016 was he was an """"outsider"""" who promised to """"end corruption."""" He did not end corruption, he is a big """"to the victor belongs the spoils of the enemy"""" guy. He's a spoiled and corrupt person, who has spoiled and corrupted his party and government. That story sells itself.","2025-11-30T18:57:40.921Z"
"yimabean.bsky.social","There’s no point in impeachment unless Rs are willing to vote for it. The senators who “try” the “case” aren’t obligated to respond to the evidence like a court jury is. That’s why they acquitted him for bribery and for insurrection. The evidence in both was overwhelming","2025-11-28T22:13:21.075Z"
"yimabean.bsky.social","Found out an old friend and co-worker of mine, an addict, had an aneurism that paralyzed him from the neck down and will kill him in the coming days. They released him from the hospital bc he had no insurance and he’s dying on someone’s couch. God bless the USA","2025-11-28T22:22:20.408Z"
"yimabean.bsky.social","Do you see how Mamdani’s approval/disapproval combine to just 65%? That’s bc 35% of the people they called had no idea who he was. If you’re reading this, you live in a bubble. You are in the information 1%","2025-11-30T23:14:50.749Z"
"yimabean.bsky.social","🤷🏼","2025-11-30T17:55:31.955Z"
"yimabean.bsky.social","The president is a political cartoon of corruption come to life, a gaudy grifter who is selling off pardons and lining his pockets, building a golden ballroom and protecting his fellow sex predator elites, all the while regular Americans are suffering and struggling to make ends meet. Run on *that*","2025-11-30T17:02:09.138Z"
"yimabean.bsky.social","When you call yourself """"Secretary of War"""" and most everyone else calls you """"Secretary of Defense"""" – we know what your motives are.","2025-11-30T01:27:34.978Z"
"yimabean.bsky.social","Empathy + Action = A Better World","2025-11-30T21:25:20.456Z"
"yimabean.bsky.social","The face of a man who realized Ukrainians are not going to sit by and watch as he sells them off to russia.","2025-11-30T18:44:42.852Z"
"yimabean.bsky.social","I'm really curious who leaked that audio. And why.","2025-11-26T04:52:32.845Z"
"yimabean.bsky.social","""""I will only comply with judges' orders when I agree with them.""""","2025-11-30T21:46:06.620Z"
"yimabean.bsky.social","Witkoff, Kushner and Trump sold out Ukraine and our allies. Thank god the info was leaked. www.wsj.com/world/russia...","2025-11-29T06:31:11.372Z"
"yimabean.bsky.social","Steve Witkoff works for Russia. Jared Kushner works for Russia. Donald Trump works for Russia. We hold these truths to be self-evident. AF.","2025-11-30T21:54:14.990Z"
"yimabean.bsky.social","Please don’t wait.","2025-11-30T21:25:16.095Z"
"yimabean.bsky.social","Just imagine Mike Johnson’s face when we get this done. Tell Congress to force a vote on extending ACA tax credits!","2025-11-30T00:57:07.652Z"
"yimabean.bsky.social","“The only people who get angry when hearing service members being told to ignore illegal orders are people who intend to issue illegal orders.”","2025-11-30T19:58:17.020Z"
"yimabean.bsky.social","Ladies and gentlemen, the President of the United States. He has brought the office down so low in such a short time. Other presidents have tried but none have come close to this.","2025-11-29T18:15:51.354Z"
"yimabean.bsky.social","All the stupid bootlicking big box stores that caved to him, are now feeling the pain. Deservedly so. #dontbuyshit","2025-11-30T20:41:06.804Z"
"yimabean.bsky.social","""""Epstein Files First Trenche"""" would be a real good headline right about now #manifesting","2025-11-30T01:15:55.498Z"
"yimabean.bsky.social","Wonderful night to watch stars. There are these new gadgets, Seestar astrophoto systems, that give amateurs a power tool to study the heavens.","2025-11-30T04:31:01.407Z"
"yimabean.bsky.social","Van Hollen: """"It's either murder from the first strike if their whole theory is wrong, and I think the weight of the legal opinion is they've concocted this ridiculous legal theory. But even if you accept it, then it is a war crime. I do believe the secretary of defense should be held accountable""""","2025-11-30T16:31:37.887Z"
"yimabean.bsky.social","So true. UGH.","2025-11-30T21:07:06.235Z"
"yimabean.bsky.social","www.queerty.com/an-early-fil...","2025-11-30T20:56:42.335Z"
"yimabean.bsky.social","The ruling is a win in federal court for ACLU, Colorado law firms who sued ICE to stop “indiscriminate” arrests and detentions.","2025-11-30T20:43:00.719Z"
"yimabean.bsky.social","Classic Karen Slayer. Watch til the end.","2025-11-30T15:51:18.396Z"
"yimabean.bsky.social","Karen might wanna hush.","2025-11-30T19:29:06.255Z"
"yimabean.bsky.social","#ResistanceUnited #ProudBlue #DV1 🗣US House TN07 Election Day Dec.02 Vote for @aftynbehn.bsky.social 💙 She’s here to: Lower Prices Fix Roads Fund Healthcare ✅ aftynforcongress.com 🙏 Share this and every other Aftyn post as you scroll by Thank you!","2025-11-30T10:13:46.972Z"
"yimabean.bsky.social","Lying needs to be OUTLAWED.","2025-11-30T20:38:11.811Z"
"yimabean.bsky.social","I spoke with Betty. She was very emotional and asked me to tell you that “she would love to give each one of you a great big hug.” We’re so close to changing her life. If you can give $5 or $10, it would be awesome. If not, I completely understand, but a repost is free. Thanks very much.","2025-11-30T19:48:33.975Z"
"yimabean.bsky.social","We went from a country that defended others from being invaded for their natural resources, to a country that is now threatening to invade others for their natural resources. Systems of governance are only as good as the people you elect to uphold them.","2025-11-30T07:01:46.905Z"
"yimabean.bsky.social","Follow the money!","2025-11-30T13:48:11.546Z"
"yimabean.bsky.social","Just a reminder Trump is a pedophile","2025-11-30T18:32:18.290Z"
"yimabean.bsky.social","Trump is cutting off immigration because his administration is incapable of doing their job and vetting them. This is a failure of his administration. All they are good at is being violence and bullying.","2025-11-29T15:11:32.427Z"
"yimabean.bsky.social","Klobuchar: """"What the president has done is taken a horrific crime that occurred in DC and went 2,400 miles away to Somali & somehow indicted an entire group of people, 80k of them in my state, as well as all naturalized citizens. This is what he does. He tries to make people hate each other.""""","2025-11-30T14:50:00.054Z"
"yimabean.bsky.social","#PedoPotus #ReleaseAllEpsteinFiles ….. the @GOP = Guardians Of Pedophilia","2025-11-30T16:17:51.264Z"
"yimabean.bsky.social","In case you’re in the mood for some good news . . .","2025-11-29T22:14:55.564Z"
"yimabean.bsky.social","When Mark Carney sets specific goals for Canada to """"diversify away"""" from its reliance on the US—making headlines in Canada but not the US—hear that for what it is: Close partners and allies looking elsewhere for better friends. This is the silent way that the US loses its pointless trade war.","2025-11-30T12:52:44.019Z"
"yimabean.bsky.social","When Canada deepens ties with China, it's not romance, it's risk management. If the U.S. keeps slapping tariffs and rewriting rules, partners diversify. Reliability is an economic asset; squander it, and trade flows and influence quietly move elsewhere.","2025-11-30T17:46:33.516Z"
"yimabean.bsky.social","“In days after Alaska, a European intel agency distributed a hard-copy report in an envelope to some of the continent’s most senior national security officials, who were shocked by the contents: Inside were details of the commercial and economic plans the Trump admin had been pursuing with Russia.”","2025-11-29T05:44:47.912Z"
"yimabean.bsky.social","The deranged madman now threatens to blow up commercial airliners flying in and out of Venezuela.","2025-11-29T14:20:20.253Z"
"yimabean.bsky.social","🎯 🎯 🎯","2025-11-29T19:03:53.270Z"
"yimabean.bsky.social","Shredded “white” meat that looks dry and tasteless. It matches KKKaroline’s personality perfectly.","2025-11-29T20:59:11.129Z"
"yimabean.bsky.social","“Ah, just one more thing, sir. You’re blowing up those boats, saying they’re filled with drugs headed for the US. But then you go and pardon the guy who brought in 400 tons of cocaine. That’s billions of doses. Help me understand that.”","2025-11-30T03:25:49.755Z"
"yimabean.bsky.social","OMG, takes one’s breath away.","2025-11-30T17:33:05.118Z"
"yimabean.bsky.social","He scammed over 1,000 people, most of whom were not wealthy - veterans, farmers, teachers, nurses, small businesses owners. Some lost everything. But he’s a rich Republican, so Trump let him get away with it. www.nytimes.com/2025/11/29/u...","2025-11-30T12:22:48.314Z"
"yimabean.bsky.social","Bash: """"Do you believe if there was a second strike to eliminate any survivors that it constitutes a war crime?"""" Mark Kelly: """"It seems to."""" Bash: """"If you received that order, would you have carried it out?"""" Mark Kelly: """"No…Going after survivors in the water is unlawful.""""","2025-11-30T14:15:03.081Z"
"yimabean.bsky.social","Trump putting the Washington Post and CBS News in his “Offender Hall of Shame,” even as they bend over backwards to curry favor tells us that nothing short of full propaganda mode will ever be acceptable to him. There's no way for a news organization to maintain credibility and be """"fair"""" to Trump.","2025-11-29T15:47:38.098Z"
"yimabean.bsky.social","Too funny.","2025-11-30T17:30:05.701Z"
"yimabean.bsky.social","Honestly can't tell if she meant """"prosecute"""" or she's just embraced the full fascist experience.","2025-11-30T15:13:39.638Z"
"yimabean.bsky.social","Maybe the fact that Trump’s entire business career was built on outrageous lies should factor in more these days.","2025-11-30T15:29:35.766Z"
"yimabean.bsky.social","When your approval rating is cratering because, among other things people think you’ve lost your grip on reality, maybe insisting it’s at a record high isn’t the move.","2025-11-30T07:04:13.870Z"
"yimabean.bsky.social","This is a highly unusual order from a Secretary of Defense, and it’s almost certainly a war crime. In the strike in question, two people survived and were clinging to the side of the ruined boat, and a second mission was spun up to execute them.","2025-11-28T20:30:13.848Z"
"yimabean.bsky.social","Mark Kelly: """"We have a president who doesn't understand the Constitution, who installed an unqualified secretary of defense. I cannot think of a secretary of defense in the history of our country that is less qualified than Pete Hegseth. He should've been fired after Signal-gate.""""","2025-11-30T14:31:19.581Z"
"yimabean.bsky.social","Ok, this has to be shared and shared and shared and shared! Thank you @preciouspetal.bsky.social !","2025-11-30T00:25:18.164Z"
"yimabean.bsky.social","They spell it out plainly in Project 2025. They want a white Christofascist nation controlled by white males with subservient females. All others are either in a servant role, slaving in worker camps, or sent to extermination camps. This is not a drill.","2025-11-30T15:21:58.549Z"
"yimabean.bsky.social","Mark Kelly: """"This president, when he says things like 'third world countries,' what is he really saying? I think what he's saying is he doesn't want brown people in our country. And that's disturbing. It's un-American.""""","2025-11-30T14:23:30.115Z"
"yimabean.bsky.social","Of course he does- his criminal record is as long as his arm. C’mon Texas. Step it up. You’ve got better than this. Nehls is a disgrace. #TexasDoBetter","2025-11-30T15:21:59.935Z"
"yimabean.bsky.social","I worked my ass off in college so I wouldn’t have to wear a shirt with my name on it and here this fucker is the President?","2025-11-30T03:48:24.442Z"
"yimabean.bsky.social","Perfect.","2025-11-30T13:44:01.587Z"
"yimabean.bsky.social","My ten year old niece grew up thinking Donald Trump was the Son of God because every time he was on TV I’d whisper, “Jesus Christ.”","2025-11-30T11:02:13.037Z"
"yimabean.bsky.social","So utterly frightening. AND his family.","2025-11-29T23:48:40.256Z"
"yimabean.bsky.social","In the first minutes after last night's russian strike on Kyiv, patrol police officers and residents together rescued a little boy from the rubble ❤️‍🩹","2025-11-29T19:33:11.656Z"
"yimabean.bsky.social","No children were killed by the mRNA shots. But the anti-vax leadership at FDA, NIH, and HHS will kill kids.","2025-11-29T19:11:11.178Z"
"yimabean.bsky.social","Still not over the fact we've just accepted them WEARING FUCKING MASKS.","2025-11-29T19:22:22.283Z"
"yimabean.bsky.social","""""The sanctity of our military""""?! WTAF?! sanc·ti·ty /ˈsaNG(k)tədē/ noun The state or quality of being holy, sacred, or saintly. Our military is *not* a religion nor a manifestation of spirituality.","2025-11-24T21:08:56.515Z"
"yimabean.bsky.social","Secretary of War Crimes 😬","2025-11-29T12:21:53.173Z"
"yimabean.bsky.social","-Feminist News","2025-11-29T11:45:58.299Z"
"yimabean.bsky.social","Ukrainian forces released videos of the operation against the two oilers Kairo and Virat in the Black Sea which tried to reach the Russian coast. The message is clear: If you are a shipowner trying to get Russian oil, expect that you will lose your whole ship.","2025-11-29T11:27:37.179Z"
"yimabean.bsky.social","The British Politician Henry Bolton OBE said that he heard that Trump is sending Jared Kushner and Steve Witkoff to Russia to tell Putin that he can have Donetsk, Luhansk, and Crimea. Trump will recognize them as Russia’s. I hope what Henry David Bolton heard is not true.","2025-11-29T18:11:51.184Z"
"yimabean.bsky.social","Demolishing the East Wing of the White House before finalizing plans for what will be built above its ruins is a near-perfect metaphor for Trump's approach to economic policy. The only difference is the wrecking crew doesn’t claim the rubble is evidence of unprecedented growth.","2025-11-29T15:46:45.369Z"
"yimabean.bsky.social","🤔","2025-11-29T01:14:50.514Z"
"yimabean.bsky.social","Lindsey Graham sponsored the Afghan Adjustment Act: “This is the right thing to do. The people who were there with us in the fight who are here in America need to stay. This will be their new home. We have a moral obligation to these people and they will make great citizens.”","2025-11-29T01:24:01.209Z"
"yimabean.bsky.social","Will someone please ask the 89 million Americans who didn't vote in the last election if they are being affected by anything this administration is doing to the other Americans?","2025-11-28T11:35:56.829Z"
"yimabean.bsky.social","Assuming every boat Trump and Hegseth blew up contained the amount of drugs they claim, Hernandez was responsible for bringing more drugs into the US than every one of them had combined. By far. And yet, Trump murders 80+ people and counting while pardoning the narco kingpin.","2025-11-29T01:41:47.243Z"
"yimabean.bsky.social","Trump’s stated justification for every single one of his despicable pardons of multiple drug traffickers, wealthy fraudsters, people who beat up cops, cronies, violent criminals, and politically connected Republicans is always the same: “I heard they were treated very unfairly.”","2025-11-29T01:51:50.551Z"
"yimabean.bsky.social","Trump said that he is pardoning Juan Orlando Hernández, the former two-term president of Honduras who was convicted last year by a U.S. jury for """"conspiring to distribute more than 400 tons of cocaine and related firearms offenses,"""" according to the DOJ. www.usatoday.com/story/news/p...","2025-11-29T11:11:31.214Z"
"yimabean.bsky.social","Seriously. I just think every day they are trying to beat us down so low we won’t be able to get up.","2025-11-28T18:55:32.678Z"
"yimabean.bsky.social","Wilson, North Carolina Freedom Fridays thru December 26","2025-11-28T17:34:05.916Z"
"yimabean.bsky.social","It’s almost impressive how Trump uses every single opportunity to be racist.","2025-11-28T02:42:19.599Z"
"yimabean.bsky.social","20-year-old West Virginia National Guard member, Sarah Beckstrom, died a day after volunteering to serve in DC so that others could enjoy Thanksgiving with their families. She deserves our gratitude, not political exploitation by a shameless president who scapegoats immigrants to swell his power.","2025-11-28T14:09:40.624Z"
"yimabean.bsky.social","in the emergency room for a snake bite and they rush in a camel to watch The Notebook","2025-11-28T16:45:22.683Z"
"yimabean.bsky.social","He is a walking talking sewer of a human being. But it will take years to uncover how many millions were killed or financially ruined because of him. Not a single good will come of his years in office. Trump will be a name like Mudd.","2025-11-28T15:56:51.636Z"
"yimabean.bsky.social","If not for Trump's filthy, disgusting political stunts, Sarah Beckstrom would be alive today.","2025-11-28T15:11:41.495Z"
"yimabean.bsky.social","Odd, that this mean white supremacist is preoccupied with other """"failed states"""" when he is busy failing our own.","2025-11-28T15:37:02.273Z"
"yimabean.bsky.social","Stephen Miller is of Ashkenazi Jewish descent. His great-grandparents inhabited the Pale of Settlement (western Russia where Jews were allowed to live) and escaped Russian pogroms and the Holocaust. All the same racist, xenophobic, ignorant things he is saying were said about his own family.","2025-11-28T15:47:27.901Z"
"yimabean.bsky.social","""""My poll numbers have never been better.""""","2025-11-28T15:53:48.984Z"
"yimabean.bsky.social","""""Donald Trump was so inconsolable about National Guard troops being in critical condition, solely because he had callously used them as props, he went golfing. Again.""""","2025-11-28T16:01:10.311Z"
"yimabean.bsky.social","Stephen Miller and the other white supremacists in the Trump administration (i.e., the rest of the Trump administration) are furious that today is known as """"Black Friday"""" instead of """"White Friday."""" Executive Order forthcoming!","2025-11-28T16:06:32.153Z"
"yimabean.bsky.social","Army Specialist Sarah Beckstrom, 20, would be alive today if Donald J. Trump hadn't callously used her as a prop to provoke violence he wished to opportunistically use as a pretext to impose authoritarian rule.","2025-11-28T17:01:49.162Z"
"yimabean.bsky.social","Knowing what we know now, the creep factor is high on this one. Epstein’s Lolita Express took its last flight in 2016 and sat abandoned at Georgia’s Brunswick Airport when photographed in 2020. This is the same jet that’s believed to have carried his trafficking victims & long list of secret VIPs.","2025-11-28T15:42:14.510Z"
"yimabean.bsky.social","I know our inclination is to buy this weekend from companies touting lower prices (Amazon, Target & Walmart). Resist the urge. The only way to force greedy corps to lower prices to acceptable levels, paying living wages, & end discriminatory practices is to withhold your money. #WeAintBuyingIt","2025-11-28T16:02:49.837Z"
"yimabean.bsky.social","It's wholesome and oddly depressing to me that Al Gore, 77, not owing anyone shit, is still criss-crossing the globe full-time warning people about climate change, raising money for climate projects, mentoring the next generation of environmentalists, and generally being obsessed with this issue.","2025-11-28T15:18:45.214Z"
"yimabean.bsky.social","TL;DR from Antrhopic: """"Terrorists beat our cockpit door locks by pretending to be pilots & crashed the plane into a building. Don't worry! We've upgraded detection & banned those accts from flying! Pilots need these planes to stop future terror, so we're building BIGGER planes w/ the same locks.""""","2025-11-28T16:37:15.878Z"
"yimabean.bsky.social","youtube.com/watch?v=R-u9...","2025-11-28T16:40:21.289Z"
