"user","post","date"
"yimabean.bsky.social","We need to FIX THIS PEOPLE. ASAP.","2026-02-18T00:51:28.362Z"
"yimabean.bsky.social","LEFT: Someone who appears in the Epstein files over a million times. Epstein called him his """"best friend."""" RIGHT: Someone never mentioned in the Epstein files—even once. And she never met him. So guess which one is being hauled before our corrupt, cover-upping Congress to testify about Epstein.","2026-02-18T00:48:42.514Z"
"yimabean.bsky.social","Deeply sickening.","2026-02-18T00:50:35.343Z"
"yimabean.bsky.social","Summary of current events: The US had an Iran strike package teed up and ready to launch in mid-late January. Bibi told Trump his plans weren’t big enough. Now we’re sending everything with wings to the Middle East.","2026-02-17T13:15:15.355Z"
"yimabean.bsky.social","How is it possible that Kristi Noem still has this job. Imagine if you’re a family member or a shipmate of this guardsman. www.nbcnews.com/politics/imm...","2026-02-17T15:17:01.472Z"
"yimabean.bsky.social","Depravity-total.","2026-02-17T21:03:07.547Z"
"yimabean.bsky.social","Donald...NO. You. Have. NOT. Been. """"Totally."""" """"Exonerated."""" That's a lot of sh*t.","2026-02-17T20:35:28.949Z"
"yimabean.bsky.social","Piled HIGH and DEEP! You are the CREEP.","2026-02-17T20:47:09.205Z"
"yimabean.bsky.social","Oh, I feel it! So do the perps/enablers. Hammer them purposely and relentlessly. As the walls close in, some will crack under pressure. That's how this gets cracked open.","2026-02-17T00:49:38.739Z"
"yimabean.bsky.social","We're watching the """"pride before the fall"""" of the arrogant Epstein Class as their elite impunity dissolves. We've known about their massive corruption for decades yet felt powerless against them. They went too far participating in the kidnapping/terrorizing/torture/murder of little girls and boys.","2026-02-17T01:47:12.738Z"
"yimabean.bsky.social","This article is on *fire*. Thanks, @therealjackhopkins.bsky.social .","2026-02-16T23:30:35.113Z"
"yimabean.bsky.social","To the good people of the United States of America...keep squashing those proposed detention centers. They. Cannot. Be. Built. They cannot.","2026-02-17T02:48:02.226Z"
"yimabean.bsky.social","Certainly deserved. Should be ZER0.","2026-02-17T02:35:34.451Z"
"yimabean.bsky.social","Yes.","2026-02-17T02:33:56.165Z"
"yimabean.bsky.social","France has confirmed that a special prosecutorial team will review the Epstein files. More countries should be doing the same. 👏","2026-02-15T22:14:20.619Z"
"yimabean.bsky.social","If you are taking a bus or ferry today and are frustrated by the holiday schedule, I want to take this moment to remind you that council is talking about TAKING AWAY service on Sundays and Holidays. Really REALLY think about that.","2026-02-16T14:09:41.128Z"
"yimabean.bsky.social","Standing up to racism shouldn’t be a partisan issue. Trump posts an objectively racist video, and MAGA is silent. All while he continues to nominate bigots and dine with Holocaust deniers. It’s clear who this President is. And it should disgust all of us.","2026-02-16T18:23:10.266Z"
"yimabean.bsky.social","Continually disgusted not only by the blatant Islamophobia and racism, but also by the Republican Party’s embrace of Fine and his views. Utterly disqualifying in a United States Congressman, as it would be in any job. newrepublic.com/post/206611/...","2026-02-16T22:44:58.810Z"
"yimabean.bsky.social","www.aol.com/entertainmen... Translation? The network’s a clown show","2026-02-17T01:43:06.450Z"
"yimabean.bsky.social","I still can’t get over Pam Bondi fighting to keep a dog from orphaned children after Hurricane Katrina. What a vile woman.","2026-02-15T15:07:11.884Z"
"yimabean.bsky.social","Someone needs to tell her that she’s too old for him.","2026-02-15T18:59:23.494Z"
"yimabean.bsky.social","Release the rest of the Epstein Files.","2026-02-15T21:12:02.371Z"
"yimabean.bsky.social","Twice. With a cactus 🌵","2026-02-17T01:07:53.543Z"
"yimabean.bsky.social","Reuters: New Mexico lawmakers on Monday passed legislation to launch what they said was the first full investigation into what happened at Zorro Ranch, where the late U.S. sex offender Jeffrey Epstein is accused of trafficking and sexually assaulting girls and women.","2026-02-17T00:25:18.370Z"
"yimabean.bsky.social","For anyone keeping track of the Iran buildup, we’ve now sent more AWACS into theater. Curious to see how tomorrow’s talks go, but it’s pretty clear the administration isn’t planning for them to be good.","2026-02-17T00:40:17.197Z"
"yimabean.bsky.social","Just a follow up about more barriers to voting if the SAVE Act is passed @psychopete.bsky.social","2026-02-17T01:07:59.771Z"
"yimabean.bsky.social","US had almost *no* job growth in 2025. Hiring numbers were revised down by over a million jobs. Largest annual revision in over 20 years. www.nbcnews.com/business/eco...","2026-02-16T17:30:43.836Z"
"yimabean.bsky.social","The worst case scenario for an AOC presidential run in 2028 is that she’s setting herself up for 2032 or 2036. She is going to be president someday—it’s just a matter of time.","2026-02-16T14:13:09.479Z"
"yimabean.bsky.social","Ossoff: """"Among today's false prophets are the election deniers who indulge this president's obsession with overturning the 2020 election. Hear me when I say this -- they tell a lie so absurd, and therefore so debasing, that the act of telling it proves the teller's total and humiliating submission.""""","2026-02-16T17:22:28.125Z"
"yimabean.bsky.social","Hope so!","2026-02-17T00:47:23.453Z"
"yimabean.bsky.social","If the shoe fits…","2026-02-17T00:36:02.493Z"
"yimabean.bsky.social","Massie not backing down.","2026-02-16T20:26:04.084Z"
"yimabean.bsky.social","“They’re kidnapping my grandpa!” 🥴","2026-02-16T21:42:45.186Z"
"yimabean.bsky.social","Well well well","2026-02-13T21:26:29.690Z"
"yimabean.bsky.social","Raskin: What makes somebody a good lawyer? You have to identify with the people who are the victims of injustice — not with their perpetrators. So I would say to Pam Bondi: If you’re going to stand with the victimizers and not the victims, then you’re not a real lawyer.","2026-02-14T23:25:50.767Z"
"yimabean.bsky.social","There are concentration camps in the USA. People are being disappeared. One facility has 3,500 people, most of them children. Now, what are we going to do about it?!","2026-02-16T21:43:22.465Z"
"yimabean.bsky.social","CBS News’s Bari Weiss is set to lose one of her network’s biggest stars. Anderson Cooper has declined a contract renewal with CBS and will leave 60 Minutes ahead of the fall season. www.thedailybeast.com//maga-curiou...","2026-02-16T22:39:40.283Z"
"yimabean.bsky.social","Does that seem fair to you?","2026-02-16T23:11:32.596Z"
"yimabean.bsky.social","Absolutely 👇 💯% True.......","2026-02-15T12:17:45.764Z"
"yimabean.bsky.social","To borrow from critic Mary McCarthy, Every word they say is a lie, including """"and"""" and """"the.""""","2026-02-15T19:44:30.153Z"
"yimabean.bsky.social","A foolish person who had the shortest run as Britain's Prime Minister poses with a statue of an ancient garden gnome in a tacky club.","2026-02-15T19:57:22.374Z"
"yimabean.bsky.social","So pitiably laughable.","2026-02-16T23:52:42.415Z"
"yimabean.bsky.social","Oh, look! The New York Times mocks the intelligent and articulate AOC for how she spoke while is constantly covers for the loopy, incoherent Donald Trump.","2026-02-16T19:37:53.237Z"
"yimabean.bsky.social","I'm sure it is just a coincidence that this announcement comes after it was discovered that partisan hack Bari Weiss was working to cut Anderson Cooper's 60 Minutes piece on Trump *loving* immigrants—but only if they are white South Africans. www.breakermedia.com/p/scoop-ande...","2026-02-16T23:04:47.138Z"
"yimabean.bsky.social","And so it is.","2026-02-16T23:43:04.219Z"
"yimabean.bsky.social","Normally we use the term """"witch hunt"""" to imply a pointless pursuit of non-existent villains and, um, buddy ...","2026-02-16T23:10:14.439Z"
"yimabean.bsky.social","The herculean task of repairing our international relationships would be a good problem to have, because it would mean this is all over and we're at least back to some semblance of normalcy. We aren't there unfortunately, we're still in the nightmare and there's no saying if and when it will happen.","2026-02-16T22:35:21.641Z"
"yimabean.bsky.social","Billionaire Trump Donor Closing U.S. Plant and Moving Work to China newrepublic.com/post/206603/... via @newrepublic.com","2026-02-16T22:57:39.303Z"
"yimabean.bsky.social","JUST IN: The FBI did interview a credible witness against Trump. #Epstein","2026-02-15T22:09:30.484Z"
"yimabean.bsky.social","Ghislaine Maxwell, a convicted child sex trafficker, gets gardening time, sports, therapy dogs, and spa products in prison. Migrant children in custody are sleeping on concrete floors without enough food or clean water. Our priorities are so fucked.","2026-02-16T05:57:56.204Z"
"yimabean.bsky.social","Resistance infrastructure.","2026-02-15T13:38:02.691Z"
"yimabean.bsky.social","How mandatory national service — not military service — would benefit young adults.","2026-02-16T04:04:18.363Z"
"yimabean.bsky.social","www.post-gazette.com/sports/gene-...","2026-02-15T13:59:48.279Z"
"yimabean.bsky.social","Thanks to @genecollier.bsky.social for a great piece on the man Larry Brown called “ the greatest player I ever saw,” and he saw them all. And thanks very much for showcasing my parents and their role breaking down the NBA’s 100% bogus blacklisting.1st victory ever against a major sports league.","2026-02-15T21:40:12.910Z"
"yimabean.bsky.social","www.nbcnews.com/news/us-news...","2026-02-15T06:23:33.367Z"
"yimabean.bsky.social","www.chicagotribune.com/2026/02/14/c...","2026-02-15T06:24:37.407Z"
"yimabean.bsky.social","lol """"you could get whatever the dust is down there..."""" stirring words from the commander in chief","2026-02-16T17:31:09.699Z"
"yimabean.bsky.social","Can’t be overstated.","2026-02-16T18:16:26.955Z"
"yimabean.bsky.social","Let's put Trump's name on something that deserves to be named after him","2026-02-11T17:54:18.464Z"
"yimabean.bsky.social","If the Act goes into affect, stay on top of what is required for you to be able to vote. Cheating is the only way the GOP can hold onto power","2026-02-12T18:53:52.452Z"
"yimabean.bsky.social","The world is waiting","2026-02-14T18:47:03.776Z"
"yimabean.bsky.social","If Dems were rigging elections we'd all be better off","2026-02-15T20:09:18.630Z"
"yimabean.bsky.social","This administration lies to everyone, why did ICE think they would be exempt?","2026-02-16T18:08:32.438Z"
"yimabean.bsky.social","There’s a paywall and VF doesn’t allow gifting articles but this one by Tara Palmeri is so good. www.vanityfair.com/news/story/e...","2026-02-16T14:25:39.108Z"
"yimabean.bsky.social","Never forget the fact that the very first iteration of FB, as The Face Book, created by him was for rating the hotness of girls on his campus. Arguably this is the ethical foundation of all his work.","2026-02-15T23:22:24.487Z"
"yimabean.bsky.social","NEW: One of the most progressive institutions in the U.S., The New School, has begun destroying its humanities departments. They have cancelled one of their most popular classes, """"Global Soccer and World Politics."""" We are going to teach it anyway. karenattiah.substack.com/p/the-new-sc...","2026-02-16T15:58:00.831Z"
"yimabean.bsky.social","These Navy officers and their Commander In Chief have made us a criminal nation. www.bbc.com/news/article...","2026-02-16T03:52:33.338Z"
"yimabean.bsky.social","Yeah, we know.","2026-02-16T15:30:24.123Z"
"yimabean.bsky.social","Alexei Navalny died on February 16, 2024, at age 47 www.reuters.com/world/kremli...","2026-02-16T15:58:10.086Z"
"yimabean.bsky.social","Right-wing Heritage Foundation’s own data shows fewer than 100 noncitizens voted since 1982 (!!!) This is not a real problem. “The SAVE ACT is a Trojan horse to nationalize elections”: open.substack.com/pub/thiswill...","2026-02-16T15:23:58.555Z"
"yimabean.bsky.social","After a year of spectacular deregulation, “the United States will essentially have no laws on the books that enforce how efficient America’s passenger cars and trucks should be.” www.nytimes.com/2026/02/16/c...","2026-02-16T15:58:10.484Z"
"yimabean.bsky.social","""""The interview was conducted July 24, 2019, and entered into the FBI’s case files on August 9, the day before Epstein was found dead in his jail cell.""""","2026-02-15T20:54:37.361Z"
"yimabean.bsky.social","I don’t mean to ruin anyone’s weekend, but I definitely could see Desantis taking Kristi Noem’s job. They also have never liked each other so wouldn’t shock me if he’s lobbying for it.","2026-02-16T00:25:04.078Z"
"yimabean.bsky.social","Oh.","2026-02-15T22:12:12.804Z"
"yimabean.bsky.social","🚨🔅Scott Galloway's Brutal Take on the """"Epstein Class"""" – They've Damaged America Why Should You Care About Epstein? Because You're Not in the """"Epstein Class"""" Jim Acosta 2/15/2026 www.youtube.com/watch?v=q7GI... #Epstein #EpsteinFiles #EpsteinGate #EpsteinAndTrump #EpsteinClass","2026-02-15T16:29:47.877Z"
"yimabean.bsky.social","And it begins - the #EpsteinFiles Analysis.","2026-02-15T18:05:43.630Z"
"yimabean.bsky.social","Measles is a bellwether. Because it’s the most contagious vaccine-preventable disease, when vaccination rates drop, it’s the first to start spreading. Now we’ve got mumps rolling up. Expect more. This is just the beginning of RFK Jr.’s successful infectious disease reintroduction plan.","2026-02-14T23:34:29.368Z"
"yimabean.bsky.social","It's been 222 days since the Epstein files story broke. No one in America has paid any price. Will anyone? When will Republicans wake up and do their jobs?","2026-02-14T16:41:15.906Z"
"yimabean.bsky.social","The President of the United States raped underage women. Attorney General Pam Bondi has seen the proof in the Epstein files and doesn't care. Thank you for your attention to this matter.","2026-02-14T04:30:20.494Z"
"yimabean.bsky.social","Translation: I will steal this election, and my lawyers will find a thin excuse to justify it.","2026-02-13T23:03:22.970Z"
"yimabean.bsky.social","Voluntarily—and vigorously—raises hand.","2026-02-14T19:09:58.260Z"
"yimabean.bsky.social","Sort of gives away the lie that they're arresting hardened criminals who are drags on society when they're setting up traps to lure in Good Samaritans","2026-02-15T01:10:01.192Z"
"yimabean.bsky.social","So SICK.😡😡","2026-02-15T01:51:58.719Z"
"yimabean.bsky.social","#PedoTrump #Epstein #EpsteinFiles","2026-02-13T19:14:05.024Z"
"yimabean.bsky.social","The text on the center flyer reads: ICE goons: You will face justice in this life and the next. You will rot in jail, and burn in hell. Resign. Repent. Repay. The other fliers simply say ICE OUT with a flower. www.nytimes.com/2026/02/13/t...","2026-02-15T00:29:47.024Z"
"yimabean.bsky.social","NFL franchise owners in the EPSTEIN e-mails & assorted docs Partial list: *Robert Kraft, owner of the New England Patriots *Steve Tisch, co-owner of the New York Giants *Stephen Ross, owner of the Miami Dolphins *Zygi Wilf, owner of the Minnesota Vikings *Arthur Blank, owner of the Atlanta Falcons","2026-02-14T19:30:09.142Z"
"yimabean.bsky.social","“I’ve never protested before - but I just watched 4th & 5th grade kids run away from our own government.” 😕🇺🇸💔 (From @crindivisible.bsky.social )","2026-02-15T00:45:31.147Z"
"yimabean.bsky.social","The Convicted FElon hasn't paid the US dues to the UN for 2025 of $4 billion. Unfortunately, the Convicted FElon hates the UN & wants to create a board of peace (Board of Evil). If the Convicted FElon doesn't pay the dues this year, the UN will go bankrupt & collapse. youtu.be/l089a5j_ma8?...","2026-02-14T20:31:48.753Z"
"yimabean.bsky.social","Donald is hellbent to steal another election... It's become a pattern. A thing... And he plans, has vowed to interfere with, your state run elections. Newsom today said, """"...gone in three years..."""" Folks, that's not very reassuring. I don't believe you're gonna survive it... 💯💯💯Certainly not well.","2026-02-13T22:40:22.104Z"
"yimabean.bsky.social","She's not a real human","2026-02-14T23:27:12.198Z"
"yimabean.bsky.social","Unclear to me if there’s anything illegal there, but it certainly makes them look guilty / scared as fuck. When you have to monitor which of the pedo files people are finding, you’re not on the right side of history.","2026-02-14T01:44:38.420Z"
"yimabean.bsky.social","Susan Collins has apparently decided to give Republicans the votes needed to pass the SAVE Act. This is a three-alarm emergency. We must act swiftly. Tell every Senator right now we absolutely cannot let this pass:","2026-02-14T01:54:47.374Z"
"yimabean.bsky.social","Although I admire Massie’s partnering with Ro Khanna surrounding the Epstein files, he’ll never be able to swing centrist enough to overcome his Xmas gun greetings. MIT trained, he’s like those Ivy League folk who move back home with an air of superiority: Vance, Cruz, Cotton, Kennedy, Stefanik…","2026-02-14T11:44:27.846Z"
"yimabean.bsky.social","The most corrupt pro-Putin president in US history endorses the most corrupt pro-Putin leader in Europe.","2026-02-13T15:49:16.659Z"
"yimabean.bsky.social","🥱OMG🥱😡😡😡","2026-02-13T23:28:23.747Z"
"yimabean.bsky.social","I’m tired of the ignorance of voters saying “idk what the big deal is about requiring id to vote”🤦🏽‍♀️ ppl take a civics class & understand the 24th Amendment makes poll taxes ILLEGAL! Ah yes that word illegal. You can’t make ppl PAY for a document to vote… it violates the constitution, so no SAVE Act!","2026-02-13T14:48:54.837Z"
"yimabean.bsky.social","#Epstein #EpsteinFiles","2026-02-12T19:19:25.616Z"
"yimabean.bsky.social","AOC: """"Extreme level of wealth inequality leads to social instability and drives authoritarianism, right-wing populism, and really dangerous domestic internal politics. That is a direct outcome of the failure of democracies over decades to deliver.""""","2026-02-13T17:50:54.266Z"
"yimabean.bsky.social","At the Munich Security Conference, European powers are contemplating the end of America’s unrivaled power—and discussing their own nuclear deterrence, Isaac Stanley-Becker reports:","2026-02-13T23:26:03Z"
"yimabean.bsky.social","LFG ALREADY","2026-02-13T23:26:13.685Z"
"yimabean.bsky.social","Two of them were convicted drug traffickers. But hey, they were former NFL players so they shouldn’t have to endure those kinds of things on their records. As usual, follow the money.","2026-02-13T10:46:21.369Z"
"yimabean.bsky.social","... From when she was protecting him in FloriDUH ... B.O. - Berore Ozempic ... Luckily for her she wasn't stinky's """"type"""" ... to tubby ...","2026-02-13T22:26:22.257Z"
"yimabean.bsky.social","I think they are desperately terrified of what's coming and will try anything to escape it.","2026-02-13T21:42:20.295Z"
"yimabean.bsky.social","In Belgian newspaper today:","2026-02-13T21:32:59.313Z"
"yimabean.bsky.social","It's clearly a cover up, and they think we’re all stupid and won't notice.","2026-02-13T21:30:13.754Z"
"yimabean.bsky.social","noem and lewandowski are like the most toxic couple you have ever met given full rein of a government agency www.wsj.com/politics/pol...","2026-02-13T13:00:35.308Z"
"yimabean.bsky.social","🧐","2026-02-13T21:15:12.514Z"
"yimabean.bsky.social","Sanders: The American people do not want this country to be an authoritarian society or an oligarchy. We have our differences, that’s what democracy is about—we argue it out. We don’t throw people who disagree in jail. We don’t intimidate the media. We don’t send ICE agents to shoot people.","2026-02-13T20:20:09.815Z"
"yimabean.bsky.social","How utterly embarrassing. It’s not the pilot’s job to remember cosplay Barbie’s blankie.","2026-02-13T16:28:23.698Z"
"yimabean.bsky.social","Slavery is white history, how we survived it is Black history. - Malcolm Jamal Warner Pic of the day #photography","2026-02-13T15:44:02.787Z"
"yimabean.bsky.social","🎩 Our government’s been using Epstein’s blackmail information for decades I believe it’s one of the main reasons we can’t have a functioning government Removing everyone implicated in the Epstein files is the key to taking our country back We need to rip these people out of power! #America","2026-02-13T00:58:27.115Z"
"yimabean.bsky.social","How the fuck is Corey Lewandowski in any position to fire a Coast Guard pilot? What is his title? What is his job? What is his official position in the US government? If you are Kristi Noem’s boyfriend you get to fire Coast Guard officers?","2026-02-13T11:56:00.852Z"
"yimabean.bsky.social","In his confirmation hearings, Robert F. Kennedy Jr. told U.S. senators that he would not cut funding for vaccine research or change the nation's official vaccine recommendations. He did both. n.pr/46QDn9p","2026-02-13T14:20:00.970120Z"
"yimabean.bsky.social","ALL OF THEM! UNREDACTED! NOW!","2026-02-12T17:15:04.079Z"
"yimabean.bsky.social","Trump repeals landmark legal policy underpinning key climate rules. This repeal will put the deaths of millions of human beings in the future on the hands of Trump. He said he doubt he will go to heaven. This guarantees he won’t. Investigate how he & donors profit from this.","2026-02-12T18:53:29.316Z"
"yimabean.bsky.social","#Resist #Epstein #EpsteinFiles","2026-02-12T18:57:07.958Z"
"yimabean.bsky.social","Hey there Pam Bondi if you have nothing to hide why were you tracking what congressmen were searching on the Epstein files? Why uh…. Why…. Why so nervous?","2026-02-13T14:27:43.159Z"
"yimabean.bsky.social","If you can, please donate. And if everyone could please share. www.gofundme.com/f/donate-to-...","2026-02-12T17:09:13.693Z"
"yimabean.bsky.social","I remember a time when even the merest whiff of any scandal or impropriety could destroy a person's political career for all eternity. I miss that.","2026-02-13T15:05:32.648Z"
"yimabean.bsky.social","The government has time to defend an ICE shooting on TV, but not to answer the Good family’s letters to preserve evidence in Renee’s killing. No outreach, no accountability, and reported talk of investigating her grieving wife instead. That’s how authoritarian systems treat state violence.","2026-02-13T02:37:50.690Z"
"yimabean.bsky.social","EVERYONE can see with own 2 eyes. Sheesh.","2026-02-13T12:56:21.822Z"
"yimabean.bsky.social","A+++ post","2026-02-12T16:47:36.642Z"
"yimabean.bsky.social","Rep. Jared Moskowitz (D-FL): Trump's name appears in the Epstein files more often than Harry Potter's name appears in the Harry Potter series","2026-02-11T19:26:29.779Z"
"yimabean.bsky.social","Trump says his social media video that included racist clip of the Obamas was about election integrity and was """"very strong"""" He says he has NOT fired any aides for the video","2026-02-12T19:09:54.968Z"
"yimabean.bsky.social","BREAKING: Big loss in court for Pete Hegseth and Trump Admin Judge rules in favor of Sen Mark Kelly (D-AZ) and urges Hegseth to “be grateful for the wisdom.. of retired service members” youtube.com/shorts/ADTlR...","2026-02-12T18:56:21.302Z"
"yimabean.bsky.social","Federal judge has ordered Trump administration to facilitate the return of certain Venezuelan migrants who he found were unlawfully deported to a Salvadoran prison under the Alien Enemies Act last year www.cbsnews.com/news/trump-a...","2026-02-13T00:14:13.866Z"
"yimabean.bsky.social","Trump said he was the most qualified person in America to be in charge of public health. bsky.app/profile/fact...","2026-02-12T23:32:34.641Z"
"yimabean.bsky.social","If he's talking, he's lying. bsky.app/profile/atru...","2026-02-12T23:39:43.613Z"
"yimabean.bsky.social","Certainly true.","2026-02-12T23:41:44.407Z"
"yimabean.bsky.social","Hope she feels all of this is worth it. Shame isn’t what it used to be.","2026-02-12T17:48:14.566Z"
"yimabean.bsky.social","Tell ‘em Tim! 😡😡","2026-02-12T17:46:48.417Z"
"yimabean.bsky.social","Ending this operation is not enough. We need justice and accountability. That starts with independent investigations into the murders of Renee Good and Alex Pretti, economic restitution for businesses impacted, abolishing ICE, and the impeachment of Kristi Noem.","2026-02-12T17:07:55.546Z"
"yimabean.bsky.social","under questioning by Rand Paul, ICE officials confirm that yelling at officers is not assault and recording officers is not a crime","2026-02-12T16:47:11.136Z"
"yimabean.bsky.social","She wrote a global history of concentration camps. Now she has a warning for her own country. In a better world, Andrea Pitzer would be delivering this warning on 60 Minutes. But you need to listen to how we can stop these systematic atrocities being committed in our name on Next Comes What.","2026-02-12T17:44:13.240Z"
"yimabean.bsky.social","I really wish we could get a law passed that no company is allowed to offer their exiting executives more than 1% of their current salary.","2026-02-12T03:40:28.606Z"
"yimabean.bsky.social","WATTERS: """"Do I come across as ... [a fascist?]"""" @jessicatarlov.bsky.social: """"Yes!""""","2026-02-12T08:35:06.383Z"
"yimabean.bsky.social","Attorney General Pam Bondi tells a member of a co-equal branch of government during a public hearing: “You don’t tell me anything, you washed-up loser lawyer.” The disdain for our own government is appalling. This administration is destroying our democracy.","2026-02-12T13:11:34.284Z"
"yimabean.bsky.social","and so mind blowingly fast.","2026-02-12T14:06:33.633Z"
