"user","post","date"
"yimabean.bsky.social","It's sad. How does a country with over 300,000,000 people, of which at least a third support the regime, organize a revolution? Does someone send out a memo, a text message? Is someone with experience going to send us an instruction manual? I get that it's up to us, but how?","2026-01-06T13:59:58.139Z"
"yimabean.bsky.social","This is basically how many of our allies see us now . . .","2026-01-06T13:51:23.389Z"
"yimabean.bsky.social","There is no secrecy or privacy any more. It’s all out there. www.wired.com/story/satell...","2026-01-06T14:42:27.981Z"
"yimabean.bsky.social","“The three most important days in American history since the Civil War have been: Dec 7, 1941. Sept. 11. And Jan. 6. We don’t use years for the last two. They aren’t dates on a calendar; they are scar tissue.” Spot on, Rep. Swalwell. Eric hits this one on the nose. www.ms.now/opinion/jan6...","2026-01-06T14:16:57.203Z"
"yimabean.bsky.social","Stephen Miller is a danger to America and to a world longing for peace","2026-01-06T13:47:51.814Z"
"yimabean.bsky.social","Ex-NATO General Michel Yakovleff: “If Trump moves on Greenland, Europeans must be ready to fight the US to defend sovereignty.” """"We must be ready to fight the US if they threaten European interests.""""","2026-01-06T14:19:04.544Z"
"yimabean.bsky.social","Trumpian imperialism in action: kidnap the head of the regime, leaving the rest of it in place so as to access the oil reserves for the US companies. Then realize the oil is actually quite expensive to extract, so go ahead and SUBSIDIZE the oil companies. Perfect. www.nbcnews.com/politics/don...","2026-01-05T23:17:49.247Z"
"yimabean.bsky.social","kind of darkly funny that """"gender studies"""" is the stereotypical """"useless degree"""" because gender studies will help you understand a large and important chunk of the current psychosis in american life","2026-01-06T02:00:25.438Z"
"yimabean.bsky.social","Denmark's PM Mette Frederiksen is clear: if the US attacks a NATO ally, the post-WWII order is over. NATO only works if borders aren't changed by force. Break that rule-and the alliance breaks with it.","2026-01-06T00:01:56.711Z"
"yimabean.bsky.social","Greenland is currently patrolled by a pair of dogsled teams. The Danish lawmaker said that it’s a tough job in some of the bleakest conditions in the world. “Very few U.S. soldiers,” he told us, “would survive a week up there.”","2026-01-06T02:13:25.914Z"
"yimabean.bsky.social","This really isn’t unusual: The government is the largest consumer of open source intel on the planet OSINT analysis is part of every major mission in a connected nation, in both planning and execution phases Robust collection capability is no substitute for eyes on the ground","2026-01-03T22:41:12.549Z"
"yimabean.bsky.social","Trump is already threatening Venezuela’s interim leader, Delcy Rodríguez, saying that “if she doesn’t do what’s right, she is going to pay a very big price, probably bigger than Maduro” Way to pour more gasoline on the fire you started. 🙄","2026-01-04T19:26:18.802Z"
"yimabean.bsky.social","President no new wars is threatening to seize Greenland again. A day after raiding Venezuela and a week after bombing Nigeria. And MAGA is still talking about how he’s the peace president 🤦‍♂️ fucking idiots","2026-01-04T22:28:40.767Z"
"yimabean.bsky.social","This shouldn’t surprise anyone. He also decided to raid Venezuela because Maduro was dancing on TV. He doesn’t make decisions based on the reality on the ground - he makes decisions based on his ego. Always.","2026-01-05T14:11:07.643Z"
"yimabean.bsky.social","Trump makes it clear on Air Force One that Venezuela was about the oil. He also floats more strikes in Venezuela, military action against Cuba and Columbia, and taking Greenland. Completely off the rails.","2026-01-05T16:11:59.283Z"
"yimabean.bsky.social","I compiled some thoughts on Venezuela, and more importantly, the insane rhetoric since the attack. Unlocked for everyone: www.patreon.com/posts/147513...","2026-01-06T01:14:14.574Z"
"yimabean.bsky.social","Pretty wild how fast MAGA went from “no new wars!” to “Invade Venezuela, bomb Iran, bomb Nigeria, destabilize Cuba, attack Colombia, threaten Mexico, and annex Greenland!!”","2026-01-06T01:17:37.520Z"
"yimabean.bsky.social","I can't create new cartoons at the moment because I'm blissfully away in Spain, largely ignoring the news. But, if you need one - just replace a country in these with Venezuela, Cuba or Mexico and you'll get the idea","2026-01-05T13:11:52.922Z"
"yimabean.bsky.social","My friend @charlotteclymer.bsky.social has written about Mark Kelly’s distinguished military career. This is not to be missed. open.substack.com/pub/charlott...","2026-01-06T02:25:46.091Z"
"yimabean.bsky.social","💙💙💙💙😢","2026-01-06T02:29:17.452Z"
"yimabean.bsky.social","💙💙💙💙😢","2026-01-06T02:29:17.452Z"
"yimabean.bsky.social","The administration that hates refugees has just created more of them. Trump is smart that way.","2026-01-05T19:17:25.646Z"
"yimabean.bsky.social","In a lawless administration, reminders to obey the law are rather unwelcome. So Mark Kelly must be punished for not fitting in by obeying the rules.","2026-01-05T19:40:47.830Z"
"yimabean.bsky.social","The Donroe Doctrine","2026-01-05T23:47:14.284Z"
"yimabean.bsky.social","He autographed a Make Iran Great Again hat for Lindsey. MAGA: This is what I voted for!!!","2026-01-05T17:19:14.463Z"
"yimabean.bsky.social","The president against remote work has been at his house in Florida for 3 weeks.","2026-01-05T17:29:54.466Z"
"yimabean.bsky.social","Venezuelan-Americans are being fed a bunch of BS by Republican politicians right now. I'm going to say something I've never said before - if you want the truth about this, then listen to Trump. He's the only Republican being brutally honest about it. bsky.app/profile/atru...","2026-01-05T20:37:52.573Z"
"yimabean.bsky.social","Cassidy is responsible for all the sickness and death that RFK Jr inflicts on the American people.","2026-01-05T21:24:36.628Z"
"yimabean.bsky.social","This can’t be true because Trump said tariffs were going to pay for everything and we were all going to get $2,000 checks with the money left over.","2026-01-05T21:50:36.270Z"
"yimabean.bsky.social","“Quarantine” is what you call a blockade when you’re wearing a tie. www.nytimes.com/2026/01/04/u...","2026-01-05T11:00:48.268Z"
"yimabean.bsky.social","Trump talking about seizing Greenland has MAGA confronting their greatest challenge - geography.","2026-01-05T12:44:32.867Z"
"yimabean.bsky.social","Trump’s rationale for invading Venezuela has had more twists and turns than a telenovela.","2026-01-05T14:29:41.689Z"
"yimabean.bsky.social","America First: We can’t afford healthcare or groceries, but we’re beta-testing imperialism again.","2026-01-05T16:23:56.136Z"
"yimabean.bsky.social","Capitalism works great until it asks you to sleep somewhere else.","2026-01-05T21:58:28.627Z"
"yimabean.bsky.social","I'm old enough to remember the Epstein files.","2026-01-05T22:45:08.861Z"
"yimabean.bsky.social","For """"worst Floridian on the national scene,"""" it's been a contest. Ron DeSantis? Matt Gaetz? Pam Bondi? Eileen Cannon? Jeb """"Recount"""" Bush? Etc *Best* Floridian has been locked up. It's former Gov and Senator, the phenomenal Bob Graham. But now Marco Rubio making daring bid for 'worst' crown.","2026-01-04T19:55:31.925Z"
"yimabean.bsky.social","This is superb, from Sen. Kelly. Please watch. __ Insider note: First sentence of Kelly's presentation is uncannily powerful echo of my favorite TV ad ever. """"Imported from Detroit,"""" 15 yrs ago Serendipity? Embedded memory by Kelly people? Perfect for both. www.youtube.com/watch?v=nNIQ...","2026-01-05T19:54:45.019Z"
"yimabean.bsky.social","Here's something I wrote about Tim Walz before he was seen as VP prospect. After speech that got unprompted standing ovation from 20,000 scientists from around the world He is a formidable, accomplished, genuinely decent, genuinely intelligent and visionary man fallows.substack.com/p/election-c...","2026-01-05T20:45:04.000Z"
"yimabean.bsky.social","yep. i can identify any number of structural issues but at the end of the day the basic problem is the republican party. this has been apparent for at least 20 years. it is also an incredibly unpopular observation to make among “serious” people.","2026-01-04T23:52:26.227Z"
"yimabean.bsky.social","Just to give you a sense of the scale of this, these are the search results for """"@grok string bikini"""" over the last hour.","2026-01-05T20:14:11.994Z"
"yimabean.bsky.social","US Insurrection Day. No mail tomorrow? Peace MBM","2026-01-05T20:34:07.683Z"
"yimabean.bsky.social","Pathetic. As usual.","2026-01-05T13:47:40.464Z"
"yimabean.bsky.social","The new MAGA-coded anchor selected to transform “CBS Evening News” instantly triggered an online backlash after appearing to throw shade at network legend Walter Cronkite.","2026-01-05T11:12:48.635282Z"
"yimabean.bsky.social","🤬 www.npr.org/2026/01/04/n...","2026-01-05T07:48:47.907Z"
"yimabean.bsky.social","🩸🩸🩸 TOMORROW!!!!!🩸🩸🩸 NEVER FORGET JANUARY 6! Instead of honoring our Constitution's key principle of a Peaceful Transfer of Power, POS Donald Trump Abused his Power on Jan 6th by inciting this violent & deadly attack on our country's Capital and should be in prison for life 🩸🩸🩸","2026-01-05T12:50:15.981Z"
"yimabean.bsky.social","Any country out there who wanna come help us with a little police work? Apparently our Congress and Courts are refusing to do it.","2026-01-05T01:36:39.324Z"
"yimabean.bsky.social","Be sure you have a empty mouth🤭🫣😳🙄🤣🤣🤣😉","2026-01-05T13:27:35.680Z"
"yimabean.bsky.social","All of this!","2026-01-04T20:37:57.773Z"
"yimabean.bsky.social","So childish.","2026-01-05T13:27:32.753Z"
"yimabean.bsky.social","Meanwhile, Stephen Miller's wife is posting stuff like this.","2026-01-04T14:02:02.884Z"
"yimabean.bsky.social","Dan Bongino: “I’m going back to my podcast, where I just talk about how incompetent the FBI is.”","2026-01-05T02:08:48.284Z"
"yimabean.bsky.social","1. Where's the report from the Butler hospital where he said he was treated? 2. Where's the scar?","2026-01-04T22:30:00.510Z"
"yimabean.bsky.social","None of Trump's wrongheaded ideas are more wrong than his notion that the people who kiss his ass actually respect him. ICYMI @monacharen.bsky.social: lnk.thebulwark.com/4seItFL","2026-01-04T19:00:47.811Z"
"yimabean.bsky.social","You *can* get special immigration treatment in this administration...as long as you launder Russian propaganda. ICYMI @willsommer.bsky.social:","2026-01-04T23:00:45.519Z"
"yimabean.bsky.social","2/2 And oh, yes, sorry: 1) Should have included the corrupt (as found by court) Rick Scott. www.justice.gov/archive/opa/... 2) Not counting the guy originally from Queens who has become epitome of Florida Man.","2026-01-04T20:21:50.935Z"
"yimabean.bsky.social","If you thought unilaterally bombing Venezuela & abducting its leader & his wife was outrageous, buckle up – Mexico could be the next country that 47 invades. I'd bet real money that he calls Claudia Sheinbaum a """"nasty woman."""" zeteo.com/p/trump-vene...","2026-01-04T21:59:08.070Z"
"yimabean.bsky.social","47's administration is grateful to the media for not leaking. And yet they didn't trust the Senate Armed Services Committee or Intelligence Committee not to leak. Right.","2026-01-04T16:50:34.756Z"
"yimabean.bsky.social","Agree with this whole thread except for taking Trump's words at face value here. This wasn't punishment - it was even more crass, it was a negotiated removal. A collusion with others in Venezuela (who may have played Trump). See thread.","2026-01-04T19:59:53.259Z"
"yimabean.bsky.social","🧐","2026-01-04T22:04:06.541Z"
"yimabean.bsky.social","No war to hide the Epstein files!","2026-01-04T02:06:16.113Z"
"yimabean.bsky.social","""""Americans know nothing about Australia because we haven't any oil."""" — Dame Edna Everage","2026-01-04T20:41:23.339Z"
"yimabean.bsky.social","open.substack.com/pub/wendysie...","2026-01-04T20:37:15.391Z"
"yimabean.bsky.social","""""America is an oil company with an army."""" —George Carlin","2026-01-04T19:21:23.153Z"
"yimabean.bsky.social","This new war is not only illegal, reckless and deeply corrupt, it is the latest in a series of increasingly desperate distractions from the EPSTEIN Files. #ImpeachAndConvict47NOW","2026-01-04T20:35:37.381Z"
"yimabean.bsky.social","The Epstein Files Transparency Act is a law, passed by Congress on November 19 with an overwhelming vote. Complying with it was not optional. The Department of Justice did not comply. I want to make sure this is very clear.","2026-01-04T18:18:19.457Z"
"yimabean.bsky.social","Rubio is just a sad shell of a human being at this point. Looking at slumpy shouldered vacant stare Rubio, I'm going to say that the soul is due at the time of the sale to an antichrist.","2026-01-04T17:21:04.719Z"
"yimabean.bsky.social","www.theguardian.com/us-news/ng-i...","2026-01-04T17:21:47.892Z"
"yimabean.bsky.social","Portland Oregon Today, January 4 Singing Protest","2026-01-04T17:22:25.230Z"
"yimabean.bsky.social","bsky.app/profile/patr.... Elon Musk back in the mix to help rig the elections this year Man this administration is so corrupt and criminal the democrats are literally drowning in investigations one after another overwhelming death threats and this is one thing they must investigate now. Big threat!","2026-01-04T17:22:32.157Z"
"yimabean.bsky.social","Sheesh.","2026-01-04T19:55:00.192Z"
"yimabean.bsky.social","…","2026-01-04T19:52:19.904Z"
"yimabean.bsky.social","Twood be awesome.","2026-01-04T19:36:32.431Z"
"yimabean.bsky.social","Himes: """"I was delighted to hear that Tom Cotton, chairmen of the Senate Intel Committee, has been in regular contact with the admin. I've had zero outreach and no D I'm aware of has. So apparently we're now in a world where the legal obligation to keep Congress informed only applies to your party.""""","2026-01-04T16:45:44.718Z"
"yimabean.bsky.social","Congressional Republicans clearly need to pass an exam on the US Constitution before taking office.","2026-01-04T19:10:33.139Z"
"yimabean.bsky.social","...the oil is for putin...Ukraine has destroyed most of their key petrol production sites. T owes putin big time and is his puppet.","2026-01-04T19:15:09.545Z"
"yimabean.bsky.social","So, this should finally put to rest any delusions that there are decent people left in the US military who will stand up to illegal orders and protect democracy. The US military is now more likely to kill US citizens rather than help them. They are not our friends.","2026-01-03T18:50:48.365Z"
"yimabean.bsky.social","The fact that I don't see an immediate move to impeach Trump or use the 25th amendment is terrifying. The lesson he'll learn is that he can get away with illegal war & regime change. So Greenland, Colombia, Mexico & Panama must prepare IMMEDIATELY. The 4th reich will come for you.","2026-01-04T18:54:11.568Z"
"yimabean.bsky.social","""""Look, your stupid healthcare supplements were just spent invading a sovereign country without provocation and kidnapping its president to distract you from that Epstein problem. You're welcome!""""","2026-01-04T18:28:51.326Z"
"yimabean.bsky.social","QUID: Trump asks US Oil companies to give him $1 billion to retake the White House. PRO QUO: Venezuelan oil.","2026-01-04T18:58:48.055Z"
"yimabean.bsky.social","As punishment for alleged drug dealing, Venezuela will be ruled by a Viceroy whose brother-in-law was a drug dealer who paid for the Viceroy's parents' house with money he made from selling cocaine. Hypocrites make the very best scolds.","2026-01-04T19:05:06.321Z"
"yimabean.bsky.social","🚨 BREAKING News: Death toll from U.S. airstrikes on Venezuela rises to 80, number could rise.- NYT","2026-01-04T18:51:01.458Z"
"yimabean.bsky.social","WELKER: “Are you running Venezuela?” RUBIO: *wOrDS* 🤷🏽‍♂️ GS: “Under what legal authority?” RUBIO: *moRE wOrDs* 🤷🏽‍♂️ GS: “Again: What legal authority?” RUBIO: *EvEn moRE wORdS* 🤷🏽‍♂️","2026-01-04T17:51:48.605Z"
"yimabean.bsky.social","BRENNAN: To be clear, there is no plan for US occupation of this country of nearly 30 million people? MARCO RUBIO: The president always retains optionality on anything and on all of these matters","2026-01-04T15:38:46.161Z"
"yimabean.bsky.social","Vile","2026-01-04T01:20:15.860Z"
"yimabean.bsky.social","Ghoulish distraction from release of Epstein files.","2026-01-04T01:31:35.669Z"
"yimabean.bsky.social","They are firing on all cylinders showing us how out of control & unlawful they are and mocking us to stand up against them as they raid another country’s sovereignty and dare us to do something about it. It was just 3 months ago that Trump posted a meme of dumping feces on American’s.","2026-01-04T02:16:53.243Z"
"yimabean.bsky.social","Despots care not. They want only power, money, and to inflict death and suffering.","2026-01-04T18:28:02.302Z"
"yimabean.bsky.social","It’s a new day in New York City, and Zohran Mamdani is asking a fundamental question that everyone else across the country should also be asking: Who should our government work for?","2026-01-04T17:00:09.664552Z"
"yimabean.bsky.social","""""Invade their countries and seize the oil"""" probably gets said on the patio at Mar-a-Lago on a busy Saturday night once the Cuba Libres have started flowing. It's seeped into the tangerine brain-stem but he doesn't realise that most people wake up in the morning hungover, knowing it was a bad idea.","2026-01-04T13:52:58.005Z"
"yimabean.bsky.social","My #Liz48 plan would still work to remove him. gregolear.substack.com/p/the-liz48-...","2026-01-04T14:18:42.149Z"
"yimabean.bsky.social","""""[I]t’s a plan that would work, under current U.S. law. It’s a way out—a legitimate, Constitutional way out. And if nothing else, it might inspire someone to come up with a better plan."""" This is great Read it:","2026-01-04T14:47:26.527Z"
"yimabean.bsky.social","What Dorothy Thompson once said of Hitler is true of Trump's Secretary of State: he is """"the apotheosis of the Little Man."""" gregolear.substack.com/p/rubio-in-r...","2026-01-04T15:41:14.437Z"
"yimabean.bsky.social","I made this image today and hope it will resonate with many of you. If it does, I would grateful for your comments and encourage you to repost. #resistance #peace #poetry","2026-01-04T01:12:37.284Z"
"yimabean.bsky.social","It's an old and obvious pattern. An unpopular president - failing on the economy and losing his grip on power at home - decides to launch a war for regime change abroad. The American people don’t want to “run” a foreign country while our leaders fail to improve life in this one.","2026-01-03T17:08:38.724Z"
"yimabean.bsky.social","When the news media say the U.S. attack on Venezuela “raises legal questions,“ that’s code for “the president is violating the law, but no one is going to stop him.”","2026-01-04T12:12:24.945Z"
"yimabean.bsky.social","Take solace in the fact that YOU ARE NOT ALONE.","2026-01-04T12:55:16.472Z"
"yimabean.bsky.social","🩸🩸🩸 I'm going to post this video every day so we never forget what the 34x POS convicted felon who incites political violence, adjudicated rapist & pedophile Trump did 🩸🩸🩸","2026-01-04T12:45:20.656Z"
"yimabean.bsky.social","That one person can drag us into a war without consulting or even notifying Congress, or our allies, or fully explaining to the American people why this is necessary, is absolutely bonkers. Reminder that Congress has the power to stop all of this. Where the hell are they?","2026-01-03T20:01:07.928257Z"
"yimabean.bsky.social","The conversation on Threads","2026-01-04T11:11:54.491Z"
"yimabean.bsky.social","Mark Kelly puts out a statement saying """"The President of the United States just overthrew a foreign ruler and explained to the American people that this is about taking control of the oil reserves of a foreign nation."""" This is probably the strongest statement alongside Gallego's I've read.","2026-01-03T18:16:07.630Z"
"yimabean.bsky.social","“Happy new year” speak for yourself","2026-01-04T12:50:55.922Z"
"yimabean.bsky.social","FFS‼️ WE JUST WANT HEALTHCARE AND THE EPSTEIN FILES‼️","2026-01-04T12:50:58.763Z"
"yimabean.bsky.social","When they have finished plundering your country, they will give you back the husk that is left. This was a robbery.","2026-01-04T12:26:27.452Z"
"yimabean.bsky.social","Phase one, kidnap, abduct, snatched, but capture implies a certain legitimacy, as if the person were on the run from law enforcement...","2026-01-04T12:31:59.495Z"
"yimabean.bsky.social","Then they were the only ones surprised.","2026-01-04T12:15:43.211Z"
"yimabean.bsky.social","Putin's original plan for Ukraine was to remove Zelensky and install as leader a Pro-Putin leader/puppet. That is the plan Trump just implemented in Venezuela. Trump is the Putin of the Western Hemisphere.","2026-01-04T12:43:51.867Z"
"yimabean.bsky.social","Run another country? Donald Trump couldn’t run a casino","2026-01-04T01:38:30.248Z"
"yimabean.bsky.social","Swalwell: Putin has an arrest warrant out for his conduct in Ukraine, and Donald Trump certainly is not going and arresting Vladimir Putin and invading that country and saying that we're going to run it without a plan.","2026-01-04T00:45:04.185Z"
"yimabean.bsky.social","If you ever wondered what if felt like to live in Putin’s Russia now you know.","2026-01-04T01:52:14.793Z"
"yimabean.bsky.social","Last night my partner ordered food and the delivery driver texted them before the drop off that he needed more money. Now I just saw a video where a driver was holding this woman's pizza hostage until she gave him cash (she had already paid for the order). Wtaf is going on","2026-01-03T18:35:01.753Z"
"yimabean.bsky.social","Isn't it odd that the United States has enough money to suddenly run Venezuela, but not enough to run our own country? There is always cash in the piggy bank for bombs to kill people, but never for healthcare to keep them alive.","2026-01-04T00:10:00.538Z"
"yimabean.bsky.social","If Putin gets mad enough maybe he’ll show the world the secrets he has on Trump. 🔄","2026-01-03T13:36:13.786Z"
"yimabean.bsky.social","If you are a foreign president who commits crimes overseas, America will come get you, arrest you, and lock you up. But if you are a US president who commits crimes here in the United States, America will give you immunity from prosecution, reelect you, and bribe you with billions of dollars.","2026-01-04T00:26:40.282Z"
"yimabean.bsky.social","It’s time for the world to Boycott, Divest and Sanction the U.S Avoid the Olympics, World Cup and other sporting events. There’s no reason to celebrate the 250 birthday of this fallen nation","2026-01-03T12:36:19.622Z"
"yimabean.bsky.social","'... Is the US still governed by laws and the Constitution? As of this morning we clearly are not.'","2026-01-04T00:32:20.547Z"
"yimabean.bsky.social","Moulton: """"When we had briefings on Venezuela, we asked, 'Are you going to invade the country?' We were told no. 'Do you plan to put troops on the ground?' We were told no. 'Do you intend regime change in VZ?' We were told no. So in a sense, we have been briefed, we've just been completely lied to""""","2026-01-03T18:01:52.815Z"
"yimabean.bsky.social","youtube.com/watch?v=_Nfs...","2026-01-04T00:01:22.342Z"
"yimabean.bsky.social","substack.com/@benmeiselas...","2026-01-04T00:01:33.335Z"
"yimabean.bsky.social","“A dark moment.”","2026-01-03T12:28:29.379Z"
"yimabean.bsky.social","No one has ever earned a derogatory nickname more fully than """"Little Marco.""""","2026-01-03T17:16:18.075Z"
"yimabean.bsky.social","Little Marco: """"It's a country run by incompetent senile men."""" ___ (He's talking about Cuba, but ... )","2026-01-03T17:30:02.325Z"
"yimabean.bsky.social","""""We're going to be taking a lot of wealth out of the ground."""" The American president. Reporters are doing a good job here! Trump is lower than absolute-zero in sanity. Marco, Hegseth, even lower in dignity.","2026-01-03T17:36:20.870Z"
"yimabean.bsky.social","The most disturbing presidential press conference I have ever seen. fallows.substack.com/p/blind-into... (First 3/4ths before paywall.)","2026-01-03T22:21:03.399Z"
"yimabean.bsky.social","Innocent Venezuela civilians capture horrors of being bombed by USA : More proof of why the world calls Amerikkka a Terrorist State! www.reddit.com/r/BlackPeopl...","2026-01-03T19:56:49.651Z"
"yimabean.bsky.social","Hold the fuck on — we just “CAPTURED” another country’s leader?!?","2026-01-03T12:25:54.457Z"
"yimabean.bsky.social","Hey Congress, u up?","2026-01-03T14:13:26.221Z"
"yimabean.bsky.social","There is something almost impressive about how many times Congressional Republicans will punch themselves in the dick to accommodate Donald Trump.","2026-01-03T17:00:16.913Z"
"yimabean.bsky.social","Reposting this. Was listening to Nicole Wallace talking to Joan Baez yesterday. I live in rural England. My almost 92 year old mum is visiting from the US. I have CML. I can’t protest today but I can do the little thing of spreading the word. Am there with you all! #warcrime #Venezuela #protest","2026-01-03T09:35:52.787Z"
"yimabean.bsky.social","This is Pastor Michel Tshimankinda getting detained, brutalized & experiencing #ICELawlessness. They weren't looking for him—they were looking for someone else. They had no warrant, just brute force & if it can happen to him, it could happen to anyone. So talk about it at your holiday celebrations.","2026-01-01T20:25:38.787Z"
